,Date,Original,Corpus,Class
410,8/10/04,economic growth buoyed accommodative monetary policy supportive credit conditions generally well robust underlying growth productivity committee believed conditions place pace expansion strengthen enough continue trim margins slack resource utilization,economic growth buoyed accommodative monetary policy supportive credit condition generally well robust underlie growth productivity committee believe condition place pace expansion strengthen enough continue trim margin slack resource utilization,1
411,8/10/04,indeed limited available evidence pointed rebound household spending especially motor vehicles july early august indicators suggested continued improvement labor market conditions,indeed limited available evidence point rebound household spending especially motor vehicle july early august indicator suggest continued improvement labor market condition,1
412,8/10/04,regarding outlook inflation recent data seen consistent assessment portion higher rates price increases recorded earlier year reflected transitory factors,regard outlook inflation recent data see consistent assessment portion high rate price increase record earlier year reflect transitory factor,1
413,8/10/04,direct effect higher energy prices real disposable income could account relatively small part reduction growth consumer spending members suggested effects may exacerbated substantial increases expected future energy costs well greater uncertainty costs,direct effect high energy price real disposable income could account relatively small part reduction growth consumer spending member suggest effect may exacerbate substantial increase expect future energy cost well great uncertainty cost,-1
416,8/10/04,effects increased energy prices consumer business confidence might led larger spending response not evident consequences growth industrialized countries dependent imported oil appeared fairly modest thus far,effect increase energy price consumer business confidence might lead large spending response not evident consequence growth industrialize country dependent import oil appear fairly modest thus far,-1
417,8/10/04,informed part prices futures markets committee members anticipated energy costs would level perhaps fall back recent highs noted considerable uncertainty outlook,inform part price future market committee member anticipate energy cost would level perhaps fall back recent high note considerable uncertainty outlook,1
418,8/10/04,policymakers focused comments key sectors economy slowdown consumer spending toward end second quarter,policymakers focus comment key sector economy slowdown consumer spending toward end second quarter,-1
419,8/10/04,business contacts parts country suggested that addition higher energy prices unseasonable weather may limited spending time,business contact part country suggest that addition high energy price unseasonable weather may limited spending time,-1
420,8/10/04,although complete accounting moderation growth not possible committee agreed resumption faster growth consumer spending likely,although complete accounting moderation growth not possible committee agree resumption faster growth consumer spending likely,-1
421,8/10/04,investment spending continued advance though perhaps somewhat slower pace members anticipated,investment spending continued advance though perhaps somewhat slow pace member anticipate,-1
422,8/10/04,several policymakers noted businesses remained cautious capital spending hiring attempting boost production much possible existing capacity payrolls,several policymakers note business remain cautious capital spending hire attempt boost production much possible exist capacity payroll,-1
423,8/10/04,nonetheless business confidence generally remained high fundamentals investment including solid growth productivity robust profits cash flow accommodative financial markets pointed continued healthy gains business outlays,nonetheless business confidence generally remain high fundamental investment including solid growth productivity robust profit cash flow accommodative financial markets pointed continued healthy gain business outlay,1
424,8/10/04,discussion recent labor market trends committee members noted slowing job growth reported june july,discussion recent labor market trend committee member note slow job growth report june july,-1
426,8/10/04,however policymakers noted monthly payrolls data might providing incomplete picture expansion economic activity nearterm variation rate growth productivity,however policymakers note monthly payroll data might provide incomplete picture expansion economic activity nearterm variation rate growth productivity,-1
427,8/10/04,addition many members pointed data survey households showed rise labor force participation decline unemployment rate july well initial claims unemployment compensation remained near recent lows,addition many member point data survey household show rise labor force participation decline unemployment rate july well initial claim unemployment compensation remain near recent low,-1
428,8/10/04,moreover survey data labor market attitudes consumers businesses not signaled significant deterioration employment prospects,moreover survey data labor market attitude consumer business not signal significant deterioration employment prospect,-1
429,8/10/04,things considered committee expected pace employment gains improve coming months,thing consider committee expect pace employment gain improve come month,1
430,8/10/04,review outlook prices members noted incoming data intermeeting period shown slowing core inflation high levels posted earlier year consistent committees view portion earlier increase reflected transitory factors,review outlook price member note incoming data intermeeting period show slow core inflation high level post earlier year consistent committee view portion earlier increase reflect transitory factor,-1
431,8/10/04,members expressed concern developments transportation sector trucking costs reportedly rise bottlenecks railroad industry triggering delivery delays,member express concern development transportation sector trucking cost reportedly rise bottleneck railroad industry trigger delivery delay,-1
432,8/10/04,looking forward however members thought rapid productivity growth flat declining energy prices would limit increases overall unit costs businesses,look forward however member thought rapid productivity growth flat decline energy price would limit increase overall unit cost business,-1
433,8/10/04,despite higher rates headline inflation earlier year longer term inflation expectations remained well contained slack resource markets seen persisting leading committee expect underlying inflation relatively low,despite high rate headline inflation earlier year longer term inflation expectation remain well contain slack resource market see persist lead committee expect underlie inflation relatively low,-1
434,8/10/04,although pace economic growth moderated second quarter committee believed softness would prove shortlived economy poised resume stronger rate expansion going forward,although pace economic growth moderate second quarter committee believe softness would prove shortlived economy poise resume strong rate expansion go forward,-1
435,8/10/04,given current quite low level shortterm rates especially judged recent level inflation members noted significant cumulative policy tightening likely would needed foster conditions consistent committees objectives price stability sustainable economic growth,give current quite low level shortterm rate especially judged recent level inflation member note significant cumulative policy tighten likely would need foster condition consistent committee objective price stability sustainable economic growth,-1
436,8/10/04,members thought policy accommodation probably could removed gradually a view reinforced slower pace growth moderate rates price increase become evident intermeeting period,member thought policy accommodation probably could remove gradually a view reinforce slow pace growth moderate rate price increase become evident intermeeting period,-1
437,8/10/04,however members also recognized timing pace additional policy tightening would depend importantly incoming economic data committees assessment implications economic activity inflation,however member also recognize timing pace additional policy tighten would depend importantly incoming economic data committee assessment implication economic activity inflation,-1
438,8/10/04,regard committees announcement released meeting members agreed description recent economic circumstances acknowledge slowing output employment growth well highlight role higher energy prices developments,regard committee announcement release meeting member agree description recent economic circumstance acknowledge slow output employment growth well highlight role high energy price development,-1
440,8/10/04,underlying inflation still expected relatively low committee believes policy accommodation removed pace likely measured,underlie inflation still expect relatively low committee believe policy accommodation remove pace likely measure,1
441,14/12/04,information received meeting suggested economy expanded moderate pace third quarter current quarter,information receive meeting suggest economy expand moderate pace third quarter current quarter,1
442,14/12/04,consumer spending solid investment spending remained strong,consumer spending solid investment spending remain strong,1
443,14/12/04,manufacturing production increased modest pace employment gains october november indicated labor market continued improve gradually,manufacturing production increase modest pace employment gain october november indicate labor market continued improve gradually,1
445,14/12/04,consumer spending appeared expanding moderate pace fourth quarter growing robust rate third quarter,consumer spending appear expand moderate pace fourth quarter grow robust rate third quarter,1
446,14/12/04,although sales motor vehicles declined november spending goods rose large increase posted october,although sale motor vehicle decline november spending good rise large increase post october,-1
447,14/12/04,spending services continued register solid gains,spending service continued register solid gain,1
448,14/12/04,real disposable income restrained sharply higher energy prices rose slightly,real disposable income restrain sharply high energy price rise slightly,1
449,14/12/04,consumer prices jumped october hurricane damage contributed higher prices food energy,consumer price jumped october hurricane damage contribute high price food energy,1
450,14/12/04,twelve months ending october consumer prices rose considerably faster year earlier period,twelve month end october consumer price rise considerably faster year earlier period,1
451,14/12/04,core consumer prices increased much modestly october overall consumer prices although twelve month change core prices also somewhat higher year before,core consumer price increase much modestly october overall consumer price although twelve month change core price also somewhat high year before,1
452,14/12/04,employment cost index private compensation advanced moderately year ending third quarter markup prices labor costs remained somewhat elevated,employment cost index private compensation advanced moderately year end third quarter markup price labor cost remain somewhat elevate,1
453,14/12/04,committee noted expectation underlying rate inflation would continue low policy accommodation could removed pace likely measured also stated would nonetheless respond changes economic prospects needed fulfill obligation maintain price stability,committee note expectation underlie rate inflation would continue low policy accommodation could remove pace likely measure also state would nonetheless respond change economic prospect need fulfill obligation maintain price stability,1
455,14/12/04,consistent readings futures markets oil prices anticipated edge lower,consistent reading future market oil price anticipate edge low,-1
456,14/12/04,economic activity projected expand pace little longerrun potential coming year hiring projected continue firm causing unemployment rate edge next year,economic activity project expand pace little longerrun potential come year hire project continue firm cause unemployment rate edge next year,-1
457,14/12/04,steep run up housing prices recent increases equity prices anticipated gains payrolls viewed likely boost growth consumption spending next year pace somewhat recorded year,steep run up housing price recent increase equity price anticipate gain payroll view likely boost growth consumption spending next year pace somewhat record year,1
459,14/12/04,measures total consumer price inflation expected decline current levels reflecting direct effect downturn energy prices,measure total consumer price inflation expect decline current level reflect direct effect downturn energy price,-1
460,14/12/04,contrast core inflation seen staff forecast remaining stable,contrast core inflation see staff forecast remain stable,1
461,14/12/04,upward pressure inflation slight stepdown structural productivity growth narrowing margin resource slack expected counter balanced diminishing pressure pass through earlier rise energy prices decline dollar,upward pressure inflation slight stepdown structural productivity growth narrow margin resource slack expect counter balance diminish pressure pass through earlier rise energy price decline dollar,1
462,14/12/04,although november employment report disappointing viewed several months labor market conditions generally seen gradually improving,although november employment report disappoint view several month labor market condition generally see gradually improve,1
463,14/12/04,improvement expected persist and along higher wealth relatively low interest rates would support gains spending households,improvement expect persist and along high wealth relatively low interest rate would support gain spending household,1
464,14/12/04,rising demand elevated underlying productivity growth accommodative financial conditions keep business spending strong uptrend,rise demand elevate underlie productivity growth accommodative financial condition keep business spending strong uptrend,1
465,14/12/04,economic slack persisting longer term inflation expectations well anchored inflation anticipated remain subdued,economic slack persist longer term inflation expectation well anchored inflation anticipate remain subdue,-1
466,14/12/04,continued gains employment thought likely provide additional support spending bolstering consumer confidence income,continued gain employment thought likely provide additional support spending bolster consumer confidence income,1
467,14/12/04,moreover intermediate longterm interest rates remained low nominal real terms despite recent firming stance policy encouraging spending consumer durables housing,moreover intermediate longterm interest rate remain low nominal real term despite recent firm stance policy encourage spending consumer durables housing,-1
468,14/12/04,many fundamentals underlying demand capital goods expanding output low cost capital strong profits ample liquid assets appeared quite favorable participants generally upbeat assessment prospects investment,many fundamental underlie demand capital goods expanding output low cost capital strong profit ample liquid assets appeared quite favorable participant generally upbeat assessment prospect investment,1
469,14/12/04,participants noted business contacts seemed confident future sense caution previously evident business spending hiring behavior seemed waning others believed many businesses remained quite wary,participant note business contact seem confident future sense caution previously evident business spending hire behavior seem wan others believe many business remain quite wary,1
470,14/12/04,participants acknowledged significant uncertainties outlook including effects expiration partialexpensing provision investment end  recent indications softening hightech spending united states elsewhere,participant acknowledge significant uncertainty outlook include effect expiration partialexpensing provision investment end recent indication soften hightech spending united state elsewhere,-1
472,14/12/04,discussion outlook prices number participants cited developments could pose upside inflation risks,discussion outlook price number participant cite development could pose upside inflation risk,1
474,14/12/04,pass through sources limited still potential source upward pressure prices could get embedded higher inflation certain circumstances,pass through source limited still potential source upward pressure price could get embed high inflation certain circumstance,1
475,14/12/04,increase last months five year measures inflation compensation derived treasury nominal inflation indexed securities might warning sign expectations not well anchored summer,increase last month five year measure inflation compensation derive treasury nominal inflation indexed security might warn sign expectation not well anchor summer,-1
476,14/12/04,depreciation dollar recent months notable participants found persuasive evidence recent studies pointing decline time across countries passthrough exchange rate movements domestic prices,depreciation dollar recent month notable participant found persuasive evidence recent study point decline time across country passthrough exchange rate movement domestic price,-1
478,14/12/04,regard committees announcement released meeting members generally agreed overall economic prospects similar prevailing time november meeting consequently statement altered minor extent required reflect recent economic developments,regard committee announcement release meeting member generally agree overall economic prospect similar prevail time november meeting consequently statement alter minor extent require reflect recent economic development,1
480,14/12/04,the federal open market committee seeks monetary financial conditions foster price stability promote sustainable growth output,the federal open market committee seek monetary financial condition foster price stability promote sustainable growth output,1
482,11/1/05,information reviewed meeting suggested economy good deal forward momentum third quarter,information review meeting suggest economy good deal forward momentum third quarter,1
484,11/1/05,despite large increase consumer energy prices since midyear core price inflation restrained september,despite large increase consumer energy price since midyear core price inflation restrain september,-1
485,11/1/05,spot prices natural gas soared hurricanes remained elevated levels,spot price natural gas soar hurricane remain elevate level,1
486,11/1/05,average selling price existing homes rose twelve months ending september rapid clip year earlier average selling price new homes rose slowly past months,average sell price exist home rise twelve month end september rapid clip year earlier average sell price new home rise slowly past month,1
487,11/1/05,surveys executive sentiment squared well fundamentals although business leaders expressed misgivings overall macroeconomic environment stated capital spending intentions pointed increasing investment,survey executive sentiment square well fundamental although business leader express misgiving overall macroeconomic environment state capital spending intention point increase investment,1
488,11/1/05,vacancy rates non residential properties continued edge lower remained elevated office industrial properties real spending new construction yet improve materially,vacancy rate non residential property continued edge low remain elevate office industrial property real spending new construction yet improve materially,-1
489,11/1/05,gdp growth foreign industrial economies appeared continued moderate pace third quarter,gdp growth foreign industrial economy appear continued moderate pace third quarter,1
490,11/1/05,soaring energy prices boosted overall measures consumer price inflation recent months,soar energy price boost overall measure consumer price inflation recent month,1
491,11/1/05,however measures core consumer price inflation much restrained,however measure core consumer price inflation much restrain,-1
492,11/1/05,one survey households october found expectations inflation coming year rose level well readings prevailed spring summer presumably response rising energy prices,one survey household october found expectation inflation come year rise level well reading prevail spring summer presumably response rise energy price,1
493,11/1/05,committee noted widespread devastation gulf region hurricane katrina associated dislocation economic activity boost energy prices would set back spending production employment near term,committee note widespread devastation gulf region hurricane katrina associate dislocation economic activity boost energy price would set back spending production employment near term,-1
494,11/1/05,however committee judged unfortunate developments not pose persistent threat overall economy,however committee judged unfortunate development not pose persistent threat overall economy,-1
495,11/1/05,rather monetary policy accommodation coupled robust underlying growth productivity providing ongoing support economic activity,rather monetary policy accommodation couple robust underlie growth productivity provide ongoing support economic activity,1
496,11/1/05,although higher energy costs potential add inflation pressure core inflation relatively low preceding months longer term inflation expectations remained contained,although high energy cost potential add inflation pressure core inflation relatively low precede month longer term inflation expectation remain contain,-1
497,11/1/05,circumstances committee believed policy accommodation could removed pace would likely measured noted would respond changes economic prospects needed fulfill obligation maintain price stability,circumstance committee believe policy accommodation could remove pace would likely measure note would respond change economic prospect need fulfill obligation maintain price stability,1
498,11/1/05,however expected path monetary policy shifted subsequent weeks incoming data indicated output expanding briskly prior hurricanes disruptions economic activity hurricanes likely less severe initially feared,however expect path monetary policy shift subsequent week incoming data indicate output expand briskly prior hurricane disruption economic activity hurricane likely less severe initially fear,-1
499,11/1/05,upward pressure interest rates may amplified comments number federal reserve officials read stressing inflation concerns,upward pressure interest rate may amplify comment number federal reserve official read stress inflation concern,1
501,11/1/05,despite large increase overall consumer price index september measures inflation compensation calculated using yields nominal inflation protected treasury securities unchanged intermeeting period although remained bit levels seen hurricane katrina,despite large increase overall consumer price index september measure inflation compensation calculate use yield nominal inflation protected treasury security unchanged intermeeting period although remain bit level see hurricane katrina,1
502,11/1/05,major stock price indexes fell moderately tradeweighted foreign exchange value dollar appreciated slightly intermeeting period,major stock price index fell moderately tradeweighted foreign exchange value dollar appreciate slightly intermeeting period,-1
503,11/1/05,growth household debt estimated edged third quarter slowing mortgage debt growth remained elevated,growth household debt estimate edge third quarter slow mortgage debt growth remain elevate,-1
504,11/1/05,growth nominal output third quarter exceeded m implying rise velocity,growth nominal output third quarter exceed m imply rise velocity,-1
505,11/1/05,output growth expected pick  boost hurricanerelated rebuilding activity offset effects somewhat tighter financial conditions slow  impetus rebuilding waned,output growth expect pick boost hurricanerelated rebuild activity offset effect somewhat tighter financial condition slow impetus rebuild wan,-1
506,11/1/05,nearterm forecast entailed marked downshift headline inflation energy prices fall back consistent readings futures markets,nearterm forecast entail marked downshift headline inflation energy price fall back consistent reading future market,-1
507,11/1/05,favorable incoming data led staff reduce forecast nearterm core inflation bit,favorable incoming data lead staff reduce forecast nearterm core inflation bit,-1
508,11/1/05,discussion economic situation outlook meeting participants saw economy continuing grow solid pace notwithstanding disruptive effects economic activity employment hurricanes,discussion economic situation outlook meeting participant saw economy continue grow solid pace notwithstanding disruptive effect economic activity employment hurricane,-1
511,11/1/05,household sector spending seemed held fairly well aside drop purchases autos,household sector spending seem held fairly well aside drop purchase auto,1
512,11/1/05,moreover construction spending commercial real estate investment seemed picking areas,moreover construction spending commercial real estate investment seem pick area,-1
513,11/1/05,rise longer term real interest rates widening private credit spreads recent months seen perhaps little restraining effect investment outlook,rise longer term real interest rate widen private credit spread recent month see perhaps little restrain effect investment outlook,-1
