,Date,Original,Corpus,Class
207,28/10/03,factors cited likely encourage robust sustained economic growth included substantial fiscal monetary policy stimulus accommodative financial conditions indications strengthening foreign economies much improved business earnings cash flows favorable implications strongly rising productivity business investment worker earnings,factor cite likely encourage robust sustain economic growth include substantial fiscal monetary policy stimulus accommodative financial condition indication strengthen foreign economy much improve business earnings cash flow favorable implication strongly rise productivity business investment worker earnings,1
208,28/10/03,members nonetheless saw factors could restrain degree vigor household business spending present downside risks forecasts,member nonetheless saw factor could restrain degree vigor household business spending present downside risk forecast,-1
209,28/10/03,among negatives mentioned stillcautious business attitudes continued inhibit hiring investment decisions potentially adverse effect household confidence appreciable gains employment fail materialize waning impetus time tax reductions taken effect year,among negative mention stillcautious business attitude continued inhibit hire investment decision potentially adverse effect household confidence appreciable gain employment fail materialize wan impetus time tax reduction take effect year,-1
210,28/10/03,contrast usual experience economic recoveries recent decades expansion appeared gathering momentum time key measures inflation suggested price stability essentially achieved,contrast usual experience economic recovery recent decade expansion appear gathering momentum time key measure inflation suggest price stability essentially achieve,1
211,28/10/03,looking ahead members generally anticipated economic performance line expectations would not entirely eliminate currently large margins unemployed labor resources perhaps latter part  even later,look ahead member generally anticipate economic performance line expectation would not entirely eliminate currently large margin unemployed labor resource perhaps latter part even later,1
212,28/10/03,accordingly given presumed persistence strong worldwide competition significant inflationary pressures not seen likely,accordingly give presume persistence strong worldwide competition significant inflationary pressure not see likely,1
213,28/10/03,moreover labor demand begun show signs stabilizing extended period weakness,moreover labor demand begin show sign stabilize extend period weakness,1
214,28/10/03,however extent recently positive labor market developments might harbingers substantial employment gains unclear point given evidently continuing business efforts respond growing demand improving productivity rather hiring new workers,however extent recently positive labor market development might harbinger substantial employment gain unclear point give evidently continue business effort respond grow demand improve productivity rather hire new worker,1
215,28/10/03,members nonetheless expressed optimism regarding prospects substantial employment gains business firms persuaded major uptrend final sales firmly established,member nonetheless express optimism regard prospect substantial employment gain business firm persuade major uptrend final sale firmly establish,1
216,28/10/03,true extended period household spending continued mainstay recent months sluggish economic recovery,true extend period household spending continued mainstay recent month sluggish economic recovery,-1
217,28/10/03,personal consumption expenditures posted quarterly increases throughout recent period limited economic growth,personal consumption expenditure post quarterly increase throughout recent period limited economic growth,1
218,28/10/03,encouraging side according number reports retailers optimistic outlook sales holiday period economy generally,encourage side accord number report retailer optimistic outlook sale holiday period economy generally,-1
219,28/10/03,however members expressed concern unless recent improvement labor market conditions sustained could adverse repercussions consumer attitudes spending,however member express concern unless recent improvement labor market condition sustain could adverse repercussion consumer attitude spending,-1
220,28/10/03,members mentioned concerns part business contacts regarding adverse economic implications large deficits economy longer term,member mention concern part business contact regard adverse economic implication large deficit economy longer term,-1
221,28/10/03,comments external sector economy members referred indications strengthening economic activity abroad conjunction weaker dollar fostering improvement exports,comment external sector economy member refer indication strengthen economic activity abroad conjunction weaker dollar foster improvement export,-1
222,28/10/03,review outlook inflation members emphasized prospects persisting slack labor resources combination substantial increases productivity likely hold inflation low levels next year two,review outlook inflation member emphasize prospect persist slack labor resource combination substantial increase productivity likely hold inflation low level next year two,-1
223,28/10/03,indeed many saw modest disinflation likely least year ahead though also agreed probability substantial worrisome disinflation become increasingly remote light recent strengthening economic activity,indeed many saw modest disinflation likely least year ahead though also agree probability substantial worrisome disinflation become increasingly remote light recent strengthen economic activity,-1
224,28/10/03,members also cited weakness dollar factor would tend reduce degree domestic disinflation,member also cite weakness dollar factor would tend reduce degree domestic disinflation,-1
225,28/10/03,members emphasized outlook inflation clouded high degree uncertainty underlying trend productivity,member emphasize outlook inflation cloud high degree uncertainty underlie trend productivity,1
226,28/10/03,growth productivity could remain higher earlier anticipated damping employment labor costs price pressures,growth productivity could remain high earlier anticipate damp employment labor cost price pressure,1
227,28/10/03,balance members not view changes inflation either direction likely generate significant policy concerns forecast horizon,balance member not view change inflation either direction likely generate significant policy concern forecast horizon,1
228,28/10/03,members referred contrast current policy expectations typical experience earlier cyclical upturns felt policy adjustments needed made quite promptly gain greater assurance inflation would not rise already relatively elevated levels,member refer contrast current policy expectation typical experience earlier cyclical upturn felt policy adjustment need make quite promptly gain great assurance inflation would not rise already relatively elevate level,1
229,28/10/03,present circumstances degree slack resources rate inflation essentially consistent price stability suggested committee could wait definitive signs economic expansion would otherwise generate inflationary pressures making significant adjustment current policy stance,present circumstance degree slack resource rate inflation essentially consistent price stability suggest committee could wait definitive sign economic expansion would otherwise generate inflationary pressure make significant adjustment current policy stance,1
231,28/10/03,meeting members agreed risks goal sustainable economic growth roughly balanced next quarters probability unwelcome fall inflation though minor exceeded rise inflation currently low level,meeting member agree risk goal sustainable economic growth roughly balance next quarter probability unwelcome fall inflation though minor exceed rise inflation currently low level,-1
232,28/10/03,balance risk undesirably low inflation likely remain committees predominant concern foreseeable future,balance risk undesirably low inflation likely remain committee predominant concern foreseeable future,1
233,28/10/03,risks committees outlook sustainable economic growth next several quarters balanced risks outlook inflation next several quarters weighted toward downside and taken together balance risks objectives weighted toward downside foreseeable future,risk committee outlook sustainable economic growth next several quarter balance risk outlook inflation next several quarter weight toward downside and take together balance risk objective weight toward downside foreseeable future,-1
234,8/12/03,labor market remained weak industrial production improved slightly,labor market remain weak industrial production improve slightly,-1
235,8/12/03,consumer spending however advanced further brisk growth expenditures autos durables modest expansion categories,consumer spending however advanced far brisk growth expenditure auto durables modest expansion category,-1
236,8/12/03,homebuilding continued robust rate business spending improved somewhat federal government expenditures remained elevated gains partially offset fiscal restraint state local government levels,homebuilding continued robust rate business spending improve somewhat federal government expenditure remain elevate gain partially offset fiscal restraint state local government level,-1
237,8/12/03,despite recent uptick consumer prices yearoveryear consumer inflation remained low level,despite recent uptick consumer price yearoveryear consumer inflation remain low level,-1
238,8/12/03,data orders shipments nondefense capital goods june pointed growth nearly categories,data order shipment nondefense capital good june point growth nearly category,-1
239,8/12/03,recent data generally indicated growth foreign industrial countries weak second quarter,recent data generally indicate growth foreign industrial country weak second quarter,-1
240,8/12/03,gdp growth united kingdom showed moderate rebound second quarter,gdp growth united kingdom show moderate rebound second quarter,1
242,8/12/03,twelvemonth period ending june increase core consumer prices measured consumer price index chaintype personal consumption expenditure index notably lower rise previous year,twelvemonth period end june increase core consumer price measure consumer price index chaintype personal consumption expenditure index notably low rise previous year,1
243,8/12/03,higher energy costs pushed producer price index june core producer prices ticked month leaving slightly levels twelve months prior,high energy cost push producer price index june core producer price ticked month leave slightly level twelve month prior,1
244,8/12/03,employment cost index hourly compensation private industry workers rose less second quarter first quarter,employment cost index hourly compensation private industry worker rise less second quarter first quarter,-1
246,8/12/03,balance committee believed concern appreciable disinflation likely predominate foreseeable future,balance committee believe concern appreciable disinflation likely predominate foreseeable future,-1
248,8/12/03,despite sharp stepup treasury yields broad equity indexes advanced intermeeting period supported positive earning reports strong profit forecasts increased confidence regarding economic prospects,despite sharp stepup treasury yield broad equity index advanced intermeeting period support positive earn report strong profit forecast increase confidence regard economic prospect,1
249,8/12/03,staff forecast prepared meeting continued suggest economic expansion would strengthen substantially year progressed,staff forecast prepared meeting continued suggest economic expansion would strengthen substantially year progress,1
250,8/12/03,accommodative financial conditions recent additional fiscal stimulus robust gains structural productivity would provide significant impetus business consumer spending months ahead,accommodative financial condition recent additional fiscal stimulus robust gain structural productivity would provide significant impetus business consumer spending month ahead,1
251,8/12/03,consequence improving sales profits low financing costs temporary federal tax incentive investment new equipment software expected boost business investment spending gradually,consequence improve sale profit low financing cost temporary federal tax incentive investment new equipment software expect boost business investment spending gradually,1
253,8/12/03,view developments context stimulative fiscal monetary policies receptive financial conditions apparently improving business consumer confidence brightened prospects substantial strengthening economy,view development context stimulative fiscal monetary policy receptive financial condition apparently improve business consumer confidence brighten prospect substantial strengthen economy,1
254,8/12/03,concerning prospects inflation members expressed view even growth somewhat economys potential materialize next several quarters many regarded likely scenario substantial excess margins labor resources would remain would continue hold overall inflation,concern prospect inflation member express view even growth somewhat economy potential materialize next several quarter many regard likely scenario substantial excess margin labor resource would remain would continue hold overall inflation,1
256,8/12/03,included possibility higher rates part reflected growing optimism economic outlook would engender faster pace business spending offsetting effects higher rates consumer spending,include possibility high rate part reflect grow optimism economic outlook would engender faster pace business spending offset effect high rate consumer spending,1
257,8/12/03,moreover longterm interest rates still relatively low risk spreads narrowed recent months stock prices held firm recently perhaps part result several upside surprises secondquarter profit reports,moreover longterm interest rate still relatively low risk spread narrow recent month stock price held firm recently perhaps part result several upside surprise secondquarter profit report,1
258,8/12/03,looking ahead much would depend growth demand business products services associated evidence rising profits building indications strengthening recent months,look ahead much would depend growth demand business product service associate evidence rise profit building indication strengthen recent month,1
259,8/12/03,now survey anecdotal reports business capital spending intentions somewhat encouraging earlier still generally mixed small number firms planning robust capital spending programs,now survey anecdotal report business capital spending intention somewhat encourage earlier still generally mixed small number firm planning robust capital spending program,1
260,8/12/03,indeed light persistence substantial margins underutilized capital many business contacts indicated intended meet growing demand adding staff increasing output capacity,indeed light persistence substantial margin underutilized capital many business contact indicate intend meet grow demand add staff increase output capacity,1
262,8/12/03,consumer spending buttressed sales motor vehicles consumer durables accelerated second quarter already elevated level appeared recently increasing considerably further,consumer spending buttress sale motor vehicle consumer durables accelerate second quarter already elevate level appear recently increase considerably far,1
263,8/12/03,positive factors mentioned regard outlook consumer sector included recent tax cuts improved performance stock market ample availability household credit generally effects rapidly rising productivity sustaining growth household incomes,positive factor mention regard outlook consumer sector include recent tax cut improve performance stock market ample availability household credit generally effect rapidly rise productivity sustain growth household income,1
265,8/12/03,review outlook prices members generally anticipated key inflation measures would remain near currently low levels extended period,review outlook price member generally anticipate key inflation measure would remain near currently low level extend period,-1
266,8/12/03,indeed number members expressed view disinflation probable year ahead,indeed number member express view disinflation probable year ahead,1
268,8/12/03,time persistence strong competitive pressures including arising foreign competitors preventing business firms passing higher costs raising prices lack pricing power not appear diminishing,time persistence strong competitive pressure include arise foreign competitor prevent business firm passing high cost raise price lack pricing power not appear diminish,1
269,8/12/03,concurrently however many firms able maintain even increase profit margins variety cost cutting productivity enhancing measures,concurrently however many firm able maintain even increase profit margin variety cost cutting productivity enhancing measure,1
270,8/12/03,members noted current stance monetary policy remained quite accommodative and given tenor latest information performance economy context generally favorable financial conditions believed policy appropriately positioned foster strengthening economic expansion,member note current stance monetary policy remain quite accommodative and give tenor late information performance economy context generally favorable financial condition believe policy appropriately position foster strengthen economic expansion,1
271,8/12/03,committee could not commit particular policy course time many members referred likelihood committee would want keep policy accommodative longer period practice past periods accelerating economic activity,committee could not commit particular policy course time many member refer likelihood committee would want keep policy accommodative longer period practice past period accelerate economic activity,1
273,8/12/03,time maintaining accommodative policy stance seen involving little risk inducing rising inflation long high levels excess capacity competitive markets continued characterize economic conditions,time maintain accommodative policy stance see involve little risk induce rise inflation long high level excess capacity competitive market continued characterize economic condition,-1
274,8/12/03,particular risks goal sustainable economic growth balanced next quarters probability unwelcome fall inflation though minor exceeded rise inflation currently low level,particular risk goal sustainable economic growth balance next quarter probability unwelcome fall inflation though minor exceed rise inflation currently low level,-1
275,8/12/03,balance risk undesirably low inflation likely committees predominant concern foreseeable future,balance risk undesirably low inflation likely committee predominant concern foreseeable future,-1
276,8/12/03,federal open market committee seeks monetary financial conditions foster price stability promote sustainable growth output,federal open market committee seek monetary financial condition foster price stability promote sustainable growth output,1
277,8/12/03,risks committees outlook sustainable economic growth next several quarters balanced risks outlook inflation next several quarters weighted toward downside and taken together balance risks objectives weighted toward downside foreseeable future,risk committee outlook sustainable economic growth next several quarter balance risk outlook inflation next several quarter weight toward downside and take together balance risk objective weight toward downside foreseeable future,-1
278,16/3/04,information reviewed meeting suggested economic activity continued expand solid pace early ,information review meeting suggest economic activity continued expand solid pace early,1
279,16/3/04,consumer spending growth appeared picked somewhat activity housing market remained high levels,consumer spending growth appear picked somewhat activity housing market remain high level,1
280,16/3/04,business sector spending equipment software apparently advancing vigorously firms adding modestly inventories,business sector spending equipment software apparently advance vigorously firm add modestly inventory,1
281,16/3/04,core consumer price inflation remained low expectations future inflation continued subdued,core consumer price inflation remain low expectation future inflation continued subdue,-1
282,16/3/04,january february employment reports depicted labor market slow pick momentum,january february employment report depict labor market slow pick momentum,-1
283,16/3/04,employment manufacturing sector fallen continually three years essentially unchanged february employment sectors showed mixed changes,employment manufacturing sector fall continually three year essentially unchanged february employment sector show mixed change,-1
284,16/3/04,retail sales rose briskly average january february spending services january the recent month data available,retail sale rise briskly average january february spending service january the recent month data available,1
285,16/3/04,overall expenditures supported sizable gains real disposable personal income increases household wealth owing rising home equity prices,overall expenditure support sizable gain real disposable personal income increase household wealth owe rise home equity price,1
286,16/3/04,home prices continued rise briskly,home price continued rise briskly,1
287,16/3/04,case time real spending private nonresidential structures languished vacancies industrial buildings office properties high levels,case time real spending private nonresidential structure languish vacancy industrial building office property high level,-1
288,16/3/04,core consumer price inflation stayed low early ,core consumer price inflation stayed low early,-1
289,16/3/04,committee also retained assessment upside downside risks attainment sustainable growth roughly equal well judgment probability unwelcome fall inflation diminished almost equal rise inflation,committee also retain assessment upside downside risk attainment sustainable growth roughly equal well judgment probability unwelcome fall inflation diminish almost equal rise inflation,-1
290,16/3/04,inflation low resource use slack committee saw no need tightening policy near future,inflation low resource use slack committee saw no need tighten policy near future,-1
291,16/3/04,however provide additional flexibility adjust monetary policy later date action deemed appropriate given economic developments committee removed postmeeting statement explicit reference considerable period substituted statement conveyed sense could patient removing policy accommodation,however provide additional flexibility adjust monetary policy later date action deem appropriate give economic development committee remove postmeeting statement explicit reference considerable period substitute statement conveyed sense could patient remove policy accommodation,-1
292,16/3/04,balance intermeeting period however chairmans testimony monetary policy data nonfarm payroll employment weakish cast persuaded investors policy tightening still ways off,balance intermeeting period however chairman testimony monetary policy data nonfarm payroll employment weakish cast persuade investor policy tighten still way off,-1
293,16/3/04,yields inflation indexed securities also fell leaving measures inflation compensation little changed,yield inflation indexed security also fell leave measure inflation compensation little change,-1
294,16/3/04,yields investment grade bonds generally moved tandem treasuries intermeeting period spreads high yield bonds widened investors reassessed credit risks light negative tone incoming economic data,yield investment grade bond generally move tandem treasury intermeeting period spread high yield bond widen investor reassess credit risk light negative tone incoming economic data,-1
295,16/3/04,disappointing employment data renewed concerns terrorism contributed decline broad equity price indexes,disappoint employment data renew concern terrorism contribute decline broad equity price index,-1
296,16/3/04,effects mortgage refinancing depressed growth second half last year appeared wane allowing expansion nominal income show growth,effect mortgage refinance depressed growth second half last year appear wane allow expansion nominal income show growth,-1
297,16/3/04,staff forecast prepared meeting indicated economic activity would continue expand solid pace ,staff forecast prepared meeting indicate economic activity would continue expand solid pace,1
298,16/3/04,monetary policy expected support growth projection period fiscal policy anticipated remain accommodative ,monetary policy expect support growth projection period fiscal policy anticipate remain accommodative,1
299,16/3/04,addition structural productivity growth projected remain substantial year next,addition structural productivity growth project remain substantial year next,-1
300,16/3/04,strong advances real disposable income expected keep consumer spending solid upward trajectory,strong advance real disposable income expect keep consumer spending solid upward trajectory,1
301,16/3/04,core inflation projected remain low forecast period,core inflation project remain low forecast period,-1
302,16/3/04,committees discussion current prospective economic developments members noted overall economic activity still seemed increasing solid pace though perhaps not quite quickly members anticipated time january meeting,committee discussion current prospective economic development member note overall economic activity still seem increase solid pace though perhaps not quite quickly member anticipate time january meeting,-1
