,Date,Original,Corpus,Class
106,16/9/03,unemployment rate fell ,unemployment rate fell,-1
107,16/9/03,real personal consumption spending advanced briskly july latest data major categories outlays recorded increases,real personal consumption spending advanced briskly july late data major category outlay record increase,1
108,16/9/03,core consumer prices rose slightly less august july,core consumer price rise slightly less august july,-1
109,16/9/03,consumer food energy prices rose somewhat faster core components leaving overall consumer inflation rate august slightly higher july,consumer food energy price rise somewhat faster core component leave overall consumer inflation rate august slightly high july,1
110,16/9/03,twelvemonth period ending august overall consumer prices bit previous year core consumer prices decelerated,twelvemonth period end august overall consumer price bit previous year core consumer price decelerate,-1
111,16/9/03,significant declines second quarter overall producer prices edged july rose bit august,significant decline second quarter overall producer price edge july rise bit august,-1
112,16/9/03,core producer prices however little changed two months posted slight increase twelvemonth period,core producer price however little change two month post slight increase twelvemonth period,1
114,16/9/03,committee judged that balance risk inflation becoming undesirably low would remain predominant concern foreseeable future,committee judged that balance risk inflation become undesirably low would remain predominant concern foreseeable future,-1
116,16/9/03,broad stock price indexes rose notably boosted improved economic growth prospects associated upwardly revised expectations earnings,broad stock price index rise notably boost improve economic growth prospect associate upwardly revise expectation earnings,1
117,16/9/03,staff forecast prepared meeting continued suggest substantially stronger economic expansion occurred earlier year,staff forecast prepared meeting continued suggest substantially strong economic expansion occur earlier year,1
118,16/9/03,accommodative financial conditions recent additional fiscal stimulus robust gains structural productivity would provide significant impetus business consumer spending months ahead,accommodative financial condition recent additional fiscal stimulus robust gain structural productivity would provide significant impetus business consumer spending month ahead,-1
119,16/9/03,consequence improving sales profits low financing costs temporary federal tax incentive investment new equipment software expected boost business investment spending time,consequence improve sale profit low financing cost temporary federal tax incentive investment new equipment software expect boost business investment spending time,1
120,16/9/03,given substantial ongoing slack resource utilization slight downward pressure core consumer price inflation anticipated staff forecast,give substantial ongoing slack resource utilization slight downward pressure core consumer price inflation anticipate staff forecast,-1
121,16/9/03,members viewed related developments supporting forecasts robust growth economic activity coming quarters consistent stimulative monetary fiscal policies accommodative conditions financial markets positive implications strong productivity growth incomes investment outlays,member view related development support forecast robust growth economic activity come quarter consistent stimulative monetary fiscal policy accommodative condition financial market positive implication strong productivity growth income investment outlay,1
122,16/9/03,members nonetheless cited number factors potential retard expansion including persistence notably cautious business sentiment potential weak employment conditions persist would point depress consumer spending prospect sluggish economic activity abroad would curb growth us exports,member nonetheless cite number factor potential retard expansion include persistence notably cautious business sentiment potential weak employment condition persist would point depress consumer spending prospect sluggish economic activity abroad would curb growth u export,-1
123,16/9/03,background taking account outlook continued strength productivity members anticipated inflation would remain subdued perhaps even edge lower despite expected strength economic activity,background take account outlook continued strength productivity member anticipate inflation would remain subdue perhaps even edge low despite expect strength economic activity,-1
124,16/9/03,improvement not universal notably within manufacturing sectors economy overall business attitudes toward hiring investment decisions continued described exceptionally cautious,improvement not universal notably within manufacturing sector economy overall business attitude toward hire investment decision continued described exceptionally cautious,-1
125,16/9/03,comments many contacts banking sector already quite upbeat regard outlook business spending optimism financial markets clearly improving several months,comment many contact banking sector already quite upbeat regard outlook business spending optimism financial market clearly improve several month,1
126,16/9/03,comments prospective developments major components aggregate demand members anticipated household sector would remain mainstay expansion would significantly reinforced going forward acceleration business expenditures and least next several quarters substantial increases federal government spending,comment prospective development major component aggregate demand member anticipate household sector would remain mainstay expansion would significantly reinforce go forward acceleration business expenditure and least next several quarter substantial increase federal government spending,-1
128,16/9/03,potential negative outlook possibility weakness employment continued would point exert pronounced negative effect consumer sentiment,potential negative outlook possibility weakness employment continued would point exert pronounce negative effect consumer sentiment,-1
129,16/9/03,runup mortgage rates since latter part june expected curb housing demand limited extent coming months outlook housing activity remained favorable given overall economic performance line current forecasts robust expansion related growth incomes still relatively attractive mortgage interest rates,runup mortgage rate since latter part june expect curb housing demand limited extent come month outlook housing activity remain favorable give overall economic performance line current forecast robust expansion related growth income still relatively attractive mortgage interest rate,1
130,16/9/03,business fixed investment remained critical factor also major source uncertainty outlook overall economic activity strength investment key bearing pace overall expansion,business fix investment remain critical factor also major source uncertainty outlook overall economic activity strength investment key bearing pace overall expansion,1
131,16/9/03,looking beyond near term members mentioned number developments supported optimistic outlook capital expenditures,look beyond near term member mention number development support optimistic outlook capital expenditure,1
132,16/9/03,even so recent firming orders shipments along somewhat upbeat anecdotal reports surveys business spending plans pointed relatively brisk advance business spending equipment software least near term,even so recent firm order shipment along somewhat upbeat anecdotal report survey business spending plan point relatively brisk advance business spending equipment software least near term,1
133,16/9/03,increasing business inventory expenditures accommodate strengthening final sales seen likely positive factor expansion overall economic activity coming quarters though degree timing impetus prospective buildup inventories subject considerable uncertainty,increase business inventory expenditure accommodate strengthen final sale see likely positive factor expansion overall economic activity come quarter though degree timing impetus prospective buildup inventory subject considerable uncertainty,1
134,16/9/03,federal spending expected increase substantially further albeit diminishing pace next year beyond reduced taxes buoy consumer business expenditures,federal spending expect increase substantially far albeit diminish pace next year beyond reduce tax buoy consumer business expenditure,-1
137,16/9/03,members agreed inflation likely remain subdued extended period given current forecasts economic activity labor productivity trends,member agree inflation likely remain subdue extend period give current forecast economic activity labor productivity trend,-1
138,16/9/03,specific views regarding probable course inflation differed degree many members expected little change year ahead even beyond,specific view regard probable course inflation differ degree many member expect little change year ahead even beyond,-1
139,16/9/03,several saw significant risk disinflation period even assuming economic growth pace somewhat exceeded economys long run potential,several saw significant risk disinflation period even assume economic growth pace somewhat exceed economy long run potential,-1
140,16/9/03,tending counter resulting disinflationary effects signs expansion globalization might slowing,tend counter result disinflationary effect sign expansion globalization might slow,-1
141,16/9/03,particular difficulties reaching global trade agreements along rise protectionism could tend inhibit increasingly strong competition worldwide markets key factor holding inflation,particular difficulty reach global trade agreement along rise protectionism could tend inhibit increasingly strong competition worldwide market key factor hold inflation,-1
142,16/9/03,members also cited factors would tend maintain upward pressure prices notably relatively rapid rise costs labor benefits especially medical pension benefits,member also cite factor would tend maintain upward pressure price notably relatively rapid rise cost labor benefit especially medical pension benefit,1
143,16/9/03,increases prices raw materials also noted,increase price raw material also note,1
146,16/9/03,several commented recent strengthening economy served alleviate not eliminated concerns possibility disinflation,several comment recent strengthen economy serve alleviate not eliminate concern possibility disinflation,1
147,16/9/03,downside upside risks continued cloud outlook economic activity thus monetary policy economys sizable output gap strongly suggested inflation would remain muted coming quarters even assuming relatively robust economic growth line current forecasts,downside upside risk continued cloud outlook economic activity thus monetary policy economy sizable output gap strongly suggest inflation would remain mute come quarter even assume relatively robust economic growth line current forecast,-1
148,16/9/03,accordingly economy might well expand brisk pace extended period inflationary pressures began emerge call adjustment monetary policy,accordingly economy might well expand brisk pace extend period inflationary pressure begin emerge call adjustment monetary policy,-1
149,16/9/03,particular risks goal sustainable economic growth balanced next quarters probability unwelcome fall inflation though minor exceeded rise inflation currently low level,particular risk goal sustainable economic growth balance next quarter probability unwelcome fall inflation though minor exceed rise inflation currently low level,1
150,16/9/03,balance risk undesirably low inflation likely committees predominant concern foreseeable future,balance risk undesirably low inflation likely committee predominant concern foreseeable future,-1
151,16/9/03,federal open market committee seeks monetary financial conditions foster price stability promote sustainable growth output,federal open market committee seek monetary financial condition foster price stability promote sustainable growth output,1
152,21/9/04,information reviewed meeting suggested economic growth regained vigor recent months slowed late spring,information review meeting suggest economic growth regain vigor recent month slow late spring,1
153,21/9/04,august labor market report showed moderate gain payrolls,august labor market report show moderate gain payroll,1
154,21/9/04,consumer spending rose sharply july housing activity increased august business outlays picked last month,consumer spending rise sharply july housing activity increase august business outlay picked last month,1
155,21/9/04,core consumer price inflation moderated june july decline energy prices damped overall inflation july,core consumer price inflation moderate june july decline energy price damped overall inflation july,-1
156,21/9/04,latest readings consumer confidence showed drop august amid labor market slack near record gasoline prices slight decline september readings third quarter averaged second quarter,late reading consumer confidence show drop august amid labor market slack near record gasoline price slight decline september reading third quarter average second quarter,-1
157,21/9/04,although book value manufacturing trade inventories rose appreciably july gains inflated price increases petroleum sector,although book value manufacturing trade inventory rise appreciably july gain inflate price increase petroleum sector,-1
158,21/9/04,economic activity major foreign industrial countries continued expand second quarter although growth slowed japan euro area,economic activity major foreign industrial country continued expand second quarter although growth slow japan euro area,1
159,21/9/04,core consumer prices edged slightly months june july inflation goods services moderated,core consumer price edge slightly month june july inflation good service moderate,1
160,21/9/04,core pce price index flat july but like core cpi bit balance june july,core pce price index flat july but like core cpi bit balance june july,-1
161,21/9/04,owing decline energy prices july inflation overall consumer prices slowed month,owe decline energy price july inflation overall consumer price slow month,-1
162,21/9/04,august households expectations consumer inflation year ahead edged lower second consecutive month,august household expectation consumer inflation year ahead edge low second consecutive month,-1
163,21/9/04,meanwhile small rise july prices finished goods faced producers moved bit august,meanwhile small rise july price finish good face producer move bit august,1
165,21/9/04,announcement committee noted output growth moderated recent months pace improvement labor market conditions slowed softness likely owed importantly substantial rise energy prices,announcement committee note output growth moderate recent month pace improvement labor market condition slow softness likely owe importantly substantial rise energy price,1
166,21/9/04,although committees decision raise intended level federal funds rate  basis points widely anticipated financial markets accompanying statement read setting optimistic tone economic prospects anticipated prompted investors mark expectations nearterm path policy,although committee decision raise intend level federal fund rate basis point widely anticipate financial market accompany statement read set optimistic tone economic prospect anticipate prompt investor mark expectation nearterm path policy,1
167,21/9/04,sentiment apparently reinforced remainder period comments several federal reserve officials release august employment report seemed convey view economy emerging soft patch,sentiment apparently reinforce remainder period comment several federal reserve official release august employment report seem convey view economy emerge soft patch,-1
168,21/9/04,longerterm policy expectations however moved noticeably lower reflecting release relatively benign readings inflation chairmans comments inflation outlook testimony house budget committee,longerterm policy expectation however move noticeably low reflect release relatively benign reading inflation chairman comment inflation outlook testimony house budget committee,-1
170,21/9/04,staff forecast prepared meeting suggested economy would continue expanding solid pace end ,staff forecast prepared meeting suggest economy would continue expand solid pace end,1
171,21/9/04,labor market improvements accommodative monetary policy seen counterbalancing drag swing fiscal policy considerable stimulus year modest restraint next year,labor market improvement accommodative monetary policy see counterbalance drag swing fiscal policy considerable stimulus year modest restraint next year,-1
172,21/9/04,consumer spending expected pick conjunction strengthening labor market associated gains wages salaries would offset effects anticipated rise savings rate recent low level,consumer spending expect pick conjunction strengthen labor market associate gain wage salary would offset effect anticipate rise saving rate recent low level,-1
173,21/9/04,consumer price inflation projected remain current level,consumer price inflation project remain current level,-1
175,21/9/04,recent data anecdotal information suggested solid growth ahead pace could well less brisk previously anticipated,recent data anecdotal information suggest solid growth ahead pace could well less brisk previously anticipate,-1
176,21/9/04,members commented benign incoming data prices tended confirm previous judgment increase inflation earlier year importantly reflected temporary factors core inflation would probably remain relatively low,member comment benign incoming data price tend confirm previous judgment increase inflation earlier year importantly reflect temporary factor core inflation would probably remain relatively low,-1
177,21/9/04,also low real interest rates strong business balance sheets high levels profits cash flow expected support capital spending,also low real interest rate strong business balance sheet high level profit cash flow expect support capital spending,-1
178,21/9/04,committee members interpreted recent data anecdotal information indicating growth consumer spending rebounding from relatively slow rate late spring,committee member interpret recent data anecdotal information indicate growth consumer spending rebound from relatively slow rate late spring,-1
179,21/9/04,committee members generally viewed labor market conditions improved modestly late,committee member generally view labor market condition improve modestly late,1
180,21/9/04,looking forward policymakers expected gradual improvement labor market conditions economy expanded,look forward policymakers expect gradual improvement labor market condition economy expand,1
181,21/9/04,however anecdotal information suggested many firms remained quite cautious expanding payrolls citing among factors continued uncertainty economic prospects high cost providing health care benefits,however anecdotal information suggest many firm remain quite cautious expand payroll cite among factor continued uncertainty economic prospect high cost provide health care benefit,-1
182,21/9/04,partly reflecting likely persistence economic slack members expected inflation stay low,partly reflect likely persistence economic slack member expect inflation stay low,-1
183,21/9/04,although non energy commodity prices remained relatively high energy prices declined noticeably record levels recent weeks effects energy price shock inflation expected wane,although non energy commodity price remain relatively high energy price decline noticeably record level recent week effect energy price shock inflation expect wane,-1
184,21/9/04,moreover inflation expectations appeared wellcontained although expectations probably conditioned part investors anticipation stance monetary policy would likely tightened time,moreover inflation expectation appear wellcontained although expectation probably condition part investor anticipation stance monetary policy would likely tighten time,-1
185,21/9/04,gradual increase interest rates seemed likely consistent continued solid economic growth would sufficient erode remaining margins slack resource utilization time,gradual increase interest rate seem likely consistent continued solid economic growth would sufficient erode remain margin slack resource utilization time,1
186,21/9/04,addition policymakers concurred statement indicate inflation inflation expectations eased recent months,addition policymakers concur statement indicate inflation inflation expectation ease recent month,-1
187,21/9/04,members commented recent evidence boosted confidence moderate economic growth would continue inflation would contained,member comment recent evidence boost confidence moderate economic growth would continue inflation would contain,1
189,21/9/04,underlying inflation expected relatively low committee believes policy accommodation removed pace likely measured,underlie inflation expect relatively low committee believe policy accommodation remove pace likely measure,-1
190,28/10/03,pace economic expansion appeared picked substantially,pace economic expansion appear picked substantially,1
191,28/10/03,core consumer prices risen faster recent months earlier year twelvemonth increase september notably lower preceding year,core consumer price risen faster recent month earlier year twelvemonth increase september notably low precede year,1
192,28/10/03,industrial output displayed solid growth third quarter declining earlier year,industrial output displayed solid growth third quarter decline earlier year,-1
193,28/10/03,real personal consumption expenditures surged july august available data suggested consumer spending fallen back september largely reflecting swing consumer purchases motor vehicles,real personal consumption expenditure surge july august available data suggest consumer spending fall back september largely reflect swing consumer purchase motor vehicle,1
194,28/10/03,available data third quarter generally suggested moderate growth major foreign industrial countries,available data third quarter generally suggest moderate growth major foreign industrial country,1
195,28/10/03,core consumer prices rose slightly august september headline consumer inflation bit more largely reflecting runup gasoline prices,core consumer price rise slightly august september headline consumer inflation bit more largely reflect runup gasoline price,1
196,28/10/03,energy prices also boosted overall consumer inflation past twelve months core consumer inflation moved lower period,energy price also boost overall consumer inflation past twelve month core consumer inflation move low period,1
197,28/10/03,producer level core prices unchanged august september rising energy food prices led somewhat larger increases prices total finished goods,producer level core price unchanged august september rise energy food price lead somewhat large increase price total finish good,1
198,28/10/03,reaching decision committee members generally perceived upside downside risks attainment sustainable growth next quarters roughly equal however viewed probability though minor unwelcome fall inflation exceeding rise inflation already low level,reach decision committee member generally perceive upside downside risk attainment sustainable growth next quarter roughly equal however view probability though minor unwelcome fall inflation exceed rise inflation already low level,-1
199,28/10/03,committee judged that balance risk inflation becoming undesirably low would remain predominant concern foreseeable future,committee judged that balance risk inflation become undesirably low would remain predominant concern foreseeable future,-1
201,28/10/03,negative market sentiment toward dollar apparently reinforced market participants interpretation g communiqu dubai september  not overcome several better than expected us economic reports though shortlived gains related data releases period,negative market sentiment toward dollar apparently reinforce market participant interpretation g communiqu dubai september not overcome several better than expected u economic report though shortlived gain related data release period,-1
202,28/10/03,accommodative financial conditions recent additional fiscal stimulus robust gains structural productivity evidently providing significant impetus business consumer spending,accommodative financial condition recent additional fiscal stimulus robust gain structural productivity evidently provide significant impetus business consumer spending,1
203,28/10/03,consequence improving sales profits low financing costs temporary federal tax incentive investment new equipment software projected boost business investment spending time,consequence improve sale profit low financing cost temporary federal tax incentive investment new equipment software project boost business investment spending time,1
204,28/10/03,given substantial ongoing slack resource utilization staff forecast anticipated slight downward pressure core consumer price inflation,give substantial ongoing slack resource utilization staff forecast anticipate slight downward pressure core consumer price inflation,-1
205,28/10/03,committees discussion current prospective economic developments members referred widespread indications marked strengthening growth economic activity,committee discussion current prospective economic development member refer widespread indication marked strengthen growth economic activity,1
