,Date,Original,Corpus,Class
0,12/9/03,consequence sales profits stock prices higher liquidation inventories appeared ending strengthening capital investment pickup hiring already evident data projected continue,consequence sale profit stock price high liquidation inventory appear end strengthen capital investment pickup hire already evident data project continue,-1
1,12/9/03,even though unemployment rate projected decline coming quarters slight downward pressure core consumer price inflation anticipated forecast given ongoing slack resource utilization,even though unemployment rate project decline come quarter slight downward pressure core consumer price inflation anticipate forecast give ongoing slack resource utilization,-1
2,12/9/03,assessments individual members likely pace expansion going forward differed somewhat generally expected growth run rate would trim slack labor goods markets forecast period assuming no major shocks economy,assessment individual member likely pace expansion go forward differ somewhat generally expect growth run rate would trim slack labor good market forecast period assume no major shock economy,-1
3,12/9/03,downside risks outlook diminished members remained concerned spending could slow somewhat next year effects fiscal stimulus mortgage refinancing faded,downside risk outlook diminish member remain concerned spending could slow somewhat next year effect fiscal stimulus mortgage refinance fade,-1
4,12/9/03,rapid productivity growth also could limit employment gains weigh consumer confidence,rapid productivity growth also could limit employment gain weigh consumer confidence,-1
5,12/9/03,relatively strong economic growth nonetheless seemingly assured members regarded risks inflation nearly balanced earlier year,relatively strong economic growth nonetheless seemingly assure member regard risk inflation nearly balance earlier year,1
6,12/9/03,comments recent developments around nation members reported improving economic conditions virtually regions strength household spending increasingly augmented gains business outlays,comment recent development around nation member report improve economic condition virtually region strength household spending increasingly augment gain business outlay,1
7,12/9/03,consumer spending remained firm residential construction continued high level,consumer spending remain firm residential construction continued high level,1
8,12/9/03,committee members business contacts generally expressed increasing confidence expansion would sustained anticipated increases investment outlays employment going forward,committee member business contact generally express increase confidence expansion would sustain anticipate increase investment outlay employment go forward,-1
9,12/9/03,even manufacturing lagged recovery rest economy recently output rising many subsectors employment displayed signs stabilizing,even manufacturing lag recovery rest economy recently output rise many subsectors employment displayed sign stabilize,1
10,12/9/03,members reported easing downward pressures prices selected industries anecdotal reports suggested competition including especially competition foreign producers continued constrain pricing,member report ease downward pressure price select industry anecdotal report suggest competition include especially competition foreign producer continued constrain pricing,-1
11,12/9/03,comments outlook demand key sectors economy members indicated greater confidence sizable gains business spending recent quarters would continue,comment outlook demand key sector economy member indicate great confidence sizable gain business spending recent quarter would continue,1
12,12/9/03,members noted commercial real estate sector weak high vacancy rates falling rents showing signs bottoming strengthening economy boosted demand office retail space,member note commercial real estate sector weak high vacancy rate fall rent show sign bottoming strengthen economy boost demand office retail space,1
13,12/9/03,level inventories still quite low relative sales sales expected strengthen further number members noted inventory investment could expected contribute growth aggregate demand coming quarters,level inventory still quite low relative sale sale expect strengthen far number member note inventory investment could expect contribute growth aggregate demand come quarter,-1
14,12/9/03,household spending remained solid even effects tax refunds mortgage refinancing boosted spending substantially summer waned,household spending remain solid even effect tax refund mortgage refinance boost spending substantially summer wan,1
15,12/9/03,consumption spending slowed earlier fall retail contacts suggested strengthening recently reported holiday sales appeared running somewhat last years pace,consumption spending slow earlier fall retail contact suggest strengthen recently report holiday sale appear run somewhat last year pace,-1
16,12/9/03,looking forward members anticipated consumer spending would supported gains employment well substantial tax refunds first half next year,look forward member anticipate consumer spending would support gain employment well substantial tax refund first half next year,1
17,12/9/03,expansion picking momentum risk slowdown spending clearly seemed diminished,expansion pick momentum risk slowdown spending clearly seem diminish,-1
18,12/9/03,members pointed however signs increased financial stress could limit ability many households hold spending recent levels especially incomes not rise robust pace line current forecasts,member point however sign increase financial stress could limit ability many household hold spending recent level especially income not rise robust pace line current forecast,-1
19,12/9/03,members anticipated growth federal government spending boosted recent quarters buildup defense outlays would slow going forward budget pressures would continue limit increases state local spending,member anticipate growth federal government spending boost recent quarter buildup defense outlay would slow go forward budget pressure would continue limit increase state local spending,1
20,12/9/03,longer horizon members expressed concern possible adverse effects deficits financial markets economy,longer horizon member express concern possible adverse effect deficit financial market economy,-1
21,12/9/03,remarks external sector economy members noted improvement economic outlook many foreign economies well lower dollar likely foster pickup exports,remark external sector economy member note improvement economic outlook many foreign economy well low dollar likely foster pickup export,1
22,12/9/03,improvement abroad probably result faster growth united states domestic demand several major trading partners appeared strengthening,improvement abroad probably result faster growth united state domestic demand several major trading partner appear strengthen,1
23,12/9/03,nonetheless value us imports likely continue exceed exports wide margin resulting large current account deficits potential correction added uncertainty longer term prospects us economy,nonetheless value u import likely continue exceed export wide margin result large current account deficit potential correction add uncertainty longer term prospect u economy,-1
24,12/9/03,review outlook prices members generally anticipated persisting though decreasing margins slack labor goods markets gains productivity would keep inflation low number members seeing small decline inflation distinct possibility,review outlook price member generally anticipate persist though decrease margin slack labor good market gain productivity would keep inflation low number member see small decline inflation distinct possibility,-1
25,12/9/03,even growth proved fairly robust downward pressure prices could come narrowing profit margins currently quite high surprising strength productivity would reduce labor costs,even growth prove fairly robust downward pressure price could come narrow profit margin currently quite high surprising strength productivity would reduce labor cost,1
26,12/9/03,however growth seen assured downward risks inflation viewed considerably reduced relative earlier year risk pernicious deflation declining prices reinforced weakness demand  risk members always viewed small  regarded virtually nil,however growth see assure downward risk inflation view considerably reduce relative earlier year risk pernicious deflation decline price reinforce weakness demand risk member always view small regard virtually nil,-1
27,12/9/03,members also expressed concern potential increase inflation expectations given highly stimulative macroeconomic policies economic growth seemed gathering momentum,member also express concern potential increase inflation expectation give highly stimulative macroeconomic policy economic growth seem gathering momentum,1
28,12/9/03,noted rise recent months inflation compensation measured difference yields nominal indexed treasury securities could potentially point direction,note rise recent month inflation compensation measure difference yield nominal indexed treasury security could potentially point direction,1
29,12/9/03,nonetheless balance members currently considered upside risks inflation bit less pressing downside next quarters,nonetheless balance member currently consider upside risk inflation bit less press downside next quarter,-1
30,12/9/03,data anecdotal evidence becoming available since last meeting made members confident robust growth economic activity would persist,data anecdotal evidence become available since last meeting make member confident robust growth economic activity would persist,1
31,12/9/03,nonetheless felt currently accommodative policy stance remained appropriate period characterized low inflation wide margins unused labor resources still considerable uncertainty speed margins would worked down,nonetheless felt currently accommodative policy stance remain appropriate period characterize low inflation wide margin unused labor resource still considerable uncertainty speed margin would work down,1
32,12/9/03,circumstances inflationary pressures appeared likely remain subdued well future,circumstance inflationary pressure appear likely remain subdue well future,-1
33,12/9/03,sure committee needed remain attentive indications rising inflation pressures prepared adjust policy stance emerging economic conditions warranted move,sure committee need remain attentive indication rise inflation pressure prepared adjust policy stance emerge economic condition warrant move,1
37,12/9/03,could agree risks disinflation substantially reduced close balance overall inflation,could agree risk disinflation substantially reduce close balance overall inflation,-1
38,12/9/03,given decision retain reference question members saw merit associating clearly economic conditions specifically persistence quite low inflation slack resource use opposed appear linked passage time,give decision retain reference question member saw merit associate clearly economic condition specifically persistence quite low inflation slack resource use oppose appear link passage time,-1
43,28/1/04,economy appeared expanded robust pace fourth quarter though well exceptional pace recorded third quarter,economy appear expand robust pace fourth quarter though well exceptional pace record third quarter,1
44,28/1/04,consumer spending continued increase solid rate final three months year activity residential sector remained high level,consumer spending continued increase solid rate final three month year activity residential sector remain high level,1
45,28/1/04,despite strong pace economic activity labor market improving slowly private payrolls showing small acceleration fourth quarter,despite strong pace economic activity labor market improve slowly private payroll show small acceleration fourth quarter,1
46,28/1/04,core consumer price inflation continued slow inflation expectations remained subdued closing months ,core consumer price inflation continued slow inflation expectation remain subdue closing month,1
47,28/1/04,december employment report suggested labor market not gained much momentum previously appeared way,december employment report suggest labor market not gain much momentum previously appear way,-1
48,28/1/04,aggregate hours worked nonfarm employees fell december fourth quarter whole posted first quarterly increase since ,aggregate hour work nonfarm employee fell december fourth quarter whole post first quarterly increase since,-1
49,28/1/04,despite weak payroll data unemployment rate measured household survey fell ,despite weak payroll data unemployment rate measure household survey fell,-1
50,28/1/04, percent december part decline labor force participation rate,percent december part decline labor force participation rate,-1
51,28/1/04,initial claims unemployment insurance continued drift weeks following reference week december employment report suggesting improved job growth january,initial claim unemployment insurance continued drift week follow reference week december employment report suggest improve job growth january,-1
52,28/1/04,available data suggested business purchases transportation equipment strengthened fourth quarter spending capital goods advanced moderate pace,available data suggest business purchase transportation equipment strengthen fourth quarter spending capital good advanced moderate pace,-1
55,28/1/04,holding roughly steady balance first half  real spending private non residential construction appeared slipped third fourth quarters,hold roughly steady balance first half real spending private non residential construction appear slip third fourth quarter,-1
56,28/1/04,recent data indicated pickup economic activity major foreign industrial countries continued fourth quarter,recent data indicate pickup economic activity major foreign industrial country continued fourth quarter,1
57,28/1/04,canadian employment sales data strong fourth quarter housing sector continuing make significant contribution growth,canadian employment sale data strong fourth quarter housing sector continue make significant contribution growth,1
58,28/1/04,overall consumer prices flat balance past three months small increase core prices large rise food prices offset sizable drop energy prices,overall consumer price flat balance past three month small increase core price large rise food price offset sizable drop energy price,1
59,28/1/04,year consumer price index posted moderate increase noticeably previous year,year consumer price index post moderate increase noticeably previous year,1
60,28/1/04,core consumer prices decelerated sharply rose slightly year,core consumer price decelerate sharply rise slightly year,-1
61,28/1/04,producer prices finished goods moderately year advance substantially previous year,producer price finish good moderately year advance substantially previous year,1
62,28/1/04,regard labor costs average hourly earnings production nonsupervisory workers private nonfarm payrolls rose modestly twelve months ending december increase somewhat ,regard labor cost average hourly earnings production nonsupervisory worker private nonfarm payroll rise modestly twelve month end december increase somewhat,1
65,28/1/04,nevertheless inflation quite low resource use slack committee believed policy accommodation could maintained considerable period,nevertheless inflation quite low resource use slack committee believe policy accommodation could maintain considerable period,-1
66,28/1/04,futures rates second half year rose basis points presumably response committees assessment probability unwelcome decline inflation fallen recent months level almost equal rise inflation,future rate second half year rise basis point presumably response committee assessment probability unwelcome decline inflation fall recent month level almost equal rise inflation,-1
67,28/1/04,subsequently however release minutes october fomc meeting indicated time committee concerned possibility persistent slack arising rapid productivity growth publication surprisingly modest growth employment december led market participants push back date expected onset tightening several months time fall,subsequently however release minute october fomc meeting indicate time committee concerned possibility persistent slack arise rapid productivity growth publication surprisingly modest growth employment december lead market participant push back date expect onset tighten several month time fall,1
68,28/1/04,major equity indexes rose strongly response declines yields positive news outlook profits,major equity index rise strongly response decline yield positive news outlook profit,1
69,28/1/04,staff forecast prepared meeting indicated momentum economic activity built second half  would carry first half current year ongoing gains spending production would soon result visible improvement labor market conditions,staff forecast prepared meeting indicate momentum economic activity built second half would carry first half current year ongoing gain spending production would soon result visible improvement labor market condition,1
70,28/1/04,addition improving labor market conditions effects strong productivity growth permanent income projected support household spending business investment spending seen strengthening response acceleration business output swelling profits continued favorable financing conditions,addition improve labor market condition effect strong productivity growth permanent income project support household spending business investment spending see strengthen response acceleration business output swell profit continued favorable financing condition,1
71,28/1/04,slight downward pressure core consumer price inflation anticipated forecast given ongoing slack labor product markets,slight downward pressure core consumer price inflation anticipate forecast give ongoing slack labor product market,-1
73,28/1/04,indeed business expenditures broadened sources significant strength expansion earlier sustained mainly household government spending,indeed business expenditure broaden source significant strength expansion earlier sustain mainly household government spending,1
74,28/1/04,members nonetheless expressed disappointment acceleration economic activity thus far failed generate significant strengthening employment though pointed number positive signs labor markets,member nonetheless express disappointment acceleration economic activity thus far fail generate significant strengthen employment though point number positive sign labor market,-1
75,28/1/04,given expectations persisting abovetrend economic growth saw increasing demand workers likely prospect going forward,give expectation persist abovetrend economic growth saw increase demand worker likely prospect go forward,1
76,28/1/04,regarding outlook inflation members observed wide margins slack labor product markets continued hold wages prices especially given concurrent strength productivity,regard outlook inflation member observe wide margin slack labor product market continued hold wage price especially give concurrent strength productivity,-1
77,28/1/04,core consumer inflation appeared drifted lower recently number members mentioned possibility modest decline inflation current subdued level,core consumer inflation appear drift low recently number member mention possibility modest decline inflation current subdue level,-1
78,28/1/04,year ahead however members generally anticipated little net change consumer price inflation,year ahead however member generally anticipate little net change consumer price inflation,-1
79,28/1/04,forecasts pointed continuation relatively vigorous growth economic activity decline unemployment quite low rate inflation,forecast point continuation relatively vigorous growth economic activity decline unemployment quite low rate inflation,-1
80,28/1/04,many contacts indicated replacement demand costsaving opportunities provided productive new equipment still driving factors guiding investment decisions reports investment spending expand capacity,many contact indicate replacement demand costsaving opportunity provide productive new equipment still drive factor guide investment decision report investment spending expand capacity,-1
81,28/1/04,members also viewed business inventory investment likely provide support economic expansion year ahead,member also view business inventory investment likely provide support economic expansion year ahead,1
82,28/1/04,business expenditures turned up employers continued display high degree caution hiring new workers,business expenditure turn up employer continued display high degree caution hire new worker,-1
83,28/1/04,employment trended since mid protracted period job losses gains significantly weaker typical similar stages earlier business cycles,employment trend since mid protract period job loss gain significantly weaker typical similar stage earlier business cycle,-1
84,28/1/04,background labor markets continued described soft areas albeit signs least modest improvement,background labor market continued described soft area albeit sign least modest improvement,-1
85,28/1/04,looking ahead members saw considerably faster growth employment likely prospect context strengthening aggregate demand expectations slowing growth productivity extraordinary pace recent quarters,look ahead member saw considerably faster growth employment likely prospect context strengthen aggregate demand expectation slow growth productivity extraordinary pace recent quarter,1
87,28/1/04,household spending benefiting stimulative fiscal monetary policies wealth effects rising real estate equity prices increased consumer confidence economic outlook,household spending benefiting stimulative fiscal monetary policy wealth effect rise real estate equity price increase consumer confidence economic outlook,1
89,28/1/04,even so ongoing strength imports still producing widening trade deficit net exports expected small arithmetic drag domestic economic activity year ahead,even so ongoing strength import still produce widen trade deficit net export expect small arithmetic drag domestic economic activity year ahead,-1
90,28/1/04,members indicated concerned implications nations rapidly growing external debt domestic financial markets economy time,member indicate concerned implication nation rapidly grow external debt domestic financial market economy time,-1
91,28/1/04,committees discussion outlook inflation members agreed increases core consumer prices likely remain muted year ongoing strength expansion gradually reducing current output gap anticipated gains productivity exerting downward pressure costs prices,committee discussion outlook inflation member agree increase core consumer price likely remain mute year ongoing strength expansion gradually reduce current output gap anticipate gain productivity exert downward pressure cost price,-1
94,28/1/04,members noted disinflation associated rapid growth productivity could viewed non threatening,member note disinflation associate rapid growth productivity could view non threatening,1
95,28/1/04,members expressed differing view core consumer prices might well edge course year light considerable stimulus stemming current monetary fiscal policies possibility expected pickup economic activity employment especially high side current forecasts would associated slower growth productivity,member express differ view core consumer price might well edge course year light considerable stimulus stem current monetary fiscal policy possibility expect pickup economic activity employment especially high side current forecast would associate slow growth productivity,1
96,28/1/04,members persuaded relatively vigorous economic expansion firmly established likely point call move toward neutral policy stance concluded adjustment not warranted current circumstances,member persuade relatively vigorous economic expansion firmly establish likely point call move toward neutral policy stance conclude adjustment not warrant current circumstance,1
97,28/1/04,regard stressed unused labor resources remained substantial inflation low level inflation not expected change appreciably either direction year ahead,regard stress unused labor resource remain substantial inflation low level inflation not expect change appreciably either direction year ahead,1
99,28/1/04,probability unwelcome fall inflation diminished recent months appears almost equal rise inflation,probability unwelcome fall inflation diminish recent month appear almost equal rise inflation,-1
100,28/1/04,inflation quite low resource use slack committee believes patient removing policy accommodation,inflation quite low resource use slack committee believe patient remove policy accommodation,-1
101,16/9/03,domestic final demand strengthened appreciably solid gains household business spending,domestic final demand strengthen appreciably solid gain household business spending,1
102,16/9/03,consumer prices edged recent months yearoveryear consumer inflation remained low level,consumer price edge recent month yearoveryear consumer inflation remain low level,-1
103,16/9/03,private nonfarm payroll employment fell august decline similar june july,private nonfarm payroll employment fell august decline similar june july,-1
104,16/9/03,employment continued fall manufacturing wholesale retail trade transportation utilities information categories,employment continued fall manufacturing wholesale retail trade transportation utility information category,-1
105,16/9/03,employment service industry unchanged job losses professional business services largely offset expansion nonbusiness services,employment service industry unchanged job loss professional business service largely offset expansion nonbusiness service,-1
