,Date,Original,Corpus,Class
429,18/3/03,information reviewed meeting suggested growth economic activity remained subpar opening months year,information review meeting suggest growth economic activity remain subpar opening month year,-1
430,18/3/03,underlying demand residential housing continued robust government outlays evidently rising expansion consumer spending seemed slowed outlays capital spending still sluggish environment business uncertainty pessimism,underlie demand residential housing continued robust government outlay evidently rise expansion consumer spending seem slow outlay capital spending still sluggish environment business uncertainty pessimism,1
432,18/3/03,consumer price inflation measured core cpi decelerated past year steep increases energy prices boosted overall price inflation,consumer price inflation measure core cpi decelerate past year steep increase energy price boost overall price inflation,1
434,18/3/03,job losses transportation industry seemed associated part higher fuel costs,job loss transportation industry seem associate part high fuel cost,1
435,18/3/03,unemployment rate inched ,unemployment rate inched,-1
436,18/3/03, percent february recent readings initial claims unemployment insurance suggested labor market conditions remained soft march,percent february recent reading initial claim unemployment insurance suggest labor market condition remain soft march,-1
437,18/3/03,addition rising energy prices eroded part sluggish gains consumer incomes consumer sentiment net worth deteriorated noticeably,addition rise energy price erode part sluggish gain consumer income consumer sentiment net worth deteriorate noticeably,1
438,18/3/03,january rise shipments nontransportation capital equipment suggested demand goods part businesses beginning respond continued increases output declines cost capital,january rise shipment nontransportation capital equipment suggest demand good part business begin respond continued increase output decline cost capital,1
439,18/3/03,measures core consumer prices labor costs decelerated twelve month period ended january,measure core consumer price labor cost decelerate twelve month period end january,-1
440,18/3/03,however recent jump gasoline heating oil prices reflecting sharp runup crude oil prices unusually cold weather midwest east significantly boosted overall consumer price inflation twelve months ended january,however recent jump gasoline heating oil price reflect sharp runup crude oil price unusually cold weather midwest east significantly boost overall consumer price inflation twelve month end january,1
441,18/3/03,producer level core price inflation finished goods eased twelve month interval ending february,producer level core price inflation finish good ease twelve month interval end february,-1
442,18/3/03,committee noted economy continued grow slowly monetary policy financial conditions quite accommodative prospects appreciable strengthening economic expansion time remained favorable,committee note economy continued grow slowly monetary policy financial condition quite accommodative prospect appreciable strengthen economic expansion time remain favorable,-1
444,18/3/03,dollar depreciated canadian dollar supported small monetary tightening action bank canada trim inflationary pressures,dollar depreciate canadian dollar support small monetary tighten action bank canada trim inflationary pressure,1
446,18/3/03,staff forecast prepared meeting continued suggest economic expansion would muted time,staff forecast prepared meeting continued suggest economic expansion would mute time,-1
447,18/3/03,persistence underutilized resources expected maintain downward pressure core price inflation forecast period,persistence underutilized resource expect maintain downward pressure core price inflation forecast period,-1
448,18/3/03,widespread indications strengthening economy near end last year first part year given way disappointing economic performance recently,widespread indication strengthen economy near end last year first part year give way disappoint economic performance recently,-1
450,18/3/03,likelihood continued low even declining inflation high especially given expectations persisting slack resource utilization,likelihood continued low even decline inflation high especially give expectation persist slack resource utilization,-1
455,18/3/03,background persistent strength productivity growth continued low levels capital labor utilization inflation would likely remain subdued going forward,background persistent strength productivity growth continued low level capital labor utilization inflation would likely remain subdue go forward,-1
456,18/3/03,indeed members saw disinflation core prices distinct possibility next several quarters,indeed member saw disinflation core price distinct possibility next several quarter,-1
457,18/3/03,however high oil prices persist likely effect damping demand raising inflation given well entrenched expectations low inflation,however high oil price persist likely effect damp demand raise inflation give well entrenched expectation low inflation,1
458,18/3/03,economic expansion displayed signs faltering recent weeks reasons hence duration period weakness could not reliably ascertained,economic expansion displayed sign falter recent week reason hence duration period weakness could not reliably ascertain,-1
460,18/3/03,monetary policy positioned accommodate strengthening economic performance seemed likely materialize key uncertainties related concerns began decrease perhaps relatively near future business consumer sentiment started improve,monetary policy position accommodate strengthen economic performance seem likely materialize key uncertainty related concern begin decrease perhaps relatively near future business consumer sentiment start improve,1
464,2/2/05,subsequent discussion meeting participants uniformly agreed price stability provided best environment maximizing sustainable economic growth long run expressed range views whether would helpful committee articulate specific numerical definition federal reserves pricestability objectiveeither single figure range,subsequent discussion meeting participant uniformly agree price stability provide best environment maximize sustainable economic growth long run express range view whether would helpful committee articulate specific numerical definition federal reserve pricestability objectiveeither single figure range,1
465,2/2/05,believed move would balance beneficial cited example usefulness anchor longterm inflation expectations vehicle enhanced clarity committee deliberations additional tool communications,believe move would balance beneficial cite example usefulness anchor longterm inflation expectation vehicle enhance clarity committee deliberation additional tool communication,1
466,2/2/05,labor market showed signs improvement,labor market show sign improvement,1
467,2/2/05,core consumer prices rose moderately past months measures inflation expectations remained well anchored,core consumer price rise moderately past month measure inflation expectation remain well anchored,1
468,2/2/05,average work week fourth quarter unchanged third quarter result aggregate hours decelerated despite pickup employment growth,average work week fourth quarter unchanged third quarter result aggregate hour decelerate despite pickup employment growth,-1
469,2/2/05,real consumer spending expanded briskly december fourth quarter whole retail sales exhibiting widespread strength across categories,real consumer spending expand briskly december fourth quarter whole retail sale exhibit widespread strength across category,1
470,2/2/05,measures consumer confidence remained favorable consistent sustained increases spending,measure consumer confidence remain favorable consistent sustain increase spending,1
472,2/2/05,core consumer prices decelerated past months overall consumer prices buffeted movements energy prices,core consumer price decelerate past month overall consumer price buffet movement energy price,-1
475,2/2/05,committee also noted output appeared growing moderate pace labor market conditions continued improve gradually inflation inflation expectations remained well contained,committee also note output appear grow moderate pace labor market condition continued improve gradually inflation inflation expectation remain well contained,-1
478,2/2/05,yields inflationindexed treasury securities rose roughly line nominal counterparts longerterm inflation compensation remained unchanged,yield inflationindexed treasury security rise roughly line nominal counterpart longerterm inflation compensation remain unchanged,1
479,2/2/05,grew moderately recent months expansion restrained rising opportunity costs associated monetary policy tightening,grow moderately recent month expansion restrain rise opportunity cost associate monetary policy tighten,1
480,2/2/05,measures total consumer price inflation expected decline forecast horizon energy prices receded core inflation seen remaining stable staff forecast,measure total consumer price inflation expect decline forecast horizon energy price recede core inflation see remain stable staff forecast,-1
481,2/2/05,tendencies core inflation increase slightly higher trend unit labor costs narrowing margin resource slack expected offset waning contribution elevated prices energy imported goods,tendency core inflation increase slightly high trend unit labor cost narrow margin resource slack expect offset wan contribution elevate price energy import good,1
482,2/2/05,recent data indicated low stable rates core consumer inflation apparently well anchored inflation expectations,recent data indicate low stable rate core consumer inflation apparently well anchored inflation expectation,-1
484,2/2/05,gains capital spending quite strong last year spending might motivated year end expiration partialexpensing provisions tax code participants seen little evidence date would significant slow down growth spending early part ,gain capital spending quite strong last year spending might motivate year end expiration partialexpensing provision tax code participant see little evidence date would significant slow down growth spending early part,-1
486,2/2/05,low longer term nominal interest rates partly attributable well contained inflation expectations low real interest rates along slight declines equity prices far year might reflect lingering caution part businesses outlook,low longer term nominal interest rate partly attributable well contained inflation expectation low real interest rate along slight decline equity price far year might reflect linger caution part business outlook,-1
487,2/2/05,solid income gains low interest rates consumer confidence seen participants helping sustain strong growth household spending,solid income gain low interest rate consumer confidence see participant help sustain strong growth household spending,-1
488,2/2/05,current low measured saving rate seemed mostly explainable strength expected income gains low interest rates increase household wealth resulting rise equity housing prices,current low measure save rate seem mostly explainable strength expect income gain low interest rate increase household wealth result rise equity housing price,-1
489,2/2/05,although saving rate might well drift next couple years participants generally thought likely consumer spending would continue growing strong pace,although save rate might well drift next couple year participant generally thought likely consumer spending would continue grow strong pace,1
490,2/2/05,however marked slowing home price appreciation possible increases longerterm interest rates would raise financing costs reduce opportunities extract equity homes refinancings home equity loans seen downside risks prospects consumption spending housing construction,however marked slow home price appreciation possible increase longerterm interest rate would raise financing cost reduce opportunity extract equity home refinancings home equity loan see downside risk prospect consumption spending housing construction,-1
491,2/2/05,number participants noted continued modest gains employment though commented that based anecdotal information job growth seemed picked late,number participant note continued modest gain employment though comment that base anecdotal information job growth seem picked late,1
492,2/2/05,increase aggregate demand expected sufficient coming quarters allow rate unemployment continue edge lower even people return labor force,increase aggregate demand expect sufficient come quarter allow rate unemployment continue edge low even people return labor force,1
496,2/2/05,despite pickup costs participants thought rate core inflation likely would remain low stable assuming removal policy accommodation,despite pickup cost participant thought rate core inflation likely would remain low stable assume removal policy accommodation,-1
497,2/2/05,elevated price markups profits well slack resource use helped absorb cost increases put downward pressure inflation would likely continue so,elevate price markup profit well slack resource use help absorb cost increase put downward pressure inflation would likely continue so,-1
498,2/2/05,indeed core inflation measures eased off latest readings balance second half  relative first half,indeed core inflation measure ease off late reading balance second half relative first half,-1
499,2/2/05,however several participants suggested possibility upward skew distribution inflation outcomes especially appreciable declines foreign exchange value dollar structural productivity growth already participants hearing anecdotal reports firms increased ability pass cost increases product prices perhaps increasing confidence outlook economic expansion,however several participant suggest possibility upward skew distribution inflation outcome especially appreciable decline foreign exchange value dollar structural productivity growth already participant hearing anecdotal report firm increase ability pas cost increase product price perhaps increase confidence outlook economic expansion,1
500,2/2/05,members judged quarter point firming target federal funds rate appropriate light current overall accommodative financial conditions continuing outlook solid economic growth diminished slack resource utilization,member judged quarter point firm target federal fund rate appropriate light current overall accommodative financial condition continue outlook solid economic growth diminish slack resource utilization,1
501,2/2/05,concurred statement note output appeared growing moderate pace despite rise energy prices labor market conditions continued improve gradually inflation longerterm inflation expectations remained wellcontained,concur statement note output appear grow moderate pace despite rise energy price labor market condition continued improve gradually inflation longerterm inflation expectation remain wellcontained,1
503,2/2/05,underlying inflation expected relatively low committee believes policy accommodation removed pace likely measured,underlie inflation expect relatively low committee believe policy accommodation remove pace likely measure,-1
505,8/9/05,information received meeting suggested final demand expanded solid pace second quarter led surge net exports another robust gain residential investment business investment consumer spending rose moderate rates,information receive meeting suggest final demand expand solid pace second quarter lead surge net export another robust gain residential investment business investment consumer spending rise moderate rate,1
506,8/9/05,labor market continued improve gradually june july,labor market continued improve gradually june july,1
507,8/9/05,core cpi pce prices decelerated recent months notable increases earlier year,core cpi pce price decelerate recent month notable increase earlier year,-1
508,8/9/05,crude oil prices continued rise reaching record levels nominal terms intermeeting period,crude oil price continued rise reach record level nominal term intermeeting period,1
509,8/9/05,payroll employment grew june july pace roughly par preceding six months,payroll employment grow june july pace roughly par precede six month,1
510,8/9/05,mortgage rates remained low house prices apparently continued rise briskly,mortgage rate remain low house price apparently continued rise briskly,-1
512,8/9/05,gdp growth number major foreign industrial economies appeared slowed bit second quarter,gdp growth number major foreign industrial economy appear slow bit second quarter,-1
514,8/9/05,consumer energy prices reversed small part previous runup core consumer inflation remained low,consumer energy price reverse small part previous runup core consumer inflation remain low,-1
515,8/9/05,survey measures near term inflation expectations edged july longer term inflation expectations firmed touch,survey measure near term inflation expectation edge july longer term inflation expectation firm touch,-1
516,8/9/05,addition committee noted expansion remained firm labor market conditions continued improve gradually that although pressures inflation remained elevated longer term inflation expectations remained well contained,addition committee note expansion remain firm labor market condition continued improve gradually that although pressure inflation remain elevate longer term inflation expectation remain well contain,1
517,8/9/05,yields inflation indexed treasury securities rose touch less nominal counterparts leaving inflation compensation slightly higher,yield inflation indexed treasury security rise touch less nominal counterpart leave inflation compensation slightly high,1
518,8/9/05,despite recent slow growth velocity remained low relative level would expected based historical relationship opportunity cost,despite recent slow growth velocity remain low relative level would expect base historical relationship opportunity cost,-1
520,8/9/05,time however trimmed growth rate forecast  reflecting effects higher energy prices higher long term interest rates somewhat slower growth productive capacity implied annual revisions national accounts,time however trim growth rate forecast reflect effect high energy price high long term interest rate somewhat slow growth productive capacity imply annual revision national account,-1
521,8/9/05,addition high rising energy prices adding pressures overall inflation energy price increases probably would feed through least temporarily core measures inflation,addition high rise energy price add pressure overall inflation energy price increase probably would feed through least temporarily core measure inflation,1
522,8/9/05,nonetheless core inflation recently relatively low inflation expectations remained well contained,nonetheless core inflation recently relatively low inflation expectation remain well contain,-1
523,8/9/05,however elevated energy prices seen likely significant drag consumption and net household spending expected advance moderate pace,however elevate energy price see likely significant drag consumption and net household spending expect advance moderate pace,1
524,8/9/05,participants generally anticipated pace home price appreciation would slow time though timing extent slowing well implications consumer spending quite uncertain,participant generally anticipate pace home price appreciation would slow time though timing extent slow well implication consumer spending quite uncertain,-1
525,8/9/05,participants viewed increases market interest rates intermeeting period appropriate response stronger economic outlook,participant view increase market interest rate intermeeting period appropriate response strong economic outlook,1
526,8/9/05,participants voiced concerns still low interest rates insufficient recognition investors dependency committees policy expectations economic data continuing foster inappropriate degree risktaking financial markets,participant voiced concern still low interest rate insufficient recognition investor dependency committee policy expectation economic data continue foster inappropriate degree risktaking financial market,1
527,8/9/05,another participant mentioned however recent sluggish growth monetary aggregates suggested stance policy not overly accommodative,another participant mention however recent sluggish growth monetary aggregate suggest stance policy not overly accommodative,-1
528,8/9/05,although uncertainties underlying pace productivity increases trends labor force participation level potential output complicated inflation outlook higher energy prices reduced resource slack seen pointing elevated inflation pressures,although uncertainty underlie pace productivity increase trend labor force participation level potential output complicate inflation outlook high energy price reduce resource slack see point elevate inflation pressure,1
529,8/9/05,recent monthly readings indicated core inflation subdued number participants noted underlying core inflation appeared running pace around upper end range viewed consistent price stability an assessment reinforced recent upward revisions historical data core pce inflation,recent monthly reading indicate core inflation subdue number participant note underlie core inflation appear run pace around upper end range view consistent price stability an assessment reinforce recent upward revision historical data core pce inflation,-1
530,8/9/05,participants commented increase inflation recent rates could especially adverse effects longer run economic performance,participant comment increase inflation recent rate could especially adverse effect longer run economic performance,1
534,8/9/05,despite rise oil prices quickening pace economic activity market survey based measures inflation expectations seemed remain quite well anchored,despite rise oil price quicken pace economic activity market survey based measure inflation expectation seem remain quite well anchor,1
535,8/9/05,even action federal funds rate would remain level members anticipated would prove necessary contain inflation pressures keep output near potential thus likelihood policy action would required,even action federal fund rate would remain level member anticipate would prove necessary contain inflation pressure keep output near potential thus likelihood policy action would require,1
536,8/9/05,members agreed appropriate acknowledge recent relatively low monthly rates core inflation also emphasize inflation pressures remained elevated,member agree appropriate acknowledge recent relatively low monthly rate core inflation also emphasize inflation pressure remain elevate,1
538,5/3/05,information received meeting suggested growth economic activity unexpectedly moderated first quarter rapid pace seen second half ,information receive meeting suggest growth economic activity unexpectedly moderate first quarter rapid pace see second half,1
539,5/3/05,consumers appeared turned somewhat cautious spending likely reflection higher energy prices,consumer appear turn somewhat cautious spending likely reflection high energy price,1
540,5/3/05,sharp increases energy prices pushed headline inflation core measures also somewhat elevated,sharp increase energy price push headline inflation core measure also somewhat elevate,1
541,5/3/05,factors underlying consumer spending also remained favorable real wages salaries continued rise ratio wealth income remained high although bit decline equity prices,factor underlie consumer spending also remain favorable real wage salary continued rise ratio wealth income remain high although bit decline equity price,1
542,5/3/05,house prices continued rise rapidly first quarter although recent data suggested slowing,house price continued rise rapidly first quarter although recent data suggest slow,1
544,5/3/05,us consumer price inflation firmed recent months energy prices rose sharply,u consumer price inflation firm recent month energy price rise sharply,1
545,5/3/05,core consumer prices also rose bit rapidly recently increase twelve months ending march little different year earlier period,core consumer price also rise bit rapidly recently increase twelve month end march little different year earlier period,1
546,5/3/05,according survey information expectations near term inflation picked march consistent increase energy prices,accord survey information expectation near term inflation picked march consistent increase energy price,1
549,5/3/05,committee also noted economic output continued grow solid pace despite rise energy prices labor market conditions continued improve gradually,committee also note economic output continued grow solid pace despite rise energy price labor market condition continued improve gradually,1
550,5/3/05,pressures inflation picked recent months pricing power evident longer term inflation expectations remained well contained,pressure inflation picked recent month pricing power evident longer term inflation expectation remain well contain,1
552,5/3/05,interest rates however rose reportedly response statements references increased price pressures evident pricing power well committees conditioning risk assessment appropriate monetary policy action,interest rate however rise reportedly response statement reference increase price pressure evident pricing power well committee conditioning risk assessment appropriate monetary policy action,1
553,5/3/05,despite generally good first quarter earnings reports equity indexes moved considerably response signs weaker economic growth,despite generally good first quarter earnings report equity index move considerably response sign weaker economic growth,-1
