,Date,Original,Corpus,Class
297,30/6/04,members noted persisting overall strength housing might extent response expectations increases mortgage rates implying slowdown might likely later year,member note persist overall strength housing might extent response expectation increase mortgage rate imply slowdown might likely later year,-1
299,30/6/04,many state local governments increasing spending rapidly response brightening budget situations,many state local government increase spending rapidly response brightening budget situation,-1
300,30/6/04,expanding foreign economies depreciation dollar expected foster appreciable growth us exports imports still considerably larger exports external sector likely make measurable negative contribution us gdp growth year next,expand foreign economy depreciation dollar expect foster appreciable growth u export import still considerably large export external sector likely make measurable negative contribution u gdp growth year next,1
301,30/6/04,inflation side higher import prices and importantly rise domestic imported oil prices adding domestic inflationary pressures although improving oil supplies recently contributed somewhat lower domestic gasoline prices,inflation side high import price and importantly rise domestic import oil price add domestic inflationary pressure although improve oil supply recently contribute somewhat low domestic gasoline price,1
302,30/6/04,recent developments notably persistence solid gains output employment along indications increase inflation seen warranting first step process removing policy accommodation,recent development notably persistence solid gain output employment along indication increase inflation see warrant first step process remove policy accommodation,1
305,30/6/04,partly reflecting anticipated monetary policy actions financial market conditions tightened recent months shortterm interest rates quite low especially judged recent level inflation,partly reflect anticipate monetary policy action financial market condition tighten recent month shortterm interest rate quite low especially judged recent level inflation,-1
309,30/6/04,underlying inflation still expected relatively low committee believes policy accommodation removed pace likely measured,underlie inflation still expect relatively low committee believe policy accommodation remove pace likely measure,-1
311,13/12/05,information reviewed meeting suggested economy continued expand solid rate fourth quarter,information review meeting suggest economy continued expand solid rate fourth quarter,1
313,13/12/05,core consumer price inflation remained subdued even though increase energy costs apparently passed prices final goods services,core consumer price inflation remain subdue even though increase energy cost apparently pass price final good service,-1
314,13/12/05,survey measures individuals expectations future labor market conditions improved november largely reversing post katrina declines,survey measure individual expectation future labor market condition improve november largely reverse post katrina decline,1
317,13/12/05,core consumer price inflation moderate recent months although signs passthrough higher energy costs evident especially transportation services,core consumer price inflation moderate recent month although sign passthrough high energy cost evident especially transportation service,1
318,13/12/05,consumer energy prices retreated notably elevated post hurricane levels,consumer energy price retreat notably elevate post hurricane level,1
319,13/12/05,wholesale retail gasoline prices dropped gasoline inventories rebounded,wholesale retail gasoline price drop gasoline inventory rebound,-1
321,13/12/05,longer term inflation expectations also edged down stayed touch narrow range observed recent years,longer term inflation expectation also edge down stayed touch narrow range observe recent year,-1
322,13/12/05,although recent increases energy costs pushed producer prices sectors overall producer price inflation remained subdued,although recent increase energy cost push producer price sector overall producer price inflation remain subdue,-1
323,13/12/05,although cumulative rise energy costs potential add inflation pressures core inflation relatively low recent months longerterm inflation expectations remained contained,although cumulative rise energy cost potential add inflation pressure core inflation relatively low recent month longerterm inflation expectation remain contain,-1
326,13/12/05,major equity price indexes posted substantial gains spurred perception economy retained considerable momentum limited inflation pressures,major equity price index post substantial gain spur perception economy retain considerable momentum limited inflation pressure,-1
328,13/12/05,overall core consumer price inflation projected move higher first half next year reflecting effects higher energy prices trend lower effects ebb,overall core consumer price inflation project move high first half next year reflect effect high energy price trend low effect ebb,1
332,13/12/05,nonetheless growth solid prices energy products still well levels earlier year possible increases resource utilization potential add pressures prices especially absence firming policy,nonetheless growth solid price energy product still well level earlier year possible increase resource utilization potential add pressure price especially absence firm policy,1
333,13/12/05,slowing house price increases restraining expansion consumption moderation pace new building expected reduce growth aggregate demand somewhat coming quarters,slow house price increase restrain expansion consumption moderation pace new building expect reduce growth aggregate demand somewhat come quarter,-1
335,13/12/05,supportive financial conditions apparent increase confidence contributed pickup growth abroad,supportive financial condition apparent increase confidence contribute pickup growth abroad,1
336,13/12/05,discussion prices participants indicated concerns nearterm inflation pressures eased somewhat intermeeting period,discussion price participant indicate concern nearterm inflation pressure ease somewhat intermeeting period,-1
337,13/12/05,recent data suggested that thus far indirect effects elevated energy prices core inflation muted,recent data suggest that thus far indirect effect elevate energy price core inflation mute,-1
338,13/12/05,moreover energy prices generally fallen back balance since earlier fall much increases inflation expectations posted aftermath hurricanes reversed,moreover energy price generally fall back balance since earlier fall much increase inflation expectation post aftermath hurricane reverse,1
339,13/12/05,nonetheless surveys anecdotal reports suggested firms successfully passing least portion increased costs customers many participants remained concerned elevated energy prices could put pressure core inflation,nonetheless survey anecdotal report suggest firm successfully passing least portion increase cost customer many participant remain concerned elevate energy price could put pressure core inflation,1
340,13/12/05,also view number participants economy possibly producing neighborhood potential persistent strength spending late suggested resource markets could tighten inflation pressures build,also view number participant economy possibly produce neighborhood potential persistent strength spending late suggest resource market could tighten inflation pressure build,1
341,13/12/05,circumstances policy accommodative time inflation expectations could rise monetary policy not seen responding contain risks,circumstance policy accommodative time inflation expectation could rise monetary policy not see respond contain risk,1
342,13/12/05,spending apparently retaining considerable momentum indirect effects increased energy prices still threatening raise core inflation least time committee thought additional policy firming meeting appropriate keep inflation inflation expectations check,spending apparently retain considerable momentum indirect effect increase energy price still threaten raise core inflation least time committee thought additional policy firm meeting appropriate keep inflation inflation expectation check,1
343,13/12/05,however would also take account effects sustained period favorable financial conditions asset prices aggregate demand well resulting possibility increases resource utilization pressures prices,however would also take account effect sustain period favorable financial condition asset price aggregate demand well result possibility increase resource utilization pressure price,1
345,13/12/05,inflation longterm inflation expectations remained contained committee agreed announcement indicate possible increases resource utilization well elevated energy prices potential add inflation pressures some measured policy firming likely needed keep risks attainment sustainable economic growth price stability roughly balance,inflation longterm inflation expectation remain contain committee agree announcement indicate possible increase resource utilization well elevate energy price potential add inflation pressure some measure policy firm likely need keep risk attainment sustainable economic growth price stability roughly balance,1
347,20/9/05,business investment appeared losing momentum labor markets continued improve increases core cpi pce prices modest notable increases earlier year,business investment appear lose momentum labor market continued improve increase core cpi pce price modest notable increase earlier year,1
348,20/9/05,oil gasoline prices however rise spiking record levels days immediately following hurricane,oil gasoline price however rise spike record level day immediately follow hurricane,1
349,20/9/05,strong overall spending along lackluster real income growth put downward pressure saving rate,strong overall spending along lackluster real income growth put downward pressure save rate,-1
350,20/9/05,survey measures consumer confidence early august generally consistent solid increases spending confidence fell appreciably period immediately storm,survey measure consumer confidence early august generally consistent solid increase spending confidence fell appreciably period immediately storm,-1
352,20/9/05,gdp growth foreign industrial economies picked up balance second quarter performance across economies mixed,gdp growth foreign industrial economy picked up balance second quarter performance across economy mixed,1
353,20/9/05,core consumer price inflation remained benign july august,core consumer price inflation remain benign july august,-1
354,20/9/05,however surge energy prices considerably boosted overall consumer price inflation months,however surge energy price considerably boost overall consumer price inflation month,1
355,20/9/05,gasoline prices particular rose steeply august survey data pointed larger increase early september,gasoline price particular rise steeply august survey data point large increase early september,1
356,20/9/05,producer price inflation subdued,producer price inflation subdue,-1
361,20/9/05,yields inflation indexed treasury securities fell bit nominal counterparts leaving inflation compensation slightly higher,yield inflation indexed treasury security fell bit nominal counterpart leave inflation compensation slightly high,1
362,20/9/05,growth bank credit surged loans expanded briskly,growth bank credit surge loan expand briskly,1
364,20/9/05,growth economy expected recover meeting participants concerned price pressures elevated storm could climb further primarily result additional increases energy prices,growth economy expect recover meeting participant concerned price pressure elevate storm could climb far primarily result additional increase energy price,1
367,20/9/05,several participants voiced concern effects hurricane likely add already considerable pressures prices,several participant voiced concern effect hurricane likely add already considerable pressure price,1
368,20/9/05,nation whole participants noted household spending fairly robust hurricane supported strong advances income continuing gains wealth reflected part large increases home prices,nation whole participant note household spending fairly robust hurricane support strong advance income continue gain wealth reflect part large increase home price,1
369,20/9/05,although uncertainties outlook spending increased appeared that time consumption would probably expand moderate pace perhaps little pace income growth increases house prices slowed historically typical rates,although uncertainty outlook spending increase appear that time consumption would probably expand moderate pace perhaps little pace income growth increase house price slow historically typical rate,1
370,20/9/05,although apparent sluggishness could reflect short term fluctuations volatile data series evidence suggested may also stemmed concern among business executives effects high energy prices,although apparent sluggishness could reflect short term fluctuation volatile data series evidence suggest may also stem concern among business executive effect high energy price,1
373,20/9/05,participants concerns inflation prospects generally increased intermeeting period,participant concern inflation prospect generally increase intermeeting period,1
374,20/9/05,surge energy prices particular boosting overall inflation increase would probably pass time core prices,surge energy price particular boost overall inflation increase would probably pas time core price,1
375,20/9/05,posed risk could persistent influence inflation inflation expectations rise,pose risk could persistent influence inflation inflation expectation rise,1
377,20/9/05,measures labor costs giving conflicting signals indexes indicating growth labor compensation remained relatively low another showing appreciably rapid increases,measure labor cost give conflict signal index indicate growth labor compensation remain relatively low another show appreciably rapid increase,-1
378,20/9/05,prices number intermediate goods including wide range petrochemical products building materials subject upward pressure reflecting high crude oil prices production disruptions energy sector elevated demands materials anticipation rebuilding gulf coast region,price number intermediate good include wide range petrochemical product building material subject upward pressure reflect high crude oil price production disruption energy sector elevate demand material anticipation rebuild gulf coast region,1
379,20/9/05,still core inflation recent months quite damped market based measures longerterm inflation expectations risen modestly late,still core inflation recent month quite damped marketbased measure longerterm inflation expectation risen modestly late,1
380,20/9/05,observed that early  pass through energy prices core inflation quite limited suggesting that current circumstances core inflation could stay relatively low overall inflation would probably drop back inflation expectations remained contained,observe that early pass through energy price core inflation quite limited suggest that current circumstance core inflation could stay relatively low overall inflation would probably drop back inflation expectation remain contain,-1
381,20/9/05,although uncertainty increased committees judgment fundamental factors influencing longer term path economy probably not affected hurricane upside risks inflation appeared increased,although uncertainty increase committee judgment fundamental factor influence longer term path economy probably not affected hurricane upside risk inflation appear increase,1
382,20/9/05,even todays action federal funds rate would likely level would necessary contain inflationary pressures rate increases probably would required,even today action federal fund rate would likely level would necessary contain inflationary pressure rate increase probably would require,1
384,20/9/05,although energy prices potential add inflation pressures inflation expectations recently exhibited signs increasing members agreed risks inflation well growth remained essentially balanced assumption appropriate policy action,although energy price potential add inflation pressure inflation expectation recently exhibit sign increase member agree risk inflation well growth remain essentially balance assumption appropriate policy action,1
387,11/10/04,information received meeting suggested economy expanded moderate pace third quarter,information receive meeting suggest economy expand moderate pace third quarter,1
388,11/10/04,low interest rates helped maintain buoyant housing market spending consumers businesses firm,low interest rate help maintain buoyant housing market spending consumer business firm,-1
389,11/10/04,inflation measures continued low levels september,inflation measure continued low level september,-1
390,11/10/04,employment increases particularly large financial services sectors,employment increase particularly large financial service sector,1
391,11/10/04,however small decline registered employment manufacturing sector,however small decline register employment manufacturing sector,-1
392,11/10/04,despite strong increase payroll employment household survey indicated slight increase unemployment rate ,despite strong increase payroll employment household survey indicate slight increase unemployment rate,-1
393,11/10/04,consumer spending advanced strongly third quarter sluggish pace second quarter,consumer spending advanced strongly third quarter sluggish pace second quarter,-1
395,11/10/04,spending services steady third quarter average advanced september boost electricity consumption related unseasonably warm weather,spending service steady third quarter average advanced september boost electricity consumption related unseasonably warm weather,1
396,11/10/04,business investment spending equipment software continued expand rapid pace third quarter supported positive fundamentals included robust business output low interest rates readily available credit healthy business balance sheets,business investment spending equipment software continued expand rapid pace third quarter support positive fundamental include robust business output low interest rate readily available credit healthy business balance sheet,-1
398,11/10/04,us international trade deficit rose third quarter average reflecting weakening growth service exports increase price quantity petroleum imports,u international trade deficit rise third quarter average reflect weaken growth service export increase price quantity petroleum import,-1
399,11/10/04,consumer prices continued advance moderate rate recent months although overall core consumer price measures rose bit faster twelve months ending september  year earlier period,consumer price continued advance moderate rate recent month although overall core consumer price measure rise bit faster twelve month end september year earlier period,1
400,11/10/04,expectations near term inflation picked october consistent increase energy prices,expectation near term inflation picked october consistent increase energy price,1
401,11/10/04,labor costs continued rise moderately,labor cost continued rise moderately,1
402,11/10/04,increase employment cost index private compensation third quarter bit average pace last two years,increase employment cost index private compensation third quarter bit average pace last two year,1
404,11/10/04,committee noted expectation underlying rate inflation would continue low policy accommodation could removed pace likely measured also stated would nonetheless respond changes economic prospects needed fulfill obligation maintain price stability,committee note expectation underlie rate inflation would continue low policy accommodation could remove pace likely measure also state would nonetheless respond change economic prospect need fulfill obligation maintain price stability,1
405,11/10/04,expectations boosted release strong employment data october,expectation boost release strong employment data october,1
406,11/10/04,shift markets outlook monetary policy contributed noticeable upward pressure short term interest rates long term rates also moved up,shift market outlook monetary policy contribute noticeable upward pressure short term interest rate long term rate also move up,-1
407,11/10/04,growth restrained recent months increases opportunity cost,growth restrain recent month increase opportunity cost,-1
408,11/10/04,economy expected advance coming year rate bit longer run potential pace hiring firm unemployment rate edge lower,economy expect advance come year rate bit longer run potential pace hire firm unemployment rate edge low,1
409,11/10/04,response rising real incomes consumer spending forecast strengthen early part next year,response rise real income consumer spending forecast strengthen early part next year,1
410,11/10/04,recent data anecdotal information suggested spending businesses households reasonably robust late supported accommodative financial conditions continuing gains productivity increasing employment,recent data anecdotal information suggest spending business household reasonably robust late support accommodative financial condition continue gain productivity increase employment,1
411,11/10/04,looking forward economic fundamentals appeared favorable continued solid growth fiscal stimulus would abate next year flattening energy prices markets seemed anticipate would bolster economic expansion,look forward economic fundamental appear favorable continued solid growth fiscal stimulus would abate next year flatten energy price market seem anticipate would bolster economic expansion,1
413,11/10/04,core consumer price inflation quite damped average recent months longer term inflation expectations remained well anchored despite increases energy prices prospective increases near term headline inflation,core consumer price inflation quite damped average recent month longer term inflation expectation remain well anchor despite increase energy price prospective increase near term headline inflation,-1
414,11/10/04,however even taking account likely effects higher oil prices pace overall business investment spending still boosting gdp growth somewhat less might expected given accommodative financial conditions tax incentives,however even take account likely effect high oil price pace overall business investment spending still boost gdp growth somewhat less might expect give accommodative financial condition tax incentive,-1
415,11/10/04,recent slower rate price declines hightech products implied softer underlying pace technological change outlook investment demand prospects persisting high trend growth productivity could damped relative previous expectations,recent slow rate price decline hightech product imply softer underlie pace technological change outlook investment demand prospect persist high trend growth productivity could damped relative previous expectation,-1
417,11/10/04,comments fiscal policy committee members indicated expectation economic stimulus provided recent years discretionary fiscal measures likely fade next year,comment fiscal policy committee member indicate expectation economic stimulus provide recent year discretionary fiscal measure likely fade next year,-1
418,11/10/04,however foreign economic growth moderating large excess imports exports members generally viewed prospects net exports likely provide continuing drag us economic expansion,however foreign economic growth moderate large excess import export member generally view prospect net export likely provide continue drag u economic expansion,1
419,11/10/04,one implication outlook us external indebtedness relative gdp would increasing further,one implication outlook u external indebtedness relative gdp would increase far,1
420,11/10/04,nevertheless many firms evidently remained slow expand hiring part rising benefit costs,nevertheless many firm evidently remain slow expand hire part rise benefit cost,-1
421,11/10/04,one member commented performance key industries citing evidence job losses since business cycle peak driven primarily weak demand rather productivity improvements,one member comment performance key industry cite evidence job loss since business cycle peak driven primarily weak demand rather productivity improvement,-1
423,11/10/04,longer term inflation expectations remained reasonably low helping restrain spillover elevated energy prices prices goods services,longer term inflation expectation remain reasonably low help restrain spillover elevate energy price price good service,-1
424,11/10/04,members noted remaining resource slack would probably exert downward pressure inflation depreciation dollar seemed muted effect import prices date,member note remain resource slack would probably exert downward pressure inflation depreciation dollar seem mute effect import price date,-1
425,11/10/04,however upside risks inflation outlook included possible depreciation dollar increases energy prices,however upside risk inflation outlook include possible depreciation dollar increase energy price,1
427,11/10/04,policymakers concurred statement indicate output appears growing moderate pace despite rise energy prices labor market conditions improved inflation longerterm inflation expectations remain well contained,policymakers concur statement indicate output appear grow moderate pace despite rise energy price labor market condition improve inflation longerterm inflation expectation remain well contain,1
428,11/10/04,underlying inflation expected relatively low committee believes policy accommodation removed pace likely measured,underlie inflation expect relatively low committee believe policy accommodation remove pace likely measure,-1
