,Date,Original,Corpus,Class
2,25/6/03,considerable uncertainty surrounded individual policy option members agreed effectiveness alternative tools along  basis points conventional easing still available would allow monetary policy combat economic weakness forestall unexpected tendency pernicious deflation develop,considerable uncertainty surround individual policy option member agree effectiveness alternative tool along basis point conventional ease still available would allow monetary policy combat economic weakness forestall unexpected tendency pernicious deflation develop,-1
3,25/6/03,information reviewed meeting suggested economy continued expand subpar pace recent months,information review meeting suggest economy continued expand subpar pace recent month,1
4,25/6/03,consumer spending increased moderately housing activity held high level government outlays grew substantially,consumer spending increase moderately housing activity held high level government outlay grow substantially,1
5,25/6/03,consumer price inflation remained low level,consumer price inflation remain low level,-1
6,25/6/03,time fundamentals underlying household spending became favorable real disposable income posted solid gains stock market consumer confidence recovered earlier year,time fundamental underlie household spending become favorable real disposable income post solid gain stock market consumer confidence recover earlier year,1
7,25/6/03,real gdp growth major foreign industrial countries remained weak first quarter external demand sagged amid heightened geopolitical uncertainties,real gdp growth major foreign industrial country remain weak first quarter external demand sag amid heighten geopolitical uncertainty,-1
8,25/6/03,sharp declines energy prices pulled overall consumer prices april may core consumer prices edged up,sharp decline energy price pull overall consumer price april may core consumer price edge up,-1
9,25/6/03,year over year basis however core consumer price inflation eased noticeably,year over year basis however core consumer price inflation ease noticeably,-1
10,25/6/03,core producer price inflation also declined year ending may,core producer price inflation also decline year end may,-1
12,25/6/03,committee discussed postmeeting release press stating next quarters upside downside risks attainment sustainable growth roughly equal that contrast period probability unwelcome substantial fall inflation though minor exceeded pickup inflation already low level,committee discuss postmeeting release press state next quarter upside downside risk attainment sustainable growth roughly equal that contrast period probability unwelcome substantial fall inflation though minor exceed pickup inflation already low level,-1
14,25/6/03,however splitting balance risks statement separate assessments growth inflation addition noting concern possible decline inflation already low level led market participants mark expectations federal funds rate,however splitting balance risk statement separate assessment growth inflation addition note concern possible decline inflation already low level lead market participant mark expectation federal fund rate,-1
15,25/6/03,equity prices buoyed decline bond yields well improved outlook economic growth registered sizable gains intermeeting period,equity price buoyed decline bond yield well improve outlook economic growth register sizable gain intermeeting period,1
16,25/6/03,long term interest rates fell major industrial economies equity prices rose substantially,long term interest rate fell major industrial economy equity price rise substantially,1
17,25/6/03,staff forecast prepared meeting suggested economic expansion would strengthen substantially year progressed,staff forecast prepared meeting suggest economic expansion would strengthen substantially year progress,1
20,25/6/03,given ongoing slack resource utilization downward pressure core price inflation expected forecast period,give ongoing slack resource utilization downward pressure core price inflation expect forecast period,-1
21,25/6/03,committees discussion current prospective economic developments members referred signs improvement sectors economy saw no conclusive evidence appreciable overall strengthening sluggish economic expansion,committee discussion current prospective economic development member refer sign improvement sector economy saw no conclusive evidence appreciable overall strengthen sluggish economic expansion,-1
22,25/6/03,concurrently however weakness persisted business capital expenditures members continued view critical factor inhibiting economic expansion,concurrently however weakness persist business capital expenditure member continued view critical factor inhibit economic expansion,-1
23,25/6/03,looking ahead emphasized favorable underlying conditions place support substantial acceleration expansion though timing dimensions significantly improved economic performance remained uncertain,look ahead emphasize favorable underlie condition place support substantial acceleration expansion though timing dimension significantly improve economic performance remain uncertain,-1
24,25/6/03,positive factors bearing outlook mentioned members included accommodative stance monetary policy supportive financial conditions generally persistence rapid growth labor productivity sizable declines energy prices elevated levels earlier year indications rising consumer confidence less negative business sentiment,positive factor bearing outlook mention member include accommodative stance monetary policy supportive financial condition generally persistence rapid growth labor productivity sizable decline energy price elevate level earlier year indication rise consumer confidence less negative business sentiment,-1
25,25/6/03,substantially reduced output gap would undoubtedly preclude significant acceleration inflation could well cause inflation edge already low level,substantially reduce output gap would undoubtedly preclude significant acceleration inflation could well cause inflation edge already low level,-1
26,25/6/03,time substantial decline inflation viewed low probability though disinflation would remain matter concern sustained pickup overall economic activity firmly established,time substantial decline inflation view low probability though disinflation would remain matter concern sustain pickup overall economic activity firmly establish,-1
31,25/6/03,expected result would relatively prompt sizable boost consumer expenditures and time business spending,expect result would relatively prompt sizable boost consumer expenditure and time business spending,-1
33,25/6/03,members also noted measures taken many state local governments raise taxes trim spending order resolve fiscal crises would offset uncertainthough view smallpart federal sector stimulus period ahead,member also note measure take many state local government raise tax trim spending order resolve fiscal crisis would offset uncertainthough view smallpart federal sector stimulus period ahead,1
36,25/6/03,number members nonetheless cited faint signs positive investment prospects though not currently increasing investment expenditures gleaned anecdotal commentary responses recent capital spending surveys,number member nonetheless cite faint sign positive investment prospect though not currently increase investment expenditure glean anecdotal commentary response recent capital spending survey,-1
37,25/6/03,general members anticipated current restraints business investment spending would lift slowly expansion gathered momentum business caution investing hiring diminished response increasing demand,general member anticipate current restraint business investment spending would lift slowly expansion gather momentum business caution invest hire diminish response increase demand,-1
38,25/6/03,consumer spending though elevated grown reduced pace recent quarters members generally saw acceleration likely not inevitable prospect,consumer spending though elevate grown reduce pace recent quarter member generally saw acceleration likely not inevitable prospect,1
39,25/6/03,favorable factors referenced members included indications growing consumer confidence effects rising stock market wealth consumer balance sheets continued opportunities many consumers extract equity appreciated value homes reduce interest service burdens refinancing mortgages fundamentally continuing uptrend disposable personal incomes associated part robust gains labor productivity,favorable factor reference member include indication grow consumer confidence effect rise stock market wealth consumer balance sheet continued opportunity many consumer extract equity appreciate value home reduce interest service burden refinance mortgage fundamentally continue uptrend disposable personal income associate part robust gain labor productivity,1
40,25/6/03,members nonetheless raised note caution regarding potential strength consumer spending,member nonetheless raise note caution regard potential strength consumer spending,1
41,25/6/03,commented particular lack significant job growth resulting persisting business reluctance hire new workers could undermine consumer confidence spending point though noted little evidence yet,comment particular lack significant job growth result persist business reluctance hire new worker could undermine consumer confidence spending point though note little evidence yet,-1
42,25/6/03,economy thought likely continue operate potential extended period productivity growth expected remain robust members believed current low inflation environment would persist next several quarters indeed disinflation could store,economy thought likely continue operate potential extend period productivity growth expect remain robust member believe current low inflation environment would persist next several quarter indeed disinflation could store,-1
46,25/6/03,circumstances given currently large margins unemployed labor resources members agreed easing move desirable provide additional insurance stronger economy would fact materialize,circumstance give currently large margin unemployed labor resource member agree ease move desirable provide additional insurance strong economy would fact materialize,-1
47,25/6/03,members noted may meeting contemplated need easing action meeting unless compelling evidence developed interim hopedfor acceleration economic activity clearly way,member note may meeting contemplate need ease action meeting unless compelling evidence developed interim hopedfor acceleration economic activity clearly way,-1
48,25/6/03,members saw virtually no prospect proposed easing though would reinforce already accommodative monetary policy would incur significant risk contributing rising inflationary pressures even strengthening economy proved somewhat greater incorporated forecasts,member saw virtually no prospect propose ease though would reinforce already accommodative monetary policy would incur significant risk contribute rise inflationary pressure even strengthen economy prove somewhat great incorporate forecast,1
49,25/6/03,indeed proposed reduction nominal federal funds rate would offset apparent increase real federal funds rate stemming recent decline inflation,indeed propose reduction nominal federal fund rate would offset apparent increase real federal fund rate stem recent decline inflation,-1
50,25/6/03,views cited favor  percentage point easing included emergence firmer signs possible upturn economic activity nearterm prospect substantial added fiscal stimulus already accommodative stance monetary policy,view cite favor percentage point ease include emergence firmer sign possible upturn economic activity nearterm prospect substantial add fiscal stimulus already accommodative stance monetary policy,-1
51,25/6/03,case larger  basis point reduction target federal funds rate focused desirability relatively forceful policy move would likely promote strengthening economic expansion time provide greater assurance countering significant disinflation,case large basis point reduction target federal fund rate focus desirability relatively forceful policy move would likely promote strengthen economic expansion time provide great assurance counter significant disinflation,-1
52,25/6/03,one member interpreted recent economic developments providing fairly persuasive indications upturn expansion already way saw merit keeping policy unchanged not oppose  percentage point easing,one member interpret recent economic development provide fairly persuasive indication upturn expansion already way saw merit keep policy unchanged not oppose percentage point ease,-1
53,25/6/03,concerning press statement released public shortly todays meeting members agreed include reference signs firming economic activity highlight key factors underlying members outlook robust economic performance time,concern press statement release public shortly today meeting member agree include reference sign firm economic activity highlight key factor underlie member outlook robust economic performance time,1
54,25/6/03,nonetheless inflation could edge lower committee needed cognizant risk substantial disinflation could potentially adverse effects,nonetheless inflation could edge low committee need cognizant risk substantial disinflation could potentially adverse effect,-1
55,25/6/03,regard committees assessment risks incorporated press release members generally agreed risks goal sustainable economic growth balanced next quarters probability appreciable disinflation already low level inflation exceeded probability rise inflation,regard committee assessment risk incorporate press release member generally agree risk goal sustainable economic growth balance next quarter probability appreciable disinflation already low level inflation exceed probability rise inflation,-1
56,25/6/03,federal open market committee seeks monetary financial conditions foster price stability promote sustainable growth output,federal open market committee seek monetary financial condition foster price stability promote sustainable growth output,1
58,25/6/03,mr parry dissented preferred  basis point reduction federal funds rate target insurance continued sluggishness economic activity declines inflation measures undesirably low rates,mr parry dissent prefer basis point reduction federal fund rate target insurance continued sluggishness economic activity decline inflation measure undesirably low rate,-1
59,25/6/03,moreover current slack labor product markets likely persist time even significant pickup real gdp growth prospect threatened reduce inflation further,moreover current slack labor product market likely persist time even significant pickup real gdp growth prospect threaten reduce inflation far,-1
60,25/6/03,finally recent declines inflation expectations raised real federal funds rate,finally recent decline inflation expectation raise real federal fund rate,-1
61,5/6/03,information reviewed meeting suggested economic activity continued grow subpar pace recent months,information review meeting suggest economic activity continued grow subpar pace recent month,1
62,5/6/03,consumer spending advanced slightly first quarter housing activity remained high level business investment slowed,consumer spending advanced slightly first quarter housing activity remain high level business investment slow,1
63,5/6/03,industrial production sluggish additional slack accumulated labor market,industrial production sluggish additional slack accumulate labor market,-1
65,5/6/03,initial claims unemployment insurance remained elevated level suggesting labor market weakness may,initial claim unemployment insurance remain elevate level suggest labor market weakness may,-1
67,5/6/03,recent indicators suggested continued sluggish economic growth foreign industrial nations,recent indicator suggest continued sluggish economic growth foreign industrial nation,-1
68,5/6/03,core consumer price inflation moved first quarter already low level,core consumer price inflation move first quarter already low level,-1
69,5/6/03,sharp run up energy prices however pushed overall consumer prices first quarter year ended march measured consumer price index chain type personal consumption expenditure index,sharp run up energy price however push overall consumer price first quarter year end march measure consumer price index chain type personal consumption expenditure index,1
70,5/6/03,producer prices also boosted significantly jump energy prices recent months,producer price also boost significantly jump energy price recent month,1
71,5/6/03,core producer prices appreciably first quarter slower pace overall producer prices,core producer price appreciably first quarter slow pace overall producer price,1
73,5/6/03,committee agreed indicate announcement light unusually large uncertainties clouding geopolitical situation short run apparent effects economic decisionmaking could not time usefully characterize current balance risks respect prospects longrun goals price stability sustainable economic growth,committee agree indicate announcement light unusually large uncertainty cloud geopolitical situation short run apparent effect economic decisionmaking could not time usefully characterize current balance risk respect prospect longrun goal price stability sustainable economic growth,-1
74,5/6/03,noted recent economic data mixed hesitancy economic expansion appeared owe significantly oil price premiums aspects geopolitical uncertainties,note recent economic data mixed hesitancy economic expansion appear owe significantly oil price premium aspect geopolitical uncertainty,1
75,5/6/03,committee believed uncertainties lifted accommodative stance monetary policy coupled ongoing growth productivity would provide vital support toward fostering improving economic performance time,committee believe uncertainty lift accommodative stance monetary policy couple ongoing growth productivity would provide vital support toward foster improve economic performance time,-1
77,5/6/03,growth slowed march april deceleration appeared attributable temporary tax related flows funds,growth slow march april deceleration appear attributable temporary tax related flow fund,-1
78,5/6/03,reduced growth april reflected part slower than average buildups deposits associated final tax payments individuals,reduce growth april reflect part slower than average buildup deposit associate final tax payment individual,-1
79,5/6/03,staff forecast prepared meeting continued suggest economic expansion would sluggish near term,staff forecast prepared meeting continued suggest economic expansion would sluggish near term,-1
80,5/6/03,addition continued slow economic growth nations major trading partners would tend restrain us exports though restraints expected abate time,addition continued slow economic growth nation major trading partner would tend restrain u export though restraint expect abate time,-1
82,5/6/03,consequence slowly improving outlook sales profits low financing costs temporary federal tax incentive investment new equipment software expected gradually boost business investment spending,consequence slowly improve outlook sale profit low financing cost temporary federal tax incentive investment new equipment software expect gradually boost business investment spending,-1
83,5/6/03,improved environment members anticipated nearterm sluggishness economic growth would give way vigorous expansion year progressed,improve environment member anticipate nearterm sluggishness economic growth would give way vigorous expansion year progress,-1
84,5/6/03,support expectation noted substantial gains financial markets experienced recently persisted experience indicated stronger economic performance generally would follow,support expectation note substantial gain financial market experienced recently persist experience indicate strong economic performance generally would follow,1
86,5/6/03,continued progress lifting various constraints economic growth including unwinding excessive misdirected capital expenditures undertaken earlier years steps taken address corporate governance credit problems also working strengthen expansion,continued progress lift various constraint economic growth include unwind excessive misdirect capital expenditure undertaken earlier year step take address corporate governance credit problem also work strengthen expansion,1
87,5/6/03,backdrop noteworthy many private sector forecasters predicted pronounced upturn economic growth third quarter,backdrop noteworthy many private sector forecaster predict pronounce upturn economic growth third quarter,1
88,5/6/03,despite underlying factors seemed increasingly conducive accelerating expansion members noted timing vigor pickup economic activity remained uncertain especially context persistently high degree caution business community regard investment hiring decisions,despite underlie factor seem increasingly conducive accelerate expansion member note timing vigor pickup economic activity remain uncertain especially context persistently high degree caution business community regard investment hire decision,1
89,5/6/03,members anticipated inflation would remain low level extended period indeed probability disinflation higher pickup inflation given current high levels excess capacity labor product markets seemed likely diminish gradually,member anticipate inflation would remain low level extend period indeed probability disinflation high pickup inflation give current high level excess capacity labor product market seem likely diminish gradually,-1
90,5/6/03,business fixed investment remained key factor prospects overall economic activity persisting weakness spending association gloomy sentiment high degree risk aversion among business decision makers not bode well capital investment outlook least near term,business fix investment remain key factor prospect overall economic activity persist weakness spending association gloomy sentiment high degree risk aversion among business decision makers not bode well capital investment outlook least near term,-1
95,5/6/03,however budgets numerous state local governments remained severe pressure efforts contain spending raise taxes governments would offset federal stimulus year next,however budget numerous state local government remain severe pressure effort contain spending raise tax government would offset federal stimulus year next,1
96,5/6/03,weakening dollar sluggish economic conditions abroad key factors impinging prospective contribution foreign sector us economic activity,weaken dollar sluggish economic condition abroad key factor impinge prospective contribution foreign sector u economic activity,-1
98,5/6/03,even assuming pickup expansion economic activity line current forecasts year next excess capacity labor product markets would remain elevated might well foster disinflation coming quarters,even assume pickup expansion economic activity line current forecast year next excess capacity labor product market would remain elevate might well foster disinflation come quarter,1
99,5/6/03,decline inflation might limited extent depreciated value dollar foreign exchange markets anticipated effects large increases worker benefit costs,decline inflation might limited extent depreciate value dollar foreign exchange market anticipate effect large increase worker benefit cost,-1
100,5/6/03,given pressure considerable amount unused resources adverse developments held economic expansion would increase probability disinflation,give pressure considerable amount unused resource adverse development held economic expansion would increase probability disinflation,1
103,5/6/03,members acknowledged case could made easing policy immediately light generally disappointing reports recent performance economy ongoing disinflation trend period already low inflation forecasts persisting excess capacity,member acknowledge case could make ease policy immediately light generally disappoint report recent performance economy ongoing disinflation trend period already low inflation forecast persist excess capacity,-1
104,5/6/03,members cautioned persisting uncertainty regarding economic trends not provide basis prolonged inaction light risks disinflation subpar economic growth,member caution persist uncertainty regard economic trend not provide basis prolong inaction light risk disinflation subpar economic growth,-1
105,5/6/03,recognized usual summary statement not allow circumstances committee saw probability albeit minor significant decline inflation unwelcome level,recognize usual summary statement not allow circumstance committee saw probability albeit minor significant decline inflation unwelcome level,-1
106,5/6/03,discussion members generally agreed separate sentences indicating risks goal sustainable economic growth balanced probability disinflation already low level exceeded pickup inflation,discussion member generally agree separate sentence indicate risk goal sustainable economic growth balance probability disinflation already low level exceed pickup inflation,-1
108,22/3/05,consumer spending still appeared growing briskly residential construction expenditures continued move higher,consumer spending still appear grow briskly residential construction expenditure continued move high,1
109,22/3/05,consumer prices moved higher january unchanged december,consumer price move high january unchanged december,1
111,22/3/05,meanwhile consumer price inflation across industrial economies remained subdued,meanwhile consumer price inflation across industrial economy remain subdue,-1
112,22/3/05,core consumer prices rose bit faster overall prices price increases widespread across commodities services,core consumer price rise bit faster overall price price increase widespread across commodity service,1
