,Date,Original,Corpus,Class
116,22/3/05,intermeeting period however chairmans semi annual testimony monetary policy higher oil prices incoming data showed pickup price inflation led market participants mark expectations trajectory target federal funds rate,intermeeting period however chairman semi annual testimony monetary policy high oil price incoming data show pickup price inflation lead market participant mark expectation trajectory target federal fund rate,1
117,22/3/05,increase nominal rates likely owed higher inflation expectations inflation compensation measured spread treasury nominal debt comparable inflation indexed securities rose,increase nominal rate likely owe high inflation expectation inflation compensation measure spread treasury nominal debt comparable inflation indexed security rise,1
119,22/3/05,growth slowed first two months year opportunity cost holding money rose monetary policy tightening,growth slow first two month year opportunity cost hold money rise monetary policy tighten,-1
120,22/3/05,staff forecast prepared meeting economy seen likely expand rate growth potential year next led strong business demand equipment software,staff forecast prepared meeting economy see likely expand rate growth potential year next lead strong business demand equipment software,1
122,22/3/05,measures overall consumer price inflation expected lower year last step next year energy prices retreated,measure overall consumer price inflation expect low year last step next year energy price retreat,1
123,22/3/05,inflation core consumer prices seen boosted bit effects higher import energy costs near term still largely contained continued strong growth underlying labor productivity remaining slack resource markets,inflation core consumer price see boost bit effect high import energy cost near term still largely contain continued strong growth underlie labor productivity remain slack resource market,1
124,22/3/05,particular incoming data anecdotal information indicated economic activity appreciably forward momentum previously perceived inflation pressures could intensifying,particular incoming data anecdotal information indicate economic activity appreciably forward momentum previously perceive inflation pressure could intensify,1
129,22/3/05,business contacts indicated high level energy prices spurring coal mining activity,business contact indicate high level energy price spur coal mining activity,1
130,22/3/05,commented failure labor force participation rise expected expansion gained momentum likely portended somewhat weaker labor force growth previously anticipated development margin would tend reduce expansion potential output,comment failure labor force participation rise expect expansion gain momentum likely portend somewhat weaker labor force growth previously anticipate development margin would tend reduce expansion potential output,-1
139,22/3/05,noted concern recent elevated readings inflation prices core personal consumption expenditures producer price index indicators prices earlier stages production well sizable increase energy prices,note concern recent elevate reading inflation price core personal consumption expenditure producer price index indicator price earlier stage production well sizable increase energy price,1
140,22/3/05,nonetheless many participants stated expected total inflation diminish rise core consumer inflation limited,nonetheless many participant state expect total inflation diminish rise core consumer inflation limited,-1
141,22/3/05,one source upward pressure inflation rise energy prices seemed reasonable expect prices would level even decline mildly built futures prices,one source upward pressure inflation rise energy price seem reasonable expect price would level even decline mildly built future price,1
144,22/3/05,short term inflation expectations risen somewhat longer term inflation expectations remained well contained,short term inflation expectation risen somewhat longer term inflation expectation remain well contain,1
145,22/3/05,lastly monetary policy would aimed preserving price stability,lastly monetary policy would aim preserve price stability,1
148,22/3/05,also anecdotal indications price increases becoming common across number industries,also anecdotal indication price increase become common across number industry,1
149,22/3/05,business executives reportedly believed that aggregate demand expanding robustly lower foreign exchange value dollar putting upward pressure import prices degree pricing power returned,business executive reportedly believe that aggregate demand expand robustly low foreign exchange value dollar put upward pressure import price degree pricing power return,1
151,22/3/05,several participants indicated that current circumstances viewed upside surprise inflation potentially harmful equivalent downside surprise partly outcome could well impart additional upward momentum inflation expectations,several participant indicate that current circumstance view upside surprise inflation potentially harmful equivalent downside surprise partly outcome could well impart additional upward momentum inflation expectation,1
155,22/3/05,rise energy prices however not notably fed core consumer prices,rise energy price however not notably fed core consumer price,1
160,29/1/03,information reviewed meeting suggested economic growth slow fourth quarter,information review meeting suggest economic growth slow fourth quarter,-1
162,29/1/03,core consumer price inflation continued decline end year,core consumer price inflation continued decline end year,-1
163,29/1/03,private nonfarm payroll employment fell december lowest level since september ,private nonfarm payroll employment fell december low level since september,-1
167,29/1/03,residential housing activity remained strong end year despite continued sluggish employment additional declines household wealth,residential housing activity remain strong end year despite continued sluggish employment additional decline household wealth,-1
169,29/1/03,available information economic activity abroad fourth quarter suggested slower growth average major foreign economies,available information economic activity abroad fourth quarter suggest slow growth average major foreign economy,-1
170,29/1/03,however sizable runup energy prices last year boosted overall consumer price inflation somewhat year over year basis,however sizable runup energy price last year boost overall consumer price inflation somewhat year over year basis,1
171,29/1/03,producer level core prices finished goods declined november december year whole jump energy prices pushed overall producer prices finished goods slightly,producer level core price finish good decline november december year whole jump energy price push overall producer price finish good slightly,-1
175,29/1/03,market worries growing tensions iraq north korea appeared key factor concerns downbeat tone recent us economic data potential vulnerability dollar general pullback international capital damped market sentiment,market worry grow tension iraq north korea appear key factor concern downbeat tone recent u economic data potential vulnerability dollar general pullback international capital damped market sentiment,-1
177,29/1/03,staff forecast prepared meeting suggested expansion economic activity would muted near term,staff forecast prepared meeting suggest expansion economic activity would mute near term,1
184,29/1/03,forecasts envisaged strengthening economic recovery not one likely induce material any decline unemployment rate year ahead,forecast envisage strengthen economic recovery not one likely induce material any decline unemployment rate year ahead,-1
187,29/1/03,circumstances easing point current uncertainties strengthening confidence induce inventory rebuilding positive implications least time expansion economic activity,circumstance ease point current uncertainty strengthen confidence induce inventory rebuild positive implication least time expansion economic activity,1
189,29/1/03,time members expressed concern potential adverse effects consumer incomes confidence stagnant conditions persist labor markets equity markets weaken further,time member express concern potential adverse effect consumer income confidence stagnant condition persist labor market equity market weaken far,-1
193,29/1/03,largely reflecting expectations ongoing albeit diminishing slack labor product markets members anticipated consumer price inflation probably would edge next several quarters already low level,largely reflect expectation ongoing albeit diminish slack labor product market member anticipate consumer price inflation probably would edge next several quarter already low level,-1
195,29/1/03,regard labor costs members cited anecdotal evidence persisting weakness numerous regional labor markets and given current reluctance employers add workforces prospect job gains labor compensation would tend lag anticipated strengthening economic activity often past,regard labor cost member cite anecdotal evidence persist weakness numerous regional labor market and give current reluctance employer add workforce prospect job gain labor compensation would tend lag anticipate strengthen economic activity often past,1
196,29/1/03,economy continued grow slowly monetary policy overall financial conditions remained accommodative prospects appreciable strengthening economic expansion time favorable,economy continued grow slowly monetary policy overall financial condition remain accommodative prospect appreciable strengthen economic expansion time favorable,1
197,29/1/03,point committee could not rule range plausible economic outcomes including possibility persisting subpar economic performance much stronger forecast acceleration expansion,point committee could not rule range plausible economic outcome include possibility persist subpar economic performance much strong forecast acceleration expansion,1
200,5/4/04,information reviewed meeting suggested economy expanded rapid pace first quarter,information review meeting suggest economy expand rapid pace first quarter,1
201,5/4/04,consumer spending housing market continued exhibit strength,consumer spending housing market continued exhibit strength,1
202,5/4/04,labor market displayed signs improvement quarter capped significant increase private payrolls march,labor market displayed sign improvement quarter capped significant increase private payroll march,1
203,5/4/04,recent increases prices imports commodities showed pickup core consumer price inflation first quarter although categories registered large gains posted unusually small increases earlier,recent increase price import commodity show pickup core consumer price inflation first quarter although category register large gain post unusually small increase earlier,1
204,5/4/04,labor market showed renewed vigor first quarter,labor market show renew vigor first quarter,1
207,5/4/04,moreover unemployment rate ticked ,moreover unemployment rate ticked,-1
208,5/4/04, percent march labor force participation rate remained low,percent march labor force participation rate remain low,-1
209,5/4/04,real consumer spending grew somewhat faster pace first quarter fourth quarter,real consumer spending grow somewhat faster pace first quarter fourth quarter,1
213,5/4/04,united states core consumer price index advanced faster rate first quarter fourth quarter reflecting passthrough higher energy prices leveling goods prices sizable declines last year,united state core consumer price index advanced faster rate first quarter fourth quarter reflect passthrough high energy price leveling good price sizable decline last year,1
214,5/4/04,higher goods price inflation owed part recent runup prices nonoil imports energy commodities,high good price inflation owe part recent runup price nonoil import energy commodity,1
215,5/4/04,price index core personal consumption expenditures also rose faster rate first quarter late last year,price index core personal consumption expenditure also rise faster rate first quarter late last year,1
216,5/4/04,despite rise inflation year however cumulative increase overall consumer price index year ending march somewhat less advance twelve months ending march ,despite rise inflation year however cumulative increase overall consumer price index year end march somewhat less advance twelve month end march,1
217,5/4/04,year ending march increase price index total personal consumption expenditures similar year earlier,year end march increase price index total personal consumption expenditure similar year earlier,1
218,5/4/04,announcement decision committee indicated upside downside risks sustainable growth roughly equal probability unwelcome fall inflation declined almost equal rise,announcement decision committee indicate upside downside risk sustainable growth roughly equal probability unwelcome fall inflation decline almost equal rise,-1
219,5/4/04,yields inflation indexed treasury securities rose almost much implying inflation compensation edged little higher,yield inflation indexed treasury security rise almost much imply inflation compensation edge little high,1
223,5/4/04,rise mortgage rates not likely show demand housing second half  expected partially offset longer term rising employment personal income,rise mortgage rate not likely show demand housing second half expect partially offset longer term rise employment personal income,1
224,5/4/04,increases employment income also projected continue boost consumer spending,increase employment income also project continue boost consumer spending,1
225,5/4/04,light recent increases price measures staff anticipated transitory rise pace core inflation near term,light recent increase price measure staff anticipate transitory rise pace core inflation near term,1
226,5/4/04,however expected remaining slack resource utilization strong productivity growth would keep core inflation low level forecast period,however expect remain slack resource utilization strong productivity growth would keep core inflation low level forecast period,-1
228,5/4/04,statistical releases confirmed consumer spending rising brisk rate housing activity remained high level business fixed investment growing vigorously,statistical release confirm consumer spending rise brisk rate housing activity remain high level business fix investment grow vigorously,1
229,5/4/04,regarding outlook inflation members took particular note recent data pointing jumps consumer producer prices,regard outlook inflation member take particular note recent data point jump consumer producer price,1
231,5/4/04,still members saw low inflation likely outcome,still member saw low inflation likely outcome,-1
233,5/4/04,also optimism regarding economic prospects among business executives seemed mounting no doubt prompted part increased demand experiencing robust growth profits,also optimism regard economic prospect among business executive seem mount no doubt prompt part increase demand experience robust growth profit,1
235,5/4/04,members viewed household sector continuing play key role expansion recent data well anecdotal information indicating consumer spending rising solid pace,member view household sector continue play key role expansion recent data well anecdotal information indicate consumer spending rise solid pace,1
236,5/4/04,addition housing activity stayed strong across nation still climbing regions reports growing backlogs deliveries substantial price increases markets,addition housing activity stayed strong across nation still climb region report grow backlog delivery substantial price increase market,1
239,5/4/04,external sector expected provide limited support us economic growth next two years,external sector expect provide limited support u economic growth next two year,-1
240,5/4/04,members saw risk growth certain rapidly expanding regions abroad could slow perhaps sharply potentially significant effects demand us exports well global commodity prices,member saw risk growth certain rapidly expand region abroad could slow perhaps sharply potentially significant effect demand u export well global commodity price,1
241,5/4/04,significant number committee members reported information contacts businesses increasingly able pass cost increases customers boost prices generally,significant number committee member report information contact business increasingly able pas cost increase customer boost price generally,1
242,5/4/04,members cited instances earlier price discounts canceled noted surcharges higher energy steel prices added base prices certain goods,member cite instance earlier price discount cancel note surcharge high energy steel price add base price certain good,1
244,5/4/04,degree recent uptick various price measures partly reflected factors jumps prices energy nonoil imports unlikely repeated,degree recent uptick various price measure partly reflect factor jump price energy nonoil import unlikely repeat,1
245,5/4/04,also recent evidence could interpreted indicating surprisingly sharp decline measured inflation  exaggerated drop underlying rate inflation,also recent evidence could interpret indicate surprisingly sharp decline measure inflation exaggerated drop underlie rate inflation,-1
247,5/4/04,others however less confident degree restraint prices noting inflation predictions based estimated output employment gaps subject considerable error,others however less confident degree restraint price note inflation prediction base estimate output employment gap subject considerable error,1
248,5/4/04,moreover evidence significant acceleration hiring still limited members referred possibility growth could falter particularly market yields rise sharply further,moreover evidence significant acceleration hire still limited member refer possibility growth could falter particularly market yield rise sharply far,-1
250,5/4/04,probable persistence slack economy least several quarters together likelihood recent substantial gains productivity would extended continue exert slight downward pressures inflation,probable persistence slack economy least several quarter together likelihood recent substantial gain productivity would extend continue exert slight downward pressure inflation,-1
251,5/4/04,time though recent stronger than expected increases number price measures anecdotal information suggesting greater ability businesses implement sustain price hikes multiplying signs solid economic growth suggested upside risks inflation increased,time though recent stronger than expected increase number price measure anecdotal information suggest great ability business implement sustain price hike multiply sign solid economic growth suggest upside risk inflation increase,1
252,5/4/04,committee also discussed length advantages disadvantages modifying dropping statement announcement following march meeting with inflation quite low resource use slack committee believes patient removing policy accommodation,committee also discuss length advantage disadvantage modify drop statement announcement follow march meeting with inflation quite low resource use slack committee believe patient remove policy accommodation,-1
255,5/4/04,juncture inflation quite low resource use slack committee believes policy accommodation removed pace likely measured,juncture inflation quite low resource use slack committee believe policy accommodation remove pace likely measure,-1
258,30/6/04,information reviewed meeting suggested economy continued expand solid pace second quarter,information review meeting suggest economy continued expand solid pace second quarter,1
259,30/6/04,although growth consumer spending appeared slowed somewhat demand housing increased robust first quarter pace,although growth consumer spending appear slow somewhat demand housing increase robust first quarter pace,-1
260,30/6/04,labor market improved quarter large gains employment registered april may,labor market improve quarter large gain employment register april may,1
261,30/6/04,core consumer price inflation picked up reflecting part pass through substantial advances energy prices non energy import prices,core consumer price inflation picked up reflect part pass through substantial advance energy price non energy import price,1
264,30/6/04,growth real consumer spending appeared slowed somewhat recent months first quarter pace,growth real consumer spending appear slow somewhat recent month first quarter pace,-1
265,30/6/04,home prices also continued rise rapid pace contributing importantly increases household wealth,home price also continued rise rapid pace contribute importantly increase household wealth,1
271,30/6/04,consumer price inflation turned year low rates registered  overall measures exclude food energy,consumer price inflation turn year low rate register overall measure exclude food energy,-1
272,30/6/04,overall consumer prices rose quickly core prices reflecting direct contributions substantial increases prices food energy,overall consumer price rise quickly core price reflect direct contribution substantial increase price food energy,1
273,30/6/04,stepup core inflation also due part pass through higher energy import costs core consumer prices,stepup core inflation also due part pass through high energy import cost core consumer price,1
274,30/6/04,survey measures short term inflation expectations moved higher recent months longer term expectations remained reasonably well contained,survey measure short term inflation expectation move high recent month longer term expectation remain reasonably well contain,1
279,30/6/04,growth slowed appreciably first half june,growth slow appreciably first half june,-1
280,30/6/04,commercial bank credit decelerated may reflecting contraction bank holdings securities slowdown growth loans,commercial bank credit decelerate may reflect contraction bank holding security slowdown growth loan,-1
281,30/6/04,slowing loan growth concentrated mainly real estate credits due partly heavy securitizations,slow loan growth concentrate mainly real estate credit due partly heavy securitizations,-1
282,30/6/04,staff forecast prepared meeting suggested economy would continue expand solid pace ,staff forecast prepared meeting suggest economy would continue expand solid pace,-1
284,30/6/04,firms shedding unusual caution past years large additions payrolls next several quarters anticipated followed gradual moderation rate increase employment,firm shed unusual caution past year large addition payroll next several quarter anticipate follow gradual moderation rate increase employment,1
286,30/6/04,core inflation projected fall back later year pace first five months remain low  transitory effects higher energy non oil import prices waned,core inflation project fall back later year pace first five month remain low transitory effect high energy non oil import price wan,-1
287,30/6/04,members saw persistence relatively vigorous expansion overall economic activity likely prospect context continuing stimulus fiscal monetary policies accommodative financial conditions growing business optimism favorable consumer sentiment robust increases productivity,member saw persistence relatively vigorous expansion overall economic activity likely prospect context continue stimulus fiscal monetary policy accommodative financial condition grow business optimism favorable consumer sentiment robust increase productivity,1
288,30/6/04,solid increases economic activity employment turn provide ongoing support business consumer spending,solid increase economic activity employment turn provide ongoing support business consumer spending,1
289,30/6/04,light strength economic activity recent indications somewhat increased price pressures members focused particular attention outlook inflation,light strength economic activity recent indication somewhat increase price pressure member focus particular attention outlook inflation,1
290,30/6/04,referred statistical anecdotal evidence whole pointed recent acceleration consumer prices increase nearterm inflation expectations,refer statistical anecdotal evidence whole point recent acceleration consumer price increase nearterm inflation expectation,1
291,30/6/04,factors cited regard included large increases prices energy intermediate materials appeared passing least part core consumer prices,factor cite regard include large increase price energy intermediate material appear passing least part core consumer price,1
293,30/6/04,regard prospective course inflation members suggested rise core inflation recent months appeared resulted might well prove transitory factors notably including increases energy import prices not seen likely persist indeed might partially reversed,regard prospective course inflation member suggest rise core inflation recent month appear result might well prove transitory factor notably include increase energy import price not see likely persist indeed might partially reverse,1
294,30/6/04,anticipated noticeable deceleration emphasized contribution onetime price increases boosted inflation recently persisting albeit diminishing margins unemployed labor productive resources anticipation strong gains productivity declines markups goods prices costs steady longterm inflation expectations,anticipate noticeable deceleration emphasize contribution onetime price increase boost inflation recently persist albeit diminish margin unemployed labor productive resource anticipation strong gain productivity decline markup good price cost steady longterm inflation expectation,1
