,Date,Original,Corpus,Class
0,2007-06-28,economic growth appears moderate first half year despite ongoing adjustment housing sector,economic growth appear moderate first half year despite ongoing adjustment housing sector,0
1,2007-06-28,economy seems likely continue expand moderate pace coming quarters,economy seem likely continue expand moderate pace come quarter,0
2,2007-06-28,readings core inflation improved modestly recent months,reading core inflation improve modestly recent month,0
3,2007-06-28,however sustained moderation inflation pressures yet convincingly demonstrated,however sustain moderation inflation pressure yet convincingly demonstrate,0
4,2007-06-28,circumstances committee predominant policy concern remains risk inflation fail moderate expected,circumstance committee predominant policy concern remains risk inflation fail moderate expect,0
5,2007-06-28,future policy adjustments depend evolution outlook inflation economic growth implied incoming information,future policy adjustment depend evolution outlook inflation economic growth imply incoming information,0
