,Date,Original,Corpus,Class
78,2000-12-19,regard consensus favor moving assessment risks weighted toward rising inflation one weighted toward economic weakness no intermediate issuance balanced risks assessment members observed change likely viewed relatively rapid shift observers,regard consensus favor move assessment risk weight toward rise inflation one weight toward economic weakness no intermediate issuance balance risk assessment member observe change likely view relatively rapid shift observer,0
79,2000-12-19,nonetheless committee reasons not easing today deemed persuasive members shifting statement economic risks seemed clearly justified recent developments,nonetheless committee reason not ease today deem persuasive member shift statement economic risk seem clearly justified recent development,0
80,2000-12-19,one view even though risks weakening economy increased statement balanced risks would preferable moderation expansion might well fail materialize,one view even though risk weaken economy increase statement balance risk would preferable moderation expansion might well fail materialize,0
81,2000-12-19,federal open market committee seeks monetary financial conditions foster price stability promote sustainable growth output,federal open market committee seek monetary financial condition foster price stability promote sustainable growth output,0
82,2000-12-19,background long run goals price stability sustainable economic growth information currently available committee believes risks weighted mainly toward conditions may generate economic weakness foreseeable future,background long run goal price stability sustainable economic growth information currently available committee believe risk weight mainly toward condition may generate economic weakness foreseeable future,0
83,2000-12-19,meeting december   committee contemplated possibility ongoing economic financial developments might warrant reassessment stance monetary policy prior next scheduled meeting late january,meeting december committee contemplate possibility ongoing economic financial development might warrant reassessment stance monetary policy prior next schedule meeting late january,0
84,2000-12-19,information become available since december meeting tended confirm economic expansion continued weaken,information become available since december meeting tend confirm economic expansion continued weaken,0
85,2000-12-19,retail sales appreciably business expectations holiday season despite pickup latter half december apparently largely induced price discounting sales motor vehicles evidenced significant weakness month progressed,retail sale appreciably business expectation holiday season despite pickup latter half december apparently largely induced price discounting sale motor vehicle evidence significant weakness month progress,0
86,2000-12-19,business confidence appeared deteriorated since december meeting amid widespread reports reductions planned production capital spending,business confidence appear deteriorate since december meeting amid widespread report reduction plan production capital spending,0
87,2000-12-19,elevated energy costs continuing drain consumer purchasing power adding costs many business firms adverse effects profits stock market valuations,elevate energy cost continue drain consumer purchasing power add cost many business firm adverse effect profit stock market valuation,0
88,2000-12-19,moreover expansion weakened economic activity might remain soft near term longer term outlook reasonably sustained economic expansion supported easier financial conditions response investment consumption rising productivity living standards still quite good,moreover expansion weaken economic activity might remain soft near term longer term outlook reasonably sustain economic expansion support easy financial condition response investment consumption rise productivity living standard still quite good,0
89,2000-12-19,inflation expectations appeared declining businesses continuing encounter marked even increased resistance efforts raise prices,inflation expectation appear decline business continue encounter marked even increase resistance effort raise price,0
90,2000-12-19,federal open market committee seeks monetary financial conditions foster price stability promote sustainable growth output,federal open market committee seek monetary financial condition foster price stability promote sustainable growth output,0
91,2000-12-19,background long run goals price stability sustainable economic growth information currently available committee believes risks weighted mainly toward conditions may generate economic weakness foreseeable future,background long run goal price stability sustainable economic growth information currently available committee believe risk weight mainly toward condition may generate economic weakness foreseeable future,0
