,Date,Original,Corpus,Class
80,2003-06-25,moreover  basis point reduction associated communication committee view risks achieving objectives economic activity balanced might mistakenly interpreted view members signal committee come end policy easing moves judgment not prepared make time,moreover basis point reduction associate communication committee view risk achieve objective economic activity balance might mistakenly interpret view member signal committee come end policy ease move judgment not prepared make time,0
81,2003-06-25,case larger  basis point reduction target federal funds rate focused desirability relatively forceful policy move would likely promote strengthening economic expansion time provide greater assurance countering significant disinflation,case large basis point reduction target federal fund rate focus desirability relatively forceful policy move would likely promote strengthen economic expansion time provide great assurance counter significant disinflation,0
82,2003-06-25,one member interpreted recent economic developments providing fairly persuasive indications upturn expansion already way saw merit keeping policy unchanged not oppose  percentage point easing,one member interpret recent economic development provide fairly persuasive indication upturn expansion already way saw merit keep policy unchanged not oppose percentage point ease,0
83,2003-06-25,concerning press statement released public shortly today meeting members agreed include reference signs firming economic activity highlight key factors underlying members outlook robust economic performance time,concern press statement release public shortly today meeting member agree include reference sign firm economic activity highlight key factor underlie member outlook robust economic performance time,0
84,2003-06-25,nonetheless inflation could edge lower committee needed cognizant risk substantial disinflation could potentially adverse effects,nonetheless inflation could edge low committee need cognizant risk substantial disinflation could potentially adverse effect,0
85,2003-06-25,regard committee assessment risks incorporated press release members generally agreed risks goal sustainable economic growth balanced next quarters probability appreciable disinflation already low level inflation exceeded probability rise inflation,regard committee assessment risk incorporate press release member generally agree risk goal sustainable economic growth balance next quarter probability appreciable disinflation already low level inflation exceed probability rise inflation,0
86,2003-06-25,federal open market committee seeks monetary financial conditions foster price stability promote sustainable growth output,federal open market committee seek monetary financial condition foster price stability promote sustainable growth output,0
87,2003-06-25,risks committee outlook sustainable economic growth next several quarters balanced risks outlook inflation next several quarters weighted toward downside and taken together balance risks objectives weighted toward downside foreseeable future,risk committee outlook sustainable economic growth next several quarter balance risk outlook inflation next several quarter weight toward downside and take together balance risk objective weight toward downside foreseeable future,0
88,2003-06-25,mr parry dissented preferred  basis point reduction federal funds rate target insurance continued sluggishness economic activity declines inflation measures undesirably low rates,mr parry dissent prefer basis point reduction federal fund rate target insurance continued sluggishness economic activity decline inflation measure undesirably low rate,0
89,2003-06-25,moreover current slack labor product markets likely persist time even significant pickup real gdp growth prospect threatened reduce inflation further,moreover current slack labor product market likely persist time even significant pickup real gdp growth prospect threaten reduce inflation far,0
90,2003-06-25,finally recent declines inflation expectations raised real federal funds rate,finally recent decline inflation expectation raise real federal fund rate,0
91,2003-06-25,attended portion meeting relating discussion economic developments,attend portion meeting relate discussion economic development,0
