,Date,Original,Corpus,Class
79,2009-01-28,fiscal stimulus bill considered congress committee met would support state local government spending well boost federal spending helping buoy demands goods services,fiscal stimulus bill consider congress committee met would support state local government spending well boost federal spending help buoy demand good service,0
80,2009-01-28,participants generally thought fiscal stimulus necessary important complement steps federal reserve agencies taking would help foster economic recovery questions details proposed legislation extent would boost demands production goods services,participant generally thought fiscal stimulus necessary important complement step federal reserve agency take would help foster economic recovery question detail propose legislation extent would boost demand production good service,0
81,2009-01-28,participants indicated surprised speed magnitude slowdown economic growth abroad resulting drop demands exports,participant indicate surprised speed magnitude slowdown economic growth abroad result drop demand export,0
82,2009-01-28,moreover participants not expect foreign economies rebound quickly suggesting net exports would not provide much supports economic activity coming quarters,moreover participant not expect foreign economy rebound quickly suggest net export would not provide much support economic activity come quarter,0
83,2009-01-28,participants agreed inflation pressures diminished appreciably recent quarters expected significantly lower headline core inflation next years recent years,participant agree inflation pressure diminish appreciably recent quarter expect significantly low headline core inflation next year recent year,0
84,2009-01-28,indeed anticipated inflation slow time rates somewhat lower judge consistent dual goals price stability maximum employment initially reflecting recent declines prices energy commodities later responding several years substantial economic slack,indeed anticipate inflation slow time rate somewhat low judge consistent dual goal price stability maximum employment initially reflect recent decline price energy commodity later respond several year substantial economic slack,0
85,2009-01-28,many participants noted risk protracted period excessively low inflation especially inflation expectations move response lower actual inflation increasing economic slack even saw risk deflation,many participant note risk protract period excessively low inflation especially inflation expectation move response low actual inflation increase economic slack even saw risk deflation,0
86,2009-01-28,several others however anticipated longer run inflation expectations would remain well anchored supported part federal reserve aggressive expansion balance sheet resulting growth monetary base therefore thought unlikely inflation would decline levels saw consistent dual goals price stability maximum employment,several others however anticipate longer run inflation expectation would remain well anchor support part federal reserve aggressive expansion balance sheet result growth monetary base therefore thought unlikely inflation would decline level saw consistent dual goal price stability maximum employment,0
87,2009-01-28,moreover noted risk expected inflation might actually increase undesirably high level public not understand federal reserve liquidity facilities wound balance sheet shrink economic financial conditions improve,moreover note risk expect inflation might actually increase undesirably high level public not understand federal reserve liquidity facility wound balance sheet shrink economic financial condition improve,0
88,2009-01-28,several participants indicated thought fomc explore establishing quantitative guidelines targets monetary aggregate perhaps growth rate monetary base view guidelines would provide useful information public help anchor inflation expectations,several participant indicate thought fomc explore establish quantitative guideline target monetary aggregate perhaps growth rate monetary base view guideline would provide useful information public help anchor inflation expectation,0
89,2009-01-28,also agreed continue using liquidity asset purchase programs support functioning financial markets stimulate economy,also agree continue use liquidity asset purchase program support function financial market stimulate economy,0
90,2009-01-28,several expressed willingness expand size duration purchases near future others stood ready expand program conditions warrant noted program recently implemented preferred wait information economic financial developments program effects considering expansion,several express willingness expand size duration purchase near future others stood ready expand program condition warrant note program recently implement prefer wait information economic financial development program effect consider expansion,0
91,2009-01-28,information received since committee met december suggests economy weakened further,information receive since committee met december suggests economy weaken far,0
92,2009-01-28,industrial production housing starts employment continued decline steeply consumers businesses cut back spending,industrial production housing start employment continued decline steeply consumer business cut back spending,0
93,2009-01-28,committee anticipates gradual recovery economic activity begin later year downside risks outlook significant,committee anticipates gradual recovery economic activity begin later year downside risk outlook significant,0
94,2009-01-28,light declines prices energy commodities recent months prospects considerable economic slack committee expects inflation pressures remain subdued coming quarters,light decline price energy commodity recent month prospect considerable economic slack committee expect inflation pressure remain subdue come quarter,0
95,2009-01-28,moreover committee sees risk inflation could persist time rates best foster economic growth price stability longer term,moreover committee see risk inflation could persist time rate best foster economic growth price stability longer term,0
96,2009-01-28,conference callon january   committee met conference call discuss issues associated establishing explicit numerical objective inflation,conference callon january committee met conference call discus issue associate establish explicit numerical objective inflation,0
97,2009-01-28,meeting participants expressed view explicit numerical objective longer run inflation would fully consistent federal reserve dual mandate promoting maximum employment price stability would not impede fostering stability financial system,meeting participant express view explicit numerical objective longer run inflation would fully consistent federal reserve dual mandate promote maximum employment price stability would not impede foster stability financial system,0
98,2009-01-28,number participants emphasized additional clarity longer run inflation goal would enhance federal reserve communications would not involve substantive change monetary policy strategy,number participant emphasize additional clarity longer run inflation goal would enhance federal reserve communication would not involve substantive change monetary policy strategy,0
99,2009-01-28,many participants agreed establishing maintaining transparent numerical inflation objective would helpful least degree anchoring inflation expectations thereby improve overall effectiveness monetary policy others judged potential benefits explicit numerical inflation objective might largely attained extending horizon regular projections economic activity inflation,many participant agree establish maintain transparent numerical inflation objective would helpful least degree anchor inflation expectation thereby improve overall effectiveness monetary policy others judged potential benefit explicit numerical inflation objective might largely attain extend horizon regular projection economic activity inflation,0
100,2009-01-28,indicated establishment numerical inflation objective could particularly helpful present circumstances forestalling unwelcome decline longer run inflation expectations hence contributing economic recovery also assuring public actions taken counter economic weakness not lead high inflation longer run,indicate establishment numerical inflation objective could particularly helpful present circumstance forestall unwelcome decline longer run inflation expectation hence contribute economic recovery also assure public action take counter economic weakness not lead high inflation longer run,0
101,2009-01-28,however several participants expressed concern initiative clarify committee longer run inflation objective could confusing public current context economic weakness financial market strains,however several participant express concern initiative clarify committee longer run inflation objective could confuse public current context economic weakness financial market strain,0
102,2009-01-28,participants also discussed several technical issues related implementation communication explicit numerical inflation objective,participant also discuss several technical issue related implementation communication explicit numerical inflation objective,0
103,2009-01-28,expressed range views whether objective expressed terms consumer price index pce price deflator merits point value versus range length time policy would aim achieve objective frequency committee would reevaluate framework,express range view whether objective express term consumer price index pce price deflator merit point value versus range length time policy would aim achieve objective frequency committee would reevaluate framework,0
104,2009-01-28,meeting staff also briefed committee coordinated set measures supporting bank america taken treasury fdic federal reserve earlier day,meeting staff also briefed committee coordinate set measure support bank america take treasury fdic federal reserve earlier day,0
