,Date,Original,Corpus,Class
87,2016-11-02,real economic activity expected advance moderate pace coming quarters primarily reflecting solid growth consumer spending consistent ongoing employment gains increases household wealth low interest rates,real economic activity expect advance moderate pace come quarter primarily reflect solid growth consumer spending consistent ongoing employment gain increase household wealth low interest rate,0
88,2016-11-02,participants continued expect economic activity coming quarters supported pickup business investment,participant continued expect economic activity come quarter support pickup business investment,0
89,2016-11-02,recent increases oil gas drilling activity response higher energy prices seen positive development investment outlook however participants reported uncertainty prospects government policy shorter investment time horizons businesses potential advances technology disrupt existing business models likely weighing capital spending plans,recent increase oil gas drilling activity response high energy price see positive development investment outlook however participant report uncertainty prospect government policy shorter investment time horizon business potential advance technology disrupt exist business model likely weigh capital spending plan,0
90,2016-11-02,one participant reported generally strong conditions district housing markets also cited various factors restraining residential construction locales including constraints builder financing limitations supply buildable lots shortages skilled labor,one participant report generally strong condition district housing market also cite various factor restrain residential construction locale include constraint builder financing limitation supply buildable lot shortage skilled labor,0
91,2016-11-02,discussion business activity districts participants provided mixed reports manufacturing areas adversely affected downturn energy prices reporting modest pickup output,discussion business activity district participant provide mixed report manufacturing area adversely affected downturn energy price reporting modest pickup output,0
92,2016-11-02,agricultural sector low crop prices said continue weigh farm income farm spending,agricultural sector low crop price say continue weigh farm income farm spending,0
93,2016-11-02,participants noted economic growth many foreign economies remained subdued inflation rates abroad generally still quite low,participant note economic growth many foreign economy remain subdue inflation rate abroad generally still quite low,0
94,2016-11-02,participants observed important international downside risks remained including constraints monetary policies low interest rate environments countries investors concerns developments potentially affecting profitability european banking sector possible consequences upcoming negotiations eventual terms united kingdom exit eu potential deleterious effects rapid credit growth china potential dollar appreciation could restrains inflation considerable time,participant observe important international downside risk remain include constraint monetary policy low interest rate environment country investor concern development potentially affect profitability european banking sector possible consequence upcoming negotiation eventual term united kingdom exit eu potential deleterious effect rapid credit growth china potential dollar appreciation could restrains inflation considerable time,0
95,2016-11-02,participants generally agreed labor market conditions continued improve intermeeting period,participant generally agree labor market condition continued improve intermeeting period,0
96,2016-11-02,reports districts pointed tightening labor markets evidenced shortages qualified workers occupations increases overtime hours pickup wage inflation,report district point tighten labor market evidence shortage qualify worker occupation increase overtime hour pickup wage inflation,0
97,2016-11-02,several districts business contacts undertaken workforce development worker training address shortage labor necessary skills,several district business contact undertaken workforce development worker training address shortage labor necessary skill,0
98,2016-11-02,many participants commented rise labor force participation rate since late ,many participant comment rise labor force participation rate since late,0
99,2016-11-02,noted increase largely reflected diminution flow individuals leaving workforce rather increase new entrants labor force prevalent among workers relatively less education,note increase largely reflect diminution flow individual leave workforce rather increase new entrant labor force prevalent among worker relatively less education,0
100,2016-11-02,addition uncertainty around estimates longer run trend rate labor force participation could higher previously thought reflecting example shift toward later retirement,addition uncertainty around estimate longer run trend rate labor force participation could high previously thought reflect example shift toward later retirement,0
101,2016-11-02,hand business cycle perspective increase participation rate recent months consistent tightening labor market economy nearing full employment furthermore not clear output growth economy potential growth rate would succeed drawing new entrants permanently labor force,hand business cycle perspective increase participation rate recent month consistent tighten labor market economy near full employment furthermore not clear output growth economy potential growth rate would succeed draw new entrant permanently labor force,0
102,2016-11-02,overall participants expressed view economy close full employment several others judged appreciable slack could remain labor market,overall participant express view economy close full employment several others judged appreciable slack could remain labor market,0
103,2016-11-02,participants characterized wage pressures moderate although one noted wage growth similar pace peak previous economic expansion,participant characterize wage pressure moderate although one note wage growth similar pace peak previous economic expansion,0
104,2016-11-02,readings headline core pce price inflation come somewhat higher expected recent months,reading headline core pce price inflation come somewhat high expect recent month,0
105,2016-11-02,participants generally regarded positive development consistent headline inflation rising medium term committee objective  percent,participant generally regard positive development consistent headline inflation rise medium term committee objective percent,0
106,2016-11-02,participants observed difficult judge much uptick core pce price inflation reflected transitory factors couple others saw incoming data suggesting inflation could move committee objective rapidly previously expected,participant observe difficult judge much uptick core pce price inflation reflect transitory factor couple others saw incoming data suggest inflation could move committee objective rapidly previously expect,0
107,2016-11-02,participants discussed possible policy implications risks surrounding outlook inflation including possibility achieving committee inflation objective sooner previously anticipated could cause revision market expectations path policy rates sharp rise longer term interest rates possibility appreciation dollar stemming developments abroad could renew disinflationary pressures postpone need policy firming,participant discuss possible policy implication risk surround outlook inflation include possibility achieve committee inflation objective sooner previously anticipate could cause revision market expectation path policy rate sharp rise longer term interest rate possibility appreciation dollar stem development abroad could renew disinflationary pressure postpone need policy firm,0
108,2016-11-02,participants regarded uptick market based measures inflation compensation intermeeting period welcome suggestion progress toward committee inflation goal,participant regard uptick market base measure inflation compensation intermeeting period welcome suggestion progress toward committee inflation goal,0
109,2016-11-02,however several cautioned measures remained low measures still appeared embed significant weight undesirably low inflation outcomes,however several caution measure remain low measure still appear embed significant weight undesirably low inflation outcome,0
110,2016-11-02,median expectation inflation next   years michigan survey edged october new historical low although noted drop could explained reduction number respondents previously expected relatively high inflation outcomes,median expectation inflation next year michigan survey edge october new historical low although note drop could explain reduction number respondent previously expect relatively high inflation outcome,0
111,2016-11-02,overall participants judged survey based measures inflation expectations fairly stable recent months,overall participant judged survey base measure inflation expectation fairly stable recent month,0
112,2016-11-02,among factors cited persistent decline neutral federal funds rate depressed term premiums likely owing elevated size federal reserve balance sheet well reduced likelihood high inflation relative several decades ago,among factor cite persistent decline neutral federal fund rate depressed term premium likely owe elevate size federal reserve balance sheet well reduce likelihood high inflation relative several decade ago,0
113,2016-11-02,particular accumulating evidence slow trend productivity output growth associated persistently low levels neutral interest rates united states abroad potential implications effective policy implementation framework federal reserve coming years well monetary policy strategy would best promote committee macroeconomic objectives,particular accumulate evidence slow trend productivity output growth associate persistently low level neutral interest rate united state abroad potential implication effective policy implementation framework federal reserve come year well monetary policy strategy would best promote committee macroeconomic objective,0
114,2016-11-02,among factors needed taken account observed neutral real short term interest rates could decline central bank balance sheets contracted positive effects quantitative easing economic activity waned time,among factor need take account observe neutral real short term interest rate could decline central bank balance sheet contract positive effect quantitative ease economic activity wan time,0
115,2016-11-02,participants agreed issues associated monetary policy implementation discussed within context current potential future economic financial environment committee strategy monetary policy,participant agree issue associate monetary policy implementation discuss within context current potential future economic financial environment committee strategy monetary policy,0
116,2016-11-02,backdrop views economic outlook participants discussed whether available information warranted taking another step reduce policy accommodation meeting,backdrop view economic outlook participant discuss whether available information warrant take another step reduce policy accommodation meeting,0
117,2016-11-02,participants saw recent information indicating labor market conditions improved considered firming inflation inflation compensation positive developments consistent continued progress toward committee  percent inflation objective,participant saw recent information indicate labor market condition improve consider firm inflation inflation compensation positive development consistent continued progress toward committee percent inflation objective,0
118,2016-11-02,however number participants expressed view modest slack remained labor market noted readings inflation compensation inflation expectations remained low,however number participant express view modest slack remain labor market note reading inflation compensation inflation expectation remain low,0
119,2016-11-02,participants advocated increase meeting viewed recent economic developments indicating labor market conditions close consistent maximum employment expected recent progress toward committee inflation objective would continue even gradual steps remove monetary policy accommodation,participant advocate increase meeting view recent economic development indicate labor market condition close consistent maximum employment expect recent progress toward committee inflation objective would continue even gradual step remove monetary policy accommodation,0
120,2016-11-02,addition many judged risks economic financial stability could increase time labor market overheated appreciably expressed concern extended period low interest rates risked intensifying incentives investors reach yield potentially leading mispricing risk misallocation capital,addition many judged risk economic financial stability could increase time labor market overheat appreciably express concern extend period low interest rate risk intensify incentive investor reach yield potentially lead mispricing risk misallocation capital,0
121,2016-11-02,contrast others judged allowing unemployment rate fall longer run normal level time could result favorable supply side effects help hasten return inflation committee  percent objective noted proximity federal funds rate effective lower bound places potential constraints monetary policy stressed global developments could pose riskss economic activity,contrast others judged allow unemployment rate fall longer run normal level time could result favorable supply side effect help hasten return inflation committee percent objective note proximity federal fund rate effective low bound place potential constraint monetary policy stress global development could pose risk economic activity,0
122,2016-11-02,generally emphasized decisions regarding near term adjustments stance monetary policy would appropriately remain dependent outlook informed incoming data participants expected economic conditions would evolve manner would warrant gradual increases federal funds rate,generally emphasize decision regard near term adjustment stance monetary policy would appropriately remain dependent outlook inform incoming data participant expect economic condition would evolve manner would warrant gradual increase federal fund rate,0
123,2016-11-02,committee policy action discussion monetary policy period ahead members judged information received since committee met september indicated labor market continued strengthen growth economic activity picked modest pace seen first half year,committee policy action discussion monetary policy period ahead member judged information receive since committee met september indicate labor market continued strengthen growth economic activity picked modest pace see first half year,0
124,2016-11-02,although unemployment rate little changed recent months job gains solid,although unemployment rate little change recent month job gain solid,0
125,2016-11-02,household spending rising moderately business fixed investment remained soft,household spending rise moderately business fix investment remain soft,0
126,2016-11-02,inflation increased somewhat since earlier year still committee  percent longer run objective partly reflecting earlier declines energy prices prices non energy imports,inflation increase somewhat since earlier year still committee percent longer run objective partly reflect earlier decline energy price price non energy import,0
127,2016-11-02,market based measures inflation compensation moved remained low survey based measures longer term inflation expectations little changed balance recent months,market base measure inflation compensation move remain low survey base measure longer term inflation expectation little change balance recent month,0
128,2016-11-02,respect economic outlook implications monetary policy members continued expect that gradual adjustments stance monetary policy economic activity would expand moderate pace labor market conditions would strengthen somewhat further,respect economic outlook implication monetary policy member continued expect that gradual adjustment stance monetary policy economic activity would expand moderate pace labor market condition would strengthen somewhat far,0
129,2016-11-02,almost continued judge near term risks economic outlook roughly balanced,almost continued judge near term risk economic outlook roughly balance,0
130,2016-11-02,members generally observed labor market conditions improved appreciably past year development particularly evident solid pace monthly payroll employment gains increase labor force participation rate,member generally observe labor market condition improve appreciably past year development particularly evident solid pace monthly payroll employment gain increase labor force participation rate,0
131,2016-11-02,noted allowing unemployment rate modestly undershoot longer run normal level could foster return inflation fomc  percent objective medium term,note allow unemployment rate modestly undershoot longer run normal level could foster return inflation fomc percent objective medium term,0
132,2016-11-02,members however concerned sizable undershooting longer run normal unemployment rate could necessitate steep subsequent rise policy rates undermining committee prior communications expectations gradually rising policy rate even posing risks economic expansion,member however concerned sizable undershoot longer run normal unemployment rate could necessitate steep subsequent rise policy rate undermine committee prior communication expectation gradually rise policy rate even pose risk economic expansion,0
133,2016-11-02,members continued expect inflation remain low near term anticipated that gradual adjustments stance monetary policy inflation would rise committee  percent objective medium term,member continued expect inflation remain low near term anticipate that gradual adjustment stance monetary policy inflation would rise committee percent objective medium term,0
134,2016-11-02,members observed increases inflation inflation compensation recent months welcome although couple noted inflation still running committee objective,member observe increase inflation inflation compensation recent month welcome although couple note inflation still run committee objective,0
135,2016-11-02,backdrop light current shortfall inflation  percent members agreed would continue carefully monitor actual expected progress toward committee inflation goal,backdrop light current shortfall inflation percent member agree would continue carefully monitor actual expect progress toward committee inflation goal,0
136,2016-11-02,assessing outlook economic activity labor market inflation well risks around outlook committee decided maintain target range federal funds rate   percent meeting,assess outlook economic activity labor market inflation well risk around outlook committee decide maintain target range federal fund rate percent meeting,0
137,2016-11-02,majority members judged committee should time being await evidence progress toward objectives maximum employment  percent inflation increasing target range federal funds rate,majority member judged committee should time be await evidence progress toward objective maximum employment percent inflation increase target range federal fund rate,0
138,2016-11-02,saw inflation close  percent objective viewed increase federal funds rate appropriate meeting judged economy essentially maximum employment monetary policy unable contribute permanent improvement labor market conditions circumstances,saw inflation close percent objective view increase federal fund rate appropriate meeting judged economy essentially maximum employment monetary policy unable contribute permanent improvement labor market condition circumstance,0
139,2016-11-02,committee agreed that determining timing size future adjustments target range federal funds rate would assess realized expected economic conditions relative objectives maximum employment  percent inflation,committee agree that determine timing size future adjustment target range federal fund rate would ass realize expect economic condition relative objective maximum employment percent inflation,0
140,2016-11-02,assessment would take account wide range information including measures labor market conditions indicators inflation pressures inflation expectations readings financial international developments,assessment would take account wide range information include measure labor market condition indicator inflation pressure inflation expectation reading financial international development,0
141,2016-11-02,committee expected economic conditions would evolve manner would warrant gradual increases federal funds rate federal funds rate likely remain time levels expected prevail longer run,committee expect economic condition would evolve manner would warrant gradual increase federal fund rate federal fund rate likely remain time level expect prevail longer run,0
142,2016-11-02,however members emphasized actual path federal funds rate would depend economic outlook informed incoming data,however member emphasize actual path federal fund rate would depend economic outlook inform incoming data,0
143,2016-11-02,information received since federal open market committee met september indicates labor market continued strengthen growth economic activity picked modest pace seen first half year,information receive since federal open market committee met september indicates labor market continued strengthen growth economic activity picked modest pace see first half year,0
144,2016-11-02,although unemployment rate little changed recent months job gains solid,although unemployment rate little change recent month job gain solid,0
145,2016-11-02,household spending rising moderately business fixed investment remained soft,household spending rise moderately business fix investment remain soft,0
146,2016-11-02,inflation increased somewhat since earlier year still committee  percent longer run objective partly reflecting earlier declines energy prices prices non energy imports,inflation increase somewhat since earlier year still committee percent longer run objective partly reflect earlier decline energy price price non energy import,0
147,2016-11-02,market based measures inflation compensation moved remain low survey based measures longer term inflation expectations little changed balance recent months,market base measure inflation compensation move remain low survey base measure longer term inflation expectation little change balance recent month,0
148,2016-11-02,consistent statutory mandate committee seeks foster maximum employment price stability,consistent statutory mandate committee seek foster maximum employment price stability,0
149,2016-11-02,committee expects that gradual adjustments stance monetary policy economic activity expand moderate pace labor market conditions strengthen somewhat further,committee expect that gradual adjustment stance monetary policy economic activity expand moderate pace labor market condition strengthen somewhat far,0
150,2016-11-02,inflation expected rise  percent medium term transitory effects past declines energy import prices dissipate labor market strengthens further,inflation expect rise percent medium term transitory effect past decline energy import price dissipate labor market strengthens far,0
151,2016-11-02,near term risks economic outlook appear roughly balanced,near term risk economic outlook appear roughly balance,0
152,2016-11-02,committee continues closely monitor inflation indicators global economic financial developments,committee continue closely monitor inflation indicator global economic financial development,0
153,2016-11-02,stance monetary policy remains accommodative thereby supporting improvement labor market conditions return  percent inflation,stance monetary policy remains accommodative thereby support improvement labor market condition return percent inflation,0
154,2016-11-02,determining timing size future adjustments target range federal funds rate committee assess realized expected economic conditions relative objectives maximum employment  percent inflation,determine timing size future adjustment target range federal fund rate committee ass realize expect economic condition relative objective maximum employment percent inflation,0
155,2016-11-02,assessment take account wide range information including measures labor market conditions indicators inflation pressures inflation expectations readings financial international developments,assessment take account wide range information include measure labor market condition indicator inflation pressure inflation expectation reading financial international development,0
156,2016-11-02,light current shortfall inflation  percent committee carefully monitor actual expected progress toward inflation goal,light current shortfall inflation percent committee carefully monitor actual expect progress toward inflation goal,0
157,2016-11-02,committee expects economic conditions evolve manner warrant gradual increases federal funds rate federal funds rate likely remain time levels expected prevail longer run,committee expect economic condition evolve manner warrant gradual increase federal fund rate federal fund rate likely remain time level expect prevail longer run,0
158,2016-11-02,however actual path federal funds rate depend economic outlook informed incoming data,however actual path federal fund rate depend economic outlook inform incoming data,0
