,Date,Original,Corpus,Class
159,2016-11-02,ms george judged that labor market near full employment inflation approaching committee  percent objective another step gradual adjustment monetary policy appropriate,m george judged that labor market near full employment inflation approach committee percent objective another step gradual adjustment monetary policy appropriate,0
160,2016-11-02,low level target range federal funds rate supported achieving committee objectives low levels no longer warranted and maintained could pose risk sustainability economic expansion stable inflation,low level target range federal fund rate support achieve committee objective low level no longer warrant and maintain could pose risk sustainability economic expansion stable inflation,0
161,2016-11-02,particular viewed supply side benefits allowing labor utilization rise neutral level temporary noted monetary policy unable affect longer run growth potential economy,particular view supply side benefit allow labor utilization rise neutral level temporary note monetary policy unable affect longer run growth potential economy,0
162,2016-11-02,ms mester judged economy essentially full employment terms achieved monetary policy,m mester judged economy essentially full employment term achieve monetary policy,0
163,2016-11-02,unemployment rate estimate longer run normal level labor market conditions projected tighten further,unemployment rate estimate longer run normal level labor market condition project tighten far,0
164,2016-11-02,addition noted inflation moving close committee  percent objective,addition note inflation move close committee percent objective,0
165,2016-11-02,circumstances believed appropriate gradually increase target range federal funds rate current low level would allow monetary policy continue lend support economic expansion,circumstance believe appropriate gradually increase target range federal fund rate current low level would allow monetary policy continue lend support economic expansion,0
166,2016-11-02,gradual path would allow committee better calibrate policy time learns underlying structural aspects economy,gradual path would allow committee well calibrate policy time learns underlie structural aspect economy,0
