,Date,Original,Corpus,Class
0,2016-11-02,anthony murphy economic policy advisor federal reserve bank dallas,anthony murphy economic policy advisor federal reserve bank dallas,0
1,2016-11-02,staff provided briefings summarized considerations regarding potential choices policy rates operating regimes balance sheet policies highlighted tradeoffs associated choices,staff provide briefing summarize consideration regard potential choice policy rate operating regime balance sheet policy highlight tradeoff associate choice,0
2,2016-11-02,staff noted long run implementation framework supply reserve balances quite abundant operational tools help establish floor short term interest rates payment interest reserves overnight reverse repurchase agreement on rrp facility would remain important elements operating regime,staff note long run implementation framework supply reserve balance quite abundant operational tool help establish floor short term interest rate payment interest reserve overnight reverse repurchase agreement on rrp facility would remain important element operating regime,0
3,2016-11-02,staff noted importance effective arrangements provide liquidity times stress,staff note importance effective arrangement provide liquidity time stress,0
4,2016-11-02,staff discussed possibility changes size composition federal reserve balance sheet including duration securities holdings could used help achieve policymakers macroeconomic goals short term interest rates declined effective lower bound conceivably short term interest rates bound,staff discuss possibility change size composition federal reserve balance sheet include duration security holding could use help achieve policymakers macroeconomic goal short term interest rate decline effective low bound conceivably short term interest rate bound,0
5,2016-11-02,staff also described possibility using balance sheet policies promote financial stability,staff also described possibility use balance sheet policy promote financial stability,0
6,2016-11-02,discussion followed staff presentations policymakers agreed decisions regarding long run implementation framework not necessary time,discussion follow staff presentation policymakers agree decision regard long run implementation framework not necessary time,0
7,2016-11-02,approach could compatible balance sheet much smaller present though likely least somewhat larger years financial crisis reflecting trend growth balance sheet items currency well larger supply reserves,approach could compatible balance sheet much small present though likely least somewhat large year financial crisis reflect trend growth balance sheet item currency well large supply reserve,0
8,2016-11-02,number policymakers stated continued view expansion balance sheet large scale asset purchases important tool provide macroeconomic stimulus situations short term interest rates effective lower bound,number policymakers state continued view expansion balance sheet large scale asset purchase important tool provide macroeconomic stimulus situation short term interest rate effective low bound,0
9,2016-11-02,staff review economic situation information reviewed november   meeting indicated real gross domestic product gdp expanded faster pace third quarter first half year labor market conditions continued strengthen recent months,staff review economic situation information review november meeting indicate real gross domestic product gdp expand faster pace third quarter first half year labor market condition continued strengthen recent month,0
10,2016-11-02,consumer price inflation increased pace early year still running committee longer run objective  percent restrained part earlier decreases energy prices prices non energy imports,consumer price inflation increase pace early year still run committee longer run objective percent restrain part earlier decrease energy price price non energy import,0
11,2016-11-02,survey based measures longer run inflation expectations little changed balance market based measures inflation compensation moved remained low,survey base measure longer run inflation expectation little change balance market base measure inflation compensation move remain low,0
12,2016-11-02,total nonfarm payroll employment expanded solid pace september unemployment rate little changed ,total nonfarm payroll employment expand solid pace september unemployment rate little change,0
13,2016-11-02,labor force participation rate employment population ratio edged september,labor force participation rate employment population ratio edge september,0
14,2016-11-02,share workers employed part time economic reasons still slightly elevated relative level recession,share worker employ part time economic reason still slightly elevate relative level recession,0
15,2016-11-02,rate private sector job openings edged august rates hiring quits unchanged,rate private sector job opening edge august rate hire quits unchanged,0
16,2016-11-02,four week moving average initial claims unemployment insurance benefits remained low,four week move average initial claim unemployment insurance benefit remain low,0
17,2016-11-02,measures labor compensation continued rise moderate pace,measure labor compensation continued rise moderate pace,0
18,2016-11-02,employment cost index private industry workers increased   percent  months ending september average hourly earnings employees increased   percent  month period,employment cost index private industry worker increase percent month end september average hourly earnings employee increase percent month period,0
19,2016-11-02,unemployment rates african americans hispanics remained rate whites close levels seen prior recent recession,unemployment rate african american hispanic remain rate white close level see prior recent recession,0
20,2016-11-02,labor force participation rate white individuals aged   continued higher african americans hispanics rates three groups appeared either moved sideways edged recently,labor force participation rate white individual age continued high african american hispanic rate three group appear either move sideways edge recently,0
21,2016-11-02,real personal consumption expenditures pce increased moderate pace third quarter supported continued gains employment real disposable personal income households net worth,real personal consumption expenditure pce increase moderate pace third quarter support continued gain employment real disposable personal income household net worth,0
22,2016-11-02,consumer spending increased september partly increase outlays motor vehicles,consumer spending increase september partly increase outlay motor vehicle,0
23,2016-11-02,real residential investment spending decreased partly reflecting decline total housing starts,real residential investment spending decrease partly reflect decline total housing start,0
24,2016-11-02,new orders nondefense capital goods excluding aircraft little changed august september orders somewhat level shipments suggesting modest pickup business spending equipment near term,new order nondefense capital good exclude aircraft little change august september order somewhat level shipment suggest modest pickup business spending equipment near term,0
25,2016-11-02,real business expenditures nonresidential structures increased third quarter number oil gas rigs operation indicator spending structures drilling mining sector continued edge october,real business expenditure nonresidential structure increase third quarter number oil gas rig operation indicator spending structure drilling mining sector continued edge october,0
26,2016-11-02,real inventory investment positive third quarter subtracting substantially real gdp growth second quarter,real inventory investment positive third quarter subtract substantially real gdp growth second quarter,0
27,2016-11-02,real federal purchases increased third quarter defense expenditures turned nondefense spending continued rise,real federal purchase increase third quarter defense expenditure turn nondefense spending continued rise,0
28,2016-11-02,real state local government purchases decreased reflecting decline real construction spending governments offset net expansion state local government payrolls third quarter,real state local government purchase decrease reflect decline real construction spending government offset net expansion state local government payroll third quarter,0
29,2016-11-02,net exports contributed positively real gdp growth third quarter largely strength soybean exports,net export contribute positively real gdp growth third quarter largely strength soybean export,0
30,2016-11-02,import growth driven higher imports capital goods services export growth led part higher exports industrial supplies automotive products,import growth driven high import capital good service export growth lead part high export industrial supply automotive product,0
31,2016-11-02,census bureau advance trade estimates september suggested narrowing trade deficit growth exports decline imports relative august,census bureau advance trade estimate september suggest narrow trade deficit growth export decline import relative august,0
32,2016-11-02,totals consumer prices measured pce price index increased   percent  months ending september partly restrained recent decreases consumer food prices earlier declines consumer energy prices,total consumer price measure pce price index increase percent month end september partly restrain recent decrease consumer food price earlier decline consumer energy price,0
33,2016-11-02,core pce price inflation excludes changes food energy prices   percent  months held part decreases prices non energy imports part period pass earlier declines energy prices prices goods services,core pce price inflation excludes change food energy price percent month held part decrease price non energy import part period pas earlier decline energy price price good service,0
34,2016-11-02, months ending september total consumer prices measured consumer price index cpi rose   percent core cpi inflation around   percent,month end september total consumer price measure consumer price index cpi rise percent core cpi inflation around percent,0
35,2016-11-02,michigan survey measure median longer run inflation expectations moved october new historical low longer run measure blue chip economic indicators also declined slightly,michigan survey measure median longer run inflation expectation move october new historical low longer run measure blue chip economic indicator also decline slightly,0
36,2016-11-02,measures longer run inflation expectations desk survey primary dealers survey market participants unchanged october,measure longer run inflation expectation desk survey primary dealer survey market participant unchanged october,0
37,2016-11-02,foreign real gdp growth appeared pick significantly third quarter following weak growth second quarter primarily reflected contractions canada mexico,foreign real gdp growth appear pick significantly third quarter follow weak growth second quarter primarily reflect contraction canada mexico,0
38,2016-11-02,recovery oil production canada boosted economic activity there pickups economic activity strong household spending mexico supported sharp rebound mexican gdp growth,recovery oil production canada boost economic activity there pickup economic activity strong household spending mexico support sharp rebound mexican gdp growth,0
39,2016-11-02,improvements economies offset moderation growth china,improvement economy offset moderation growth china,0
40,2016-11-02,euro area japan economic growth continued modest pace,euro area japan economic growth continued modest pace,0
41,2016-11-02,inflation generally remained subdued emerging market economies advanced foreign economies afes,inflation generally remain subdue emerge market economy advanced foreign economy afes,0
42,2016-11-02,notable exception united kingdom inflationary pressures increased partly result substantial depreciation pound recent months,notable exception united kingdom inflationary pressure increase partly result substantial depreciation pound recent month,0
43,2016-11-02,staff review financial situation domestic financial markets relatively calm period since september fomc meeting,staff review financial situation domestic financial market relatively calm period since september fomc meeting,0
44,2016-11-02,asset prices little changed volatility mostly low,asset price little change volatility mostly low,0
45,2016-11-02,federal reserve communications immediately following september meeting notably summary economic projections interpreted market participants slightly accommodative expected,federal reserve communication immediately follow september meeting notably summary economic projection interpret market participant slightly accommodative expect,0
46,2016-11-02,subsequent federal reserve communicationss economic data releases intermeeting period generally interpreted line market expectations,subsequent federal reserve communications economic data release intermeeting period generally interpret line market expectation,0
47,2016-11-02,nominal yields pushed increase inflation compensation appeared attributable combination factors including recent rise oil prices decline investors concerns risk low inflation outcomes implied quotes inflation caps floors,nominal yield push increase inflation compensation appear attributable combination factor include recent rise oil price decline investor concern risk low inflation outcome imply quote inflation cap floor,0
48,2016-11-02,broad stock price indexes little changed net since september fomc meeting,broad stock price index little change net since september fomc meeting,0
49,2016-11-02,spreads yields nonfinancial investment grade speculative grade corporate bonds comparable maturity treasury securities declined bit spreads finishing period levels close medians economic expansions past two decades,spread yield nonfinancial investment grade speculative grade corporate bond comparable maturity treasury security decline bit spread finish period level close median economic expansion past two decade,0
50,2016-11-02,period dollar appreciated afe currencies appreciation pound particularly pronounced reflecting increased concerns negotiationsk european officials would result outcome featuring less economic integration anticipated earlier,period dollar appreciate afe currency appreciation pound particularly pronounce reflect increase concern negotiationsk european official would result outcome feature less economic integration anticipate earlier,0
51,2016-11-02,concernsk eu negotiations higherk inflation compensation also drove  year gilt yields,concernsk eu negotiation higherk inflation compensation also drove year gilt yield,0
52,2016-11-02,contrast dollar depreciated currencies commodity exporting countries including mexican peso russian ruble consistent increase oil prices,contrast dollar depreciate currency commodity export country include mexican peso russian ruble consistent increase oil price,0
53,2016-11-02,growth commercial industrial ci loans slowed overall third quarter picked september,growth commercial industrial ci loan slow overall third quarter picked september,0
54,2016-11-02,growth cre loans banks books continued strong third quarter even though significant number banks reported october sloos tightened lending standards cre loans,growth cre loan bank book continued strong third quarter even though significant number bank report october sloos tighten lending standard cre loan,0
55,2016-11-02,growth revolving nonrevolving loans remained robust,growth revolve nonrevolving loan remain robust,0
56,2016-11-02,latest report potential risks stabilitys financial system staff continued judge overall vulnerabilities remained moderate,late report potential risk stability financial system staff continued judge overall vulnerability remain moderate,0
57,2016-11-02,vulnerabilities leverage private nonfinancial sector seen moderate overall reflecting combination relatively high aggregate leverage corporate sector sharp slowdown expansion riskiest forms corporate debt continued modest rise aggregate household debt accrued almost exclusively borrowers high credit scores,vulnerability leverage private nonfinancial sector see moderate overall reflect combination relatively high aggregate leverage corporate sector sharp slowdown expansion riskiest form corporate debt continued modest rise aggregate household debt accrue almost exclusively borrower high credit score,0
58,2016-11-02,monetary policy announcements foreign central banks limited effects asset prices,monetary policy announcement foreign central bank limited effect asset price,0
59,2016-11-02,september monetary policy meeting bank japan boj announced purchase japanese government bonds jgbs keep yield  year jgbs around zero boj also announced continue expand monetary base consumer price inflation exceeds  percent target stays target stable manner,september monetary policy meeting bank japan boj announce purchase japanese government bond jgbs keep yield year jgbs around zero boj also announce continue expand monetary base consumer price inflation exceeds percent target stay target stable manner,0
60,2016-11-02,staff economic outlooks economic projection prepared staff november fomc meeting pace real gdp growth forecast faster second half year first half business investment anticipated turn drag inventory investment expected end,staff economic outlook economic projection prepared staff november fomc meeting pace real gdp growth forecast faster second half year first half business investment anticipate turn drag inventory investment expect end,0
61,2016-11-02,however forecast second half lower september projection primarily reflecting softer expected data consumer spending,however forecast second half low september projection primarily reflect softer expect data consumer spending,0
62,2016-11-02,staff forecast real gdp growth next couple years also slightly lower previous projection primarily reflecting effects higher assumed paths dollar crude oil prices,staff forecast real gdp growth next couple year also slightly low previous projection primarily reflect effect high assume path dollar crude oil price,0
63,2016-11-02,nonetheless staff projected real gdp would expand modestly faster pace potential output   supported solid gains consumer spending and lesser degree pickups residential business investment  gdp projected expand rate potential,nonetheless staff project real gdp would expand modestly faster pace potential output support solid gain consumer spending and lesser degree pickup residential business investment gdp project expand rate potential,0
64,2016-11-02,unemployment rate forecast edge gradually end  flatten  path unemployment rate little higher previous projection still projected run staff estimate longer run natural rate,unemployment rate forecast edge gradually end flatten path unemployment rate little high previous projection still project run staff estimate longer run natural rate,0
65,2016-11-02,near term forecast consumer price inflation somewhat higher previous projection reflecting incoming data core prices energy prices,near term forecast consumer price inflation somewhat high previous projection reflect incoming data core price energy price,0
66,2016-11-02,beyond near term inflation forecast generally little revised,beyond near term inflation forecast generally little revise,0
67,2016-11-02,staff continued project inflation would increase next several years food energy prices along prices non energy imports expected begin rising steadily year,staff continued project inflation would increase next several year food energy price along price non energy import expect begin rise steadily year,0
68,2016-11-02,however inflation projected marginally committee longer run objective  percent ,however inflation project marginally committee longer run objective percent,0
69,2016-11-02,staff viewed uncertainty around projections real gdp growth unemployment rate inflation similar average past  years,staff view uncertainty around projection real gdp growth unemployment rate inflation similar average past year,0
70,2016-11-02,risks forecast real gdp seen tilted downside reflecting staff assessment monetary fiscal policy appeared better positioned offset large positive shocks adverse ones,risk forecast real gdp see tilt downside reflect staff assessment monetary fiscal policy appear well position offset large positive shock adverse one,0
71,2016-11-02,addition staff continued see risks forecast developments abroad skewed downside,addition staff continued see risk forecast development abroad skewed downside,0
72,2016-11-02,consistent downside risks aggregate demand staff viewed risks outlook unemployment rate tilted upside,consistent downside risk aggregate demand staff view risk outlook unemployment rate tilt upside,0
73,2016-11-02,risks projection inflation seen roughly balanced,risk projection inflation see roughly balance,0
74,2016-11-02,possibility longer term inflation expectations may edged roughly counterbalanced risks somewhat firmer inflation year could persistent expected particularly economy projected continue operating long run potential,possibility longer term inflation expectation may edge roughly counterbalance risk somewhat firmer inflation year could persistent expect particularly economy project continue operating long run potential,0
75,2016-11-02,participants views current conditions economic outlook discussion economic situation outlook meeting participants agreed information received intermeeting period indicated labor market continued strengthen growth economic activity picked modest pace seen first half year,participant view current condition economic outlook discussion economic situation outlook meeting participant agree information receive intermeeting period indicate labor market continued strengthen growth economic activity picked modest pace see first half year,0
76,2016-11-02,job gains solid recent months although unemployment rate little changed,job gain solid recent month although unemployment rate little change,0
77,2016-11-02,household spending rising moderately business fixed investment remained soft,household spending rise moderately business fix investment remain soft,0
78,2016-11-02,inflation increased somewhat since earlier year remained committee  percent longer run objective partly reflecting earlier declines energy prices prices non energy imports,inflation increase somewhat since earlier year remain committee percent longer run objective partly reflect earlier decline energy price price non energy import,0
79,2016-11-02,market based measures inflation compensation moved remained low survey based measures longer term inflation expectations changed little balance recent months,market base measure inflation compensation move remain low survey base measure longer term inflation expectation change little balance recent month,0
80,2016-11-02,participants generally indicated economic forecasts changed little intermeeting period,participant generally indicate economic forecast change little intermeeting period,0
81,2016-11-02,continued anticipate that gradual adjustments stance monetary policy economic activity would expand moderate pace labor market conditions would strengthen somewhat further,continued anticipate that gradual adjustment stance monetary policy economic activity would expand moderate pace labor market condition would strengthen somewhat far,0
82,2016-11-02,inflation expected rise  percent medium term transitory effects past declines energy import prices continued dissipate labor market strengthened further,inflation expect rise percent medium term transitory effect past decline energy import price continued dissipate labor market strengthen far,0
83,2016-11-02,substantial majority viewed near term risks economic outlook roughly balanced although participants judged significant downside risks remained citing various factors including low value neutral federal funds rate proximity effective lower bound possibility weaker expected growth foreign economies continued uncertainty associated united kingdom exit eu financial fragilities countries,substantial majority view near term risk economic outlook roughly balance although participant judged significant downside risk remain cite various factor include low value neutral federal fund rate proximity effective low bound possibility weaker expect growth foreign economy continued uncertainty associate united kingdom exit eu financial fragility country,0
84,2016-11-02,participants agreed committee continue closely monitor inflation indicators global economic financial developments,participant agree committee continue closely monitor inflation indicator global economic financial development,0
85,2016-11-02,participants noted although real gdp growth third quarter appreciably slow pace first half boosted part transitory factors including surge agricultural exports bounceback inventory investment,participant note although real gdp growth third quarter appreciably slow pace first half boost part transitory factor include surge agricultural export bounceback inventory investment,0
86,2016-11-02,excluding factors underlying economic growth relatively modest growth consumer spending slowed brisk pace earlier year residential investment fallen again business fixed investment remained soft,exclude factor underlie economic growth relatively modest growth consumer spending slow brisk pace earlier year residential investment fall again business fix investment remain soft,0
