,Date,Original,Corpus,Class
0,2016-09-21,satyajit chatterjee senior economic advisor federal reserve bank philadelphia,satyajit chatterjee senior economic advisor federal reserve bank philadelphia,0
1,2016-09-21,revisions documents governing foreign currency operations manager system open market account soma briefed committee staff proposal revise documents governing system foreign currency operations including authorization foreign currency operations foreign authorization foreign currency directive foreign directive procedural instructions respect foreign currency operations procedural instructions,revision document govern foreign currency operation manager system open market account soma briefed committee staff proposal revise document govern system foreign currency operation include authorization foreign currency operation foreign authorization foreign currency directive foreign directive procedural instruction respect foreign currency operation procedural instruction,0
2,2016-09-21,staff proposed incorporating material foreign authorization foreign directive procedural instructions new authorization directive would parallel domestic authorization directive procedural instructions document would no longer necessary,staff propose incorporate material foreign authorization foreign directive procedural instruction new authorization directive would parallel domestic authorization directive procedural instruction document would no longer necessary,0
3,2016-09-21, general specified article iv member imf undertakes collaborate imf members assure orderly exchange arrangements promote stable system exchange rates,general specify article iv member imf undertakes collaborate imf member assure orderly exchange arrangement promote stable system exchange rate,0
4,2016-09-21,obligations include seeking direct member economic financial policies toward objective fostering orderly economic growth reasonable price stability,obligation include seek direct member economic financial policy toward objective foster orderly economic growth reasonable price stability,0
5,2016-09-21,desk staff anticipated revisions would published later year,desk staff anticipate revision would publish later year,0
6,2016-09-21,staff review economic situation information reviewed september   meeting indicated labor market conditions strengthened recent months real gross domestic product gdp increasing faster pace third quarter first half year,staff review economic situation information review september meeting indicate labor market condition strengthen recent month real gross domestic product gdp increase faster pace third quarter first half year,0
7,2016-09-21,consumer price inflation continued run committee longer run objective  percent restrained part earlier decreases energy prices prices non energy imports,consumer price inflation continued run committee longer run objective percent restrain part earlier decrease energy price price non energy import,0
8,2016-09-21,survey based measures longer run inflation expectations little changed balance market based measures inflation compensation remained low,survey base measure longer run inflation expectation little change balance market base measure inflation compensation remain low,0
9,2016-09-21,total nonfarm payroll employment expanded strongly average july august,total nonfarm payroll employment expand strongly average july august,0
10,2016-09-21,unemployment rate remained ,unemployment rate remain,0
11,2016-09-21,labor force participation rate employment population ratio edged since june,labor force participation rate employment population ratio edge since june,0
12,2016-09-21,share workers employed part time economic reasons little changed balance,share worker employ part time economic reason little change balance,0
13,2016-09-21,rates private sector job openings hires increased june july rate quits unchanged,rate private sector job opening hire increase june july rate quits unchanged,0
14,2016-09-21,four week moving average initial claims unemployment insurance benefits continued low,four week move average initial claim unemployment insurance benefit continued low,0
15,2016-09-21,labor productivity business sector declined slightly four quarters ending second quarter ,labor productivity business sector decline slightly four quarter end second quarter,0
16,2016-09-21,measures labor compensation continued rise moderate pace,measure labor compensation continued rise moderate pace,0
17,2016-09-21,compensation per hour business sector rose  percent four quarters ending second quarter employment cost index private workers increased   percent  months ending june average hourly earnings employees increased   percent  months ending august,compensation per hour business sector rise percent four quarter end second quarter employment cost index private worker increase percent month end june average hourly earnings employee increase percent month end august,0
18,2016-09-21,unemployment rates african americans hispanics remained rate whites although differentials jobless rates across groups similar recent recession,unemployment rate african american hispanic remain rate white although differential jobless rate across group similar recent recession,0
19,2016-09-21,employment population ratio individuals aged   continued higher whites african americans hispanics,employment population ratio individual age continued high white african american hispanic,0
20,2016-09-21,real pce rose strongly july components nominal retail sales data used bureau economic analysis construct estimate pce flat august pace light motor vehicle sales softened,real pce rise strongly july component nominal retail sale data use bureau economic analysis construct estimate pce flat august pace light motor vehicle sale soften,0
21,2016-09-21,recent readings key factors influence consumer spending consistent solid real pce growth third quarter whole including continued gains employment real disposable personal income households net worth,recent reading key factor influence consumer spending consistent solid real pce growth third quarter whole include continued gain employment real disposable personal income household net worth,0
22,2016-09-21,recent information housing activity suggested real residential investment spending continued soft third quarter,recent information housing activity suggest real residential investment spending continued soft third quarter,0
23,2016-09-21,however new orders capital goods rose substantially july notably level shipments suggesting pickup business spending equipment near term,however new order capital good rise substantially july notably level shipment suggest pickup business spending equipment near term,0
24,2016-09-21,firms nominal spending nonresidential structures excluding drilling mining increased june july,firm nominal spending nonresidential structure exclude drilling mining increase june july,0
25,2016-09-21,number oil gas rigs operation indicator spending structures drilling mining sector continued edge early september,number oil gas rig operation indicator spending structure drilling mining sector continued edge early september,0
26,2016-09-21,limited information available suggested change inventory investment would positive third quarter subtracting substantially real gdp growth second quarter,limited information available suggest change inventory investment would positive third quarter subtract substantially real gdp growth second quarter,0
27,2016-09-21,although payrolls state local governments expanded july august nominal construction spending governments declined july,although payroll state local government expand july august nominal construction spending government decline july,0
28,2016-09-21,exports increased months strong growth july driven higher agricultural exports,export increase month strong growth july driven high agricultural export,0
29,2016-09-21,totals consumer prices measured pce price index increased  percent  months ending july partly restrained recent decreases consumer food prices earlier declines consumer energy prices,total consumer price measure pce price index increase percent month end july partly restrain recent decrease consumer food price earlier decline consumer energy price,0
30,2016-09-21,core pce price inflation excludes changes food energy prices little   percent  months held part decreases prices non energy imports much period pass earlier declines energy prices prices goods services,core pce price inflation excludes change food energy price little percent month held part decrease price non energy import much period pas earlier decline energy price price good service,0
31,2016-09-21, months ending august total consumer prices measured consumer price index cpi rose  percent core cpi inflation around   percent,month end august total consumer price measure consumer price index cpi rise percent core cpi inflation around percent,0
32,2016-09-21,michigan survey measure median longer run inflation expectations edged august unchanged early september,michigan survey measure median longer run inflation expectation edge august unchanged early september,0
33,2016-09-21,measure longer run inflation expectations pce prices survey professional forecasters unchanged third quarter,measure longer run inflation expectation pce price survey professional forecaster unchanged third quarter,0
34,2016-09-21,measures longer run inflation expectations desk survey primary dealers survey market participants also unchanged september,measure longer run inflation expectation desk survey primary dealer survey market participant also unchanged september,0
35,2016-09-21,foreign real gdp growth slowed noticeably second quarter primarily owing contractions canada mexico economic growth foreign economies fell slightly average,foreign real gdp growth slow noticeably second quarter primarily owe contraction canada mexico economic growth foreign economy fell slightly average,0
36,2016-09-21,aggregate foreign economic growth appeared pick third quarter amid signs recovery oil production canada improved manufacturing production mexico,aggregate foreign economic growth appear pick third quarter amid sign recovery oil production canada improve manufacturing production mexico,0
37,2016-09-21,however weaker investment readings pointed slight moderation economic activity china third quarter,however weaker investment reading point slight moderation economic activity china third quarter,0
38,2016-09-21,outcomek referendum exit european union brexit apparently exerted less drag economic activity previously anticipated many analysts,outcomek referendum exit european union brexit apparently exert less drag economic activity previously anticipate many analyst,0
39,2016-09-21,nonetheless recent data suggested economic growth europe remained modest,nonetheless recent data suggest economic growth europe remain modest,0
40,2016-09-21,inflation generally subdued recent months advanced foreign economies afes emerging market economies emes,inflation generally subdue recent month advanced foreign economy afes emerge market economy emes,0
41,2016-09-21,staff review financial situation domestic financial conditions remained accommodative since july fomc meeting,staff review financial situation domestic financial condition remain accommodative since july fomc meeting,0
42,2016-09-21,asset prices moved within fairly narrow range much intermeeting period although volatility increased somewhat last days period market participants focused central bank communications united states abroad,asset price move within fairly narrow range much intermeeting period although volatility increase somewhat last day period market participant focus central bank communication united state abroad,0
43,2016-09-21,however domestic economic data releases appeared little softer balance investors expected august employment report manufacturing surveys particular expectations,however domestic economic data release appear little softer balance investor expect august employment report manufacturing survey particular expectation,0
44,2016-09-21,measures forward inflation compensation based treasury inflation protected securities rose slightly remained near lower end historical range,measure forward inflation compensation base treasury inflation protect security rise slightly remain near low end historical range,0
45,2016-09-21,broad stock price indexes moved down net since july fomc meeting,broad stock price index move down net since july fomc meeting,0
46,2016-09-21,growth cre loans banks continued strong,growth cre loan bank continued strong,0
47,2016-09-21,although puerto rico missed small debt payment due august  prices puerto rico benchmark general obligation bonds roughly unchanged intermeeting period,although puerto rico miss small debt payment due august price puerto rico benchmark general obligation bond roughly unchanged intermeeting period,0
48,2016-09-21,global risk asset prices broadly increased amid improving sentiment among investors low volatility,global risk asset price broadly increase amid improve sentiment among investor low volatility,0
49,2016-09-21,european financial markets remained resilient following brexit vote european bank equity prices increased net,european financial market remain resilient follow brexit vote european bank equity price increase net,0
50,2016-09-21,announcements foreign central banks garnered investor attention contributed somewhat higher asset price volatility later period,announcement foreign central bank garner investor attention contribute somewhat high asset price volatility later period,0
51,2016-09-21,september meeting boj introduced new monetary policy framework includes yield curve control commitment expand monetary base inflation exceeds  percent stays target stable manner,september meeting boj introduce new monetary policy framework include yield curve control commitment expand monetary base inflation exceeds percent stay target stable manner,0
52,2016-09-21,longer termk yields pound fell immediately following announcement retraced declines following better expected economic data later period,longer termk yield pound fell immediately follow announcement retrace decline follow well expect economic data later period,0
53,2016-09-21,staff economic outlooks economic projection prepared staff september fomc meeting forecast real gdp growth   little changed one presented july,staff economic outlook economic projection prepared staff september fomc meeting forecast real gdp growth little change one present july,0
54,2016-09-21,pace real gdp growth forecast faster second half year first half primarily reflecting modest increase rate growth private domestic final purchases sizable turnaround inventory investment,pace real gdp growth forecast faster second half year first half primarily reflect modest increase rate growth private domestic final purchase sizable turnaround inventory investment,0
55,2016-09-21,staff continued project real gdp would expand modestly faster pace potential output   supported primarily increases consumer spending and lesser degree somewhat faster growth business investment beginning next year,staff continued project real gdp would expand modestly faster pace potential output support primarily increase consumer spending and lesser degree somewhat faster growth business investment begin next year,0
56,2016-09-21,the staff slightly lowered assumption potential output growth medium term longer run,the staff slightly lower assumption potential output growth medium term longer run,0
57,2016-09-21, unemployment rate forecast remain flat remainder year gradually decline end  period unemployment rate projected run staff estimate longer run natural rate,unemployment rate forecast remain flat remainder year gradually decline end period unemployment rate project run staff estimate longer run natural rate,0
58,2016-09-21,forecast consumer price inflation essentially unchanged previous projection,forecast consumer price inflation essentially unchanged previous projection,0
59,2016-09-21,staff continued project inflation would increase next several years food energy prices along prices non energy imports expected begin steadily rising year,staff continued project inflation would increase next several year food energy price along price non energy import expect begin steadily rise year,0
60,2016-09-21,however inflation projected marginally committee longer run objective  percent ,however inflation project marginally committee longer run objective percent,0
61,2016-09-21,staff viewed uncertainty around projections real gdp growth unemployment rate inflation similar average past  years,staff view uncertainty around projection real gdp growth unemployment rate inflation similar average past year,0
62,2016-09-21,risks forecast real gdp seen tilted downside reflecting staff assessment monetary fiscal policy appeared better positioned offset large positive shocks adverse ones,risk forecast real gdp see tilt downside reflect staff assessment monetary fiscal policy appear well position offset large positive shock adverse one,0
63,2016-09-21,addition staff continued see risks forecast developments abroad skewed downside,addition staff continued see risk forecast development abroad skewed downside,0
64,2016-09-21,consistent downside risks aggregate demand staff viewed risks outlook unemployment rate tilted upside,consistent downside risk aggregate demand staff view risk outlook unemployment rate tilt upside,0
65,2016-09-21,risks projection inflation still judged weighted somewhat downside partly reflecting possibility longer term inflation expectations may edged down,risk projection inflation still judged weight somewhat downside partly reflect possibility longer term inflation expectation may edge down,0
66,2016-09-21,participants views current conditions economic outlook conjunction fomc meeting members board governors federal reserve bank presidents submitted projections likely outcomes real gdp growth unemployment rate inflation federal funds rate year   longer run,participant view current condition economic outlook conjunction fomc meeting member board governor federal reserve bank president submit projection likely outcome real gdp growth unemployment rate inflation federal fund rate year longer run,0
67,2016-09-21,longer run projections represented participant assessment rate variable would expected converge time appropriate monetary policy absence shocks economy,longer run projection represent participant assessment rate variable would expect converge time appropriate monetary policy absence shock economy,0
68,2016-09-21,projections policy assessments described summary economic projections addendum minutes,projection policy assessment described summary economic projection addendum minute,0
69,2016-09-21,discussion economic situation outlook participants agreed information received intermeeting period suggested labor market continued strengthen growth economic activity picked modest pace seen first half year,discussion economic situation outlook participant agree information receive intermeeting period suggest labor market continued strengthen growth economic activity picked modest pace see first half year,0
70,2016-09-21,although unemployment rate little changed recent months job gains solid average,although unemployment rate little change recent month job gain solid average,0
71,2016-09-21,household spending growing strongly business fixed investment remained soft,household spending grow strongly business fix investment remain soft,0
72,2016-09-21,inflation continued run committee  percent longer run objective partly reflecting earlier declines energy prices prices non energy imports,inflation continued run committee percent longer run objective partly reflect earlier decline energy price price non energy import,0
73,2016-09-21,market based measures inflation compensation remained low survey based measures longer term inflation expectations little changed balance recent months,market base measure inflation compensation remain low survey base measure longer term inflation expectation little change balance recent month,0
74,2016-09-21,participants generally expected that gradual adjustments stance monetary policy economic activity would expand moderate pace labor market conditions would strengthen somewhat further,participant generally expect that gradual adjustment stance monetary policy economic activity would expand moderate pace labor market condition would strengthen somewhat far,0
75,2016-09-21,inflation expected remain low near term part earlier declines energy prices rise  percent medium term transitory effects past declines energy import prices dissipated labor market strengthened further,inflation expect remain low near term part earlier decline energy price rise percent medium term transitory effect past decline energy import price dissipate labor market strengthen far,0
76,2016-09-21,number participants indicated little change economic outlooks recent months,number participant indicate little change economic outlook recent month,0
77,2016-09-21,substantial majority viewed near term risks economic outlook roughly balanced several indicating risks brexit receded,substantial majority view near term risk economic outlook roughly balance several indicate risk brexit recede,0
78,2016-09-21,however still judged overall risks weighted downside citing various factors included possibility weaker expected growth foreign economies continued uncertainty associated brexit proximity policy interest rates effective lower bound persistent headwinds economic growth,however still judged overall risk weight downside cite various factor include possibility weaker expect growth foreign economy continued uncertainty associate brexit proximity policy interest rate effective low bound persistent headwind economic growth,0
79,2016-09-21,participants agreed committee continue closely monitor inflation indicators global economic financial developments,participant agree committee continue closely monitor inflation indicator global economic financial development,0
80,2016-09-21,growth consumer spending appeared moderated somewhat third quarter rapid second quarter pace reflecting softening retail sales since june,growth consumer spending appear moderate somewhat third quarter rapid second quarter pace reflect soften retail sale since june,0
81,2016-09-21,district contacts provided mixed reports consistent easing growth sales,district contact provide mixed report consistent ease growth sale,0
82,2016-09-21,nevertheless incoming data pointed still solid growth consumption expenditures overall,nevertheless incoming data point still solid growth consumption expenditure overall,0
83,2016-09-21,many participants noted expected household spending primary contributor economic growth going forward,many participant note expect household spending primary contributor economic growth go forward,0
84,2016-09-21,saw consumer spending likely supported number factors including ongoing job gains rising household income wealth improved household balance sheets buoyant consumer sentiment,saw consumer spending likely support number factor include ongoing job gain rise household income wealth improve household balance sheet buoyant consumer sentiment,0
85,2016-09-21,economic activity second half year expected buoyed part pickup business fixed investment rebuilding inventories,economic activity second half year expect buoyed part pickup business fix investment rebuild inventory,0
86,2016-09-21,recent increase oil drilling rigs operation seen positive sign business investment although continued low level oil prices still weighing capital investment energy industry,recent increase oil drilling rig operation see positive sign business investment although continued low level oil price still weigh capital investment energy industry,0
87,2016-09-21,contacts districts suggested businesses taking cautious approach capital spending even outside energy sector instance preferring modernize existing manufacturing facilities rather increase capacity investing new facilities light continuing sluggish global demand shorter investment time horizons businesses uncertainty prospects government policy regulation,contact district suggest business take cautious approach capital spending even outside energy sector instance prefer modernize exist manufacturing facility rather increase capacity invest new facility light continue sluggish global demand shorter investment time horizon business uncertainty prospect government policy regulation,0
88,2016-09-21,couple participants pointed limited availability lots shortage skilled labor restraining residential construction activity districts one district constraints supply new homes sale expected boost spending home improvements offset drag slowing new construction,couple participant point limited availability lot shortage skilled labor restrain residential construction activity district one district constraint supply new home sale expect boost spending home improvement offset drag slow new construction,0
89,2016-09-21,couple participants noted firming crude oil prices led stabilization drilling activity,couple participant note firm crude oil price lead stabilization drilling activity,0
90,2016-09-21,agricultural sector lower crop prices continued weigh profit margins farm income expected fall loan repayment rates declined,agricultural sector low crop price continued weigh profit margin farm income expect fall loan repayment rate decline,0
91,2016-09-21,however participants noted economic growth many foreign economies remained subdued inflation rates abroad generally continued quite low,however participant note economic growth many foreign economy remain subdue inflation rate abroad generally continued quite low,0
