,Date,Original,Corpus,Class
167,2016-09-21,committee expects economic conditions evolve manner warrant gradual increases federal funds rate federal funds rate likely remain time levels expected prevail longer run,committee expect economic condition evolve manner warrant gradual increase federal fund rate federal fund rate likely remain time level expect prevail longer run,0
168,2016-09-21,however actual path federal funds rate depend economic outlook informed incoming data,however actual path federal fund rate depend economic outlook inform incoming data,0
169,2016-09-21,ms george judged unemployment rate inflation near longer run levels removing accommodation warranted would consistent prescriptions several frameworks assessing appropriate stance monetary policy,m george judged unemployment rate inflation near longer run level remove accommodation warrant would consistent prescription several framework assess appropriate stance monetary policy,0
170,2016-09-21,ms mester noted economy made considerable progress committee statutory goals outlook continued progress corroborated recent economic developments risks around outlook diminished,m mester note economy make considerable progress committee statutory goal outlook continued progress corroborate recent economic development risk around outlook diminish,0
171,2016-09-21,gradual path would give committee better chance recalibrating policy path time gains insights underlying structure economy,gradual path would give committee well chance recalibrating policy path time gain insight underlie structure economy,0
172,2016-09-21,believed inflation gradually rising robust employment growth moving economy close full employment appropriate continue gradual normalization monetary policy meeting,believe inflation gradually rise robust employment growth move economy close full employment appropriate continue gradual normalization monetary policy meeting,0
173,2016-09-21,believed failure could require committee raise policy interest rates faster aggressively later on could shorten rather lengthen duration economic expansion,believe failure could require committee raise policy interest rate faster aggressively later on could shorten rather lengthen duration economic expansion,0
174,2016-09-21,one participant not submit longer run projections change real gdp unemployment rate federal funds rate,one participant not submit longer run projection change real gdp unemployment rate federal fund rate,0
