,Date,Original,Corpus,Class
85,2017-03-15,regarding outlook inflation several participants noted apparently modest response inflation measures resource slack recent years along inflation expectations appeared remained well anchored limited risk marked pickup inflation labor market tightened further,regard outlook inflation several participant note apparently modest response inflation measure resource slack recent year along inflation expectation appear remain well anchor limited risk marked pickup inflation labor market tighten far,0
86,2017-03-15,contrast participants continued express concern substantial undershooting longer run normal rate unemployment occur posed significant upside risk inflation part possibility behavior inflation could differ recent decades,contrast participant continued express concern substantial undershoot longer run normal rate unemployment occur pose significant upside risk inflation part possibility behavior inflation could differ recent decade,0
87,2017-03-15,participants generally agreed would appropriate continue closely monitor inflation indicators global economic financial developments,participant generally agree would appropriate continue closely monitor inflation indicator global economic financial development,0
88,2017-03-15,discussion developments household sector participants agreed consumer spending likely contribute significantly economic growth year,discussion development household sector participant agree consumer spending likely contribute significantly economic growth year,0
89,2017-03-15,although motor vehicle sales fallen early year components pce also declined many participants suggested slowdown consumer spending january would likely temporary,although motor vehicle sale fall early year component pce also decline many participant suggest slowdown consumer spending january would likely temporary,0
90,2017-03-15,addition conditions conducive growth consumer spending strong labor market higher levels household wealth expected persist,addition condition conducive growth consumer spending strong labor market high level household wealth expect persist,0
91,2017-03-15,number participants also cited buoyant consumer confidence potentially supporting household expenditures although also mentioned improved sentiment not appear appreciably altered trajectory consumer spending far,number participant also cite buoyant consumer confidence potentially support household expenditure although also mention improve sentiment not appear appreciably alter trajectory consumer spending far,0
92,2017-03-15,nonetheless slower economic growth ample existing capacity modest returns energy sector noted factors continuing restrain overall capital spending,nonetheless slow economic growth ample exist capacity modest return energy sector note factor continue restrain overall capital spending,0
93,2017-03-15,labor market conditions continued improve,labor market condition continued improve,0
94,2017-03-15,monthly increases nonfarm payroll employment averaged nearly  three months ending february unemployment rate edged down labor force participation rate ticked up,monthly increase nonfarm payroll employment average nearly three month end february unemployment rate edge down labor force participation rate ticked up,0
95,2017-03-15,participants cited anecdotal evidence tightening labor markets,participant cite anecdotal evidence tighten labor market,0
96,2017-03-15,business contacts many districts reported difficulty recruiting qualified workers indicated either offer higher wages hire workers lower qualifications desired,business contact many district report difficulty recruiting qualify worker indicate either offer high wage hire worker low qualification desire,0
97,2017-03-15,couple participants reported ongoing mismatch skill requirements available jobs qualifications job applicants factor boosting number unfilled positions,couple participant report ongoing mismatch skill requirement available job qualification job applicant factor boost number unfilled position,0
98,2017-03-15,tight labor markets said increasingly factor businesses planning,tight labor market say increasingly factor business planning,0
99,2017-03-15,employers reportedly addressing scarcity labor expanding vocational programs contacts emphasized that effective efforts needed complemented programs assistance child care transportation,employer reportedly address scarcity labor expand vocational program contact emphasize that effective effort need complement program assistance child care transportation,0
100,2017-03-15,contrast several participants cited evidence slack remained labor market still modest aggregate wage growth unevenness wage gains across industries elevated share employees working part time economic reasons broad measures labor underutilization,contrast several participant cite evidence slack remain labor market still modest aggregate wage growth unevenness wage gain across industry elevate share employee work part time economic reason broad measure labor underutilization,0
101,2017-03-15,participants noted continued stability labor force participation rate face demographically driven downward trend,participant note continued stability labor force participation rate face demographically driven downward trend,0
102,2017-03-15,participants interpreted development suggesting slack labor market minimal,participant interpret development suggest slack labor market minimal,0
103,2017-03-15,others saw indication labor force participation could increase bit relative trend thus reduction labor market slack could occur,others saw indication labor force participation could increase bit relative trend thus reduction labor market slack could occur,0
104,2017-03-15,participants still expected economic growth stayed moderate projected unemployment rate would remain modestly estimates longer run normal rate unemployment next years,participant still expect economic growth stayed moderate project unemployment rate would remain modestly estimate longer run normal rate unemployment next year,0
105,2017-03-15,participants generally viewed information received intermeeting period reinforcing expectation inflation would stabilize around committee  percent objective medium term,participant generally view information receive intermeeting period reinforce expectation inflation would stabilize around committee percent objective medium term,0
106,2017-03-15, month change headline pce prices increased ,month change headline pce price increase,0
107,2017-03-15, percent january effects firmer consumer energy prices registered,percent january effect firmer consumer energy price register,0
108,2017-03-15,core pce prices rose relatively quick pace ,core pce price rise relatively quick pace,0
109,2017-03-15,federal reserve bank dallas  month trimmed mean pce inflation rate gradually increased past couple years reaching ,federal reserve bank dallas month trim mean pce inflation rate gradually increase past couple year reach,0
110,2017-03-15,although market based measures inflation compensation remained low somewhat levels seen last year,although market base measure inflation compensation remain low somewhat level see last year,0
111,2017-03-15,addition longer term inflation expectations michigan survey relatively stable since beginning year survey measures inflation expectations three year ahead measure federal reserve bank new york survey consumer expectations increased recent months,addition longer term inflation expectation michigan survey relatively stable since begin year survey measure inflation expectation three year ahead measure federal reserve bank new york survey consumer expectation increase recent month,0
112,2017-03-15,notwithstanding developments participants cautioned progress toward committee inflation objective not overstated noted inflation persistently  percent current economic expansion core inflation  month basis little changed recent months level  percent,notwithstanding development participant caution progress toward committee inflation objective not overstate note inflation persistently percent current economic expansion core inflation month basis little change recent month level percent,0
113,2017-03-15,contrast participants commented recent inflation data stronger expected anticipated inflation would reach committee objective  percent year,contrast participant comment recent inflation data strong expect anticipate inflation would reach committee objective percent year,0
114,2017-03-15,discussion recent developments financial markets participants noted financial conditions remained accommodative despite rise longer term interest rates recent months continued support expansion economic activity,discussion recent development financial market participant note financial condition remain accommodative despite rise longer term interest rate recent month continued support expansion economic activity,0
115,2017-03-15,many participants discussed implications rise equity prices past months several citing contributing easing financial conditions,many participant discuss implication rise equity price past month several cite contribute ease financial condition,0
116,2017-03-15,participants attributed recent equity price appreciation expectations corporate tax cuts increased risk tolerance among investors rather expectations stronger economic growth,participant attribute recent equity price appreciation expectation corporate tax cut increase risk tolerance among investor rather expectation strong economic growth,0
117,2017-03-15,participants viewed equity prices quite high relative standard valuation measures,participant view equity price quite high relative standard valuation measure,0
118,2017-03-15,observed prices risk assets emerging market stocks high yield corporate bonds commercial real estate also risen significantly recent months,observe price risk asset emerge market stock high yield corporate bond commercial real estate also risen significantly recent month,0
119,2017-03-15,contrast prices farmland reportedly edged lower part low commodity prices continued weigh farm income,contrast price farmland reportedly edge low part low commodity price continued weigh farm income,0
120,2017-03-15,still farmland valuations said remain quite high gauged standard benchmarks rent price ratios,still farmland valuation say remain quite high gauge standard benchmark rent price ratio,0
121,2017-03-15,consideration monetary policy participants generally agreed data intermeeting period broadly line expectations providing evidence strengthening labor market conditions ongoing progress toward committee objective  percent inflation,consideration monetary policy participant generally agree data intermeeting period broadly line expectation provide evidence strengthen labor market condition ongoing progress toward committee objective percent inflation,0
122,2017-03-15,participants noted views economic outlook essentially unchanged past couple meetings,participant note view economic outlook essentially unchanged past couple meeting,0
123,2017-03-15,judged that even increase target range stance monetary policy would remain accommodative supporting additional strengthening labor market conditions sustained return  percent inflation,judged that even increase target range stance monetary policy would remain accommodative support additional strengthen labor market condition sustain return percent inflation,0
124,2017-03-15,views outlook economy little changed participants generally continued judge gradual pace rate increases likely appropriate promote committee objectives maximum employment  percent inflation,view outlook economy little change participant generally continued judge gradual pace rate increase likely appropriate promote committee objective maximum employment percent inflation,0
125,2017-03-15,noted could take time inflation rise  percent sustained basis thus monetary policy would likely need remain accommodative longer order support economic conditions would foster increase,note could take time inflation rise percent sustain basis thus monetary policy would likely need remain accommodative longer order support economic condition would foster increase,0
126,2017-03-15,moreover neutral real rate defined real interest rate neither expansionary contractionary economy operating near potential still appeared low historical standards,moreover neutral real rate define real interest rate neither expansionary contractionary economy operating near potential still appear low historical standard,0
127,2017-03-15,risks included possibility stronger spending businesses households result improved sentiment appreciably expansionary fiscal policy rapid buildup inflationary pressures anticipated,risk include possibility strong spending business household result improve sentiment appreciably expansionary fiscal policy rapid buildup inflationary pressure anticipate,0
128,2017-03-15,addition number participants remarked recent prospective changes financial conditions posed upside risks economic projections extent financial developments provided greater stimulus spending currently anticipated well downside risks economic projections if example financial markets experience significant correction,addition number participant remark recent prospective change financial condition pose upside risk economic projection extent financial development provide great stimulus spending currently anticipate well downside risk economic projection if example financial market experience significant correction,0
129,2017-03-15,participants also mentioned potential developments abroad could adverse implicationss economy,participant also mention potential development abroad could adverse implication economy,0
130,2017-03-15,nearly participants judgeds economy operating near maximum employment,nearly participant judgeds economy operating near maximum employment,0
131,2017-03-15,contrast participants held different views regarding prospects attainment committee inflation goal,contrast participant held different view regard prospect attainment committee inflation goal,0
132,2017-03-15,number participants noted core inflation useful indicator future headline inflation latest reading  month core inflation suggested could still time headline inflation reached  percent sustained basis,number participant note core inflation useful indicator future headline inflation late reading month core inflation suggest could still time headline inflation reach percent sustain basis,0
133,2017-03-15,moreover several participants remarked even though inflation currently not far committee  percent objective important committee remove accommodation gradually help ensure inflation would stabilize around objective medium term,moreover several participant remark even though inflation currently not far committee percent objective important committee remove accommodation gradually help ensure inflation would stabilize around objective medium term,0
134,2017-03-15,participants emphasized sustained return  percent inflation particularly important light persistent shortfall inflation objective past several years,participant emphasize sustain return percent inflation particularly important light persistent shortfall inflation objective past several year,0
135,2017-03-15,however several participants judged headline pce price index rising nearly  percent core pce index increasing close   percent  month period ending january committee essentially met inflation goal poised meet later year,however several participant judged headline pce price index rise nearly percent core pce index increase close percent month period end january committee essentially met inflation goal poise meet later year,0
136,2017-03-15,committee policy action discussion monetary policy period ahead members judged information received since committee previous meeting indicated labor market continued strengthen economic activity continued expand moderate pace,committee policy action discussion monetary policy period ahead member judged information receive since committee previous meeting indicate labor market continued strengthen economic activity continued expand moderate pace,0
137,2017-03-15,job gains remained solid unemployment rate changed little recent months,job gain remain solid unemployment rate change little recent month,0
138,2017-03-15,household spending continued rise moderately business fixed investment appeared firmed somewhat,household spending continued rise moderately business fix investment appear firm somewhat,0
139,2017-03-15,inflation increased recent quarters  month change headline pce price index rising nearly  percent january close committee longer run objective,inflation increase recent quarter month change headline pce price index rise nearly percent january close committee longer run objective,0
140,2017-03-15,however nearly members judged committee not yet achieved objective headline inflation sustained basis,however nearly member judged committee not yet achieve objective headline inflation sustain basis,0
141,2017-03-15,members generally viewed important highlight core inflation excludes volatile energy food prices historically tended good indicator future headline inflation little changed continued run somewhat  percent,member generally view important highlight core inflation excludes volatile energy food price historically tend good indicator future headline inflation little change continued run somewhat percent,0
142,2017-03-15,moreover market based measures inflation compensation remained low,moreover market base measure inflation compensation remain low,0
143,2017-03-15,respect economic outlook implications monetary policy members continued expect that gradual adjustments stance monetary policy economic activity would expand moderate pace labor market conditions would strengthen somewhat further,respect economic outlook implication monetary policy member continued expect that gradual adjustment stance monetary policy economic activity would expand moderate pace labor market condition would strengthen somewhat far,0
144,2017-03-15,noted recent increases consumer energy prices could cause inflation temporarily reach even rise bit  percent near term,note recent increase consumer energy price could cause inflation temporarily reach even rise bit percent near term,0
145,2017-03-15,members anticipated inflation would stabilize around  percent medium term commented transitory deviations  percent expected,member anticipate inflation would stabilize around percent medium term comment transitory deviation percent expect,0
146,2017-03-15,members continued judge significant uncertainty effects possible changes fiscal government policies near term risks economic outlook appeared roughly balanced,member continued judge significant uncertainty effect possible change fiscal government policy near term risk economic outlook appear roughly balance,0
147,2017-03-15,members agreed would continue closely monitor inflation indicators global economic financial developments,member agree would continue closely monitor inflation indicator global economic financial development,0
148,2017-03-15,assessing current conditions outlook economic activity labor market inflation one member agreed raise target range federal funds rate   percent,assess current condition outlook economic activity labor market inflation one member agree raise target range federal fund rate percent,0
149,2017-03-15,increase viewed appropriate light progress made toward committee objectives maximum employment  percent inflation,increase view appropriate light progress make toward committee objective maximum employment percent inflation,0
150,2017-03-15,members generally noted increase target range not reflect changes assessments economic outlook appropriate path federal funds rate adding increase consistent gradual pace removal accommodation anticipated december committee last raised target range,member generally note increase target range not reflect change assessment economic outlook appropriate path federal fund rate add increase consistent gradual pace removal accommodation anticipate december committee last raise target range,0
151,2017-03-15,member preferred await additional information amount slack remaining labor market increased evidence inflation would stabilize committee objective taking another step remove monetary policy accommodation,member prefer await additional information amount slack remain labor market increase evidence inflation would stabilize committee objective take another step remove monetary policy accommodation,0
152,2017-03-15,members agreed that determining timing size future adjustments target range federal funds rate committee would assess realized expected economic conditions relative objectives maximum employment  percent inflation,member agree that determine timing size future adjustment target range federal fund rate committee would ass realize expect economic condition relative objective maximum employment percent inflation,0
153,2017-03-15,assessment would take account wide range information including measures labor market conditions indicators inflation pressures inflation expectations readings financial international developments,assessment would take account wide range information include measure labor market condition indicator inflation pressure inflation expectation reading financial international development,0
154,2017-03-15,partly light likelihood recent higher readings headline inflation mostly reflected temporary effect increases consumer energy prices members agreed committee would continue carefully monitor actual expected inflation developments relative inflation goal,partly light likelihood recent high reading headline inflation mostly reflect temporary effect increase consumer energy price member agree committee would continue carefully monitor actual expect inflation development relative inflation goal,0
155,2017-03-15,members expressed view committee avoid policy actions communications might interpreted suggesting committee  percent inflation objective actually ceiling,member express view committee avoid policy action communication might interpret suggest committee percent inflation objective actually ceiling,0
156,2017-03-15,several members observed explicit recognition statement committee inflation goal symmetric could help support inflation expectations level consistent goal noted symmetric inflation objective implied committee would adjust stance monetary policy response inflation either persistently persistently  percent,several member observe explicit recognition statement committee inflation goal symmetric could help support inflation expectation level consistent goal note symmetric inflation objective imply committee would adjust stance monetary policy response inflation either persistently persistently percent,0
157,2017-03-15,members also reiterated expected economic conditions would evolve manner would warrant gradual increases federal funds rate,member also reiterate expect economic condition would evolve manner would warrant gradual increase federal fund rate,0
158,2017-03-15,however noted actual path federal funds rate would depend economic outlook informed incoming data,however note actual path federal fund rate would depend economic outlook inform incoming data,0
159,2017-03-15,information received since federal open market committee met february indicates labor market continued strengthen economic activity continued expand moderate pace,information receive since federal open market committee met february indicates labor market continued strengthen economic activity continued expand moderate pace,0
160,2017-03-15,job gains remained solid unemployment rate little changed recent months,job gain remain solid unemployment rate little change recent month,0
161,2017-03-15,household spending continued rise moderately business fixed investment appears firmed somewhat,household spending continued rise moderately business fix investment appear firm somewhat,0
162,2017-03-15,inflation increased recent quarters moving close committee  percent longer run objective excluding energy food prices inflation little changed continued run somewhat  percent,inflation increase recent quarter move close committee percent longer run objective exclude energy food price inflation little change continued run somewhat percent,0
163,2017-03-15,market based measures inflation compensation remain low survey based measures longer term inflation expectations little changed balance,market base measure inflation compensation remain low survey base measure longer term inflation expectation little change balance,0
164,2017-03-15,consistent statutory mandate committee seeks foster maximum employment price stability,consistent statutory mandate committee seek foster maximum employment price stability,0
165,2017-03-15,committee expects that gradual adjustments stance monetary policy economic activity expand moderate pace labor market conditions strengthen somewhat further inflation stabilize around  percent medium term,committee expect that gradual adjustment stance monetary policy economic activity expand moderate pace labor market condition strengthen somewhat far inflation stabilize around percent medium term,0
166,2017-03-15,near term risks economic outlook appear roughly balanced,near term risk economic outlook appear roughly balance,0
167,2017-03-15,committee continues closely monitor inflation indicators global economic financial developments,committee continue closely monitor inflation indicator global economic financial development,0
168,2017-03-15,view realized expected labor market conditions inflation committee decided raise target range federal funds rate   percent,view realize expect labor market condition inflation committee decide raise target range federal fund rate percent,0
