,Date,Original,Corpus,Class
95,2017-06-14,however couple participants raised concern tighter relationship inflation resource utilization could reemerge unemployment rate ran significantly longer run normal level could result inflation running persistently committee  percent objective,however couple participant raise concern tighter relationship inflation resource utilization could reemerge unemployment rate ran significantly longer run normal level could result inflation run persistently committee percent objective,0
96,2017-06-14,overall participants continued see near term risks economic outlook roughly balanced,overall participant continued see near term risk economic outlook roughly balance,0
97,2017-06-14,participants noted uncertainty regarding possible enactment timing nature changes fiscal government policies saw upside downside risks economic outlook associated changes,participant note uncertainty regard possible enactment timing nature change fiscal government policy saw upside downside risk economic outlook associate change,0
98,2017-06-14,number participants pointing improved prospects foreign economic growth viewed downside riskss economic outlook stemming international developments receded intermeeting period,number participant point improve prospect foreign economic growth view downside risk economic outlook stem international development recede intermeeting period,0
99,2017-06-14,regard outlook inflation participants emphasized downside risks particularly light recent low readings inflation along measures inflation compensation survey measures inflation expectations still low,regard outlook inflation participant emphasize downside risk particularly light recent low reading inflation along measure inflation compensation survey measure inflation expectation still low,0
100,2017-06-14,however couple participants expressed concern substantial undershooting longer run normal rate unemployment could pose appreciable upside risk inflation give rise macroeconomic financial imbalances eventually could lead significant economic downturn,however couple participant express concern substantial undershoot longer run normal rate unemployment could pose appreciable upside risk inflation give rise macroeconomic financial imbalance eventually could lead significant economic downturn,0
101,2017-06-14,participants agreed committee continue monitor inflation developments closely,participant agree committee continue monitor inflation development closely,0
102,2017-06-14,discussion recent developments financial markets participants observed that intermeeting period equity prices rose longer term interest rates declined volatility financial markets generally low,discussion recent development financial market participant observe that intermeeting period equity price rise longer term interest rate decline volatility financial market generally low,0
103,2017-06-14,corporate earnings growth robust nevertheless assessment participants equity prices high judged standard valuation measures,corporate earnings growth robust nevertheless assessment participant equity price high judged standard valuation measure,0
104,2017-06-14,participants offered various explanations low bond yields including prospect sluggish longer term economic growth well elevated level federal reserve longer term asset holdings,participant offer various explanation low bond yield include prospect sluggish longer term economic growth well elevate level federal reserve longer term asset holding,0
105,2017-06-14,participants suggested increased risk tolerance among investors might contributing elevated asset prices broadly participants expressed concern subdued market volatility coupled low equity premium could lead buildup risks financial stability,participant suggest increase risk tolerance among investor might contribute elevate asset price broadly participant express concern subdue market volatility couple low equity premium could lead buildup risk financial stability,0
106,2017-06-14,discussion monetary policy participants generally saw outlook economic activity medium term outlook inflation little changed viewed continued gradual removal monetary policy accommodation appropriate,discussion monetary policy participant generally saw outlook economic activity medium term outlook inflation little change view continued gradual removal monetary policy accommodation appropriate,0
107,2017-06-14,participants agreed that even increase target range federal funds rate meeting stance monetary policy would remain accommodative supporting additional strengthening labor market conditions sustained return  percent inflation,participant agree that even increase target range federal fund rate meeting stance monetary policy would remain accommodative support additional strengthen labor market condition sustain return percent inflation,0
108,2017-06-14,one participant not believe appropriate raise federal funds rate target range meeting participant suggested committee maintain target range federal funds rate   percent inflation rate actually moving toward committee  percent longer run objective,one participant not believe appropriate raise federal fund rate target range meeting participant suggest committee maintain target range federal fund rate percent inflation rate actually move toward committee percent longer run objective,0
109,2017-06-14,however others emphasized deferring decision later year would permit additional time assess outlook economic activity inflation,however others emphasize defer decision later year would permit additional time ass outlook economic activity inflation,0
110,2017-06-14,several participants indicated reduction policy accommodation arising commencement balance sheet normalization one basis believing that economic conditions evolved broadly anticipated target range federal funds rate would follow less steep path otherwise would,several participant indicate reduction policy accommodation arise commencement balance sheet normalization one basis believe that economic condition evolve broadly anticipate target range federal fund rate would follow less steep path otherwise would,0
111,2017-06-14,several participants expressed confidence series increases federal funds rate coming years along lines implied medians projections federal funds rate june sep would contribute stabilization medium term inflation rate around committee  percent objective especially tightening monetary policy would affect economy lag would start point policy still accommodative,several participant express confidence series increase federal fund rate come year along line imply median projection federal fund rate june sep would contribute stabilization medium term inflation rate around committee percent objective especially tighten monetary policy would affect economy lag would start point policy still accommodative,0
112,2017-06-14,participants expressed concern path increases policy rate gradual might prove inconsistent sustained return inflation  percent,participant express concern path increase policy rate gradual might prove inconsistent sustain return inflation percent,0
113,2017-06-14,several participants endorsed policy approach embedded many participants projections unemployment rate would undershoot current estimates longer term normal rate sustained period,several participant endorse policy approach embed many participant projection unemployment rate would undershoot current estimate longer term normal rate sustain period,0
114,2017-06-14,noted longer run normal rate unemployment difficult measure recent evidence suggested resource pressures generated modest responses nominal wage growth inflation,note longer run normal rate unemployment difficult measure recent evidence suggest resource pressure generate modest response nominal wage growth inflation,0
115,2017-06-14,backdrop possible benefits cited policymakers period tight labor markets included rise nominal wage growth would bolster inflation expectations help push inflation rate closer committee  percent longer run goal well stimulus labor market participation business fixed investment,backdrop possible benefit cite policymakers period tight labor market include rise nominal wage growth would bolster inflation expectation help push inflation rate closer committee percent longer run goal well stimulus labor market participation business fix investment,0
116,2017-06-14,also suggested symmetry committee inflation goal might underscored inflation modestly exceeded  percent time outcome would follow long period inflation undershot  percent longer term objective,also suggest symmetry committee inflation goal might underscored inflation modestly exceed percent time outcome would follow long period inflation undershot percent longer term objective,0
117,2017-06-14,several participants expressed concern substantial sustained unemployment undershooting might make economy likely experience financial instability could lead sharp rise inflation would require rapid policy tightening that turn could raise risk economic downturn,several participant express concern substantial sustain unemployment undershoot might make economy likely experience financial instability could lead sharp rise inflation would require rapid policy tighten that turn could raise risk economic downturn,0
118,2017-06-14,however participants noted sharp rise inflation inflation expectations occur committee could readily respond using conventional monetary policy tools,however participant note sharp rise inflation inflation expectation occur committee could readily respond use conventional monetary policy tool,0
119,2017-06-14,regard financial stability one participant emphasized importance remaining vigilant financial developments observed previous episodes elevated financial imbalances low unemployment limited relevance present situation current system financial regulation likely robust prevailing financial crisis,regard financial stability one participant emphasize importance remain vigilant financial development observe previous episode elevate financial imbalance low unemployment limited relevance present situation current system financial regulation likely robust prevail financial crisis,0
120,2017-06-14,committee policy action discussion monetary policy period ahead members judged information received since federal open market committee met may indicated labor market continued strengthen economic activity rising moderately far year,committee policy action discussion monetary policy period ahead member judged information receive since federal open market committee met may indicate labor market continued strengthen economic activity rise moderately far year,0
121,2017-06-14,job gains moderated solid average since beginning year unemployment rate declined,job gain moderate solid average since begin year unemployment rate decline,0
122,2017-06-14,household spending picked recent months business fixed investment continued expand,household spending picked recent month business fix investment continued expand,0
123,2017-06-14,inflation  month basis declined recently running somewhat  percent,inflation month basis decline recently run somewhat percent,0
124,2017-06-14,measure inflation excluding food energy prices likewise running somewhat  percent,measure inflation exclude food energy price likewise run somewhat percent,0
125,2017-06-14,market based measures inflation compensation remained low survey based measures longer term inflation expectations changed little balance,market base measure inflation compensation remain low survey base measure longer term inflation expectation change little balance,0
126,2017-06-14,respect economic outlook implications monetary policy members continued expect that gradual adjustments stance monetary policy economic activity would expand moderate pace labor market conditions would strengthen somewhat further,respect economic outlook implication monetary policy member continued expect that gradual adjustment stance monetary policy economic activity would expand moderate pace labor market condition would strengthen somewhat far,0
127,2017-06-14,inflation  month basis expected remain somewhat  percent near term almost members expected stabilize around  percent medium term although monitoring inflation developments closely,inflation month basis expect remain somewhat percent near term almost member expect stabilize around percent medium term although monitoring inflation development closely,0
128,2017-06-14,members continued judge significant uncertainty effects possible changes fiscal government policies near term risks economic outlook appeared roughly balanced especially risks related foreign economic financial developments diminished,member continued judge significant uncertainty effect possible change fiscal government policy near term risk economic outlook appear roughly balance especially risk related foreign economic financial development diminish,0
129,2017-06-14,assessing current conditions outlook economic activity labor market inflation one member agreed raise target range federal funds rate    percent,assess current condition outlook economic activity labor market inflation one member agree raise target range federal fund rate percent,0
130,2017-06-14,noted stance monetary policy remained accommodative thereby supporting strengthening labor market conditions sustained return  percent inflation,note stance monetary policy remain accommodative thereby support strengthen labor market condition sustain return percent inflation,0
131,2017-06-14,members agreed that determining timing size future adjustments target range federal funds rate committee would assess realized expected economic conditions relative objectives maximum employment  percent inflation,member agree that determine timing size future adjustment target range federal fund rate committee would ass realize expect economic condition relative objective maximum employment percent inflation,0
132,2017-06-14,assessment would take account wide range information including measures labor market conditions indicators inflation pressures inflation expectations readings financial international developments,assessment would take account wide range information include measure labor market condition indicator inflation pressure inflation expectation reading financial international development,0
133,2017-06-14,members also agreed would carefully monitor actual expected developments inflation relation committee symmetric inflation goal,member also agree would carefully monitor actual expect development inflation relation committee symmetric inflation goal,0
134,2017-06-14,expected economic conditions would evolve manner would warrant gradual increases federal funds rate agreed federal funds rate likely remain time levels expected prevail longer run,expect economic condition would evolve manner would warrant gradual increase federal fund rate agree federal fund rate likely remain time level expect prevail longer run,0
135,2017-06-14,however actual path federal funds rate would depend economic outlook informed incoming data,however actual path federal fund rate would depend economic outlook inform incoming data,0
136,2017-06-14,committee expected begin implementing balance sheet normalization program  provided economy evolves broadly anticipated,committee expect begin implement balance sheet normalization program provide economy evolves broadly anticipate,0
137,2017-06-14,information received since federal open market committee met may indicates labor market continued strengthen economic activity rising moderately far year,information receive since federal open market committee met may indicates labor market continued strengthen economic activity rise moderately far year,0
138,2017-06-14,job gains moderated solid average since beginning year unemployment rate declined,job gain moderate solid average since begin year unemployment rate decline,0
139,2017-06-14,household spending picked recent months business fixed investment continued expand,household spending picked recent month business fix investment continued expand,0
140,2017-06-14, month basis inflation declined recently and like measure excluding food energy prices running somewhat  percent,month basis inflation decline recently and like measure exclude food energy price run somewhat percent,0
141,2017-06-14,market based measures inflation compensation remain low survey based measures longer term inflation expectations little changed balance,market base measure inflation compensation remain low survey base measure longer term inflation expectation little change balance,0
142,2017-06-14,consistent statutory mandate committee seeks foster maximum employment price stability,consistent statutory mandate committee seek foster maximum employment price stability,0
143,2017-06-14,committee continues expect that gradual adjustments stance monetary policy economic activity expand moderate pace labor market conditions strengthen somewhat further,committee continue expect that gradual adjustment stance monetary policy economic activity expand moderate pace labor market condition strengthen somewhat far,0
144,2017-06-14,inflation  month basis expected remain somewhat  percent near term stabilize around committee  percent objective medium term,inflation month basis expect remain somewhat percent near term stabilize around committee percent objective medium term,0
145,2017-06-14,near term risks economic outlook appear roughly balanced committee monitoring inflation developments closely,near term risk economic outlook appear roughly balance committee monitoring inflation development closely,0
146,2017-06-14,view realized expected labor market conditions inflation committee decided raise target range federal funds rate    percent,view realize expect labor market condition inflation committee decide raise target range federal fund rate percent,0
147,2017-06-14,stance monetary policy remains accommodative thereby supporting strengthening labor market conditions sustained return  percent inflation,stance monetary policy remains accommodative thereby support strengthen labor market condition sustain return percent inflation,0
148,2017-06-14,determining timing size future adjustments target range federal funds rate committee assess realized expected economic conditions relative objectives maximum employment  percent inflation,determine timing size future adjustment target range federal fund rate committee ass realize expect economic condition relative objective maximum employment percent inflation,0
149,2017-06-14,assessment take account wide range information including measures labor market conditions indicators inflation pressures inflation expectations readings financial international developments,assessment take account wide range information include measure labor market condition indicator inflation pressure inflation expectation reading financial international development,0
150,2017-06-14,committee carefully monitor actual expected inflation developments relative symmetric inflation goal,committee carefully monitor actual expect inflation development relative symmetric inflation goal,0
151,2017-06-14,committee expects economic conditions evolve manner warrant gradual increases federal funds rate federal funds rate likely remain time levels expected prevail longer run,committee expect economic condition evolve manner warrant gradual increase federal fund rate federal fund rate likely remain time level expect prevail longer run,0
152,2017-06-14,however actual path federal funds rate depend economic outlook informed incoming data,however actual path federal fund rate depend economic outlook inform incoming data,0
153,2017-06-14,committee currently expects begin implementing balance sheet normalization program year provided economy evolves broadly anticipated,committee currently expect begin implement balance sheet normalization program year provide economy evolves broadly anticipate,0
154,2017-06-14,view recent data suggesting labor market improved further increased doubts achievement committee  percent longer run inflation objective thus not provided compelling basis firm monetary policy meeting,view recent data suggest labor market improve far increase doubt achievement committee percent longer run inflation objective thus not provide compelling basis firm monetary policy meeting,0
155,2017-06-14,preferred await additional evidence recent decline inflation temporary inflation moving toward committee symmetric  percent inflation objective,prefer await additional evidence recent decline inflation temporary inflation move toward committee symmetric percent inflation objective,0
156,2017-06-14,concerned raising federal funds rate target range soon increased likelihood inflation expectations would decline inflation would continue run  percent,concerned raise federal fund rate target range soon increase likelihood inflation expectation would decline inflation would continue run percent,0
157,2017-06-14,attended staff report economic financial situation,attend staff report economic financial situation,0
158,2017-06-14,four members board governors one fewer march  office time june  meeting submitted economic projections,four member board governor one few march office time june meeting submit economic projection,0
159,2017-06-14,office president federal reserve bank richmond vacant time fomc meeting first vice president mark mullinix submitted economic projections,office president federal reserve bank richmond vacant time fomc meeting first vice president mark mullinix submit economic projection,0
160,2017-06-14,one participant not submit longer run projections real output growth unemployment rate federal funds rate,one participant not submit longer run projection real output growth unemployment rate federal fund rate,0
