,Date,Original,Corpus,Class
0,2017-03-15,global equity prices generally increased further credit spreads corporate debt emerging market bonds narrowed yields treasury securities rose somewhat,global equity price generally increase far credit spread corporate debt emerge market bond narrow yield treasury security rise somewhat,0
1,2017-03-15,survey responses market participants reported elevated uncertainty outlooks economic policies financial asset prices various measures implied volatility nonetheless declined further,survey response market participant report elevate uncertainty outlook economic policy financial asset price various measure imply volatility nonetheless decline far,0
2,2017-03-15,monetary policies advanced economy central banks remained quite accommodative signs progress central banks inflation mandates evident,monetary policy advanced economy central bank remain quite accommodative sign progress central bank inflation mandate evident,0
3,2017-03-15,late intermeeting period market participants came interprets monetary policy communications implying high odds firming monetary policy meeting changes market prices suggested slightly steeper path federal funds rate next years previously anticipated,late intermeeting period market participant come interprets monetary policy communication imply high odds firm monetary policy meeting change market price suggest slightly steeper path federal fund rate next year previously anticipate,0
4,2017-03-15,system open market account reinvestment policy staff provided several briefings summarized issues related potential changes committee policy reinvesting principal payments securities held soma,system open market account reinvestment policy staff provide several briefing summarize issue related potential change committee policy reinvesting principal payment security held soma,0
5,2017-03-15,briefings discussed macroeconomic implications alternative strategies committee could employ respect reinvestments including making timing end reinvestments either date dependent dependent economic conditions,briefing discuss macroeconomic implication alternative strategy committee could employ respect reinvestments include make timing end reinvestments either date dependent dependent economic condition,0
6,2017-03-15,number participants indicated committee resume asset purchases substantially adverse economic circumstances warranted greater monetary policy accommodation could provided lowering federal funds rate effective lower bound,number participant indicate committee resume asset purchase substantially adverse economic circumstance warrant great monetary policy accommodation could provide lower federal fund rate effective low bound,0
7,2017-03-15,consistent policy normalization principles plans nearly participants preferred timing change reinvestment policy depend assessment economic financial conditions,consistent policy normalization principle plan nearly participant prefer timing change reinvestment policy depend assessment economic financial condition,0
8,2017-03-15,participants expressed view timing depend qualitative judgment economic financial conditions,participant express view timing depend qualitative judgment economic financial condition,0
9,2017-03-15,judgment would importantly encompass assessment committee risks outlook including degree confidence evolving circumstances would not soon require reversal direction policy,judgment would importantly encompass assessment committee risk outlook include degree confidence evolve circumstance would not soon require reversal direction policy,0
10,2017-03-15,provided economy continued perform expected participants anticipated gradual increases federal funds rate would continue judged change committee reinvestment policy would likely appropriate later year,provide economy continued perform expect participant anticipate gradual increase federal fund rate would continue judged change committee reinvestment policy would likely appropriate later year,0
11,2017-03-15,participants expressed view might appropriate committee restart reinvestments economy encountered significant adverse shocks required reduction target range federal funds rate,participant express view might appropriate committee restart reinvestments economy encounter significant adverse shock require reduction target range federal fund rate,0
12,2017-03-15,policymakers also discussed potential benefits costs approaches would either phase cease reinvestments principal securities,policymakers also discuss potential benefit cost approach would either phase cease reinvestments principal security,0
13,2017-03-15,staff review economic situation information reviewed march   meeting suggested labor market strengthened january february real gross domestic product gdp continuing expand first quarter albeit slower pace fourth quarter slowing likely reflecting transitory factors,staff review economic situation information review march meeting suggest labor market strengthen january february real gross domestic product gdp continue expand first quarter albeit slow pace fourth quarter slow likely reflect transitory factor,0
14,2017-03-15, month change consumer prices moved recent months close committee longer run objective  percent excluding food energy prices inflation little changed continued run somewhat  percent,month change consumer price move recent month close committee longer run objective percent exclude food energy price inflation little change continued run somewhat percent,0
15,2017-03-15,total nonfarm payroll employment increased brisk pace january february,total nonfarm payroll employment increase brisk pace january february,0
16,2017-03-15,unemployment rate edged back ,unemployment rate edge back,0
17,2017-03-15, percent february labor force participation rate rose first two months year,percent february labor force participation rate rise first two month year,0
18,2017-03-15,share workers employed part time economic reasons little changed net,share worker employ part time economic reason little change net,0
19,2017-03-15,rate private sector job openings unchanged high level december rate hiring edged rate quits edged down,rate private sector job opening unchanged high level december rate hire edge rate quits edge down,0
20,2017-03-15,four week moving average initial claims unemployment insurance benefits low level early march,four week move average initial claim unemployment insurance benefit low level early march,0
21,2017-03-15,measures labor compensation continued rise moderate rate,measure labor compensation continued rise moderate rate,0
22,2017-03-15,compensation per hour nonfarm business sector increased   percent four quarters  average hourly earnings employees increased   percent  months ending february,compensation per hour nonfarm business sector increase percent four quarter average hourly earnings employee increase percent month end february,0
23,2017-03-15,unemployment rates african americans hispanics whites close levels seen recent recession unemployment rates african americans hispanics remained rate whites,unemployment rate african american hispanic white close level see recent recession unemployment rate african american hispanic remain rate white,0
24,2017-03-15,past year so jobless rate african americans moved lower rates hispanics whites moved roughly sideways,past year so jobless rate african american move low rate hispanic white move roughly sideways,0
25,2017-03-15,motor vehicle sales stepped january february brisk year end pace unseasonably warm weather prompted decline consumer spending energy services,motor vehicle sale step january february brisk year end pace unseasonably warm weather prompt decline consumer spending energy service,0
26,2017-03-15,taken together components nominal retail sales data used bureau economic analysis construct estimate pce unchanged february robust gain january,take together component nominal retail sale data use bureau economic analysis construct estimate pce unchanged february robust gain january,0
27,2017-03-15,recent readings key factors influence consumer spending including gains employment real disposable personal income households net worth consistent moderate increases real pce early ,recent reading key factor influence consumer spending include gain employment real disposable personal income household net worth consistent moderate increase real pce early,0
28,2017-03-15,firms nominal spending nonresidential structures excluding drilling mining fairly flat recent months number crude oil natural gas rigs operation indicator spending structures drilling mining sector continued increase early march,firm nominal spending nonresidential structure exclude drilling mining fairly flat recent month number crude oil natural gas rig operation indicator spending structure drilling mining sector continued increase early march,0
29,2017-03-15,limited available data suggested inventory investment likely make smaller contribution real gdp growth early part year fourth quarter,limited available data suggest inventory investment likely make small contribution real gdp growth early part year fourth quarter,0
30,2017-03-15,although state local government payrolls expanded january february nominal construction spending governments fell sharply january,although state local government payroll expand january february nominal construction spending government fell sharply january,0
31,2017-03-15,net exports exerted significant drag real gdp growth fourth quarter  january trade data suggested net exports would continue weigh growth first quarter year,net export exert significant drag real gdp growth fourth quarter january trade data suggest net export would continue weigh growth first quarter year,0
32,2017-03-15,totals consumer prices measured pce price index increased little less  percent  months ending january,total consumer price measure pce price index increase little less percent month end january,0
33,2017-03-15,core pce price inflation excludes changes food energy prices   percent  months held part decreases prices nonenergy imports part period,core pce price inflation excludes change food energy price percent month held part decrease price nonenergy import part period,0
34,2017-03-15, months ending february total consumer prices measured consumer price index cpi rose   percent core cpi inflation   percent,month end february total consumer price measure consumer price index cpi rise percent core cpi inflation percent,0
35,2017-03-15,medians survey based measures longer run inflation expectations michigan survey survey professional forecasters desk survey primary dealers survey market participants little changed balance recent months,median survey base measure longer run inflation expectation michigan survey survey professional forecaster desk survey primary dealer survey market participant little change balance recent month,0
36,2017-03-15,foreign real gdp growth slowed bit fourth quarter relatively strong rate third quarter still somewhat higher average pace past two years,foreign real gdp growth slow bit fourth quarter relatively strong rate third quarter still somewhat high average pace past two year,0
37,2017-03-15,much world including europe japan emerging asia economic activity continued grow moderate pace,much world include europe japan emerge asia economic activity continued grow moderate pace,0
38,2017-03-15,canada mexico two important trading partners united states growth stepped unusually strong third quarter rates still solid pace fourth quarter brazil recession deepened,canada mexico two important trading partner united state growth step unusually strong third quarter rate still solid pace fourth quarter brazil recession deepen,0
39,2017-03-15,recently released purchasing managers indexes confidence indicators abroad generally upbeat pointed continued moderate foreign growth early  although indicators mexico suggested slowing,recently release purchasing manager index confidence indicator abroad generally upbeat point continued moderate foreign growth early although indicator mexico suggest slow,0
40,2017-03-15,inflation advanced foreign economies afes continued rise largely reflecting increases retail energy prices currency depreciation,inflation advanced foreign economy afes continued rise largely reflect increase retail energy price currency depreciation,0
41,2017-03-15,among emerging market economies emes inflation rose mexico part reflecting substantial hike fuel prices fell china parts south america,among emerge market economy emes inflation rise mexico part reflect substantial hike fuel price fell china part south america,0
42,2017-03-15,staff review financial situation financial markets generally quiet intermeeting period,staff review financial situation financial market generally quiet intermeeting period,0
43,2017-03-15,broad equity price indexes rose further leaving standard measures valuations historical norms,broad equity price index rise far leave standard measure valuation historical norm,0
44,2017-03-15,chair semiannual monetary policy testimony reportedly led market participants price slightly higher probability monetary policy firming near term,chair semiannual monetary policy testimony reportedly lead market participant price slightly high probability monetary policy firm near term,0
45,2017-03-15,subsequently investors took note mention minutes january february fomc meeting many participants expressed view might appropriate raise federal funds rate fairly soon incoming information labor market inflation line stronger current expectations risks overshooting committee maximum employment inflation objectives increased,subsequently investor take note mention minute january february fomc meeting many participant express view might appropriate raise federal fund rate fairly soon incoming information labor market inflation line strong current expectation risk overshoot committee maximum employment inflation objective increase,0
46,2017-03-15,treasury yields reacted modestly period domestic economic data releases reportedly seen little stronger expected balance,treasury yield react modestly period domestic economic data release reportedly see little strong expect balance,0
47,2017-03-15,measures inflation compensation based treasury inflation protected securities little changed net since february fomc meeting,measure inflation compensation base treasury inflation protect security little change net since february fomc meeting,0
48,2017-03-15,broads equity price indexes increased intermeeting period measures valuations price earnings ratios rose historical norms,broad equity price index increase intermeeting period measure valuation price earnings ratio rise historical norm,0
49,2017-03-15,stock prices rose across industries equity prices financial firms outperformed broader indexes,stock price rise across industry equity price financial firm outperform broader index,0
50,2017-03-15,since previous fomc meeting better expected economic data earnings releases abroad also supported risk sentiment foreign equity prices increased flows emerging market mutual funds picked up emerging market bond spreads narrowed,since previous fomc meeting well expect economic data earnings release abroad also support risk sentiment foreign equity price increase flow emerge market mutual fund picked up emerge market bond spread narrow,0
51,2017-03-15,united kingdom however gilt yields declined pound weakened dollar response weaker expected inflation data upward revision bank england early february policy meeting assessment degree slack labor market,united kingdom however gilt yield decline pound weaken dollar response weaker expect inflation data upward revision bank england early february policy meeting assessment degree slack labor market,0
52,2017-03-15,market commentators attributed slowdown response issuers risk retention rules took effect late ,market commentator attribute slowdown response issuer risk retention rule take effect late,0
53,2017-03-15,consumer credit continued increase steady pace similar growth rates across credit card automobile student loans,consumer credit continued increase steady pace similar growth rate across credit card automobile student loan,0
54,2017-03-15,growth consumer lending banks continued january february albeit slower pace fourth quarter ,growth consumer lending bank continued january february albeit slow pace fourth quarter,0
55,2017-03-15,staff economic outlooks economic projection prepared staff march fomc meeting near term forecast real gdp growth little weaker net previous projection,staff economic outlook economic projection prepared staff march fomc meeting near term forecast real gdp growth little weaker net previous projection,0
56,2017-03-15,real gdp expected expand slower rate first quarter fourth quarter reflecting data january judged transitorily weak growth projected move back second quarter,real gdp expect expand slow rate first quarter fourth quarter reflect data january judged transitorily weak growth project move back second quarter,0
57,2017-03-15,staff maintained assumption provisionally included starting december  forecast expansionary fiscal policy coming years pushed back timing policy changes anticipated take effect,staff maintain assumption provisionally include start december forecast expansionary fiscal policy come year push back timing policy change anticipate take effect,0
58,2017-03-15,negative effect timing change projected real gdp growth  offset higher assumed path equity prices lower assumed path exchange value dollar,negative effect timing change project real gdp growth offset high assume path equity price low assume path exchange value dollar,0
59,2017-03-15,told staff forecast level real gdp end  essentially unrevised previous forecast staff continued project real gdp would expand modestly faster pace potential output  ,told staff forecast level real gdp end essentially unrevised previous forecast staff continued project real gdp would expand modestly faster pace potential output,0
60,2017-03-15,unemployment rate forecast edge gradually end  run staff estimate longer run natural rate path unemployment rate little changed previous projection,unemployment rate forecast edge gradually end run staff estimate longer run natural rate path unemployment rate little change previous projection,0
61,2017-03-15,staff forecast consumer price inflation measured changes pce price index unchanged  whole next couple years,staff forecast consumer price inflation measure change pce price index unchanged whole next couple year,0
62,2017-03-15,staff continued project inflation would increase gradually period food energy prices along prices non energy imports expected begin steadily rising year,staff continued project inflation would increase gradually period food energy price along price non energy import expect begin steadily rise year,0
63,2017-03-15,however inflation projected slightly committee longer run objective  percent ,however inflation project slightly committee longer run objective percent,0
64,2017-03-15,staff viewed uncertainty around projections real gdp growth unemployment rate inflation similar average past  years,staff view uncertainty around projection real gdp growth unemployment rate inflation similar average past year,0
65,2017-03-15,risks forecast real gdp seen tilted downside primarily reflecting staff assessment monetary policy appeared better positioned respond large positive shocks economic outlook substantial adverse ones,risk forecast real gdp see tilt downside primarily reflect staff assessment monetary policy appear well position respond large positive shock economic outlook substantial adverse one,0
66,2017-03-15,however staff viewed risks forecast less pronounced recent past reflecting somewhat diminished risks foreign outlook increases consumer business confidence recent months,however staff view risk forecast less pronounce recent past reflect somewhat diminish risk foreign outlook increase consumer business confidence recent month,0
67,2017-03-15,consistent downside risks aggregate demand staff viewed risks outlook unemployment rate tilted upside,consistent downside risk aggregate demand staff view risk outlook unemployment rate tilt upside,0
68,2017-03-15,risks projection inflation seen roughly balanced,risk projection inflation see roughly balance,0
69,2017-03-15,downside risks possibility longer term inflation expectations may edged dollar could appreciate substantially seen roughly counterbalanced upside risk inflation could increase expected economy projected continue operating longer run potential,downside risk possibility longer term inflation expectation may edge dollar could appreciate substantially see roughly counterbalance upside risk inflation could increase expect economy project continue operating longer run potential,0
70,2017-03-15,participants views current conditions economic outlook conjunction fomc meeting members board governors federal reserve bank presidents submitted projections likely outcomes real output growth unemployment rate inflation year   longer run based individual assessments appropriate path federal funds rate,participant view current condition economic outlook conjunction fomc meeting member board governor federal reserve bank president submit projection likely outcome real output growth unemployment rate inflation year longer run base individual assessment appropriate path federal fund rate,0
71,2017-03-15, longer run projections represented participant assessment rate variable would expected converge time appropriate monetary policy absence shocks economy,longer run projection represent participant assessment rate variable would expect converge time appropriate monetary policy absence shock economy,0
72,2017-03-15, projections policy assessments described summary economic projections sep addendum minutes,projection policy assessment described summary economic projection sep addendum minute,0
73,2017-03-15,discussion economic situation outlook meeting participants agreed information received intermeeting period indicated labor market continued strengthen economic activity continued expand moderate pace,discussion economic situation outlook meeting participant agree information receive intermeeting period indicate labor market continued strengthen economic activity continued expand moderate pace,0
74,2017-03-15,job gains remained solid unemployment rate little changed recent months,job gain remain solid unemployment rate little change recent month,0
75,2017-03-15,household spending continued rise moderately business fixed investment appeared firmed somewhat,household spending continued rise moderately business fix investment appear firm somewhat,0
76,2017-03-15,inflation increased recent quarters moved close committee  percent longer run objective excluding energy food prices inflation little changed continued run somewhat  percent,inflation increase recent quarter move close committee percent longer run objective exclude energy food price inflation little change continued run somewhat percent,0
77,2017-03-15,market based measures inflation compensation remained low survey based measures inflation compensation little changed balance,market base measure inflation compensation remain low survey base measure inflation compensation little change balance,0
78,2017-03-15,participants generally saw incoming economic information consistent overall expectations indicated views economic outlook changed little since january february fomc meeting,participant generally saw incoming economic information consistent overall expectation indicate view economic outlook change little since january february fomc meeting,0
79,2017-03-15,participants continued anticipate that gradual adjustments stance monetary policy economic activity would expand moderate pace labor market conditions would strengthen somewhat further inflation would stabilize around  percent medium term,participant continued anticipate that gradual adjustment stance monetary policy economic activity would expand moderate pace labor market condition would strengthen somewhat far inflation would stabilize around percent medium term,0
80,2017-03-15,participants generally judged risks economic outlook remained roughly balanced overall although saw considerations underlying assessment changed modestly,participant generally judged risk economic outlook remain roughly balance overall although saw consideration underlie assessment change modestly,0
81,2017-03-15,participants continued underscore considerable uncertainty timing nature potential changes fiscal policies well size effects changes economic activity,participant continued underscore considerable uncertainty timing nature potential change fiscal policy well size effect change economic activity,0
82,2017-03-15,nonetheless participants continued view prospect expansionary fiscal policies upside risk economic forecasts,nonetheless participant continued view prospect expansionary fiscal policy upside risk economic forecast,0
83,2017-03-15,time participants business contacts saw downside risks labor force economic growth possible changes government policies affecting immigration trade,time participant business contact saw downside risk labor force economic growth possible change government policy affect immigration trade,0
84,2017-03-15,participants generally viewed downside risks associated global economic outlook particularly related economic situation china europe diminished recent months,participant generally view downside risk associate global economic outlook particularly related economic situation china europe diminish recent month,0
