,Date,Original,Corpus,Class
0,2017-06-14,yields treasury securities foreign exchange value dollar declined modestly equity prices continued rise contributing easing financial conditions according measures,yield treasury security foreign exchange value dollar decline modestly equity price continued rise contribute ease financial condition accord measure,0
1,2017-06-14,meanwhile inflation compensation edged lower,meanwhile inflation compensation edge low,0
2,2017-06-14,anticipated committee determined economic conditions warranted implementation program step would communicated committee postmeeting statement,anticipate committee determine economic condition warrant implementation program step would communicate committee postmeeting statement,0
3,2017-06-14,staff review economic situation information reviewed june   meeting showed labor market conditions continued strengthen recent months suggested real gross domestic product gdp expanding faster pace second quarter first quarter,staff review economic situation information review june meeting show labor market condition continued strengthen recent month suggest real gross domestic product gdp expand faster pace second quarter first quarter,0
4,2017-06-14, month change overall consumer prices measured price index personal consumption expenditures pce slowed bit april total consumer price inflation core inflation excludes consumer food energy prices running somewhat  percent,month change overall consumer price measure price index personal consumption expenditure pce slow bit april total consumer price inflation core inflation excludes consumer food energy price run somewhat percent,0
5,2017-06-14,survey based measures longer run inflation expectations little changed balance,survey base measure longer run inflation expectation little change balance,0
6,2017-06-14,total nonfarm payroll employment expanded april may average pace job gains first five months year solid,total nonfarm payroll employment expand april may average pace job gain first five month year solid,0
7,2017-06-14,unemployment rate moved ,unemployment rate move,0
8,2017-06-14, percent may unemployment rates african americans hispanics stepped remained unemployment rates asians whites,percent may unemployment rate african american hispanic step remain unemployment rate asian white,0
9,2017-06-14,overall labor force participation rate declined somewhat share workers employed part time economic reasons decreased little,overall labor force participation rate decline somewhat share worker employ part time economic reason decrease little,0
10,2017-06-14,rate private sector job openings increased march april quits rate little changed hiring rate moved down,rate private sector job opening increase march april quits rate little change hire rate move down,0
11,2017-06-14,four week moving average initial claims unemployment insurance benefits remained low level early june,four week move average initial claim unemployment insurance benefit remain low level early june,0
12,2017-06-14,measures labor compensation continued rise moderate rates,measure labor compensation continued rise moderate rate,0
13,2017-06-14,average hourly earnings employees increased   percent  months ending may comparable period year earlier,average hourly earnings employee increase percent month end may comparable period year earlier,0
14,2017-06-14,components nominal retail sales data used bureau economic analysis construct estimate pce flat may estimated increases components sales previous two months revised up,component nominal retail sale data use bureau economic analysis construct estimate pce flat may estimate increase component sale previous two month revise up,0
15,2017-06-14,addition recent readings key factors influence consumer spending pointed solid growth total real pce near term including continued gains employment real disposable personal income households net worth,addition recent reading key factor influence consumer spending point solid growth total real pce near term include continued gain employment real disposable personal income household net worth,0
16,2017-06-14,although firms nominal spending nonresidential structures excluding drilling mining declined april number oil gas rigs operation indicator spending structures drilling mining sector continued rise early june,although firm nominal spending nonresidential structure exclude drilling mining decline april number oil gas rig operation indicator spending structure drilling mining sector continued rise early june,0
17,2017-06-14,nominal federal government spending data april may pointed essentially flat real federal purchases second quarter,nominal federal government spending data april may point essentially flat real federal purchase second quarter,0
18,2017-06-14,net exports estimated made small positive contribution real gdp growth first quarter,net export estimate make small positive contribution real gdp growth first quarter,0
19,2017-06-14,however april trade data suggested net exports might slight drag real gdp growth second quarter,however april trade data suggest net export might slight drag real gdp growth second quarter,0
20,2017-06-14,totals consumer prices measured pce price index increased   percent  months ending april,total consumer price measure pce price index increase percent month end april,0
21,2017-06-14,core pce price inflation   percent  months,core pce price inflation percent month,0
22,2017-06-14, months ending may consumer price index cpi rose little less  percent core cpi inflation   percent,month end may consumer price index cpi rise little less percent core cpi inflation percent,0
23,2017-06-14,median inflation expectations next   years michigan survey unchanged may median expectation pce price inflation next  years survey professional forecasters also held steady second quarter,median inflation expectation next year michigan survey unchanged may median expectation pce price inflation next year survey professional forecaster also held steady second quarter,0
24,2017-06-14,likewise medians longer run inflation expectations desk survey primary dealers survey market participants essentially unchanged june,likewise median longer run inflation expectation desk survey primary dealer survey market participant essentially unchanged june,0
25,2017-06-14,economic expansions canada euro area well china many emerging market economies emes continued firm first quarter,economic expansion canada euro area well china many emerge market economy emes continued firm first quarter,0
26,2017-06-14,contrast economic growth united kingdom slowed sharply,contrast economic growth united kingdom slow sharply,0
27,2017-06-14,recent indicators suggested real gdp growth foreign economies remained solid second quarter,recent indicator suggest real gdp growth foreign economy remain solid second quarter,0
28,2017-06-14,headline inflation across advanced foreign economies afes generally appeared moderate pace registered first quarter effects earlier increases energy prices started fade core inflation continued subdued many afes,headline inflation across advanced foreign economy afes generally appear moderate pace register first quarter effect earlier increase energy price start fade core inflation continued subdue many afes,0
29,2017-06-14,among emes inflation china rose inflation latin america fell,among emes inflation china rise inflation latin america fell,0
30,2017-06-14,mexico effects fuel price hikes january pass earlier currency depreciation prices started wane inflation remained central bank target,mexico effect fuel price hike january pas earlier currency depreciation price start wane inflation remain central bank target,0
31,2017-06-14,staff review financial situation domestic financial market conditions remained generally accommodative intermeeting period,staff review financial situation domestic financial market condition remain generally accommodative intermeeting period,0
32,2017-06-14,us equity prices increased period longer term treasury yields declined dollar depreciated,u equity price increase period longer term treasury yield decline dollar depreciate,0
33,2017-06-14,market participants perceptions improved global economic outlook appeared provide support prices risk assets,market participant perception improve global economic outlook appear provide support price risk asset,0
34,2017-06-14,market participants interpreted may fomc statement meeting minutes indicating committee not materially changed economic outlook,market participant interpret may fomc statement meeting minute indicate committee not materially change economic outlook,0
35,2017-06-14,immediately following may fomc meeting nominal treasury yields rose short intermediate maturities reportedly reflecting response investors passage postmeeting statement indicating committee view slowing real gdp growth first quarter likely transitory,immediately follow may fomc meeting nominal treasury yield rise short intermediate maturity reportedly reflect response investor passage postmeeting statement indicate committee view slow real gdp growth first quarter likely transitory,0
36,2017-06-14,later intermeeting period yields declined reaction release weaker expected april cpi data somewhat disappointing may employment report,later intermeeting period yield decline reaction release weaker expect april cpi data somewhat disappoint may employment report,0
37,2017-06-14, year   year forward tips based inflation compensation declined part reflecting expectations inflation data,year year forward tip base inflation compensation decline part reflect expectation inflation data,0
38,2017-06-14,broads equity price indexes increased,broad equity price index increase,0
39,2017-06-14,commercial industrial loans outstanding increased april may weak first quarter although growth loans remained well pace seen year ago,commercial industrial loan outstanding increase april may weak first quarter although growth loan remain well pace see year ago,0
40,2017-06-14,however recent cre loan growth bit slower first quarter part reflecting slowdown lending construction multifamily units,however recent cre loan growth bit slow first quarter part reflect slowdown lending construction multifamily unit,0
41,2017-06-14,despite higher level mortgage rates growth mortgage lending home purchases remained near upper end recent range first quarter,despite high level mortgage rate growth mortgage lending home purchase remain near upper end recent range first quarter,0
42,2017-06-14,delinquency rates residential mortgage loans continued edge amid robust house price growth still tight lending standards households low credit scores hard document incomes,delinquency rate residential mortgage loan continued edge amid robust house price growth still tight lending standard household low credit score hard document income,0
43,2017-06-14,growth auto loans remained solid first quarter,growth auto loan remain solid first quarter,0
44,2017-06-14,period since may fomc meeting foreign financial markets influenced incoming economic data political developments abroad united states,period since may fomc meeting foreign financial market influence incoming economic data political development abroad united state,0
45,2017-06-14,dollar also depreciated euro supported results french presidential election stronger expected macroeconomic releases,dollar also depreciate euro support result french presidential election strong expect macroeconomic release,0
46,2017-06-14,data releases prompted european central bank june  meeting change assessment risks economic outlook tilted downside balanced,data release prompt european central bank june meeting change assessment risk economic outlook tilt downside balance,0
47,2017-06-14,us developments including mixed economic data reports also weighed dollar,u development include mixed economic data report also weigh dollar,0
48,2017-06-14,staff economic outlooks economic projection prepared staff june fomc meeting real gdp growth forecast step solid pace second quarter following weak reading first quarter primarily reflecting faster real pce growth,staff economic outlook economic projection prepared staff june fomc meeting real gdp growth forecast step solid pace second quarter follow weak reading first quarter primarily reflect faster real pce growth,0
49,2017-06-14,balance incoming data aggregate spending little stronger staff expected forecast real gdp growth current year bit higher previous projection,balance incoming data aggregate spending little strong staff expect forecast real gdp growth current year bit high previous projection,0
50,2017-06-14,beyond year projection real gdp growth essentially unchanged,beyond year projection real gdp growth essentially unchanged,0
51,2017-06-14,staff continued project real gdp would expand modestly faster pace potential output   supported part staff maintained assumption fiscal policy would become expansionary coming years,staff continued project real gdp would expand modestly faster pace potential output support part staff maintain assumption fiscal policy would become expansionary come year,0
52,2017-06-14,unemployment rate projected decline gradually next couple years continue running staff estimate longer run natural rate period,unemployment rate project decline gradually next couple year continue run staff estimate longer run natural rate period,0
53,2017-06-14,staff forecast consumer price inflation measured change pce price index revised slightly  weaker expected incoming data inflation,staff forecast consumer price inflation measure change pce price index revise slightly weaker expect incoming data inflation,0
54,2017-06-14,however projection little changed thereafter recent weakness inflation viewed transitory,however projection little change thereafter recent weakness inflation view transitory,0
55,2017-06-14,inflation still expected somewhat higher year last year largely reflecting upturn prices food non energy imports,inflation still expect somewhat high year last year largely reflect upturn price food non energy import,0
56,2017-06-14,staff projected inflation would increase next couple years would close committee longer run objective   percent ,staff project inflation would increase next couple year would close committee longer run objective percent,0
57,2017-06-14,staff viewed uncertainty around projections real gdp growth unemployment rate inflation similar average past  years,staff view uncertainty around projection real gdp growth unemployment rate inflation similar average past year,0
58,2017-06-14,many financial market indicators uncertainty subdued uncertainty associated foreign outlook appeared subsided further balance since late last year developments judged counterweights elevated measures economic policy uncertainty,many financial market indicator uncertainty subdue uncertainty associate foreign outlook appear subside far balance since late last year development judged counterweight elevate measure economic policy uncertainty,0
59,2017-06-14,staff saw risks forecasts real gdp unemployment rate balanced staff assessment downside risks associated monetary policy not well positioned respond adverse shocks diminished since previous forecast,staff saw risk forecast real gdp unemployment rate balance staff assessment downside risk associate monetary policy not well position respond adverse shock diminish since previous forecast,0
60,2017-06-14,risks projection inflation also seen roughly balanced,risk projection inflation also see roughly balance,0
61,2017-06-14,downside risks possibility longer term inflation expectations may edged dollar could appreciate substantially seen essentially counterbalanced upside risk inflation could increase expected economy projected continue operating longer run potential,downside risk possibility longer term inflation expectation may edge dollar could appreciate substantially see essentially counterbalance upside risk inflation could increase expect economy project continue operating longer run potential,0
62,2017-06-14,participants views current conditions economic outlook conjunction fomc meeting members board governors federal reserve bank presidents submitted projections likely outcomes real output growth unemployment rate inflation year   longer run based individual assessments appropriate path federal funds rate,participant view current condition economic outlook conjunction fomc meeting member board governor federal reserve bank president submit projection likely outcome real output growth unemployment rate inflation year longer run base individual assessment appropriate path federal fund rate,0
63,2017-06-14, longer run projections represented participant assessment rate variable would expected converge time appropriate monetary policy absence shocks economy,longer run projection represent participant assessment rate variable would expect converge time appropriate monetary policy absence shock economy,0
64,2017-06-14, projections policy assessments described summary economic projections sep addendum minutes,projection policy assessment described summary economic projection sep addendum minute,0
65,2017-06-14,discussion economic situation outlook meeting participants agreed information received intermeeting period indicated labor market continued strengthen economic activity rising moderately average far year,discussion economic situation outlook meeting participant agree information receive intermeeting period indicate labor market continued strengthen economic activity rise moderately average far year,0
66,2017-06-14,job gains moderated since beginning year remained solid average unemployment rate declined,job gain moderate since begin year remain solid average unemployment rate decline,0
67,2017-06-14,household spending picked recent months business fixed investment continued expand,household spending picked recent month business fix investment continued expand,0
68,2017-06-14,inflation measured  month basis declined recently and like measure excluding food energy prices running somewhat  percent,inflation measure month basis decline recently and like measure exclude food energy price run somewhat percent,0
69,2017-06-14,market based measures inflation compensation remained low survey based measures longer term inflation expectations little changed balance,market base measure inflation compensation remain low survey base measure longer term inflation expectation little change balance,0
70,2017-06-14,participants generally saw incoming information spending labor market indicators consistent overall expectations indicated views outlook economic growth labor market changed slightly since may fomc meeting,participant generally saw incoming information spending labor market indicator consistent overall expectation indicate view outlook economic growth labor market change slightly since may fomc meeting,0
71,2017-06-14,anticipated growth consumer spending seemed bounced back weak first quarter participants continued expect that gradual adjustments stance monetary policy economic activity would expand moderate pace labor market conditions would strengthen somewhat further,anticipate growth consumer spending seem bounce back weak first quarter participant continued expect that gradual adjustment stance monetary policy economic activity would expand moderate pace labor market condition would strengthen somewhat far,0
72,2017-06-14,light surprisingly low recent readings inflation participants expected inflation  month basis would remain somewhat  percent near term,light surprisingly low recent reading inflation participant expect inflation month basis would remain somewhat percent near term,0
73,2017-06-14,however participants judged inflation would stabilize around committee  percent objective medium term,however participant judged inflation would stabilize around committee percent objective medium term,0
74,2017-06-14,growth consumer spending appeared rebounding slowing first quarter year,growth consumer spending appear rebound slow first quarter year,0
75,2017-06-14,participants generally continued expect ongoing job gains rising household income wealth improved household balance sheets would support moderate growth household spending medium term,participant generally continued expect ongoing job gain rise household income wealth improve household balance sheet would support moderate growth household spending medium term,0
76,2017-06-14,district contacts suggested expansion oil production capacity likely continue near term though longer term outlook uncertain,district contact suggest expansion oil production capacity likely continue near term though longer term outlook uncertain,0
77,2017-06-14,contacts large firms indicated curtailed capital spending part uncertainty changes fiscal government policies contacts smaller firms however indicated capital spending plans not appreciably affected news government policy,contact large firm indicate curtail capital spending part uncertainty change fiscal government policy contact small firm however indicate capital spending plan not appreciably affected news government policy,0
78,2017-06-14,labor market conditions continued strengthen recent months,labor market condition continued strengthen recent month,0
79,2017-06-14,unemployment rate fell ,unemployment rate fell,0
80,2017-06-14,monthly increases nonfarm payrolls averaged  since beginning year  per month  still well estimates pace necessary absorb new entrants labor force,monthly increase nonfarm payroll average since begin year per month still well estimate pace necessary absorb new entrant labor force,0
81,2017-06-14,participants interpreted slowing payroll growth expected development reflected tight labor market,participant interpret slow payroll growth expect development reflect tight labor market,0
82,2017-06-14,labor market indicators number job openings broader measures unemployment also seen consistent labor market conditions strengthened recent months,labor market indicator number job opening broader measure unemployment also see consistent labor market condition strengthen recent month,0
83,2017-06-14,however contacts reported modest wage gains participants observed measures labor compensation overall economy continued rise moderately despite strengthening labor market conditions,however contact report modest wage gain participant observe measure labor compensation overall economy continued rise moderately despite strengthen labor market condition,0
84,2017-06-14,couple participants saw restrained increases labor compensation consistent low productivity growth moderate inflation experienced recent years,couple participant saw restrain increase labor compensation consistent low productivity growth moderate inflation experienced recent year,0
85,2017-06-14,light recent behavior labor compensation consumer prices well demographic trends number participants lowered estimate longer run normal level unemployment rate,light recent behavior labor compensation consumer price well demographic trend number participant lower estimate longer run normal level unemployment rate,0
86,2017-06-14,recent readings headline core pce price inflation come lower participants expected,recent reading headline core pce price inflation come low participant expect,0
87,2017-06-14, month basis headline pce price inflation running somewhat committee  percent objective april partly factors appeared transitory,month basis headline pce price inflation run somewhat committee percent objective april partly factor appear transitory,0
88,2017-06-14,core pce price inflation historically useful predictor future inflation although it too affected transitory factors moved ,core pce price inflation historically useful predictor future inflation although it too affected transitory factor move,0
89,2017-06-14,addition cpi inflation may came lower expected,addition cpi inflation may come low expect,0
90,2017-06-14,participants viewed recent softness price data largely reflecting idiosyncratic factors including sharp declines prices wireless telephone services prescription drugs expected developments little bearing inflation medium run,participant view recent softness price data largely reflect idiosyncratic factor include sharp decline price wireless telephone service prescription drug expect development little bearing inflation medium run,0
91,2017-06-14,participants continued expect that effects transitory factors waned labor market conditions strengthened further inflation would stabilize around committee  percent objective medium term,participant continued expect that effect transitory factor wan labor market condition strengthen far inflation would stabilize around committee percent objective medium term,0
92,2017-06-14,several participants suggested recent increases import prices consistent expectation,several participant suggest recent increase import price consistent expectation,0
93,2017-06-14,however several participants expressed concern progress toward committee  percent longer run inflation objective might slowed recent softness inflation might persist,however several participant express concern progress toward committee percent longer run inflation objective might slow recent softness inflation might persist,0
94,2017-06-14,persistence might occur part upward pressure inflation resource utilization may limited relationship two variables appeared weaker previous decades,persistence might occur part upward pressure inflation resource utilization may limited relationship two variable appear weaker previous decade,0
