,Date,Original,Corpus,Class
169,2017-03-15,stance monetary policy remains accommodative thereby supporting strengthening labor market conditions sustained return  percent inflation,stance monetary policy remains accommodative thereby support strengthen labor market condition sustain return percent inflation,0
170,2017-03-15,determining timing size future adjustments target range federal funds rate committee assess realized expected economic conditions relative objectives maximum employment  percent inflation,determine timing size future adjustment target range federal fund rate committee ass realize expect economic condition relative objective maximum employment percent inflation,0
171,2017-03-15,assessment take account wide range information including measures labor market conditions indicators inflation pressures inflation expectations readings financial international developments,assessment take account wide range information include measure labor market condition indicator inflation pressure inflation expectation reading financial international development,0
172,2017-03-15,committee carefully monitor actual expected inflation developments relative symmetric inflation goal,committee carefully monitor actual expect inflation development relative symmetric inflation goal,0
173,2017-03-15,committee expects economic conditions evolve manner warrant gradual increases federal funds rate federal funds rate likely remain time levels expected prevail longer run,committee expect economic condition evolve manner warrant gradual increase federal fund rate federal fund rate likely remain time level expect prevail longer run,0
174,2017-03-15,however actual path federal funds rate depend economic outlook informed incoming data,however actual path federal fund rate depend economic outlook inform incoming data,0
175,2017-03-15,preferred await additional information amount slack remaining labor market increased evidence inflation would stabilize committee symmetric  percent inflation objective taking another step remove monetary policy accommodation,prefer await additional information amount slack remain labor market increase evidence inflation would stabilize committee symmetric percent inflation objective take another step remove monetary policy accommodation,0
176,2017-03-15,marie gooding first vice president federal reserve bank atlanta submitted economic projections,marie gooding first vice president federal reserve bank atlanta submit economic projection,0
177,2017-03-15,one participant not submit longer run projections real output growth unemployment rate federal funds rate,one participant not submit longer run projection real output growth unemployment rate federal fund rate,0
