,Date,Original,Corpus,Class
91,2018-08-01,several participants stressed possibility real gdp growth second quarter may boosted transitory factors including outsized increases exports,several participant stress possibility real gdp growth second quarter may boost transitory factor include outsized increase export,0
92,2018-08-01,second half year participants generally expected gdp growth would likely slow second quarter rate would still exceed potential output,second half year participant generally expect gdp growth would likely slow second quarter rate would still exceed potential output,0
93,2018-08-01,participants noted number favorable economic factors supporting trend gdp growth included strong labor market stimulative federal tax spending policies accommodative financial conditions continued high levels household business confidence,participant note number favorable economic factor support trend gdp growth include strong labor market stimulative federal tax spending policy accommodative financial condition continued high level household business confidence,0
94,2018-08-01,participants generally viewed risks economic outlook roughly balanced,participant generally view risk economic outlook roughly balance,0
95,2018-08-01,reports business contacts confirmed robust pace expansion several sectors economy including energy manufacturing services,report business contact confirm robust pace expansion several sector economy include energy manufacturing service,0
96,2018-08-01,business contacts various sectors cited labor shortages supply constraints impediments production,business contact various sector cite labor shortage supply constraint impediment production,0
97,2018-08-01,furthermore recent tariff increases put upward pressure input prices,furthermore recent tariff increase put upward pressure input price,0
98,2018-08-01,business contacts districts reported uncertainty regarding trade policy led reductions delays investment spending,business contact district report uncertainty regard trade policy lead reduction delay investment spending,0
99,2018-08-01,several participants observed agricultural sector adversely affected significant declines crop livestock prices intermeeting period,several participant observe agricultural sector adversely affected significant decline crop livestock price intermeeting period,0
100,2018-08-01,participants agreed labor market conditions strengthened intermeeting period,participant agree labor market condition strengthen intermeeting period,0
101,2018-08-01,payrolls grown strongly june labor market tightness reflected recent readings rates private sector job openings quits job job switching workers,payroll grown strongly june labor market tightness reflect recent reading rate private sector job opening quits job job switch worker,0
102,2018-08-01,although unemployment rate increased slightly june increase accompanied uptick labor force participation rate,although unemployment rate increase slightly june increase accompany uptick labor force participation rate,0
103,2018-08-01,many participants commented fact measures aggregate nominal wage growth far picked modestly,many participant comment fact measure aggregate nominal wage growth far picked modestly,0
104,2018-08-01,among factors cited containing pickup wage growth low trend productivity growth lags response nominal wage growth resource pressures improvements terms employment not recorded wage data,among factor cite contain pickup wage growth low trend productivity growth lag response nominal wage growth resource pressure improvement term employment not record wage data,0
105,2018-08-01,alternatively recent pace nominal wage growth might indicate continued slack labor market,alternatively recent pace nominal wage growth might indicate continued slack labor market,0
106,2018-08-01,however participants expected pickup aggregate nominal wage growth occur long number participants reporting wage pressures districts rising firms exhibited greater willingness grant wage increases,however participant expect pickup aggregate nominal wage growth occur long number participant reporting wage pressure district rise firm exhibit great willingness grant wage increase,0
107,2018-08-01,participants noted overall inflation inflation items food energy remained near  percent  month basis,participant note overall inflation inflation item food energy remain near percent month basis,0
108,2018-08-01,participants expressed increased confidence recent return inflation near committee longer term  percent objective would sustained,participant express increase confidence recent return inflation near committee longer term percent objective would sustain,0
109,2018-08-01,several participants commented increases prices particular goods induced tariff increases would likely one source short term upward pressure inflation rate although offsetting influences including negative effects trade developments agricultural prices also noted,several participant comment increase price particular good induced tariff increase would likely one source short term upward pressure inflation rate although offset influence include negative effect trade development agricultural price also note,0
110,2018-08-01,reports several districts suggested firms greater scope recent past raise prices response strong demand increases input costs including associated tariff increases recent rises fuel freight expenses,report several district suggest firm great scope recent past raise price response strong demand increase input cost include associate tariff increase recent rise fuel freight expense,0
111,2018-08-01,many participants anticipated that medium term high levels resource utilization stable inflation expectations would keep inflation near  percent,many participant anticipate that medium term high level resource utilization stable inflation expectation would keep inflation near percent,0
112,2018-08-01,however participants observed inflation recent years shown weak connection measures resource pressures indicated would like see evidence measures underlying inflation readings inflation expectations course attain levels consistent sustained achievement committee symmetric  percent inflation objective,however participant observe inflation recent year show weak connection measure resource pressure indicate would like see evidence measure underlie inflation reading inflation expectation course attain level consistent sustain achievement committee symmetric percent inflation objective,0
113,2018-08-01,although participants observed trimmed mean measure inflation calculated federal reserve bank dallas still  percent couple noted forecasts measure would reach  percent end year,although participant observe trim mean measure inflation calculate federal reserve bank dallas still percent couple note forecast measure would reach percent end year,0
114,2018-08-01,participants raised concern prolonged period economy operated beyond potential could give rise inflationary pressures financial imbalances could eventually trigger economic downturn,participant raise concern prolong period economy operate beyond potential could give rise inflationary pressure financial imbalance could eventually trigger economic downturn,0
115,2018-08-01,participants commented number risks uncertainties associated outlook economic activity labor market inflation medium term,participant comment number risk uncertainty associate outlook economic activity labor market inflation medium term,0
116,2018-08-01,generally continued see fiscal policy strengthening labor market supportive economic growth near term,generally continued see fiscal policy strengthen labor market supportive economic growth near term,0
117,2018-08-01,noted larger persistent positive effects factors upside risk outlook,note large persistent positive effect factor upside risk outlook,0
118,2018-08-01,participants observed large scale prolonged dispute trade policies developed would likely adverse effects business sentiment investment spending employment,participant observe large scale prolong dispute trade policy developed would likely adverse effect business sentiment investment spending employment,0
119,2018-08-01,downside risks cited included possibility significant weakening housing sector sharp increase oil prices severe slowdown emes,downside risk cite include possibility significant weaken housing sector sharp increase oil price severe slowdown emes,0
120,2018-08-01,participants remarked extent financial conditions remained supportive economic expansion,participant remark extent financial condition remain supportive economic expansion,0
121,2018-08-01,intermeeting period small change overall financial conditions occurred modest movements net equity prices foreign exchange value dollar,intermeeting period small change overall financial condition occur modest movement net equity price foreign exchange value dollar,0
122,2018-08-01,discussing capital positions large banks participants emphasized financial stability risks could reduced institutions boosted capital cushions profits strong economic outlook favorable arguments activation countercyclical capital buffer means strengthening capital positions large banks discussed context,discuss capital position large bank participant emphasize financial stability risk could reduce institution boost capital cushion profit strong economic outlook favorable argument activation countercyclical capital buffer mean strengthen capital position large bank discuss context,0
123,2018-08-01,consideration monetary policy participants discussed implications recent economic financial developments economic outlook associated risks outlook,consideration monetary policy participant discuss implication recent economic financial development economic outlook associate risk outlook,0
124,2018-08-01,participants remarked recent trend growth real gdp indicators resource utilization,participant remark recent trend growth real gdp indicator resource utilization,0
125,2018-08-01,commented consumer spending quite strong second quarter confirming impressions first quarter weakness temporary,comment consumer spending quite strong second quarter confirm impression first quarter weakness temporary,0
126,2018-08-01,several participants also pointed continued strength business fixed investment although persistent weakness risk slowdown residential investment also noted,several participant also point continued strength business fix investment although persistent weakness risk slowdown residential investment also note,0
127,2018-08-01,participants suggested could still labor market slack citing recent increases labor force participation rates relative prevailing demographically driven downward trends participation rate prime age men particular still previous business cycle peak,participant suggest could still labor market slack cite recent increase labor force participation rate relative prevail demographically driven downward trend participation rate prime age men particular still previous business cycle peak,0
128,2018-08-01,participants judged labor market conditions tight pointing data including job quits openings rates anecdotes contacts,participant judged labor market condition tight point data include job quits opening rate anecdote contact,0
129,2018-08-01,participants generally characterized inflation running close committee objective  percent expressed view indicated recent readings inflation come close expectations,participant generally characterize inflation run close committee objective percent express view indicate recent reading inflation come close expectation,0
130,2018-08-01,consistent sep submissions june several participants remarked inflation measured  month basis likely move modestly committee objective time,consistent sep submission june several participant remark inflation measure month basis likely move modestly committee objective time,0
131,2018-08-01,others pointed indicators suggesting long term inflation expectations could levels consistent committee  percent inflation objective,others point indicator suggest long term inflation expectation could level consistent committee percent inflation objective,0
132,2018-08-01,participants generally judged current stance monetary policy remained accommodative supporting strong labor market conditions inflation around  percent,participant generally judged current stance monetary policy remain accommodative support strong labor market condition inflation around percent,0
133,2018-08-01,regard medium term various participants indicated information gathered since committee met june not significantly altered outlooks economy,regard medium term various participant indicate information gather since committee met june not significantly alter outlook economy,0
134,2018-08-01,many participants suggested incoming data continued support current economic outlook would likely soon appropriate take another step removing policy accommodation,many participant suggest incoming data continued support current economic outlook would likely soon appropriate take another step remove policy accommodation,0
135,2018-08-01,participants generally expected gradual increases target range federal funds rate would consistent sustained expansion economic activity strong labor market conditions inflation near committee symmetric  percent objective medium term,participant generally expect gradual increase target range federal fund rate would consistent sustain expansion economic activity strong labor market condition inflation near committee symmetric percent objective medium term,0
136,2018-08-01,many participants reiterated actual path federal funds rate would ultimately depend incoming data data affect economic outlook,many participant reiterate actual path federal fund rate would ultimately depend incoming data data affect economic outlook,0
137,2018-08-01,participants discussed economic forces risks saw providing rationale gradual increases federal funds rate well scenarios might cause depart expected path,participant discuss economic force risk saw provide rationale gradual increase federal fund rate well scenario might cause depart expect path,0
138,2018-08-01,participants noted stronger underlying momentum economy upside risk expressed view escalation international trade disputes potentially consequential downside risk real activity,participant note strong underlie momentum economy upside risk express view escalation international trade dispute potentially consequential downside risk real activity,0
139,2018-08-01,participants suggested that event major escalation trade disputes complex nature trade issues including entire range effects output inflation presented challenge determining appropriate monetary policy response,participant suggest that event major escalation trade dispute complex nature trade issue include entire range effect output inflation present challenge determine appropriate monetary policy response,0
140,2018-08-01,suggested policymakers pay close attention slope yield curve assessing economic policy outlook,suggest policymakers pay close attention slope yield curve assess economic policy outlook,0
141,2018-08-01,participants emphasized inferring economic causality statistical correlations not appropriate,participant emphasize infer economic causality statistical correlation not appropriate,0
142,2018-08-01,environment inversion yield curve might not significance historical record would suggest signal taken yield curve needed considered context economic financial indicators,environment inversion yield curve might not significance historical record would suggest signal take yield curve need consider context economic financial indicator,0
143,2018-08-01,committee policy action discussion monetary policy period ahead members judged information received since fomc met june indicated labor market continued strengthen economic activity rising strong rate,committee policy action discussion monetary policy period ahead member judged information receive since fomc met june indicate labor market continued strengthen economic activity rise strong rate,0
144,2018-08-01,job gains strong average recent months unemployment rate stayed low,job gain strong average recent month unemployment rate stayed low,0
145,2018-08-01,household spending business fixed investment grown strongly,household spending business fix investment grown strongly,0
146,2018-08-01,month basis overall inflation inflation items food energy remained near  percent,month basis overall inflation inflation item food energy remain near percent,0
147,2018-08-01,indicators longer term inflation expectations little changed balance,indicator longer term inflation expectation little change balance,0
148,2018-08-01,policymakers viewed recent data indicating outlook economy evolving expected,policymakers view recent data indicate outlook economy evolve expect,0
149,2018-08-01,consequently members expected gradual increases target range federal funds rate would consistent sustained expansion economic activity strong labor market conditions inflation near committee symmetric  percent objective medium term,consequently member expect gradual increase target range federal fund rate would consistent sustain expansion economic activity strong labor market condition inflation near committee symmetric percent objective medium term,0
150,2018-08-01,members continued judge risks economic outlook appeared roughly balanced,member continued judge risk economic outlook appear roughly balance,0
151,2018-08-01,assessing incoming data current conditions outlook economic activity labor market inflation members agreed maintain target range federal funds rate    percent,assess incoming data current condition outlook economic activity labor market inflation member agree maintain target range federal fund rate percent,0
152,2018-08-01,noted stance monetary policy remained accommodative thereby supporting strong labor market conditions sustained return  percent inflation,note stance monetary policy remain accommodative thereby support strong labor market condition sustain return percent inflation,0
153,2018-08-01,members agreed timing size future adjustments target range federal funds rate would depend assessments realized expected economic conditions relative committee objectives maximum employment  percent inflation,member agree timing size future adjustment target range federal fund rate would depend assessment realize expect economic condition relative committee objective maximum employment percent inflation,0
154,2018-08-01,reiterated assessment would take account wide range information including measures labor market conditions indicators inflation pressures inflation expectations readings financial international developments,reiterate assessment would take account wide range information include measure labor market condition indicator inflation pressure inflation expectation reading financial international development,0
155,2018-08-01,information received since federal open market committee met june indicates labor market continued strengthen economic activity rising strong rate,information receive since federal open market committee met june indicates labor market continued strengthen economic activity rise strong rate,0
156,2018-08-01,job gains strong average recent months unemployment rate stayed low,job gain strong average recent month unemployment rate stayed low,0
157,2018-08-01,household spending business fixed investment grown strongly,household spending business fix investment grown strongly,0
158,2018-08-01, month basis overall inflation inflation items food energy remain near  percent,month basis overall inflation inflation item food energy remain near percent,0
159,2018-08-01,indicators longer term inflation expectations little changed balance,indicator longer term inflation expectation little change balance,0
160,2018-08-01,consistent statutory mandate committee seeks foster maximum employment price stability,consistent statutory mandate committee seek foster maximum employment price stability,0
161,2018-08-01,committee expects gradual increases target range federal funds rate consistent sustained expansion economic activity strong labor market conditions inflation near committee symmetric  percent objective medium term,committee expect gradual increase target range federal fund rate consistent sustain expansion economic activity strong labor market condition inflation near committee symmetric percent objective medium term,0
162,2018-08-01,risks economic outlook appear roughly balanced,risk economic outlook appear roughly balance,0
163,2018-08-01,view realized expected labor market conditions inflation committee decided maintain target range federal funds rate    percent,view realize expect labor market condition inflation committee decide maintain target range federal fund rate percent,0
164,2018-08-01,stance monetary policy remains accommodative thereby supporting strong labor market conditions sustained return  percent inflation,stance monetary policy remains accommodative thereby support strong labor market condition sustain return percent inflation,0
165,2018-08-01,determining timing size future adjustments target range federal funds rate committee assess realized expected economic conditions relative maximum employment objective symmetric  percent inflation objective,determine timing size future adjustment target range federal fund rate committee ass realize expect economic condition relative maximum employment objective symmetric percent inflation objective,0
166,2018-08-01,assessment take account wide range information including measures labor market conditions indicators inflation pressures inflation expectations readings financial international developments,assessment take account wide range information include measure labor market condition indicator inflation pressure inflation expectation reading financial international development,0
167,2018-08-01,analysis staff assumed elb ,analysis staff assume elb,0
