,Date,Original,Corpus,Class
0,2018-12-19,mark carlson senior economic project manager division monetary affairs board governors,mark carlson senior economic project manager division monetary affair board governor,0
1,2018-12-19,december meeting staff provided set briefings considered various issues related transition long run operating regime lower levels excess reserves present long run composition balance sheet,december meeting staff provide set briefing consider various issue related transition long run operating regime low level excess reserve present long run composition balance sheet,0
2,2018-12-19,staff noted transition long run operating regime excess reserves current levels effective federal funds rate effr could begin rise little interest excess reserves ioer rate reserves banking system declined gradually level committee judges appropriate efficient effective implementation policy,staff note transition long run operating regime excess reserve current level effective federal fund rate effr could begin rise little interest excess reserve ioer rate reserve banking system decline gradually level committee judge appropriate efficient effective implementation policy,0
3,2018-12-19,however staff noted federal funds rate money market rates could possibly become somewhat volatile times banks financial markets adjusted lower levels reserve balances,however staff note federal fund rate money market rate could possibly become somewhat volatile time bank financial market adjust low level reserve balance,0
4,2018-12-19,staff reported monitoring conditions money markets well various survey market outreach activities could assist detecting reserve scarcity,staff report monitoring condition money market well various survey market outreach activity could assist detect reserve scarcity,0
5,2018-12-19,staff reviewed number steps federal reserve could take ensure effective monetary policy implementation upward pressures federal funds rate money market rates emerge,staff review number step federal reserve could take ensure effective monetary policy implementation upward pressure federal fund rate money market rate emerge,0
6,2018-12-19,staff also discussed new ceiling tools could help keep effr within committee target range including options would add new counterparties open market desk operations,staff also discuss new ceiling tool could help keep effr within committee target range include option would add new counterparties open market desk operation,0
7,2018-12-19,staff also provided review liabilities federal reserve balance sheet review described factors influence size reserve nonreserve liabilities discussed increase size liabilities since financial crisis,staff also provide review liability federal reserve balance sheet review described factor influence size reserve nonreserve liability discuss increase size liability since financial crisis,0
8,2018-12-19,additionally staff outlined various issues related long run composition system open market account soma portfolio including maturity composition portfolio treasury securities management residual holdings agency mortgage backed securities mbs committee normalized size balance sheet,additionally staff outline various issue related long run composition system open market account soma portfolio include maturity composition portfolio treasury security management residual holding agency mortgage back security mb committee normalize size balance sheet,0
9,2018-12-19,addition participants discussed options ending portfolio redemptions relatively high level reserves still system either maintaining level reserves allowing growth nonreserve liabilities gradually reduce reserves further,addition participant discuss option end portfolio redemption relatively high level reserve still system either maintain level reserve allow growth nonreserve liability gradually reduce reserve far,0
10,2018-12-19,also remarked size federal reserve balance sheet expected increase time growth liabilities roughly tracks growth nominal gross domestic product gdp,also remark size federal reserve balance sheet expect increase time growth liability roughly track growth nominal gross domestic product gdp,0
11,2018-12-19,additionally participants cited social benefits provided liabilities economy,additionally participant cite social benefit provide liability economy,0
12,2018-12-19,several participants noted portfolio holdings weighted toward shorter maturities would provide greater flexibility lengthen maturity warranted economic downturn couple others noted portfolio maturities matched outstanding treasury market would neutral effect market,several participant note portfolio holding weight toward shorter maturity would provide great flexibility lengthen maturity warrant economic downturn couple others note portfolio maturity match outstanding treasury market would neutral effect market,0
13,2018-12-19,asset prices volatile recent weeks reportedly reflecting pullback risk taking investors,asset price volatile recent week reportedly reflect pullback risk take investor,0
14,2018-12-19,addition investors pointed concerns global growth outlook unsettled state brexit negotiations uncertainties political situation europe,addition investor point concern global growth outlook unsettled state brexit negotiation uncertainty political situation europe,0
15,2018-12-19,backdrop us stock prices nearly  percent period,backdrop u stock price nearly percent period,0
16,2018-12-19,risk spreads corporate bonds widened appreciably market participants reportedly focusing potential implications downside riskss economic outlook financial condition companies particularly companies lower end investment grade spectrum,risk spread corporate bond widen appreciably market participant reportedly focus potential implication downside risk economic outlook financial condition company particularly company low end investment grade spectrum,0
17,2018-12-19,based readings treasury inflation protected securities tips decline nominal treasury yields associated notable drop inflation compensation,base reading treasury inflation protect security tip decline nominal treasury yield associate notable drop inflation compensation,0
18,2018-12-19,sizable decline oil prices cited important factor contributing drop measures inflation compensation,sizable decline oil price cite important factor contribute drop measure inflation compensation,0
19,2018-12-19,desk surveys indicated respondents placed high odds quarter point firming stance monetary policy december meeting lower near certainty rate increase reported previous policy firmings  survey responses anticipated median projected path federal funds rate summary economic projections sep would show two additional quarter point policy firmings next year three policy firmings median path september sep results,desk survey indicate respondent place high odds quarter point firm stance monetary policy december meeting low near certainty rate increase report previous policy firmings survey response anticipate median project path federal fund rate summary economic projection sep would show two additional quarter point policy firmings next year three policy firmings median path september sep result,0
20,2018-12-19,baseline outlook prepayments principal agency mbs would remain  billion redemption cap foreseeable future,baseline outlook prepayment principal agency mb would remain billion redemption cap foreseeable future,0
21,2018-12-19,staff review economic situation information reviewed december   meeting indicated labor market conditions continued strengthen recent months real gdp growth strong,staff review economic situation information review december meeting indicate labor market condition continued strengthen recent month real gdp growth strong,0
22,2018-12-19,consumer price inflation measured  month percentage change price index personal consumption expenditures pce  percent october,consumer price inflation measure month percentage change price index personal consumption expenditure pce percent october,0
23,2018-12-19,survey based measures longer run inflation expectations little changed balance,survey base measure longer run inflation expectation little change balance,0
24,2018-12-19,total nonfarm payroll employment expanded november job gains strong average recent months,total nonfarm payroll employment expand november job gain strong average recent month,0
25,2018-12-19,national unemployment rate remained low level ,national unemployment rate remain low level,0
26,2018-12-19, percent labor force participation rate employment population ratio also stayed flat november,percent labor force participation rate employment population ratio also stayed flat november,0
27,2018-12-19,unemployment rates african americans asians hispanics november levels end previous economic expansion,unemployment rate african american asian hispanic november level end previous economic expansion,0
28,2018-12-19,share workers employed part time economic reasons still close lows reached late ,share worker employ part time economic reason still close low reach late,0
29,2018-12-19,rates private sector job openings quits still high levels october initial claims unemployment insurance benefits early december still close historically low levels,rate private sector job opening quits still high level october initial claim unemployment insurance benefit early december still close historically low level,0
30,2018-12-19,total labor compensation per hour nonfarm business sector volatile measure even four quarter change basis increased ,total labor compensation per hour nonfarm business sector volatile measure even four quarter change basis increase,0
31,2018-12-19,average hourly earnings employees rose ,average hourly earnings employee rise,0
32,2018-12-19,household spending continued increase strong pace recent months,household spending continued increase strong pace recent month,0
33,2018-12-19,real pce growth brisk october components nominal retail sales used bureau economic analysis construct estimate pce rose considerably november,real pce growth brisk october component nominal retail sale use bureau economic analysis construct estimate pce rise considerably november,0
34,2018-12-19,key factors influence consumer spending including ongoing gains real disposable personal income effects earlier increases equity prices home values households net worth continued supportive solid real pce growth near term,key factor influence consumer spending include ongoing gain real disposable personal income effect earlier increase equity price home value household net worth continued supportive solid real pce growth near term,0
35,2018-12-19,growth real private expenditures business equipment intellectual property looked picking solidly fourth quarter moderating previous quarter,growth real private expenditure business equipment intellectual property look pick solidly fourth quarter moderate previous quarter,0
36,2018-12-19,forward looking indicators business equipment spending rising backlog unfilled orders nondefense capital goods excluding aircraft upbeat readings business sentiment pointed spending gains near term,forward look indicator business equipment spending rise backlog unfilled order nondefense capital good exclude aircraft upbeat reading business sentiment point spending gain near term,0
37,2018-12-19,nominal business expenditures nonresidential structures outside drilling mining sector declined modestly october number crude oil natural gas rigs operation indicator business spending structures drilling mining sector held steady november early december,nominal business expenditure nonresidential structure outside drilling mining sector decline modestly october number crude oil natural gas rig operation indicator business spending structure drilling mining sector held steady november early december,0
38,2018-12-19,nominal defense spending october november pointed solid growth real federal purchases,nominal defense spending october november point solid growth real federal purchase,0
39,2018-12-19,real purchases state local governments looked edging up nominal construction spending governments rose solidly october payrolls declined little october november,real purchase state local government look edge up nominal construction spending government rise solidly october payroll decline little october november,0
40,2018-12-19,available trade data suggested contribution change net exports rate real gdp growth fourth quarter would much less negative drag nearly  percentage points third quarter,available trade data suggest contribution change net export rate real gdp growth fourth quarter would much less negative drag nearly percentage point third quarter,0
41,2018-12-19,totals consumer prices measured pce price index increased  percent  months ending october,total consumer price measure pce price index increase percent month end october,0
42,2018-12-19,core pce price inflation excludes changes consumer food energy prices ,core pce price inflation excludes change consumer food energy price,0
43,2018-12-19,consumer price index cpi rose ,consumer price index cpi rise,0
44,2018-12-19, percent  months ending november core cpi inflation also ,percent month end november core cpi inflation also,0
45,2018-12-19,recent readings survey based measures longer run inflation expectations including michigan survey survey professional forecasters desk survey primary dealers survey market participants little changed balance,recent reading survey base measure longer run inflation expectation include michigan survey survey professional forecaster desk survey primary dealer survey market participant little change balance,0
46,2018-12-19,foreign economic growth continued moderate pace third quarter pickup emerging market economies emes roughly offset slowing growth advanced foreign economies afes,foreign economic growth continued moderate pace third quarter pickup emerge market economy emes roughly offset slow growth advanced foreign economy afes,0
47,2018-12-19,among emes growth mexico brazil bounced back transitory second quarter weakness offsetting slowdown china india,among emes growth mexico brazil bounce back transitory second quarter weakness offset slowdown china india,0
48,2018-12-19,softness afe growth partly reflected temporary factors including disruptions natural disasters japan adoption new car emissions testing germany,softness afe growth partly reflect temporary factor include disruption natural disaster japan adoption new car emission test germany,0
49,2018-12-19,indicators economic activity fourth quarter consistent continued moderate foreign economic growth,indicator economic activity fourth quarter consistent continued moderate foreign economic growth,0
50,2018-12-19,foreign inflation fell recent months largely reflecting significant drag lower oil prices,foreign inflation fell recent month largely reflect significant drag low oil price,0
51,2018-12-19,underlying inflation pressures especially afes remained muted,underlie inflation pressure especially afes remain mute,0
52,2018-12-19,staff review financial situation investors perceptions downside risks domestic global outlook appeared increase intermeeting period reportedly driven part signs slowing foreign economies growing concerns escalating trade frictions,staff review financial situation investor perception downside risk domestic global outlook appear increase intermeeting period reportedly driven part sign slow foreign economy grow concern escalate trade friction,0
53,2018-12-19,nominals treasury yieldss equity prices declined notably period,nominal treasury yield equity price decline notably period,0
54,2018-12-19,financing conditions businesses households tightened bit generally remained supportive economic growth,financing condition business household tighten bit generally remain supportive economic growth,0
55,2018-12-19,investor perceptions increased downside risks outlooks domestic foreign economic growth including growing concerns trade frictions united states china reportedly weighed yields,investor perception increase downside risk outlook domestic foreign economic growth include grow concern trade friction united state china reportedly weigh yield,0
56,2018-12-19,measures inflation compensation derived tips also decreased notably period along declines oil prices,measure inflation compensation derive tip also decrease notably period along decline oil price,0
57,2018-12-19,concerns escalating trade tensions global growth prospects sustainability corporate earnings growth among factors appeared contribute significant drops equity prices,concern escalate trade tension global growth prospect sustainability corporate earnings growth among factor appear contribute significant drop equity price,0
58,2018-12-19,intermeeting period foreign financial markets affected perceived increases downside risks global growth outlook ongoing uncertainty trade relations united states china,intermeeting period foreign financial market affected perceive increase downside risk global growth outlook ongoing uncertainty trade relation united state china,0
59,2018-12-19,afe sovereign yields declined significantly reflecting decreasess bond yields weaker expected euro areak economic data,afe sovereign yield decline significantly reflect decrease bond yield weaker expect euro areak economic data,0
60,2018-12-19,measures inflation compensation generally fell partly reflecting sharp decreases oil prices,measure inflation compensation generally fell partly reflect sharp decrease oil price,0
61,2018-12-19,many cases nonfinancial firms earnings reports suggested tariffs salient concern changed outlook corporate earnings,many case nonfinancial firm earnings report suggest tariff salient concern change outlook corporate earnings,0
62,2018-12-19,issuance non agency cmbs stable cre loan growth remained strong banks,issuance non agency cmb stable cre loan growth remain strong bank,0
63,2018-12-19,broad consumer credit grew solid pace september though october november saw credit card growth banks edge bit lower average,broad consumer credit grow solid pace september though october november saw credit card growth bank edge bit low average,0
64,2018-12-19,staff economic outlook stronger expected incoming data economic activity recent tightening financial conditions particularly decline equity prices us economic forecast prepared staff december fomc meeting little revised balance,staff economic outlook strong expect incoming data economic activity recent tighten financial condition particularly decline equity price u economic forecast prepared staff december fomc meeting little revise balance,0
65,2018-12-19,staff continued expect real gdp growth would strong fourth quarter  although somewhat slower rapid pace growth previous two quarters,staff continued expect real gdp growth would strong fourth quarter although somewhat slow rapid pace growth previous two quarter,0
66,2018-12-19,  period real gdp forecast rise rate staff estimate potential output growth slow pace ,period real gdp forecast rise rate staff estimate potential output growth slow pace,0
67,2018-12-19,unemployment rate projected decline staff estimate longer run natural rate bottom  begin edge ,unemployment rate project decline staff estimate longer run natural rate bottom begin edge,0
68,2018-12-19,labor market conditions already tight staff continued assume projected employment gains would manifest smaller usual downward pressure unemployment rate larger usual upward pressure labor force participation rate,labor market condition already tight staff continued assume project employment gain would manifest small usual downward pressure unemployment rate large usual upward pressure labor force participation rate,0
69,2018-12-19,staff expected total core pce price inflation touch  percent  total inflation revised bit recent declines consumer energy prices,staff expect total core pce price inflation touch percent total inflation revise bit recent decline consumer energy price,0
70,2018-12-19,core pce price inflation forecast move  percent  remain level medium term total inflation forecast little core inflation  reflecting projected declines energy prices run level core inflation following two years,core pce price inflation forecast move percent remain level medium term total inflation forecast little core inflation reflect project decline energy price run level core inflation follow two year,0
71,2018-12-19,staff medium term projections total core pce price inflation little revised net,staff medium term projection total core pce price inflation little revise net,0
72,2018-12-19,staff viewed uncertainty around projections real gdp growth unemployment rate inflation similar average past  years,staff view uncertainty around projection real gdp growth unemployment rate inflation similar average past year,0
73,2018-12-19,staff also saw risks forecasts real gdp growth unemployment rate balanced,staff also saw risk forecast real gdp growth unemployment rate balance,0
74,2018-12-19,upside household spending business investment could expand faster staff projected supported part tax cuts enacted last year,upside household spending business investment could expand faster staff project support part tax cut enact last year,0
75,2018-12-19,downside trade policies foreign economic developments could move directions significant negative effectss economic growth,downside trade policy foreign economic development could move direction significant negative effects economic growth,0
76,2018-12-19,risks inflation projection also seen balanced,risk inflation projection also see balance,0
77,2018-12-19,upside risk inflation could increase expected economy projected move potential counterbalanced downside risk longer term inflation expectations may lower assumed staff forecast,upside risk inflation could increase expect economy project move potential counterbalance downside risk longer term inflation expectation may low assume staff forecast,0
78,2018-12-19,participants views current conditions economic outlook conjunction fomc meeting members board governors federal reserve bank presidents submitted projections likely outcomes real gdp growth unemployment rate inflation year   longer run based individual assessments appropriate path federal funds rate,participant view current condition economic outlook conjunction fomc meeting member board governor federal reserve bank president submit projection likely outcome real gdp growth unemployment rate inflation year longer run base individual assessment appropriate path federal fund rate,0
79,2018-12-19,longer run projections represented participant assessment rate variable would expected converge time appropriate monetary policy absence shocks economy,longer run projection represent participant assessment rate variable would expect converge time appropriate monetary policy absence shock economy,0
80,2018-12-19,discussion economic situation outlook meeting participants agreed information received since fomc met november indicated labor market continued strengthen economic activity rising strong rate,discussion economic situation outlook meeting participant agree information receive since fomc met november indicate labor market continued strengthen economic activity rise strong rate,0
81,2018-12-19,job gains strong average recent months unemployment rate remained low,job gain strong average recent month unemployment rate remain low,0
82,2018-12-19,household spending continued grow strongly growth business fixed investment moderated rapid pace earlier year,household spending continued grow strongly growth business fix investment moderate rapid pace earlier year,0
83,2018-12-19, month basis overall inflation inflation items food energy remained near  percent,month basis overall inflation inflation item food energy remain near percent,0
84,2018-12-19,indicators longer term inflation expectations little changed balance,indicator longer term inflation expectation little change balance,0
85,2018-12-19,assessing economic outlook participants noted contrast strength incoming data economic activity concerns downside risks evident financial markets reports business contacts,assess economic outlook participant note contrast strength incoming data economic activity concern downside risk evident financial market report business contact,0
86,2018-12-19,recent readings household business spending inflation labor market conditions largely line participants expectations indicated continued strength economy,recent reading household business spending inflation labor market condition largely line participant expectation indicate continued strength economy,0
87,2018-12-19,contrast financial markets volatile conditions tightened intermeeting period sizable declines equity prices notably wider corporate credit spreads coinciding continued flattening treasury yield curve part changes financial conditions appeared reflect greater concerns global economic outlook,contrast financial market volatile condition tighten intermeeting period sizable decline equity price notably wider corporate credit spread coincide continued flatten treasury yield curve part change financial condition appear reflect great concern global economic outlook,0
88,2018-12-19,participants also reported hearing frequent concerns global economic outlook business contacts,participant also report hearing frequent concern global economic outlook business contact,0
