,Date,Original,Corpus,Class
0,2018-08-01,karel mertens senior economic policy advisor federal reserve bank dallas,karel mertens senior economic policy advisor federal reserve bank dallas,0
1,2018-08-01,monetary policy options effective lower bound staff provided briefing summarized analysis extent committee monetary policy tools could provide adequate policy accommodation if future economic downturns policy rate become constrained effective lower bound elb,monetary policy option effective low bound staff provide briefing summarize analysis extent committee monetary policy tool could provide adequate policy accommodation if future economic downturn policy rate become constrain effective low bound elb,0
2,2018-08-01, staff examined simulations staff frbus model various economic models assess likelihood policy rate returning elb evaluate much additional policy accommodation could delivered current toolkit,staff examine simulation staff frbus model various economic model ass likelihood policy rate return elb evaluate much additional policy accommodation could deliver current toolkit,0
3,2018-08-01,toolkit included threshold based forward guidance policies committee communicates federal funds rate remain elb either inflation unemployment rate reaches certain threshold balance sheet policies involving increases size duration federal reserve asset holdings,toolkit include threshold base forward guidance policy committee communicates federal fund rate remain elb either inflation unemployment rate reach certain threshold balance sheet policy involve increase size duration federal reserve asset holding,0
4,2018-08-01,staff analysis indicated various policy rules including prescribing aggressive reductions federal funds rate response adverse economic shocks meaningful risk elb could bind sometime next decade,staff analysis indicate various policy rule include prescribe aggressive reduction federal fund rate response adverse economic shock meaningful risk elb could bind sometime next decade,0
5,2018-08-01,analysis also implied threshold based forward guidance balance sheet actions could provide additional accommodation could help support economic activity mitigate disinflationary pressures episodes,analysis also imply threshold base forward guidance balance sheet action could provide additional accommodation could help support economic activity mitigate disinflationary pressure episode,0
6,2018-08-01,model simulations unanticipated shocks lags transmission effects monetary policy actions economic activity inflation effectiveness monetary policy general including forward guidance balance sheet policies limited mitigating initial downturn economy,model simulation unanticipated shock lag transmission effect monetary policy action economic activity inflation effectiveness monetary policy general include forward guidance balance sheet policy limited mitigate initial downturn economy,0
7,2018-08-01,staff noted considerable uncertainty surrounding estimated effects policies economy addition estimates frequently elb could bind future differed across models staff examined,staff note considerable uncertainty surround estimate effect policy economy addition estimate frequently elb could bind future differ across model staff examine,0
8,2018-08-01,discussion followed staff briefing participants generally agreed current toolkit could provide significant accommodation expressed concern potential limits policy effectiveness stemming elb,discussion follow staff briefing participant generally agree current toolkit could provide significant accommodation express concern potential limit policy effectiveness stem elb,0
9,2018-08-01,decline viewed likely driven various factors including slower trend growth labor force productivity well increased demand safe assets,decline view likely driven various factor include slow trend growth labor force productivity well increase demand safe asset,0
10,2018-08-01,accordingly view spells elb could become frequent protracted past consistent staff analysis,accordingly view spell elb could become frequent protract past consistent staff analysis,0
11,2018-08-01,participants raised concern frequent extended elb episodes could result expectations inflation committee symmetric  percent objective limiting scope reductions federal funds rate serve buffer economy increasing likelihood elb episodes,participant raise concern frequent extend elb episode could result expectation inflation committee symmetric percent objective limit scope reduction federal fund rate serve buffer economy increase likelihood elb episode,0
12,2018-08-01,fiscal policy viewed potentially important tool addressing future economic downturn monetary policy constrained elb however countercyclical fiscal policy actions united states may constrained high rising level federal government debt,fiscal policy view potentially important tool address future economic downturn monetary policy constrain elb however countercyclical fiscal policy action united state may constrain high rise level federal government debt,0
13,2018-08-01,couple participants saw macroprudential regulatory policies tools could used mitigate risk financial imbalances inducing economic downturn elb constrained federal funds rate,couple participant saw macroprudential regulatory policy tool could use mitigate risk financial imbalance induce economic downturn elb constrain federal fund rate,0
14,2018-08-01,addendum policy normalization principles plans statement issued june  committee indicated would prepared use full range tools including altering size composition balance sheet future economic conditions warrant accommodative monetary policy achieved solely reducing federal funds rate,addendum policy normalization principle plan statement issue june committee indicate would prepared use full range tool include alter size composition balance sheet future economic condition warrant accommodative monetary policy achieve solely reduce federal fund rate,0
15,2018-08-01,also emphasized considerable uncertainty economic effects tools,also emphasize considerable uncertainty economic effect tool,0
16,2018-08-01,consistent view participants noted economic researchers not yet reached consensus effectiveness unconventional policies,consistent view participant note economic researcher not yet reach consensus effectiveness unconventional policy,0
17,2018-08-01,number participants indicated might significant costs associated use unconventional policies costs might limit particular extent committee engage large scale asset purchases,number participant indicate might significant cost associate use unconventional policy cost might limit particular extent committee engage large scale asset purchase,0
18,2018-08-01,particular difficult anticipate forces might push economy recession thus preserving flexibility responding economic downturn could appropriate,particular difficult anticipate force might push economy recession thus preserve flexibility respond economic downturn could appropriate,0
19,2018-08-01,asset prices influenced number factors including reports concerning trade tensions among united states major trading partners foreign monetary policy developments data pointing strong growth momentum united states,asset price influence number factor include report concern trade tension among united state major trading partner foreign monetary policy development data point strong growth momentum united state,0
20,2018-08-01,news agreement united states european union continue talks resolve trade disputes provided support global equity prices,news agreement united state european union continue talk resolve trade dispute provide support global equity price,0
21,2018-08-01,july meeting boj announced number changes respect forward guidance policy outlook including intention keep interest rates low extended period,july meeting boj announce number change respect forward guidance policy outlook include intention keep interest rate low extend period,0
22,2018-08-01,responses open market desk survey primary dealers survey market participants indicated concerns trade tensions not affected outlooks monetary policy,response open market desk survey primary dealer survey market participant indicate concern trade tension not affected outlook monetary policy,0
23,2018-08-01,staff projected principal payments federal reserve holdings agency mbs would fall fomc monthly redemption cap beginning october,staff project principal payment federal reserve holding agency mb would fall fomc monthly redemption cap begin october,0
24,2018-08-01,staff review economic situation information reviewed july  august  meeting indicated labor market conditions continued strengthen recent months real gross domestic product gdp rose strong rate first half year,staff review economic situation information review july august meeting indicate labor market condition continued strengthen recent month real gross domestic product gdp rise strong rate first half year,0
25,2018-08-01,consumer price inflation measured month percentage change price index personal consumption expenditures pce remained near  percent june,consumer price inflation measure month percentage change price index personal consumption expenditure pce remain near percent june,0
26,2018-08-01,surveybased measures longer run inflation expectations little changed balance,surveybased measure longer run inflation expectation little change balance,0
27,2018-08-01,total nonfarm payroll employment expanded strong pace june,total nonfarm payroll employment expand strong pace june,0
28,2018-08-01,national unemployment rate moved ,national unemployment rate move,0
29,2018-08-01, percent labor force participation rate rose similar amount leaving employment population ratio unchanged may,percent labor force participation rate rise similar amount leave employment population ratio unchanged may,0
30,2018-08-01,three month moving averages unemployment rates african americans asians hispanics lows achieved previous expansion,three month move average unemployment rate african american asian hispanic low achieve previous expansion,0
31,2018-08-01,share workers employed part time economic reasons edged lowest level since late ,share worker employ part time economic reason edge low level since late,0
32,2018-08-01,rate private sector job openings ticked may remained elevated rate quits moved higher initial claims unemployment insurance benefits continued low mid july,rate private sector job opening ticked may remain elevate rate quits move high initial claim unemployment insurance benefit continued low mid july,0
33,2018-08-01,recent readings showed increases hourly labor compensation stepped modestly past year,recent reading show increase hourly labor compensation step modestly past year,0
34,2018-08-01,employment cost index private workers increased ,employment cost index private worker increase,0
35,2018-08-01, percent  months year earlier average hourly earnings employees rose ,percent month year earlier average hourly earnings employee rise,0
36,2018-08-01,data compensation per hour reflected comprehensive revision national income product accounts bureau economic analysis bea not available time meeting,data compensation per hour reflect comprehensive revision national income product account bureau economic analysis bea not available time meeting,0
37,2018-08-01,broadly recent readings key factors influence consumer spending including gains employment real disposable personal income households net worth continued supportive solid real pce growth near term,broadly recent reading key factor influence consumer spending include gain employment real disposable personal income household net worth continued supportive solid real pce growth near term,0
38,2018-08-01,nominal shipments nondefense capital goods excluding aircraft rose may june forward looking indicators business equipment spending backlog unfilled capital goods orders along upbeat readings business sentiment national regional surveys continued point robust gains equipment spending near term,nominal shipment nondefense capital good exclude aircraft rise may june forward look indicator business equipment spending backlog unfilled capital good order along upbeat reading business sentiment national regional survey continued point robust gain equipment spending near term,0
39,2018-08-01,however number crude oil natural gas rigs operation indicator business spending structures drilling mining sector decreased slightly recent weeks,however number crude oil natural gas rig operation indicator business spending structure drilling mining sector decrease slightly recent week,0
40,2018-08-01,real purchases state local governments also moved higher state local government payrolls construction spending governments increased second quarter,real purchase state local government also move high state local government payroll construction spending government increase second quarter,0
41,2018-08-01,told bea estimates net exports made positive contribution  percentage point real gdp growth second quarter near zero contribution first,told bea estimate net export make positive contribution percentage point real gdp growth second quarter near zero contribution first,0
42,2018-08-01,totals consumer prices measured pce price index increased ,total consumer price measure pce price index increase,0
43,2018-08-01,core pce price inflation excludes changes consumer food energy prices ,core pce price inflation excludes change consumer food energy price,0
44,2018-08-01,consumer price index cpi rose ,consumer price index cpi rise,0
45,2018-08-01, percent  months ending june core cpi inflation ,percent month end june core cpi inflation,0
46,2018-08-01,recent readings survey based measures longer run inflation expectations including michigan survey desk survey primary dealers survey market participants little changed balance,recent reading survey base measure longer run inflation expectation include michigan survey desk survey primary dealer survey market participant little change balance,0
47,2018-08-01,incoming data suggested foreign economic activity expanded moderate pace second quarter,incoming data suggest foreign economic activity expand moderate pace second quarter,0
48,2018-08-01,monthly indicators pointed pickup pace economic activity advanced foreign economies afes following temporary dip first quarter,monthly indicator point pickup pace economic activity advanced foreign economy afes follow temporary dip first quarter,0
49,2018-08-01,however real gdp growth remained moderate euro area appeared slowed notably many emerging market economies emes especially mexico unusually strong start year,however real gdp growth remain moderate euro area appear slow notably many emerge market economy emes especially mexico unusually strong start year,0
50,2018-08-01,foreign inflation fell second quarter largely reflecting lower retail energy food price inflation,foreign inflation fell second quarter largely reflect low retail energy food price inflation,0
51,2018-08-01,underlying inflation pressures foreign economies especially afes remained subdued,underlie inflation pressure foreign economy especially afes remain subdue,0
52,2018-08-01,staff review financial situation concerns regarding international trade policy weighed market sentiment times intermeeting period prompting notable declines foreign equity markets leaving modest imprint domestic asset prices net,staff review financial situation concern regard international trade policy weigh market sentiment time intermeeting period prompt notable decline foreign equity market leave modest imprint domestic asset price net,0
53,2018-08-01,meanwhile fomc communications viewed market participants slightly less accommodative expected domestic economic data releases seen mixed,meanwhile fomc communication view market participant slightly less accommodative expect domestic economic data release see mixed,0
54,2018-08-01,financing conditions nonfinancial businesses households remained supportive economic activity balance,financing condition nonfinancial business household remain supportive economic activity balance,0
55,2018-08-01,although reactions asset prices fomc communications period generally modest market participants reportedly interpreted june fomc statement summary economic projections sep somewhat less accommodative expected,although reaction asset price fomc communication period generally modest market participant reportedly interpret june fomc statement summary economic projection sep somewhat less accommodative expect,0
56,2018-08-01,measures inflation compensation derived treasury inflation protected securities little changed net,measure inflation compensation derive treasury inflation protect security little change net,0
57,2018-08-01,broads equity price indexes displayed mixed results since june fomc meeting,broad equity price index displayed mixed result since june fomc meeting,0
58,2018-08-01,dollar appreciated currencies notable exception mexican peso appreciated easing investor concerns around prospective economic policies newly elected government,dollar appreciate currency notable exception mexican peso appreciate ease investor concern around prospective economic policy newly elect government,0
59,2018-08-01,trade tensions also drove foreign equity prices lower modest reversal late intermeeting period following agreement united states european union hold tariff increases pending negotiations,trade tension also drove foreign equity price low modest reversal late intermeeting period follow agreement united state european union hold tariff increase pending negotiation,0
60,2018-08-01,net equity prices little changed afes declined emes led largely steep drop china,net equity price little change afes decline emes lead largely steep drop china,0
61,2018-08-01,finally bank england held policy rate steady june meeting uk yields declined slightly amid ongoing brexit related concerns well lower expected inflation data,finally bank england held policy rate steady june meeting uk yield decline slightly amid ongoing brexit related concern well low expect inflation data,0
62,2018-08-01,growth outstanding commercial industrial ci loans held banks strong average june,growth outstanding commercial industrial ci loan held bank strong average june,0
63,2018-08-01,cre loans banks maintained solid growth past several quarters growth shared across three major cre loan categories,cre loan bank maintain solid growth past several quarter growth share across three major cre loan category,0
64,2018-08-01,growth home purchase mortgages slowed bit refinancing activity continued muted past year developments partly reflecting rise mortgage rates earlier year,growth home purchase mortgage slow bit refinance activity continued mute past year development partly reflect rise mortgage rate earlier year,0
65,2018-08-01,financing conditions consumer credit markets little changed far year balance remained largely supportive growth household spending,financing condition consumer credit market little change far year balance remain largely supportive growth household spending,0
66,2018-08-01,growth consumer credit picked may moderate pace seen earlier year,growth consumer credit picked may moderate pace see earlier year,0
67,2018-08-01,credit supply conditions also continued largely supportive spending,credit supply condition also continued largely supportive spending,0
68,2018-08-01,staff provided latest report potential risks financial stability report characterized financial vulnerabilitiess financial system moderate balance,staff provide late report potential risk financial stability report characterize financial vulnerability financial system moderate balance,0
69,2018-08-01,overall assessment incorporated staff judgment vulnerabilities associated asset valuation pressures continued elevated no major asset class exhibiting valuations historical midpoints,overall assessment incorporate staff judgment vulnerability associate asset valuation pressure continued elevate no major asset class exhibit valuation historical midpoint,0
70,2018-08-01,additionally staff judged vulnerabilities financial sector leverage maturity liquidity transformation low vulnerabilities household leverage low moderate range vulnerabilities leverage nonfinancial business sector elevated,additionally staff judged vulnerability financial sector leverage maturity liquidity transformation low vulnerability household leverage low moderate range vulnerability leverage nonfinancial business sector elevate,0
71,2018-08-01,staff economic outlooks economic forecast prepared fomc meeting staff continued project economy would expand trend pace,staff economic outlook economic forecast prepared fomc meeting staff continued project economy would expand trend pace,0
72,2018-08-01,  period output projected rise staff estimate potential output unemployment rate projected decline staff estimate longer run natural rate,period output project rise staff estimate potential output unemployment rate project decline staff estimate longer run natural rate,0
73,2018-08-01,however labor market conditions already tight staff continued assume projected decline unemployment rate attenuated greater usual cyclical improvement labor force participation rate,however labor market condition already tight staff continued assume project decline unemployment rate attenuate great usual cyclical improvement labor force participation rate,0
74,2018-08-01,relative forecast prepared june meeting projection real gdp growth revised little primarily response stronger incoming data household spending,relative forecast prepared june meeting projection real gdp growth revise little primarily response strong incoming data household spending,0
75,2018-08-01,addition staff continued anticipate supply constraints might restrain output growth somewhat medium term,addition staff continued anticipate supply constraint might restrain output growth somewhat medium term,0
76,2018-08-01,unemployment rate projected little higher next quarters previous forecast essentially unrevised thereafter,unemployment rate project little high next quarter previous forecast essentially unrevised thereafter,0
77,2018-08-01,staff forecast total pce price inflation  revised little mainly slower expected increase consumer energy prices second quarter downward revision forecast energy price inflation second half year,staff forecast total pce price inflation revise little mainly slow expect increase consumer energy price second quarter downward revision forecast energy price inflation second half year,0
78,2018-08-01,staff continued project total pce inflation would remain near committee  percent objective medium term core pce price inflation would run slightly higher total inflation period projected decline consumer energy prices  ,staff continued project total pce inflation would remain near committee percent objective medium term core pce price inflation would run slightly high total inflation period project decline consumer energy price,0
79,2018-08-01,staff viewed uncertainty around projections real gdp growth unemployment rate inflation similar average past  years,staff view uncertainty around projection real gdp growth unemployment rate inflation similar average past year,0
80,2018-08-01,staff saw risks forecasts real gdp growth unemployment rate balanced,staff saw risk forecast real gdp growth unemployment rate balance,0
81,2018-08-01,upside household spending business investment could expand faster next years staff projected supported part tax cuts enacted last year,upside household spending business investment could expand faster next year staff project support part tax cut enact last year,0
82,2018-08-01,downside trade policies could move direction would significant negative effects economic growth,downside trade policy could move direction would significant negative effect economic growth,0
83,2018-08-01,risks inflation projection also seen balanced,risk inflation projection also see balance,0
84,2018-08-01,upside risk inflation could increase expected economy projected move potential counterbalanced downside risk longer term inflation expectations may lower assumed staff forecast,upside risk inflation could increase expect economy project move potential counterbalance downside risk longer term inflation expectation may low assume staff forecast,0
85,2018-08-01,participants views current conditions economic outlook discussion economic situation outlook meeting participants agreed information received since fomc met june indicated labor market continued strengthen economic activity rising strong rate,participant view current condition economic outlook discussion economic situation outlook meeting participant agree information receive since fomc met june indicate labor market continued strengthen economic activity rise strong rate,0
86,2018-08-01,job gains strong average recent months unemployment rate stayed low,job gain strong average recent month unemployment rate stayed low,0
87,2018-08-01,household spending business fixed investment grown strongly,household spending business fix investment grown strongly,0
88,2018-08-01, month basis overall inflation core inflation excludes changes food energy prices remained near  percent,month basis overall inflation core inflation excludes change food energy price remain near percent,0
89,2018-08-01,indicators longer term inflation expectations little changed balance,indicator longer term inflation expectation little change balance,0
90,2018-08-01,participants generally noted economic growth second quarter strong incoming data indicated considerable momentum spending households businesses,participant generally note economic growth second quarter strong incoming data indicate considerable momentum spending household business,0
