,Date,Original,Corpus,Class
0,2020-01-29,outright operation securities dealers foreign international accounts maintained selected bank day deferred delivery basis including transactions commonly referred dollar rolls coupon swaps market prices,outright operation security dealer foreign international account maintain select bank day defer delivery basis include transaction commonly refer dollar roll coupon swap market price,0
1,2020-01-29,exchange market prices connection treasury auction maturing eligible securities soma treasury case eligible securities direct obligations united states fully guaranteed principal interest united states,exchange market price connection treasury auction mature eligible security soma treasury case eligible security direct obligation united state fully guaranteed principal interest united state,0
2,2020-01-29,exchange market prices maturing eligible securities soma agency united states case eligible securities direct obligations agency fully guaranteed principal interest agency,exchange market price mature eligible security soma agency united state case eligible security direct obligation agency fully guaranteed principal interest agency,0
3,2020-01-29,adjustment described subparagraph paragraph  shall made context committee discussion decision stance policy recent meeting committee long run objectives foster maximum employment price stability shall based economic financial monetary developments since recent meeting committee,adjustment described subparagraph paragraph shall make context committee discussion decision stance policy recent meeting committee long run objective foster maximum employment price stability shall base economic financial monetary development since recent meeting committee,0
4,2020-01-29,operations involving standing dollar liquidity swap arrangements standing foreign currency liquidity swap arrangements shall generally directed countering strains financial markets united states abroad reducing risk could emerge mitigate effects economic financial conditions united states,operation involve stand dollar liquidity swap arrangement stand foreign currency liquidity swap arrangement shall generally direct counter strain financial market united state abroad reduce risk could emerge mitigate effect economic financial condition united state,0
5,2020-01-29,meeting discussion focused two topics potential interactions monetary policy financial stability potential use inflation ranges around committee  percent inflation objective,meeting discussion focus two topic potential interaction monetary policy financial stability potential use inflation range around committee percent inflation objective,0
6,2020-01-29,staff briefing first topic noted current environment low neutral rates achieving committee dual mandate goals maximum employment price stability would require low policy rates frequently regardless monetary policy strategy tools chosen,staff briefing first topic note current environment low neutral rate achieve committee dual mandate goal maximum employment price stability would require low policy rate frequently regardless monetary policy strategy tool chosen,0
7,2020-01-29,consequently policy strategies tools help support stronger economy anchor inflation expectations level consistent committee objective low neutral rate environment help promote financial stability,consequently policy strategy tool help support strong economy anchor inflation expectation level consistent committee objective low neutral rate environment help promote financial stability,0
8,2020-01-29,addition staff reported available empirical evidence suggests effects changes policy rates asset prices risk premiums tend modest relative historical fluctuations measures,addition staff report available empirical evidence suggests effect change policy rate asset price risk premium tend modest relative historical fluctuation measure,0
9,2020-01-29,staff noted clear communications committee ongoing assessments interactions monetary policy financial stability could help avoid large interest rate surprises could otherwise contribute financial vulnerabilities,staff note clear communication committee ongoing assessment interaction monetary policy financial stability could help avoid large interest rate surprise could otherwise contribute financial vulnerability,0
10,2020-01-29,discussion effects alternative monetary policy strategies tools might financial stability participants noted macroeconomic stability achievement committee dual mandate depended stable financial system,discussion effect alternative monetary policy strategy tool might financial stability participant note macroeconomic stability achievement committee dual mandate depend stable financial system,0
11,2020-01-29,unstable financial system may amplify shocks economy exacerbate increases unemployment drive inflation away committee goal,unstable financial system may amplify shock economy exacerbate increase unemployment drive inflation away committee goal,0
12,2020-01-29,number participants judged that circumstances low policy rates might help foster financial stability provided needed support strong economic conditions price stability,number participant judged that circumstance low policy rate might help foster financial stability provide need support strong economic condition price stability,0
13,2020-01-29,participants remarked however keeping policy rates low achieve committee dual mandate objectives may contribute buildup financial vulnerabilities especially times economy full employment development could pose future risks economy ability committee achieve dual mandate,participant remark however keep policy rate low achieve committee dual mandate objective may contribute buildup financial vulnerability especially time economy full employment development could pose future risk economy ability committee achieve dual mandate,0
14,2020-01-29,recognizing limitations many participants remarked committee not rule possibility adjusting stance monetary policy mitigate financial stability risks particularly risks important implications economic outlook macroprudential tools likely ineffective mitigating risks,recognize limitation many participant remark committee not rule possibility adjust stance monetary policy mitigate financial stability risk particularly risk important implication economic outlook macroprudential tool likely ineffective mitigate risk,0
15,2020-01-29,result monetary policy guided primarily outlook employment inflation respond financial stability risks insofar risks significantly threaten achievement committee mandate,result monetary policy guide primarily outlook employment inflation respond financial stability risk insofar risk significantly threaten achievement committee mandate,0
16,2020-01-29,several participants observed monetary policy measures needed curb financial stability risks could quite large resulting effects employment inflation could place high hurdle measures,several participant observe monetary policy measure need curb financial stability risk could quite large result effect employment inflation could place high hurdle measure,0
17,2020-01-29,participants remarked that financial stability risks consideration achieving committee dual mandate clear communications strategy would needed convey committee assessments financial vulnerabilities potential implications monetary policy outlook,participant remark that financial stability risk consideration achieve committee dual mandate clear communication strategy would need convey committee assessment financial vulnerability potential implication monetary policy outlook,0
18,2020-01-29,staff briefing considerations regarding use inflation range focused three different concepts inflation range,staff briefing consideration regard use inflation range focus three different concept inflation range,0
19,2020-01-29,first uncertainty range could communicate magnitude inherent variability inflation would still consistent achieving committee symmetric inflation objective,first uncertainty range could communicate magnitude inherent variability inflation would still consistent achieve committee symmetric inflation objective,0
20,2020-01-29,second operational range could signal that conditions committee would prefer inflation away longer run objective time range could potentially used part makeup policy strategy including one based average inflation targeting strategies aimed offsetting adverse effects binding effective lower bound policy rates,second operational range could signal that condition committee would prefer inflation away longer run objective time range could potentially use part makeup policy strategy include one base average inflation target strategy aim offset adverse effect binding effective low bound policy rate,0
21,2020-01-29,third indifference range could communicate monetary policy would not respond deviations inflation within range,third indifference range could communicate monetary policy would not respond deviation inflation within range,0
22,2020-01-29,briefing also summarized experiences foreign central banks use inflation ranges ranges typically put place many years ago often conjunction adopting inflation target,briefing also summarize experience foreign central bank use inflation range range typically put place many year ago often conjunction adopt inflation target,0
23,2020-01-29,staff highlighted communications challenges could arise inflation range introduced time inflation running central bank objective number years,staff highlight communication challenge could arise inflation range introduce time inflation run central bank objective number year,0
24,2020-01-29,environment introduction symmetric range around point objective could misinterpreted sign central bank not concerned inflation remaining stated goal situation could lead inflation expectations drifting lower end range,environment introduction symmetric range around point objective could misinterpret sign central bank not concerned inflation remain state goal situation could lead inflation expectation drift low end range,0
25,2020-01-29,participants expressed range views potential benefits costs different types inflation ranges,participant express range view potential benefit cost different type inflation range,0
26,2020-01-29,participants expressed concern introducing symmetric inflation range around  percent objective following extended period inflation mostly running somewhat  percent could misperceived signal committee comfortable continued misses symmetric inflation objective,participant express concern introduce symmetric inflation range around percent objective follow extend period inflation mostly run somewhat percent could misperceive signal committee comfortable continued miss symmetric inflation objective,0
27,2020-01-29,many participants agreed uncertainty range could misinterpreted indifference range hence lack commitment committee symmetric  percent inflation objective,many participant agree uncertainty range could misinterpret indifference range hence lack commitment committee symmetric percent inflation objective,0
28,2020-01-29,participants suggested not clear introducing range would help much achieving committee inflation objective noted introducing range could make objective less clear public,participant suggest not clear introduce range would help much achieve committee inflation objective note introduce range could make objective less clear public,0
29,2020-01-29,instead establishing range committee could continue communicate inflation objective symmetric around  percent,instead establish range committee could continue communicate inflation objective symmetric around percent,0
30,2020-01-29,inflation inherently variable committee could emphasize intention inflation centered  percent objective,inflation inherently variable committee could emphasize intention inflation center percent objective,0
31,2020-01-29,nevertheless view inherent variability inflation several participants judged could benefit communicating inflation objective symmetric range around point target,nevertheless view inherent variability inflation several participant judged could benefit communicate inflation objective symmetric range around point target,0
32,2020-01-29,addition participants suggested inflation range could convey uncertainty associated available array inflation measures committee communications could explicitly reference measures inflation,addition participant suggest inflation range could convey uncertainty associate available array inflation measure committee communication could explicitly reference measure inflation,0
33,2020-01-29,several participants also stated employing asymmetric operational range timewith  percent near lower end rangewhile still maintaining longer run target  percent could help communicate committee intended inflation average  percent time turn could help keep longer run inflation expectations levels consistent objective,several participant also state employ asymmetric operational range timewith percent near low end rangewhile still maintain longer run target percent could help communicate committee intend inflation average percent time turn could help keep longer run inflation expectation level consistent objective,0
34,2020-01-29,period risk asset prices rose market participants focused perceived reduction downside risks economic outlook favorable data foreign economic activity expectations continued monetary policy accommodation united states major economies,period risk asset price rise market participant focus perceive reduction downside risk economic outlook favorable data foreign economic activity expectation continued monetary policy accommodation united state major economy,0
35,2020-01-29,market participants suggested federal reserve actions fourth quarter maintain ample reserve levels might contributed degree rise equity risk asset prices,market participant suggest federal reserve action fourth quarter maintain ample reserve level might contribute degree rise equity risk asset price,0
36,2020-01-29,final days intermeeting period financial markets responded news spread coronavirus started china reportedly contributed downward moves treasury yields and lesser extent us equity prices,final day intermeeting period financial market respond news spread coronavirus start china reportedly contribute downward move treasury yield and lesser extent u equity price,0
37,2020-01-29,balance us financial conditions became accommodative intermeeting period equity prices rising notably,balance u financial condition become accommodative intermeeting period equity price rise notably,0
38,2020-01-29,despite signs reduced risks outlook stabilization economic activity abroad financial market participants views likely courses monetary policy appeared changed little intermeeting period,despite sign reduce risk outlook stabilization economic activity abroad financial market participant view likely course monetary policy appear change little intermeeting period,0
39,2020-01-29,addition results desk surveys suggested that notwithstanding abatement risks recent months many market participants continued see risks economic outlook skewed downside,addition result desk survey suggest that notwithstanding abatement risk recent month many market participant continued see risk economic outlook skewed downside,0
40,2020-01-29,current pace  billion per month staff estimates suggested april year desk reserve management purchases restore permanent base reserves levels prevailing early september ,current pace billion per month staff estimate suggest april year desk reserve management purchase restore permanent base reserve level prevail early september,0
41,2020-01-29,second quarter manager expected reserve conditions support slowing pace treasury bill purchases goal eventually aligning growth federal reserve treasury holdings trend growth liabilities,second quarter manager expect reserve condition support slow pace treasury bill purchase goal eventually align growth federal reserve treasury holding trend growth liability,0
42,2020-01-29,staff review economic situation information available january  meeting indicated labor market conditions remained strong real gross domestic product gdp increased moderate rate fourth quarter ,staff review economic situation information available january meeting indicate labor market condition remain strong real gross domestic product gdp increase moderate rate fourth quarter,0
43,2020-01-29,consumer price inflation measured month percentage change price index personal consumption expenditures pce remained  percent november,consumer price inflation measure month percentage change price index personal consumption expenditure pce remain percent november,0
44,2020-01-29,survey based measures longer run inflation expectations little changed,survey base measure longer run inflation expectation little change,0
45,2020-01-29,total nonfarm payroll employment rose december solid pace job gains second half  somewhat first half,total nonfarm payroll employment rise december solid pace job gain second half somewhat first half,0
46,2020-01-29,however rate increase payrolls  slower  whether not one accounted anticipated effects bureau labor statistics benchmark revision payroll employment scheduled early february,however rate increase payroll slow whether not one account anticipate effect bureau labor statistic benchmark revision payroll employment schedule early february,0
47,2020-01-29,unemployment rate held steady year low ,unemployment rate held steady year low,0
48,2020-01-29, percent december labor force participation rate employment population ratio unchanged well,percent december labor force participation rate employment population ratio unchanged well,0
49,2020-01-29,unemployment rates african americans asians hispanics whites levels end previous economic expansion,unemployment rate african american asian hispanic white level end previous economic expansion,0
50,2020-01-29,average share workers employed part time economic reasons november stayed level late ,average share worker employ part time economic reason november stayed level late,0
51,2020-01-29,rate private sector job openings declined net october november still fairly high level rate quits also high level edged up,rate private sector job opening decline net october november still fairly high level rate quits also high level edge up,0
52,2020-01-29,four week moving average initial claims unemployment insurance benefits mid january remained near historically low levels,four week move average initial claim unemployment insurance benefit mid january remain near historically low level,0
53,2020-01-29,nominal wage growth moderate average hourly earnings employees increasing ,nominal wage growth moderate average hourly earnings employee increase,0
54,2020-01-29,total consumer prices measured pce price index increased ,total consumer price measure pce price index increase,0
55,2020-01-29,core pce price inflation which excludes changes consumer food energy prices ,core pce price inflation which excludes change consumer food energy price,0
56,2020-01-29,consumer food price inflation lower core inflation consumer energy prices declined,consumer food price inflation low core inflation consumer energy price decline,0
57,2020-01-29,trimmed mean measure  month pce price inflation constructed federal reserve bank dallas remained  percent november,trim mean measure month pce price inflation construct federal reserve bank dallas remain percent november,0
58,2020-01-29,consumer price index cpi core cpi rose ,consumer price index cpi core cpi rise,0
59,2020-01-29,recent readings survey based measures longer run inflation expectations little changed balance recent months,recent reading survey base measure longer run inflation expectation little change balance recent month,0
60,2020-01-29,however key factors influence consumer spendingincluding low unemployment rate upward trend real disposable income high levels households net worth generally low interest ratesremained supportive solid real pce growth near term,however key factor influence consumer spendingincluding low unemployment rate upward trend real disposable income high level household net worth generally low interest ratesremained supportive solid real pce growth near term,0
61,2020-01-29,although measures business sentiment improved analysts expectations firms longer term profit growth edged further concerns trade developments continued weigh firms investment decisions reduced deliveries boeing  max likely restraining investment,although measure business sentiment improve analyst expectation firm longer term profit growth edge far concern trade development continued weigh firm investment decision reduce delivery boeing max likely restrain investment,0
62,2020-01-29,total number crude oil natural gas rigs operationan indicator business spending structures drilling mining sectorwas little changed net mid january though still levels seen latter part ,total number crude oil natural gas rig operationan indicator business spending structure drilling mining sectorwas little change net mid january though still level see latter part,0
63,2020-01-29,nominal defense spending november december pointed moderate rise real federal government purchases,nominal defense spending november december point moderate rise real federal government purchase,0
64,2020-01-29,real purchases state local governments looked risen little faster third quarter nominal construction spending governments increased solidly november state local payrolls expanded modestly december,real purchase state local government look risen little faster third quarter nominal construction spending government increase solidly november state local payroll expand modestly december,0
65,2020-01-29,real net exports estimated provided substantial boost real gdp growth fourth quarter,real net export estimate provide substantial boost real gdp growth fourth quarter,0
66,2020-01-29,incoming data suggested foreign economic growth slowed fourth quarter subdued pace,incoming data suggest foreign economic growth slow fourth quarter subdue pace,0
67,2020-01-29,advanced foreign economies afes growth appeared remained weak manufacturing slump continued consumption tax hike japan led sharp contraction household spending,advanced foreign economy afes growth appear remain weak manufacturing slump continued consumption tax hike japan lead sharp contraction household spending,0
68,2020-01-29,emerging economies social unrest weighed heavily economic activity hong kong chile labor strike general motors drag mexico already weak economy,emerge economy social unrest weigh heavily economic activity hong kong chile labor strike general motor drag mexico already weak economy,0
69,2020-01-29,contrast early gdp releases showed pickup growth china asian economies though news coronavirus outbreak raised questions sustainability pickup,contrast early gdp release show pickup growth china asian economy though news coronavirus outbreak raise question sustainability pickup,0
70,2020-01-29,foreign inflation rose wake temporary factors india china remained soft afes part reflecting previous declines energy prices muted core inflation pressures,foreign inflation rise wake temporary factor india china remain soft afes part reflect previous decline energy price mute core inflation pressure,0
71,2020-01-29,staff review financial situation investor sentiment improved balance intermeeting period mostly reflecting progress related phase one trade deal united states china subsequent signing perception probability disorderly brexit declined signs stabilization global economic outlook and reportedly continued confidence monetary policy united states major economies would remain accommodative near term,staff review financial situation investor sentiment improve balance intermeeting period mostly reflect progress related phase one trade deal united state china subsequent signing perception probability disorderly brexit decline sign stabilization global economic outlook and reportedly continued confidence monetary policy united state major economy would remain accommodative near term,0
72,2020-01-29,late period concerns spread coronavirus uncertainty potential economic effect weighed negatively investor sentiment led moderate declines prices risky assets,late period concern spread coronavirus uncertainty potential economic effect weigh negatively investor sentiment lead moderate decline price risky asset,0
73,2020-01-29,net equity prices increased notably intermeeting period corporate bond spreads little changed yields nominal treasury securities declined,net equity price increase notably intermeeting period corporate bond spread little change yield nominal treasury security decline,0
74,2020-01-29,financing conditions businesses households eased bit generally remained supportive spending economic activity,financing condition business household ease bit generally remain supportive spending economic activity,0
75,2020-01-29,consistent reports straight read probability distributions federal funds rate implied options prices suggested investors assigned high probability target range remaining unchanged next months,consistent report straight read probability distribution federal fund rate imply option price suggest investor assign high probability target range remain unchanged next month,0
76,2020-01-29,measures inflation compensation next  years   years ahead based treasury inflation protected securities decreased net remained october  lows,measure inflation compensation next year year ahead base treasury inflation protect security decrease net remain october low,0
