,Date,Original,Corpus,Class
77,2020-01-29,broad stock price indexes increased notably balance intermeeting period gains largely attributed improved market sentiment trade negotiations perceived lower probability disorderly brexit,broad stock price index increase notably balance intermeeting period gain largely attribute improve market sentiment trade negotiation perceive low probability disorderly brexit,0
78,2020-01-29,late period equity prices retraced gains concerns spread coronavirus weighed negatively risk sentiment,late period equity price retrace gain concern spread coronavirus weigh negatively risk sentiment,0
79,2020-01-29,overall movements stock prices varied widely across economic sectors stocks firms information technology utilities sectors significantly outperforming aggregate indexes stock prices firms energy sector declined markedly,overall movement stock price varied widely across economic sector stock firm information technology utility sector significantly outperform aggregate index stock price firm energy sector decline markedly,0
80,2020-01-29,intermeeting period foreign equity prices rose amid progressschina trade negotiations generally favorable data global economic activity reduced risk disorderly brexit followingk general election,intermeeting period foreign equity price rise amid progressschina trade negotiation generally favorable data global economic activity reduce risk disorderly brexit followingk general election,0
81,2020-01-29,financing conditions nonfinancial firms remained accommodative balance corporate borrowing costs staying near historical lows intermeeting period,financing condition nonfinancial firm remain accommodative balance corporate borrowing cost stay near historical low intermeeting period,0
82,2020-01-29,credit quality nonfinancial corporations earnings outlook remained generally stable recent months,credit quality nonfinancial corporation earnings outlook remain generally stable recent month,0
83,2020-01-29,volume agency non agency commercial mortgage backed securities issuance grew notably fourth quarter buoyed lower interest rates growth cre loans banks books picked period,volume agency non agency commercial mortgage back security issuance grow notably fourth quarter buoyed low interest rate growth cre loan bank book picked period,0
84,2020-01-29,financing conditions consumer credit markets remained supportive growth consumer spending although supply credit remained relatively tight nonprime borrowers,financing condition consumer credit market remain supportive growth consumer spending although supply credit remain relatively tight nonprime borrower,0
85,2020-01-29,growth credit card balances slowed fourth quarter and according january sloos commercial banks tightened standards credit card loans period,growth credit card balance slow fourth quarter and accord january sloos commercial bank tighten standard credit card loan period,0
86,2020-01-29,auto loan growth maintained solid pace recent months amid declining interest rates year end,auto loan growth maintain solid pace recent month amid decline interest rate year end,0
87,2020-01-29,staff provided update assessments potential risks financial stability,staff provide update assessment potential risk financial stability,0
88,2020-01-29,staff judged asset valuation pressures increased recent months elevated level,staff judged asset valuation pressure increase recent month elevate level,0
89,2020-01-29,assessing vulnerabilities stemming borrowing household business sectors staff noted that ratio household debt nominal gdp fairly low ratio business debt nominal gdp high historical standards,assess vulnerability stem borrowing household business sector staff note that ratio household debt nominal gdp fairly low ratio business debt nominal gdp high historical standard,0
90,2020-01-29,nonetheless staff noted banks announced intend allow capital ratios decline closer regulatory requirements medium term,nonetheless staff note bank announce intend allow capital ratio decline closer regulatory requirement medium term,0
91,2020-01-29,money market strains september raised questions vulnerabilities funding markets staff assessed core financial system remains resilient vulnerabilities maturity liquidity transformation,money market strain september raise question vulnerability funding market staff assess core financial system remains resilient vulnerability maturity liquidity transformation,0
92,2020-01-29,staff economic outlook projections real gdp growth prepared staff january fomc meeting stronger previous forecast,staff economic outlook projection real gdp growth prepared staff january fomc meeting strong previous forecast,0
93,2020-01-29,data pertaining fourth quarter  particularly imports suggested output rose faster end year previously projected faster pace seemed consistent solid employment gains fourth quarter,data pertain fourth quarter particularly import suggest output rise faster end year previously project faster pace seem consistent solid employment gain fourth quarter,0
94,2020-01-29,addition supportive financial conditions anticipated effects phase one trade deal united states china pushed staff gdp forecast year next,addition supportive financial condition anticipate effect phase one trade deal united state china push staff gdp forecast year next,0
95,2020-01-29,told real gdp growth projected   slow modestly coming years partly fading boost fiscal policy,told real gdp growth project slow modestly come year partly fading boost fiscal policy,0
96,2020-01-29,output forecast expand rate little staff estimate potential rate growth   slow pace slightly potential output growth ,output forecast expand rate little staff estimate potential rate growth slow pace slightly potential output growth,0
97,2020-01-29,unemployment rate projected decline little year remain lower level  unemployment rate anticipated staff estimate longer run natural rate throughout forecast period,unemployment rate project decline little year remain low level unemployment rate anticipate staff estimate longer run natural rate throughout forecast period,0
98,2020-01-29,staff forecasts total core pce price inflation  period essentially unrevised,staff forecast total core pce price inflation period essentially unrevised,0
99,2020-01-29,core inflation still projected step little  run bit  percent year next two years,core inflation still project step little run bit percent year next two year,0
100,2020-01-29,total pce price inflation projected little lower core inflation  projected decline consumer energy prices core inflation  ,total pce price inflation project little low core inflation project decline consumer energy price core inflation,0
101,2020-01-29,staff continued view uncertainty around projections real gdp growth unemployment rate inflation generally similar average past  years,staff continued view uncertainty around projection real gdp growth unemployment rate inflation generally similar average past year,0
102,2020-01-29,staff viewed downside risks economic activity diminished bit since previous forecast still judged risks forecast real gdp growth tilted downside corresponding skew upside unemployment rate,staff view downside risk economic activity diminish bit since previous forecast still judged risk forecast real gdp growth tilt downside correspond skew upside unemployment rate,0
103,2020-01-29,important factors influencing assessment foreign economic geopolitical developments still seemed likely move directions could significant negative effectss economy resolve favorably assumed,important factor influence assessment foreign economic geopolitical development still seem likely move direction could significant negative effects economy resolve favorably assume,0
104,2020-01-29,addition softness business investment manufacturing production last year well recent weakness imports seen pointing possibility substantial slowing economic growth staff projected,addition softness business investment manufacturing production last year well recent weakness import see point possibility substantial slow economic growth staff project,0
105,2020-01-29,risks inflation projection also viewed downward skew part downside risks forecast economic activity,risk inflation projection also view downward skew part downside risk forecast economic activity,0
106,2020-01-29,participants views current conditions economic outlook participants agreed labor market remained strong intermeeting period economic activity risen moderate rate,participant view current condition economic outlook participant agree labor market remain strong intermeeting period economic activity risen moderate rate,0
107,2020-01-29,job gains solid average recent months unemployment rate remained low,job gain solid average recent month unemployment rate remain low,0
108,2020-01-29,although household spending risen moderate pace business fixed investment exports remained weak,although household spending risen moderate pace business fix investment export remain weak,0
109,2020-01-29,month basis overall inflation inflation items food energy running  percent,month basis overall inflation inflation item food energy run percent,0
110,2020-01-29,market based measures inflation compensation remained low survey based measures longer term inflation expectations little changed,market base measure inflation compensation remain low survey base measure longer term inflation expectation little change,0
111,2020-01-29,participants generally judged current stance monetary policy appropriate support sustained expansion economic activity strong labor market conditions inflation returning committee symmetric  percent objective,participant generally judged current stance monetary policy appropriate support sustain expansion economic activity strong labor market condition inflation return committee symmetric percent objective,0
112,2020-01-29,expected economic growth continue moderate pace supported accommodative monetary financial conditions,expect economic growth continue moderate pace support accommodative monetary financial condition,0
113,2020-01-29,addition trade uncertainties diminished recently signs stabilization global growth,addition trade uncertainty diminish recently sign stabilization global growth,0
114,2020-01-29,nonetheless uncertainties outlook remained including posed outbreak coronavirus,nonetheless uncertainty outlook remain include pose outbreak coronavirus,0
115,2020-01-29,discussion household sector participants noted spending growth moderated fourth quarter,discussion household sector participant note spending growth moderate fourth quarter,0
116,2020-01-29,however generally expected that period ahead consumption spending would likely remain firm footing supported strong labor market conditions rising incomes healthy household balance sheets,however generally expect that period ahead consumption spending would likely remain firm footing support strong labor market condition rise income healthy household balance sheet,0
117,2020-01-29,looking ahead participants generally cautiously optimistic effects business sector recent favorable trade developments signs stabilization global growth,look ahead participant generally cautiously optimistic effect business sector recent favorable trade development sign stabilization global growth,0
118,2020-01-29,participants judged conditions labor market remained strong unemployment rate year low continued solid job gains average,participant judged condition labor market remain strong unemployment rate year low continued solid job gain average,0
119,2020-01-29,although upcoming annual benchmark revision expected reduce estimates recent payroll growth participants expected payroll employment expand healthy pace year,although upcoming annual benchmark revision expect reduce estimate recent payroll growth participant expect payroll employment expand healthy pace year,0
120,2020-01-29,business contacts many districts indicated continued strong labor demand several participants mentioning contacts reported difficulties finding qualified workers observed wage growth might currently understate degree tightness labor market,business contact many district indicate continued strong labor demand several participant mention contact report difficulty find qualify worker observe wage growth might currently understate degree tightness labor market,0
121,2020-01-29,however number participants indicated aggregate measures nominal wages continued rise moderate pace broadly line productivity growth rate inflation,however number participant indicate aggregate measure nominal wage continued rise moderate pace broadly line productivity growth rate inflation,0
122,2020-01-29,several participants commented potential reasons absence stronger broad based wage pressures including technological changes could substitute labor increased willingness employees forgo wage gains greater job stability adjustments nonwage portions compensation packages possibility labor market not tight historically low unemployment rate would suggest,several participant comment potential reason absence strong broad base wage pressure include technological change could substitute labor increase willingness employee forgo wage gain great job stability adjustment nonwage portion compensation package possibility labor market not tight historically low unemployment rate would suggest,0
123,2020-01-29,many participants pointed strong performance labor force participation despite downward pressures associated aging population several raised possibility room labor force participation rise further,many participant point strong performance labor force participation despite downward pressure associate age population several raise possibility room labor force participation rise far,0
124,2020-01-29,discussion inflation developments participants noted recent readings overall core pce price inflation measured  month basis continued run  percent,discussion inflation development participant note recent reading overall core pce price inflation measure month basis continued run percent,0
125,2020-01-29,overall participants described inflation outlook changed little since december,overall participant described inflation outlook change little since december,0
126,2020-01-29,participants generally expected inflation move closer  percent coming months unusually low readings early  drop  month calculation,participant generally expect inflation move closer percent come month unusually low reading early drop month calculation,0
127,2020-01-29,participants also expected that economic expansion continues resource utilization remains high inflation would return  percent objective sustainable basis,participant also expect that economic expansion continue resource utilization remains high inflation would return percent objective sustainable basis,0
128,2020-01-29,participants expressed less confidence outlook inflation commented inflation averaged less  percent past several years even resource utilization increased pointed downward pressures global technology related factors could continue suppress inflation,participant express less confidence outlook inflation comment inflation average less percent past several year even resource utilization increase point downward pressure global technology related factor could continue suppress inflation,0
129,2020-01-29,couple participants however noted alternative inflation indicators including trimmed mean measures suggested modest step underlying inflation  underlying inflation could already level consistent committee goal,couple participant however note alternative inflation indicator include trim mean measure suggest modest step underlie inflation underlie inflation could already level consistent committee goal,0
130,2020-01-29,participants generally saw distribution risks outlook economic activity somewhat favorable previous meeting although number downside risks remained prominent,participant generally saw distribution risk outlook economic activity somewhat favorable previous meeting although number downside risk remain prominent,0
131,2020-01-29,easing trade tensions resulting recent agreement china passage usmca well tentative signs stabilization global economic growth helped reduce downside risks appeared buoy business sentiment,ease trade tension result recent agreement china passage usmca well tentative sign stabilization global economic growth help reduce downside risk appear buoy business sentiment,0
132,2020-01-29,still participants generally expected trade related uncertainty remain somewhat elevated mindful possibility tentative signs stabilization global growth could fade,still participant generally expect trade related uncertainty remain somewhat elevate mindful possibility tentative sign stabilization global growth could fade,0
133,2020-01-29,threat coronavirus addition human toll emerged new risk global growth outlook participants agreed warranted close watching,threat coronavirus addition human toll emerge new risk global growth outlook participant agree warrant close watch,0
134,2020-01-29,discussion financial stability participants acknowledged staff report suggesting overall financial vulnerabilities remained moderate financial system remained resilient,discussion financial stability participant acknowledge staff report suggest overall financial vulnerability remain moderate financial system remain resilient,0
135,2020-01-29,participants expressed concern financial imbalancesincluding overvaluation excessive indebtednesscould amplify adverse shock economy current conditions low interest rates labor market tightness could increase risks financial stability cyber attacks could affects financial system,participant express concern financial imbalancesincluding overvaluation excessive indebtednesscould amplify adverse shock economy current condition low interest rate labor market tightness could increase risk financial stability cyber attack could affect financial system,0
136,2020-01-29,several participants noted planned increases dividend payouts large banks associated decline capital buffers might leave banks less capacity weather adverse shockswhich could negative implications economyor lower bank capital ratios could associated greater tail risks gdp growth,several participant note plan increase dividend payouts large bank associate decline capital buffer might leave bank less capacity weather adverse shockswhich could negative implication economyor low bank capital ratio could associate great tail risk gdp growth,0
137,2020-01-29,consideration monetary policy meeting participants judged would appropriate maintain target range federal funds rate     percent support sustained expansion economic activity strong labor market conditions inflation returning committee symmetric  percent objective,consideration monetary policy meeting participant judged would appropriate maintain target range federal fund rate percent support sustain expansion economic activity strong labor market condition inflation return committee symmetric percent objective,0
138,2020-01-29,regard monetary policy beyond meeting participants viewed current stance policy likely remain appropriate time provided incoming information economy remained broadly consistent economic outlook,regard monetary policy beyond meeting participant view current stance policy likely remain appropriate time provide incoming information economy remain broadly consistent economic outlook,0
139,2020-01-29,course developments emerged led material reassessment outlook adjustment stance monetary policy would appropriate order foster achievement committee dual mandate objectives,course development emerge lead material reassessment outlook adjustment stance monetary policy would appropriate order foster achievement committee dual mandate objective,0
140,2020-01-29,commenting monetary policy outlook participants concurred maintaining current stance policy would give committee time fuller assessment ongoing effects economic activity last year shift accommodative policy stance would also allow policymakers accumulate information bearing economic outlook,comment monetary policy outlook participant concur maintain current stance policy would give committee time fuller assessment ongoing effect economic activity last year shift accommodative policy stance would also allow policymakers accumulate information bearing economic outlook,0
141,2020-01-29,participants discussed maintaining current policy stance time could helpful supportings economic activity employment face global developments weighing spending decisions,participant discuss maintain current policy stance time could helpful supporting economic activity employment face global development weigh spending decision,0
142,2020-01-29,regard committee price stability objective participants observed current degree monetary policy accommodation would useful facilitating return inflation  percent,regard committee price stability objective participant observe current degree monetary policy accommodation would useful facilitate return inflation percent,0
143,2020-01-29,several participants noted inflation returning  percent would help ensure longer term inflation expectations remained consistent committee longer run inflation objective,several participant note inflation return percent would help ensure longer term inflation expectation remain consistent committee longer run inflation objective,0
144,2020-01-29,participants stressed committee explicit need achieve inflation goal sustained basis,participant stress committee explicit need achieve inflation goal sustain basis,0
145,2020-01-29,several participants suggested inflation modestly exceeding  percent period would consistent achievement committee longer run inflation objective mild overshooting might underscore symmetry objective,several participant suggest inflation modestly exceed percent period would consistent achievement committee longer run inflation objective mild overshoot might underscore symmetry objective,0
146,2020-01-29,regard committee maximum employment objective participants observed actual level employment might still maximum employment maintaining present monetary policy stance would allow economy achieve maximum level,regard committee maximum employment objective participant observe actual level employment might still maximum employment maintain present monetary policy stance would allow economy achieve maximum level,0
147,2020-01-29,couple participants expressed concern tight labor markets past associated economic financial imbalances emergence imbalances might jeopardize longer run attainment committee dual mandate goals,couple participant express concern tight labor market past associate economic financial imbalance emergence imbalance might jeopardize longer run attainment committee dual mandate goal,0
148,2020-01-29,beyond point regular open market operations would required time order accommodate trend growth federal reserve liabilities maintain ample level reserves,beyond point regular open market operation would require time order accommodate trend growth federal reserve liability maintain ample level reserve,0
149,2020-01-29,committee policy action discussion monetary policy meeting members noted information received since fomc met december indicated labor market remained strong economic activity rising moderate rate,committee policy action discussion monetary policy meeting member note information receive since fomc met december indicate labor market remain strong economic activity rise moderate rate,0
150,2020-01-29,job gains solid average recent months unemployment rate remained low,job gain solid average recent month unemployment rate remain low,0
151,2020-01-29,although household spending rising moderate pace business fixed investment exports remained weak,although household spending rise moderate pace business fix investment export remain weak,0
152,2020-01-29,month basis overall inflation inflation items food energy running  percent,month basis overall inflation inflation item food energy run percent,0
153,2020-01-29,market based measures inflation compensation remained low survey based measures longer term inflation expectations little changed,market base measure inflation compensation remain low survey base measure longer term inflation expectation little change,0
154,2020-01-29,members judged current stance monetary policy appropriate support sustained expansion economic activity strong labor market conditions inflation returning committee symmetric  percent objective,member judged current stance monetary policy appropriate support sustain expansion economic activity strong labor market condition inflation return committee symmetric percent objective,0
155,2020-01-29,members also agreed that determining timing size future adjustments target range federal funds rate committee would assess realized expected economic conditions relative maximum employment objective symmetric  percent inflation objective,member also agree that determine timing size future adjustment target range federal fund rate committee would ass realize expect economic condition relative maximum employment objective symmetric percent inflation objective,0
156,2020-01-29,concurred assessment would take account wide range information including measures labor market conditions indicators inflation pressures inflation expectations readings financial international developments,concur assessment would take account wide range information include measure labor market condition indicator inflation pressure inflation expectation reading financial international development,0
