,Date,Original,Corpus,Class
103,2002-08-13,generally interest costs declined borrowers acceptable credit ratings overall condition banking system remained sound bank credit widely available,generally interest cost decline borrower acceptable credit rating overall condition banking system remain sound bank credit widely available,0
104,2002-08-13,moreover many households negative wealth effects stemming losses equities offset least extent continuing increases home equity values,moreover many household negative wealth effect stem loss equity offset least extent continue increase home equity value,0
105,2002-08-13,ongoing factors suggested members effects financial restraints economic activity might fairly limited point,ongoing factor suggest member effect financial restraint economic activity might fairly limited point,0
106,2002-08-13,review demand prospects key sectors economy members noted household spending continuing play key role sustaining expansion,review demand prospect key sector economy member note household spending continue play key role sustain expansion,0
107,2002-08-13,retail sales buttressed strength motor vehicles well maintained recent months despite survey evidence declining consumer confidence,retail sale buttress strength motor vehicle well maintain recent month despite survey evidence decline consumer confidence,0
108,2002-08-13,extraction funds increases home equity evidently remained important source financing household expenditures especially including outlays home modernization,extraction fund increase home equity evidently remain important source financing household expenditure especially include outlay home modernization,0
109,2002-08-13,looking ahead anticipated pickup employment related gains incomes undergirded continued robust growth structural productivity seen supporting expansion consumer spending,look ahead anticipate pickup employment related gain income undergirded continued robust growth structural productivity see support expansion consumer spending,0
110,2002-08-13,members commented however declines equity wealth possible persistence turmoil equity markets might continue restrain pickup consumer expenditures months ahead,member comment however decline equity wealth possible persistence turmoil equity market might continue restrain pickup consumer expenditure month ahead,0
111,2002-08-13,housing sector low mortgage interest rates remained key factor sustaining homebuilding activity relatively elevated level,housing sector low mortgage interest rate remain key factor sustain homebuilding activity relatively elevate level,0
112,2002-08-13,housing markets continued exhibit strength across much country indications moderation except sales high priced homes,housing market continued exhibit strength across much country indication moderation except sale high price home,0
113,2002-08-13,noted that absence unanticipated downturn general economic activity underlying pressures housing population expanded coupled scarcity viable homebuilding sites urban areas likely would preclude substantial decline housing activity housing prices foreseeable future,note that absence unanticipated downturn general economic activity underlie pressure housing population expand couple scarcity viable homebuilding site urban area likely would preclude substantial decline housing activity housing price foreseeable future,0
114,2002-08-13,weakness business fixed investment still depressant overall economic activity though decline business outlays abated since latter part  indeed spending equipment software edged second quarter,weakness business fix investment still depressant overall economic activity though decline business outlay abate since latter part indeed spending equipment software edge second quarter,0
115,2002-08-13,excess stocks capital inventories seemingly worked acceptable levels many industries expansion final sales expected become firmly established acceleration spending equipment software likely store,excess stock capital inventory seemingly work acceptable level many industry expansion final sale expect become firmly establish acceleration spending equipment software likely store,0
116,2002-08-13,earlier meetings however members observed business sentiment remained extraordinarily cautious whole business firms industries continued direct investment spending primarily toward enhancing productivity operations rather also increasing capacity,earlier meeting however member observe business sentiment remain extraordinarily cautious whole business firm industry continued direct investment spending primarily toward enhance productivity operation rather also increase capacity,0
117,2002-08-13,exceptions cited members included enlargement production facilities firms industries currently enjoying vigorous demand producers motor vehicles,exception cite member include enlargement production facility firm industry currently enjoy vigorous demand producer motor vehicle,0
118,2002-08-13,soon gloom surrounding outlook pickup sales profits associated concerns financial markets would dissipate subject substantial uncertainty increasing needs capital economy continued expand growth investment opportunities conjunction uptrend structural productivity temporary tax incentive provision equipment software likely would support sustained recovery investment expenditures coming quarters would provide essential impetus lifting economic growth,soon gloom surround outlook pickup sale profit associate concern financial market would dissipate subject substantial uncertainty increase need capital economy continued expand growth investment opportunity conjunction uptrend structural productivity temporary tax incentive provision equipment software likely would support sustain recovery investment expenditure come quarter would provide essential impetus lift economic growth,0
119,2002-08-13,prospects upturn nonresidential construction appeared many bleak,prospect upturn nonresidential construction appear many bleak,0
120,2002-08-13,reports around nation pointed high many areas still rising vacancy rates commercial industrial space hotel construction continued held problems afflicting travel industry,report around nation point high many area still rise vacancy rate commercial industrial space hotel construction continued held problem afflict travel industry,0
121,2002-08-13,backdrop overall nonresidential building activity seemed likely decline next several quarters,backdrop overall nonresidential building activity seem likely decline next several quarter,0
122,2002-08-13,business inventories edged second quarter declining persistently since early ,business inventory edge second quarter decline persistently since early,0
123,2002-08-13,indeed strengthening sufficient account small advance gdp latest quarter,indeed strengthen sufficient account small advance gdp late quarter,0
124,2002-08-13,inventories apparently close desired levels many sectors economy reportedly levels retailers expected strengthening final sales would probably foster inventory accumulation coming quarters thereby adding impetus projected growth economy,inventory apparently close desire level many sector economy reportedly level retailer expect strengthen final sale would probably foster inventory accumulation come quarter thereby add impetus project growth economy,0
125,2002-08-13,government spending also expected provide ongoing stimulus expansion especially given prospects spending initiatives forthcoming federal legislation,government spending also expect provide ongoing stimulus expansion especially give prospect spending initiative forthcoming federal legislation,0
126,2002-08-13,addition already enacted income tax cuts tax expensing provision certain investment outlays would help support consumer business expenditures,addition already enact income tax cut tax expense provision certain investment outlay would help support consumer business expenditure,0
127,2002-08-13,concurrently though state local governments facing large shortfalls revenues sluggish economy holding overall growth expenditures,concurrently though state local government face large shortfall revenue sluggish economy hold overall growth expenditure,0
128,2002-08-13,anecdotal reports suggested however sizable spending variety construction projects continuing financed part bond issues,anecdotal report suggest however sizable spending variety construction project continue finance part bond issue,0
129,2002-08-13,balance government sector expected remain positive factor economic recovery,balance government sector expect remain positive factor economic recovery,0
130,2002-08-13,depreciation dollar overall strengthening foreign economic activity projected foster moderate added growths exports next several quarters,depreciation dollar overall strengthen foreign economic activity project foster moderate add growth export next several quarter,0
131,2002-08-13,however recent developments including indications weaker projected economic recovery europe growing questions outlook several important economies south america continued sluggish performance japanese economy threatened limit improvement exports least nearer term,however recent development include indication weaker project economic recovery europe grow question outlook several important economy south america continued sluggish performance japanese economy threaten limit improvement export least nearer term,0
132,2002-08-13,providing partial counterweight anecdotal reports indicating sizable growths exports number asian countries,provide partial counterweight anecdotal report indicate sizable growth export number asian country,0
133,2002-08-13,outlook inflation remained favorable context continuing slack labor markets robust growth structural productivity,outlook inflation remain favorable context continue slack labor market robust growth structural productivity,0
134,2002-08-13,conditions increases trend unit labor costs likely remain subdued next several quarters despite likely escalation cost worker healthcare benefits,condition increase trend unit labor cost likely remain subdue next several quarter despite likely escalation cost worker healthcare benefit,0
135,2002-08-13,indeed risks significant run inflation appeared receded time anticipated earlier likely elapse expansion reached pace would begin reduce margins underutilized labor producer resources,indeed risk significant run inflation appear recede time anticipate earlier likely elapse expansion reach pace would begin reduce margin underutilized labor producer resource,0
136,2002-08-13,even so examples rising cost price pressures not entirely absent,even so example rise cost price pressure not entirely absent,0
137,2002-08-13,addition healthcare insurance costs pressures included insurance costs generally steel prices materials costs and association dollar depreciation upward pressures import prices,addition healthcare insurance cost pressure include insurance cost generally steel price material cost and association dollar depreciation upward pressure import price,0
138,2002-08-13,balance barring major supply shock economy members saw little reason concern prospect increase inflation foreseeable future,balance bar major supply shock economy member saw little reason concern prospect increase inflation foreseeable future,0
139,2002-08-13,committee discussion policy intermeeting period ahead members favor unchanged policy stance consistent retaining target rate   percent federal funds rate,committee discussion policy intermeeting period ahead member favor unchanged policy stance consistent retain target rate percent federal fund rate,0
140,2002-08-13,although economic financial indicators deteriorated since june meeting members generally scaled economic forecasts continued see favorable prospects strengthening economy time,although economic financial indicator deteriorate since june meeting member generally scale economic forecast continued see favorable prospect strengthen economy time,0
141,2002-08-13,sure significant weakening economic prospects example might associated additional deterioration financial markets might well call policy response members viewed current degree monetary accommodation appropriately calibrated provide stimulus needed foster solid expansion would bring economy fuller resource utilization,sure significant weaken economic prospect example might associate additional deterioration financial market might well call policy response member view current degree monetary accommodation appropriately calibrate provide stimulus need foster solid expansion would bring economy fuller resource utilization,0
142,2002-08-13,members indicated could accept said preferred proposal shift committee assessment risks economy currently neutral statement one tilted toward weakness foreseeable future,member indicate could accept say prefer proposal shift committee assessment risk economy currently neutral statement one tilt toward weakness foreseeable future,0
143,2002-08-13,expressed preference retain current balanced risks statement press release issued shortly meeting,express preference retain current balance risk statement press release issue shortly meeting,0
144,2002-08-13,support view underscored considerable uncertainty surrounding outlook financial economic conditions prospect many observers financial markets could misread shift committee assessment risks outlook signal committee contemplating easing near term,support view underscored considerable uncertainty surround outlook financial economic condition prospect many observer financial market could misread shift committee assessment risk outlook signal committee contemplate ease near term,0
145,2002-08-13,members agreed however desirability communicating form whether text post meeting press release shift risks statement view expansion recently less robust expected foreseeable future risks extended period subpar growth increased inflation declined,member agree however desirability communicate form whether text post meeting press release shift risk statement view expansion recently less robust expect foreseeable future risk extend period subpar growth increase inflation decline,0
146,2002-08-13,several also commented shift consideration might raise expectations easing coming months expectations related market adjustments would shaped principally tenor incoming economic information,several also comment shift consideration might raise expectation ease come month expectation related market adjustment would shape principally tenor incoming economic information,0
147,2002-08-13,conclusion discussion committee voted authorize direct federal reserve bank new york instructed otherwise execute transactions system account accordance following domestic policy directive,conclusion discussion committee vote authorize direct federal reserve bank new york instruct otherwise execute transaction system account accordance follow domestic policy directive,0
148,2002-08-13,federal open market committee seeks monetary financial conditions foster price stability promote sustainable growth output,federal open market committee seek monetary financial condition foster price stability promote sustainable growth output,0
149,2002-08-13,long run objectives committee immediate future seeks conditions reserve markets consistent maintaining federal funds rate average around   percent,long run objective committee immediate future seek condition reserve market consistent maintain federal fund rate average around percent,0
150,2002-08-13,vote encompassed approval sentence inclusion press statement released shortly meeting,vote encompass approval sentence inclusion press statement release shortly meeting,0
151,2002-08-13,background long run goals price stability sustainable economic growth information currently available committee believes risks weighted mainly toward conditions may generate economic weakness foreseeable future,background long run goal price stability sustainable economic growth information currently available committee believe risk weight mainly toward condition may generate economic weakness foreseeable future,0
152,2002-08-13,votes action messrs,vote action messrs,0
153,2002-08-13,greenspan mcdonough bernanke ms bies messrs,greenspan mcdonough bernanke m bies messrs,0
154,2002-08-13,ferguson gramlich jordan kohn mcteer olson santomero stern,ferguson gramlich jordan kohn mcteer olson santomero stern,0
155,2002-08-13,votes action none,vote action none,0
156,2002-08-13,agreed next meeting committee would held tuesday september  ,agree next meeting committee would held tuesday september,0
157,2002-08-13,meeting adjourned,meeting adjourn,0
158,2002-08-13,vincent reinhart secretary,vincent reinhart secretary,0
