,Date,Original,Corpus,Class
0,2002-08-13,meeting federal open market committee held offices board governors federal reserve system washington dc tuesday august   m,meeting federal open market committee held office board governor federal reserve system washington dc tuesday august m,0
1,2002-08-13,present mr greenspan chairman mr mcdonough vice chairman mr bernanke ms bies mr ferguson mr gramlich mr jordan mr kohn mr mcteer mr olson mr santomero mr stern,present mr greenspan chairman mr mcdonough vice chairman mr bernanke m bies mr ferguson mr gramlich mr jordan mr kohn mr mcteer mr olson mr santomero mr stern,0
2,2002-08-13,messrs,messrs,0
3,2002-08-13,broaddus guynn moskow parry alternate members federal open market committee,broaddus guynn moskow parry alternate member federal open market committee,0
4,2002-08-13,mr hoenig ms minehan mr poole presidents federal reserve banks kansas city boston st louis respectively,mr hoenig m minehan mr poole president federal reserve bank kansa city boston st louis respectively,0
5,2002-08-13,mr reinhart secretary economist mr bernard deputy secretary mr gillum assistant secretary ms smith assistant secretary mr mattingly general counsel ms johnson economist mr stockton economist,mr reinhart secretary economist mr bernard deputy secretary mr gillum assistant secretary m smith assistant secretary mr mattingly general counsel m johnson economist mr stockton economist,0
6,2002-08-13,mr connors ms cumming messrs,mr connors m cumming messrs,0
7,2002-08-13,howard lindsey ms mester messrs,howard lindsey m mester messrs,0
8,2002-08-13,oliner rolnick wilcox associate economists,oliner rolnick wilcox associate economist,0
9,2002-08-13,mr kos manager system open market account,mr ko manager system open market account,0
10,2002-08-13,mr winn assistant board office board members board governors,mr winn assistant board office board member board governor,0
11,2002-08-13,messrs,messrs,0
12,2002-08-13,ettin madigan deputy directors divisions research statistics monetary affairs respectively board governors,ettin madigan deputy director division research statistic monetary affair respectively board governor,0
13,2002-08-13,messrs,messrs,0
14,2002-08-13,slifman struckmeyer associate directors divisions research statistics board governors,slifman struckmeyer associate director division research statistic board governor,0
15,2002-08-13,mr whitesell deputy associate director division monetary affairs board governors,mr whitesell deputy associate director division monetary affair board governor,0
16,2002-08-13,mr clouse assistant director division monetary affairs board governors,mr clouse assistant director division monetary affair board governor,0
17,2002-08-13,mr simpson senior advisor division research statistics board governors,mr simpson senior advisor division research statistic board governor,0
18,2002-08-13,mr skidmore special assistant board office board members board governors,mr skidmore special assistant board office board member board governor,0
19,2002-08-13,ms low open market secretariat assistant office board members board governors,m low open market secretariat assistant office board member board governor,0
20,2002-08-13,messrs,messrs,0
21,2002-08-13,connolly stewart first vice presidents federal reserve banks boston new york,connolly stewart first vice president federal reserve bank boston new york,0
22,2002-08-13,messrs,messrs,0
23,2002-08-13,goodfriend hakkio hunter rasche senior vice presidents federal reserve banks richmond kansas city chicago st louis respectively,goodfriend hakkio hunter rasche senior vice president federal reserve bank richmond kansa city chicago st louis respectively,0
24,2002-08-13,messrs,messrs,0
25,2002-08-13,bryan cox cunningham ms hargraves messrs,bryan cox cunningham m hargraves messrs,0
26,2002-08-13,rudebusch tootell vice presidents federal reserve banks cleveland dallas atlanta new york san francisco boston respectively,rudebusch tootell vice president federal reserve bank cleveland dallas atlanta new york san francisco boston respectively,0
27,2002-08-13,unanimous vote minutes meeting federal open market committee held june    approved,unanimous vote minute meeting federal open market committee held june approve,0
28,2002-08-13,unanimous vote vincent reinhart elected secretary economist committee period first regularly scheduled meeting ,unanimous vote vincent reinhart elect secretary economist committee period first regularly schedule meeting,0
29,2002-08-13,manager system open market account reported recent developments foreign exchange markets,manager system open market account report recent development foreign exchange market,0
30,2002-08-13,no open market operations foreign currencies system account period since previous meeting,no open market operation foreign currency system account period since previous meeting,0
31,2002-08-13,manager also reported developments domestic financial markets system open market transactions government securities securities issued fully guaranteed federal agencies period june   august  ,manager also report development domestic financial market system open market transaction government security security issue fully guaranteed federal agency period june august,0
32,2002-08-13,unanimous vote committee ratified transactions,unanimous vote committee ratify transaction,0
33,2002-08-13,committee turned discussion economic financial outlook conduct monetary policy intermeeting period ahead,committee turn discussion economic financial outlook conduct monetary policy intermeeting period ahead,0
34,2002-08-13,information reviewed meeting indicated economic activity expanded slightly second quarter,information review meeting indicate economic activity expand slightly second quarter,0
35,2002-08-13,businesses added bit inventory positions extended period sizable declines final sales changed little business capital spending weakened somewhat growth consumer spending residential housing expenditures government outlays slowed,business add bit inventory position extend period sizable decline final sale change little business capital spending weaken somewhat growth consumer spending residential housing expenditure government outlay slow,0
36,2002-08-13,scant information available third quarter principally july strong motor vehicle sales suggested domestic demand still recovering relatively sluggishly,scant information available third quarter principally july strong motor vehicle sale suggest domestic demand still recover relatively sluggishly,0
37,2002-08-13,industrial production continued advance since first quarter demand labor services increased slightly unemployment rate risen,industrial production continued advance since first quarter demand labor service increase slightly unemployment rate risen,0
38,2002-08-13,importantly labor productivity continued strong upward trend,importantly labor productivity continued strong upward trend,0
39,2002-08-13,overall price inflation fallen sharply past year largely reflecting developments food energy sectors core inflation eased little,overall price inflation fall sharply past year largely reflect development food energy sector core inflation ease little,0
40,2002-08-13,private nonfarm payroll employment inched july mild increase june though aggregate hours worked production nonsupervisory workers declined steeply,private nonfarm payroll employment inched july mild increase june though aggregate hour work production nonsupervisory worker decline steeply,0
41,2002-08-13,help supply portion services sector construction industry recorded substantial net job losses june july period manufacturing registered smallest payroll decline two years july hiring relatively brisk services help supply,help supply portion service sector construction industry record substantial net job loss june july period manufacturing register small payroll decline two year july hire relatively brisk service help supply,0
42,2002-08-13,civilian unemployment rate edged june ,civilian unemployment rate edge june,0
43,2002-08-13, percent unchanged july,percent unchanged july,0
44,2002-08-13,industrial production jumped june gains output widespread across market groups industries,industrial production jumped june gain output widespread across market group industry,0
45,2002-08-13,however limited available information indicated output leveled july six consecutive months increases,however limited available information indicate output level july six consecutive month increase,0
46,2002-08-13,capacity utilization manufacturing moved little higher june remained substantially long run average,capacity utilization manufacturing move little high june remain substantially long run average,0
47,2002-08-13,retail sales relatively brisk june july despite plunging equity prices apparently marked erosion consumer confidence,retail sale relatively brisk june july despite plunge equity price apparently marked erosion consumer confidence,0
48,2002-08-13,households spent heavily motor vehicles response incentives offered auto manufacturers expenditures retail categories generally well maintained,household spent heavily motor vehicle response incentive offer auto manufacturer expenditure retail category generally well maintain,0
49,2002-08-13,residential housing activity remained strong second quarter buoyed favorable mortgage financing environment,residential housing activity remain strong second quarter buoyed favorable mortgage financing environment,0
50,2002-08-13,pace homebuilding quarter continued well seen past years even though single family housing starts june not reach elevated may level,pace homebuilding quarter continued well see past year even though single family housing start june not reach elevate may level,0
51,2002-08-13,sales new single family homes june remained record high sales existing homes declined noticeably,sale new single family home june remain record high sale exist home decline noticeably,0
52,2002-08-13,multifamily sector june starts lower end range recent quarters,multifamily sector june start low end range recent quarter,0
53,2002-08-13,market conditions condominium cooperative apartment portion housing sector appeared favorable rising vacancy rates weaker rents apparently hindered rental apartment segment,market condition condominium cooperative apartment portion housing sector appear favorable rise vacancy rate weaker rent apparently hinder rental apartment segment,0
54,2002-08-13,business investment equipment structures declined second quarter continuing downdraft nonresidential construction offset pickup business spending durable equipment software,business investment equipment structure decline second quarter continue downdraft nonresidential construction offset pickup business spending durable equipment software,0
55,2002-08-13,despite gradually improving fundamentals rising output profits new tax incentives low cost capital firms remained cautious stepping investments equipment software recent data orders shipments nondefense capital goods coupled anecdotal reports suggested lackluster gains spending coming months,despite gradually improve fundamental rise output profit new tax incentive low cost capital firm remain cautious step investment equipment software recent data order shipment nondefense capital good couple anecdotal report suggest lackluster gain spending come month,0
56,2002-08-13,nonresidential construction sector outlays office industrial structures lodging facilities public utilities declined substantially further,nonresidential construction sector outlay office industrial structure lodge facility public utility decline substantially far,0
57,2002-08-13,contrast construction institutional structures second quarter,contrast construction institutional structure second quarter,0
58,2002-08-13,nonfarm inventory investment turned slightly positive second quarter several quarters heavy liquidation,nonfarm inventory investment turn slightly positive second quarter several quarter heavy liquidation,0
59,2002-08-13,success pruning inventories resulted inventory sales ratios generally low levels across manufacturing wholesale retail sectors,success prune inventory result inventory sale ratio generally low level across manufacturing wholesale retail sector,0
60,2002-08-13,appeared industries still sizable inventory overhangs,appear industry still sizable inventory overhang,0
61,2002-08-13,us trade deficit goods services widened may april may period,u trade deficit good service widen may april may period,0
62,2002-08-13,expansion deficit two months reflected sharp rise value imports exceeded sizable gain value exports,expansion deficit two month reflect sharp rise value import exceed sizable gain value export,0
63,2002-08-13,step imports spread widely across almost major trade categories notable increases motor vehicles consumer goods machinery,step import spread widely across almost major trade category notable increase motor vehicle consumer good machinery,0
64,2002-08-13,advance exports primarily automotive parts industrial supplies capital equipment,advance export primarily automotive part industrial supply capital equipment,0
65,2002-08-13,regard economic activity abroad available information released many cases considerable lag indicated foreign economic output generally continued rebound first half year though pace recovery uneven across regions countries,regard economic activity abroad available information release many case considerable lag indicate foreign economic output generally continued rebound first half year though pace recovery uneven across region country,0
66,2002-08-13,growth strong canada united kingdom emerging asia expansion euro area japan remained sluggish owing continued weakness final domestic demand,growth strong canada united kingdom emerge asia expansion euro area japan remain sluggish owe continued weakness final domestic demand,0
67,2002-08-13,south america economic financial conditions deteriorated significantly intermeeting period especially brazil uruguay economic activity remained particularly weak argentina venezuela,south america economic financial condition deteriorate significantly intermeeting period especially brazil uruguay economic activity remain particularly weak argentina venezuela,0
68,2002-08-13,consumer price inflation trended past year,consumer price inflation trend past year,0
69,2002-08-13,much drop reflected developments food energy sectors core inflation also eased little,much drop reflect development food energy sector core inflation also ease little,0
70,2002-08-13,may june consumer price chain weighted personal consumption indexes exhibited little change total core prices,may june consumer price chain weight personal consumption index exhibit little change total core price,0
71,2002-08-13,moreover producer level inflation core finished goods low rate may june period past twelve months,moreover producer level inflation core finish good low rate may june period past twelve month,0
72,2002-08-13,regard labor costs employment cost index hourly compensation private industry workers increased somewhat faster rate three months ended june reflecting surge benefit costs,regard labor cost employment cost index hourly compensation private industry worker increase somewhat faster rate three month end june reflect surge benefit cost,0
73,2002-08-13,somewhat longer perspective however growth compensation costs twelve months ended june previous twelve month period,somewhat longer perspective however growth compensation cost twelve month end june previous twelve month period,0
74,2002-08-13,meeting june    committee adopted directive called maintaining conditions reserve markets consistent keeping intended level federal funds rate   percent also retained neutral balance risks statement,meeting june committee adopt directive call maintain condition reserve market consistent keep intend level federal fund rate percent also retain neutral balance risk statement,0
75,2002-08-13,little market reaction committee rate decision statement,little market reaction committee rate decision statement,0
76,2002-08-13,instead market participants focused attention revelations corporate malfeasance fears earnings restatements would announced run august  deadline certifying corporate financial statements concerns second half corporate earnings might prove disappointing,instead market participant focus attention revelation corporate malfeasance fear earnings restatement would announce run august deadline certify corporate financial statement concern second half corporate earnings might prove disappoint,0
77,2002-08-13,environment equity prices plunged recovering somewhat later intermeeting period net major broad equity indexes substantially,environment equity price plunge recover somewhat later intermeeting period net major broad equity index substantially,0
78,2002-08-13,yields treasury securities also fell markedly balance volatile trading investors sought safe funds trimmed expectations path intended federal funds rate coming quarters,yield treasury security also fell markedly balance volatile trading investor sought safe fund trim expectation path intend federal fund rate come quarter,0
79,2002-08-13,however doubts corporate balance sheets prospects earnings growth led steep increases corporate debt yields particularly lower quality issues,however doubt corporate balance sheet prospect earnings growth lead steep increase corporate debt yield particularly low quality issue,0
80,2002-08-13,foreign exchange markets trade weighted value dollar changed little balance terms major foreign currencies intermeeting period though early period dollar declined sharply currencies amid disclosuress corporate accounting irregularities concerns strengths recovery,foreign exchange market trade weight value dollar change little balance term major foreign currency intermeeting period though early period dollar decline sharply currency amid disclosure corporate accounting irregularity concern strength recovery,0
81,2002-08-13,background similar combination disappointing concerns european stock prices dropped united states japanese equity prices declined less incoming data seemed point mild pickup economic activity japan,background similar combination disappoint concern european stock price drop united state japanese equity price decline less incoming data seem point mild pickup economic activity japan,0
82,2002-08-13,across major industrial economies investors tended shift funds toward less risky instruments lower expectations policy rates,across major industrial economy investor tend shift fund toward less risky instrument low expectation policy rate,0
83,2002-08-13,dollar also little changed balance index currencies important trading partners even though several south american countries experiencing difficult financial political problems,dollar also little change balance index currency important trading partner even though several south american country experience difficult financial political problem,0
84,2002-08-13,borrowing domestic nonfinancial businesses weak recently likely reflecting deteriorating conditions credit markets reduced requirements funds finance capital spending projects,borrowing domestic nonfinancial business weak recently likely reflect deteriorate condition credit market reduce requirement fund finance capital spending project,0
85,2002-08-13,growth surged july association large inflows liquid deposits retail money market funds,growth surge july association large inflow liquid deposit retail money market fund,0
86,2002-08-13,staff forecast prepared meeting suggested that light weaker expected incoming economic data expansion economic activity would pick gradually next year half sluggish pace second quarter,staff forecast prepared meeting suggest that light weaker expect incoming economic data expansion economic activity would pick gradually next year half sluggish pace second quarter,0
87,2002-08-13,considerable monetary ease fiscal stimulus already place continuing sizable gains structural productivity would provide significant impetus spending though persisting volatility weakness equity prices would tend offset support,considerable monetary ease fiscal stimulus already place continue sizable gain structural productivity would provide significant impetus spending though persist volatility weakness equity price would tend offset support,0
88,2002-08-13,inventory overhangs appeared largely eliminated business capital stocks moved closer desired levels,inventory overhang appear largely eliminate business capital stock move closer desire level,0
89,2002-08-13,consequence gradually improving outlook sales profits low financing costs temporary federal tax incentive investment new equipment software expected boost business investment spending,consequence gradually improve outlook sale profit low financing cost temporary federal tax incentive investment new equipment software expect boost business investment spending,0
90,2002-08-13,however less robust pickup final sales expected forecast period would put somewhat less pressure resource margins anticipated previously level activity would remain economy potential somewhat longer time,however less robust pickup final sale expect forecast period would put somewhat less pressure resource margin anticipate previously level activity would remain economy potential somewhat longer time,0
91,2002-08-13,persistence underutilized resources expected foster moderation core price inflation,persistence underutilized resource expect foster moderation core price inflation,0
92,2002-08-13,committee discussion current prospective economic developments members commented much incoming information economic activity disappointing many indicated marked growth forecasts months ahead,committee discussion current prospective economic development member comment much incoming information economic activity disappoint many indicate marked growth forecast month ahead,0
93,2002-08-13,even so recent weakness concentrated volatile high frequency data might well prove transitory business consumer confidence unlikely deteriorate absence major shock economy members continued place favorable odds underlying outlook strengthening expansion,even so recent weakness concentrate volatile high frequency data might well prove transitory business consumer confidence unlikely deteriorate absence major shock economy member continued place favorable odds underlie outlook strengthen expansion,0
94,2002-08-13,factors cited positive outlook included stimulative stances fiscal monetary policy apparent completion industries efforts bring inventories capital facilities desired alignment expected sales support consumer incomes business incentives provided continued rise structural productivity,factor cite positive outlook include stimulative stance fiscal monetary policy apparent completion industry effort bring inventory capital facility desire alignment expect sale support consumer income business incentive provide continued rise structural productivity,0
95,2002-08-13,gains productivity prospect relatively contained demand pressures resources likely somewhat limited time members anticipated earlier would contribute keeping price inflation subdued,gain productivity prospect relatively contain demand pressure resource likely somewhat limited time member anticipate earlier would contribute keep price inflation subdue,0
96,2002-08-13,number members commented financial developments appeared holding back pace expansion,number member comment financial development appear hold back pace expansion,0
97,2002-08-13,prices equity markets turned recent lows cumulative losses financial wealth incurred since early  clearly adverse impact expenditures households higher cost equity capital inhibiting business investment,price equity market turn recent low cumulative loss financial wealth incur since early clearly adverse impact expenditure household high cost equity capital inhibit business investment,0
98,2002-08-13,declines equity prices accompanied heightened degree risk aversion led widened credit spreads financial markets curtailment credit availability potential borrowers whose repayment prospects viewed questionable,decline equity price accompany heighten degree risk aversion lead widen credit spread financial market curtailment credit availability potential borrower whose repayment prospect view questionable,0
99,2002-08-13,extent difficult determine current skittishness debt equity markets reflected lender investor reactions ongoing revelations corporate governance failures,extent difficult determine current skittishness debt equity market reflect lender investor reaction ongoing revelation corporate governance failure,0
100,2002-08-13,reactions proving severe probably would longer lasting many anticipated appeared contributing cautious business spending hiring least temporarily,reaction prove severe probably would longer last many anticipate appear contribute cautious business spending hire least temporarily,0
101,2002-08-13,unclear associated uncertainties would diminish confidence would begin rebuild though outlook might come better focus mid august sec deadline certification financial statements corporate executives,unclear associate uncertainty would diminish confidence would begin rebuild though outlook might come well focus mid august sec deadline certification financial statement corporate executive,0
102,2002-08-13,positive side home mortgage financing remained widely available low interest rates providing important support household spending,positive side home mortgage financing remain widely available low interest rate provide important support household spending,0
