,Date,Original,Corpus,Class
0,2005-12-13,meeting federal open market committee held offices board governors federal reserve system washington dc tuesday december   m,meeting federal open market committee held office board governor federal reserve system washington dc tuesday december m,0
1,2005-12-13,ms cumming messrs,m cumming messrs,0
2,2005-12-13,guynn lacker mses,guynn lacker ms,0
3,2005-12-13,pianalto yellen alternate members federal open market committee,pianalto yellen alternate member federal open market committee,0
4,2005-12-13,mr hoenig ms minehan mr poole presidents federal reserve banks kansas city boston st louis respectively,mr hoenig m minehan mr poole president federal reserve bank kansa city boston st louis respectively,0
5,2005-12-13,mr reinhart secretary economist ms danker deputy secretary ms smith assistant secretary mr alvarez general counsel mr baxter deputy general counsel ms johnson economist mr stockton economist messrs,mr reinhart secretary economist m danker deputy secretary m smith assistant secretary mr alvarez general counsel mr baxter deputy general counsel m johnson economist mr stockton economist messrs,0
6,2005-12-13,connors freeman madigan ms mester messrs,connors freeman madigan m mester messrs,0
7,2005-12-13,oliner rosenblum tracy wilcox associate economists,oliner rosenblum tracy wilcox associate economist,0
8,2005-12-13,mr kos manager system open market account,mr ko manager system open market account,0
9,2005-12-13,messrs,messrs,0
10,2005-12-13,slifman struckmeyer associate directors division research statistics board governors,slifman struckmeyer associate director division research statistic board governor,0
11,2005-12-13,mr whitesell deputy associate director division monetary affairs board governors,mr whitesell deputy associate director division monetary affair board governor,0
12,2005-12-13,messrs,messrs,0
13,2005-12-13,english sheets assistant directors divisions monetary affairs international finance respectively board governors,english sheet assistant director division monetary affair international finance respectively board governor,0
14,2005-12-13,mr simpson senior adviser division research statistics board governors,mr simpson senior adviser division research statistic board governor,0
15,2005-12-13,mr skidmore special assistant board office board members board governors mr small project manager division monetary affairs board governors,mr skidmore special assistant board office board member board governor mr small project manager division monetary affair board governor,0
16,2005-12-13,mr zakrajsek section chief division monetary affairs board governors,mr zakrajsek section chief division monetary affair board governor,0
17,2005-12-13,mr kumasaka senior financial analyst division monetary affairs board governors,mr kumasaka senior financial analyst division monetary affair board governor,0
18,2005-12-13,ms low open market secretariat specialist division monetary affairs board governors,m low open market secretariat specialist division monetary affair board governor,0
19,2005-12-13,mr barron first vice president federal reserve bank atlanta messrs,mr barron first vice president federal reserve bank atlanta messrs,0
20,2005-12-13,fuhrer hakkio rasche sniderman weinberg williams senior vice presidents federal reserve banks boston kansas city st louis cleveland richmond san francisco respectively,fuhrer hakkio rasche sniderman weinberg williams senior vice president federal reserve bank boston kansa city st louis cleveland richmond san francisco respectively,0
21,2005-12-13,mr cunningham ms mosser mr sullivan vice presidents federal reserve banks atlanta new york chicago respectively,mr cunningham m mosser mr sullivan vice president federal reserve bank atlanta new york chicago respectively,0
22,2005-12-13,mr weber senior research officer federal reserve bank minneapolis,mr weber senior research officer federal reserve bank minneapolis,0
23,2005-12-13,manager system open market account reported recent developments foreign exchange markets,manager system open market account report recent development foreign exchange market,0
24,2005-12-13,no open market operations foreign currencies system account period since previous meeting,no open market operation foreign currency system account period since previous meeting,0
25,2005-12-13,manager also reported developments domestic financial markets system open market transactions government securities federal agency obligations period since previous meeting,manager also report development domestic financial market system open market transaction government security federal agency obligation period since previous meeting,0
26,2005-12-13,unanimous vote committee ratified transactions,unanimous vote committee ratify transaction,0
27,2005-12-13,information reviewed meeting suggested economy continued expand solid rate fourth quarter,information review meeting suggest economy continued expand solid rate fourth quarter,0
28,2005-12-13,industrial production rebounded employment growth appeared recovered smartly depressing effects recent hurricanes,industrial production rebound employment growth appear recover smartly depress effect recent hurricane,0
29,2005-12-13,although scattered signs cooling housing sector emerged pace construction activity sales remained brisk,although scatter sign cool housing sector emerge pace construction activity sale remain brisk,0
30,2005-12-13,broadly spending consumers businesses well maintained,broadly spending consumer business well maintain,0
31,2005-12-13,core consumer price inflation remained subdued even though increase energy costs apparently passed prices final goods services,core consumer price inflation remain subdue even though increase energy cost apparently pass price final good service,0
32,2005-12-13,private nonfarm payrolls grew rapidly november small gain october,private nonfarm payroll grow rapidly november small gain october,0
33,2005-12-13,construction employment posted another large increase probably owing part hurricane related activity,construction employment post another large increase probably owe part hurricane related activity,0
34,2005-12-13,broad based gains durable goods industries augmented manufacturing employment employment related industries temporary help services wholesale trade increased well,broad base gain durable good industry augment manufacturing employment employment related industry temporary help service wholesale trade increase well,0
35,2005-12-13,employment rising average workweek production nonsupervisory workers falling slightly aggregate hours slipped november albeit level third quarter average,employment rise average workweek production nonsupervisory worker fall slightly aggregate hour slip november albeit level third quarter average,0
36,2005-12-13,unemployment rate held steady  percent labor force participation rate also unchanged,unemployment rate held steady percent labor force participation rate also unchanged,0
37,2005-12-13,survey measures individuals expectations future labor market conditions improved november largely reversing post katrina declines,survey measure individual expectation future labor market condition improve november largely reverse post katrina decline,0
38,2005-12-13,industrial production rebounded october held september hurricanes strike boeing,industrial production rebound october held september hurricane strike boeing,0
39,2005-12-13,resumption commercial aircraft production boosted manufacturing output offset fall production motor vehicles parts,resumption commercial aircraft production boost manufacturing output offset fall production motor vehicle part,0
40,2005-12-13,large output gains hurricane affected industries segments food rubber plastics paper industries also contributed increase manufacturing output,large output gain hurricane affected industry segment food rubber plastic paper industry also contribute increase manufacturing output,0
41,2005-12-13,growth high tech output slowed slightly october mainly result smaller increases production semiconductors,growth high tech output slow slightly october mainly result small increase production semiconductor,0
42,2005-12-13,contrast production communication equipment particularly data networking equipment accelerated,contrast production communication equipment particularly data networking equipment accelerate,0
43,2005-12-13,many energy facilities gulf region still closed output mines defined include oil gas extraction slipped october,many energy facility gulf region still close output mine define include oil gas extraction slip october,0
44,2005-12-13,manufacturing capacity utilization moved october touch long run average,manufacturing capacity utilization move october touch long run average,0
45,2005-12-13,real personal consumption expenditures appeared increasing solidly course fourth quarter led improvements fundamental determinants consumer spending,real personal consumption expenditure appear increase solidly course fourth quarter lead improvement fundamental determinant consumer spending,0
46,2005-12-13,real disposable personal income bolstered gains employment falling retail energy prices continued brisk advances house prices recent strengthening equity prices contributed importantly increases household wealth,real disposable personal income bolster gain employment fall retail energy price continued brisk advance house price recent strengthen equity price contribute importantly increase household wealth,0
47,2005-12-13,consumer sentiment picked november early december survey measures confidence returned range seen first half year,consumer sentiment picked november early december survey measure confidence return range see first half year,0
48,2005-12-13,personal saving rate still slightly negative moved october,personal save rate still slightly negative move october,0
49,2005-12-13,activity housing market remained brisk despite rise mortgage interest rates,activity housing market remain brisk despite rise mortgage interest rate,0
50,2005-12-13,starts new single family homes dropped back somewhat october september strong pace permit issuance remained elevated,start new single family home drop back somewhat october september strong pace permit issuance remain elevate,0
51,2005-12-13,new home sales reached new high october existing home sales eased little high levels recorded summer,new home sale reach new high october exist home sale ease little high level record summer,0
52,2005-12-13,available indicators housing activity soft side index mortgage applications purchases homes declined november builders ratings new home sales fallen recent months,available indicator housing activity soft side index mortgage application purchase home decline november builder rating new home sale fall recent month,0
53,2005-12-13,addition survey measures homebuying attitudes declined levels last observed early,addition survey measure homebuying attitude decline level last observe early,0
54,2005-12-13,real outlays equipment software posted solid gain third quarter,real outlay equipment software post solid gain third quarter,0
55,2005-12-13,although business purchases motor vehicles declined october november growth investment nontransportation equipment appeared well maintained fourth quarter,although business purchase motor vehicle decline october november growth investment nontransportation equipment appear well maintain fourth quarter,0
56,2005-12-13,rising business sales declining cost capital ample financial resources corporate sector continued foster favorable environment capital spending sentiment echoed executive surveys generally pointed widespread increases planned capital outlays,rise business sale decline cost capital ample financial resource corporate sector continued foster favorable environment capital spending sentiment echoed executive survey generally point widespread increase plan capital outlay,0
57,2005-12-13,real spending nonresidential construction improved materially third quarter boosted substantial gains drilling mining expenditures,real spending nonresidential construction improve materially third quarter boost substantial gain drilling mining expenditure,0
58,2005-12-13,real nonfarm inventories ran third quarter automakers pared motor vehicle stocks,real nonfarm inventory ran third quarter automaker par motor vehicle stock,0
59,2005-12-13,even outside motor vehicle sector inventory investment relatively restrained partial data october suggested real stockbuilding continued subdued,even outside motor vehicle sector inventory investment relatively restrain partial data october suggest real stockbuilding continued subdue,0
60,2005-12-13,level stocks appeared reasonably well aligned sales,level stock appear reasonably well align sale,0
61,2005-12-13,us international trade deficit reached new record september,u international trade deficit reach new record september,0
62,2005-12-13,surge imports accompanied fairly sizable drop exports part due steep falloff aircraft exports result strike boeing,surge import accompany fairly sizable drop export part due steep falloff aircraft export result strike boeing,0
63,2005-12-13,jump value imports driven strong growth categories goods and lesser extent growth services increases dollar value imports oil industrial supplies especially natural gas particularly strong reflection higher prices,jump value import driven strong growth category good and lesser extent growth service increase dollar value import oil industrial supply especially natural gas particularly strong reflection high price,0
64,2005-12-13,foreign industrialized economies expanded robustly third quarter available indicators fourth quarter appeared promising balance,foreign industrialize economy expand robustly third quarter available indicator fourth quarter appear promising balance,0
65,2005-12-13,core consumer price inflation moderate recent months although signs pass higher energy costs evident especially transportation services,core consumer price inflation moderate recent month although sign pas high energy cost evident especially transportation service,0
66,2005-12-13,consumer energy prices retreated notably elevated post hurricane levels,consumer energy price retreat notably elevate post hurricane level,0
67,2005-12-13,wholesale retail gasoline prices dropped gasoline inventories rebounded,wholesale retail gasoline price drop gasoline inventory rebound,0
68,2005-12-13,spot prices natural gas fell sharply mid november amidst unusually temperate weather plentiful inventories declining prices competing fuels unusually cold weather early december however caused spot prices move back october levels,spot price natural gas fell sharply mid november amidst unusually temperate weather plentiful inventory decline price compete fuel unusually cold weather early december however cause spot price move back october level,0
69,2005-12-13,presumably response falling retail energy prices one survey households november early december showed marked retreat expectations inflation coming year,presumably response fall retail energy price one survey household november early december show marked retreat expectation inflation come year,0
70,2005-12-13,longer term inflation expectations also edged down stayed touch narrow range observed recent years,longer term inflation expectation also edge down stayed touch narrow range observe recent year,0
71,2005-12-13,although recent increases energy costs pushed producer prices sectors overall producer price inflation remained subdued,although recent increase energy cost push producer price sector overall producer price inflation remain subdue,0
72,2005-12-13,regard labor costs twelve month change employment cost index private industry workers september well year ago increase,regard labor cost twelve month change employment cost index private industry worker september well year ago increase,0
73,2005-12-13,hourly compensation nonfarm business sector also appeared slowed bit recently,hourly compensation nonfarm business sector also appear slow bit recently,0
74,2005-12-13,november meeting federal open market committee decided increase target level federal funds rate  basis points  percent,november meeting federal open market committee decide increase target level federal fund rate basis point percent,0
75,2005-12-13,accompanying statement committee indicated that appropriate monetary policy action upside downside risks attainment sustainable growth price stability kept roughly equal,accompany statement committee indicate that appropriate monetary policy action upside downside risk attainment sustainable growth price stability kept roughly equal,0
76,2005-12-13,committee also noted elevated energy prices hurricane related disruptions economic activity temporarily depressed output employment,committee also note elevate energy price hurricane related disruption economic activity temporarily depressed output employment,0
77,2005-12-13,however monetary policy accommodation coupled robust underlying growth productivity providing ongoing support economic activity,however monetary policy accommodation couple robust underlie growth productivity provide ongoing support economic activity,0
78,2005-12-13,although cumulative rise energy costs potential add inflation pressures core inflation relatively low recent months longer term inflation expectations remained contained,although cumulative rise energy cost potential add inflation pressure core inflation relatively low recent month longer term inflation expectation remain contain,0
79,2005-12-13,circumstances committee believed policy accommodation could removed pace likely measured noted would respond changes economic prospects needed fulfill obligation maintain price stability,circumstance committee believe policy accommodation could remove pace likely measure note would respond change economic prospect need fulfill obligation maintain price stability,0
80,2005-12-13,market participants widely anticipated committee decision november meeting policy announcement evoked little reaction financial markets,market participant widely anticipate committee decision november meeting policy announcement evoke little reaction financial market,0
81,2005-12-13,intermeeting period investors marked slightly expectations path monetary policy light stronger expected data spending production,intermeeting period investor marked slightly expectation path monetary policy light strong expect data spending production,0
82,2005-12-13,nominal treasury yields changed little net measures inflation compensation longer horizons calculated using yields nominal inflation protected securities declined somewhat,nominal treasury yield change little net measure inflation compensation longer horizon calculate use yield nominal inflation protect security decline somewhat,0
83,2005-12-13,credit spreads investment speculative grade corporate bonds unchanged intermeeting period,credit spread investment speculative grade corporate bond unchanged intermeeting period,0
84,2005-12-13,major equity price indexes posted substantial gains spurred perception economy retained considerable momentum limited inflation pressures,major equity price index post substantial gain spur perception economy retain considerable momentum limited inflation pressure,0
85,2005-12-13,foreign exchange markets trade weighted value dollar unchanged intermeeting period,foreign exchange market trade weight value dollar unchanged intermeeting period,0
86,2005-12-13,expansion domestic nonfinancial debt appeared moderated little brisk third quarter pace,expansion domestic nonfinancial debt appear moderate little brisk third quarter pace,0
87,2005-12-13,consumer credit dipped october nonfinancial firms net borrowing form bank loans commercial paper bonds bit third quarter pace,consumer credit dipped october nonfinancial firm net borrowing form bank loan commercial paper bond bit third quarter pace,0
88,2005-12-13,household bankruptcies hovered low levels recent weeks soaring unprecedented heights implementation stringent bankruptcy rules mid october,household bankruptcy hover low level recent week soar unprecedented height implementation stringent bankruptcy rule mid october,0
89,2005-12-13,hurricane relief payments apparently boosted october aggregate decelerated november partly reflecting continued rise opportunity cost holding liquid deposits,hurricane relief payment apparently boost october aggregate decelerate november partly reflect continued rise opportunity cost hold liquid deposit,0
90,2005-12-13,staff forecast prepared meeting suggested growth economic activity would slow year pace remain solid output staying near economy potential next two years,staff forecast prepared meeting suggest growth economic activity would slow year pace remain solid output stay near economy potential next two year,0
91,2005-12-13,although hurricane related rebuilding would boost activity especially near term stimulus increasingly would countered higher interest rates anticipated waning positive wealth effect associated large earlier gains equity house prices reduced impetus fiscal policy,although hurricane related rebuild would boost activity especially near term stimulus increasingly would counter high interest rate anticipate wan positive wealth effect associate large earlier gain equity house price reduce impetus fiscal policy,0
92,2005-12-13,overall core consumer price inflation projected move higher first half next year reflecting effects higher energy prices trend lower effects ebb,overall core consumer price inflation project move high first half next year reflect effect high energy price trend low effect ebb,0
93,2005-12-13,discussion economic situation outlook meeting participants noted incoming data intermeeting period encouraging regard economic growth inflation,discussion economic situation outlook meeting participant note incoming data intermeeting period encourage regard economic growth inflation,0
94,2005-12-13,economic expansion shown considerable resilience face higher energy prices hurricane related disruptions suggesting greater underlying strength apparent time november meeting,economic expansion show considerable resilience face high energy price hurricane related disruption suggest great underlie strength apparent time november meeting,0
95,2005-12-13,time incoming inflation data benign indicating relatively modest pass higher energy prices core inflation date subdued gains compensation strong growth productivity holding business costs inflation expectations jumped hurricanes fallen back,time incoming inflation data benign indicate relatively modest pas high energy price core inflation date subdue gain compensation strong growth productivity hold business cost inflation expectation jumped hurricane fall back,0
96,2005-12-13,nonetheless growth solid prices energy products still well levels earlier year possible increases resource utilization potential add pressures prices especially absence firming policy,nonetheless growth solid price energy product still well level earlier year possible increase resource utilization potential add pressure price especially absence firm policy,0
97,2005-12-13,discussion major sectors economy meeting participants noted that light vehicle sales slowed fall consumer spending outside auto sector appeared remained vigorous,discussion major sector economy meeting participant note that light vehicle sale slow fall consumer spending outside auto sector appear remain vigorous,0
98,2005-12-13,holiday sales said good start many parts country,holiday sale say good start many part country,0
99,2005-12-13,substantial recovery measures consumer confidence sharp declines aftermath hurricanes reduced meeting participants concerns significant pull back spending,substantial recovery measure consumer confidence sharp decline aftermath hurricane reduce meeting participant concern significant pull back spending,0
100,2005-12-13,going forward consumer outlays expected supported advances employment income,go forward consumer outlay expect support advance employment income,0
101,2005-12-13,meeting participants discussed tentative signs activity beginning slow housing sector,meeting participant discuss tentative sign activity begin slow housing sector,0
102,2005-12-13,reports contacts many parts country suggested somewhat less ebullient market conditions measures confidence homebuyers builders fallen back noticeably,report contact many part country suggest somewhat less ebullient market condition measure confidence homebuyers builder fall back noticeably,0
103,2005-12-13,downshift attitudes regarding outlook housing sector could significant market effects part damping demand houses investors speculators,downshift attitude regard outlook housing sector could significant market effect part damp demand house investor speculator,0
104,2005-12-13,slowing house price increases restraining expansion consumption moderation pace new building expected reduce growth aggregate demand somewhat coming quarters,slow house price increase restrain expansion consumption moderation pace new building expect reduce growth aggregate demand somewhat come quarter,0
105,2005-12-13,date however national data home prices sales construction activity not suggest significant weakening sector,date however national data home price sale construction activity not suggest significant weaken sector,0
106,2005-12-13,business investment spending accelerated since midyear,business investment spending accelerate since midyear,0
107,2005-12-13,part pickup may reflected increase business confidence economy proved resilient face year substantial adverse shocks,part pickup may reflect increase business confidence economy prove resilient face year substantial adverse shock,0
