,Date,Original,Corpus,Class
108,2005-12-13,participants noted improved performance investment suggested expansion becoming balanced strengthening business spending potentially offsetting moderation growth household spending elevated rates recent years,participant note improve performance investment suggest expansion become balance strengthen business spending potentially offset moderation growth household spending elevate rate recent year,0
109,2005-12-13,economic activity also could buoyed developments sectors economy,economic activity also could buoyed development sector economy,0
110,2005-12-13,increased federal government outlays expected boost output little next year,increase federal government outlay expect boost output little next year,0
111,2005-12-13,supportive financial conditions apparent increase confidence contributed pickup growth abroad,supportive financial condition apparent increase confidence contribute pickup growth abroad,0
112,2005-12-13,despite possible firming monetary policy foreign central banks rise foreign exchange value dollar owing global demands dollar assets good portion recent strength foreign economic growth expected persist provide supports exports,despite possible firm monetary policy foreign central bank rise foreign exchange value dollar owe global demand dollar asset good portion recent strength foreign economic growth expect persist provide support export,0
113,2005-12-13,discussion prices participants indicated concerns near term inflation pressures eased somewhat intermeeting period,discussion price participant indicate concern near term inflation pressure ease somewhat intermeeting period,0
114,2005-12-13,recent data suggested that thus far indirect effects elevated energy prices core inflation muted,recent data suggest that thus far indirect effect elevate energy price core inflation mute,0
115,2005-12-13,moreover energy prices generally fallen back balance since earlier fall much increases inflation expectations posted aftermath hurricanes reversed,moreover energy price generally fall back balance since earlier fall much increase inflation expectation post aftermath hurricane reverse,0
116,2005-12-13,participants noted robust competition including foreign producers substantial gains productivity helping contain cost price pressures,participant note robust competition include foreign producer substantial gain productivity help contain cost price pressure,0
117,2005-12-13,moreover measures labor compensation showed moderate gains relatively wide profit margins could allow firms absorb somewhat larger increases labor costs without boosting prices,moreover measure labor compensation show moderate gain relatively wide profit margin could allow firm absorb somewhat large increase labor cost without boost price,0
118,2005-12-13,nonetheless surveys anecdotal reports suggested firms successfully passing least portion increased costs customers many participants remained concerned elevated energy prices could put pressure core inflation,nonetheless survey anecdotal report suggest firm successfully passing least portion increase cost customer many participant remain concerned elevate energy price could put pressure core inflation,0
119,2005-12-13,also view number participants economy possibly producing neighborhood potential persistent strength spending late suggested resource markets could tighten inflation pressures build,also view number participant economy possibly produce neighborhood potential persistent strength spending late suggest resource market could tighten inflation pressure build,0
120,2005-12-13,circumstances policy accommodative time inflation expectations could rise monetary policy not seen responding contain risks,circumstance policy accommodative time inflation expectation could rise monetary policy not see respond contain risk,0
121,2005-12-13,committee discussion monetary policy intermeeting period members favored raising target federal funds rate  basis points   percent,committee discussion monetary policy intermeeting period member favor raise target federal fund rate basis point percent,0
122,2005-12-13,spending apparently retaining considerable momentum indirect effects increased energy prices still threatening raise core inflation least time committee thought additional policy firming meeting appropriate keep inflation inflation expectations check,spending apparently retain considerable momentum indirect effect increase energy price still threaten raise core inflation least time committee thought additional policy firm meeting appropriate keep inflation inflation expectation check,0
123,2005-12-13,committee members generally anticipated policy would likely need firmed going forward,committee member generally anticipate policy would likely need firm go forward,0
124,2005-12-13,process committee would need mindful lags effect policy firming economy,process committee would need mindful lag effect policy firm economy,0
125,2005-12-13,however would also take account effects sustained period favorable financial conditions asset prices aggregate demand well resulting possibility increases resource utilization pressures prices,however would also take account effect sustain period favorable financial condition asset price aggregate demand well result possibility increase resource utilization pressure price,0
126,2005-12-13,views differed much tightening might required,view differ much tighten might require,0
127,2005-12-13,committee actions past eighteen months significantly reduced degree monetary policy accommodation members thought policy outlook becoming considerably less certain policy decisions going forward would depend increased extent implications incoming economic data future growth inflation,committee action past eighteen month significantly reduce degree monetary policy accommodation member thought policy outlook become considerably less certain policy decision go forward would depend increase extent implication incoming economic data future growth inflation,0
128,2005-12-13,committee agreed several changes wording announcement released today meeting would appropriate,committee agree several change word announcement release today meeting would appropriate,0
129,2005-12-13,federal funds rate boosted substantially and view members likely within broad range values might turn consistent output remaining close potential,federal fund rate boost substantially and view member likely within broad range value might turn consistent output remain close potential,0
130,2005-12-13,circumstances committee thought policy no longer characterized accommodative,circumstance committee thought policy no longer characterize accommodative,0
131,2005-12-13,members concurred statement note expansion remained solid despite elevated energy prices hurricane related disruptions,member concur statement note expansion remain solid despite elevate energy price hurricane related disruption,0
132,2005-12-13,inflation long term inflation expectations remained contained committee agreed announcement indicate possible increases resource utilization well elevated energy prices potential add inflation pressures some measured policy firming likely needed keep risks attainment sustainable economic growth price stability roughly balance,inflation long term inflation expectation remain contain committee agree announcement indicate possible increase resource utilization well elevate energy price potential add inflation pressure some measure policy firm likely need keep risk attainment sustainable economic growth price stability roughly balance,0
133,2005-12-13,although future action would depend incoming data characterization outlook policy seen members indicating that given information hand number additional firming steps required probably would not large,although future action would depend incoming data characterization outlook policy see member indicate that give information hand number additional firm step require probably would not large,0
134,2005-12-13,members thought word measured no longer necessary retention meeting seen potentially useful preclude possible misinterpretation committee saw significant possibility adjusting policy larger increments near future,member thought word measure no longer necessary retention meeting see potentially useful preclude possible misinterpretation committee saw significant possibility adjust policy large increment near future,0
135,2005-12-13,wording announcement along lines not expected substantial effect market expectations policy though effects especially difficult judge given extensive changes made statement,word announcement along line not expect substantial effect market expectation policy though effect especially difficult judge give extensive change make statement,0
136,2005-12-13,members agreed announcement end noting policy respond changes economic prospects needed foster committee objectives,member agree announcement end note policy respond change economic prospect need foster committee objective,0
137,2005-12-13,conclusion discussion committee voted authorize direct federal reserve bank new york instructed otherwise execute transactions system account accordance following domestic policy directive,conclusion discussion committee vote authorize direct federal reserve bank new york instruct otherwise execute transaction system account accordance follow domestic policy directive,0
138,2005-12-13,vote encompassed approval paragraph inclusion statement released shortly meeting,vote encompass approval paragraph inclusion statement release shortly meeting,0
139,2005-12-13,votes action messrs,vote action messrs,0
140,2005-12-13,greenspan geithner ms bies messrs,greenspan geithner m bies messrs,0
141,2005-12-13,ferguson fisher kohn olson moskow santomero stern,ferguson fisher kohn olson moskow santomero stern,0
142,2005-12-13,votes action none,vote action none,0
143,2005-12-13,agreed next meeting committee would held tuesday january  ,agree next meeting committee would held tuesday january,0
144,2005-12-13,meeting adjourned,meeting adjourn,0
145,2005-12-13,notation vote notation vote completed november   committee unanimously approved minutes meeting federal open market committee held november  ,notation vote notation vote complete november committee unanimously approve minute meeting federal open market committee held november,0
146,2005-12-13,vincent reinhart secretary,vincent reinhart secretary,0
147,2005-12-13,return top,return top,0
