,Date,Original,Corpus,Class
119,2006-10-25,looking ahead gradual reduction restraining effects contraction residential investment solid gains consumer business spending expected lead pickup gdp growth  ,look ahead gradual reduction restrain effect contraction residential investment solid gain consumer business spending expect lead pickup gdp growth,0
120,2006-10-25,gains spending likely supported past declines energy prices continued gains payroll employment labor income,gain spending likely support past decline energy price continued gain payroll employment labor income,0
121,2006-10-25,real gdp expected rise somewhat slower rate next two years  part result less impetus household wealth interest rates fiscal policy,real gdp expect rise somewhat slow rate next two year part result less impetus household wealth interest rate fiscal policy,0
122,2006-10-25,projected increase real output next year little staff estimate potential output growth leading lessening pressures resource utilization,project increase real output next year little staff estimate potential output growth lead lessen pressure resource utilization,0
123,2006-10-25,core inflation anticipated edge   relative second half year diminishing impetus prices energy commodities modest easing resource utilization,core inflation anticipate edge relative second half year diminish impetus price energy commodity modest ease resource utilization,0
124,2006-10-25,discussion economic situation outlook meeting participants noted incoming data relatively brief intermeeting period come broadly anticipated,discussion economic situation outlook meeting participant note incoming data relatively brief intermeeting period come broadly anticipate,0
125,2006-10-25,recent indicators suggested economic growth probably slowed sharply third quarter expected time september meeting appeared largely reflect impact temporary influences,recent indicator suggest economic growth probably slow sharply third quarter expect time september meeting appear largely reflect impact temporary influence,0
126,2006-10-25,participants continued expect economy expand rate close little economy long run sustainable pace coming quarters,participant continued expect economy expand rate close little economy long run sustainable pace come quarter,0
127,2006-10-25,ongoing adjustment housing market likely depress real activity near term effect expected wane gradually private final domestic purchases held well recent months looked set expand reasonably good pace,ongoing adjustment housing market likely depress real activity near term effect expect wane gradually private final domestic purchase held well recent month look set expand reasonably good pace,0
128,2006-10-25,although recent monthly inflation readings indicated slowing core inflation rapid rates spring early summer many participants noted current rates core inflation remained undesirably high,although recent monthly inflation reading indicate slow core inflation rapid rate spring early summer many participant note current rate core inflation remain undesirably high,0
129,2006-10-25,participants expected core inflation moderate gradually quite uncertain likely pace extent moderation,participant expect core inflation moderate gradually quite uncertain likely pace extent moderation,0
130,2006-10-25,discussion major sectors economy participants noted housing activity likely remain substantial drag economic growth next quarters,discussion major sector economy participant note housing activity likely remain substantial drag economic growth next quarter,0
131,2006-10-25,many participants drew comfort recent data suggested correction housing market likely no severe previously expected risk even larger contraction sector ebbed,many participant drew comfort recent data suggest correction housing market likely no severe previously expect risk even large contraction sector ebbed,0
132,2006-10-25,adjustment housing market appeared likely,adjustment housing market appear likely,0
133,2006-10-25,single family housing permits continued fall inventories unsold homes remained historically high levels,single family housing permit continued fall inventory unsold home remain historically high level,0
134,2006-10-25,contacts building sector suggested construction firms attempting reduce backlogs unsold homes cutting back sharply new construction offering substantial price incentives,contact building sector suggest construction firm attempt reduce backlog unsold home cut back sharply new construction offering substantial price incentive,0
135,2006-10-25,several meeting participants noted considerable strain small medium sized residential construction firms,several meeting participant note considerable strain small medium size residential construction firm,0
136,2006-10-25,date weakness housing market associated downshift house price appreciation not seem spilling consumer spending appeared grown steady pace recent months,date weakness housing market associate downshift house price appreciation not seem spill consumer spending appear grown steady pace recent month,0
137,2006-10-25,retail activity districts relatively robust contacts retail sector generally upbeat outlook,retail activity district relatively robust contact retail sector generally upbeat outlook,0
138,2006-10-25,several participants noted however contacts within transportation sector reported activity anticipation holiday shopping season appeared softer previous years,several participant note however contact within transportation sector report activity anticipation holiday shopping season appear softer previous year,0
139,2006-10-25,meeting participants judged consumer expenditures going forward likely expand steady pace little growth disposable income supported favorable financial conditions continued increases employment income recent decline energy prices,meeting participant judged consumer expenditure go forward likely expand steady pace little growth disposable income support favorable financial condition continued increase employment income recent decline energy price,0
140,2006-10-25,nonetheless many participants expressed concern ongoing developments housing market could pronounced impact consumer spending especially house prices declined significantly,nonetheless many participant express concern ongoing development housing market could pronounce impact consumer spending especially house price decline significantly,0
141,2006-10-25,investment spending also appeared holding well,investment spending also appear hold well,0
142,2006-10-25,meeting participants reported business contacts generally optimistic perceived economic outlook relatively favorable,meeting participant report business contact generally optimistic perceive economic outlook relatively favorable,0
143,2006-10-25,several participants noted growth nonresidential construction remained robust absorbing resources displaced residential sector,several participant note growth nonresidential construction remain robust absorb resource displace residential sector,0
144,2006-10-25,strength corporate balance sheets profits seen likely help maintain solid profile investment spending next year so despite restraint slower growth final sales,strength corporate balance sheet profit see likely help maintain solid profile investment spending next year so despite restraint slow growth final sale,0
145,2006-10-25,however one participant observed uncertainty concerning possible severity current slowing economic growth could lead businesses delay investment plans,however one participant observe uncertainty concern possible severity current slow economic growth could lead business delay investment plan,0
146,2006-10-25,contrast steady expansion consumer business investment spending recent months several components output demand appeared somewhat weaker expected,contrast steady expansion consumer business investment spending recent month several component output demand appear somewhat weaker expect,0
147,2006-10-25,particular apparently uncomfortably high levels inventories within auto sector prompted sharp reduction light vehicle production third quarter,particular apparently uncomfortably high level inventory within auto sector prompt sharp reduction light vehicle production third quarter,0
148,2006-10-25,federal expenditures held surprisingly weak defense outlays,federal expenditure held surprisingly weak defense outlay,0
149,2006-10-25,strong growth imports july august driven part surge oil imports suggested net exports probably posed arithmetic drag economic growth third quarter,strong growth import july august driven part surge oil import suggest net export probably pose arithmetic drag economic growth third quarter,0
150,2006-10-25,however participants judged recent weakness components largely reflected temporary influences not likely depress pace economic expansion going forward,however participant judged recent weakness component largely reflect temporary influence not likely depress pace economic expansion go forward,0
151,2006-10-25,said one participant note possibility recent decline oil prices may part stem weakness global demand,say one participant note possibility recent decline oil price may part stem weakness global demand,0
152,2006-10-25,data reports businesses indicated labor market remained tight,data report business indicate labor market remain tight,0
153,2006-10-25,employment continued rise steady pace participants reported many contacts increasingly concerned difficulty recruiting suitably qualified workers,employment continued rise steady pace participant report many contact increasingly concerned difficulty recruiting suitably qualify worker,0
154,2006-10-25,shortages pronounced certain types professional skilled workers,shortage pronounce certain type professional skilled worker,0
155,2006-10-25,reports shortages associated wage pressures not unambiguously shown aggregate compensation data giving contradictory signals whether compensation increases picking up,report shortage associate wage pressure not unambiguously show aggregate compensation data give contradictory signal whether compensation increase pick up,0
156,2006-10-25,however possibility tightness labor market could lead sustained increase wage pressure viewed participants upside risk costs expectations gradual decline inflation,however possibility tightness labor market could lead sustain increase wage pressure view participant upside risk cost expectation gradual decline inflation,0
157,2006-10-25,noted though continuing high profit margins provided scope increased labor costs absorbed without necessarily leading elevated price pressures,note though continue high profit margin provide scope increase labor cost absorbed without necessarily lead elevate price pressure,0
158,2006-10-25,meeting participants expressed concern outlook inflation,meeting participant express concern outlook inflation,0
159,2006-10-25,participants expected core inflation edge lower part effects run energy prices recent years waned,participant expect core inflation edge low part effect run energy price recent year wan,0
160,2006-10-25,shelter costs not expected add materially inflation going forward,shelter cost not expect add materially inflation go forward,0
161,2006-10-25,moreover moderate growth aggregate demand associated modest easing pressures resource utilization also contribute slightly slowing core inflation,moreover moderate growth aggregate demand associate modest ease pressure resource utilization also contribute slightly slow core inflation,0
162,2006-10-25,recent changes core prices declined slightly earlier year,recent change core price decline slightly earlier year,0
163,2006-10-25,nonetheless nearly participants viewed current rates core inflation uncomfortably high stressed importance moderation,nonetheless nearly participant view current rate core inflation uncomfortably high stress importance moderation,0
164,2006-10-25,available measures suggested medium long term inflation expectations remained around levels seen past several years although view participants expectations probably higher would consistent assessment long run price stability,available measure suggest medium long term inflation expectation remain around level see past several year although view participant expectation probably high would consistent assessment long run price stability,0
165,2006-10-25,participants concerned inflation expectations could begin drift upwards core inflation remained elevated protracted period,participant concerned inflation expectation could begin drift upwards core inflation remain elevate protract period,0
166,2006-10-25,rise inflation expectations associated upward pressure inflation would likely prove costly reverse,rise inflation expectation associate upward pressure inflation would likely prove costly reverse,0
167,2006-10-25,although participants noted recent slowing core inflation helped allay fears sustained increase inflation participants emphasized risks around desired downward path inflation remained upside,although participant note recent slow core inflation help allay fear sustain increase inflation participant emphasize risk around desire downward path inflation remain upside,0
168,2006-10-25,committee discussion monetary policy intermeeting period nearly members favored keeping target federal funds rate   percent meeting,committee discussion monetary policy intermeeting period nearly member favor keep target federal fund rate percent meeting,0
169,2006-10-25,committee view outlook economic growth inflation changed little since previous meeting,committee view outlook economic growth inflation change little since previous meeting,0
170,2006-10-25,nearly members expected economy would expand close little potential growth rate inflation would ebb gradually elevated levels,nearly member expect economy would expand close little potential growth rate inflation would ebb gradually elevate level,0
171,2006-10-25,although substantial uncertainty continued attend outlook members judged downside risks economic activity diminished little likewise members felt upside risks inflation declined albeit slightly,although substantial uncertainty continued attend outlook member judged downside risk economic activity diminish little likewise member felt upside risk inflation decline albeit slightly,0
172,2006-10-25,members agreed risks achieving anticipated reduction inflation remained greatest concern,member agree risk achieve anticipate reduction inflation remain great concern,0
173,2006-10-25,members noted significant amount data would published next committee meeting december giving committee ample scope refine assessment economic outlook judging whether additional firming needed address risks,member note significant amount data would publish next committee meeting december give committee ample scope refine assessment economic outlook judging whether additional firm need address risk,0
174,2006-10-25,members agreed statement released meeting continue convey inflation risks remained dominant concern additional policy firming possible,member agree statement release meeting continue convey inflation risk remain dominant concern additional policy firm possible,0
175,2006-10-25,committee concurred statement mention economic growth slowed course year that going forward economy seemed likely expand moderate pace,committee concur statement mention economic growth slow course year that go forward economy seem likely expand moderate pace,0
176,2006-10-25,energy prices well highs reached earlier year members felt no longer appropriate note high level energy prices potential sustain inflation pressures,energy price well high reach earlier year member felt no longer appropriate note high level energy price potential sustain inflation pressure,0
177,2006-10-25,conclusion discussion committee voted authorize direct federal reserve bank new york instructed otherwise execute transactions system account accordance following domestic policy directive,conclusion discussion committee vote authorize direct federal reserve bank new york instruct otherwise execute transaction system account accordance follow domestic policy directive,0
178,2006-10-25,the federal open market committee seeks monetary financial conditions foster price stability promote sustainable growth output,the federal open market committee seek monetary financial condition foster price stability promote sustainable growth output,0
179,2006-10-25,long run objectives committee immediate future seeks conditions reserve markets consistent maintaining federal funds rate average around   percent,long run objective committee immediate future seek condition reserve market consistent maintain federal fund rate average around percent,0
180,2006-10-25,vote encompassed approval text inclusion statement released,vote encompass approval text inclusion statement release,0
181,2006-10-25,nonetheless committee judges inflation risks remain,nonetheless committee judge inflation risk remain,0
182,2006-10-25,extent timing additional firming may needed address risks depend evolution outlook inflation economic growth implied incoming information,extent timing additional firm may need address risk depend evolution outlook inflation economic growth imply incoming information,0
183,2006-10-25,votes action messrs,vote action messrs,0
184,2006-10-25,bernanke geithner ms bies messrs,bernanke geithner m bies messrs,0
185,2006-10-25,kohn kroszner mishkin ms pianalto messrs,kohn kroszner mishkin m pianalto messrs,0
186,2006-10-25,poole warsh ms yellen,poole warsh m yellen,0
187,2006-10-25,votes actionmr lacker,vote actionmr lacker,0
188,2006-10-25,mr lacker dissented believed tightening needed help ensure core inflation declines acceptable rate coming quarters,mr lacker dissent believe tighten need help ensure core inflation decline acceptable rate come quarter,0
189,2006-10-25,committee continued discussion communication issues considered advantages disadvantages quantifying inflation objective,committee continued discussion communication issue consider advantage disadvantage quantify inflation objective,0
190,2006-10-25,participants stressed step consistent statutory objectives monetary policy,participant stress step consistent statutory objective monetary policy,0
191,2006-10-25,regard noted time price stability prerequisite maximum employment moderate long term interest rates,regard note time price stability prerequisite maximum employment moderate long term interest rate,0
192,2006-10-25,however possible specification numerical price objective raised number complex interrelated issues required considerable discussion,however possible specification numerical price objective raise number complex interrelate issue require considerable discussion,0
193,2006-10-25,committee reached no decisions issues meeting participants agreed continue committee review communication issues meeting january ,committee reach no decision issue meeting participant agree continue committee review communication issue meeting january,0
194,2006-10-25,meeting adjourned,meeting adjourn,0
195,2006-10-25,notation vote notation vote completed october   committee unanimously approved minutes fomc meeting held september  ,notation vote notation vote complete october committee unanimously approve minute fomc meeting held september,0
196,2006-10-25,vincent reinhart secretary,vincent reinhart secretary,0
197,2006-10-25,attended tuesday session only,attend tuesday session only,0
198,2006-10-25,return text,return text,0
199,2006-10-25,attended wednesday session only,attend wednesday session only,0
200,2006-10-25,return text,return text,0
201,2006-10-25,return top,return top,0
