,Date,Original,Corpus,Class
89,2006-01-31,maintain reciprocal currency swap arrangements selected foreign central banks,maintain reciprocal currency swap arrangement select foreign central bank,0
90,2006-01-31,cooperate respects central banks countries international monetary institutions,cooperate respect central bank country international monetary institution,0
91,2006-01-31,transactions may also undertaken,transaction may also undertaken,0
92,2006-01-31,adjust system balances light probable future needs currencies,adjust system balance light probable future need currency,0
93,2006-01-31,provide means meeting system treasury commitments particular currencies facilitate operations exchange stabilization fund,provide mean meeting system treasury commitment particular currency facilitate operation exchange stabilization fund,0
94,2006-01-31,purposes may expressly authorized committee,purpose may expressly authorize committee,0
95,2006-01-31,system foreign currency operations shall conducted,system foreign currency operation shall conduct,0
96,2006-01-31,close continuous consultation cooperation united states treasury,close continuous consultation cooperation united state treasury,0
97,2006-01-31,cooperation appropriate foreign monetary authorities,cooperation appropriate foreign monetary authority,0
98,2006-01-31,manner consistent obligations united states international monetary fund regarding exchange arrangements imf article iv,manner consistent obligation united state international monetary fund regard exchange arrangement imf article iv,0
99,2006-01-31,mr lacker dissented votes foreign currency directive authorization foreign currency operations indicate opposition foreign currency intervention federal reserve,mr lacker dissent vote foreign currency directive authorization foreign currency operation indicate opposition foreign currency intervention federal reserve,0
100,2006-01-31,view intervention would ineffective not also signal shift domestic monetary policy,view intervention would ineffective not also signal shift domestic monetary policy,0
101,2006-01-31,signal shift could potentially compromise federal reserve monetary policy independence,signal shift could potentially compromise federal reserve monetary policy independence,0
102,2006-01-31,unanimous vote procedural instructions respect foreign currency operations reaffirmed form shown below,unanimous vote procedural instruction respect foreign currency operation reaffirm form show below,0
103,2006-01-31,procedural instructions respect foreign currency operations reaffirmed january  ,procedural instruction respect foreign currency operation reaffirm january,0
104,2006-01-31,conducting operations pursuant authorization direction federal open market committee set forth authorization foreign currency operations foreign currency directive federal reserve bank new york manager system open market account manager shall guided following procedural understandings respect consultations clearances committee foreign currency subcommittee chairman committee,conduct operation pursuant authorization direction federal open market committee set forth authorization foreign currency operation foreign currency directive federal reserve bank new york manager system open market account manager shall guide follow procedural understanding respect consultation clearance committee foreign currency subcommittee chairman committee,0
105,2006-01-31,operations undertaken pursuant clearances shall reported promptly committee,operation undertaken pursuant clearance shall report promptly committee,0
106,2006-01-31,manager shall clear subcommittee or chairman chairman believes consultation subcommittee not feasible time available,manager shall clear subcommittee or chairman chairman believe consultation subcommittee not feasible time available,0
107,2006-01-31,operation would result change system overall open position foreign currencies exceeding  million day  million since recent regular meeting committee,operation would result change system overall open position foreign currency exceed million day million since recent regular meeting committee,0
108,2006-01-31,operation would result change day system net position single foreign currency exceeding  million  million operation associated repayment swap drawings,operation would result change day system net position single foreign currency exceed million million operation associate repayment swap drawing,0
109,2006-01-31,operation might generate substantial volume trading particular currency system even though change system net position currency might less limits specified ,operation might generate substantial volume trading particular currency system even though change system net position currency might less limit specify,0
110,2006-01-31,b,b,0
111,2006-01-31,swap drawing proposed foreign bank not exceeding larger  million ii  percent size swap arrangement,swap draw propose foreign bank not exceed large million ii percent size swap arrangement,0
112,2006-01-31,manager shall clear committee or subcommittee subcommittee believes consultation full committee not feasible time available chairman chairman believes consultation subcommittee not feasible time available,manager shall clear committee or subcommittee subcommittee believe consultation full committee not feasible time available chairman chairman believe consultation subcommittee not feasible time available,0
113,2006-01-31,operation would result change system overall open position foreign currencies exceeding ,operation would result change system overall open position foreign currency exceed,0
114,2006-01-31, billion since recent regular meeting committee,billion since recent regular meeting committee,0
115,2006-01-31,swap drawing proposed foreign bank exceeding larger  million ii  percent size swap arrangement,swap draw propose foreign bank exceed large million ii percent size swap arrangement,0
116,2006-01-31,manager shall also consult subcommittee chairman proposed swap drawings system operations not routine character,manager shall also consult subcommittee chairman propose swap drawing system operation not routine character,0
117,2006-01-31,among organizational matters raised committee indicated intended take future meeting relationship formal vote policy statement issued meeting,among organizational matter raise committee indicate intend take future meeting relationship formal vote policy statement issue meeting,0
118,2006-01-31,manager system open market account reported recent developments foreign exchange markets,manager system open market account report recent development foreign exchange market,0
119,2006-01-31,no open market operations foreign currencies system account period since previous meeting,no open market operation foreign currency system account period since previous meeting,0
120,2006-01-31,manager also reported developments domestic financial markets system open market transactions government securities federal agency obligations period since previous meeting,manager also report development domestic financial market system open market transaction government security federal agency obligation period since previous meeting,0
121,2006-01-31,unanimous vote committee ratified transactions,unanimous vote committee ratify transaction,0
122,2006-01-31,information reviewed meeting suggested underlying growth aggregate demand remained solid even though expansion real gdp estimated slowed fourth quarter,information review meeting suggest underlie growth aggregate demand remain solid even though expansion real gdp estimate slow fourth quarter,0
123,2006-01-31,household spending rose smartly outside autos orders shipments nondefense capital goods business sector generally quite strong,household spending rise smartly outside auto order shipment nondefense capital good business sector generally quite strong,0
124,2006-01-31,housing markets showed signs cooling starts sales remained high levels,housing market show sign cool start sale remain high level,0
125,2006-01-31,industrial production posted moderate gains even excluding hurricane related rebounds production categories private payrolls expanded firm rate average,industrial production post moderate gain even exclude hurricane related rebound production category private payroll expand firm rate average,0
126,2006-01-31,headline consumer inflation held falling consumer energy prices recently however crude oil prices climbed back high levels,headline consumer inflation held fall consumer energy price recently however crude oil price climbed back high level,0
127,2006-01-31,meanwhile core inflation moved bit low levels seen last summer,meanwhile core inflation move bit low level see last summer,0
128,2006-01-31,labor demand expanded fourth quarter private nonfarm payrolls showed large gains november followed modest gains december,labor demand expand fourth quarter private nonfarm payroll show large gain november follow modest gain december,0
129,2006-01-31,average increase two months represented sturdy job gains even accounting likely catch employment following hurricanes katrina rita,average increase two month represent sturdy job gain even accounting likely catch employment follow hurricane katrina rita,0
130,2006-01-31,several sectors including manufacturing several service groups added vigorously payrolls december total month held employment declines number sectors retail trade construction seasonal adjustment difficult time year,several sector include manufacturing several service group add vigorously payroll december total month held employment decline number sector retail trade construction seasonal adjustment difficult time year,0
131,2006-01-31,aggregate hours fell slightly december owing decrease workweek rose fourth quarter whole,aggregate hour fell slightly december owe decrease workweek rise fourth quarter whole,0
132,2006-01-31,unemployment rate edged ,unemployment rate edge,0
133,2006-01-31, percent part due labor force participation rate ticking down,percent part due labor force participation rate tick down,0
134,2006-01-31,industrial production rose notably november december boosted partial recovery effects hurricanes,industrial production rise notably november december boost partial recovery effect hurricane,0
135,2006-01-31,production mining industry includes oil gas extraction increased sharply,production mining industry include oil gas extraction increase sharply,0
136,2006-01-31,utilities output also popped december temperatures turned unseasonably cold first half month,utility output also popped december temperature turn unseasonably cold first half month,0
137,2006-01-31,abstracting effects special factors underlying activity industrial sector advanced moderately,abstract effect special factor underlie activity industrial sector advanced moderately,0
138,2006-01-31,modest production increases manufacturing categories december including high tech consumer goods business equipment outweighed production declines motor vehicles parts sector,modest production increase manufacturing category december include high tech consumer good business equipment outweigh production decline motor vehicle part sector,0
139,2006-01-31,capacity utilization rate manufacturing stood bit level one year ago near long run average,capacity utilization rate manufacturing stood bit level one year ago near long run average,0
140,2006-01-31,real personal consumption expenditures appeared increased modestly fourth quarter spending motor vehicles restrained following surge summer response manufacturers price incentives,real personal consumption expenditure appear increase modestly fourth quarter spending motor vehicle restrain follow surge summer response manufacturer price incentive,0
141,2006-01-31,outside motor vehicles consumption brisk supported job growth increases personal income decline energy prices,outside motor vehicle consumption brisk support job growth increase personal income decline energy price,0
142,2006-01-31,consumption also likely supported gains home values equity prices raised ratio household wealth disposable income relative seen earlier ,consumption also likely support gain home value equity price raise ratio household wealth disposable income relative see earlier,0
143,2006-01-31,consumer sentiment measured surveys moved december and judging preliminary reading michigan survey edged january,consumer sentiment measure survey move december and judging preliminary reading michigan survey edge january,0
144,2006-01-31,activity housing market appeared continue high levels although indications slowing,activity housing market appear continue high level although indication slow,0
145,2006-01-31,single family housing starts decreased markedly december however decline may due part unusually cold wet weather areas country,single family housing start decrease markedly december however decline may due part unusually cold wet weather area country,0
146,2006-01-31,multifamily housing starts increased december,multifamily housing start increase december,0
147,2006-01-31,sales new existing homes remained elevated levels slowed somewhat toward end year,sale new exist home remain elevate level slow somewhat toward end year,0
148,2006-01-31,moreover stock homes sale increased upper end ranges seen recent years,moreover stock home sale increase upper end range see recent year,0
149,2006-01-31,recent data mortgage applications survey measures homebuying attitudes also pointed cooling housing market,recent data mortgage application survey measure homebuying attitude also point cool housing market,0
150,2006-01-31,real outlays equipment software appeared slowed significantly fourth quarter expenditures transportation communications equipment reversed earlier sharp increases,real outlay equipment software appear slow significantly fourth quarter expenditure transportation communication equipment reverse earlier sharp increase,0
151,2006-01-31,exceptions however new orders appeared quite strong order backlogs increased several goods transportation sector,exception however new order appear quite strong order backlog increase several good transportation sector,0
152,2006-01-31,underlying fundamentals continued support gains capital spending business sector output expanded firms remained flush funds relative price declines pushed user cost capital equipment,underlie fundamental continued support gain capital spending business sector output expand firm remain flush fund relative price decline push user cost capital equipment,0
153,2006-01-31,anecdotal reports surveys also indicated businesses optimistic near term capital spending plans,anecdotal report survey also indicate business optimistic near term capital spending plan,0
154,2006-01-31,vacancy rates nonresidential properties drifted lower construction expenditures commercial manufacturing structures remained well recent peaks,vacancy rate nonresidential property drift low construction expenditure commercial manufacturing structure remain well recent peak,0
155,2006-01-31,however spending drilling mining structures continued increase strongly,however spending drilling mining structure continued increase strongly,0
156,2006-01-31,business investment real nonfarm inventories increased moderately fourth quarter boosted rapid accumulation motor vehicle inventories,business investment real nonfarm inventory increase moderately fourth quarter boost rapid accumulation motor vehicle inventory,0
157,2006-01-31,outside motor vehicles stocks continued rise slowly,outside motor vehicle stock continued rise slowly,0
158,2006-01-31,restrained growth inventories recent months suggested firms outside motor vehicle sector intentionally keeping stockbuilding low however could also reflected unanticipated increase sales supply interruptions following hurricanes last fall,restrain growth inventory recent month suggest firm outside motor vehicle sector intentionally keep stockbuilding low however could also reflect unanticipated increase sale supply interruption follow hurricane last fall,0
159,2006-01-31,said level stocks appeared reasonably well aligned demand industries,say level stock appear reasonably well align demand industry,0
160,2006-01-31,increasing october us international trade deficit narrowed somewhat november,increase october u international trade deficit narrow somewhat november,0
161,2006-01-31,reduction deficit reflected modest increase exports similar sized decrease imports owed importantly decline imports oil,reduction deficit reflect modest increase export similar size decrease import owe importantly decline import oil,0
162,2006-01-31,firm pace third quarter gdp growth foreign economies generally appeared continue fourth quarter,firm pace third quarter gdp growth foreign economy generally appear continue fourth quarter,0
163,2006-01-31,core consumer price inflation remained moderate second half last year,core consumer price inflation remain moderate second half last year,0
164,2006-01-31,core prices posted string low increases last summer held part falling motor vehicle prices,core price post string low increase last summer held part fall motor vehicle price,0
165,2006-01-31,recent months increases core prices rebounded,recent month increase core price rebound,0
166,2006-01-31,overall consumer price index edged december response substantial declines volatile energy price components,overall consumer price index edge december response substantial decline volatile energy price component,0
167,2006-01-31,however survey data pointed large increases gasoline prices january due backup crude oil prices,however survey data point large increase gasoline price january due backup crude oil price,0
168,2006-01-31,preliminary survey measures near term inflation expectations january nonetheless ticked down continuing reversal sharp increase hurricanes last fall longer term inflation expectations moved lower well,preliminary survey measure near term inflation expectation january nonetheless ticked down continue reversal sharp increase hurricane last fall longer term inflation expectation move low well,0
169,2006-01-31,input prices increased somewhat less december upward pressure previous energy price increases receded somewhat,input price increase somewhat less december upward pressure previous energy price increase recede somewhat,0
170,2006-01-31,indeed increase core intermediate producer prices year estimated considerably lower previous year,indeed increase core intermediate producer price year estimate considerably low previous year,0
171,2006-01-31,december meeting federal open market committee decided increase target level federal funds rate  basis points  percent,december meeting federal open market committee decide increase target level federal fund rate basis point percent,0
172,2006-01-31,accompanying statement committee indicated that despite elevated energy prices hurricane related disruptions expansion economic activity appeared solid,accompany statement committee indicate that despite elevate energy price hurricane related disruption expansion economic activity appear solid,0
173,2006-01-31,core inflation stayed relatively low recent months longer term inflation expectations remained contained,core inflation stayed relatively low recent month longer term inflation expectation remain contain,0
174,2006-01-31,nevertheless committee noted possible increases resource utilization well elevated energy prices potential add inflationary pressures,nevertheless committee note possible increase resource utilization well elevate energy price potential add inflationary pressure,0
175,2006-01-31,circumstances committee believed measured policy firming likely needed keep risks attainment sustainable economic growth price stability roughly balance,circumstance committee believe measure policy firm likely need keep risk attainment sustainable economic growth price stability roughly balance,0
176,2006-01-31,investors largely anticipated committee interest rate decision december meeting change portions statement characterizing policy accommodative,investor largely anticipate committee interest rate decision december meeting change portion statement characterize policy accommodative,0
177,2006-01-31,accordingly policy announcement elicited modest reactions financial markets,accordingly policy announcement elicit modest reaction financial market,0
178,2006-01-31,mixed readings economic activity inflation intermeeting period market expectations path monetary policy yields treasury coupon securities ended period little changed balance,mixed reading economic activity inflation intermeeting period market expectation path monetary policy yield treasury coupon security end period little change balance,0
179,2006-01-31,yields investment speculative grade corporate debt moved largely line treasury yields,yield investment speculative grade corporate debt move largely line treasury yield,0
180,2006-01-31,major stock price indexes rose modestly trade weighted foreign exchange value dollar depreciated slightly period,major stock price index rise modestly trade weight foreign exchange value dollar depreciate slightly period,0
181,2006-01-31,domestic nonfinancial sector debt appeared expanded somewhat slower pace fourth quarter rapid increase third quarter,domestic nonfinancial sector debt appear expand somewhat slow pace fourth quarter rapid increase third quarter,0
182,2006-01-31,household debt growth likely moderated amid hints downshift mortgage borrowing robust third quarter pace outright decline consumer credit owed part increased charge offs october spike bankruptcy filings,household debt growth likely moderate amid hint downshift mortgage borrowing robust third quarter pace outright decline consumer credit owe part increase charge offs october spike bankruptcy filing,0
183,2006-01-31,business sector debt slowed somewhat fourth quarter mainly reflecting runoff commercial paper multinational firms reported repatriated foreign earnings take advantage recently enacted tax provision,business sector debt slow somewhat fourth quarter mainly reflect runoff commercial paper multinational firm report repatriate foreign earnings take advantage recently enact tax provision,0
184,2006-01-31,expanded somewhat faster pace fourth quarter predicted historical relationships income opportunity costs,expand somewhat faster pace fourth quarter predict historical relationship income opportunity cost,0
185,2006-01-31,part monetary aggregate likely boosted payments hurricane victims federal government insurance companies,part monetary aggregate likely boost payment hurricane victim federal government insurance company,0
186,2006-01-31,staff forecast prepared meeting suggested that slow growth fourth quarter  real gdp would expand fairly robust pace first half year boosted part spending recovery activities associated hurricanes,staff forecast prepared meeting suggest that slow growth fourth quarter real gdp would expand fairly robust pace first half year boost part spending recovery activity associate hurricane,0
187,2006-01-31,thereafter real gdp growth expected moderate importantly reflecting reduced impetus consumption house price appreciation slowing residential housing expenditures,thereafter real gdp growth expect moderate importantly reflect reduce impetus consumption house price appreciation slow residential housing expenditure,0
188,2006-01-31,core pce inflation expected touch higher year  largely pass higher energy nonfuel import prices but energy prices leveling out core inflation projected drop back modestly ,core pce inflation expect touch high year largely pas high energy nonfuel import price but energy price leveling out core inflation project drop back modestly,0
189,2006-01-31,discussion economic situation outlook meeting participants noted slowing gdp growth fourth quarter  believed probably owed large part transitory factors economic growth would bounce back current quarter,discussion economic situation outlook meeting participant note slow gdp growth fourth quarter believe probably owe large part transitory factor economic growth would bounce back current quarter,0
190,2006-01-31,regard several high frequency indicators production labor markets private demand suggested greater underlying strength late reflected recent gdp data,regard several high frequency indicator production labor market private demand suggest great underlie strength late reflect recent gdp data,0
191,2006-01-31,next couple years economy seemed poised expand moderate rate neighborhood sustainable pace,next couple year economy seem poise expand moderate rate neighborhood sustainable pace,0
192,2006-01-31,participants expected core inflation move slightly near term reflecting pass increased energy commodity prices,participant expect core inflation move slightly near term reflect pas increase energy commodity price,0
193,2006-01-31,although heightened inflation pressures could also arise possible increases resource utilization outlook economic growth stability inflation expectations suggested core inflation remain contained time,although heighten inflation pressure could also arise possible increase resource utilization outlook economic growth stability inflation expectation suggest core inflation remain contain time,0
194,2006-01-31,preparation federal reserve semiannual report congress economy monetary policy members board governors presidents federal reserve banks submitted individual projections growth gdp rate unemployment core consumer price inflation years  ,preparation federal reserve semiannual report congress economy monetary policy member board governor president federal reserve bank submit individual projection growth gdp rate unemployment core consumer price inflation year,0
