,Date,Original,Corpus,Class
117,2006-12-12,discussion major sectors economy participants noted developments housing market continued weigh heavily economic activity,discussion major sector economy participant note development housing market continued weigh heavily economic activity,0
118,2006-12-12,housing starts permits new construction dropped sharply october contacts building sector reported construction firms continuing cancel options land purchases,housing start permit new construction drop sharply october contact building sector report construction firm continue cancel option land purchase,0
119,2006-12-12,however indications home sales might starting stabilize aided marked slowing rate increase house prices decline mortgage rates recent months,however indication home sale might start stabilize aid marked slow rate increase house price decline mortgage rate recent month,0
120,2006-12-12,several participants also noted range non price incentives concessions offered construction firms bolster sales,several participant also note range non price incentive concession offer construction firm bolster sale,0
121,2006-12-12,even home purchases begun level off residential investment likely fall coming quarters homebuilders sought reduce backlogs unsold homes,even home purchase begin level off residential investment likely fall come quarter homebuilder sought reduce backlog unsold home,0
122,2006-12-12,thus far adjustment activity prices housing market not appear spilled significantly consumer spending expanded steady pace recent months buoyed continued gains employment decline energy prices,thus far adjustment activity price housing market not appear spill significantly consumer spending expand steady pace recent month buoyed continued gain employment decline energy price,0
123,2006-12-12,retailers districts expected good sales holiday season although contacts package delivery trucking firms reported activity less busy usual time year,retailer district expect good sale holiday season although contact package delivery trucking firm report activity less busy usual time year,0
124,2006-12-12,participants noted downward revision bea estimate personal income second quarter year nonetheless continued anticipate consumer expenditures expand steady pace going forward,participant note downward revision bea estimate personal income second quarter year nonetheless continued anticipate consumer expenditure expand steady pace go forward,0
125,2006-12-12,growth consumer spending expected supported favorable financial conditions solid gains income employment outweighing damping effect sluggish increases housing wealth,growth consumer spending expect support favorable financial condition solid gain income employment outweigh damp effect sluggish increase housing wealth,0
126,2006-12-12,still considerable uncertainty regarding ultimate extent housing market correction meant spillovers consumption could become evident especially house prices decline significantly,still considerable uncertainty regard ultimate extent housing market correction meant spillover consumption could become evident especially house price decline significantly,0
127,2006-12-12,business investment appeared decelerated recently surveys orders data pointed relatively slow rise equipment software spending next quarters,business investment appear decelerate recently survey order data point relatively slow rise equipment software spending next quarter,0
128,2006-12-12,incoming data construction activity employment also suggested that following rapid growth earlier year increases nonresidential construction spending could moderating considerably,incoming data construction activity employment also suggest that follow rapid growth earlier year increase nonresidential construction spending could moderate considerably,0
129,2006-12-12,however weaker cast data contrasted sense optimism among business contacts,however weaker cast data contrast sense optimism among business contact,0
130,2006-12-12,moreover several participants noted contacts within construction sector reported commercial real estate activity remained robust encouraged lower vacancy rates firming rents accommodative financial conditions,moreover several participant note contact within construction sector report commercial real estate activity remain robust encourage low vacancy rate firm rent accommodative financial condition,0
131,2006-12-12,looking ahead meeting participants expected investment expand solid pace supported strong corporate balance sheets profits ready availability funding financial markets institutions factors expected offset partially restraint slower growth final sales,look ahead meeting participant expect investment expand solid pace support strong corporate balance sheet profit ready availability funding financial market institution factor expect offset partially restraint slow growth final sale,0
132,2006-12-12,recent data suggested aggregate demand rest world likely continue expand somewhat faster rate united states,recent data suggest aggregate demand rest world likely continue expand somewhat faster rate united state,0
133,2006-12-12,participants noted strength global demand recent decline foreign exchange value dollar help support increasess exports,participant note strength global demand recent decline foreign exchange value dollar help support increase export,0
134,2006-12-12,slowing pace economic expansion recent quarters evidenced business spending data also apparent measures industrial production,slow pace economic expansion recent quarter evidence business spending data also apparent measure industrial production,0
135,2006-12-12,much slowing production concentrated motor vehicle sector producers cut assemblies order reduce high inventory levels construction related sectors,much slow production concentrate motor vehicle sector producer cut assembly order reduce high inventory level construction related sector,0
136,2006-12-12,but recently inventories increased number sectors manufacturing production trimmed response,but recently inventory increase number sector manufacturing production trim response,0
137,2006-12-12,adjustments remained possible suggesting additional source downside risk economic growth near term,adjustment remain possible suggest additional source downside risk economic growth near term,0
138,2006-12-12,contrast indicators activity services sector implied continued brisk growth,contrast indicator activity service sector imply continued brisk growth,0
139,2006-12-12,participants noted recent indicators provided mixed signals strength near term activity,participant note recent indicator provide mixed signal strength near term activity,0
140,2006-12-12,solid gains employment recent quarters stood contrast softer pace economic expansion suggested spending production data,solid gain employment recent quarter stood contrast softer pace economic expansion suggest spending production data,0
141,2006-12-12,difference likely reflected lags movements activity employment implying growth employment would probably slow next quarter so,difference likely reflect lag movement activity employment imply growth employment would probably slow next quarter so,0
142,2006-12-12,participants suggested forces might work well,participant suggest force might work well,0
143,2006-12-12,growth structural labor productivity could weaker currently thought helping reconcile steady growth employment subdued advances spending output,growth structural labor productivity could weaker currently thought help reconcile steady growth employment subdue advance spending output,0
144,2006-12-12,moreover recent pace activity may stronger indicated spending production data,moreover recent pace activity may strong indicate spending production data,0
145,2006-12-12,regard possibility noted gross domestic income grown substantially quickly measured gdp past year,regard possibility note gross domestic income grown substantially quickly measure gdp past year,0
146,2006-12-12,incoming data reports businesses suggested labor market remained tight,incoming data report business suggest labor market remain tight,0
147,2006-12-12,unemployment rate moved slightly lower balance recent months many business contacts reported difficulties recruiting suitably qualified workers especially certain types professional skilled positions,unemployment rate move slightly low balance recent month many business contact report difficulty recruiting suitably qualify worker especially certain type professional skilled position,0
148,2006-12-12,downward revision estimated increases labor compensation unit labor costs earlier year eased participants concerns extent pressures labor resources,downward revision estimate increase labor compensation unit labor cost earlier year ease participant concern extent pressure labor resource,0
149,2006-12-12,nonetheless possibility tightness labor market could lead sustained upward pressure nominal labor costs viewed upside risk expected moderation inflation,nonetheless possibility tightness labor market could lead sustain upward pressure nominal labor cost view upside risk expect moderation inflation,0
150,2006-12-12,meeting participants remained concerned outlook inflation,meeting participant remain concerned outlook inflation,0
151,2006-12-12,although readings core inflation improved modestly since spring nearly participants viewed core inflation uncomfortably high stressed importance moderation,although reading core inflation improve modestly since spring nearly participant view core inflation uncomfortably high stress importance moderation,0
152,2006-12-12,participants expected core inflation edge lower time part pass higher prices energy commodities ran course moderate growth aggregate demand likely led modest easing pressures resources,participant expect core inflation edge low time part pas high price energy commodity ran course moderate growth aggregate demand likely lead modest ease pressure resource,0
153,2006-12-12,participants also highlighted impact movements prices individual components price index owners equivalent rent medical costs could near term readings core inflation,participant also highlight impact movement price individual component price index owner equivalent rent medical cost could near term reading core inflation,0
154,2006-12-12,generally participants stressed considerable uncertainty probable pace extent moderation core inflation risks around desired downward path remained upside,generally participant stress considerable uncertainty probable pace extent moderation core inflation risk around desire downward path remain upside,0
155,2006-12-12,moreover participants expressed concern failure inflation moderate expected could entail significant costs upward drift inflation expectations ensued,moreover participant express concern failure inflation moderate expect could entail significant cost upward drift inflation expectation ensue,0
156,2006-12-12,committee discussion monetary policy intermeeting period nearly members favored keeping target federal funds rate   percent meeting,committee discussion monetary policy intermeeting period nearly member favor keep target federal fund rate percent meeting,0
157,2006-12-12,outlook economic growth inflation thought changed relatively little since previous meeting,outlook economic growth inflation thought change relatively little since previous meeting,0
158,2006-12-12,nearly members felt maintaining current target likely foster moderate economic growth gradual ebbing core inflation elevated levels,nearly member felt maintain current target likely foster moderate economic growth gradual ebb core inflation elevate level,0
159,2006-12-12,several members judged subdued tone incoming indicators meant downside risks economic growth near term increased little become bit broadly based previously thought,several member judged subdue tone incoming indicator meant downside risk economic growth near term increase little become bit broadly base previously thought,0
160,2006-12-12,nonetheless members agreed risk inflation would fail moderate desired remained predominant concern,nonetheless member agree risk inflation would fail moderate desire remain predominant concern,0
161,2006-12-12,light data received intermeeting period members felt statement characterize cooling housing market substantial note recent indicators mixed,light data receive intermeeting period member felt statement characterize cool housing market substantial note recent indicator mixed,0
162,2006-12-12,committee thought statement reiterate economy seemed likely expand moderate pace also recognizing possibility measured gdp growth could somewhat uneven coming quarters,committee thought statement reiterate economy seem likely expand moderate pace also recognize possibility measure gdp growth could somewhat uneven come quarter,0
163,2006-12-12,members agreed statement continue convey inflation risks remained greatest concern additional policy firming possible,member agree statement continue convey inflation risk remain great concern additional policy firm possible,0
164,2006-12-12,one member not favor language referenced possibility additional policy firming believed that although risks inflation remained predominant concern statement emphasize policy could adjusted either direction depending evolution outlook inflation economic growth,one member not favor language reference possibility additional policy firm believe that although risk inflation remain predominant concern statement emphasize policy could adjust either direction depend evolution outlook inflation economic growth,0
165,2006-12-12,the federal open market committee seeks monetary financial conditions foster price stability promote sustainable growth output,the federal open market committee seek monetary financial condition foster price stability promote sustainable growth output,0
166,2006-12-12,long run objectives committee immediate future seeks conditions reserve markets consistent maintaining federal funds rate average around   percent,long run objective committee immediate future seek condition reserve market consistent maintain federal fund rate average around percent,0
167,2006-12-12,vote encompassed approval text inclusion statement released,vote encompass approval text inclusion statement release,0
168,2006-12-12,nonetheless committee judges inflation risks remain,nonetheless committee judge inflation risk remain,0
169,2006-12-12,extent timing additional firming may needed address risks depend evolution outlook inflation economic growth implied incoming information,extent timing additional firm may need address risk depend evolution outlook inflation economic growth imply incoming information,0
170,2006-12-12,votes action messrs,vote action messrs,0
171,2006-12-12,bernanke geithner ms bies messrs,bernanke geithner m bies messrs,0
172,2006-12-12,kohn kroszner mishkin ms pianalto messrs,kohn kroszner mishkin m pianalto messrs,0
173,2006-12-12,poole warsh ms yellen,poole warsh m yellen,0
174,2006-12-12,votes actionmr lacker,vote actionmr lacker,0
175,2006-12-12,mr lacker dissented believed tightening needed help ensure core inflation declines acceptable rate coming quarters,mr lacker dissent believe tighten need help ensure core inflation decline acceptable rate come quarter,0
176,2006-12-12,meeting participants briefly reviewed issues regarding communications next steps continuing discussion topic,meeting participant briefly review issue regard communication next step continue discussion topic,0
177,2006-12-12,next fomc meeting confirmed january    committee intended consider role economic projections forecasts play communicating information,next fomc meeting confirm january committee intend consider role economic projection forecast play communicate information,0
178,2006-12-12,meeting adjourned,meeting adjourn,0
179,2006-12-12,notation vote notation vote completed november   committee unanimously approved minutes fomc meeting held october   ,notation vote notation vote complete november committee unanimously approve minute fomc meeting held october,0
180,2006-12-12,vincent reinhart secretary,vincent reinhart secretary,0
181,2006-12-12,return top,return top,0
