,Date,Original,Corpus,Class
0,2006-10-25,meeting federal open market committee held offices board governors federal reserve system washington dc tuesday october   continued wednesday october   m,meeting federal open market committee held office board governor federal reserve system washington dc tuesday october continued wednesday october m,0
1,2006-10-25,mr hoenig ms minehan messrs,mr hoenig m minehan messrs,0
2,2006-10-25,moskow poole alternate members federal open market committee,moskow poole alternate member federal open market committee,0
3,2006-10-25,messrs,messrs,0
4,2006-10-25,fisher plosser stern presidents federal reserve banks dallas philadelphia minneapolis respectively,fisher plosser stern president federal reserve bank dallas philadelphia minneapolis respectively,0
5,2006-10-25,mr barron first vice president federal reserve bank atlanta,mr barron first vice president federal reserve bank atlanta,0
6,2006-10-25,messrs,messrs,0
7,2006-10-25,connors eisenbeis judd kamin madigan sniderman struckmeyer wilcox associate economists,connors eisenbeis judd kamin madigan sniderman struckmeyer wilcox associate economist,0
8,2006-10-25,mr kos manager system open market account,mr ko manager system open market account,0
9,2006-10-25,messrs,messrs,0
10,2006-10-25,english slifman associate directors divisions monetary affairs research statistics respectively board governors,english slifman associate director division monetary affair research statistic respectively board governor,0
11,2006-10-25,messrs,messrs,0
12,2006-10-25,gagnon wascher deputy associate directors divisions international finance research statistics respectively board governors,gagnon wascher deputy associate director division international finance research statistic respectively board governor,0
13,2006-10-25,messrs,messrs,0
14,2006-10-25,dale oliner senior advisers divisions monetary affairs research statistics respectively board governors,dale oliner senior adviser division monetary affair research statistic respectively board governor,0
15,2006-10-25,mr gross special assistant board office board members board governors,mr gross special assistant board office board member board governor,0
16,2006-10-25,mr small project manager division monetary affairs board governors,mr small project manager division monetary affair board governor,0
17,2006-10-25,ms weinbach senior economist division monetary affairs board governors,m weinbach senior economist division monetary affair board governor,0
18,2006-10-25,messrs,messrs,0
19,2006-10-25,kumasaka luecke senior financial analysts division monetary affairs board governors,kumasaka luecke senior financial analyst division monetary affair board governor,0
20,2006-10-25,ms low open market secretariat specialist division monetary affairs board governors,m low open market secretariat specialist division monetary affair board governor,0
21,2006-10-25,messrs,messrs,0
22,2006-10-25,fuhrer rosenblum executive vice presidents federal reserve banks boston dallas respectively,fuhrer rosenblum executive vice president federal reserve bank boston dallas respectively,0
23,2006-10-25,mr evans ms mester messrs,mr evans m mester messrs,0
24,2006-10-25,rasche sellon senior vice presidents federal reserve banks chicago philadelphia st louis kansas city respectively,rasche sellon senior vice president federal reserve bank chicago philadelphia st louis kansa city respectively,0
25,2006-10-25,ms mucciolo mr todd vice presidents federal reserve banks new york minneapolis respectively,m mucciolo mr todd vice president federal reserve bank new york minneapolis respectively,0
26,2006-10-25,ms mcconnell assistant vice president federal reserve bank new york,m mcconnell assistant vice president federal reserve bank new york,0
27,2006-10-25,mr hetzel senior economist federal reserve bank richmond,mr hetzel senior economist federal reserve bank richmond,0
28,2006-10-25,manager system open market account soma reported recent developments foreign exchange markets,manager system open market account soma report recent development foreign exchange market,0
29,2006-10-25,no open market operations foreign currencies system account period since previous meeting,no open market operation foreign currency system account period since previous meeting,0
30,2006-10-25,manager also reported developments domestic financial markets system open market transactions government securities federal agency obligations period since previous meeting,manager also report development domestic financial market system open market transaction government security federal agency obligation period since previous meeting,0
31,2006-10-25,unanimous vote committee ratified transactions,unanimous vote committee ratify transaction,0
32,2006-10-25,manager also discussed committee results recent review management domestic security holdings soma,manager also discuss committee result recent review management domestic security holding soma,0
33,2006-10-25,manager noted  response reduced issuance treasury securities limits adopted soma holdings individual treasury bonds notes bills ranged  percent  percent amounts outstanding,manager note response reduce issuance treasury security limit adopt soma holding individual treasury bond note bill range percent percent amount outstanding,0
34,2006-10-25,recent years limits created occasional operational complications trading desk,recent year limit create occasional operational complication trading desk,0
35,2006-10-25,meanwhile circumstances treasury securities market changed considerably manager noted intended revert previous practice applying single  percent limit across issues,meanwhile circumstance treasury security market change considerably manager note intend revert previous practice apply single percent limit across issue,0
36,2006-10-25,chairman noted president recently signed financial services regulatory relief act  among provisions gave federal reserve discretion beginning october  pay interest reserve balances reduce eliminate reserve requirements,chairman note president recently sign financial service regulatory relief act among provision give federal reserve discretion begin october pay interest reserve balance reduce eliminate reserve requirement,0
37,2006-10-25,act potentially important implications many aspects federal reserve operations chairman asked vincent reinhart director division monetary affairs form committee federal reserve system staff consider issues,act potentially important implication many aspect federal reserve operation chairman ask vincent reinhart director division monetary affair form committee federal reserve system staff consider issue,0
38,2006-10-25,information reviewed october meeting suggested economic activity increased slow pace third quarter,information review october meeting suggest economic activity increase slow pace third quarter,0
39,2006-10-25,contraction home construction remained significant drag economic activity steep reductions motor vehicle assemblies weighed growth third quarter,contraction home construction remain significant drag economic activity steep reduction motor vehicle assembly weigh growth third quarter,0
40,2006-10-25,nonetheless consumer spending business investment continued hold well,nonetheless consumer spending business investment continued hold well,0
41,2006-10-25,payroll employment extended moderate expansion average september,payroll employment extend moderate expansion average september,0
42,2006-10-25,sharp declines energy prices reduced total consumer price inflation september twelve month change core prices remained elevated relative year earlier readings,sharp decline energy price reduce total consumer price inflation september twelve month change core price remain elevate relative year earlier reading,0
43,2006-10-25,nonfarm payrolls rose modestly september larger increase august variation apparently result seasonal factors,nonfarm payroll rise modestly september large increase august variation apparently result seasonal factor,0
44,2006-10-25,september job increases service producing sectors fairly widespread led health care industry,september job increase service produce sector fairly widespread lead health care industry,0
45,2006-10-25,construction sector also added jobs lift came gains associated nonresidential building offset losses residential sector,construction sector also add job lift come gain associate nonresidential building offset loss residential sector,0
46,2006-10-25,job cutbacks retail trade manufacturing sectors continued,job cutback retail trade manufacturing sector continued,0
47,2006-10-25,aggregate hours private production nonsupervisory workers edged lower,aggregate hour private production nonsupervisory worker edge low,0
48,2006-10-25,unemployment rate ticked ,unemployment rate ticked,0
49,2006-10-25, percent august,percent august,0
50,2006-10-25,flat august industrial production declined september reflecting sizable weather related decrease output utilities fairly broad based reduction manufacturing output,flat august industrial production decline september reflect sizable weather related decrease output utility fairly broad base reduction manufacturing output,0
51,2006-10-25,declines partially offset rise output mining sector led gains crude oil extraction mined construction supplies stone sand gravel,decline partially offset rise output mining sector lead gain crude oil extraction mine construction supply stone sand gravel,0
52,2006-10-25,output motor vehicles parts fell september automakers continued trim production light trucks response bloated inventories,output motor vehicle part fell september automaker continued trim production light truck response bloat inventory,0
53,2006-10-25,output growth high technology sector softened bit september relative summer months reflecting smaller rise production semiconductors,output growth high technology sector soften bit september relative summer month reflect small rise production semiconductor,0
54,2006-10-25,computer production continued increase tepid rate output communications equipment turned noticeably decline august,computer production continued increase tepid rate output communication equipment turn noticeably decline august,0
55,2006-10-25,third quarter whole growth industrial production moderated bit relative first half year stronger output high technology sector pickup production business equipment partially offset steep contraction output motor vehicles parts slowdown mining output,third quarter whole growth industrial production moderate bit relative first half year strong output high technology sector pickup production business equipment partially offset steep contraction output motor vehicle part slowdown mining output,0
56,2006-10-25,real consumer spending appeared regain steam september lackluster august,real consumer spending appear regain steam september lackluster august,0
57,2006-10-25,although nominal retail sales fell noticeably september steep drop gasoline prices accounted decline,although nominal retail sale fell noticeably september steep drop gasoline price account decline,0
58,2006-10-25,excluding sales gasoline stations step consumer spending result faster sales motor vehicles broad based strength outlays categories goods particularly apparel,exclude sale gasoline station step consumer spending result faster sale motor vehicle broad base strength outlay category good particularly apparel,0
59,2006-10-25,real disposable income rose moderately july august pace somewhat second quarter average,real disposable income rise moderately july august pace somewhat second quarter average,0
60,2006-10-25,consumer spending continued draw support lagged effects increases household wealth past two years,consumer spending continued draw support lag effect increase household wealth past two year,0
61,2006-10-25,interest rates types household loans short long term risen year balance,interest rate type household loan short long term risen year balance,0
62,2006-10-25,latest readings consumer sentiment positive perhaps reflecting recent declines oil prices,late reading consumer sentiment positive perhaps reflect recent decline oil price,0
63,2006-10-25,personal saving rate edged august dip july,personal save rate edge august dip july,0
64,2006-10-25,residential construction activity remained weak,residential construction activity remain weak,0
65,2006-10-25,single family starts ticked september new permit issuance slid lowest level nearly five years,single family start ticked september new permit issuance slid low level nearly five year,0
66,2006-10-25,construction multifamily sector continued fluctuate within range prevailed several years,construction multifamily sector continued fluctuate within range prevail several year,0
67,2006-10-25,sales new single family homes edged august sales existing homes held steady,sale new single family home edge august sale exist home held steady,0
68,2006-10-25,pending home sales rose somewhat august noticeable drop july decline mortgage rates since july likely indicated support housing demand near term,pending home sale rise somewhat august noticeable drop july decline mortgage rate since july likely indicate support housing demand near term,0
69,2006-10-25,still overhang unsold homes remained historically high price appreciation existing homes continued slow second quarter,still overhang unsold home remain historically high price appreciation exist home continued slow second quarter,0
70,2006-10-25,real spending equipment software increased solid pace summer fundamental influences spending remained favorable part,real spending equipment software increase solid pace summer fundamental influence spending remain favorable part,0
71,2006-10-25,particular although business output recently rising slower rate corporate financial reserves remained plentiful cost high tech capital goods continued fall,particular although business output recently rise slow rate corporate financial reserve remain plentiful cost high tech capital good continued fall,0
72,2006-10-25,high tech sector real outlays communications equipment likely stabilized august surged earlier year available data suggested real computer spending picked third quarter,high tech sector real outlay communication equipment likely stabilize august surge earlier year available data suggest real computer spending picked third quarter,0
73,2006-10-25,transportation sector business purchases motor vehicles brisk late environmental protection agency regulations truck emissions scheduled take effect  likely pulled forward spending medium heavy trucks,transportation sector business purchase motor vehicle brisk late environmental protection agency regulation truck emission schedule take effect likely pull forward spending medium heavy truck,0
74,2006-10-25,outlays aircraft appeared risen somewhat third quarter extremely low second quarter level,outlay aircraft appear risen somewhat third quarter extremely low second quarter level,0
75,2006-10-25,real spending equipment high tech transportation items seemed retained considerable momentum third quarter,real spending equipment high tech transportation item seem retain considerable momentum third quarter,0
76,2006-10-25,activity nonresidential construction sector continued strengthen august,activity nonresidential construction sector continued strengthen august,0
77,2006-10-25,book value data manufacturing trade inventories available august suggested rate stockbuilding remained substantial third quarter,book value data manufacturing trade inventory available august suggest rate stockbuilding remain substantial third quarter,0
78,2006-10-25,major exception motor vehicle sector cutbacks assemblies probably began reduce inventory overhang sector,major exception motor vehicle sector cutback assembly probably begin reduce inventory overhang sector,0
79,2006-10-25,outside motor vehicle sector inventories generally appeared well aligned demand,outside motor vehicle sector inventory generally appear well align demand,0
80,2006-10-25,although survey data september showed noticeable rise share firms viewed inventories high large majority remained comfortable level,although survey data september show noticeable rise share firm view inventory high large majority remain comfortable level,0
81,2006-10-25,us international trade deficit widened another record august reflecting surge imports offset sizable jump exports,u international trade deficit widen another record august reflect surge import offset sizable jump export,0
82,2006-10-25,sharp increase imports driven importantly oil natural gas imports capital goods non oil industrial supplies particularly metals also exhibited large gains,sharp increase import driven importantly oil natural gas import capital good non oil industrial supply particularly metal also exhibit large gain,0
83,2006-10-25,imports services fell back slightly,import service fell back slightly,0
84,2006-10-25,increase exports led capital goods aircraft computers semiconductors machinery climbing briskly,increase export lead capital good aircraft computer semiconductor machinery climb briskly,0
85,2006-10-25,exports industrial supplies consumer goods also rose strongly exports services expanded modestly,export industrial supply consumer good also rise strongly export service expand modestly,0
86,2006-10-25,economic activity foreign industrial economies continued expand relatively solid pace third quarter,economic activity foreign industrial economy continued expand relatively solid pace third quarter,0
87,2006-10-25,investment spending boosted expansion japan,investment spending boost expansion japan,0
88,2006-10-25,euro area data industrial production retail sales consistent robust growth real activity,euro area data industrial production retail sale consistent robust growth real activity,0
89,2006-10-25,mixed indicators canada united kingdom suggested output growth countries remained around recent rates,mixed indicator canada united kingdom suggest output growth country remain around recent rate,0
90,2006-10-25,incoming data across emerging market economies continued point moderating solid growth economic activity third quarter,incoming data across emerge market economy continued point moderate solid growth economic activity third quarter,0
91,2006-10-25,core prices personal consumption expenditures expected risen september pace july august leaving change twelve months ending september bit higher year earlier period,core price personal consumption expenditure expect risen september pace july august leave change twelve month end september bit high year earlier period,0
92,2006-10-25,increases shelter costs accounted significant proportion pickup core inflation past year slowed considerably recent months remained well rates prevailed  ,increase shelter cost account significant proportion pickup core inflation past year slow considerably recent month remain well rate prevail,0
93,2006-10-25,price index total personal consumption expenditures estimated fallen markedly september steep decline gasoline prices bringing twelve month increase two one half year low,price index total personal consumption expenditure estimate fall markedly september steep decline gasoline price bring twelve month increase two one half year low,0
94,2006-10-25,retail gasoline prices fell especially rapidly september crude oil prices declined historically high level gasoline inventories likely led sharp narrowing margins retail gasoline prices crude oil prices,retail gasoline price fell especially rapidly september crude oil price decline historically high level gasoline inventory likely lead sharp narrow margin retail gasoline price crude oil price,0
95,2006-10-25,producer price index core intermediate materials rose slightly september increase well average monthly advance preceding twelve months reflecting drop prices chemicals high energy content,producer price index core intermediate material rise slightly september increase well average monthly advance precede twelve month reflect drop price chemical high energy content,0
96,2006-10-25,average hourly earnings increased moderately august september larger gain july,average hourly earnings increase moderately august september large gain july,0
97,2006-10-25,survey measures households year ahead inflation expectations eased substantially early october sharp drop energy prices,survey measure household year ahead inflation expectation ease substantially early october sharp drop energy price,0
98,2006-10-25,respondents longer term inflation expectations changed little remaining well within narrow range reported past year,respondent longer term inflation expectation change little remain well within narrow range report past year,0
99,2006-10-25,september meeting federal open market committee fomc decided maintain target federal funds rate   percent,september meeting federal open market committee fomc decide maintain target federal fund rate percent,0
100,2006-10-25,committee accompanying statement indicated moderation economic growth appeared continuing partly reflecting cooling housing market,committee accompany statement indicate moderation economic growth appear continue partly reflect cool housing market,0
101,2006-10-25,readings core inflation elevated high levels resource utilization prices energy commodities potential sustain inflation pressures,reading core inflation elevate high level resource utilization price energy commodity potential sustain inflation pressure,0
102,2006-10-25,however inflation pressures seemed likely moderate time reflecting reduced impetus energy prices contained inflation expectations cumulative effects monetary policy actions factors restraining aggregate demand,however inflation pressure seem likely moderate time reflect reduce impetus energy price contain inflation expectation cumulative effect monetary policy action factor restrain aggregate demand,0
103,2006-10-25,nonetheless committee judged inflation risks remained,nonetheless committee judged inflation risk remain,0
104,2006-10-25,extent timing additional firming may needed address risks would depend evolution outlook inflation economic growth implied incoming information,extent timing additional firm may need address risk would depend evolution outlook inflation economic growth imply incoming information,0
105,2006-10-25,fomc decision september meeting leave target federal funds rate unchanged largely anticipated investors policy expectations mid  beyond rose slightly,fomc decision september meeting leave target federal fund rate unchanged largely anticipate investor policy expectation mid beyond rise slightly,0
106,2006-10-25,investors subsequently revised expectations future path federal funds rate light data releases indicated weaker expected economic activity,investor subsequently revise expectation future path federal fund rate light data release indicate weaker expect economic activity,0
107,2006-10-25,however declines rolled back wake speeches fomc members release minutes september fomc meeting stronger expected economic data,however decline roll back wake speech fomc member release minute september fomc meeting strong expect economic data,0
108,2006-10-25,intermeeting period yields nominal inflation indexed treasury coupon securities rose somewhat net,intermeeting period yield nominal inflation indexed treasury coupon security rise somewhat net,0
109,2006-10-25,inflation compensation  declined modestly perhaps reflecting drop spot energy prices largely unchanged longer maturities,inflation compensation decline modestly perhaps reflect drop spot energy price largely unchanged longer maturity,0
110,2006-10-25,spreads investment grade corporate bond yields comparable maturity treasury securities held steady speculative grade corporate bonds narrowed little,spread investment grade corporate bond yield comparable maturity treasury security held steady speculative grade corporate bond narrow little,0
111,2006-10-25,broad equity indexes rose noticeably,broad equity index rise noticeably,0
112,2006-10-25,trade weighted index foreign exchange value dollar versus major currencies rose somewhat balance gains spread evenly currencies,trade weight index foreign exchange value dollar versus major currency rise somewhat balance gain spread evenly currency,0
113,2006-10-25,debt domestic nonfinancial sectors third quarter estimated expanding around second quarter pace,debt domestic nonfinancial sector third quarter estimate expand around second quarter pace,0
114,2006-10-25,business debt rose moderately bank lending businesses slowed,business debt rise moderately bank lending business slow,0
115,2006-10-25,particular bank lending finance commercial real estate activity waned august september commercial industrial loans expanding briskly many months slowed sharply september,particular bank lending finance commercial real estate activity wan august september commercial industrial loan expand briskly many month slow sharply september,0
116,2006-10-25,household sector slowing rate increase house prices appeared continued weigh expansion mortgage debt third quarter,household sector slow rate increase house price appear continued weigh expansion mortgage debt third quarter,0
117,2006-10-25,grew slowly third quarter exhibiting lagged effects earlier increases opportunity costs slow rise nominal spending,grow slowly third quarter exhibit lag effect earlier increase opportunity cost slow rise nominal spending,0
118,2006-10-25,staff forecast prepared meeting indicated growth real gdp slowed third quarter reflecting significant drag continuing contraction residential construction steep decline motor vehicle assemblies,staff forecast prepared meeting indicate growth real gdp slow third quarter reflect significant drag continue contraction residential construction steep decline motor vehicle assembly,0
