,Date,Original,Corpus,Class
0,2006-01-31,meeting federal open market committee held offices board governors federal reserve system washington dc tuesday january   m,meeting federal open market committee held office board governor federal reserve system washington dc tuesday january m,0
1,2006-01-31,mses,ms,0
2,2006-01-31,cumming minehan messrs,cumming minehan messrs,0
3,2006-01-31,moskow poole hoenig alternate members federal open market committee,moskow poole hoenig alternate member federal open market committee,0
4,2006-01-31,messrs,messrs,0
5,2006-01-31,fisher stern santomero presidents federal reserve banks dallas minneapolis philadelphia respectively,fisher stern santomero president federal reserve bank dallas minneapolis philadelphia respectively,0
6,2006-01-31,mr reinhart secretary economist ms danker deputy secretary ms smith assistant secretary mr skidmore assistant secretary mr alvarez general counsel mr baxter deputy general counsel ms johnson economist mr stockton economist,mr reinhart secretary economist m danker deputy secretary m smith assistant secretary mr skidmore assistant secretary mr alvarez general counsel mr baxter deputy general counsel m johnson economist mr stockton economist,0
7,2006-01-31,messrs,messrs,0
8,2006-01-31,connors eisenbeis judd kamin madigan sniderman struckmeyer wilcox associate economists,connors eisenbeis judd kamin madigan sniderman struckmeyer wilcox associate economist,0
9,2006-01-31,mr kos manager system open market account,mr ko manager system open market account,0
10,2006-01-31,messrs,messrs,0
11,2006-01-31,oliner slifman associate directors division research statistics board governors,oliner slifman associate director division research statistic board governor,0
12,2006-01-31,mr whitesell deputy associate director division monetary affairs board governors,mr whitesell deputy associate director division monetary affair board governor,0
13,2006-01-31,messrs,messrs,0
14,2006-01-31,english sheets assistant directors division monetary affairs international finance respectively board governors,english sheet assistant director division monetary affair international finance respectively board governor,0
15,2006-01-31,mr simpson senior adviser division research statistics board governors,mr simpson senior adviser division research statistic board governor,0
16,2006-01-31,mr small project manager division monetary affairs board governors,mr small project manager division monetary affair board governor,0
17,2006-01-31,mr chaboud mses,mr chaboud ms,0
18,2006-01-31,kusko weinbach senior economists divisions international finance research statistics monetary affairs respectively board governors,kusko weinbach senior economist division international finance research statistic monetary affair respectively board governor,0
19,2006-01-31,ms roush economist division monetary affairs board governors,m roush economist division monetary affair board governor,0
20,2006-01-31,mr luecke senior financial analyst division monetary affairs board governors,mr luecke senior financial analyst division monetary affair board governor,0
21,2006-01-31,ms low open market secretariat specialist division monetary affairs board governors,m low open market secretariat specialist division monetary affair board governor,0
22,2006-01-31,mr stone first vice president federal reserve bank philadelphia,mr stone first vice president federal reserve bank philadelphia,0
23,2006-01-31,messrs,messrs,0
24,2006-01-31,fuhrer rosenblum executive vice presidents federal reserve banks boston dallas respectively,fuhrer rosenblum executive vice president federal reserve bank boston dallas respectively,0
25,2006-01-31,messrs,messrs,0
26,2006-01-31,evans hakkio mses,evans hakkio ms,0
27,2006-01-31,mester perelmuter messrs,mester perelmuter messrs,0
28,2006-01-31,rasche rolnick steindel senior vice presidents federal reserve banks chicago kansas city philadelphia new york st louis minneapolis new york respectively,rasche rolnick steindel senior vice president federal reserve bank chicago kansa city philadelphia new york st louis minneapolis new york respectively,0
29,2006-01-31,mr hetzel senior economist federal reserve bank richmond,mr hetzel senior economist federal reserve bank richmond,0
30,2006-01-31,agenda meeting reported advices election following members alternate members federal open market committee term beginning january   received individuals executed oaths office,agenda meeting report advice election follow member alternate member federal open market committee term begin january receive individual execute oath office,0
31,2006-01-31,elected members alternate members follows,elect member alternate member follow,0
32,2006-01-31,timothy geithner president federal reserve bank new york christine cumming first vice president federal reserve bank new york alternate,timothy geithner president federal reserve bank new york christine cumming first vice president federal reserve bank new york alternate,0
33,2006-01-31,jeffrey lacker president federal reserve bank richmond cathy minehan president federal reserve bank boston alternate,jeffrey lacker president federal reserve bank richmond cathy minehan president federal reserve bank boston alternate,0
34,2006-01-31,sandra pianalto president federal reserve bank cleveland michael moskow president federal reserve bank chicago alternate,sandra pianalto president federal reserve bank cleveland michael moskow president federal reserve bank chicago alternate,0
35,2006-01-31,jack guynn president federal reserve bank atlanta william poole president federal reserve bank st louis alternate,jack guynn president federal reserve bank atlanta william poole president federal reserve bank st louis alternate,0
36,2006-01-31,janet yellen president federal reserve bank san francisco thomas hoenig president federal reserve bank kansas city alternate,janet yellen president federal reserve bank san francisco thomas hoenig president federal reserve bank kansa city alternate,0
37,2006-01-31,unanimous vote following officers federal open market committee selected serve selection successors first regularly scheduled meeting committee  understanding event discontinuance official connection board governors federal reserve bank would cease official connection federal open market committee alan greenspanchairman timothy geithnervice chairman vincent reinhartsecretary economist deborah dankerdeputy secretary david skidmoreassistant secretary michelle smithassistant secretary scott alvarezgeneral counsel thomas baxter jrdeputy general counsel karen johnsoneconomist david stocktoneconomist thomas connors robert eisenbeis john judd steven kamin brian madigan mark sniderman charles struckmeyer joseph tracy john weinberg david wilcoxassociate economists,unanimous vote follow officer federal open market committee select serve selection successor first regularly schedule meeting committee understand event discontinuance official connection board governor federal reserve bank would cease official connection federal open market committee alan greenspanchairman timothy geithnervice chairman vincent reinhartsecretary economist deborah dankerdeputy secretary david skidmoreassistant secretary michelle smithassistant secretary scott alvarezgeneral counsel thomas baxter jrdeputy general counsel karen johnsoneconomist david stocktoneconomist thomas connors robert eisenbeis john judd steven kamin brian madigan mark sniderman charles struckmeyer joseph tracy john weinberg david wilcoxassociate economist,0
38,2006-01-31,alan greenspan elected serve remainder day,alan greenspan elect serve remainder day,0
39,2006-01-31,addition agreed committee would conduct notation vote upon swearing new chairman board governors elect alan greenspan successor chairman committee,addition agree committee would conduct notation vote upon swear new chairman board governor elect alan greenspan successor chairman committee,0
40,2006-01-31,unanimous vote deborah danker successor deputy secretary elected serve chief freedom information act officer comply executive order issued december   requires federal agencies take certain actions relating foia activities,unanimous vote deborah danker successor deputy secretary elect serve chief freedom information act officer comply executive order issue december require federal agency take certain action relate foia activity,0
41,2006-01-31,unanimous vote committee amended program security fomc information primarily reflect incorporation board new rules access confidential information non citizens,unanimous vote committee amend program security fomc information primarily reflect incorporation board new rule access confidential information non citizen,0
42,2006-01-31,unanimous vote federal reserve bank new york selected execute transactions system open market,unanimous vote federal reserve bank new york select execute transaction system open market,0
43,2006-01-31,unanimous vote dino kos selected serve pleasure committee manager system open market account understanding selection subject satisfactory federal reserve bank new york,unanimous vote dino ko select serve pleasure committee manager system open market account understand selection subject satisfactory federal reserve bank new york,0
44,2006-01-31,unanimous vote authorization domestic open market operations reaffirmed form shown below,unanimous vote authorization domestic open market operation reaffirm form show below,0
45,2006-01-31,authorization domestic open market operations reaffirmed january  ,authorization domestic open market operation reaffirm january,0
46,2006-01-31,federal open market committee authorizes directs federal reserve bank new york extent necessary carry recent domestic policy directive adopted meeting committee,federal open market committee authorizes directs federal reserve bank new york extent necessary carry recent domestic policy directive adopt meeting committee,0
47,2006-01-31,buy sells government securities including securities federal financing bank securities direct obligations of fully guaranteed principal interest by agency united states open market securities dealers foreign international accounts maintained federal reserve bank new york cash regular deferred delivery basis system open market account market prices and account exchange maturings government federal agency securities treasury individual agencies allow mature without replacement,buy sell government security include security federal financing bank security direct obligation of fully guaranteed principal interest by agency united state open market security dealer foreign international account maintain federal reserve bank new york cash regular defer delivery basis system open market account market price and account exchange maturings government federal agency security treasury individual agency allow mature without replacement,0
48,2006-01-31,buys government securities obligations direct obligations of fully guaranteed principal interest by agency united states dealers account federal reserve bank new york agreements repurchase securities obligations  business days less rates that unless otherwise expressly authorized committee shall determined competitive bidding applying reasonable limitations volume agreements individual dealers provided event government securities agency issues covered agreement not repurchased dealer pursuant agreement renewal thereof shall sold market transferred system open market account,buy government security obligation direct obligation of fully guaranteed principal interest by agency united state dealer account federal reserve bank new york agreement repurchase security obligation business day less rate that unless otherwise expressly authorize committee shall determine competitive bidding apply reasonable limitation volume agreement individual dealer provide event government security agency issue cover agreement not repurchase dealer pursuant agreement renewal thereof shall sell market transfer system open market account,0
49,2006-01-31,sells government securities obligations direct obligations of fully guaranteed principal interest by agency united states dealers system open market account agreements resale dealers securities obligations  business days less rates that unless otherwise expressly authorized committee shall determined competitive bidding applying reasonable limitations volume agreements individual dealers,sell government security obligation direct obligation of fully guaranteed principal interest by agency united state dealer system open market account agreement resale dealer security obligation business day less rate that unless otherwise expressly authorize committee shall determine competitive bidding apply reasonable limitation volume agreement individual dealer,0
50,2006-01-31,order ensure effective conduct open market operations federal open market committee authorizes federal reserve bank new york lend overnight basiss government securities held system open market account dealers rates shall determined competitive bidding,order ensure effective conduct open market operation federal open market committee authorizes federal reserve bank new york lend overnight basis government security held system open market account dealer rate shall determine competitive bidding,0
51,2006-01-31,federal reserve bank new york shall set minimum lending fee consistent objectives program apply reasonable limitations total amount specific issue may auctioned amount securities dealer may borrow,federal reserve bank new york shall set minimum lending fee consistent objective program apply reasonable limitation total amount specific issue may auction amount security dealer may borrow,0
52,2006-01-31,federal reserve bank new york may reject bids could facilitate dealer ability control single issue determined solely federal reserve bank new york,federal reserve bank new york may reject bid could facilitate dealer ability control single issue determine solely federal reserve bank new york,0
53,2006-01-31,order ensure effective conduct open market operations assisting provision short term investments foreign international accounts maintained federal reserve bank new york accounts maintained federal reserve bank new york fiscal agent united states pursuant section  federal reserve act federal open market committee authorizes directs federal reserve bank new york system open market account sells government securities accounts bases set forth paragrapha agreements providing resale accounts securities  business days less terms comparable available transactions market new york bank account appropriate undertake dealers subject conditions imposed purchases sales securities paragraphb repurchase agreementss government agency securities arrange corresponding sale repurchase agreements account foreign international fiscal agency accounts maintained bank,order ensure effective conduct open market operation assist provision short term investment foreign international account maintain federal reserve bank new york account maintain federal reserve bank new york fiscal agent united state pursuant section federal reserve act federal open market committee authorizes directs federal reserve bank new york system open market account sell government security account base set forth paragrapha agreement provide resale account security business day less term comparable available transaction market new york bank account appropriate undertake dealer subject condition impose purchase sale security paragraphb repurchase agreement government agency security arrange correspond sale repurchase agreement account foreign international fiscal agency account maintain bank,0
54,2006-01-31,transactions undertaken accounts provisions paragraph may provide service fee appropriate,transaction undertaken account provision paragraph may provide service fee appropriate,0
55,2006-01-31,execution committee decision regarding policy intermeeting period committee authorizes directs federal reserve bank new york upon instruction chairman committee adjust somewhat exceptional circumstances degree pressure reserve positions hence intended federal funds rate,execution committee decision regard policy intermeeting period committee authorizes directs federal reserve bank new york upon instruction chairman committee adjust somewhat exceptional circumstance degree pressure reserve position hence intend federal fund rate,0
56,2006-01-31,adjustment shall made context committee discussion decision recent meeting committee long run objectives price stability sustainable economic growth shall based economic financial monetary developments intermeeting period,adjustment shall make context committee discussion decision recent meeting committee long run objective price stability sustainable economic growth shall base economic financial monetary development intermeeting period,0
57,2006-01-31,consistent committee practice chairman feasible consult committee making adjustment,consistent committee practice chairman feasible consult committee make adjustment,0
58,2006-01-31,mr lacker dissenting committee approved authorization foreign currency operations amendment paragraph  clarifies language permissible investment activities foreign portfolio brings language alignment present authorization domestic portfolio,mr lacker dissent committee approve authorization foreign currency operation amendment paragraph clarifies language permissible investment activity foreign portfolio brings language alignment present authorization domestic portfolio,0
59,2006-01-31,accordingly authorization foreign currency operations adopted effective january   shown below,accordingly authorization foreign currency operation adopt effective january show below,0
60,2006-01-31,authorization foreign currency operations amended january  ,authorization foreign currency operation amend january,0
61,2006-01-31,federal open market committee authorizes directs federal reserve bank new york system open market account extent necessary carry committee foreign currency directive express authorizations committee pursuant thereto conformity procedural instructions committee may issue time time,federal open market committee authorizes directs federal reserve bank new york system open market account extent necessary carry committee foreign currency directive express authorization committee pursuant thereto conformity procedural instruction committee may issue time time,0
62,2006-01-31,changes terms existing swap arrangements proposed terms new arrangements may authorized shall referred review approval committee,change term exist swap arrangement propose term new arrangement may authorize shall refer review approval committee,0
63,2006-01-31,transactions foreign currencies undertaken paragraph ,transaction foreign currency undertaken paragraph,0
64,2006-01-31,a,a,0
65,2006-01-31,shall unless otherwise expressly authorized committee prevailing market rates,shall unless otherwise expressly authorize committee prevail market rate,0
66,2006-01-31,purpose providing investment return system holdings foreign currencies purpose adjusting interest rates paid received connection swap drawings transactions foreign central banks may undertaken non market exchange rates,purpose provide investment return system holding foreign currency purpose adjust interest rate paid receive connection swap drawing transaction foreign central bank may undertaken non market exchange rate,0
67,2006-01-31,shall normal practice arrange foreign central banks coordination foreign currency transactions,shall normal practice arrange foreign central bank coordination foreign currency transaction,0
68,2006-01-31,making operating arrangements foreign central banks system holdings foreign currencies federal reserve bank new york shall not commit maintain specific balance unless authorized federal open market committee,make operating arrangement foreign central bank system holding foreign currency federal reserve bank new york shall not commit maintain specific balance unless authorize federal open market committee,0
69,2006-01-31,agreements understandings concerning administration accounts maintained federal reserve bank new york foreign banks designated board governors section ,agreement understanding concern administration account maintain federal reserve bank new york foreign bank designate board governor section,0
70,2006-01-31, regulation shall referred review approval committee,regulation shall refer review approval committee,0
71,2006-01-31,foreign currency holdings shall invested ensure adequate liquidity maintained meet anticipated needs currency portfolio shall generally average duration no  months calculated macaulay duration,foreign currency holding shall invest ensure adequate liquidity maintain meet anticipate need currency portfolio shall generally average duration no month calculate macaulay duration,0
72,2006-01-31,investments may include buying selling outright obligations of fully guaranteed principal interest by foreign government agency thereof buying securities agreements repurchase securities selling securities agreements resale securities holding various time deposit accounts foreign institutions,investment may include buying sell outright obligation of fully guaranteed principal interest by foreign government agency thereof buying security agreement repurchase security sell security agreement resale security hold various time deposit account foreign institution,0
73,2006-01-31,addition appropriate connection arrangements provide investment facilities foreign currency holdings us government securities may purchased foreign central banks agreements repurchase securities within  calendar days,addition appropriate connection arrangement provide investment facility foreign currency holding u government security may purchase foreign central bank agreement repurchase security within calendar day,0
74,2006-01-31,operations undertaken pursuant preceding paragraphs shall reported promptly foreign currency subcommittee committee,operation undertaken pursuant precede paragraph shall report promptly foreign currency subcommittee committee,0
75,2006-01-31,foreign currency subcommittee consists chairman vice chairman committee vice chairman board governors member board chairman may designate or absence members board serving subcommittee board members designated chairman alternates absence vice chairman committee alternate,foreign currency subcommittee consists chairman vice chairman committee vice chairman board governor member board chairman may designate or absence member board serve subcommittee board member designate chairman alternate absence vice chairman committee alternate,0
76,2006-01-31,meetings subcommittee shall called request member request manager system open market account manager purposes reviewing recent contemplated operations consulting manager matters relating responsibilities,meeting subcommittee shall call request member request manager system open market account manager purpose review recent contemplate operation consult manager matter relate responsibility,0
77,2006-01-31,request member subcommittee questions arising reviews consultations shall referred determination federal open market committee,request member subcommittee question arise review consultation shall refer determination federal open market committee,0
78,2006-01-31,chairman authorized,chairman authorize,0
79,2006-01-31,approval committee enter needed agreement understanding secretary treasury division responsibility foreign currency operations system treasury,approval committee enter need agreement understand secretary treasury division responsibility foreign currency operation system treasury,0
80,2006-01-31,keep secretary treasury fully advised concerning system foreign currency operations consult secretary policy matters relating foreign currency operations,keep secretary treasury fully advise concern system foreign currency operation consult secretary policy matter relate foreign currency operation,0
81,2006-01-31,time time transmit appropriate reports information national advisory council international monetary financial policies,time time transmit appropriate report information national advisory council international monetary financial policy,0
82,2006-01-31,staff officers committee authorized transmit pertinent information system foreign currency operations appropriate officials treasury department,staff officer committee authorize transmit pertinent information system foreign currency operation appropriate official treasury department,0
83,2006-01-31,federal reserve banks shall participate foreign currency operations system account accordance paragraph board governors statement procedure respect foreign relationships federal reserve banks dated january  ,federal reserve bank shall participate foreign currency operation system account accordance paragraph board governor statement procedure respect foreign relationship federal reserve bank date january,0
84,2006-01-31,mr lacker dissenting foreign currency directive reaffirmed form shown below,mr lacker dissent foreign currency directive reaffirm form show below,0
85,2006-01-31,foreign currency directive reaffirmed january  ,foreign currency directive reaffirm january,0
86,2006-01-31,system operations foreign currencies shall generally directed countering disorderly market conditions provided market exchange ratess dollar reflect actions behavior consistent imf article iv section ,system operation foreign currency shall generally direct counter disorderly market condition provide market exchange rates dollar reflect action behavior consistent imf article iv section,0
87,2006-01-31,achieve end system shall,achieve end system shall,0
88,2006-01-31,undertake spot forward purchases sales foreign exchange,undertake spot forward purchase sale foreign exchange,0
