,Date,Original,Corpus,Class
0,2006-12-12,meeting federal open market committee held offices board governors federal reserve system washington dc tuesday december   m,meeting federal open market committee held office board governor federal reserve system washington dc tuesday december m,0
1,2006-12-12,ms cumming mr hoenig ms minehan messrs,m cumming mr hoenig m minehan messrs,0
2,2006-12-12,moskow poole alternate members federal open market committee,moskow poole alternate member federal open market committee,0
3,2006-12-12,messrs,messrs,0
4,2006-12-12,fisher plosser stern presidents federal reserve banks dallas philadelphia minneapolis respectively,fisher plosser stern president federal reserve bank dallas philadelphia minneapolis respectively,0
5,2006-12-12,mr barron first vice president federal reserve bank atlanta,mr barron first vice president federal reserve bank atlanta,0
6,2006-12-12,messrs,messrs,0
7,2006-12-12,connors eisenbeis kamin madigan sniderman struckmeyer weinberg wilcox associate economists,connors eisenbeis kamin madigan sniderman struckmeyer weinberg wilcox associate economist,0
8,2006-12-12,mr kos manager system open market account,mr ko manager system open market account,0
9,2006-12-12,messrs,messrs,0
10,2006-12-12,clouse english associate directors division monetary affairs board governors,clouse english associate director division monetary affair board governor,0
11,2006-12-12,ms liang mr slifman associate directors division research statistics board governors,m liang mr slifman associate director division research statistic board governor,0
12,2006-12-12,messrs,messrs,0
13,2006-12-12,gagnon wascher deputy associate directors divisions international finance research statistics respectively board governors,gagnon wascher deputy associate director division international finance research statistic respectively board governor,0
14,2006-12-12,mr dale senior adviser division monetary affairs board governors,mr dale senior adviser division monetary affair board governor,0
15,2006-12-12,mr gross special assistant board office board members board governors,mr gross special assistant board office board member board governor,0
16,2006-12-12,mr luecke senior financial analyst division monetary affairs board governors,mr luecke senior financial analyst division monetary affair board governor,0
17,2006-12-12,mr driscoll economist division monetary affairs board governors,mr driscoll economist division monetary affair board governor,0
18,2006-12-12,ms low open market secretariat specialist division monetary affairs board governors,m low open market secretariat specialist division monetary affair board governor,0
19,2006-12-12,mr rasdall first vice president federal reserve bank kansas city,mr rasdall first vice president federal reserve bank kansa city,0
20,2006-12-12,mr rosenblum executive vice president federal reserve bank dallas,mr rosenblum executive vice president federal reserve bank dallas,0
21,2006-12-12,mr hakkio mses,mr hakkio ms,0
22,2006-12-12,mester perelmuter messrs,mester perelmuter messrs,0
23,2006-12-12,rasche rolnick williams senior vice presidents federal reserve banks kansas city philadelphia new york st louis minneapolis san francisco respectively,rasche rolnick williams senior vice president federal reserve bank kansa city philadelphia new york st louis minneapolis san francisco respectively,0
24,2006-12-12,messrs,messrs,0
25,2006-12-12,kahn sullivan vice presidents federal reserve banks new york chicago respectively,kahn sullivan vice president federal reserve bank new york chicago respectively,0
26,2006-12-12,mr olivei senior economist federal reserve bank boston,mr olivei senior economist federal reserve bank boston,0
27,2006-12-12,manager system open market account soma reported recent developments foreign exchange markets,manager system open market account soma report recent development foreign exchange market,0
28,2006-12-12,no open market operations foreign currencies system account period since previous meeting,no open market operation foreign currency system account period since previous meeting,0
29,2006-12-12,manager also reported developments domestic financial markets system open market transactions government securities federal agency obligations period since previous meeting,manager also report development domestic financial market system open market transaction government security federal agency obligation period since previous meeting,0
30,2006-12-12,unanimous vote committee ratified transactions,unanimous vote committee ratify transaction,0
31,2006-12-12,information reviewed december meeting suggested economic activity increasing subdued rate second half year,information review december meeting suggest economic activity increase subdue rate second half year,0
32,2006-12-12,contraction homebuilding continuing restrain overall activity step motor vehicle output held industrial production,contraction homebuilding continue restrain overall activity step motor vehicle output held industrial production,0
33,2006-12-12,contrast consumer spending business investment increasing moderate rate payroll employment expanded solidly november,contrast consumer spending business investment increase moderate rate payroll employment expand solidly november,0
34,2006-12-12,additional sharp declines energy prices reduced total consumer price inflation october twelve month change core prices remained year earlier level,additional sharp decline energy price reduce total consumer price inflation october twelve month change core price remain year earlier level,0
35,2006-12-12,indicators labor market generally strong november,indicator labor market generally strong november,0
36,2006-12-12,nonfarm payrolls increased solid pace revisions previous estimates showed larger gain balance preceding two months,nonfarm payroll increase solid pace revision previous estimate show large gain balance precede two month,0
37,2006-12-12,employment manufacturing construction industries fell november hiring continued brisk professional nonbusiness service industries,employment manufacturing construction industry fell november hire continued brisk professional nonbusiness service industry,0
38,2006-12-12,aggregate weekly hours private production nonsupervisory workers edged up,aggregate weekly hour private production nonsupervisory worker edge up,0
39,2006-12-12,unemployment rate fallen ,unemployment rate fall,0
40,2006-12-12, percent october ticked back ,percent october ticked back,0
41,2006-12-12, percent november remaining average ,percent november remain average,0
42,2006-12-12, percent first three quarters year,percent first three quarter year,0
43,2006-12-12,industrial production ip declined september rose slightly october,industrial production ip decline september rise slightly october,0
44,2006-12-12,october total industrial production boosted weather related rebound electricity generation output mining sector posted sizable gain crude oil extraction alaska returned full production following pipeline repairs,october total industrial production boost weather related rebound electricity generation output mining sector post sizable gain crude oil extraction alaska return full production follow pipeline repair,0
45,2006-12-12,manufacturing output fell months partly cutbacks motor vehicle production vehicle makers pared elevated inventories light trucks,manufacturing output fell month partly cutback motor vehicle production vehicle maker par elevate inventory light truck,0
46,2006-12-12,although less pronounced motor vehicle sector recent softness factory output also apparent number sectors,although less pronounce motor vehicle sector recent softness factory output also apparent number sector,0
47,2006-12-12,notable exception production high tech industries posted another solid increase october reflecting pickup computer output rise semiconductor production attributable rollout new generation microprocessors,notable exception production high tech industry post another solid increase october reflect pickup computer output rise semiconductor production attributable rollout new generation microprocessor,0
48,2006-12-12,national income product accounts third quarter incorporated estimate bureau economic analysis bea gross output new motor vehicles increased rapid pace third quarter sharp contrast drop ip index motor vehicles including parts production period,national income product account third quarter incorporate estimate bureau economic analysis bea gross output new motor vehicle increase rapid pace third quarter sharp contrast drop ip index motor vehicle include part production period,0
49,2006-12-12,much difference could attributed bea method inferring motor vehicle output separate data sales net international trade changes inventories rather measuring output directly using data production,much difference could attribute bea method infer motor vehicle output separate data sale net international trade change inventory rather measure output directly use data production,0
50,2006-12-12,addition large drop producer price index light trucks third quarter resulted jump bea implied unit values light trucks inventory,addition large drop producer price index light truck third quarter result jump bea imply unit value light truck inventory,0
51,2006-12-12,staff view measurement issues likely caused overstatement rate increase real gdp third quarter gradual unwinding effects would probably lead understatement real gdp growth next several quarters,staff view measurement issue likely cause overstatement rate increase real gdp third quarter gradual unwind effect would probably lead understatement real gdp growth next several quarter,0
52,2006-12-12,real consumer spending increased strongly october modest gain september,real consumer spending increase strongly october modest gain september,0
53,2006-12-12,although purchases motor vehicles weakened october outlays broad range categories goods including gasoline food apparel rose briskly,although purchase motor vehicle weaken october outlay broad range category good include gasoline food apparel rise briskly,0
54,2006-12-12,spurred sharp declines consumer energy prices real disposable income also increased rapidly september october,spur sharp decline consumer energy price real disposable income also increase rapidly september october,0
55,2006-12-12,despite deceleration house prices ratio household wealth disposable income remained well historical average buoyed robust gains stock market,despite deceleration house price ratio household wealth disposable income remain well historical average buoyed robust gain stock market,0
56,2006-12-12,readings consumer sentiment edged november early december stayed levels seen summer,reading consumer sentiment edge november early december stayed level see summer,0
57,2006-12-12,residential construction activity continued weak,residential construction activity continued weak,0
58,2006-12-12,single family housing starts dropped substantially october slight increase september new permit issuance fell nearly lowest level past ten years,single family housing start drop substantially october slight increase september new permit issuance fell nearly low level past ten year,0
59,2006-12-12,construction much smaller multifamily sector continued fluctuate within range prevailed past several years,construction much small multifamily sector continued fluctuate within range prevail past several year,0
60,2006-12-12,inventories unsold homes remained high october bit lower preceding months,inventory unsold home remain high october bit low precede month,0
61,2006-12-12,sales new existing homes showed tentative signs stabilizing although levels well mid  peaks,sale new exist home show tentative sign stabilize although level well mid peak,0
62,2006-12-12,price appreciation existing homes continued slow third quarter price measures showed outright declines,price appreciation exist home continued slow third quarter price measure show outright decline,0
63,2006-12-12,real spending equipment software continued increase solid pace third quarter supported strong corporate cash positions low cost capital,real spending equipment software continued increase solid pace third quarter support strong corporate cash position low cost capital,0
64,2006-12-12,early indicators fourth quarter including survey measures business conditions suggested slowdown spending part reflecting deceleration business output,early indicator fourth quarter include survey measure business condition suggest slowdown spending part reflect deceleration business output,0
65,2006-12-12,business purchases motor vehicles likely continue boosted increase spending advance upcoming change regulations truck engines environmental protection agency,business purchase motor vehicle likely continue boost increase spending advance upcoming change regulation truck engine environmental protection agency,0
66,2006-12-12,although spending high tech capital goods software expanded robust pace third quarter data new orders shipments october pointed moderate growth fourth quarter,although spending high tech capital good software expand robust pace third quarter data new order shipment october point moderate growth fourth quarter,0
67,2006-12-12,growth nonresidential construction spending appeared slowed rapid rate earlier year responding part still high vacancy rates office industrial categories,growth nonresidential construction spending appear slow rapid rate earlier year respond part still high vacancy rate office industrial category,0
68,2006-12-12,number natural gas petroleum drilling rigs operation moved down balance since september response moderation energy prices,number natural gas petroleum drilling rig operation move down balance since september response moderation energy price,0
69,2006-12-12,unit stocks light motor vehicles dropped third quarter,unit stock light motor vehicle drop third quarter,0
70,2006-12-12,outside motor vehicle sector real nonfarm inventories edged up ratio book value inventories sales manufacturing trade sectors rose september levels last seen mid ,outside motor vehicle sector real nonfarm inventory edge up ratio book value inventory sale manufacturing trade sector rise september level last see mid,0
71,2006-12-12,inventory imbalances appeared widespread months earlier although business surveys november indicated large majority firms perceived customers inventories remained comfortable levels,inventory imbalance appear widespread month earlier although business survey november indicate large majority firm perceive customer inventory remain comfortable level,0
72,2006-12-12,us international trade deficit declined september record level august,u international trade deficit decline september record level august,0
73,2006-12-12,narrowing primarily reflected sharp falloff value imported oil although non oil imports including industrial supplies capital goods automotive products also declined,narrow primarily reflect sharp falloff value import oil although non oil import include industrial supply capital good automotive product also decline,0
74,2006-12-12,export growth september led aircraft industrial supplies exports automotive products consumer goods semiconductors fell,export growth september lead aircraft industrial supply export automotive product consumer good semiconductor fell,0
75,2006-12-12,trade deficit shrank bit october,trade deficit shrank bit october,0
76,2006-12-12,economic activity advanced foreign economies rose moderate rate third quarter,economic activity advanced foreign economy rise moderate rate third quarter,0
77,2006-12-12,expansion real activity euro area although slower staff expected supported strong domestic demand,expansion real activity euro area although slow staff expect support strong domestic demand,0
78,2006-12-12,canada real gdp growth dragged weakness inventories government spending slumping private consumption weighed growth japan,canada real gdp growth drag weakness inventory government spending slump private consumption weigh growth japan,0
79,2006-12-12,uk economy buoyed strong investment continued expand solidly,uk economy buoyed strong investment continued expand solidly,0
80,2006-12-12,recent economic indicators developing economies somewhat mixed suggested generally brisk growth third quarter,recent economic indicator develop economy somewhat mixed suggest generally brisk growth third quarter,0
81,2006-12-12,overall price index personal consumption expenditures fell september october reflecting sharp declines energy prices months declines left change index twelve months ending october substantially lower preceding twelve month period,overall price index personal consumption expenditure fell september october reflect sharp decline energy price month decline left change index twelve month end october substantially low precede twelve month period,0
82,2006-12-12,contrast change core price index personal consumption expenditures twelve months ending october still somewhat higher year earlier largely reflecting acceleration shelter costs period,contrast change core price index personal consumption expenditure twelve month end october still somewhat high year earlier largely reflect acceleration shelter cost period,0
83,2006-12-12,producer price index core intermediate materials flat october,producer price index core intermediate material flat october,0
84,2006-12-12,increases average hourly earnings moderate recent months compensation per hour nonfarm business sector appeared risen subdued rate third quarter,increase average hourly earnings moderate recent month compensation per hour nonfarm business sector appear risen subdue rate third quarter,0
85,2006-12-12,estimated increase hourly compensation second quarter revised substantially hourly compensation estimated declined second quarter following sharp gain recorded first quarter,estimate increase hourly compensation second quarter revise substantially hourly compensation estimate decline second quarter follow sharp gain record first quarter,0
86,2006-12-12,uneven pattern suggested surge hourly compensation first quarter largely driven transitory factors,uneven pattern suggest surge hourly compensation first quarter largely driven transitory factor,0
87,2006-12-12,hourly compensation private industry workers measured employment cost index increased somewhat faster rate three months ending september preceding quarters,hourly compensation private industry worker measure employment cost index increase somewhat faster rate three month end september precede quarter,0
88,2006-12-12,october meeting federal open market committee fomc decided maintain target federal funds rate   percent,october meeting federal open market committee fomc decide maintain target federal fund rate percent,0
89,2006-12-12,committee accompanying statement indicated economic growth slowed course year partly reflecting cooling housing market,committee accompany statement indicate economic growth slow course year partly reflect cool housing market,0
90,2006-12-12,going forward economy seemed likely expand moderate pace,go forward economy seem likely expand moderate pace,0
91,2006-12-12,readings core inflation elevated high level resource utilization potential sustain inflation pressures,reading core inflation elevate high level resource utilization potential sustain inflation pressure,0
92,2006-12-12,however inflation pressures seemed likely moderate time reflecting reduced impetus energy prices contained inflation expectations cumulative effects monetary policy actions factors restraining aggregate demand,however inflation pressure seem likely moderate time reflect reduce impetus energy price contain inflation expectation cumulative effect monetary policy action factor restrain aggregate demand,0
93,2006-12-12,nonetheless committee judged inflation risks remained,nonetheless committee judged inflation risk remain,0
94,2006-12-12,extent timing additional firming might needed address risks would depend evolution outlook inflation economic growth implied incoming information,extent timing additional firm might need address risk would depend evolution outlook inflation economic growth imply incoming information,0
95,2006-12-12,investors largely anticipated fomc decision october meeting leave target federal funds rate unchanged make modest changes accompanying policy statement,investor largely anticipate fomc decision october meeting leave target federal fund rate unchanged make modest change accompany policy statement,0
96,2006-12-12,result announcement decision elicited little market reaction subsequent publication minutes meeting,result announcement decision elicit little market reaction subsequent publication minute meeting,0
97,2006-12-12,however somewhat weaker anticipated economic data intermeeting period apparently led softening investors perception economic outlook,however somewhat weaker anticipate economic data intermeeting period apparently lead soften investor perception economic outlook,0
98,2006-12-12,result likely pace extent policy easing expected investors increased yields nominal inflation indexed treasury coupon securities fell,result likely pace extent policy ease expect investor increase yield nominal inflation indexed treasury coupon security fell,0
99,2006-12-12,inflation compensation measures little changed,inflation compensation measure little change,0
100,2006-12-12,spreads investment grade corporate bond yields comparable maturity treasury securities remained unchanged speculative grade corporate bonds rose bit,spread investment grade corporate bond yield comparable maturity treasury security remain unchanged speculative grade corporate bond rise bit,0
101,2006-12-12,broad equity indexes showed solid gains,broad equity index show solid gain,0
102,2006-12-12,foreign exchange value dollar major currencies fell net intermeeting period pronounced declines euro sterling,foreign exchange value dollar major currency fell net intermeeting period pronounce decline euro sterling,0
103,2006-12-12,debt domestic nonfinancial sectors third quarter expanded around second quarter pace,debt domestic nonfinancial sector third quarter expand around second quarter pace,0
104,2006-12-12,business debt rose slightly slowly second quarter part reflecting reduced borrowing bond commercial paper markets,business debt rise slightly slowly second quarter part reflect reduce borrowing bond commercial paper market,0
105,2006-12-12,household sector mortgage debt increased lowest pace since late reflecting continued deceleration house prices,household sector mortgage debt increase low pace since late reflect continued deceleration house price,0
106,2006-12-12,rose strongly october november preceding months,rise strongly october november precede month,0
107,2006-12-12,staff forecast prepared meeting indicated growth economic activity slowed pace economy long run potential second half  partly result ongoing adjustment housing sector,staff forecast prepared meeting indicate growth economic activity slow pace economy long run potential second half partly result ongoing adjustment housing sector,0
108,2006-12-12,rate increase real gdp expected pick gradually drag contraction residential construction diminished returning towards end  rate close staff estimate potential output growth,rate increase real gdp expect pick gradually drag contraction residential construction diminish return towards end rate close staff estimate potential output growth,0
109,2006-12-12,core inflation anticipated edge   response waning effects higher energy import prices step rent increases emergence small amount slack economy,core inflation anticipate edge response wan effect high energy import price step rent increase emergence small amount slack economy,0
110,2006-12-12,discussion economic situation outlook meeting participants noted assessments medium term prospects economic growth inflation little changed previous meeting,discussion economic situation outlook meeting participant note assessment medium term prospect economic growth inflation little change previous meeting,0
111,2006-12-12,incoming indicators near term activity mixed spending production data pointing subdued picture suggested still solid labor market data,incoming indicator near term activity mixed spending production data point subdue picture suggest still solid labor market data,0
112,2006-12-12,many participants judged economic activity second half year probably touch softer expected time october meeting,many participant judged economic activity second half year probably touch softer expect time october meeting,0
113,2006-12-12,looking next year so participants continued expect economy expand rate close little economy long run sustainable pace,look next year so participant continued expect economy expand rate close little economy long run sustainable pace,0
114,2006-12-12,ongoing adjustment housing market likely damp economic growth near term effect expected dissipate spending categories looked set expand reasonably good pace,ongoing adjustment housing market likely damp economic growth near term effect expect dissipate spending category look set expand reasonably good pace,0
115,2006-12-12,although readings core inflation improved modestly since spring price pressures not yet viewed convincingly downward trend,although reading core inflation improve modestly since spring price pressure not yet view convincingly downward trend,0
116,2006-12-12,participants expected core inflation moderate slowly time stressed risks inflation outlook remained upside,participant expect core inflation moderate slowly time stress risk inflation outlook remain upside,0
