,Date,Original,Corpus,Class
129,2008-09-16,contracted slightly august following generally weak performance previous months,contract slightly august follow generally weak performance previous month,0
130,2008-09-16,august data showed considerable reallocation among components,august data show considerable reallocation among component,0
131,2008-09-16,liquid deposits retail money funds fell small time deposits surged banks thrifts bid aggressively deposits,liquid deposit retail money fund fell small time deposit surge bank thrift bid aggressively deposit,0
132,2008-09-16,september  treasury department federal housing finance agency announced fannie mae freddie mac placed conservatorship treasury would establish backstop lending facility government sponsored enterprises gses purchase preferred stock gses necessary ensure maintain positive net worth initiate program purchase mortgage backed securities mbs,september treasury department federal housing finance agency announce fannie mae freddie mac place conservatorship treasury would establish backstop lending facility government sponsor enterprise g purchase prefer stock g necessary ensure maintain positive net worth initiate program purchase mortgage back security mb,0
133,2008-09-16,following announcement spreads fannie mae freddie mac debt agency mbs narrowed share prices common preferred stock fell,follow announcement spread fannie mae freddie mac debt agency mb narrow share price common prefer stock fell,0
134,2008-09-16,auctions gse debt following conservatorship announcement reportedly attracted heavy demand market participants indicated liquidity secondary market gse debt remained somewhat lower normal,auction gse debt follow conservatorship announcement reportedly attract heavy demand market participant indicate liquidity secondary market gse debt remain somewhat low normal,0
135,2008-09-16,conservatorship announcement interest rates  year fixed rate mortgages declined less comparable maturity treasury securities leaving mortgage spreads top range past two decades,conservatorship announcement interest rate year fix rate mortgage decline less comparable maturity treasury security leave mortgage spread top range past two decade,0
136,2008-09-16,following treasury announcement rates spreads new conforming fixed rate mortgages dropped sharply,follow treasury announcement rate spread new conform fix rate mortgage drop sharply,0
137,2008-09-16,days immediately fomc meeting lehman brothers holdings filed bankruptcy bank america announced would acquire merrill lynch market concerns health financial institutions increased,day immediately fomc meeting lehman brother holding file bankruptcy bank america announce would acquire merrill lynch market concern health financial institution increase,0
138,2008-09-16,address potential liquidity pressures financial markets associated developments federal reserve announced several additional initiatives including expansion collateral eligible primary dealer credit facility term securities lending facility tslf increases size frequency tslf auctions temporary relaxation limitations broker dealers access funding affiliated depository institutions,address potential liquidity pressure financial market associate development federal reserve announce several additional initiative include expansion collateral eligible primary dealer credit facility term security lending facility tslf increase size frequency tslf auction temporary relaxation limitation broker dealer access funding affiliate depository institution,0
139,2008-09-16,addition consortium  major banks announced creation liquidity pool participants could draw collateralized loans,addition consortium major bank announce creation liquidity pool participant could draw collateralize loan,0
140,2008-09-16,despite enhanced liquidity measures short term funding markets remained severely strained reflecting investors heightened concerns financial condition large financial firms including american international group prominent insurance financial services company,despite enhance liquidity measure short term funding market remain severely strain reflect investor heighten concern financial condition large financial firm include american international group prominent insurance financial service company,0
141,2008-09-16,support market liquidity help keep federal funds rate near target federal reserve conducted large reserve adding open market operations day morning fomc meeting,support market liquidity help keep federal fund rate near target federal reserve conduct large reserve add open market operation day morning fomc meeting,0
142,2008-09-16,market expectations path monetary policy moved sharply,market expectation path monetary policy move sharply,0
143,2008-09-16,yields nominal treasury securities dropped steeply credit spreads corporate bonds widened significantly,yield nominal treasury security drop steeply credit spread corporate bond widen significantly,0
144,2008-09-16,equity markets volatile equity prices dropped considerably,equity market volatile equity price drop considerably,0
145,2008-09-16,forecast prepared meeting staff left projection real gdp growth second half  little changed previous meeting marked forecast  slightly,forecast prepared meeting staff left projection real gdp growth second half little change previous meeting marked forecast slightly,0
146,2008-09-16,real gdp estimated increased solid pace second quarter however available indicators pointed sharp deceleration economic activity third quarter,real gdp estimate increase solid pace second quarter however available indicator point sharp deceleration economic activity third quarter,0
147,2008-09-16,consumer spending softened appreciably recent months housing construction remained steep downtrend,consumer spending soften appreciably recent month housing construction remain steep downtrend,0
148,2008-09-16,weakness household sector appeared reflect ongoing deterioration labor market effects earlier run oil prices weakened balance sheets restrictive financial conditions also likely put finances many households businesses pressure,weakness household sector appear reflect ongoing deterioration labor market effect earlier run oil price weaken balance sheet restrictive financial condition also likely put finance many household business pressure,0
149,2008-09-16,staff continued expect real gdp would advance slowly fourth quarter  faster rate  still less potential,staff continued expect real gdp would advance slowly fourth quarter faster rate still less potential,0
150,2008-09-16,real gdp growth expected pick slightly rate potential growth  restraint household business spending associated financial market turmoil gradually eases contraction housing sector comes end,real gdp growth expect pick slightly rate potential growth restraint household business spending associate financial market turmoil gradually eas contraction housing sector come end,0
151,2008-09-16,staff outlook core overall pce inflation next two years also changed little,staff outlook core overall pce inflation next two year also change little,0
152,2008-09-16,staff continued project core inflation would edge lower   prices imports energy commodities decelerate margin resource slack remains relatively wide,staff continued project core inflation would edge low price import energy commodity decelerate margin resource slack remains relatively wide,0
153,2008-09-16,discussion economic situation outlook fomc participants noted financial market strains intensified days meeting strains could potentially weigh economic activity,discussion economic situation outlook fomc participant note financial market strain intensified day meeting strain could potentially weigh economic activity,0
154,2008-09-16,participants agreed economic growth likely sluggish second half ,participant agree economic growth likely sluggish second half,0
155,2008-09-16,several participants marked near term outlook economic activity judged downside risks increased continued expect gradual recovery ,several participant marked near term outlook economic activity judged downside risk increase continued expect gradual recovery,0
156,2008-09-16,despite concern recent high inflation readings suggested price pressures could persist participants generally thought outlook inflation improved mainly reflecting recent declines prices oil commodities stronger foreign exchange value dollar weakening labor market,despite concern recent high inflation reading suggest price pressure could persist participant generally thought outlook inflation improve mainly reflect recent decline price oil commodity strong foreign exchange value dollar weaken labor market,0
157,2008-09-16,participants noted stresses financial markets institutions increased,participant note stress financial market institution increase,0
158,2008-09-16,announcement government support fannie mae freddie mac appeared positive impact financial markets importantly primary secondary markets residential mortgages,announcement government support fannie mae freddie mac appear positive impact financial market importantly primary secondary market residential mortgage,0
159,2008-09-16,however bankruptcy lehman brothers market concerns financial institutions causing wide variety financial firms experience increasing difficulty obtaining funding raising capital development likely lead tightening credit availability households firms,however bankruptcy lehman brother market concern financial institution cause wide variety financial firm experience increase difficulty obtain funding raise capital development likely lead tighten credit availability household firm,0
160,2008-09-16,meeting participants highly uncertain future financial developments implications broader economy,meeting participant highly uncertain future financial development implication broader economy,0
161,2008-09-16,agreement liquidity facilities established federal reserve past year helpful ameliorating strains financial markets also noted capital banks financial institutions would need bolstered order strengthen functioning financial system ease constraints credit,agreement liquidity facility establish federal reserve past year helpful ameliorate strain financial market also note capital bank financial institution would need bolster order strengthen function financial system ease constraint credit,0
162,2008-09-16,strains financial system interactions housing developments real economy broadly continued restrain aggregate demand pose substantial downside risks expected path economic activity,strain financial system interaction housing development real economy broadly continued restrain aggregate demand pose substantial downside risk expect path economic activity,0
163,2008-09-16,fall employment august highlighted concerns adverse dynamic taking hold economic weakness increased financial firms losses leading tighter credit conditions thus causing softening economic activity,fall employment august highlight concern adverse dynamic take hold economic weakness increase financial firm loss lead tighter credit condition thus cause soften economic activity,0
164,2008-09-16,however participants cited indications pace decline house prices might begin slow coming months would serve limit strains lenders,however participant cite indication pace decline house price might begin slow come month would serve limit strain lender,0
165,2008-09-16,mortgage rates fallen action gses inventories houses sale fallen reports contacts parts nation suggested possible bottoming housing sector might not far off although differences prospects housing across states regions seemed large,mortgage rate fall action g inventory house sale fall report contact part nation suggest possible bottoming housing sector might not far off although difference prospect housing across state region seem large,0
166,2008-09-16,all contraction housing sector adverse implications performance mortgage related financial assets continued represent drag economic performance,all contraction housing sector adverse implication performance mortgage related financial asset continued represent drag economic performance,0
167,2008-09-16,recent readings consumer spending weak despite tax rebates mostly paid mid july indicators suggested consumption may remain soft effects stimulus fade near term,recent reading consumer spending weak despite tax rebate mostly paid mid july indicator suggest consumption may remain soft effect stimulus fade near term,0
168,2008-09-16,falling real estate prices likely continue reduce household wealth eroding quality consumer loans potential lead tightening credit conditions,fall real estate price likely continue reduce household wealth erode quality consumer loan potential lead tighten credit condition,0
169,2008-09-16,many participants worried deterioration labor market conditions summer would damp growth income depress consumer confidence holding back consumption,many participant worried deterioration labor market condition summer would damp growth income depress consumer confidence hold back consumption,0
170,2008-09-16,business spending held well summer inventories appeared well managed,business spending held well summer inventory appear well manage,0
171,2008-09-16,however reports business contacts suggested new commercial real estate projects difficult finance,however report business contact suggest new commercial real estate project difficult finance,0
172,2008-09-16,credit conditions generally tight economic prospects relatively uncertain investment spending likely soft side going forward,credit condition generally tight economic prospect relatively uncertain investment spending likely soft side go forward,0
173,2008-09-16,foreign economic growth slowed recent months dollar risen broadly developments suggested contributionss gdp growth net exports would likely less strong late,foreign economic growth slow recent month dollar risen broadly development suggest contribution gdp growth net export would likely less strong late,0
174,2008-09-16,participants noted financial strains increasing many foreign countries,participant note financial strain increase many foreign country,0
175,2008-09-16,however beneficial side effect global slowdown falling prices oil commodities would help bolster real incomess households,however beneficial side effect global slowdown fall price oil commodity would help bolster real income household,0
176,2008-09-16,participants generally somewhat confident outlook moderation inflation forecast horizon,participant generally somewhat confident outlook moderation inflation forecast horizon,0
177,2008-09-16,recent substantial declines prices oil commodities help contain broader price pressures coming quarters,recent substantial decline price oil commodity help contain broader price pressure come quarter,0
178,2008-09-16,addition effects stronger dollar import prices along increased economic slack would tend damp inflation,addition effect strong dollar import price along increase economic slack would tend damp inflation,0
179,2008-09-16,various measures inflation expectations declined since last meeting nominal wage increases continued moderate,various measure inflation expectation decline since last meeting nominal wage increase continued moderate,0
180,2008-09-16,indeed solid growth productivity unit labor costs well contained,indeed solid growth productivity unit labor cost well contain,0
181,2008-09-16,still reports business contacts suggested firms continuing attempt pass customers previous increases costs energy raw materials would resist reversing previous price increases,still report business contact suggest firm continue attempt pas customer previous increase cost energy raw material would resist reverse previous price increase,0
182,2008-09-16,participants noted recent readings core headline inflation elevated expressed concern high inflation might become embedded expectations retain considerable momentum,participant note recent reading core headline inflation elevate express concern high inflation might become embed expectation retain considerable momentum,0
183,2008-09-16,members agreed keeping federal funds rate unchanged meeting appropriate,member agree keep federal fund rate unchanged meeting appropriate,0
184,2008-09-16,current low real federal funds rate appeared necessary provide adequate counterweight restraining effects tight credit conditions continued declines housing market spending output,current low real federal fund rate appear necessary provide adequate counterweight restrain effect tight credit condition continued decline housing market spending output,0
185,2008-09-16,committee members generally saw current stance monetary policy consistent gradual strengthening economic growth beginning next year although recognized recent financial developments boosted downside risks economic outlook,committee member generally saw current stance monetary policy consistent gradual strengthen economic growth begin next year although recognize recent financial development boost downside risk economic outlook,0
186,2008-09-16,inflation risks appeared diminished response declines prices energy commodities recent strengthening dollar outlook somewhat greater economic slack committee members bit optimistic inflation would moderate coming quarters,inflation risk appear diminish response decline price energy commodity recent strengthen dollar outlook somewhat great economic slack committee member bit optimistic inflation would moderate come quarter,0
187,2008-09-16,however possibility core inflation would not moderate anticipated still significant concern,however possibility core inflation would not moderate anticipate still significant concern,0
188,2008-09-16,substantial downside risks growth persisting upside risks inflation members judged leaving federal funds rate unchanged time suitably balanced risks outlook,substantial downside risk growth persist upside risk inflation member judged leave federal fund rate unchanged time suitably balance risk outlook,0
189,2008-09-16,members emphasized intensifying financial strains led significant worsening growth outlook policy response could required however response not called meeting,member emphasize intensify financial strain lead significant worsen growth outlook policy response could require however response not call meeting,0
190,2008-09-16,indeed noted that elevated inflation still concern growth expected pick next year financial strains diminish committee also remain prepared reverse policy easing put place past year timely fashion,indeed note that elevate inflation still concern growth expect pick next year financial strain diminish committee also remain prepared reverse policy ease put place past year timely fashion,0
191,2008-09-16,conclusion discussion committee voted authorize direct federal reserve bank new york instructed otherwise execute transactions system account accordance following domestic policy directive,conclusion discussion committee vote authorize direct federal reserve bank new york instruct otherwise execute transaction system account accordance follow domestic policy directive,0
192,2008-09-16,the federal open market committee seeks monetary financial conditions foster price stability promote sustainable growth output,the federal open market committee seek monetary financial condition foster price stability promote sustainable growth output,0
193,2008-09-16,long run objectives committee immediate future seeks conditions reserve markets consistent maintaining federal funds rate average around  percent,long run objective committee immediate future seek condition reserve market consistent maintain federal fund rate average around percent,0
194,2008-09-16,vote encompassed approval statement released,vote encompass approval statement release,0
195,2008-09-16,the federal open market committee decided today keep target federal funds rate  percent,the federal open market committee decide today keep target federal fund rate percent,0
196,2008-09-16,strains financial markets increased significantly labor markets weakened further,strain financial market increase significantly labor market weaken far,0
197,2008-09-16,economic growth appears slowed recently partly reflecting softening household spending,economic growth appear slow recently partly reflect soften household spending,0
198,2008-09-16,tight credit conditions ongoing housing contraction slowing export growth likely weigh economic growth next quarters,tight credit condition ongoing housing contraction slow export growth likely weigh economic growth next quarter,0
199,2008-09-16,time substantial easing monetary policy combined ongoing measures foster market liquidity help promote moderate economic growth,time substantial ease monetary policy combine ongoing measure foster market liquidity help promote moderate economic growth,0
200,2008-09-16,inflation high spurred earlier increases prices energy commodities,inflation high spur earlier increase price energy commodity,0
201,2008-09-16,committee expects inflation moderate later year next year inflation outlook remains highly uncertain,committee expect inflation moderate later year next year inflation outlook remains highly uncertain,0
202,2008-09-16,downside risks growth upside risks inflation significant concern committee,downside risk growth upside risk inflation significant concern committee,0
203,2008-09-16,committee monitor economic financial developments carefully act needed promote sustainable economic growth price stability,committee monitor economic financial development carefully act need promote sustainable economic growth price stability,0
204,2008-09-16,votes action mr bernanke mses,vote action mr bernanke ms,0
205,2008-09-16,cumming duke messrs,cumming duke messrs,0
206,2008-09-16,fisher kohn kroszner ms pianalto messrs,fisher kohn kroszner m pianalto messrs,0
207,2008-09-16,plosser stern warsh,plosser stern warsh,0
208,2008-09-16,votes action none,vote action none,0
209,2008-09-16,ms cumming voted alternate mr geithner,m cumming vote alternate mr geithner,0
210,2008-09-16,agreed next meeting committee would held tuesday wednesday october   ,agree next meeting committee would held tuesday wednesday october,0
211,2008-09-16,meeting adjourned,meeting adjourn,0
212,2008-09-16,notation vote,notation vote,0
213,2008-09-16,notation vote completed august   committee unanimously approved minutes fomc meeting held august  ,notation vote complete august committee unanimously approve minute fomc meeting held august,0
