,Date,Original,Corpus,Class
106,2010-04-28,real spending drilling mining structures picked strongly second half last year response rebound oil natural gas prices,real spending drilling mining structure picked strongly second half last year response rebound oil natural gas price,0
107,2010-04-28,available data suggested pace inventory liquidation moderated first quarter slowing sharply fourth quarter last year,available data suggest pace inventory liquidation moderate first quarter slow sharply fourth quarter last year,0
108,2010-04-28,inventories appeared approach comfortable levels relative sales aggregate although inventory positions across industries varied,inventory appear approach comfortable level relative sale aggregate although inventory position across industry varied,0
109,2010-04-28,months supply remained elevated equipment materials and lesser degree construction supplies,month supply remain elevate equipment material and lesser degree construction supply,0
110,2010-04-28,contrast inventories consumer goods business supplies high tech goods appeared low relative demand,contrast inventory consumer good business supply high tech good appear low relative demand,0
111,2010-04-28,consumer price inflation low recent months headline core personal consumption expenditures pce prices estimated risen slightly march remaining unchanged february,consumer price inflation low recent month headline core personal consumption expenditure pce price estimate risen slightly march remain unchanged february,0
112,2010-04-28, month change basis core pce prices slowed year ending march deceleration widespread across categories expenditures,month change basis core pce price slow year end march deceleration widespread across category expenditure,0
113,2010-04-28,contrast corresponding change headline index moved noticeably energy prices rebounded,contrast correspond change headline index move noticeably energy price rebound,0
114,2010-04-28,survey measures long term inflation expectations fairly stable recent months levels slightly lower posted year ago,survey measure long term inflation expectation fairly stable recent month level slightly low post year ago,0
115,2010-04-28,meanwhile measures inflation compensation based treasury inflation protected securities tips edged slightly,meanwhile measure inflation compensation base treasury inflation protect security tip edge slightly,0
116,2010-04-28,cost pressures rising commodity prices showed prices early stages processing producer price index core intermediate materials continued rise rapidly march,cost pressure rise commodity price show price early stage processing producer price index core intermediate material continued rise rapidly march,0
117,2010-04-28,however measures labor costs decelerated sharply last year compensation per hour nonfarm business sector increased slightly four quarters ,however measure labor cost decelerate sharply last year compensation per hour nonfarm business sector increase slightly four quarter,0
118,2010-04-28,us international trade deficit widened february rise nominal imports outpaced small increase exports,u international trade deficit widen february rise nominal import outpace small increase export,0
119,2010-04-28,increased exports industrial supplies capital goods automotive products partly offset declines agricultural goods consumer goods,increase export industrial supply capital good automotive product partly offset decline agricultural good consumer good,0
120,2010-04-28,february rise imports reversed similarly sized decrease january,february rise import reverse similarly size decrease january,0
121,2010-04-28,imports oil accounted one third january decline reflecting lower volumes accounted one tenth february increase volumes rebounded prices fell,import oil account one third january decline reflect low volume account one tenth february increase volume rebound price fell,0
122,2010-04-28,imports capital goods rose strong computer imports offset falling aircraft purchases imports industrial supplies consumer goods also moved up,import capital good rise strong computer import offset fall aircraft purchase import industrial supply consumer good also move up,0
123,2010-04-28,recent indicators advanced foreign economies suggested continued divergence pace recovery strong performance canada moderate expansion japan subdued rebound europe,recent indicator advanced foreign economy suggest continued divergence pace recovery strong performance canada moderate expansion japan subdue rebound europe,0
124,2010-04-28,fiscal strains greece intensified intermeeting period mid april euro area member states announced plan provide financing aid greece coordination international monetary fund,fiscal strain greece intensified intermeeting period mid april euro area member state announce plan provide financing aid greece coordination international monetary fund,0
125,2010-04-28,however time april fomc meeting no official agreement reached concerning scale composition implementation aid package,however time april fomc meeting no official agreement reach concern scale composition implementation aid package,0
126,2010-04-28,economic activity emerging markets continued expand robustly first quarter,economic activity emerge market continued expand robustly first quarter,0
127,2010-04-28,despite strength exports merchandise trade balances declined countries strong domestic demand caused imports outpace exports,despite strength export merchandise trade balance decline country strong domestic demand cause import outpace export,0
128,2010-04-28,china real gross domestic product gdp increased higher expected annual rate first quarter economic recovery remained broad based industrial production investment domestic demand continuing grow briskly,china real gross domestic product gdp increase high expect annual rate first quarter economic recovery remain broad base industrial production investment domestic demand continue grow briskly,0
129,2010-04-28,latin america indicators suggested economic activity mexico brazil expanded first quarter,latin america indicator suggest economic activity mexico brazil expand first quarter,0
130,2010-04-28,foreign inflation boosted increases prices oil commodities core inflation generally remained subdued,foreign inflation boost increase price oil commodity core inflation generally remain subdue,0
131,2010-04-28,staff review financial situation decision fomc march meeting keep target range federal funds rate unchanged retain extended period language statement largely anticipated market participants,staff review financial situation decision fomc march meeting keep target range federal fund rate unchanged retain extend period language statement largely anticipate market participant,0
132,2010-04-28,however market participants reportedly interpreted retention extended period language pointing longer period low rates previously expected eurodollar futures rates temporarily declined bit response,however market participant reportedly interpret retention extend period language point longer period low rate previously expect eurodollar future rate temporarily decline bit response,0
133,2010-04-28,balance intermeeting period expected path policy edged slightly,balance intermeeting period expect path policy edge slightly,0
134,2010-04-28,yields  year  year nominal treasury securities posted small mixed changes amid volatility reportedly reflected evolving viewss fiscal outlook prospectss economic growth fiscal situation peripheral european countries,yield year year nominal treasury security post small mixed change amid volatility reportedly reflect evolve view fiscal outlook prospect economic growth fiscal situation peripheral european country,0
135,2010-04-28,inflation compensation difference nominal treasury yields yields tips rose period survey measures longer term inflation expectations unchanged,inflation compensation difference nominal treasury yield yield tip rise period survey measure longer term inflation expectation unchanged,0
136,2010-04-28,overall conditions short term funding markets remained generally stable intermeeting period,overall condition short term funding market remain generally stable intermeeting period,0
137,2010-04-28,spreads london interbank offered rates libor overnight index swap ois rates unchanged levels near prevailed late  although began edge final days intermeeting period,spread london interbank offer rate libor overnight index swap ois rate unchanged level near prevail late although begin edge final day intermeeting period,0
138,2010-04-28,spreads commercial paper market little changed,spread commercial paper market little change,0
139,2010-04-28,equity indexes rose balance intermeeting period bank shares outperforming broader market,equity index rise balance intermeeting period bank share outperform broader market,0
140,2010-04-28,stock prices supported somewhat better expected macroeconomic data favorable response investors initial batch first quarter earnings reports especially banking institutions,stock price support somewhat well expect macroeconomic data favorable response investor initial batch first quarter earnings report especially banking institution,0
141,2010-04-28,option implied volatility index generally declined period jumped end april renewed concerns regarding fiscal situation greece,option imply volatility index generally decline period jumped end april renew concern regard fiscal situation greece,0
142,2010-04-28,gap staff estimate expected real equity return next  years firms real  year treasury yield rough measure equity risk premium remained well average past decade,gap staff estimate expect real equity return next year firm real year treasury yield rough measure equity risk premium remain well average past decade,0
143,2010-04-28,yields investment grade corporate bonds edged down leaving spreads comparable maturity treasury securities bit lower levels around prevailed late ,yield investment grade corporate bond edge down leave spread comparable maturity treasury security bit low level around prevail late,0
144,2010-04-28,consistent favorable investor sentiment toward risky assets yields spreads speculative grade corporate bonds declined secondary market prices syndicated leveraged loans rose further,consistent favorable investor sentiment toward risky asset yield spread speculative grade corporate bond decline secondary market price syndicate leveraged loan rise far,0
145,2010-04-28,overall net debt financing nonfinancial firms positive march,overall net debt financing nonfinancial firm positive march,0
146,2010-04-28,issuance nonfinancial bonds surged net issuance commercial paper rebounded appreciably,issuance nonfinancial bond surge net issuance commercial paper rebound appreciably,0
147,2010-04-28,net equity issuance nonfinancial firms negative first quarter solid pace gross public issuance offset equity retirements cash financed mergers share repurchases,net equity issuance nonfinancial firm negative first quarter solid pace gross public issuance offset equity retirement cash finance merger share repurchase,0
148,2010-04-28,financial firms issued significant volume debt securities first quarter also raised moderate amount gross funds equity market pattern appeared continue first half april,financial firm issue significant volume debt security first quarter also raise moderate amount gross fund equity market pattern appear continue first half april,0
149,2010-04-28,credit quality commercial real estate sector continued deteriorate delinquency rate securitized commercial mortgages increased march,credit quality commercial real estate sector continued deteriorate delinquency rate securitized commercial mortgage increase march,0
150,2010-04-28,decline outstanding commercial mortgage debt fourth quarter last year largest record,decline outstanding commercial mortgage debt fourth quarter last year large record,0
151,2010-04-28,nonetheless indexes prices credit default swaps commercial mortgage backed securities ticked noticeably period line overall reduction financial market risk premiums,nonetheless index price credit default swap commercial mortgage back security ticked noticeably period line overall reduction financial market risk premium,0
152,2010-04-28,conclusion purchases federal reserve agency mbs program modest market effect,conclusion purchase federal reserve agency mb program modest market effect,0
153,2010-04-28,intermeeting period spreads agency mbs retraced much increase seen around time program conclusion ending period roughly unchanged,intermeeting period spread agency mb retrace much increase see around time program conclusion end period roughly unchanged,0
154,2010-04-28,factors contributing recent narrowing mbs mortgage spreads included low level mortgage originations damped supply new mbs fannie mae freddie mac increased purchases mortgages buyouts delinquent loans,factor contribute recent narrow mb mortgage spread include low level mortgage origination damped supply new mb fannie mae freddie mac increase purchase mortgage buyout delinquent loan,0
155,2010-04-28,consumer credit continued trend lower recent months pushed steep decline revolving credit,consumer credit continued trend low recent month push steep decline revolve credit,0
156,2010-04-28,spreads high quality credit card auto loan asset backed securities abs edged period little upward pressure evident end portion term asset backed securities loan facility supporting abs,spread high quality credit card auto loan asset back security ab edge period little upward pressure evident end portion term asset back security loan facility support ab,0
157,2010-04-28,nonetheless fewer abs issued first quarter fourth quarter reflecting continued weakness loan originations,nonetheless few ab issue first quarter fourth quarter reflect continued weakness loan origination,0
158,2010-04-28,delinquency rates consumer loans edged february remained elevated,delinquency rate consumer loan edge february remain elevate,0
159,2010-04-28,spreads interest rates credit cards yields two year treasury securities continued drift upward interest rates new auto loans dealerships spreads yields five year treasury securities extended previous decline,spread interest rate credit card yield two year treasury security continued drift upward interest rate new auto loan dealership spread yield five year treasury security extend previous decline,0
160,2010-04-28,adjusting remove effects banks adoption financial accounting standards   bank credit contracted march loans securities holdings declined,adjust remove effect bank adoption financial accounting standard bank credit contract march loan security holding decline,0
161,2010-04-28, contraction commercial industrial loans remained pronounced,contraction commercial industrial loan remain pronounce,0
162,2010-04-28,drop commercial real estate loans persisted reflecting weak fundamentals limited originations well charge offs existing loans,drop commercial real estate loan persist reflect weak fundamental limited origination well charge offs exist loan,0
163,2010-04-28,residential real estate loans also decreased march credit card loans consumer loans,residential real estate loan also decrease march credit card loan consumer loan,0
164,2010-04-28,fell march reflecting slowing expansion liquid deposits along contraction small time deposits steep runoff retail money market mutual funds,fell march reflect slow expansion liquid deposit along contraction small time deposit steep runoff retail money market mutual fund,0
165,2010-04-28,currency grew moderate pace likely result continued demands banknotes abroad coupled solid domestic demand,currency grow moderate pace likely result continued demand banknote abroad couple solid domestic demand,0
166,2010-04-28,monetary base contracted effect reserves purchases federal reserve large scale asset purchase programs offset contraction credit outstanding liquidity credit facilities increase treasury balances federal reserve,monetary base contract effect reserve purchase federal reserve large scale asset purchase program offset contraction credit outstanding liquidity credit facility increase treasury balance federal reserve,0
167,2010-04-28,intensification greek crisis near end intermeeting period equity indexes higher nearly countries emerging market risk spreads generally declined,intensification greek crisis near end intermeeting period equity index high nearly country emerge market risk spread generally decline,0
168,2010-04-28,moves appeared reflect growing confidence global recovery gaining momentum particularly emerging market economies,move appear reflect grow confidence global recovery gain momentum particularly emerge market economy,0
169,2010-04-28,however sovereign debt spreads greece portugal peripheral european countries widened days leading april fomc meeting investor anxiety fiscal situation countries increased,however sovereign debt spread greece portugal peripheral european country widen day lead april fomc meeting investor anxiety fiscal situation country increase,0
170,2010-04-28,downgrades credit ratings greece portugal weighed investor sentiment global markets retraced earlier gains,downgrade credit rating greece portugal weigh investor sentiment global market retrace earlier gain,0
171,2010-04-28,intermeeting period bank japan doubled size three month fixed rate funds facility bank canada dropped conditional commitment keeping rates steady first half year reserve bank australia raised policy rate,intermeeting period bank japan double size three month fix rate fund facility bank canada drop conditional commitment keep rate steady first half year reserve bank australia raise policy rate,0
172,2010-04-28,trade weighted value dollar changed little net gains euro yen offset declines many emerging market currencies,trade weight value dollar change little net gain euro yen offset decline many emerge market currency,0
173,2010-04-28,staff economic outlook economic forecast prepared staff april fomc meeting similar developed march meeting,staff economic outlook economic forecast prepared staff april fomc meeting similar developed march meeting,0
174,2010-04-28,staff continued project accommodative stance monetary policy together attenuation financial stress waning adverse effects earlier declines wealth improving household business confidence would support moderate recovery economic activity gradual decline unemployment rate next two years,staff continued project accommodative stance monetary policy together attenuation financial stress wan adverse effect earlier decline wealth improve household business confidence would support moderate recovery economic activity gradual decline unemployment rate next two year,0
175,2010-04-28,staff forecast real gdp growth unemployment rate end  roughly line previous projections,staff forecast real gdp growth unemployment rate end roughly line previous projection,0
176,2010-04-28,recent data core consumer prices led staff mark slightly forecast core pce inflation,recent data core consumer price lead staff mark slightly forecast core pce inflation,0
177,2010-04-28,staff continued anticipate downward pressure inflation substantial amount projected resource slack would tempered stable inflation expectations,staff continued anticipate downward pressure inflation substantial amount project resource slack would temper stable inflation expectation,0
178,2010-04-28,energy price increases expected slow next year total pce inflation seen likely fall back line core inflation end  previous projections,energy price increase expect slow next year total pce inflation see likely fall back line core inflation end previous projection,0
179,2010-04-28,participants views current conditions economic outlook conjunction fomc meeting meeting participants five members board governors presidents  federal reserve banks provided projections economic growth unemployment rate consumer price inflation year   longer horizon,participant view current condition economic outlook conjunction fomc meeting meeting participant five member board governor president federal reserve bank provide projection economic growth unemployment rate consumer price inflation year longer horizon,0
180,2010-04-28,longer run projections represent participant assessment rate variable would expected converge time appropriate monetary policy absence shocks,longer run projection represent participant assessment rate variable would expect converge time appropriate monetary policy absence shock,0
181,2010-04-28,participants forecasts  longer run described summary economic projections attached addendum minutes,participant forecast longer run described summary economic projection attach addendum minute,0
182,2010-04-28,discussion economic situation outlook meeting participants agreed incoming data information received business contacts indicated economic activity continued strengthen labor market beginning improve,discussion economic situation outlook meeting participant agree incoming data information receive business contact indicate economic activity continued strengthen labor market begin improve,0
183,2010-04-28,although recent data economic activity better anticipated participants saw incoming information broadly line earlier projections moderate growth accordingly views economic outlook not changed appreciably,although recent data economic activity well anticipate participant saw incoming information broadly line earlier projection moderate growth accordingly view economic outlook not change appreciably,0
184,2010-04-28,participants expected economic recovery continue but consistent experience following previous financial crises anticipated pickup output would rather slow relative past recoveries deep recessions,participant expect economic recovery continue but consistent experience follow previous financial crisis anticipate pickup output would rather slow relative past recovery deep recession,0
185,2010-04-28,moderate pace expansion turn would imply modest improvement labor market year unemployment rate declining gradually,moderate pace expansion turn would imply modest improvement labor market year unemployment rate decline gradually,0
186,2010-04-28,participants projected economy would grow somewhat faster   generating pronounced decline unemployment rate,participant project economy would grow somewhat faster generate pronounce decline unemployment rate,0
187,2010-04-28,light stable longer term inflation expectations likely continuation substantial resource slack policymakers anticipated overall core inflation would remain subdued  measured inflation somewhat rates policymakers considered consistent longer run federal reserve dual mandate,light stable longer term inflation expectation likely continuation substantial resource slack policymakers anticipate overall core inflation would remain subdue measure inflation somewhat rate policymakers consider consistent longer run federal reserve dual mandate,0
188,2010-04-28,participants expected economic growth would continue recent data pointed significant gains retail sales business spending equipment software picked substantially reports business contacts regional surveys indicated production increasing briskly many sectors,participant expect economic growth would continue recent data point significant gain retail sale business spending equipment software picked substantially report business contact regional survey indicate production increase briskly many sector,0
189,2010-04-28,participants agreed growth real gdp appeared reflect strengthening private final demand not fiscal stimulus slower pace inventory decumulation welcome development lessened policymakers concerns economy ability maintain self sustaining recovery without government support,participant agree growth real gdp appear reflect strengthen private final demand not fiscal stimulus slow pace inventory decumulation welcome development lessen policymakers concern economy ability maintain self sustain recovery without government support,0
190,2010-04-28,businesses appeared gaining confidence economic recovery narrowing credit spreads private debt markets allowing low policy rates reflected fully cost capital,business appear gain confidence economic recovery narrow credit spread private debt market allow low policy rate reflect fully cost capital,0
191,2010-04-28,time rising stock prices apparent stabilization house prices helping repair household balance sheets,time rise stock price apparent stabilization house price help repair household balance sheet,0
192,2010-04-28,result consumers firms beginning satisfy demands durable goods capital equipment postponed economic downturn,result consumer firm begin satisfy demand durable good capital equipment postpone economic downturn,0
193,2010-04-28,many participants noted employment increased recent months expected firming labor market conditions going forward,many participant note employment increase recent month expect firm labor market condition go forward,0
194,2010-04-28,stronger labor market could continue boost consumer business confidence contribute gains spending,strong labor market could continue boost consumer business confidence contribute gain spending,0
195,2010-04-28,although developments positive participants noted several factors likely would continue restrain expansion economic activity posed downside risks,although development positive participant note several factor likely would continue restrain expansion economic activity pose downside risk,0
196,2010-04-28,recent increase consumer spending appeared supported importantly pent demands possibly temporary factors unusually large income tax refunds,recent increase consumer spending appear support importantly pent demand possibly temporary factor unusually large income tax refund,0
