,Date,Original,Corpus,Class
0,2010-04-28,april   ,april,0
1,2010-04-28,present ben bernanke chairman william dudley vice chairman james bullard elizabeth duke thomas hoenig donald kohn sandra pianalto eric rosengren daniel tarullo kevin warsh,present ben bernanke chairman william dudley vice chairman james bullard elizabeth duke thomas hoenig donald kohn sandra pianalto eric rosengren daniel tarullo kevin warsh,0
2,2010-04-28,christine cumming charles evans narayana kocherlakota charles plosser alternate members federal open market committee,christine cumming charles evans narayana kocherlakota charles plosser alternate member federal open market committee,0
3,2010-04-28,jeffrey lacker dennis lockhart janet yellen presidents federal reserve banks richmond atlanta san francisco respectively,jeffrey lacker dennis lockhart janet yellen president federal reserve bank richmond atlanta san francisco respectively,0
4,2010-04-28,helen holcomb first vice president federal reserve bank dallas,helen holcomb first vice president federal reserve bank dallas,0
5,2010-04-28,brian madigan secretary economist matthew luecke assistant secretary david skidmore assistant secretary michelle smith assistant secretary scott alvarez general counsel thomas baxter deputy general counsel nathan sheets economist david stockton economist,brian madigan secretary economist matthew luecke assistant secretary david skidmore assistant secretary michelle smith assistant secretary scott alvarez general counsel thomas baxter deputy general counsel nathan sheet economist david stockton economist,0
6,2010-04-28,alan barkema thomas connors william english jeff fuhrer steven kamin simon potter lawrence slifman mark sniderman christopher waller david wilcox associate economists,alan barkema thomas connors william english jeff fuhrer steven kamin simon potter lawrence slifman mark sniderman christopher waller david wilcox associate economist,0
7,2010-04-28,brian sack manager system open market account,brian sack manager system open market account,0
8,2010-04-28,jennifer johnson secretary board office secretary board governors,jennifer johnson secretary board office secretary board governor,0
9,2010-04-28,patrick parkinson director division bank supervision regulation board governors,patrick parkinson director division bank supervision regulation board governor,0
10,2010-04-28,robert dev,robert dev,0
11,2010-04-28,frierson deputy secretary office secretary board governors,frierson deputy secretary office secretary board governor,0
12,2010-04-28,charles struckmeyer deputy staff director office staff director management board governors,charles struckmeyer deputy staff director office staff director management board governor,0
13,2010-04-28,james clouse deputy director division monetary affairs board governors,james clouse deputy director division monetary affair board governor,0
14,2010-04-28,linda robertson assistant board office board members board governors,linda robertson assistant board office board member board governor,0
15,2010-04-28,william nelson senior associate director division monetary affairs board governors nellie liang david reifschneider william wascher senior associate directors division research statistics board governors,william nelson senior associate director division monetary affair board governor nellie liang david reifschneider william wascher senior associate director division research statistic board governor,0
16,2010-04-28,seth carpenter associate director division monetary affairs board governors,seth carpenter associate director division monetary affair board governor,0
17,2010-04-28,christopher erceg deputy associate director division international finance board governors egon zakrajek deputy associate director division monetary affairs board governors,christopher erceg deputy associate director division international finance board governor egon zakrajek deputy associate director division monetary affair board governor,0
18,2010-04-28,brian gross special assistant board office board members board governors,brian gross special assistant board office board member board governor,0
19,2010-04-28,david small project manager division monetary affairs board governors,david small project manager division monetary affair board governor,0
20,2010-04-28,jennifer roush senior economist division monetary affairs board governors,jennifer roush senior economist division monetary affair board governor,0
21,2010-04-28,kurt lewis economist division monetary affairs board governors,kurt lewis economist division monetary affair board governor,0
22,2010-04-28,penelope beattie assistant secretary office secretary board governors,penelope beattie assistant secretary office secretary board governor,0
23,2010-04-28,kimberley braun records project manager division monetary affairs board governors,kimberley braun record project manager division monetary affair board governor,0
24,2010-04-28,randall williams records management analyst division monetary affairs board governors,randall williams record management analyst division monetary affair board governor,0
25,2010-04-28,esther george first vice president federal reserve bank kansas city,esther george first vice president federal reserve bank kansa city,0
26,2010-04-28,loretta mester harvey rosenblum john williams executive vice presidents federal reserve banks philadelphia dallas san francisco respectively,loretta mester harvey rosenblum john williams executive vice president federal reserve bank philadelphia dallas san francisco respectively,0
27,2010-04-28,david altig richard dzina daniel sullivan john weinberg senior vice presidents federal reserve banks atlanta new york chicago richmond respectively,david altig richard dzina daniel sullivan john weinberg senior vice president federal reserve bank atlanta new york chicago richmond respectively,0
28,2010-04-28,warren weber senior research officer federal reserve bank minneapolis,warren weber senior research officer federal reserve bank minneapolis,0
29,2010-04-28,developments financial markets federal reserve balance sheet manager system open market account soma reported developments domestic foreign financial markets period since committee met march  ,development financial market federal reserve balance sheet manager system open market account soma report development domestic foreign financial market period since committee met march,0
30,2010-04-28,manager also reported system open market operations treasury securities agency debt agency mortgage backed securities mbs intermeeting period,manager also report system open market operation treasury security agency debt agency mortgage back security mb intermeeting period,0
31,2010-04-28,unanimous vote committee ratified transactions,unanimous vote committee ratify transaction,0
32,2010-04-28,no open market operations foreign currencies system account intermeeting period,no open market operation foreign currency system account intermeeting period,0
33,2010-04-28,unanimous vote committee decided extend reciprocal currency swap arrangements bank canada banco de mexico additional year beginning mid december  arrangements associated federal reserve participation north american framework agreement ,unanimous vote committee decide extend reciprocal currency swap arrangement bank canada banco de mexico additional year begin mid december arrangement associate federal reserve participation north american framework agreement,0
34,2010-04-28,arrangement bank canada amount  billion equivalent arrangement banco de mexico amount  billion equivalent,arrangement bank canada amount billion equivalent arrangement banco de mexico amount billion equivalent,0
35,2010-04-28,vote renew system participation swap arrangements taken meeting provision arrangements requires party provide six months prior notice intention terminate participation,vote renew system participation swap arrangement take meeting provision arrangement require party provide six month prior notice intention terminate participation,0
36,2010-04-28,staff also briefed committee recent progress development reserve draining tools,staff also briefed committee recent progress development reserve drain tool,0
37,2010-04-28,desk preparing conduct small scale reverse repurchase operations ensure ability use agency mbs collateral,desk prepare conduct small scale reverse repurchase operation ensure ability use agency mb collateral,0
38,2010-04-28,also continued work toward expansion set counterparties reverse repurchase operations,also continued work toward expansion set counterparties reverse repurchase operation,0
39,2010-04-28,staff noted board recently approved changes regulation would necessary establishment term deposit facility,staff note board recently approve change regulation would necessary establishment term deposit facility,0
40,2010-04-28,staff next gave presentation potential longer run strategies managing soma,staff next give presentation potential longer run strategy manage soma,0
41,2010-04-28,previous meetings committee participants expressed support steps reduce size federal reserve balance sheet time return composition soma treasury securities,previous meeting committee participant express support step reduce size federal reserve balance sheet time return composition soma treasury security,0
42,2010-04-28,staff discussed potential portfolio paths macroeconomic consequences number different strategies accomplishing objectives,staff discuss potential portfolio path macroeconomic consequence number different strategy accomplish objective,0
43,2010-04-28,date desk reinvesting proceeds maturing treasury securities newly issued treasury securities not reinvesting principal interest payments maturing agency debt agency mbs selling securities,date desk reinvesting proceeds mature treasury security newly issue treasury security not reinvesting principal interest payment mature agency debt agency mb sell security,0
44,2010-04-28,one strategy considered staff presentation continuation current practice would normalize balance sheet gradually,one strategy consider staff presentation continuation current practice would normalize balance sheet gradually,0
45,2010-04-28,addition staff presented information number strategies included sales soma holdings agency debt mbs proceeds maturing treasury securities would not reinvested strategies differed date circumstances sales would initiated average pace sales degree timing pace sales would adjusted response financial economic developments,addition staff present information number strategy include sale soma holding agency debt mb proceeds mature treasury security would not reinvested strategy differ date circumstance sale would initiate average pace sale degree timing pace sale would adjust response financial economic development,0
46,2010-04-28,meeting participants agreed broadly key objectives longer run strategy asset sales redemptions,meeting participant agree broadly key objective longer run strategy asset sale redemption,0
47,2010-04-28,strategy consistent achievement committee objectives maximum employment price stability,strategy consistent achievement committee objective maximum employment price stability,0
48,2010-04-28,addition strategy normalize size composition balance sheet time,addition strategy normalize size composition balance sheet time,0
49,2010-04-28,reducing size balance sheet would decrease associated reserve balances amounts consistent normal operations money markets monetary policy,reduce size balance sheet would decrease associate reserve balance amount consistent normal operation money market monetary policy,0
50,2010-04-28,returning portfolio historical composition essentially treasury securities would minimize extent federal reserve portfolio might affecting allocation credit among private borrowers sectors economy,return portfolio historical composition essentially treasury security would minimize extent federal reserve portfolio might affect allocation credit among private borrower sector economy,0
51,2010-04-28,participants expressed preference strategies would eventually entail sales agency debt mbs order return size composition federal reserve balance sheet normal configuration quickly would accomplished simply letting mbs agency securities run off,participant express preference strategy would eventually entail sale agency debt mb order return size composition federal reserve balance sheet normal configuration quickly would accomplish simply let mb agency security run off,0
52,2010-04-28,agreed sales agency debt mbs implemented accordance framework communicated advance conducted gradual pace potentially could adjusted response changes economic financial conditions,agree sale agency debt mb implement accordance framework communicate advance conduct gradual pace potentially could adjust response change economic financial condition,0
53,2010-04-28,participants expressed range views details strategy asset sales,participant express range view detail strategy asset sale,0
54,2010-04-28,participants favored deferring asset sales time,participant favor defer asset sale time,0
55,2010-04-28,majority preferred beginning asset sales time first increase federal open market committee fomc target short term interest rates,majority prefer begin asset sale time first increase federal open market committee fomc target short term interest rate,0
56,2010-04-28,approach would postpone asset sales economic recovery well established would maintain short term interest rates committee key monetary policy tool,approach would postpone asset sale economic recovery well establish would maintain short term interest rate committee key monetary policy tool,0
57,2010-04-28,participants favored strategy committee would soon announce general schedule future asset sales date initiation sales would not necessarily linked increase committee interest rate target,participant favor strategy committee would soon announce general schedule future asset sale date initiation sale would not necessarily link increase committee interest rate target,0
58,2010-04-28,preferred begin sales relatively soon,prefer begin sale relatively soon,0
59,2010-04-28,earlier sales would normalize size composition balance sheet sooner would unwind least part unconventional policy stimulus put place crisis conventional policy firming got way,earlier sale would normalize size composition balance sheet sooner would unwind least part unconventional policy stimulus put place crisis conventional policy firm get way,0
60,2010-04-28,participants saw advantages varying fomc holdings longer term assets system atically response economic financial developments,participant saw advantage vary fomc holding longer term asset system atically response economic financial development,0
61,2010-04-28,however others thought pre announced pace sales unlikely vary much would provide high degree certainty sales helping limit disruptions financial markets,however others thought pre announce pace sale unlikely vary much would provide high degree certainty sale help limit disruption financial market,0
62,2010-04-28,views participants also differed extent regarding appropriate pace asset sales,view participant also differ extent regard appropriate pace asset sale,0
63,2010-04-28,preferred agency debt mbs held portfolio sold gradual pace would complete sales five years began,prefer agency debt mb held portfolio sell gradual pace would complete sale five year begin,0
64,2010-04-28,one possibility would pace relatively slow initially increase time allowing markets adjust gradually,one possibility would pace relatively slow initially increase time allow market adjust gradually,0
65,2010-04-28,couple participants thought faster sales conducted three years would appropriate felt pace would not put undue strain financial markets,couple participant thought faster sale conduct three year would appropriate felt pace would not put undue strain financial market,0
66,2010-04-28,view relatively brisk pace sales would reduce chance elevated size federal reserve balance sheet associated high level reserve balances could raise inflation expectations inflation beyond levels consistent price stability could generate excessive growth credit economy banking system recover fully,view relatively brisk pace sale would reduce chance elevate size federal reserve balance sheet associate high level reserve balance could raise inflation expectation inflation beyond level consistent price stability could generate excessive growth credit economy banking system recover fully,0
67,2010-04-28,participants saw advantages disadvantages not rolling treasury securities mature,participant saw advantage disadvantage not roll treasury security mature,0
68,2010-04-28,one hand redeeming treasury securities would contribute expeditious normalization size balance sheet quantity reserves,one hand redeem treasury security would contribute expeditious normalization size balance sheet quantity reserve,0
69,2010-04-28,hand redemptions could put upward pressure interest rates would tend work objective returning soma treasuries composition,hand redemption could put upward pressure interest rate would tend work objective return soma treasury composition,0
70,2010-04-28,no decisions committee longer run strategy asset sales redemptions made meeting,no decision committee longer run strategy asset sale redemption make meeting,0
71,2010-04-28,time being participants agreed desk continue interim approach allowing maturing agency debt prepayments agency mbs redeemed without replacement rolling maturing treasury securities,time be participant agree desk continue interim approach allow mature agency debt prepayment agency mb redeem without replacement roll mature treasury security,0
72,2010-04-28,participants agreed give consideration longer run strategy later date,participant agree give consideration longer run strategy later date,0
73,2010-04-28,staff review economic situation information reviewed april   meeting suggested that balance economic recovery proceeding moderate pace deterioration labor market likely coming end,staff review economic situation information review april meeting suggest that balance economic recovery proceed moderate pace deterioration labor market likely come end,0
74,2010-04-28,consumer spending continued post solid gains first three months year business investment equipment software appeared increased significantly first quarter,consumer spending continued post solid gain first three month year business investment equipment software appear increase significantly first quarter,0
75,2010-04-28,addition growth manufacturing output remained brisk gains became broadly based across industries,addition growth manufacturing output remain brisk gain become broadly base across industry,0
76,2010-04-28,however residential construction edged up still depressed construction nonresidential buildings remained steep downward trajectory state local governments continued retrench,however residential construction edge up still depressed construction nonresidential building remain steep downward trajectory state local government continued retrench,0
77,2010-04-28,consumer price inflation remained low,consumer price inflation remain low,0
78,2010-04-28,labor market showed signs nascent recovery recent months,labor market show sign nascent recovery recent month,0
79,2010-04-28,private nonfarm payroll employment increased first quarter  first quarterly increase since onset recession,private nonfarm payroll employment increase first quarter first quarterly increase since onset recession,0
80,2010-04-28,average workweek also rose last quarter data household survey pointed firming labor market conditions,average workweek also rise last quarter data household survey point firm labor market condition,0
81,2010-04-28,unemployment rate held steady ,unemployment rate held steady,0
82,2010-04-28, percent throughout first quarter labor force participation rate increased past months following sharp declines second half last year,percent throughout first quarter labor force participation rate increase past month follow sharp decline second half last year,0
83,2010-04-28,number new job losers percentage household employment continued drop fraction workers part time schedules economic reasons moved since end last year,number new job loser percentage household employment continued drop fraction worker part time schedule economic reason move since end last year,0
84,2010-04-28,nonetheless finding job remained difficult average duration unemployment spells increased further,nonetheless find job remain difficult average duration unemployment spell increase far,0
85,2010-04-28,industrial production continued expand brisk pace first quarter,industrial production continued expand brisk pace first quarter,0
86,2010-04-28,recent production gains remained broadly based across industries foreign demand mild restocking inventories contributed positively output growth,recent production gain remain broadly base across industry foreign demand mild restock inventory contribute positively output growth,0
87,2010-04-28,capacity utilization stood significantly trough recorded last june still well long run average,capacity utilization stood significantly trough record last june still well long run average,0
88,2010-04-28,light motor vehicle production stepped march assemblies first quarter fourth quarter average automakers cautiously began rebuild dealers inventories,light motor vehicle production step march assembly first quarter fourth quarter average automaker cautiously begin rebuild dealer inventory,0
89,2010-04-28,production high tech industries increased solidly available indicators pointed toward expansion sector near term,production high tech industry increase solidly available indicator point toward expansion sector near term,0
90,2010-04-28,balance indicators near term manufacturing activity remained quite positive,balance indicator near term manufacturing activity remain quite positive,0
91,2010-04-28,consumer spending continued rise solid pace march recent gains pronounced non auto goods food services,consumer spending continued rise solid pace march recent gain pronounce non auto good food service,0
92,2010-04-28,despite signs improvement recently determinants spending remained subdued,despite sign improvement recently determinant spending remain subdue,0
93,2010-04-28,wages salaries picked early year real disposable income flat february slight decline january housing wealth still well level prior crisis,wage salary picked early year real disposable income flat february slight decline january housing wealth still well level prior crisis,0
94,2010-04-28,furthermore although banks indicated somewhat greater willingness lend consumers recent months terms standards consumer loans remained restrictive,furthermore although bank indicate somewhat great willingness lend consumer recent month term standard consumer loan remain restrictive,0
95,2010-04-28,additionally consumer sentiment dropped back early april little changed net since beginning year,additionally consumer sentiment drop back early april little change net since begin year,0
96,2010-04-28,starts new single family homes edged up net february march much increase likely reflected delayed projects getting way weather conditions returned normal,start new single family home edge up net february march much increase likely reflect delayed project get way weather condition return normal,0
97,2010-04-28,home sales strengthened noticeably sales new single family homes jumped sales existing single family homes rose well,home sale strengthen noticeably sale new single family home jumped sale exist single family home rise well,0
98,2010-04-28,however new home sales existing home sales likely boosted least part anticipated expiration homebuyer tax credit,however new home sale exist home sale likely boost least part anticipate expiration homebuyer tax credit,0
99,2010-04-28,interest rates conforming  year fixed rate mortgages changed little recent months remained levels low historical standards,interest rate conform year fix rate mortgage change little recent month remain level low historical standard,0
100,2010-04-28,real spending equipment software continued rebound first quarter,real spending equipment software continued rebound first quarter,0
101,2010-04-28,investment high tech equipment transportation advanced further real spending equipment high tech transportation appeared turn sharply falling year suggesting recovery equipment software investment became broadly based,investment high tech equipment transportation advanced far real spending equipment high tech transportation appear turn sharply fall year suggest recovery equipment software investment become broadly base,0
102,2010-04-28,recovery equipment software spending consistent strengthening many indicators business activity,recovery equipment software spending consistent strengthen many indicator business activity,0
103,2010-04-28,contrast nonresidential construction sector continued contract,contrast nonresidential construction sector continued contract,0
104,2010-04-28,real outlays structures outside drilling mining fell steeply last year recent data nominal expenditures february suggested decline first quarter,real outlay structure outside drilling mining fell steeply last year recent data nominal expenditure february suggest decline first quarter,0
105,2010-04-28,weakness widespread across categories likely reflected elevated vacancy rates low levels property prices difficulties obtaining financing new projects,weakness widespread across category likely reflect elevate vacancy rate low level property price difficulty obtain financing new project,0
