,Date,Original,Corpus,Class
83,2011-01-26,foreign currency subcommittee consists chairman vice chairman committee vice chairman board governors member board chairman may designate or absence members board serving subcommittee board members designated chairman alternates absence vice chairman committee vice chairman alternate,foreign currency subcommittee consists chairman vice chairman committee vice chairman board governor member board chairman may designate or absence member board serve subcommittee board member designate chairman alternate absence vice chairman committee vice chairman alternate,0
84,2011-01-26,meetings subcommittee shall called request member request manager system open market account manager purposes reviewing recent contemplated operations consulting manager matters relating manager responsibilities,meeting subcommittee shall call request member request manager system open market account manager purpose review recent contemplate operation consult manager matter relate manager responsibility,0
85,2011-01-26,request member subcommittee questions arising reviews consultations shall referred determination federal open market committee,request member subcommittee question arise review consultation shall refer determination federal open market committee,0
86,2011-01-26,chairman authorized,chairman authorize,0
87,2011-01-26,approval committee enter needed agreement understanding secretary treasury division responsibility foreign currency operations system treasury,approval committee enter need agreement understand secretary treasury division responsibility foreign currency operation system treasury,0
88,2011-01-26,keep secretary treasury fully advised concerning system foreign currency operations consult secretary policy matters relating foreign currency operations,keep secretary treasury fully advise concern system foreign currency operation consult secretary policy matter relate foreign currency operation,0
89,2011-01-26,time time transmit appropriate reports information national advisory council international monetary financial policies,time time transmit appropriate report information national advisory council international monetary financial policy,0
90,2011-01-26,staff officers committee authorized transmit pertinent information system foreign currency operations appropriate officials treasury department,staff officer committee authorize transmit pertinent information system foreign currency operation appropriate official treasury department,0
91,2011-01-26,federal reserve banks shall participate foreign currency operations system account accordance paragraph board governors statement procedure respect foreign relationships federal reserve banks dated january  ,federal reserve bank shall participate foreign currency operation system account accordance paragraph board governor statement procedure respect foreign relationship federal reserve bank date january,0
92,2011-01-26,foreign currency directive reaffirmed january  ,foreign currency directive reaffirm january,0
93,2011-01-26,system operations foreign currencies shall generally directed countering disorderly market conditions provided market exchange ratess dollar reflect actions behavior consistent imf article iv section ,system operation foreign currency shall generally direct counter disorderly market condition provide market exchange rates dollar reflect action behavior consistent imf article iv section,0
94,2011-01-26,achieve end system shall,achieve end system shall,0
95,2011-01-26,undertake spot forward purchases sales foreign exchange,undertake spot forward purchase sale foreign exchange,0
96,2011-01-26,maintain reciprocal currency swap arrangements selected foreign central banks,maintain reciprocal currency swap arrangement select foreign central bank,0
97,2011-01-26,cooperate respects central banks countries international monetary institutions,cooperate respect central bank country international monetary institution,0
98,2011-01-26,transactions may also undertaken,transaction may also undertaken,0
99,2011-01-26,adjust system balances light probable future needs currencies,adjust system balance light probable future need currency,0
100,2011-01-26,provide means meeting system treasury commitments particular currencies facilitate operations exchange stabilization fund,provide mean meeting system treasury commitment particular currency facilitate operation exchange stabilization fund,0
101,2011-01-26,purposes may expressly authorized committee,purpose may expressly authorize committee,0
102,2011-01-26,system foreign currency operations shall conducted,system foreign currency operation shall conduct,0
103,2011-01-26,close continuous consultation cooperation united states treasury,close continuous consultation cooperation united state treasury,0
104,2011-01-26,cooperation appropriate foreign monetary authorities,cooperation appropriate foreign monetary authority,0
105,2011-01-26,manner consistent obligations united states international monetary fund regarding exchange arrangements imf article iv,manner consistent obligation united state international monetary fund regard exchange arrangement imf article iv,0
106,2011-01-26,procedural instructions respect foreign currency operations reaffirmed january  ,procedural instruction respect foreign currency operation reaffirm january,0
107,2011-01-26,conducting operations pursuant authorization direction federal open market committee set forth authorization foreign currency operations foreign currency directive federal reserve bank new york manager system open market account manager shall guided following procedural understandings respect consultations clearances committee foreign currency subcommittee chairman committee unless otherwise directed committee,conduct operation pursuant authorization direction federal open market committee set forth authorization foreign currency operation foreign currency directive federal reserve bank new york manager system open market account manager shall guide follow procedural understanding respect consultation clearance committee foreign currency subcommittee chairman committee unless otherwise direct committee,0
108,2011-01-26,operations undertaken pursuant clearances shall reported promptly committee,operation undertaken pursuant clearance shall report promptly committee,0
109,2011-01-26,manager shall clear subcommittee or chairman chairman believes consultation subcommittee not feasible time available,manager shall clear subcommittee or chairman chairman believe consultation subcommittee not feasible time available,0
110,2011-01-26,operation would result change system overall open position foreign currencies exceeding  million day  million since recent regular meeting committee,operation would result change system overall open position foreign currency exceed million day million since recent regular meeting committee,0
111,2011-01-26,operation would result change day system net position single foreign currency exceeding  million  million operation associated repayment swap drawings,operation would result change day system net position single foreign currency exceed million million operation associate repayment swap drawing,0
112,2011-01-26,operation might generate substantial volume trading particular currency system even though change system net position currency might less limits specified ,operation might generate substantial volume trading particular currency system even though change system net position currency might less limit specify,0
113,2011-01-26,b,b,0
114,2011-01-26,swap drawing proposed foreign bank not exceeding larger  million ii  percent size swap arrangement,swap draw propose foreign bank not exceed large million ii percent size swap arrangement,0
115,2011-01-26,manager shall clear committee or subcommittee subcommittee believes consultation full committee not feasible time available chairman chairman believes consultation subcommittee not feasible time available,manager shall clear committee or subcommittee subcommittee believe consultation full committee not feasible time available chairman chairman believe consultation subcommittee not feasible time available,0
116,2011-01-26,operation would result change system overall open position foreign currencies exceeding ,operation would result change system overall open position foreign currency exceed,0
117,2011-01-26, billion since recent regular meeting committee,billion since recent regular meeting committee,0
118,2011-01-26,swap drawing proposed foreign bank exceeding larger  million ii  percent size swap arrangement,swap draw propose foreign bank exceed large million ii percent size swap arrangement,0
119,2011-01-26,manager shall also consult subcommittee chairman proposed swap drawings system operations not routine character,manager shall also consult subcommittee chairman propose swap drawing system operation not routine character,0
120,2011-01-26,developments financial markets federal reserve balance sheet manager system open market account soma reported developments domestic foreign financial markets period since federal open market committee fomc met december  ,development financial market federal reserve balance sheet manager system open market account soma report development domestic foreign financial market period since federal open market committee fomc met december,0
121,2011-01-26,also reported system open market operations including continuing reinvestment longer term treasury securities principal payments received soma holdings agency debt agency guaranteed mortgage backed securities mbs well ongoing purchases additional treasury securities authorized november   fomc meeting,also report system open market operation include continue reinvestment longer term treasury security principal payment receive soma holding agency debt agency guaranteed mortgage back security mb well ongoing purchase additional treasury security authorize november fomc meeting,0
122,2011-01-26,since first purchase schedule released november fomc meeting open market desk federal reserve bank new york purchased total  billion treasury securities,since first purchase schedule release november fomc meeting open market desk federal reserve bank new york purchase total billion treasury security,0
123,2011-01-26,purchases included  billion associated reinvestment principal payments agency debt mbs  billion associated expansion federal reserve securities holdings,purchase include billion associate reinvestment principal payment agency debt mb billion associate expansion federal reserve security holding,0
124,2011-01-26,maturity distribution desk purchases resulted average duration   years securities obtained,maturity distribution desk purchase result average duration year security obtain,0
125,2011-01-26,manager reported given purchases completed thus far achieving  billion expansion soma portfolio end june  would require purchasing additional securities pace  billion per month,manager report give purchase complete thus far achieve billion expansion soma portfolio end june would require purchasing additional security pace billion per month,0
126,2011-01-26,addition manager provided projections federal reserve balance sheet income alternative assumptions,addition manager provide projection federal reserve balance sheet income alternative assumption,0
127,2011-01-26,no open market operations foreign currencies system account intermeeting period,no open market operation foreign currency system account intermeeting period,0
128,2011-01-26,unanimous vote committee ratified desk transactions intermeeting period,unanimous vote committee ratify desk transaction intermeeting period,0
129,2011-01-26,structural unemployment staff presentation structural unemployment summarized broad range economic research topic conducted across federal reserve system,structural unemployment staff presentation structural unemployment summarize broad range economic research topic conduct across federal reserve system,0
130,2011-01-26,among factors cited could affect level structural unemployment demographics changes intensity job search worker screening differences geographic locations potential workers vacant jobs mismatches characteristics potential workers available jobs,among factor cite could affect level structural unemployment demographic change intensity job search worker screen difference geographic location potential worker vacant job mismatch characteristic potential worker available job,0
131,2011-01-26,research reviewed suggested structural unemployment likely risen recent years less actual unemployment increased,research review suggest structural unemployment likely risen recent year less actual unemployment increase,0
132,2011-01-26,discussing staff presentation meeting participants mentioned various factors seen influencing path unemployment rate,discuss staff presentation meeting participant mention various factor see influence path unemployment rate,0
133,2011-01-26,several participants noted estimates contributions individual factors depended importantly approach taken researchers including models used assumptions made,several participant note estimate contribution individual factor depend importantly approach take researcher include model use assumption make,0
134,2011-01-26,participants noted many factors contributed recent apparent rise structural unemployment likely recede time,participant note many factor contribute recent apparent rise structural unemployment likely recede time,0
135,2011-01-26,participants stressed certain determinants unemployment rate mismatches labor market firms hiring practices difficult measure real time not directly affected monetary policy,participant stress certain determinant unemployment rate mismatch labor market firm hire practice difficult measure real time not directly affected monetary policy,0
136,2011-01-26,others emphasized current situation monetary policy could still play important role reducing unemployment,others emphasize current situation monetary policy could still play important role reduce unemployment,0
137,2011-01-26,staff review economic situation information reviewed january  meeting indicated economic recovery firming though expansion not yet sufficient bring significant improvement labor market conditions,staff review economic situation information review january meeting indicate economic recovery firm though expansion not yet sufficient bring significant improvement labor market condition,0
138,2011-01-26,consumer spending rose strongly late last year ongoing expansion business outlays equipment software appeared sustained recent months,consumer spending rise strongly late last year ongoing expansion business outlay equipment software appear sustain recent month,0
139,2011-01-26,however construction activity residential nonresidential sectors remained weak,however construction activity residential nonresidential sector remain weak,0
140,2011-01-26,industrial production increased solidly november december,industrial production increase solidly november december,0
141,2011-01-26,modest gains employment continued unemployment rate remained elevated,modest gain employment continued unemployment rate remain elevate,0
142,2011-01-26,despite increases commodity prices measures underlying inflation remained subdued longer run inflation expectations stable,despite increase commodity price measure underlie inflation remain subdue longer run inflation expectation stable,0
143,2011-01-26,labor market situation continued improve gradually,labor market situation continued improve gradually,0
144,2011-01-26,private nonfarm payroll employment increased december pace roughly average  whole average workweek employees unchanged,private nonfarm payroll employment increase december pace roughly average whole average workweek employee unchanged,0
145,2011-01-26,services industries continued add new jobs private sector,service industry continued add new job private sector,0
146,2011-01-26,initial claims unemployment insurance trended lower december early january indicators job openings firms hiring plans improved,initial claim unemployment insurance trend low december early january indicator job opening firm hire plan improve,0
147,2011-01-26,unemployment rate decreased ,unemployment rate decrease,0
148,2011-01-26, percent december decline part reflected drop labor force participation rate,percent december decline part reflect drop labor force participation rate,0
149,2011-01-26,long duration unemployment remained elevated employment population ratio still low level end year,long duration unemployment remain elevate employment population ratio still low level end year,0
150,2011-01-26,total industrial production posted solid increases november december part colder weather boosted output utilities,total industrial production post solid increase november december part colder weather boost output utility,0
151,2011-01-26,although motor vehicle assemblies dropped back months production manufacturing sector outside motor vehicles posted solid gains fairly widespread across industries result capacity utilization manufacturing increased further although remained long run average,although motor vehicle assembly drop back month production manufacturing sector outside motor vehicle post solid gain fairly widespread across industry result capacity utilization manufacturing increase far although remain long run average,0
152,2011-01-26,indicators near term industrial activity new orders diffusion indexes national regional manufacturing surveys levels consistent increases industrial production near term addition motor vehicle production scheduled move early ,indicator near term industrial activity new order diffusion index national regional manufacturing survey level consistent increase industrial production near term addition motor vehicle production schedule move early,0
153,2011-01-26,growth consumer spending appeared picked fourth quarter modest pace seen earlier year,growth consumer spending appear picked fourth quarter modest pace see earlier year,0
154,2011-01-26,nominal retail sales excluding purchases motor vehicles parts rose december following substantial increases previous four months,nominal retail sale exclude purchase motor vehicle part rise december follow substantial increase previous four month,0
155,2011-01-26,addition sales new light motor vehicles climbed december stepping higher level preceding two months,addition sale new light motor vehicle climbed december step high level precede two month,0
156,2011-01-26,available data suggested consumer spending supported gains personal income fourth quarter ,available data suggest consumer spending support gain personal income fourth quarter,0
157,2011-01-26,moreover household net worth appeared risen fourth quarter large increase equity prices offset declines house values,moreover household net worth appear risen fourth quarter large increase equity price offset decline house value,0
158,2011-01-26,consumer credit started increase october november generally declined since fall ,consumer credit start increase october november generally decline since fall,0
159,2011-01-26,however consumer sentiment edged up net december early january still relatively subdued level,however consumer sentiment edge up net december early january still relatively subdue level,0
160,2011-01-26,activity housing market remained weak environment characterized soft demand large inventory foreclosed distressed properties market tight credit conditions construction loans mortgages,activity housing market remain weak environment characterize soft demand large inventory foreclose distressed property market tight credit condition construction loan mortgage,0
161,2011-01-26,starts permits new single family homes november december still near low levels recorded since midyear,start permit new single family home november december still near low level record since midyear,0
162,2011-01-26,sales new homes rose december remained historically low,sale new home rise december remain historically low,0
163,2011-01-26,sales existing homes increased november december depressed levels seen summer early autumn sales stayed relatively weak well,sale exist home increase november december depressed level see summer early autumn sale stayed relatively weak well,0
164,2011-01-26,moreover measures house prices declined recent months survey responses indicated households remained concerned home values might continue fall,moreover measure house price decline recent month survey response indicate household remain concerned home value might continue fall,0
165,2011-01-26,real business investment equipment software appeared increased fourth quarter although likely moderate rate first three quarters ,real business investment equipment software appear increase fourth quarter although likely moderate rate first three quarter,0
166,2011-01-26,declining october nominal orders shipments nondefense capital goods excluding aircraft rose november level new orders remained level shipments indicating backlog unfilled orders still rising,decline october nominal order shipment nondefense capital good exclude aircraft rise november level new order remain level shipment indicate backlog unfilled order still rise,0
167,2011-01-26,available indicators suggested business purchases software stayed solid uptrend outlays computing communications equipment appeared risen briskly,available indicator suggest business purchase software stayed solid uptrend outlay compute communication equipment appear risen briskly,0
168,2011-01-26,however business spending transportation equipment including aircraft motor vehicles likely declined fourth quarter  expanding rapidly earlier year,however business spending transportation equipment include aircraft motor vehicle likely decline fourth quarter expand rapidly earlier year,0
169,2011-01-26,surveys purchasing managers reported firms planned increase capital spending year,survey purchasing manager report firm plan increase capital spending year,0
170,2011-01-26,reports planned capital expenditures small businesses showed signs improvement recent months although remained relatively subdued,report plan capital expenditure small business show sign improvement recent month although remain relatively subdue,0
171,2011-01-26,business outlays nonresidential structures stayed weak reflecting high vacancy rates low property values office commercial properties well tight credit conditions commercial real estate,business outlay nonresidential structure stayed weak reflect high vacancy rate low property value office commercial property well tight credit condition commercial real estate,0
172,2011-01-26,contrast investment drilling mining structures increased buoyed rising energy prices,contrast investment drilling mining structure increase buoyed rise energy price,0
173,2011-01-26,real nonfarm inventory investment appeared slowed substantially fourth quarter sizable increase previous quarter,real nonfarm inventory investment appear slow substantially fourth quarter sizable increase previous quarter,0
174,2011-01-26,much fourth quarter downswing likely associated drawdown motor vehicle stocks accumulation third quarter,much fourth quarter downswing likely associate drawdown motor vehicle stock accumulation third quarter,0
175,2011-01-26,book value data october november suggested pace inventory accumulation also slowing outside motor vehicle sector,book value data october november suggest pace inventory accumulation also slow outside motor vehicle sector,0
176,2011-01-26,inventory sales ratios toward end  close pre recession norms purchasing managers surveyed december reported customers inventories not high,inventory sale ratio toward end close pre recession norm purchasing manager survey december report customer inventory not high,0
177,2011-01-26,measures underlying consumer price inflation remained low,measure underlie consumer price inflation remain low,0
178,2011-01-26,december core consumer price index cpi edged up goods prices unchanged prices non energy services rose slightly,december core consumer price index cpi edge up good price unchanged price non energy service rise slightly,0
179,2011-01-26, month change core cpi remained near low readings previous two months,month change core cpi remain near low reading previous two month,0
180,2011-01-26,measures underlying inflation trimmed mean median cpis also remained subdued,measure underlie inflation trim mean median cpi also remain subdue,0
181,2011-01-26,despite steep run agricultural commodity prices second half last year increases retail food prices remained modest,despite steep run agricultural commodity price second half last year increase retail food price remain modest,0
182,2011-01-26,however consumer energy prices moved sharply december prices types crude oil increased december january,however consumer energy price move sharply december price type crude oil increase december january,0
183,2011-01-26,prices nonfuel industrial commodities also continued rise intermeeting period,price nonfuel industrial commodity also continued rise intermeeting period,0
184,2011-01-26,december early january survey measures households long term inflation expectations stayed range prevailed time,december early january survey measure household long term inflation expectation stayed range prevail time,0
185,2011-01-26,available measures labor compensation showed labor cost pressures still restrained wage increases slowed along inflation productivity gains appeared remain substantial,available measure labor compensation show labor cost pressure still restrain wage increase slow along inflation productivity gain appear remain substantial,0
186,2011-01-26, month change average hourly earnings employees continued low december,month change average hourly earnings employee continued low december,0
