,Date,Original,Corpus,Class
282,2011-01-26,although business contacts remained somewhat cautious economic outlook generally indicated greater optimism regarding prospects sales hiring time previous meeting,although business contact remain somewhat cautious economic outlook generally indicate great optimism regard prospect sale hire time previous meeting,0
283,2011-01-26,participants viewed downside risks forecasts economic activity projection period diminished assessment likely outcomes economic activity inflation projection period not greatly changed,participant view downside risk forecast economic activity projection period diminish assessment likely outcome economic activity inflation projection period not greatly change,0
284,2011-01-26,participants raised forecast real gdp growth  somewhat continued anticipate stronger growth year  gradual acceleration  ,participant raise forecast real gdp growth somewhat continued anticipate strong growth year gradual acceleration,0
285,2011-01-26,unemployment rate still projected decline gradually forecast period remain elevated,unemployment rate still project decline gradually forecast period remain elevate,0
286,2011-01-26,total inflation still expected remain subdued core inflation projected trend slowly next years economic activity picks inflation expectations remain well anchored,total inflation still expect remain subdue core inflation project trend slowly next year economic activity pick inflation expectation remain well anchor,0
287,2011-01-26,participants judgment economic recovery firmer footing supported strength household spending fourth quarter,participant judgment economic recovery firmer footing support strength household spending fourth quarter,0
288,2011-01-26,incoming data indicated households stepped sharply purchases durable goods particularly automobiles last quarter,incoming data indicate household step sharply purchase durable good particularly automobile last quarter,0
289,2011-01-26,spending luxury goods also increased pace holiday sales better recent years,spending luxury good also increase pace holiday sale well recent year,0
290,2011-01-26,however participants noted not clear whether recent pace consumer spending would sustained,however participant note not clear whether recent pace consumer spending would sustain,0
291,2011-01-26,one hand additional spending could reflect pent demand following downturn greater confidence part households future case might expected continue,one hand additional spending could reflect pent demand follow downturn great confidence part household future case might expect continue,0
292,2011-01-26,hand additional spending could prove short lived given good portion appeared occurred relatively volatile categories autos,hand additional spending could prove short live give good portion appear occur relatively volatile category auto,0
293,2011-01-26,activity business sector also indicated economic recovery remained track,activity business sector also indicate economic recovery remain track,0
294,2011-01-26,instance indicators business investment equipment software continued rise,instance indicator business investment equipment software continued rise,0
295,2011-01-26,industrial production posted solid gains supported parts exports appeared noticeably stronger fourth quarter,industrial production post solid gain support part export appear noticeably strong fourth quarter,0
296,2011-01-26,wide range business contacts expressed cautious optimism durability strength recovery planning expansion production order meet anticipated rise sales,wide range business contact express cautious optimism durability strength recovery planning expansion production order meet anticipate rise sale,0
297,2011-01-26,addition although residential construction spending remained weak spending commercial construction projects showed tentative signs bottoming out,addition although residential construction spending remain weak spending commercial construction project show tentative sign bottoming out,0
298,2011-01-26,participants noted conditions labor markets continued improve gradually,participant note condition labor market continued improve gradually,0
299,2011-01-26,payroll employment increased modest pace and although data somewhat erratic slight downward trend apparent recent pattern weekly initial claims unemployment insurance,payroll employment increase modest pace and although data somewhat erratic slight downward trend apparent recent pattern weekly initial claim unemployment insurance,0
300,2011-01-26,addition surveys employers suggested somewhat upbeat outlook employment,addition survey employer suggest somewhat upbeat outlook employment,0
301,2011-01-26,business contacts provided range information regarding hiring intentions indicating workers skill levels readily obtainable others reported upgraded skill requirements currently unemployed not meet new requirements,business contact provide range information regard hire intention indicate worker skill level readily obtainable others report upgraded skill requirement currently unemployed not meet new requirement,0
302,2011-01-26,businesses remained reluctant add permanent positions planning meet labor requirements temporary workers,business remain reluctant add permanent position planning meet labor requirement temporary worker,0
303,2011-01-26,overall meeting participants continued express disappointment pace unevenness improvements labor markets noted would monitor labor market developments closely,overall meeting participant continued express disappointment pace unevenness improvement labor market note would monitor labor market development closely,0
304,2011-01-26,conditions financial markets improved somewhat intermeeting period,condition financial market improve somewhat intermeeting period,0
305,2011-01-26,broad equity prices rose adding substantial gains since middle ,broad equity price rise add substantial gain since middle,0
306,2011-01-26,yields longer term nominal treasury securities little changed balance period increased quite bit recent months leaving treasury yield curve noticeably steeper,yield longer term nominal treasury security little change balance period increase quite bit recent month leave treasury yield curve noticeably steeper,0
307,2011-01-26,participants noted steep yield curve typical feature economy recovery much steepening appeared occurred response stronger expected economic data,participant note steep yield curve typical feature economy recovery much steepen appear occur response strong expect economic data,0
308,2011-01-26,market based measures inflation compensation next years increased intermeeting period extending rise occurred recent months,market base measure inflation compensation next year increase intermeeting period extend rise occur recent month,0
309,2011-01-26,participants suggested increase likely reflected part decline investors perceptions near term risk disinflation,participant suggest increase likely reflect part decline investor perception near term risk disinflation,0
310,2011-01-26,time longer term inflation expectations remained stable,time longer term inflation expectation remain stable,0
311,2011-01-26,credit spreads debt nonfinancial corporations continued narrow period reaching levels noticeably lower posted several months ago largest declines coming speculative grade bonds,credit spread debt nonfinancial corporation continued narrow period reach level noticeably low post several month ago large decline come speculative grade bond,0
312,2011-01-26,however credit conditions remained tight smaller bank dependent firms although bank loan growth clearly picked sectors,however credit condition remain tight small bank dependent firm although bank loan growth clearly picked sector,0
313,2011-01-26,participants noted that taken together financial developments consistent accommodative stance monetary policy since last summer reduction risk aversion part market participants,participant note that take together financial development consistent accommodative stance monetary policy since last summer reduction risk aversion part market participant,0
314,2011-01-26,meeting participants noted headline inflation boosted higher prices energy commodities well increases prices imported goods,meeting participant note headline inflation boost high price energy commodity well increase price import good,0
315,2011-01-26,participants indicated unit labor costs generally declined profit margins wide higher commodity prices boosting costs production many firms,participant indicate unit labor cost generally decline profit margin wide high commodity price boost cost production many firm,0
316,2011-01-26,business contacts indicated going try pass portion higher costs customers uncertain whether would possible given current market conditions,business contact indicate go try pas portion high cost customer uncertain whether would possible give current market condition,0
317,2011-01-26,many participants expected that significant slack resource markets longer term inflation expectations stable measures core inflation would remain close current levels coming quarters,many participant expect that significant slack resource market longer term inflation expectation stable measure core inflation would remain close current level come quarter,0
318,2011-01-26,however importance resource slack factor influencing inflation debated participants suggested variables current expected rates economic growth could useful indicators inflation pressures,however importance resource slack factor influence inflation debate participant suggest variable current expect rate economic growth could useful indicator inflation pressure,0
319,2011-01-26,overall participants indicated somewhat better expected economic data anecdotal information business contacts importantly increased confidence continuation moderate recovery activity year,overall participant indicate somewhat well expect economic data anecdotal information business contact importantly increase confidence continuation moderate recovery activity year,0
320,2011-01-26,accordingly participants generally agreed downside risks forecasts economic growth inflation well odds period deflation diminished,accordingly participant generally agree downside risk forecast economic growth inflation well odds period deflation diminish,0
321,2011-01-26,participants also generally agreed recent data not led significantly change outlooks likely rates economic growth inflation coming quarters,participant also generally agree recent data not lead significantly change outlook likely rate economic growth inflation come quarter,0
322,2011-01-26,participants noted strength recent data reflected factors could prove temporary large contribution net exports volatile category sharp step auto sales,participant note strength recent data reflect factor could prove temporary large contribution net export volatile category sharp step auto sale,0
323,2011-01-26,participants continued anticipate recovery economic activity likely restrained variety economic factors including still high unemployment modest income growth lower housing wealth high rates mortgage foreclosure elevated inventories unsold homes tight credit conditions number sectors,participant continued anticipate recovery economic activity likely restrain variety economic factor include still high unemployment modest income growth low housing wealth high rate mortgage foreclosure elevate inventory unsold home tight credit condition number sector,0
324,2011-01-26,addition although many business contacts expressed optimism economic recovery number aimed recent investments primarily enhancing productivity rather expanding employment hiring businesses reportedly focused temporary workers,addition although many business contact express optimism economic recovery number aim recent investment primarily enhance productivity rather expand employment hire business reportedly focus temporary worker,0
325,2011-01-26,participants noted incoming data production spending employment would need solid longer justify significant upward revision outlook likely pace recovery,participant note incoming data production spending employment would need solid longer justify significant upward revision outlook likely pace recovery,0
326,2011-01-26,participants generally saw risks outlook economic growth employment become broadly balanced continued see significant risks sides outlook,participant generally saw risk outlook economic growth employment become broadly balance continued see significant risk side outlook,0
327,2011-01-26,downside participants remained worried possible effects spillovers banking fiscal strains peripheral europe ongoing fiscal adjustmentss state local governments continued weakness housing market,downside participant remain worried possible effect spillover banking fiscal strain peripheral europe ongoing fiscal adjustment state local government continued weakness housing market,0
328,2011-01-26,upside recent strength household spending raised possibility domestic final demand could snap back rapidly anticipated,upside recent strength household spending raise possibility domestic final demand could snap back rapidly anticipate,0
329,2011-01-26,so considerably stronger recovery could take hold line sorts recoveries seen following deep economic recessions past,so considerably strong recovery could take hold line sort recovery see follow deep economic recession past,0
330,2011-01-26,regarding risks inflation outlook participants noted increases energy commodity prices well prices imported goods emes posed upside risks,regard risk inflation outlook participant note increase energy commodity price well price import good emes pose upside risk,0
331,2011-01-26,others however noted pass increases commodity prices broad measures consumer price inflation united states generally fairly small,others however note pas increase commodity price broad measure consumer price inflation united state generally fairly small,0
332,2011-01-26,participants expressed concern situation businesses unable raise prices response higher costs time firms might increase substantially found sufficient pricing power,participant express concern situation business unable raise price response high cost time firm might increase substantially found sufficient pricing power,0
333,2011-01-26,case factors affecting ability businesses pass higher prices consumers viewed complex hard monitor real time,case factor affect ability business pas high price consumer view complex hard monitor real time,0
334,2011-01-26,participants saw large degree resource slack economy likely remain force restraining inflation risk disinflation declined number participants cited concerns inflation mandate consistent level expected remain time,participant saw large degree resource slack economy likely remain force restrain inflation risk disinflation decline number participant cite concern inflation mandate consistent level expect remain time,0
335,2011-01-26,finally participants noted large size federal reserve balance sheet led public doubt committee ability withdraw monetary accommodation becomes appropriate result could upward pressure inflation expectations actual inflation,finally participant note large size federal reserve balance sheet lead public doubt committee ability withdraw monetary accommodation becomes appropriate result could upward pressure inflation expectation actual inflation,0
336,2011-01-26,mitigate risks noted committee continue planning eventual exit current exceptionally accommodative stance policy,mitigate risk note committee continue planning eventual exit current exceptionally accommodative stance policy,0
337,2011-01-26,committee policy action discussion monetary policy period ahead members agreed no changes committee asset purchase program target range federal funds rate warranted meeting,committee policy action discussion monetary policy period ahead member agree no change committee asset purchase program target range federal fund rate warrant meeting,0
338,2011-01-26,information received intermeeting period increased members confidence sustainability economic recovery pace recovery insufficient bring significant improvement labor market conditions measures underlying inflation trended downward,information receive intermeeting period increase member confidence sustainability economic recovery pace recovery insufficient bring significant improvement labor market condition measure underlie inflation trend downward,0
339,2011-01-26,moreover economic projections submitted meeting indicated unemployment expected remain above inflation remain somewhat below levels consistent committee objectives time,moreover economic projection submit meeting indicate unemployment expect remain above inflation remain somewhat below level consistent committee objective time,0
340,2011-01-26,accordingly committee agreed continue expand holdings longer term treasury securities announced november order promote stronger pace economic recovery help ensure inflation time levels consistent committee mandate,accordingly committee agree continue expand holding longer term treasury security announce november order promote strong pace economic recovery help ensure inflation time level consistent committee mandate,0
341,2011-01-26,committee decided maintain existing policy reinvesting principal payments securities holdings reaffirmed intention purchase  billion longer term treasury securities end second quarter ,committee decide maintain exist policy reinvesting principal payment security holding reaffirm intention purchase billion longer term treasury security end second quarter,0
342,2011-01-26,members remained unsure likely effects asset purchase program economy felt making changes program time not appropriate,member remain unsure likely effect asset purchase program economy felt make change program time not appropriate,0
343,2011-01-26,members emphasized committee would continue regularly review pace securities purchases overall size asset purchase program light incoming information including information outlook economic activity developments financial markets efficacy purchase program unintended consequences might arise would adjust program needed best foster maximum employment price stability,member emphasize committee would continue regularly review pace security purchase overall size asset purchase program light incoming information include information outlook economic activity development financial market efficacy purchase program unintended consequence might arise would adjust program need best foster maximum employment price stability,0
344,2011-01-26,members noted additional data pointing sufficiently strong recovery could make appropriate consider reducing pace overall size purchase program,member note additional data point sufficiently strong recovery could make appropriate consider reduce pace overall size purchase program,0
345,2011-01-26,however others pointed unlikely outlook would change enough substantiate adjustments program completion,however others point unlikely outlook would change enough substantiate adjustment program completion,0
346,2011-01-26,addition committee reiterated expectation economic conditions likely warrant exceptionally low levels federal funds rate extended period,addition committee reiterate expectation economic condition likely warrant exceptionally low level federal fund rate extend period,0
347,2011-01-26,respect statement released following meeting members agreed small changes necessary reflect improvement near term economic outlook make clear policy decision reflected continuation asset purchase program announced november,respect statement release follow meeting member agree small change necessary reflect improvement near term economic outlook make clear policy decision reflect continuation asset purchase program announce november,0
348,2011-01-26,conclusion discussion committee voted authorize direct federal reserve bank new york instructed otherwise execute transactions system account accordance following domestic policy directive,conclusion discussion committee vote authorize direct federal reserve bank new york instruct otherwise execute transaction system account accordance follow domestic policy directive,0
349,2011-01-26,vote encompassed approval statement released,vote encompass approval statement release,0
350,2011-01-26,information received since federal open market committee met december confirms economic recovery continuing though rate insufficient bring significant improvement labor market conditions,information receive since federal open market committee met december confirms economic recovery continue though rate insufficient bring significant improvement labor market condition,0
351,2011-01-26,growth household spending picked late last year remains constrained high unemployment modest income growth lower housing wealth tight credit,growth household spending picked late last year remains constrain high unemployment modest income growth low housing wealth tight credit,0
352,2011-01-26,business spending equipment software rising investment nonresidential structures still weak,business spending equipment software rise investment nonresidential structure still weak,0
353,2011-01-26,employers remain reluctant add payrolls,employer remain reluctant add payroll,0
354,2011-01-26,housing sector continues depressed,housing sector continue depressed,0
355,2011-01-26,although commodity prices risen longer term inflation expectations remained stable measures underlying inflation trending downward,although commodity price risen longer term inflation expectation remain stable measure underlie inflation trend downward,0
356,2011-01-26,consistent statutory mandate committee seeks foster maximum employment price stability,consistent statutory mandate committee seek foster maximum employment price stability,0
357,2011-01-26,currently unemployment rate elevated measures underlying inflation somewhat low relative levels committee judges consistent longer run dual mandate,currently unemployment rate elevate measure underlie inflation somewhat low relative level committee judge consistent longer run dual mandate,0
358,2011-01-26,although committee anticipates gradual return higher levels resource utilization context price stability progress toward objectives disappointingly slow,although committee anticipates gradual return high level resource utilization context price stability progress toward objective disappointingly slow,0
359,2011-01-26,promote stronger pace economic recovery help ensure inflation time levels consistent mandate committee decided today continue expanding holdings securities announced november,promote strong pace economic recovery help ensure inflation time level consistent mandate committee decide today continue expand holding security announce november,0
360,2011-01-26,particular committee maintaining existing policy reinvesting principal payments securities holdings intends purchase  billion longer term treasury securities end second quarter ,particular committee maintain exist policy reinvesting principal payment security holding intend purchase billion longer term treasury security end second quarter,0
361,2011-01-26,committee regularly review pace securities purchases overall size asset purchase program light incoming information adjust program needed best foster maximum employment price stability,committee regularly review pace security purchase overall size asset purchase program light incoming information adjust program need best foster maximum employment price stability,0
362,2011-01-26,committee maintain target range federal funds rate   percent continues anticipate economic conditions including low rates resource utilization subdued inflation trends stable inflation expectations likely warrant exceptionally low levels federal funds rate extended period,committee maintain target range federal fund rate percent continue anticipate economic condition include low rate resource utilization subdue inflation trend stable inflation expectation likely warrant exceptionally low level federal fund rate extend period,0
363,2011-01-26,committee continue monitor economic outlook financial developments employ policy tools necessary support economic recovery help ensure inflation time levels consistent mandate,committee continue monitor economic outlook financial development employ policy tool necessary support economic recovery help ensure inflation time level consistent mandate,0
364,2011-01-26,voting action ben bernanke william dudley elizabeth duke charles evans richard fisher narayana kocherlakota charles plosser sarah bloom raskin daniel tarullo kevin warsh janet yellen,voting action ben bernanke william dudley elizabeth duke charles evans richard fisher narayana kocherlakota charles plosser sarah bloom raskin daniel tarullo kevin warsh janet yellen,0
365,2011-01-26,voting action none,voting action none,0
366,2011-01-26,next committee turned discussion external communications specifically importance communicating broadly effectively,next committee turn discussion external communication specifically importance communicate broadly effectively,0
367,2011-01-26,fomc participants noted importance fair equal access public information could informative future policy decisions considered approaches address issue,fomc participant note importance fair equal access public information could informative future policy decision consider approach address issue,0
368,2011-01-26,several participants noted increased clarity communications key objective referred central role communications monetary policy transmission process,several participant note increase clarity communication key objective refer central role communication monetary policy transmission process,0
