,Date,Original,Corpus,Class
0,2011-01-26,january   ,january,0
1,2011-01-26,present ben bernanke chairman william dudley vice chairman elizabeth duke charles evans richard fisher narayana kocherlakota charles plosser sarah bloom raskin daniel tarullo kevin warsh janet yellen,present ben bernanke chairman william dudley vice chairman elizabeth duke charles evans richard fisher narayana kocherlakota charles plosser sarah bloom raskin daniel tarullo kevin warsh janet yellen,0
2,2011-01-26,jeffrey lacker dennis lockhart john moore sandra pianalto alternate members federal open market committee,jeffrey lacker dennis lockhart john moore sandra pianalto alternate member federal open market committee,0
3,2011-01-26,james bullard thomas hoenig eric rosengren presidents federal reserve banks st louis kansas city boston respectively,james bullard thomas hoenig eric rosengren president federal reserve bank st louis kansa city boston respectively,0
4,2011-01-26,william english secretary economist deborah danker deputy secretary matthew luecke assistant secretary david skidmore assistant secretary michelle smith assistant secretary scott alvarez general counsel thomas baxter deputy general counsel nathan sheets economist david stockton economist,william english secretary economist deborah danker deputy secretary matthew luecke assistant secretary david skidmore assistant secretary michelle smith assistant secretary scott alvarez general counsel thomas baxter deputy general counsel nathan sheet economist david stockton economist,0
5,2011-01-26,james clouse thomas connors steven kamin loretta mester simon potter david reifschneider harvey rosenblum daniel sullivan david wilcox kei mu yi associate economists,james clouse thomas connors steven kamin loretta mester simon potter david reifschneider harvey rosenblum daniel sullivan david wilcox kei mu yi associate economist,0
6,2011-01-26,brian sack manager system open market account,brian sack manager system open market account,0
7,2011-01-26,patrick parkinson director division banking supervision regulation board governors,patrick parkinson director division banking supervision regulation board governor,0
8,2011-01-26,nellie liang director office financial stability policy research board governors,nellie liang director office financial stability policy research board governor,0
9,2011-01-26,william nelson deputy director division monetary affairs board governors,william nelson deputy director division monetary affair board governor,0
10,2011-01-26,linda robertson assistant board office board members board governors,linda robertson assistant board office board member board governor,0
11,2011-01-26,charles struckmeyer deputy staff director office staff director board governors,charles struckmeyer deputy staff director office staff director board governor,0
12,2011-01-26,lawrence slifman william wascher senior associate directors division research statistics board governors,lawrence slifman william wascher senior associate director division research statistic board governor,0
13,2011-01-26,andrew levin senior adviser office board members board governors,andrew levin senior adviser office board member board governor,0
14,2011-01-26,joyce zickler visiting senior adviser division monetary affairs board governors,joyce zickler visit senior adviser division monetary affair board governor,0
15,2011-01-26,daniel covitz associate director division research statistics board governors,daniel covitz associate director division research statistic board governor,0
16,2011-01-26,gretchen weinbach deputy associate director division monetary affairs board governors,gretchen weinbach deputy associate director division monetary affair board governor,0
17,2011-01-26,beth anne wilson assistant director division international finance board governors,beth anne wilson assistant director division international finance board governor,0
18,2011-01-26,bruce fallick group manager division research statistics board governors,bruce fallick group manager division research statistic board governor,0
19,2011-01-26,david small project manager division monetary affairs board governors,david small project manager division monetary affair board governor,0
20,2011-01-26,david arseneau senior economist division international finance board governors stefaniaamico edward nelson senior economists division monetary affairs board governors norman morin senior economist division research statistics board governors,david arseneau senior economist division international finance board governor stefaniaamico edward nelson senior economist division monetary affair board governor norman morin senior economist division research statistic board governor,0
21,2011-01-26,mark carlson economist division monetary affairs board governors,mark carlson economist division monetary affair board governor,0
22,2011-01-26,randall williams records management analyst division monetary affairs board governors,randall williams record management analyst division monetary affair board governor,0
23,2011-01-26,patrick barron first vice president federal reserve bank atlanta,patrick barron first vice president federal reserve bank atlanta,0
24,2011-01-26,mark sniderman executive vice president federal reserve bank cleveland,mark sniderman executive vice president federal reserve bank cleveland,0
25,2011-01-26,david altig alan barkema glenn rudebusch geoffrey tootell christopher waller senior vice presidents federal reserve banks atlanta kansas city san francisco boston st louis respectively,david altig alan barkema glenn rudebusch geoffrey tootell christopher waller senior vice president federal reserve bank atlanta kansa city san francisco boston st louis respectively,0
26,2011-01-26,julie ann remache assistant vice president federal reserve bank new york,julie ann remache assistant vice president federal reserve bank new york,0
27,2011-01-26,aysegl sahin officer federal reserve bank new york,aysegl sahin officer federal reserve bank new york,0
28,2011-01-26,jason faberman robert hetzel senior economists federal reserve banks philadelphia richmond respectively,jason faberman robert hetzel senior economist federal reserve bank philadelphia richmond respectively,0
29,2011-01-26,annual organizational matters agenda meeting reported advices election following members alternate members federal open market committee term beginning january   received individuals executed oaths office,annual organizational matter agenda meeting report advice election follow member alternate member federal open market committee term begin january receive individual execute oath office,0
30,2011-01-26,elected members alternate members follows,elect member alternate member follow,0
31,2011-01-26,william dudley president federal reserve bank new york christine cumming first vice president federal reserve bank new york alternate,william dudley president federal reserve bank new york christine cumming first vice president federal reserve bank new york alternate,0
32,2011-01-26,charles plosser president federal reserve bank philadelphia jeffrey lacker president federal reserve bank richmond alternate,charles plosser president federal reserve bank philadelphia jeffrey lacker president federal reserve bank richmond alternate,0
33,2011-01-26,charles evans president federal reserve bank chicago sandra pianalto president federal reserve bank cleveland alternate,charles evans president federal reserve bank chicago sandra pianalto president federal reserve bank cleveland alternate,0
34,2011-01-26,richard fisher president federal reserve bank dallas dennis lockhart president federal reserve bank atlanta alternate,richard fisher president federal reserve bank dallas dennis lockhart president federal reserve bank atlanta alternate,0
35,2011-01-26,narayana kocherlakota president federal reserve bank minneapolis john moore first vice president federal reserve bank san francisco alternate,narayana kocherlakota president federal reserve bank minneapolis john moore first vice president federal reserve bank san francisco alternate,0
36,2011-01-26,unanimous vote following officers federal open market committee selected serve selection successors first regularly scheduled meeting committee ,unanimous vote follow officer federal open market committee select serve selection successor first regularly schedule meeting committee,0
37,2011-01-26,unanimous vote federal reserve bank new york selected execute transactions system open market account,unanimous vote federal reserve bank new york select execute transaction system open market account,0
38,2011-01-26,unanimous vote brian sack selected serve pleasure committee manager system open market account understanding selection subject satisfactory federal reserve bank new york,unanimous vote brian sack select serve pleasure committee manager system open market account understand selection subject satisfactory federal reserve bank new york,0
39,2011-01-26,unanimous vote committee adopted program security fomc information amendments section ongoing responsibility maintaining confidentiality number technical updates,unanimous vote committee adopt program security fomc information amendment section ongoing responsibility maintain confidentiality number technical update,0
40,2011-01-26,unanimous vote authorization domestic open market operations reaffirmed form shown below,unanimous vote authorization domestic open market operation reaffirm form show below,0
41,2011-01-26,guidelines conduct system open market operations federal agency issues remained suspended,guideline conduct system open market operation federal agency issue remain suspend,0
42,2011-01-26,authorization domestic open market operations reaffirmed january  ,authorization domestic open market operation reaffirm january,0
43,2011-01-26,federal open market committee authorizes directs federal reserve bank new york extent necessary carry recent domestic policy directive adopted meeting committee,federal open market committee authorizes directs federal reserve bank new york extent necessary carry recent domestic policy directive adopt meeting committee,0
44,2011-01-26,buy sells government securities including securities federal financing bank securities direct obligations of fully guaranteed principal interest by agency united states open market securities dealers foreign international accounts maintained federal reserve bank new york cash regular deferred delivery basis system open market account market prices and account exchange maturings government federal agency securities treasury individual agencies allow mature without replacement,buy sell government security include security federal financing bank security direct obligation of fully guaranteed principal interest by agency united state open market security dealer foreign international account maintain federal reserve bank new york cash regular defer delivery basis system open market account market price and account exchange maturings government federal agency security treasury individual agency allow mature without replacement,0
45,2011-01-26,buy sell open markets government securities securities direct obligations of fully guaranteed principal interest by agency united states system open market account agreements resell repurchase securities obligations including transactions commonly referred repo reverse repo transactions  business days less rates that unless otherwise expressly authorized committee shall determined competitive bidding applying reasonable limitations volume agreements individual counterparties,buy sell open market government security security direct obligation of fully guaranteed principal interest by agency united state system open market account agreement resell repurchase security obligation include transaction commonly refer repo reverse repo transaction business day less rate that unless otherwise expressly authorize committee shall determine competitive bidding apply reasonable limitation volume agreement individual counterparties,0
46,2011-01-26,order ensure effective conduct open market operations federal open market committee authorizes federal reserve bank new york use agents agency mbs related transactions,order ensure effective conduct open market operation federal open market committee authorizes federal reserve bank new york use agent agency mb related transaction,0
47,2011-01-26,order ensure effective conduct open market operations federal open market committee authorizes federal reserve bank new york lend overnight basiss government securities securities direct obligations agency united states held system open market account dealers rates shall determined competitive bidding,order ensure effective conduct open market operation federal open market committee authorizes federal reserve bank new york lend overnight basis government security security direct obligation agency united state held system open market account dealer rate shall determine competitive bidding,0
48,2011-01-26,federal reserve bank new york shall set minimum lending fee consistent objectives program apply reasonable limitations total amount specific issue may auctioned amount securities dealer may borrow,federal reserve bank new york shall set minimum lending fee consistent objective program apply reasonable limitation total amount specific issue may auction amount security dealer may borrow,0
49,2011-01-26,federal reserve bank new york may reject bids could facilitate dealer ability control single issue determined solely federal reserve bank new york,federal reserve bank new york may reject bid could facilitate dealer ability control single issue determine solely federal reserve bank new york,0
50,2011-01-26,order ensure effective conduct open market operations assisting provision short term investments foreign international accounts maintained federal reserve bank new york accounts maintained federal reserve bank new york fiscal agent united states pursuant section  federal reserve act federal open market committee authorizes directs federal reserve bank new york,order ensure effective conduct open market operation assist provision short term investment foreign international account maintain federal reserve bank new york account maintain federal reserve bank new york fiscal agent united state pursuant section federal reserve act federal open market committee authorizes directs federal reserve bank new york,0
51,2011-01-26,system open market account sells government securities securities direct obligations of fully guaranteed principal interest by agency united states accounts bases set forth paragraph ,system open market account sell government security security direct obligation of fully guaranteed principal interest by agency united state account base set forth paragraph,0
52,2011-01-26,agreements providing resale accounts securities  business days less terms comparable available transactions market,agreement provide resale account security business day less term comparable available transaction market,0
53,2011-01-26,new york bank account appropriate undertake dealers subject conditions imposed purchases sales securities paragraphb repurchase agreementss government securities securities direct obligations of fully guaranteed principal interest by agency united states arrange corresponding sale repurchase agreements account foreign international fiscal agency accounts maintained bank,new york bank account appropriate undertake dealer subject condition impose purchase sale security paragraphb repurchase agreement government security security direct obligation of fully guaranteed principal interest by agency united state arrange correspond sale repurchase agreement account foreign international fiscal agency account maintain bank,0
54,2011-01-26,transactions undertaken accounts provisions paragraph may provide service fee appropriate,transaction undertaken account provision paragraph may provide service fee appropriate,0
55,2011-01-26,execution committee decision regarding policy intermeeting period committee authorizes directs federal reserve bank new york upon instruction chairman committee adjust somewhat exceptional circumstances degree pressure reserve positions hence intended federal funds rate take actions result material changes composition size assets system open market account anticipated committee recent meeting,execution committee decision regard policy intermeeting period committee authorizes directs federal reserve bank new york upon instruction chairman committee adjust somewhat exceptional circumstance degree pressure reserve position hence intend federal fund rate take action result material change composition size asset system open market account anticipate committee recent meeting,0
56,2011-01-26,adjustment shall made context committee discussion decision recent meeting committee long run objectives price stability sustainable economic growth shall based economic financial monetary developments intermeeting period,adjustment shall make context committee discussion decision recent meeting committee long run objective price stability sustainable economic growth shall base economic financial monetary development intermeeting period,0
57,2011-01-26,consistent committee practice chairman feasible consult committee making adjustment,consistent committee practice chairman feasible consult committee make adjustment,0
58,2011-01-26,unanimous vote authorization foreign currency operations foreign currency directive procedural instructions respect foreign currency operations reaffirmed form shown below,unanimous vote authorization foreign currency operation foreign currency directive procedural instruction respect foreign currency operation reaffirm form show below,0
59,2011-01-26,vote reaffirm documents included approval system warehousing agreements treasury,vote reaffirm document include approval system warehouse agreement treasury,0
60,2011-01-26,authorization foreign currency operations reaffirmed january  ,authorization foreign currency operation reaffirm january,0
61,2011-01-26,federal open market committee authorizes directs federal reserve bank new york system open market account extent necessary carry committee foreign currency directive express authorizations committee pursuant thereto conformity procedural instructions committee may issue time time,federal open market committee authorizes directs federal reserve bank new york system open market account extent necessary carry committee foreign currency directive express authorization committee pursuant thereto conformity procedural instruction committee may issue time time,0
62,2011-01-26,purchase sell following foreign currencies form cable transfers spot forward transactions open market home abroad including transactionss treasury us exchange stabilization fund established section  gold reserve act  foreign monetary authorities bank international settlements international financial institutions,purchase sell follow foreign currency form cable transfer spot forward transaction open market home abroad include transactions treasury u exchange stabilization fund establish section gold reserve act foreign monetary authority bank international settlement international financial institution,0
63,2011-01-26,hold balances of outstanding forward contracts receive deliver foreign currencies listed paragraph above,hold balance of outstanding forward contract receive deliver foreign currency list paragraph above,0
64,2011-01-26,draw foreign currencies permit foreign banks draw dollars reciprocal currency arrangements listed paragraph  below provided drawings either party arrangement shall fully liquidated within  months amount outstanding time first drawn unless committee exceptional circumstances specifically authorizes delay,draw foreign currency permit foreign bank draw dollar reciprocal currency arrangement list paragraph below provide drawing either party arrangement shall fully liquidate within month amount outstanding time first drawn unless committee exceptional circumstance specifically authorizes delay,0
65,2011-01-26,maintain overall open position foreign currencies not exceeding ,maintain overall open position foreign currency not exceed,0
66,2011-01-26, billion,billion,0
67,2011-01-26,purpose overall open position foreign currencies defined sum disregarding signs net positions individual currencies excluding changes dollar value due foreign exchange rate movements interest accruals,purpose overall open position foreign currency define sum disregard sign net position individual currency exclude change dollar value due foreign exchange rate movement interest accrual,0
68,2011-01-26,net position single foreign currency defined holdings balances currency plus outstanding contracts future receipt minus outstanding contracts future delivery currency ie sum elements due regard sign,net position single foreign currency define holding balance currency plus outstanding contract future receipt minus outstanding contract future delivery currency ie sum element due regard sign,0
69,2011-01-26,federal open market committee directs federal reserve bank new york maintain reciprocal currency arrangements swap arrangements system open market account periods maximum  months following foreign banks among designated board governors federal reserve system section ,federal open market committee directs federal reserve bank new york maintain reciprocal currency arrangement swap arrangement system open market account period maximum month follow foreign bank among designate board governor federal reserve system section,0
70,2011-01-26, regulation relations foreign banks bankers approval committee renew arrangements maturity,regulation relation foreign bank banker approval committee renew arrangement maturity,0
71,2011-01-26,changes terms existing swap arrangements proposed terms new arrangements may authorized shall referred review approval committee,change term exist swap arrangement propose term new arrangement may authorize shall refer review approval committee,0
72,2011-01-26,transactions foreign currencies undertaken paragraph ,transaction foreign currency undertaken paragraph,0
73,2011-01-26,shall unless otherwise expressly authorized committee prevailing market rates,shall unless otherwise expressly authorize committee prevail market rate,0
74,2011-01-26,purpose providing investment return system holdings foreign currencies purpose adjusting interest rates paid received connection swap drawings transactions foreign central banks may undertaken nonmarket exchange rates,purpose provide investment return system holding foreign currency purpose adjust interest rate paid receive connection swap drawing transaction foreign central bank may undertaken nonmarket exchange rate,0
75,2011-01-26,shall normal practice arrange foreign central banks coordination foreign currency transactions,shall normal practice arrange foreign central bank coordination foreign currency transaction,0
76,2011-01-26,making operating arrangements foreign central banks system holdings foreign currencies federal reserve bank new york shall not commit maintain specific balance unless authorized federal open market committee,make operating arrangement foreign central bank system holding foreign currency federal reserve bank new york shall not commit maintain specific balance unless authorize federal open market committee,0
77,2011-01-26,agreements understandings concerning administration accounts maintained federal reserve bank new york foreign banks designated board governors section ,agreement understanding concern administration account maintain federal reserve bank new york foreign bank designate board governor section,0
78,2011-01-26, regulation shall referred review approval committee,regulation shall refer review approval committee,0
79,2011-01-26,foreign currency holdings shall invested ensure adequate liquidity maintained meet anticipated needs currency portfolio shall generally average duration no  months calculated macaulay duration,foreign currency holding shall invest ensure adequate liquidity maintain meet anticipate need currency portfolio shall generally average duration no month calculate macaulay duration,0
80,2011-01-26,investments may include buying selling outright obligations of fully guaranteed principal interest by foreign government agency thereof buying securities agreements repurchase securities selling securities agreements resale securities holding various time deposit accounts foreign institutions,investment may include buying sell outright obligation of fully guaranteed principal interest by foreign government agency thereof buying security agreement repurchase security sell security agreement resale security hold various time deposit account foreign institution,0
81,2011-01-26,addition appropriate connection arrangements provide investment facilities foreign currency holdings us government securities may purchased foreign central banks agreements repurchase securities within  calendar days,addition appropriate connection arrangement provide investment facility foreign currency holding u government security may purchase foreign central bank agreement repurchase security within calendar day,0
82,2011-01-26,operations undertaken pursuant preceding paragraphs shall reported promptly foreign currency subcommittee committee,operation undertaken pursuant precede paragraph shall report promptly foreign currency subcommittee committee,0
