,Date,Original,Corpus,Class
124,2012-04-25,businesses continued raise substantial amounts funds credit capital markets recent months,business continued raise substantial amount fund credit capital market recent month,0
125,2012-04-25,bond issuance financial firms picked march strong pace recorded previous two months,bond issuance financial firm picked march strong pace record previous two month,0
126,2012-04-25,domestic nonfinancial firms bond issuance growth commercial industrial ci loans robust first quarter,domestic nonfinancial firm bond issuance growth commercial industrial ci loan robust first quarter,0
127,2012-04-25,leveraged loan issuance brisk period well reportedly supported investor demand newly issued collateralized loan obligations well interest pension funds institutional investors,leveraged loan issuance brisk period well reportedly support investor demand newly issue collateralize loan obligation well interest pension fund institutional investor,0
128,2012-04-25,gross public equity issuance nonfinancial firms stayed strong march,gross public equity issuance nonfinancial firm stayed strong march,0
129,2012-04-25,contrast financial conditions commercial real estate cre sector remained strained amid weak fundamentals tight underwriting conditions issuance commercial mortgage backed securities first quarter  year ago,contrast financial condition commercial real estate cre sector remain strain amid weak fundamental tight underwriting condition issuance commercial mortgage back security first quarter year ago,0
130,2012-04-25,respect credit households developments intermeeting period mixed,respect credit household development intermeeting period mixed,0
131,2012-04-25,although mortgage rates remained near historical lows mortgage refinancing activity subdued conditions residential mortgage markets continued weak,although mortgage rate remain near historical low mortgage refinance activity subdue condition residential mortgage market continued weak,0
132,2012-04-25,contrast consumer credit rose solid pace balance recent months nonrevolving credit particularly student loans expanded,contrast consumer credit rise solid pace balance recent month nonrevolving credit particularly student loan expand,0
133,2012-04-25,issuance consumer asset backed securities abs edged recent months supported auto loan abs issuance,issuance consumer asset back security ab edge recent month support auto loan ab issuance,0
134,2012-04-25,gross issuance long term municipal bonds subdued first quarter,gross issuance long term municipal bond subdue first quarter,0
135,2012-04-25,ratio general obligation municipal bond yields yields comparable maturity treasury securities little changed intermeeting period average spreads credit default swaps debt issued states declined net,ratio general obligation municipal bond yield yield comparable maturity treasury security little change intermeeting period average spread credit default swap debt issue state decline net,0
136,2012-04-25,bank credit slowed march expanded solid pace first quarter whole,bank credit slow march expand solid pace first quarter whole,0
137,2012-04-25,senior loan officer opinion survey bank lending practices conducted april indicated that aggregate domestic banks eased slightly lending standards core loansi real estate consumer loans experienced somewhat stronger demand loans first quarter ,senior loan officer opinion survey bank lending practice conduct april indicate that aggregate domestic bank ease slightly lending standard core loansi real estate consumer loan experienced somewhat strong demand loan first quarter,0
138,2012-04-25,cloans domestic banks continued expand march growth concentrated large domestic banks,cloans domestic bank continued expand march growth concentrate large domestic bank,0
139,2012-04-25,banks holdings closed end residential mortgage loans expanded home equity loans cre loans continued decline,bank holding close end residential mortgage loan expand home equity loan cre loan continued decline,0
140,2012-04-25,consumer loans banks books rose modestly march,consumer loan bank book rise modestly march,0
141,2012-04-25,expanded moderate pace march reflecting growth liquid deposits currency partially offset declines small time deposits balances retail money market funds,expand moderate pace march reflect growth liquid deposit currency partially offset decline small time deposit balance retail money market fund,0
142,2012-04-25,financial strains within euro area increased intermeeting period,financial strain within euro area increase intermeeting period,0
143,2012-04-25,spreads yields sovereign italian spanish debt comparable maturity german bonds rose amid official warnings spain would miss fiscal target year would need make budget cuts well renewed concerns market prospects spanish banks,spread yield sovereign italian spanish debt comparable maturity german bond rise amid official warning spain would miss fiscal target year would need make budget cut well renew concern market prospect spanish bank,0
144,2012-04-25,although spread three month euro london interbank offered rate comparable ois rate narrowed balance period euro area bank equity indexes dropped sharply driven declines share prices spanish italian banks,although spread three month euro london interbank offer rate comparable ois rate narrow balance period euro area bank equity index drop sharply driven decline share price spanish italian bank,0
145,2012-04-25,five year credit default swap premiums rose broad range euro area banks especially spanish banks,five year credit default swap premium rise broad range euro area bank especially spanish bank,0
146,2012-04-25,background increased stresses within euro area foreign equity indexes declined corporate credit spreads widened,background increase stress within euro area foreign equity index decline corporate credit spread widen,0
147,2012-04-25,staff broad nominal index foreign exchange value dollar unchanged intermeeting period dollar appreciated emerging market currencies depreciated moderately yen sterling,staff broad nominal index foreign exchange value dollar unchanged intermeeting period dollar appreciate emerge market currency depreciate moderately yen sterling,0
148,2012-04-25,amid volatility yields benchmark sovereign bonds germany japan ended period somewhat lower,amid volatility yield benchmark sovereign bond germany japan end period somewhat low,0
149,2012-04-25,monetary policy abroad remained generally accommodative,monetary policy abroad remain generally accommodative,0
150,2012-04-25,total outstanding amount federal reserve dollar liquidity swap lines declined  billion  billion time march fomc meeting demand dollars fell lending operations european central bank bank japan swiss national bank,total outstanding amount federal reserve dollar liquidity swap line decline billion billion time march fomc meeting demand dollar fell lending operation european central bank bank japan swiss national bank,0
151,2012-04-25,staff economic outlook economic forecast prepared april fomc meeting staff revised slightly near term projection real gross domestic product gdp growth reflecting unemployment rate little lower level overall payroll employment bit higher consumer spending noticeably stronger staff expected time previous forecast,staff economic outlook economic forecast prepared april fomc meeting staff revise slightly near term projection real gross domestic product gdp growth reflect unemployment rate little low level overall payroll employment bit high consumer spending noticeably strong staff expect time previous forecast,0
152,2012-04-25,however staff medium term projection real gdp growth april forecast little changed one presented march,however staff medium term projection real gdp growth april forecast little change one present march,0
153,2012-04-25,staff continued project real gdp would accelerate gradually  supported accommodative monetary policy improvements credit availability rising consumer business sentiment,staff continued project real gdp would accelerate gradually support accommodative monetary policy improvement credit availability rise consumer business sentiment,0
154,2012-04-25,increases economic activity expected sufficient decrease wide margin slack labor market slowly projection period unemployment rate anticipated still elevated end ,increase economic activity expect sufficient decrease wide margin slack labor market slowly projection period unemployment rate anticipate still elevate end,0
155,2012-04-25,staff forecast inflation projection period bit forecast prepared march fomc meeting reflecting somewhat higher expected data core consumer prices slightly narrower margin economic slack march forecast,staff forecast inflation projection period bit forecast prepared march fomc meeting reflect somewhat high expect data core consumer price slightly narrower margin economic slack march forecast,0
156,2012-04-25,however pass recent run crude oil prices consumer energy prices seen nearly complete oil prices expected edge lower current levels substantial resource slack persisting projection period stable long run inflation expectations staff continued forecast inflation would subdued ,however pas recent run crude oil price consumer energy price see nearly complete oil price expect edge low current level substantial resource slack persist projection period stable long run inflation expectation staff continued forecast inflation would subdue,0
157,2012-04-25,participants views current conditions economic outlook conjunction fomc meeting meeting participants five members board governors presidents  federal reserve banks participate deliberations fomc submitted assessments real output growth unemployment rate inflation target federal funds rate year   longer run participant judgment appropriate monetary policy,participant view current condition economic outlook conjunction fomc meeting meeting participant five member board governor president federal reserve bank participate deliberation fomc submit assessment real output growth unemployment rate inflation target federal fund rate year longer run participant judgment appropriate monetary policy,0
158,2012-04-25,longer run projections represent participant assessment rate variable would expected converge time appropriate monetary policy absence shocks economy,longer run projection represent participant assessment rate variable would expect converge time appropriate monetary policy absence shock economy,0
159,2012-04-25,economic projections policy assessments described detail summary economic projections sep attached addendum minutes,economic projection policy assessment described detail summary economic projection sep attach addendum minute,0
160,2012-04-25,discussion economic situation outlook meeting participants agreed information received since committee previous meeting suggested economy continued expand moderately,discussion economic situation outlook meeting participant agree information receive since committee previous meeting suggest economy continued expand moderately,0
161,2012-04-25,labor market conditions improved recent months,labor market condition improve recent month,0
162,2012-04-25,far year payroll employment expanded faster pace last year unemployment rate declined further although remained elevated,far year payroll employment expand faster pace last year unemployment rate decline far although remain elevate,0
163,2012-04-25,household spending business fixed investment continued expand,household spending business fix investment continued expand,0
164,2012-04-25,signs improvement housing sector low level activity,sign improvement housing sector low level activity,0
165,2012-04-25,despite volatility financial markets intermeeting period financial conditionss markets continued improve bank credit quality loan demand increased,despite volatility financial market intermeeting period financial conditions market continued improve bank credit quality loan demand increase,0
166,2012-04-25,mainly reflecting increase prices crude oil gasoline earlier year inflation picked somewhat,mainly reflect increase price crude oil gasoline earlier year inflation picked somewhat,0
167,2012-04-25,however longer term inflation expectations remained stable,however longer term inflation expectation remain stable,0
168,2012-04-25,participants assessments economic outlook little changed intermeeting information generally seen suggesting economic growth would remain moderate coming quarters pick gradually,participant assessment economic outlook little change intermeeting information generally see suggest economic growth would remain moderate come quarter pick gradually,0
169,2012-04-25,reflecting moderate pace economic growth anticipated gradual decline unemployment rate,reflect moderate pace economic growth anticipate gradual decline unemployment rate,0
170,2012-04-25,incoming information led participants become confident durability recovery,incoming information lead participant become confident durability recovery,0
171,2012-04-25,however others thought premature infer stronger underlying trend recent positive indicators since readings may partially reflect effects mild winter weather temporary influences,however others thought premature infer strong underlie trend recent positive indicator since reading may partially reflect effect mild winter weather temporary influence,0
172,2012-04-25,number factors continued seen likely limiting economic expansion moderate pace near term included slow growth foreign economies prospective fiscal tightening united states slow household income growth notwithstanding recent signs improvement ongoing weakness housing market,number factor continued see likely limit economic expansion moderate pace near term include slow growth foreign economy prospective fiscal tighten united state slow household income growth notwithstanding recent sign improvement ongoing weakness housing market,0
173,2012-04-25,participants continued expect factors restraining economic expansion ease time anticipated recovery would gradually gain strength,participant continued expect factor restrain economic expansion ease time anticipate recovery would gradually gain strength,0
174,2012-04-25,strains global financial markets though generally less pronounced last fall continued pose significant risk outlook possibility sharp fiscal tightening united states also considered sizable risk,strain global financial market though generally less pronounce last fall continued pose significant risk outlook possibility sharp fiscal tighten united state also consider sizable risk,0
175,2012-04-25,participants anticipated inflation would fall back recent elevated levels effects higher energy prices waned still expected inflation subsequently would run  percent rate committee judges consistent statutory mandate,participant anticipate inflation would fall back recent elevate level effect high energy price wan still expect inflation subsequently would run percent rate committee judge consistent statutory mandate,0
176,2012-04-25,however participants saw upside risks inflation outlook given recent pickup inflation highly accommodative stance monetary policy,however participant saw upside risk inflation outlook give recent pickup inflation highly accommodative stance monetary policy,0
177,2012-04-25,discussing household sector meeting participants generally noted consumer spending continued expand moderately notwithstanding high gasoline prices,discuss household sector meeting participant generally note consumer spending continued expand moderately notwithstanding high gasoline price,0
178,2012-04-25,recent strengthening pace light motor vehicle sales attributed pent demand desire increased fuel efficiency wake higher gasoline prices,recent strengthen pace light motor vehicle sale attribute pent demand desire increase fuel efficiency wake high gasoline price,0
179,2012-04-25,looking forward increases household wealth rise equity prices improving consumer sentiment diminishing drag household deleveraging seen helping support continued increases household expenditures notwithstanding sluggish growth real disposable income restrictive fiscal policies,look forward increase household wealth rise equity price improve consumer sentiment diminish drag household deleveraging see help support continued increase household expenditure notwithstanding sluggish growth real disposable income restrictive fiscal policy,0
180,2012-04-25,recent housing sector indicators including sales starts suggested upward movement participants saw improvement likely related unusually warm winter weather much country,recent housing sector indicator include sale start suggest upward movement participant saw improvement likely related unusually warm winter weather much country,0
181,2012-04-25,overall level activity sector remained depressed,overall level activity sector remain depressed,0
182,2012-04-25,house prices appeared stabilizing not yet begun rise markets,house price appear stabilize not yet begin rise market,0
183,2012-04-25,participants anticipated housing sector likely recover slowly time optimistic potential rapid housing recovery given reports stronger demand regions improved sentiment among builders well signs recent changes home affordable refinance program contributing refinancing performing high loan value mortgages,participant anticipate housing sector likely recover slowly time optimistic potential rapid housing recovery give report strong demand region improve sentiment among builder well sign recent change home affordable refinance program contribute refinance perform high loan value mortgage,0
184,2012-04-25,reports business contacts indicated activity manufacturing energy agriculture sectors continued advance recent months,report business contact indicate activity manufacturing energy agriculture sector continued advance recent month,0
185,2012-04-25,auto production picked light strengthening demand,auto production picked light strengthen demand,0
186,2012-04-25,business contacts suggested sentiment improving many firms remained somewhat cautious hiring investment decisions capital investment undertaken improve productivity gain market share rather expand capacity,business contact suggest sentiment improve many firm remain somewhat cautious hire investment decision capital investment undertaken improve productivity gain market share rather expand capacity,0
187,2012-04-25,reportedly caution reflected part continued uncertainty strength durability economic recovery well government policies,reportedly caution reflect part continued uncertainty strength durability economic recovery well government policy,0
188,2012-04-25,participants expected government sector would drag economic growth coming quarters,participant expect government sector would drag economic growth come quarter,0
189,2012-04-25,generally saws fiscal situation also risk economic outlook agreement not reached plan federal budget sharp fiscal tightening could occur start ,generally saw fiscal situation also risk economic outlook agreement not reach plan federal budget sharp fiscal tighten could occur start,0
190,2012-04-25,several participants indicated uncertainty trajectory future fiscal policy could lead businesses defer hiring investment,several participant indicate uncertainty trajectory future fiscal policy could lead business defer hire investment,0
191,2012-04-25,noted agreement longer term plan address country fiscal challenges would help alleviate uncertainty consequent negative effects consumer business sentiment,note agreement longer term plan address country fiscal challenge would help alleviate uncertainty consequent negative effect consumer business sentiment,0
192,2012-04-25,exports supporteds growth far year however participants noted risks export picture economic weakness europe significant slowdown pace expansion china emerging asia,export supporteds growth far year however participant note risk export picture economic weakness europe significant slowdown pace expansion china emerge asia,0
193,2012-04-25,labor market conditions continued improve although unusually warm weather may inflated payroll job figures somewhat earlier year,labor market condition continued improve although unusually warm weather may inflate payroll job figure somewhat earlier year,0
194,2012-04-25,contacts parts country said highly qualified workers short supply overall however wage pressures limited far,contact part country say highly qualify worker short supply overall however wage pressure limited far,0
195,2012-04-25,decline labor force participation sharpest younger workers factor nearly  percentage point decline unemployment rate since last august drop larger would predicted historical relationship real gdp growth changes unemployment rate,decline labor force participation sharpest young worker factor nearly percentage point decline unemployment rate since last august drop large would predict historical relationship real gdp growth change unemployment rate,0
196,2012-04-25,assessing extent changes labor force participation reflect cyclical factors reversed recovery picks up opposed changes trend rate participation seen important understanding unemployment dynamics going forward,assess extent change labor force participation reflect cyclical factor reverse recovery pick up oppose change trend rate participation see important understand unemployment dynamic go forward,0
197,2012-04-25,one participant cited research suggesting half decline labor force participation reflected cyclical factors thus participation picks up unemployment may decline slowly coming quarters compared recent pace,one participant cite research suggest half decline labor force participation reflect cyclical factor thus participation pick up unemployment may decline slowly come quarter compare recent pace,0
198,2012-04-25,another posited strength payroll job growth recent months may one time reaction sharp layoffs   future job gains may somewhat weaker unless pace economic growth increases,another posit strength payroll job growth recent month may one time reaction sharp layoff future job gain may somewhat weaker unless pace economic growth increase,0
199,2012-04-25,participants expressed range views extent unemployment rate boosted structural factors mismatches skills unemployed workers demanded hiring firms,participant express range view extent unemployment rate boost structural factor mismatch skill unemployed worker demand hire firm,0
200,2012-04-25,participants acknowledged could structural factors work said view slack remained high weak aggregate demand major reason unemployment still elevated,participant acknowledge could structural factor work say view slack remain high weak aggregate demand major reason unemployment still elevate,0
201,2012-04-25,two noted possibility sustained high levels long term unemployment could result higher structural unemployment outcome might forestalled increased aggregate demand,two note possibility sustain high level long term unemployment could result high structural unemployment outcome might forestall increase aggregate demand,0
202,2012-04-25,participants noted current measures labor market slack would overstated structural factors accounted large portion current high levels unemployment,participant note current measure labor market slack would overstate structural factor account large portion current high level unemployment,0
203,2012-04-25,result measures might unreliable guide close economy maximum employment,result measure might unreliable guide close economy maximum employment,0
204,2012-04-25,participants pointed that time estimates potential level output declined reducing consequence estimates level economic slack,participant point that time estimate potential level output decline reduce consequence estimate level economic slack,0
205,2012-04-25,participants cited recent rise inflation abstracting direct effect rise energy prices supportive view level slack lower believe,participant cite recent rise inflation abstract direct effect rise energy price supportive view level slack low believe,0
206,2012-04-25,participants judged that general conditions domestic credit markets continued improve since march fomc meeting,participant judged that general condition domestic credit market continued improve since march fomc meeting,0
207,2012-04-25,bank credit quality consumer business loan demand increasing although commercial residential real estate lending remained relatively weak,bank credit quality consumer business loan demand increase although commercial residential real estate lending remain relatively weak,0
208,2012-04-25,us equity prices risen early intermeeting period subsequently declined ending period little changed net investment grade corporate bond yields flat slightly remained low levels,u equity price risen early intermeeting period subsequently decline end period little change net investment grade corporate bond yield flat slightly remain low level,0
209,2012-04-25,manys financial institutions taking steps bolster resiliency including increasing capital levels liquidity buffers reducing european exposures,manys financial institution take step bolster resiliency include increase capital level liquidity buffer reduce european exposure,0
210,2012-04-25,participants indicated seeing signs low interest rates might inducing investors take imprudent risks search higher nominal returns,participant indicate see sign low interest rate might induce investor take imprudent risk search high nominal return,0
211,2012-04-25,contrast improved conditions domestic credit markets investors concerns sovereign debt banking situation euro area intensified intermeeting period,contrast improve condition domestic credit market investor concern sovereign debt banking situation euro area intensified intermeeting period,0
