,Date,Original,Corpus,Class
0,2012-04-25,federal reserve central bank united states provides nation safe flexible stable monetary financial system,federal reserve central bank united state provide nation safe flexible stable monetary financial system,0
1,2012-04-25,federal open market committee,federal open market committee,0
2,2012-04-25,monetary policy principles practice,monetary policy principle practice,0
3,2012-04-25,policy implementation,policy implementation,0
4,2012-04-25,reports,report,0
5,2012-04-25,review monetary policy strategy tools communications,review monetary policy strategy tool communication,0
6,2012-04-25,institution supervision,institution supervision,0
7,2012-04-25,reports,report,0
8,2012-04-25,reporting forms,reporting form,0
9,2012-04-25,supervision  regulation letters,supervision regulation letter,0
10,2012-04-25,banking applications  legal developments,banking application legal development,0
11,2012-04-25,regulatory resources,regulatory resource,0
12,2012-04-25,banking  data structure,banking data structure,0
13,2012-04-25,regulations  statutes,regulation statute,0
14,2012-04-25,payment policies,payment policy,0
15,2012-04-25,reserve bank payment services  data,reserve bank payment service data,0
16,2012-04-25,financial market utilities  infrastructures,financial market utility infrastructure,0
17,2012-04-25,research committees forums,research committee forum,0
18,2012-04-25,working papers notes,work paper note,0
19,2012-04-25,models tools,model tool,0
20,2012-04-25,bank assets liabilities,bank asset liability,0
21,2012-04-25,bank structure data,bank structure data,0
22,2012-04-25,business finance,business finance,0
23,2012-04-25,dealer financing terms,dealer financing term,0
24,2012-04-25,exchange rates international data,exchange rate international data,0
25,2012-04-25,financial accounts,financial account,0
26,2012-04-25,household finance,household finance,0
27,2012-04-25,industrial activity,industrial activity,0
28,2012-04-25,interest rates,interest rate,0
29,2012-04-25,micro data reference manual mdrm,micro data reference manual mdrm,0
30,2012-04-25,money stock reserve balances,money stock reserve balance,0
31,2012-04-25,regulations,regulation,0
32,2012-04-25,supervision  enforcement,supervision enforcement,0
33,2012-04-25,community development,community development,0
34,2012-04-25,research  analysis,research analysis,0
35,2012-04-25,consumer resources,consumer resource,0
36,2012-04-25,april   ,april,0
37,2012-04-25,meeting federal open market committee held offices board governors federal reserve system washington dc tuesday april   continued wednesday april   m,meeting federal open market committee held office board governor federal reserve system washington dc tuesday april continued wednesday april m,0
38,2012-04-25,present ben bernanke chairman william dudley vice chairman elizabeth duke jeffrey lacker dennis lockhart sandra pianalto sarah bloom raskin daniel tarullo john williams janet yellen,present ben bernanke chairman william dudley vice chairman elizabeth duke jeffrey lacker dennis lockhart sandra pianalto sarah bloom raskin daniel tarullo john williams janet yellen,0
39,2012-04-25,james bullard christine cumming charles evans esther george eric rosengren alternate members federal open market committee,james bullard christine cumming charles evans esther george eric rosengren alternate member federal open market committee,0
40,2012-04-25,richard fisher narayana kocherlakota charles plosser presidents federal reserve banks dallas minneapolis philadelphia respectively,richard fisher narayana kocherlakota charles plosser president federal reserve bank dallas minneapolis philadelphia respectively,0
41,2012-04-25,william english secretary economist deborah danker deputy secretary matthew luecke assistant secretary david skidmore assistant secretary michelle smith assistant secretary scott alvarez general counsel thomas baxter deputy general counsel steven kamin economist david wilcox economist,william english secretary economist deborah danker deputy secretary matthew luecke assistant secretary david skidmore assistant secretary michelle smith assistant secretary scott alvarez general counsel thomas baxter deputy general counsel steven kamin economist david wilcox economist,0
42,2012-04-25,david altig thomas connors michael leahy william nelson simon potter david reifschneider william wascher associate economists,david altig thomas connors michael leahy william nelson simon potter david reifschneider william wascher associate economist,0
43,2012-04-25,brian sack manager system open market account,brian sack manager system open market account,0
44,2012-04-25,michael gibson director division banking supervision regulation board governors,michael gibson director division banking supervision regulation board governor,0
45,2012-04-25,nellie liang director office financial stability policy research board governors,nellie liang director office financial stability policy research board governor,0
46,2012-04-25,jon faust andrew levin special advisors board office board members board governors,jon faust andrew levin special advisor board office board member board governor,0
47,2012-04-25,james clouse deputy director division monetary affairs board governors matthew eichner deputy director division research statistics board governors,james clouse deputy director division monetary affair board governor matthew eichner deputy director division research statistic board governor,0
48,2012-04-25,linda robertson assistant board office board members board governors,linda robertson assistant board office board member board governor,0
49,2012-04-25,thomas laubach senior adviser division research statistics board governors ellen meade senior adviser division monetary affairs board governors,thomas laubach senior adviser division research statistic board governor ellen meade senior adviser division monetary affair board governor,0
50,2012-04-25,daniel covitz david lebow associate directors division research statistics board governors,daniel covitz david lebow associate director division research statistic board governor,0
51,2012-04-25,david bowman deputy associate director division international finance board governors gretchen weinbach deputy associate director division monetary affairs board governors,david bowman deputy associate director division international finance board governor gretchen weinbach deputy associate director division monetary affair board governor,0
52,2012-04-25,jane ihrig assistant director division monetary affairs board governors,jane ihrig assistant director division monetary affair board governor,0
53,2012-04-25,david small project manager division monetary affairs board governors,david small project manager division monetary affair board governor,0
54,2012-04-25,gregory stefani first vice president federal reserve bank cleveland,gregory stefani first vice president federal reserve bank cleveland,0
55,2012-04-25,jeff fuhrer loretta mester harvey rosenblum daniel sullivan executive vice presidents federal reserve banks boston philadelphia dallas chicago respectively,jeff fuhrer loretta mester harvey rosenblum daniel sullivan executive vice president federal reserve bank boston philadelphia dallas chicago respectively,0
56,2012-04-25,troy davig ron feldman mark schweitzer christopher waller senior vice presidents federal reserve banks kansas city minneapolis cleveland st louis respectively,troy davig ron feldman mark schweitzer christopher waller senior vice president federal reserve bank kansa city minneapolis cleveland st louis respectively,0
57,2012-04-25,john fernald group vice president federal reserve bank san francisco,john fernald group vice president federal reserve bank san francisco,0
58,2012-04-25,andreas hornstein lorie logan vice presidents federal reserve banks richmond new york respectively,andreas hornstein lorie logan vice president federal reserve bank richmond new york respectively,0
59,2012-04-25,monetary policy alternative scenarios staff presentation provided overview exercise explored individual participants views appropriate monetary policy responses alternative economic scenarios,monetary policy alternative scenario staff presentation provide overview exercise explore individual participant view appropriate monetary policy response alternative economic scenario,0
60,2012-04-25,committee participants discussed potential value drawbacks type exercise internal deliberations external communications monetary policy,committee participant discuss potential value drawback type exercise internal deliberation external communication monetary policy,0
61,2012-04-25,possible benefits include helping clarify factors individual participants judge important forming views economic outlook assessments appropriate monetary policy,possible benefit include help clarify factor individual participant judge important form view economic outlook assessment appropriate monetary policy,0
62,2012-04-25,two potential limitations approach scenario descriptions must necessity incomplete practical range scenarios examined may insufficient informative given degree uncertainty surrounding possible outcomes,two potential limitation approach scenario description must necessity incomplete practical range scenario examine may insufficient informative give degree uncertainty surround possible outcome,0
63,2012-04-25,participants stated exercises using alternative scenarios appropriate adjustments could potentially helpful internal deliberations and thus explored further,participant state exercise use alternative scenario appropriate adjustment could potentially helpful internal deliberation and thus explore far,0
64,2012-04-25,however no decision made meeting regarding future exercises along lines,however no decision make meeting regard future exercise along line,0
65,2012-04-25,developments financial markets federal reserve balance sheet manager system open market account soma reported developments domestic foreign financial markets period since federal open market committee fomc met march  ,development financial market federal reserve balance sheet manager system open market account soma report development domestic foreign financial market period since federal open market committee fomc met march,0
66,2012-04-25,also reported system open market operations including ongoing reinvestment agency guaranteed mortgage backed securities mbs principal payments received soma holdings agency debt agency guaranteed mbs well operations related maturity extension program authorized september    fomc meeting,also report system open market operation include ongoing reinvestment agency guaranteed mortgage back security mb principal payment receive soma holding agency debt agency guaranteed mb well operation related maturity extension program authorize september fomc meeting,0
67,2012-04-25,unanimous vote committee ratified desk domestic transactions intermeeting period,unanimous vote committee ratify desk domestic transaction intermeeting period,0
68,2012-04-25,no intervention operations foreign currencies system account intermeeting period,no intervention operation foreign currency system account intermeeting period,0
69,2012-04-25,mr lacker dissenting committee agreed extend reciprocal currency swap arrangements bank canada banco de mxico additional year beginning mid december  arrangements associated federal reserve participation north american framework agreement ,mr lacker dissent committee agree extend reciprocal currency swap arrangement bank canada banco de mxico additional year begin mid december arrangement associate federal reserve participation north american framework agreement,0
70,2012-04-25,arrangement bank canada allows cumulative drawings  billion equivalent arrangement banco de mxico allows cumulative drawings  billion equivalent,arrangement bank canada allows cumulative drawing billion equivalent arrangement banco de mxico allows cumulative drawing billion equivalent,0
71,2012-04-25,vote renew system participation swap arrangements taken meeting provision framework agreement requires party provide six months prior notice intention terminate participation,vote renew system participation swap arrangement take meeting provision framework agreement require party provide six month prior notice intention terminate participation,0
72,2012-04-25,mr lacker dissented opposition indicated january meeting foreign exchange market intervention federal reserve swap arrangements might facilitate opposition direct lending foreign central banks,mr lacker dissent opposition indicate january meeting foreign exchange market intervention federal reserve swap arrangement might facilitate opposition direct lending foreign central bank,0
73,2012-04-25,staff review economic situation information reviewed april   meeting suggested economic activity expanding moderately,staff review economic situation information review april meeting suggest economic activity expand moderately,0
74,2012-04-25,payroll employment continued move up unemployment rate still elevated declined little further,payroll employment continued move up unemployment rate still elevate decline little far,0
75,2012-04-25,overall consumer price inflation increased somewhat primarily reflecting higher prices crude oil gasoline measures long run inflation expectations remained stable,overall consumer price inflation increase somewhat primarily reflect high price crude oil gasoline measure long run inflation expectation remain stable,0
76,2012-04-25,unemployment rate declined ,unemployment rate decline,0
77,2012-04-25, percent march,percent march,0
78,2012-04-25,share workers employed part time economic reasons also moved down rate long duration unemployment remained elevated,share worker employ part time economic reason also move down rate long duration unemployment remain elevate,0
79,2012-04-25,private nonfarm employment rose slower pace march preceding three months total government employment little changed recent months declining last year,private nonfarm employment rise slow pace march precede three month total government employment little change recent month decline last year,0
80,2012-04-25,indicators job openings firms hiring plans improved,indicator job opening firm hire plan improve,0
81,2012-04-25,roughly flat intermeeting period initial claims unemployment insurance rose moderately toward end period remained level consistent moderate job gains coming months,roughly flat intermeeting period initial claim unemployment insurance rise moderately toward end period remain level consistent moderate job gain come month,0
82,2012-04-25,manufacturing production expanded net february march rate manufacturing capacity utilization essentially unchanged,manufacturing production expand net february march rate manufacturing capacity utilization essentially unchanged,0
83,2012-04-25,recent months production motor vehicles continued rise appreciably response higher vehicle sales dealers additions relatively low levels inventories output gains industries also solid widespread,recent month production motor vehicle continued rise appreciably response high vehicle sale dealer addition relatively low level inventory output gain industry also solid widespread,0
84,2012-04-25,motor vehicle assemblies scheduled step second quarter broader indicators manufacturing activity diffusion indexes new orders national regional manufacturing surveys levels consistent moderate increases factory output second quarter,motor vehicle assembly schedule step second quarter broader indicator manufacturing activity diffusion index new order national regional manufacturing survey level consistent moderate increase factory output second quarter,0
85,2012-04-25,real personal consumption expenditures pce rose briskly february even though households real disposable incomes declined,real personal consumption expenditure pce rise briskly february even though household real disposable income decline,0
86,2012-04-25,march nominal retail sales excluding purchases motor vehicles increased solidly motor vehicle sales fell little brisk pace previous month,march nominal retail sale exclude purchase motor vehicle increase solidly motor vehicle sale fell little brisk pace previous month,0
87,2012-04-25,consumer sentiment little changed balance march early april remained subdued,consumer sentiment little change balance march early april remain subdue,0
88,2012-04-25,measures home prices rose january february activity housing market continued held large inventory foreclosed distressed properties tight underwriting standards mortgage loans,measure home price rise january february activity housing market continued held large inventory foreclose distressed property tight underwriting standard mortgage loan,0
89,2012-04-25,starts new single family homes fell back february march level line permit issuance starts apparently boosted unseasonably warm weather december january,start new single family home fell back february march level line permit issuance start apparently boost unseasonably warm weather december january,0
90,2012-04-25,moreover sales new existing homes edged down net recent months,moreover sale new exist home edge down net recent month,0
91,2012-04-25,real business expenditures equipment software appeared rise modestly first quarter,real business expenditure equipment software appear rise modestly first quarter,0
92,2012-04-25,nominal shipments nondefense capital goods excluding aircraft increased february march declining january new orders capital goods increased balance february march continued run level shipments,nominal shipment nondefense capital good exclude aircraft increase february march decline january new order capital good increase balance february march continued run level shipment,0
93,2012-04-25,buildup unfilled orders recent months along improvements survey measures capital spending plans forward looking indicators pointed toward pickup pace expenditures business equipment,buildup unfilled order recent month along improvement survey measure capital spending plan forward look indicator point toward pickup pace expenditure business equipment,0
94,2012-04-25,contrast nominal business spending nonresidential construction declined january february,contrast nominal business spending nonresidential construction decline january february,0
95,2012-04-25,inventories industries looked fairly well aligned sales recent months although motor vehicle stocks still relatively lean,inventory industry look fairly well align sale recent month although motor vehicle stock still relatively lean,0
96,2012-04-25,data federal government spending recent months indicated real defense expenditures rose modestly first quarter,data federal government spending recent month indicate real defense expenditure rise modestly first quarter,0
97,2012-04-25,real state local government purchases appeared flat last quarter payrolls governments edged first quarter nominal construction spending declined slightly net january february,real state local government purchase appear flat last quarter payroll government edge first quarter nominal construction spending decline slightly net january february,0
98,2012-04-25,us international trade deficit narrowed february exports rose imports fell,u international trade deficit narrow february export rise import fell,0
99,2012-04-25,export gains concentrated services,export gain concentrate service,0
100,2012-04-25,exports goods declined largely decrease exports automotive products,export good decline largely decrease export automotive product,0
101,2012-04-25,drop imports reflected significant declines imports petroleum products automotive products capital goods consumer goods,drop import reflect significant decline import petroleum product automotive product capital good consumer good,0
102,2012-04-25,imports china especially weak may part reflect seasonal adjustment issues related timing chinese new year,import china especially weak may part reflect seasonal adjustment issue related timing chinese new year,0
103,2012-04-25,overalls consumer prices measured pce price index rose somewhat faster rate february preceding six months,overall consumer price measure pce price index rise somewhat faster rate february precede six month,0
104,2012-04-25,march prices measured consumer price index increased faster pace,march price measure consumer price index increase faster pace,0
105,2012-04-25,consumer energy prices climbed markedly february march although survey data indicated gasoline prices stepped first half april,consumer energy price climbed markedly february march although survey data indicate gasoline price step first half april,0
106,2012-04-25,meanwhile increases consumer food prices relatively subdued recent months,meanwhile increase consumer food price relatively subdue recent month,0
107,2012-04-25,consumer prices excluding food energy rose moderately february march,consumer price exclude food energy rise moderately february march,0
108,2012-04-25,near term inflation expectations thomson reutersuniversity michigan surveys consumers increased march fell back early april longer term inflation expectations survey remained stable,near term inflation expectation thomson reutersuniversity michigan survey consumer increase march fell back early april longer term inflation expectation survey remain stable,0
109,2012-04-25,available measures labor compensation indicated nominal wage gains continued muted,available measure labor compensation indicate nominal wage gain continued mute,0
110,2012-04-25,average hourly earnings employees rose modestly march rate increase  months earlier remained low,average hourly earnings employee rise modestly march rate increase month earlier remain low,0
111,2012-04-25,recent indicators suggested foreign economic activity improved balance first quarter important differences across economies,recent indicator suggest foreign economic activity improve balance first quarter important difference across economy,0
112,2012-04-25,euro area economic indicators pointed weakening activity financial stresses worsened whereas emerging market economies recent data consistent continued expansion,euro area economic indicator point weaken activity financial stress worsen whereas emerge market economy recent data consistent continued expansion,0
113,2012-04-25,readings foreign inflation eased although still relatively high latin american countries,reading foreign inflation ease although still relatively high latin american country,0
114,2012-04-25,staff review financial situation broad financial market conditions changed little balance since march fomc meeting,staff review financial situation broad financial market condition change little balance since march fomc meeting,0
115,2012-04-25,however asset prices fluctuated substantially period apparently response evolving viewss global economic outlook changing expectations regarding future course monetary policy,however asset price fluctuate substantially period apparently response evolve view global economic outlook change expectation regard future course monetary policy,0
116,2012-04-25,yields nominal treasury securities moved early period reportedly investors read incoming information including march fomc statement minutes along results comprehensive capital analysis review ccar suggesting somewhat stronger economic outlook previously expected,yield nominal treasury security move early period reportedly investor read incoming information include march fomc statement minute along result comprehensive capital analysis review ccar suggest somewhat strong economic outlook previously expect,0
117,2012-04-25,subsequent weeks however yields drifted lower response disappointing economic news increased concerns strains europe,subsequent week however yield drift low response disappoint economic news increase concern strain europe,0
118,2012-04-25,net nominal treasury yields finished period slightly lower measures expected path federal funds rate derived overnight index swap ois rates moved down,net nominal treasury yield finish period slightly low measure expect path federal fund rate derive overnight index swap ois rate move down,0
119,2012-04-25,conditions unsecured short term dollar funding markets stable intermeeting period despite increase concerns europe latter part period,condition unsecured short term dollar funding market stable intermeeting period despite increase concern europe latter part period,0
120,2012-04-25,secured funding markets overnight general collateral treasury repurchase agreement rate declined time late period reportedly response seasonal reduction treasury bill issuance april ended period roughly unchanged,secure funding market overnight general collateral treasury repurchase agreement rate decline time late period reportedly response seasonal reduction treasury bill issuance april end period roughly unchanged,0
121,2012-04-25,broads stock price indexes followed general pattern observed across asset markets rising early period increased investor optimism falling later on end period little changed net,broad stock price index follow general pattern observe across asset market rise early period increase investor optimism fall later on end period little change net,0
122,2012-04-25,equity prices financial institutions increased reportedly investors interpreted first quarter earnings several large banking organizations results ccar better expected,equity price financial institution increase reportedly investor interpret first quarter earnings several large banking organization result ccar well expect,0
123,2012-04-25,yields spreads investment grade corporate bonds unchanged yields spreads speculative grade corporate bonds increased somewhat,yield spread investment grade corporate bond unchanged yield spread speculative grade corporate bond increase somewhat,0
