,Date,Original,Corpus,Class
124,2014-09-17,foreign economies continued expand second quarter significant differences across countries,foreign economy continued expand second quarter significant difference across country,0
125,2014-09-17,economic growth rebounded strongly weak first quarter pace canada china mexico supported improvement exports,economic growth rebound strongly weak first quarter pace canada china mexico support improvement export,0
126,2014-09-17,contrast japanese economy contracted sharply following consumption tax increase april economic activity stagnated euro area brazilian economy fell recession,contrast japanese economy contract sharply follow consumption tax increase april economic activity stagnate euro area brazilian economy fell recession,0
127,2014-09-17,third quarter household spending appeared normalizing japan production continued rise mexico,third quarter household spending appear normalize japan production continued rise mexico,0
128,2014-09-17,however indicators economic activity euro area remained weak chinese economic data july august suggested slowing third quarter,however indicator economic activity euro area remain weak chinese economic data july august suggest slow third quarter,0
129,2014-09-17,inflation low euro area european central bank reduced policy interest rates september  meeting announced plans purchase private assets,inflation low euro area european central bank reduce policy interest rate september meeting announce plan purchase private asset,0
130,2014-09-17,staff review financial situation data releases domestic economic activity reportedly interpreted financial market participants somewhat better expected balance notwithstanding disappointing employment report august,staff review financial situation data release domestic economic activity reportedly interpret financial market participant somewhat well expect balance notwithstanding disappoint employment report august,0
131,2014-09-17,federal reserve communications particularly july fomc minutes chair speech jackson hole economic policy symposium viewed signaling slightly less policy accommodation anticipated,federal reserve communication particularly july fomc minute chair speech jackson hole economic policy symposium view signal slightly less policy accommodation anticipate,0
132,2014-09-17,reflecting developments yields nominal treasury securities rose somewhat equity prices edged intermeeting period,reflect development yield nominal treasury security rise somewhat equity price edge intermeeting period,0
133,2014-09-17,net conflicts middle east ukraine geopolitical tensions limited effects domestic financial markets,net conflict middle east ukraine geopolitical tension limited effect domestic financial market,0
134,2014-09-17,federal funds rate path implied financial market quotes essentially unchanged intermeeting period,federal fund rate path imply financial market quote essentially unchanged intermeeting period,0
135,2014-09-17,results desk september survey primary dealers indicated distribution likely date liftoff across dealers shifted somewhat earlier dates showed second quarter  likely date liftoff,result desk september survey primary dealer indicate distribution likely date liftoff across dealer shift somewhat earlier date show second quarter likely date liftoff,0
136,2014-09-17,however dealers expected levels various employment inflation indicators time liftoff not change materially previous survey,however dealer expect level various employment inflation indicator time liftoff not change materially previous survey,0
137,2014-09-17,yield  year nominal treasury securities moved  basis points net since fomc met july likely boosted part federal reserve communications,yield year nominal treasury security move basis point net since fomc met july likely boost part federal reserve communication,0
138,2014-09-17,measures inflation compensation based treasury inflation protected securities edged down reportedly reflecting lower expected cpi data july recent declines oil prices,measure inflation compensation base treasury inflation protect security edge down reportedly reflect low expect cpi data july recent decline oil price,0
139,2014-09-17,broad measures domestic equity prices modestly intermeeting period reports suggesting investors interpreting incoming economic data implying economic recovery strengthening,broad measure domestic equity price modestly intermeeting period report suggest investor interpret incoming economic data imply economic recovery strengthen,0
140,2014-09-17,yields corporate bonds agency mbs rose line comparable maturity treasury securities,yield corporate bond agency mb rise line comparable maturity treasury security,0
141,2014-09-17,high yield bond mutual funds experienced sharp outflows early intermeeting period spreads bonds widened noticeably however spreads returned initial levels subsequent weeks high yield bond funds attracted modest inflows,high yield bond mutual fund experienced sharp outflow early intermeeting period spread bond widen noticeably however spread return initial level subsequent week high yield bond fund attract modest inflow,0
142,2014-09-17,measures liquidity corporate bond market remained stable face substantial flows,measure liquidity corporate bond market remain stable face substantial flow,0
143,2014-09-17,conditions short term dollar funding markets little changed,condition short term dollar funding market little change,0
144,2014-09-17,federal reserve continued testing rrp operations intermeeting period,federal reserve continued test rrp operation intermeeting period,0
145,2014-09-17,take rrp operations increased little average period relative previous intermeeting period,take rrp operation increase little average period relative previous intermeeting period,0
146,2014-09-17,credit conditions domestic businesses remained favorable,credit condition domestic business remain favorable,0
147,2014-09-17,corporate bond issuance slowed july august reflecting fairly typical summer lull well elevated volatility high yield bond market early intermeeting period issuance rebounded strongly first week september,corporate bond issuance slow july august reflect fairly typical summer lull well elevate volatility high yield bond market early intermeeting period issuance rebound strongly first week september,0
148,2014-09-17,commercial paper outstanding commercial industrial loans banks expanded briskly,commercial paper outstanding commercial industrial loan bank expand briskly,0
149,2014-09-17,credit conditions commercial real estate cre sector continued ease growth cre loans banks stayed solid,credit condition commercial real estate cre sector continued ease growth cre loan bank stayed solid,0
150,2014-09-17,issuance commercial mortgage backed securities remained robust july august,issuance commercial mortgage back security remain robust july august,0
151,2014-09-17,issuance institutional leveraged loans continued apace july august traditionally slow period market,issuance institutional leveraged loan continued apace july august traditionally slow period market,0
152,2014-09-17,issuance new money loans typically earmarked corporate leveraged buyouts mergers acquisitions strong pipeline loans reported quite large heading fall,issuance new money loan typically earmark corporate leveraged buyout merger acquisition strong pipeline loan report quite large head fall,0
153,2014-09-17,issuance collateralized loan obligations still major source demand leveraged loans,issuance collateralize loan obligation still major source demand leveraged loan,0
154,2014-09-17,financing conditions households remained mixed,financing condition household remain mixed,0
155,2014-09-17,auto loans widely available standards terms credit card loans eased somewhat though still tight access residential mortgages continued limited excellent credit histories,auto loan widely available standard term credit card loan ease somewhat though still tight access residential mortgage continued limited excellent credit history,0
156,2014-09-17,responding part disappointing economic data abroad us dollar appreciated currencies intermeeting period including large appreciations euro yen pound sterling,respond part disappoint economic data abroad u dollar appreciate currency intermeeting period include large appreciation euro yen pound sterling,0
157,2014-09-17,greater monetary accommodation euro area expectations lower policy rate near term added downward pressure euro uncertainty outcome forthcoming referendum scottish independence weighed value pound,great monetary accommodation euro area expectation low policy rate near term add downward pressure euro uncertainty outcome forthcoming referendum scottish independence weigh value pound,0
158,2014-09-17,addition near term policy rate expectations moved united kingdom reacting release august inflation report uncertainty induced referendum,addition near term policy rate expectation move united kingdom react release august inflation report uncertainty induced referendum,0
159,2014-09-17,sovereign yields european economies generally declined yield spreads sovereign bonds euro area periphery german bunds narrowed considerably,sovereign yield european economy generally decline yield spread sovereign bond euro area periphery german bunds narrow considerably,0
160,2014-09-17,foreign equity indexes ended period modestly higher,foreign equity index end period modestly high,0
161,2014-09-17,staff economic outlook economic forecast prepared staff september fomc meeting projection growth real gross domestic product gdp second half year revised slightly one prepared previous meeting primarily somewhat weaker near term outlook consumer spending,staff economic outlook economic forecast prepared staff september fomc meeting projection growth real gross domestic product gdp second half year revise slightly one prepared previous meeting primarily somewhat weaker near term outlook consumer spending,0
162,2014-09-17,staff medium term forecast real gdp also revised little reflecting higher projected path foreign exchange value dollar along slightly smaller projected gains home prices,staff medium term forecast real gdp also revise little reflect high project path foreign exchange value dollar along slightly small project gain home price,0
163,2014-09-17,staff still anticipated pace real gdp growth   would exceed growth rate potential output supported continued increases consumer business confidence easing restraint spending changes fiscal policy additional improvements credit availability pickup foreign economic growth,staff still anticipate pace real gdp growth would exceed growth rate potential output support continued increase consumer business confidence ease restraint spending change fiscal policy additional improvement credit availability pickup foreign economic growth,0
164,2014-09-17, real gdp growth projected begin slowing toward remain above rate potential output growth,real gdp growth project begin slow toward remain above rate potential output growth,0
165,2014-09-17,expansion economic activity projection period anticipated steadily reduce resource slack unemployment rate expected decline gradually temporarily move slightly staff estimate longer run natural rate toward end period,expansion economic activity projection period anticipate steadily reduce resource slack unemployment rate expect decline gradually temporarily move slightly staff estimate longer run natural rate toward end period,0
166,2014-09-17,staff near term forecast inflation little lower projection prepared previous fomc meeting reflecting recent readings core consumer price inflation lower anticipated declines oil prices faster expected forecast inflation medium term little changed,staff near term forecast inflation little low projection prepared previous fomc meeting reflect recent reading core consumer price inflation low anticipate decline oil price faster expect forecast inflation medium term little change,0
167,2014-09-17,staff continued project inflation lower second half year first half remain committee longer run objective  percent next years,staff continued project inflation low second half year first half remain committee longer run objective percent next year,0
168,2014-09-17,longer term inflation expectations assumed remain stable resource slack projected diminish slowly changes commodity import prices expected subdued inflation projected rise gradually reach committee objective longer run,longer term inflation expectation assume remain stable resource slack project diminish slowly change commodity import price expect subdue inflation project rise gradually reach committee objective longer run,0
169,2014-09-17,overall staff economic projection september meeting quite similar forecast presented june meeting fomc last prepared summary economic projections sep,overall staff economic projection september meeting quite similar forecast present june meeting fomc last prepared summary economic projection sep,0
170,2014-09-17,staff september projection showed slightly higher path unemployment rate bit lower real gdp growth essentially no change inflation compared june forecast,staff september projection show slightly high path unemployment rate bit low real gdp growth essentially no change inflation compare june forecast,0
171,2014-09-17,staff continued view uncertainty around projections real gdp growth unemployment rate inflation similar average past  years,staff continued view uncertainty around projection real gdp growth unemployment rate inflation similar average past year,0
172,2014-09-17,risks forecast real gdp growth still seen tilted little downside neither monetary policy fiscal policy viewed well positioned help economy withstand adverse shocks,risk forecast real gdp growth still see tilt little downside neither monetary policy fiscal policy view well position help economy withstand adverse shock,0
173,2014-09-17,time staff viewed risks around outlook unemployment rate inflation roughly balanced,time staff view risk around outlook unemployment rate inflation roughly balance,0
174,2014-09-17,participants views current conditions economic outlook conjunction fomc meeting members board governors federal reserve bank presidents submitted projections real output growth unemployment rate inflation federal funds rate year   longer run conditional participant assessment appropriate monetary policy,participant view current condition economic outlook conjunction fomc meeting member board governor federal reserve bank president submit projection real output growth unemployment rate inflation federal fund rate year longer run conditional participant assessment appropriate monetary policy,0
175,2014-09-17,longer run projections represent participant assessment value variable would expected converge time appropriate monetary policy absence shocks economy,longer run projection represent participant assessment value variable would expect converge time appropriate monetary policy absence shock economy,0
176,2014-09-17,economic projections policy assessments described sep attached addendum minutes,economic projection policy assessment described sep attach addendum minute,0
177,2014-09-17,discussion economic situation outlook meeting participants viewed information received intermeeting period suggesting economic activity expanding moderate rate,discussion economic situation outlook meeting participant view information receive intermeeting period suggest economic activity expand moderate rate,0
178,2014-09-17,balance labor market conditions improved somewhat further however unemployment rate little changed participants judged remained significant underutilization labor resources,balance labor market condition improve somewhat far however unemployment rate little change participant judged remain significant underutilization labor resource,0
179,2014-09-17,participants generally expected that medium term real economic activity would increase pace sufficient lead gradual decline unemployment rate toward levels consistent committee objective maximum employment,participant generally expect that medium term real economic activity would increase pace sufficient lead gradual decline unemployment rate toward level consistent committee objective maximum employment,0
180,2014-09-17,inflation running committee longer run objective longer term inflation expectations stable,inflation run committee longer run objective longer term inflation expectation stable,0
181,2014-09-17,participants anticipated inflation would move toward committee  percent goal coming years several expressing concern inflation might persist committee objective quite time,participant anticipate inflation would move toward committee percent goal come year several express concern inflation might persist committee objective quite time,0
182,2014-09-17,viewed risks outlook economic activity labor market broadly balanced,view risk outlook economic activity labor market broadly balance,0
183,2014-09-17,however number participants noted economic growth medium term might slower expected foreign economic growth came weaker anticipated structural productivity continued increase slowly recovery residential construction continued lag,however number participant note economic growth medium term might slow expect foreign economic growth come weaker anticipate structural productivity continued increase slowly recovery residential construction continued lag,0
184,2014-09-17,household spending appeared rising moderately several participants noting recent positive reports retail sales motor vehicle purchases health care spending reduced concern weakness underlying pace household spending,household spending appear rise moderately several participant note recent positive report retail sale motor vehicle purchase health care spending reduce concern weakness underlie pace household spending,0
185,2014-09-17,among favorable factors attending outlook consumer spending participants cited continued gains household wealth improved household balance sheets low delinquency rates high saving rate rising confidence employment income prospects,among favorable factor attend outlook consumer spending participant cite continued gain household wealth improve household balance sheet low delinquency rate high save rate rise confidence employment income prospect,0
186,2014-09-17,however participants said heard mixed reports business contacts regarding consumer spending uncertain prospects stronger gains real income necessary sustain moderate growth household spending,however participant say heard mixed report business contact regard consumer spending uncertain prospect strong gain real income necessary sustain moderate growth household spending,0
187,2014-09-17,recovery housing activity remained slow areas country despite relatively low mortgage rates rising house prices improvements household wealth,recovery housing activity remain slow area country despite relatively low mortgage rate rise house price improvement household wealth,0
188,2014-09-17,contacts couple districts reported new construction held back shortages materials lots available development skilled workers overhang vacant homes not market,contact couple district report new construction held back shortage material lot available development skilled worker overhang vacant home not market,0
189,2014-09-17,households relatively low credit scores continued difficulty obtaining mortgage loans,household relatively low credit score continued difficulty obtain mortgage loan,0
190,2014-09-17,noted difficulty could factor restraining demand housing particularly among younger households high levels student loan debt weak job prospects,note difficulty could factor restrain demand housing particularly among young household high level student loan debt weak job prospect,0
191,2014-09-17,participants pointed relative strength construction demand multifamily units possibly due shift demand among younger homebuyers away single family homes,participant point relative strength construction demand multifamily unit possibly due shift demand among young homebuyers away single family home,0
192,2014-09-17,information business contacts parts country indicated improvements business conditions rising confidence economic outlook increasing willingness undertake new investment projects,information business contact part country indicate improvement business condition rise confidence economic outlook increase willingness undertake new investment project,0
193,2014-09-17,according national regional surveys manufacturing activity strong several participants received reports hiring increased capital spending sector,accord national regional survey manufacturing activity strong several participant receive report hire increase capital spending sector,0
194,2014-09-17,among industries cited relatively strong recent months transportation energy services,among industry cite relatively strong recent month transportation energy service,0
195,2014-09-17,several participants noted positive signs increases investment spending going forward including elevated levels new orders shipments capital goods strong interest technology sector need replace aging capital,several participant note positive sign increase investment spending go forward include elevate level new order shipment capital good strong interest technology sector need replace age capital,0
196,2014-09-17,couple participants added nonresidential construction activity rising districts,couple participant add nonresidential construction activity rise district,0
197,2014-09-17,improvement business conditions reflected reports increased demand loans banks several districts,improvement business condition reflect report increase demand loan bank several district,0
198,2014-09-17,demand rose loans households businesses couple participants indicated borrowers expanding use existing credit lines well obtaining new commitments,demand rise loan household business couple participant indicate borrower expand use exist credit line well obtain new commitment,0
199,2014-09-17,bankers one district stated that eased terms conditions loans response competition lenders not taken riskier loans,banker one district state that ease term condition loan response competition lender not take riskier loan,0
200,2014-09-17,financial developments could undermine financial stability time noted including deterioration leveraged lending standards stretched stock market valuations compressed risk spreads,financial development could undermine financial stability time note include deterioration leveraged lending standard stretch stock market valuation compress risk spread,0
201,2014-09-17,however one participant suggested leveraged loan market seemed moving better balance market participants appeared taking appropriate account changes interest rates might associated eventual normalization stance monetary policy,however one participant suggest leveraged loan market seem move well balance market participant appear take appropriate account change interest rate might associate eventual normalization stance monetary policy,0
202,2014-09-17,moreover couple participants stressing importance remaining vigilant potential risks financial stability observed conditions financial markets present not suggest types financial stability considerations would impede achievement committee macroeconomic objectives,moreover couple participant stress importance remain vigilant potential risk financial stability observe condition financial market present not suggest type financial stability consideration would impede achievement committee macroeconomic objective,0
203,2014-09-17,participants noted expectations path federal funds rate implied market quotes appeared remain projections federal funds rate provided committee participants sep represent individual participant assessment appropriate path federal funds rate consistent economic outlook,participant note expectation path federal fund rate imply market quote appear remain projection federal fund rate provide committee participant sep represent individual participant assessment appropriate path federal fund rate consistent economic outlook,0
204,2014-09-17,however pointed measures financial market participants expectations incorporate judgments regarding not likely outcomes also possible downside tail risks might associated especially low paths federal funds rate,however point measure financial market participant expectation incorporate judgment regard not likely outcome also possible downside tail risk might associate especially low path federal fund rate,0
205,2014-09-17,example respondents recent survey primary dealers placed considerable odds federal funds rate returning zero lower bound two years following initial increase rate,example respondent recent survey primary dealer place considerable odds federal fund rate return zero low bound two year follow initial increase rate,0
206,2014-09-17,probability investors attach low interest rate scenarios could pull expected path federal funds rate computed market quotes committee participants assessments appropriate policy reported sep,probability investor attach low interest rate scenario could pull expect path federal fund rate compute market quote committee participant assessment appropriate policy report sep,0
207,2014-09-17,restraint economic activity fiscal policy seen diminishing couple participants pointed that second half year remaining drag likely small,restraint economic activity fiscal policy see diminish couple participant point that second half year remain drag likely small,0
