,Date,Original,Corpus,Class
0,2014-04-30,federal reserve central bank united states provides nation safe flexible stable monetary financial system,federal reserve central bank united state provide nation safe flexible stable monetary financial system,0
1,2014-04-30,federal open market committee,federal open market committee,0
2,2014-04-30,monetary policy principles practice,monetary policy principle practice,0
3,2014-04-30,policy implementation,policy implementation,0
4,2014-04-30,reports,report,0
5,2014-04-30,review monetary policy strategy tools communications,review monetary policy strategy tool communication,0
6,2014-04-30,institution supervision,institution supervision,0
7,2014-04-30,reports,report,0
8,2014-04-30,reporting forms,reporting form,0
9,2014-04-30,supervision  regulation letters,supervision regulation letter,0
10,2014-04-30,banking applications  legal developments,banking application legal development,0
11,2014-04-30,regulatory resources,regulatory resource,0
12,2014-04-30,banking  data structure,banking data structure,0
13,2014-04-30,regulations  statutes,regulation statute,0
14,2014-04-30,payment policies,payment policy,0
15,2014-04-30,reserve bank payment services  data,reserve bank payment service data,0
16,2014-04-30,financial market utilities  infrastructures,financial market utility infrastructure,0
17,2014-04-30,research committees forums,research committee forum,0
18,2014-04-30,working papers notes,work paper note,0
19,2014-04-30,models tools,model tool,0
20,2014-04-30,bank assets liabilities,bank asset liability,0
21,2014-04-30,bank structure data,bank structure data,0
22,2014-04-30,business finance,business finance,0
23,2014-04-30,dealer financing terms,dealer financing term,0
24,2014-04-30,exchange rates international data,exchange rate international data,0
25,2014-04-30,financial accounts,financial account,0
26,2014-04-30,household finance,household finance,0
27,2014-04-30,industrial activity,industrial activity,0
28,2014-04-30,interest rates,interest rate,0
29,2014-04-30,micro data reference manual mdrm,micro data reference manual mdrm,0
30,2014-04-30,money stock reserve balances,money stock reserve balance,0
31,2014-04-30,regulations,regulation,0
32,2014-04-30,supervision  enforcement,supervision enforcement,0
33,2014-04-30,community development,community development,0
34,2014-04-30,research  analysis,research analysis,0
35,2014-04-30,consumer resources,consumer resource,0
36,2014-04-30,april   ,april,0
37,2014-04-30,meeting federal open market committee held offices board governors federal reserve system washington dc tuesday april   continued wednesday april   m,meeting federal open market committee held office board governor federal reserve system washington dc tuesday april continued wednesday april m,0
38,2014-04-30,present janet yellen chair william dudley vice chairman richard fisher narayana kocherlakota sandra pianalto charles plosser jerome powell jeremy stein daniel tarullo,present janet yellen chair william dudley vice chairman richard fisher narayana kocherlakota sandra pianalto charles plosser jerome powell jeremy stein daniel tarullo,0
39,2014-04-30,charles evans jeffrey lacker dennis lockhart john williams alternate members federal open market committee,charles evans jeffrey lacker dennis lockhart john williams alternate member federal open market committee,0
40,2014-04-30,james bullard esther george eric rosengren presidents federal reserve banks st louis kansas city boston respectively,james bullard esther george eric rosengren president federal reserve bank st louis kansa city boston respectively,0
41,2014-04-30,william english secretary economist matthew luecke deputy secretary michelle smith assistant secretary scott alvarez general counsel steven kamin economist david wilcox economist,william english secretary economist matthew luecke deputy secretary michelle smith assistant secretary scott alvarez general counsel steven kamin economist david wilcox economist,0
42,2014-04-30,james clouse thomas connors evan koenig thomas laubach michael leahy loretta mester samuel schulhofer wohl mark schweitzer william wascher associate economists,james clouse thomas connors evan koenig thomas laubach michael leahy loretta mester samuel schulhofer wohl mark schweitzer william wascher associate economist,0
43,2014-04-30,simon potter manager system open market account,simon potter manager system open market account,0
44,2014-04-30,lorie logan deputy manager system open market account,lorie logan deputy manager system open market account,0
45,2014-04-30,robert dev,robert dev,0
46,2014-04-30,frierson secretary board office secretary board governors,frierson secretary board office secretary board governor,0
47,2014-04-30,michael gibson director division banking supervision regulation board governors,michael gibson director division banking supervision regulation board governor,0
48,2014-04-30,nellie liang director office financial stability policy research board governors,nellie liang director office financial stability policy research board governor,0
49,2014-04-30,matthew eichner deputy director division research statistics board governors stephen meyer william nelson deputy directors division monetary affairs board governors,matthew eichner deputy director division research statistic board governor stephen meyer william nelson deputy director division monetary affair board governor,0
50,2014-04-30,jon faust special adviser board office board members board governors,jon faust special adviser board office board member board governor,0
51,2014-04-30,trevor reeve special adviser chair office board members board governors,trevor reeve special adviser chair office board member board governor,0
52,2014-04-30,linda robertson assistant board office board members board governors,linda robertson assistant board office board member board governor,0
53,2014-04-30,ellen meade joyce zickler senior advisers division monetary affairs board governors,ellen meade joyce zickler senior adviser division monetary affair board governor,0
54,2014-04-30,david bowman beth anne wilson associate directors division international finance board governors daniel covitz david lebow michael palumbo associate directors division research statistics board governors fabio natalucci gretchen weinbach associate directors division monetary affairs board governors,david bowman beth anne wilson associate director division international finance board governor daniel covitz david lebow michael palumbo associate director division research statistic board governor fabio natalucci gretchen weinbach associate director division monetary affair board governor,0
55,2014-04-30,marnie gillis deboer jane ihrig deputy associate directors division monetary affairs board governors,marnie gillis deboer jane ihrig deputy associate director division monetary affair board governor,0
56,2014-04-30,brian gross special assistant board office board members board governors,brian gross special assistant board office board member board governor,0
57,2014-04-30,stacey tevlin assistant director division research statistics board governors,stacey tevlin assistant director division research statistic board governor,0
58,2014-04-30,robert tetlow adviser division monetary affairs board governors,robert tetlow adviser division monetary affair board governor,0
59,2014-04-30,dana burnett section chief division monetary affairs board governors,dana burnett section chief division monetary affair board governor,0
60,2014-04-30,patrick mccabe senior economist division research statistics board governors,patrick mccabe senior economist division research statistic board governor,0
61,2014-04-30,penelope beattie assistant secretary office secretary board governors,penelope beattie assistant secretary office secretary board governor,0
62,2014-04-30,randall williams records project manager division monetary affairs board governors,randall williams record project manager division monetary affair board governor,0
63,2014-04-30,james lyon first vice president federal reserve bank minneapolis,james lyon first vice president federal reserve bank minneapolis,0
64,2014-04-30,david altig james mcandrews alberto musalem executive vice presidents federal reserve banks atlanta new york new york respectively,david altig james mcandrews alberto musalem executive vice president federal reserve bank atlanta new york new york respectively,0
65,2014-04-30,joshua frost spencer krane senior vice presidents federal reserve banks new york chicago respectively,joshua frost spencer krane senior vice president federal reserve bank new york chicago respectively,0
66,2014-04-30,george kahn antoine martin joe peek keith sill daniel thornton douglas tillett vice presidents federal reserve banks kansas city new york boston philadelphia st louis chicago respectively,george kahn antoine martin joe peek keith sill daniel thornton douglas tillett vice president federal reserve bank kansa city new york boston philadelphia st louis chicago respectively,0
67,2014-04-30,andreas hornstein senior advisor federal reserve bank richmond,andreas hornstein senior advisor federal reserve bank richmond,0
68,2014-04-30,john fernald senior research adviser federal reserve bank san francisco,john fernald senior research adviser federal reserve bank san francisco,0
69,2014-04-30,sean savage senior associate federal reserve bank new york,sean savage senior associate federal reserve bank new york,0
70,2014-04-30,monetary policy normalization joint session federal open market committee fomc board governors federal reserve system meeting participants discussed issues associated eventual normalization stance conduct monetary policy,monetary policy normalization joint session federal open market committee fomc board governor federal reserve system meeting participant discuss issue associate eventual normalization stance conduct monetary policy,0
71,2014-04-30,committee discussion topic undertaken part prudent planning not imply normalization would necessarily begin sometime soon,committee discussion topic undertaken part prudent planning not imply normalization would necessarily begin sometime soon,0
72,2014-04-30,staff presentation outlined several approaches raising short term interest rates becomes appropriate so controlling level short term interest rates effective lower bound period federal reserve large balance sheet,staff presentation outline several approach raise short term interest rate becomes appropriate so control level short term interest rate effective low bound period federal reserve large balance sheet,0
73,2014-04-30,approaches differed terms combination policy tools might used accomplish objectives,approach differ term combination policy tool might use accomplish objective,0
74,2014-04-30,addition rate interest paid excess reserve balances tools considered included fixed rate overnight reverse repurchase on rrp operations term reverse repurchase agreements term deposit facility tdf,addition rate interest paid excess reserve balance tool consider include fix rate overnight reverse repurchase on rrp operation term reverse repurchase agreement term deposit facility tdf,0
75,2014-04-30,staff presentation discussed potential implications approach financial intermediation financial markets including federal funds market possible implications financial stability,staff presentation discuss potential implication approach financial intermediation financial market include federal fund market possible implication financial stability,0
76,2014-04-30,addition staff outlined options additional operational testing policy tools,addition staff outline option additional operational test policy tool,0
77,2014-04-30,following staff presentation meeting participants discussed wide range topics related policy normalization,follow staff presentation meeting participant discuss wide range topic related policy normalization,0
78,2014-04-30,participants generally agreed starting consider options normalization meeting prudent would help committee make decisions approaches policy normalization communicate plans public well first steps normalizing policy become appropriate,participant generally agree start consider option normalization meeting prudent would help committee make decision approach policy normalization communicate plan public well first step normalize policy become appropriate,0
79,2014-04-30,early communication turn would enhance clarity credibility monetary policy help promote achievement committee statutory objectives,early communication turn would enhance clarity credibility monetary policy help promote achievement committee statutory objective,0
80,2014-04-30,emphasized tools available committee allow reduce policy accommodation becomes appropriate,emphasize tool available committee allow reduce policy accommodation becomes appropriate,0
81,2014-04-30,participants considered various combinations tools could different implications degree control short term interest rates federal reserve balance sheet remittances treasury functioning federal funds market financial stability normal times periods stress,participant consider various combination tool could different implication degree control short term interest rate federal reserve balance sheet remittance treasury function federal fund market financial stability normal time period stress,0
82,2014-04-30,federal reserve not previously tightened stance policy holding large balance sheet participants judged committee consider range options prepared adjust mix policy tools warranted,federal reserve not previously tighten stance policy hold large balance sheet participant judged committee consider range option prepared adjust mix policy tool warrant,0
83,2014-04-30,participants generally favored testing various tools including tdf better assess operational readiness effectiveness,participant generally favor test various tool include tdf well ass operational readiness effectiveness,0
84,2014-04-30,no decisions regarding policy normalization taken participants requested additional analysis staff agreed would helpful continue review issues upcoming meetings,no decision regard policy normalization take participant request additional analysis staff agree would helpful continue review issue upcoming meeting,0
85,2014-04-30,board meeting concluded end discussion,board meeting conclude end discussion,0
86,2014-04-30,developments financial markets federal reserve balance sheet manager system open market account soma reported developments domestic foreign financial markets well system open market operations period since committee met march   ,development financial market federal reserve balance sheet manager system open market account soma report development domestic foreign financial market well system open market operation period since committee met march,0
87,2014-04-30,unanimous vote committee ratified open market desk domestic transactions intermeeting period,unanimous vote committee ratify open market desk domestic transaction intermeeting period,0
88,2014-04-30,no intervention operations foreign currencies system account intermeeting period,no intervention operation foreign currency system account intermeeting period,0
89,2014-04-30,unanimous vote committee agreed renew reciprocal currency arrangements bank canada bank mexico arrangements associated federal reserve participation north american framework agreement ,unanimous vote committee agree renew reciprocal currency arrangement bank canada bank mexico arrangement associate federal reserve participation north american framework agreement,0
90,2014-04-30,addition unanimous vote committee agreed renew dollar foreign currency liquidity swap arrangements bank canada bank england bank japan european central bank swiss national bank,addition unanimous vote committee agree renew dollar foreign currency liquidity swap arrangement bank canada bank england bank japan european central bank swiss national bank,0
91,2014-04-30,votes renew federal reserve participation arrangements taken meeting provisions arrangements specify federal reserve provide six months prior notice intention terminate participation,vote renew federal reserve participation arrangement take meeting provision arrangement specify federal reserve provide six month prior notice intention terminate participation,0
92,2014-04-30,staff review economic situation information reviewed april   meeting indicated growth economic activity paused first quarter whole activity stepped late quarter pattern reflected part temporary effects unusually cold snowy weather earlier quarter unwinding effects later quarter,staff review economic situation information review april meeting indicate growth economic activity pause first quarter whole activity step late quarter pattern reflect part temporary effect unusually cold snowy weather earlier quarter unwind effect later quarter,0
93,2014-04-30,march payroll employment increased further although unemployment rate held steady still elevated,march payroll employment increase far although unemployment rate held steady still elevate,0
94,2014-04-30,consumer price inflation continued run committee longer run objective measures longer run inflation expectations remained stable,consumer price inflation continued run committee longer run objective measure longer run inflation expectation remain stable,0
95,2014-04-30,unemployment rate stayed ,unemployment rate stayed,0
96,2014-04-30, percent march labor force participation rate employment population ratio increased slightly,percent march labor force participation rate employment population ratio increase slightly,0
97,2014-04-30,rate long duration unemployment declined somewhat share workers employed part time economic reasons moved up measures still well pre recession levels,rate long duration unemployment decline somewhat share worker employ part time economic reason move up measure still well pre recession level,0
98,2014-04-30,initial claims unemployment insurance remained low intermeeting period,initial claim unemployment insurance remain low intermeeting period,0
99,2014-04-30,although rate job openings moved february hiring rate flat continued subdued,although rate job opening move february hire rate flat continued subdue,0
100,2014-04-30,following rebound february partly weather related manufacturing production rose march rate manufacturing capacity utilization increased,follow rebound february partly weather related manufacturing production rise march rate manufacturing capacity utilization increase,0
101,2014-04-30,production motor vehicles parts declined march factory output outside motor vehicle sector expanded,production motor vehicle part decline march factory output outside motor vehicle sector expand,0
102,2014-04-30,automakers schedules indicated pace motor vehicle assemblies coming months would similar level march,automaker schedule indicate pace motor vehicle assembly come month would similar level march,0
103,2014-04-30,however broad indicators manufacturing production new orders indexes national regional manufacturing surveys levels consistent moderate increases factory output near term,however broad indicator manufacturing production new order index national regional manufacturing survey level consistent moderate increase factory output near term,0
104,2014-04-30,real personal consumption expenditures pce expanded slightly less rapidly first quarter fourth quarter,real personal consumption expenditure pce expand slightly less rapidly first quarter fourth quarter,0
105,2014-04-30,moving roughly sideways net january february component nominal retail sales used bureau economic analysis bea construct monthly estimate pce rose briskly march part weather returned seasonal norms,move roughly sideways net january february component nominal retail sale use bureau economic analysis bea construct monthly estimate pce rise briskly march part weather return seasonal norm,0
106,2014-04-30,recent information several important factors influence household spending positive,recent information several important factor influence household spending positive,0
107,2014-04-30,real disposable income continued increase first quarter gains house prices likely bolstered household net worth consumer sentiment thomson reutersuniversity michigan surveys consumers improved balance march april,real disposable income continued increase first quarter gain house price likely bolster household net worth consumer sentiment thomson reutersuniversity michigan survey consumer improve balance march april,0
108,2014-04-30,pace activity housing sector remained soft real expenditures residential investment decreased first quarter,pace activity housing sector remain soft real expenditure residential investment decrease first quarter,0
109,2014-04-30,starts new single family homes increased march,start new single family home increase march,0
110,2014-04-30,however permits single family homes typically less sensitive fluctuations weather better indicator underlying pace construction remained fourth quarter level not shown sustained improvement since last spring mortgage rates began rise,however permit single family home typically less sensitive fluctuation weather well indicator underlie pace construction remain fourth quarter level not show sustain improvement since last spring mortgage rate begin rise,0
111,2014-04-30,sales new existing homes decreased march year pending home sales rose,sale new exist home decrease march year pending home sale rise,0
112,2014-04-30,real private expenditures business equipment intellectual property products declined first quarter,real private expenditure business equipment intellectual property product decline first quarter,0
113,2014-04-30,however nominal shipments nondefense capital goods excluding aircraft rose february march new orders somewhat level shipments pointing modest gains shipments near term,however nominal shipment nondefense capital good exclude aircraft rise february march new order somewhat level shipment point modest gain shipment near term,0
114,2014-04-30,forward looking indicators surveys business conditions capital spending plans also consistent increased outlays business equipment coming months,forward look indicator survey business condition capital spending plan also consistent increase outlay business equipment come month,0
115,2014-04-30,real spending nonresidential construction flat first quarter declining fourth quarter real inventory investment moved lower,real spending nonresidential construction flat first quarter decline fourth quarter real inventory investment move low,0
116,2014-04-30,business inventories industries appeared broadly aligned sales recent months,business inventory industry appear broadly align sale recent month,0
117,2014-04-30,real federal government purchases rose slightly first quarter increase reversal government shutdown fourth quarter mostly offset ongoing downtrend purchases,real federal government purchase rise slightly first quarter increase reversal government shutdown fourth quarter mostly offset ongoing downtrend purchase,0
118,2014-04-30,real state local government purchases decreased somewhat first quarter state local construction expenditures declined,real state local government purchase decrease somewhat first quarter state local construction expenditure decline,0
119,2014-04-30,us international trade deficit widened february exports fell imports rose,u international trade deficit widen february export fell import rise,0
120,2014-04-30,export declines concentrated aircraft petroleum products exports consumer goods rose,export decline concentrate aircraft petroleum product export consumer good rise,0
121,2014-04-30,rising imports services automotive products offset declines imports oil capital goods,rise import service automotive product offset decline import oil capital good,0
122,2014-04-30,advance release national income product accounts bea estimated net exports subtracted substantially real gross domestic product gdp growth first quarter,advance release national income product account bea estimate net export subtract substantially real gross domestic product gdp growth first quarter,0
123,2014-04-30,us consumer prices measured pce price index rose slow rate first quarter though somewhat faster pace posted fourth quarter  percent higher year earlier,u consumer price measure pce price index rise slow rate first quarter though somewhat faster pace post fourth quarter percent high year earlier,0
124,2014-04-30,falling fourth quarter consumer energy prices increased markedly first quarter natural gas prices moved higher sharp decline inventories unusually cold winter months,fall fourth quarter consumer energy price increase markedly first quarter natural gas price move high sharp decline inventory unusually cold winter month,0
125,2014-04-30,pce price index items excluding food energy rose rate first quarter previous one around   percent higher four quarters earlier,pce price index item exclude food energy rise rate first quarter previous one around percent high four quarter earlier,0
126,2014-04-30,near longer term inflation expectations michigan survey unchanged march april,near longer term inflation expectation michigan survey unchanged march april,0
127,2014-04-30, months ending march employment cost index private sector workers average hourly earnings employees increased little consumer price inflation,month end march employment cost index private sector worker average hourly earnings employee increase little consumer price inflation,0
128,2014-04-30,indicators foreign economic activity suggested continued expansion first quarter rate somewhat fourth quarter,indicator foreign economic activity suggest continued expansion first quarter rate somewhat fourth quarter,0
129,2014-04-30,deceleration concentrated emerging market economies emes,deceleration concentrate emerge market economy emes,0
