,Date,Original,Corpus,Class
217,2014-03-19,one participant however favored retaining existing threshold language grounds removing unemployment rate reached   percent could misinterpreted signal path policy going forward would less accommodative,one participant however favor retain exist threshold language ground remove unemployment rate reach percent could misinterpret signal path policy go forward would less accommodative,0
218,2014-03-19,another participant favored introducing new quantitative thresholds   percent unemployment rate   percent projected inflation,another participant favor introduce new quantitative threshold percent unemployment rate percent project inflation,0
219,2014-03-19,participants proposed adding new language committee would indicate willingness keep rates low projected inflation remained persistently committee  percent longer run objective participants suggested inclusion quantitative element forward guidance would demonstrate committee commitment defend inflation objective well above,participant propose add new language committee would indicate willingness keep rate low project inflation remain persistently committee percent longer run objective participant suggest inclusion quantitative element forward guidance would demonstrate committee commitment defend inflation objective well above,0
220,2014-03-19,participants however judged already well understood committee recognizes inflation persistently  percent objective could pose risks economic performance,participant however judged already well understood committee recognizes inflation persistently percent objective could pose risk economic performance,0
221,2014-03-19,participants therefore not favor adding new quantitative language preferring shift qualitative language would describe committee likely reaction state economy,participant therefore not favor add new quantitative language prefer shift qualitative language would describe committee likely reaction state economy,0
222,2014-03-19,participants also believed that part process clarifying committee future policy intentions would appropriate time committee provide additional guidance postmeeting statement regarding likely behavior federal funds rate first increase,participant also believe that part process clarify committee future policy intention would appropriate time committee provide additional guidance postmeeting statement regard likely behavior federal fund rate first increase,0
223,2014-03-19,example statement could indicate committee currently anticipates that even employment inflation near mandate consistent levels economic conditions may time warrant keeping target federal funds rate levels committee views normal longer run,example statement could indicate committee currently anticipates that even employment inflation near mandate consistent level economic condition may time warrant keep target federal fund rate level committee view normal longer run,0
224,2014-03-19,participants observed number factors likely contributed persistent decline level interest rates consistent attaining maintaining committee objectives,participant observe number factor likely contribute persistent decline level interest rate consistent attain maintain committee objective,0
225,2014-03-19,particular participants cited higher precautionary savingss households following financial crisis higher global levels savings demographic changes slower growth potential output continued restraint availability credit,particular participant cite high precautionary savings household follow financial crisis high global level saving demographic change slow growth potential output continued restraint availability credit,0
226,2014-03-19,participants suggested new language along lines could instead introduced first increase federal funds rate drawn closer committee discussed reasons anticipating relatively low federal funds rate period policy firming,participant suggest new language along line could instead introduce first increase federal fund rate drawn closer committee discuss reason anticipate relatively low federal fund rate period policy firm,0
227,2014-03-19,number participants noted overall upward shift since december participants projections federal funds rate included march sep expressing concern component sep could misconstrued indicating move committee less accommodative reaction function,number participant note overall upward shift since december participant projection federal fund rate include march sep express concern component sep could misconstrue indicate move committee less accommodative reaction function,0
228,2014-03-19,however several participants noted increase median projection overstated shift projections,however several participant note increase median projection overstate shift projection,0
229,2014-03-19,addition number participants observed upward shift arguably warranted improvement participants outlooks labor market since december therefore need not viewed signifying less accommodative reaction function,addition number participant observe upward shift arguably warrant improvement participant outlook labor market since december therefore need not view signify less accommodative reaction function,0
230,2014-03-19,participants favored providing explicit indication statement new forward guidance taken whole not imply change committee policy intentions grounds indication could help forestall misinterpretation new forward guidance,participant favor provide explicit indication statement new forward guidance take whole not imply change committee policy intention ground indication could help forestall misinterpretation new forward guidance,0
231,2014-03-19,committee policy action committee members saw information received intermeeting period indicating growth economic activity slowed winter months part reflecting adverse weather conditions,committee policy action committee member saw information receive intermeeting period indicate growth economic activity slow winter month part reflect adverse weather condition,0
232,2014-03-19,labor market indicators mixed balance showed improvement,labor market indicator mixed balance show improvement,0
233,2014-03-19,unemployment rate however remained elevated judged members estimates longer run normal rate unemployment,unemployment rate however remain elevate judged member estimate longer run normal rate unemployment,0
234,2014-03-19,household spending business fixed investment continued advance recovery housing sector remained slow,household spending business fix investment continued advance recovery housing sector remain slow,0
235,2014-03-19,fiscal policy restraining economic growth although extent restraint diminished,fiscal policy restrain economic growth although extent restraint diminish,0
236,2014-03-19,committee expected that appropriate policy accommodation economy would expand moderate pace labor market conditions would continue improve gradually moving toward committee judges consistent dual mandate,committee expect that appropriate policy accommodation economy would expand moderate pace labor market condition would continue improve gradually move toward committee judge consistent dual mandate,0
237,2014-03-19,moreover members judged risks outlook economy labor market nearly balanced,moreover member judged risk outlook economy labor market nearly balance,0
238,2014-03-19,inflation running committee longer run objective seen posing possible risks economic performance members anticipated stable inflation expectations strengthening economic activity would time return inflation committee  percent objective,inflation run committee longer run objective see pose possible risk economic performance member anticipate stable inflation expectation strengthen economic activity would time return inflation committee percent objective,0
239,2014-03-19,however light concerns possible persistence low inflation members agreed inflation developments monitored carefully evidence inflation moving back toward committee longer run objective,however light concern possible persistence low inflation member agree inflation development monitor carefully evidence inflation move back toward committee longer run objective,0
240,2014-03-19,discussion monetary policy period ahead members agreed sufficient underlying strength broader economy support ongoing improvement labor market conditions,discussion monetary policy period ahead member agree sufficient underlie strength broader economy support ongoing improvement labor market condition,0
241,2014-03-19,light cumulative progress toward maximum employment improvement outlook labor market conditions since inception current asset purchase program members decided would appropriate make measured reduction pace asset purchases meeting,light cumulative progress toward maximum employment improvement outlook labor market condition since inception current asset purchase program member decide would appropriate make measure reduction pace asset purchase meeting,0
242,2014-03-19,members judged that economy continued develop anticipated committee would likely reduce pace asset purchases measured steps future meetings,member judged that economy continued develop anticipate committee would likely reduce pace asset purchase measure step future meeting,0
243,2014-03-19,members also underscored pace asset purchases not preset course would remain contingent committee outlook labor market inflation well assessment likely efficacy costs purchases,member also underscored pace asset purchase not preset course would remain contingent committee outlook labor market inflation well assessment likely efficacy cost purchase,0
244,2014-03-19,accordingly committee agreed that beginning april would add holdings agency mortgage backed securities pace  billion per month rather  billion per month would add holdings longer term treasury securities pace  billion per month rather  billion per month,accordingly committee agree that begin april would add holding agency mortgage back security pace billion per month rather billion per month would add holding longer term treasury security pace billion per month rather billion per month,0
245,2014-03-19,making measured reduction pace purchases committee emphasized holdings longer term securities sizable would still increasing would promote stronger economic recovery maintaining downward pressure longer term interest rates supporting mortgage markets helping make broader financial conditions accommodative,make measure reduction pace purchase committee emphasize holding longer term security sizable would still increase would promote strong economic recovery maintain downward pressure longer term interest rate support mortgage market help make broader financial condition accommodative,0
246,2014-03-19,committee also reiterated would continue asset purchases employ policy tools appropriate outlook labor market improved substantially context price stability,committee also reiterate would continue asset purchase employ policy tool appropriate outlook labor market improve substantially context price stability,0
247,2014-03-19,one member concurring policy action suggested future statements committee might provide information trajectory federal reserve balance sheet including information committee might discontinue policy reinvesting principal payments agency debt agency mortgage backed securities agency mortgage backed securities,one member concur policy action suggest future statement committee might provide information trajectory federal reserve balance sheet include information committee might discontinue policy reinvesting principal payment agency debt agency mortgage back security agency mortgage back security,0
248,2014-03-19,respect forward guidance federal funds rate members judged that unemployment rate likely fall   percent long appropriate replace existing quantitative thresholds meeting,respect forward guidance federal fund rate member judged that unemployment rate likely fall percent long appropriate replace exist quantitative threshold meeting,0
249,2014-03-19,almost members judged new language qualitative nature indicate that determining long maintain current   percent target range federal funds rate committee would assess progress realized expected toward objectives maximum employment  percent inflation,almost member judged new language qualitative nature indicate that determine long maintain current percent target range federal fund rate committee would ass progress realize expect toward objective maximum employment percent inflation,0
250,2014-03-19,however couple members preferred include language statement indicating committee would keep rates low projected inflation remained persistently committee  percent longer run objective,however couple member prefer include language statement indicate committee would keep rate low project inflation remain persistently committee percent longer run objective,0
251,2014-03-19,one members argued committee continue provide quantitative thresholds unemployment rate inflation,one member argue committee continue provide quantitative threshold unemployment rate inflation,0
252,2014-03-19,members also considered statement language would provide information anticipated behavior federal funds rate raised effective lower bound,member also consider statement language would provide information anticipate behavior federal fund rate raise effective low bound,0
253,2014-03-19,committee decided appropriate add language indicating committee currently anticipates that even employment inflation near mandate consistent levels economic conditions may time warrant keeping target federal funds rate levels committee views normal longer run,committee decide appropriate add language indicate committee currently anticipates that even employment inflation near mandate consistent level economic condition may time warrant keep target federal fund rate level committee view normal longer run,0
254,2014-03-19,discussing addition couple members suggested language along lines might better introduced later meeting,discuss addition couple member suggest language along line might well introduce later meeting,0
255,2014-03-19,however another member indicated adding new language stage could beneficial effectiveness policy financial conditions depend length time federal funds rate effective lower bound expected path federal funds rate follow policy firming begins,however another member indicate add new language stage could beneficial effectiveness policy financial condition depend length time federal fund rate effective low bound expect path federal fund rate follow policy firm begin,0
256,2014-03-19,also noted postmeeting statements rather sep provide public information committee monetary policy decisions therefore appropriate postmeeting statement convey committee position likely future behavior federal funds rate,also note postmeeting statement rather sep provide public information committee monetary policy decision therefore appropriate postmeeting statement convey committee position likely future behavior federal fund rate,0
257,2014-03-19,conclusion discussion committee voted authorize direct federal reserve bank new york instructed otherwise execute transactions soma accordance following domestic policy directive,conclusion discussion committee vote authorize direct federal reserve bank new york instruct otherwise execute transaction soma accordance follow domestic policy directive,0
258,2014-03-19,vote encompassed approval statement released,vote encompass approval statement release,0
259,2014-03-19,information received since federal open market committee met january indicates growth economic activity slowed winter months part reflecting adverse weather conditions,information receive since federal open market committee met january indicates growth economic activity slow winter month part reflect adverse weather condition,0
260,2014-03-19,labor market indicators mixed balance showed improvement,labor market indicator mixed balance show improvement,0
261,2014-03-19,unemployment rate however remains elevated,unemployment rate however remains elevate,0
262,2014-03-19,household spending business fixed investment continued advance recovery housing sector remained slow,household spending business fix investment continued advance recovery housing sector remain slow,0
263,2014-03-19,fiscal policy restraining economic growth although extent restraint diminishing,fiscal policy restrain economic growth although extent restraint diminish,0
264,2014-03-19,inflation running committee longer run objective longer term inflation expectations remained stable,inflation run committee longer run objective longer term inflation expectation remain stable,0
265,2014-03-19,consistent statutory mandate committee seeks foster maximum employment price stability,consistent statutory mandate committee seek foster maximum employment price stability,0
266,2014-03-19,committee expects that appropriate policy accommodation economic activity expand moderate pace labor market conditions continue improve gradually moving toward committee judges consistent dual mandate,committee expect that appropriate policy accommodation economic activity expand moderate pace labor market condition continue improve gradually move toward committee judge consistent dual mandate,0
267,2014-03-19,committee sees risks outlook economy labor market nearly balanced,committee see risk outlook economy labor market nearly balance,0
268,2014-03-19,committee recognizes inflation persistently  percent objective could pose risks economic performance monitoring inflation developments carefully evidence inflation move back toward objective medium term,committee recognizes inflation persistently percent objective could pose risk economic performance monitoring inflation development carefully evidence inflation move back toward objective medium term,0
269,2014-03-19,committee currently judges sufficient underlying strength broader economy support ongoing improvement labor market conditions,committee currently judge sufficient underlie strength broader economy support ongoing improvement labor market condition,0
270,2014-03-19,light cumulative progress toward maximum employment improvement outlook labor market conditions since inception current asset purchase program committee decided make measured reduction pace asset purchases,light cumulative progress toward maximum employment improvement outlook labor market condition since inception current asset purchase program committee decide make measure reduction pace asset purchase,0
271,2014-03-19,beginning april committee add holdings agency mortgage backed securities pace  billion per month rather  billion per month add holdings longer term treasury securities pace  billion per month rather  billion per month,begin april committee add holding agency mortgage back security pace billion per month rather billion per month add holding longer term treasury security pace billion per month rather billion per month,0
272,2014-03-19,committee maintaining existing policy reinvesting principal payments holdings agency debt agency mortgage backed securities agency mortgage backed securities rolling maturing treasury securities auction,committee maintain exist policy reinvesting principal payment holding agency debt agency mortgage back security agency mortgage back security roll mature treasury security auction,0
273,2014-03-19,committee sizable still increasing holdings longer term securities maintain downward pressure longer term interest rates support mortgage markets help make broader financial conditions accommodative turn promote stronger economic recovery help ensure inflation time rate consistent committee dual mandate,committee sizable still increase holding longer term security maintain downward pressure longer term interest rate support mortgage market help make broader financial condition accommodative turn promote strong economic recovery help ensure inflation time rate consistent committee dual mandate,0
274,2014-03-19,committee closely monitor incoming information economic financial developments coming months continue purchases treasury agency mortgage backed securities employ policy tools appropriate outlook labor market improved substantially context price stability,committee closely monitor incoming information economic financial development come month continue purchase treasury agency mortgage back security employ policy tool appropriate outlook labor market improve substantially context price stability,0
275,2014-03-19,incoming information broadly supports committee expectation ongoing improvement labor market conditions inflation moving back toward longer run objective committee likely reduce pace asset purchases measured steps future meetings,incoming information broadly support committee expectation ongoing improvement labor market condition inflation move back toward longer run objective committee likely reduce pace asset purchase measure step future meeting,0
276,2014-03-19,however asset purchases not preset course committee decisions pace remain contingent committee outlook labor market inflation well assessment likely efficacy costs purchases,however asset purchase not preset course committee decision pace remain contingent committee outlook labor market inflation well assessment likely efficacy cost purchase,0
277,2014-03-19,support continued progress toward maximum employment price stability committee today reaffirmed view highly accommodative stance monetary policy remains appropriate,support continued progress toward maximum employment price stability committee today reaffirm view highly accommodative stance monetary policy remains appropriate,0
278,2014-03-19,determining long maintain current   percent target range federal funds rate committee assess progress realized expected toward objectives maximum employment  percent inflation,determine long maintain current percent target range federal fund rate committee ass progress realize expect toward objective maximum employment percent inflation,0
279,2014-03-19,assessment take account wide range information including measures labor market conditions indicators inflation pressures inflation expectations readings financial developments,assessment take account wide range information include measure labor market condition indicator inflation pressure inflation expectation reading financial development,0
280,2014-03-19,committee continues anticipate based assessment factors likely appropriate maintain current target range federal funds rate considerable time asset purchase program ends especially projected inflation continues run committee  percent longer run goal provided longer term inflation expectations remain well anchored,committee continue anticipate base assessment factor likely appropriate maintain current target range federal fund rate considerable time asset purchase program end especially project inflation continue run committee percent longer run goal provide longer term inflation expectation remain well anchor,0
281,2014-03-19,committee decides begin remove policy accommodation take balanced approach consistent longer run goals maximum employment inflation  percent,committee decides begin remove policy accommodation take balance approach consistent longer run goal maximum employment inflation percent,0
282,2014-03-19,committee currently anticipates that even employment inflation near mandate consistent levels economic conditions may time warrant keeping target federal funds rate levels committee views normal longer run,committee currently anticipates that even employment inflation near mandate consistent level economic condition may time warrant keep target federal fund rate level committee view normal longer run,0
283,2014-03-19,unemployment rate nearing   percent committee updated forward guidance,unemployment rate near percent committee update forward guidance,0
284,2014-03-19,change committee guidance not indicate change committee policy intentions set forth recent statements,change committee guidance not indicate change committee policy intention set forth recent statement,0
285,2014-03-19,voting action janet yellen william dudley richard fisher sandra pianalto charles plosser jerome powell jeremy stein daniel tarullo,voting action janet yellen william dudley richard fisher sandra pianalto charles plosser jerome powell jeremy stein daniel tarullo,0
286,2014-03-19,voting action narayana kocherlakota,voting action narayana kocherlakota,0
287,2014-03-19,mr kocherlakota dissented because view new forward guidance fifth paragraph statement would weaken credibility committee commitment inflation goal failing communicate purposeful steps rapidly increase inflation  percent target suggesting committee views inflation persistently  percent acceptable outcome,mr kocherlakota dissent because view new forward guidance fifth paragraph statement would weaken credibility committee commitment inflation goal fail communicate purposeful step rapidly increase inflation percent target suggest committee view inflation persistently percent acceptable outcome,0
288,2014-03-19,moreover judged new guidance would act drag economic activity provided little information desired rate progress toward maximum employment no quantitative measure constitutes maximum employment thus would generate uncertainty extent committee willing use monetary stimulus foster faster growth,moreover judged new guidance would act drag economic activity provide little information desire rate progress toward maximum employment no quantitative measure constitutes maximum employment thus would generate uncertainty extent committee willing use monetary stimulus foster faster growth,0
