,Date,Original,Corpus,Class
0,2014-03-19,federal reserve central bank united states provides nation safe flexible stable monetary financial system,federal reserve central bank united state provide nation safe flexible stable monetary financial system,0
1,2014-03-19,federal open market committee,federal open market committee,0
2,2014-03-19,monetary policy principles practice,monetary policy principle practice,0
3,2014-03-19,policy implementation,policy implementation,0
4,2014-03-19,reports,report,0
5,2014-03-19,review monetary policy strategy tools communications,review monetary policy strategy tool communication,0
6,2014-03-19,institution supervision,institution supervision,0
7,2014-03-19,reports,report,0
8,2014-03-19,reporting forms,reporting form,0
9,2014-03-19,supervision  regulation letters,supervision regulation letter,0
10,2014-03-19,banking applications  legal developments,banking application legal development,0
11,2014-03-19,regulatory resources,regulatory resource,0
12,2014-03-19,banking  data structure,banking data structure,0
13,2014-03-19,regulations  statutes,regulation statute,0
14,2014-03-19,payment policies,payment policy,0
15,2014-03-19,reserve bank payment services  data,reserve bank payment service data,0
16,2014-03-19,financial market utilities  infrastructures,financial market utility infrastructure,0
17,2014-03-19,research committees forums,research committee forum,0
18,2014-03-19,working papers notes,work paper note,0
19,2014-03-19,models tools,model tool,0
20,2014-03-19,bank assets liabilities,bank asset liability,0
21,2014-03-19,bank structure data,bank structure data,0
22,2014-03-19,business finance,business finance,0
23,2014-03-19,dealer financing terms,dealer financing term,0
24,2014-03-19,exchange rates international data,exchange rate international data,0
25,2014-03-19,financial accounts,financial account,0
26,2014-03-19,household finance,household finance,0
27,2014-03-19,industrial activity,industrial activity,0
28,2014-03-19,interest rates,interest rate,0
29,2014-03-19,micro data reference manual mdrm,micro data reference manual mdrm,0
30,2014-03-19,money stock reserve balances,money stock reserve balance,0
31,2014-03-19,regulations,regulation,0
32,2014-03-19,supervision  enforcement,supervision enforcement,0
33,2014-03-19,community development,community development,0
34,2014-03-19,research  analysis,research analysis,0
35,2014-03-19,consumer resources,consumer resource,0
36,2014-03-19,march   ,march,0
37,2014-03-19,meeting federal open market committee held offices board governors federal reserve system washington dc tuesday march   continued wednesday march   m,meeting federal open market committee held office board governor federal reserve system washington dc tuesday march continued wednesday march m,0
38,2014-03-19,present janet yellen chair william dudley vice chairman richard fisher narayana kocherlakota sandra pianalto charles plosser jerome powell jeremy stein daniel tarullo,present janet yellen chair william dudley vice chairman richard fisher narayana kocherlakota sandra pianalto charles plosser jerome powell jeremy stein daniel tarullo,0
39,2014-03-19,christine cumming charles evans jeffrey lacker dennis lockhart john williams alternate members federal open market committee,christine cumming charles evans jeffrey lacker dennis lockhart john williams alternate member federal open market committee,0
40,2014-03-19,james bullard esther george eric rosengren presidents federal reserve banks st louis kansas city boston respectively,james bullard esther george eric rosengren president federal reserve bank st louis kansa city boston respectively,0
41,2014-03-19,william english secretary economist matthew luecke deputy secretary michelle smith assistant secretary scott alvarez general counsel thomas baxter deputy general counsel steven kamin economist david wilcox economist,william english secretary economist matthew luecke deputy secretary michelle smith assistant secretary scott alvarez general counsel thomas baxter deputy general counsel steven kamin economist david wilcox economist,0
42,2014-03-19,james clouse thomas connors evan koenig thomas laubach michael leahy loretta mester samuel schulhofer wohl mark schweitzer william wascher associate economists,james clouse thomas connors evan koenig thomas laubach michael leahy loretta mester samuel schulhofer wohl mark schweitzer william wascher associate economist,0
43,2014-03-19,simon potter manager system open market account,simon potter manager system open market account,0
44,2014-03-19,lorie logan deputy manager system open market account,lorie logan deputy manager system open market account,0
45,2014-03-19,michael gibson director division banking supervision regulation board governors louise roseman director division reserve bank operations payment systems board governors,michael gibson director division banking supervision regulation board governor louise roseman director division reserve bank operation payment system board governor,0
46,2014-03-19,nellie liang director office financial stability policy research board governors,nellie liang director office financial stability policy research board governor,0
47,2014-03-19,stephen meyer william nelson deputy directors division monetary affairs board governors,stephen meyer william nelson deputy director division monetary affair board governor,0
48,2014-03-19,jon faust special adviser board office board members board governors,jon faust special adviser board office board member board governor,0
49,2014-03-19,trevor reeve special adviser chair office board members board governors,trevor reeve special adviser chair office board member board governor,0
50,2014-03-19,ellen meade senior adviser division monetary affairs board governors,ellen meade senior adviser division monetary affair board governor,0
51,2014-03-19,eric engen michael palumbo wayne passmore associate directors division research statistics board governors,eric engen michael palumbo wayne passmore associate director division research statistic board governor,0
52,2014-03-19,brian gross special assistant board office board members board governors,brian gross special assistant board office board member board governor,0
53,2014-03-19,edward nelson assistant director division monetary affairs board governors,edward nelson assistant director division monetary affair board governor,0
54,2014-03-19,jeremy rudd adviser division research statistics board governors,jeremy rudd adviser division research statistic board governor,0
55,2014-03-19,stephanie aaronson section chief division research statistics board governors laura lipscomb section chief division monetary affairs board governors,stephanie aaronson section chief division research statistic board governor laura lipscomb section chief division monetary affair board governor,0
56,2014-03-19,david small project manager division monetary affairs board governors,david small project manager division monetary affair board governor,0
57,2014-03-19,peter garavuso records management analyst division monetary affairs board governors,peter garavuso record management analyst division monetary affair board governor,0
58,2014-03-19,david altig jeff fuhrer glenn rudebusch daniel sullivan executive vice presidents federal reserve banks atlanta boston san francisco chicago respectively,david altig jeff fuhrer glenn rudebusch daniel sullivan executive vice president federal reserve bank atlanta boston san francisco chicago respectively,0
59,2014-03-19,troy davig christopher waller john weinberg senior vice presidents federal reserve banks kansas city st louis richmond respectively,troy davig christopher waller john weinberg senior vice president federal reserve bank kansa city st louis richmond respectively,0
60,2014-03-19,jonathan mccarthy keith sill douglas tillett vice presidents federal reserve banks new york philadelphia chicago respectively,jonathan mccarthy keith sill douglas tillett vice president federal reserve bank new york philadelphia chicago respectively,0
61,2014-03-19,developments financial markets federal reserve balance sheet manager system open market account soma reported developments domestic foreign financial markets well system open market operations period since federal open market committee fomc met january   ,development financial market federal reserve balance sheet manager system open market account soma report development domestic foreign financial market well system open market operation period since federal open market committee fomc met january,0
62,2014-03-19,unanimous vote committee ratified open market desk domestic transactions intermeeting period,unanimous vote committee ratify open market desk domestic transaction intermeeting period,0
63,2014-03-19,no intervention operations foreign currencies system account intermeeting period,no intervention operation foreign currency system account intermeeting period,0
64,2014-03-19,staff review economic situation information reviewed march   meeting indicated economic growth slowed early year likely part temporary effects unusually cold snowy winter weather,staff review economic situation information review march meeting indicate economic growth slow early year likely part temporary effect unusually cold snowy winter weather,0
65,2014-03-19,total payroll employment expanded further unemployment rate held steady balance still elevated,total payroll employment expand far unemployment rate held steady balance still elevate,0
66,2014-03-19,consumer price inflation continued run committee longer run objective measures longer run inflation expectations remained stable,consumer price inflation continued run committee longer run objective measure longer run inflation expectation remain stable,0
67,2014-03-19,total nonfarm payroll employment rose january february slower pace fourth quarter last year,total nonfarm payroll employment rise january february slow pace fourth quarter last year,0
68,2014-03-19,unemployment rate ,unemployment rate,0
69,2014-03-19, percent february december last year,percent february december last year,0
70,2014-03-19,labor force participation rate along employment population ratio increased net recent months,labor force participation rate along employment population ratio increase net recent month,0
71,2014-03-19,share workers employed part time economic reasons rate long duration unemployment lower february late last year although measures still high,share worker employ part time economic reason rate long duration unemployment low february late last year although measure still high,0
72,2014-03-19,initial claims unemployment insurance little changed intermeeting period,initial claim unemployment insurance little change intermeeting period,0
73,2014-03-19,rate job openings stepped down rate hiring unchanged december january,rate job opening step down rate hire unchanged december january,0
74,2014-03-19,manufacturing production roughly flat balance january february part effects severe winter weather held motor vehicle output production outside motor vehicle sector,manufacturing production roughly flat balance january february part effect severe winter weather held motor vehicle output production outside motor vehicle sector,0
75,2014-03-19,automakers production schedules indicated pace light motor vehicle assemblies would increase second quarter broader indicators manufacturing production readings new orders national manufacturing surveys consistent expectation moderate expansion factory output coming months,automaker production schedule indicate pace light motor vehicle assembly would increase second quarter broader indicator manufacturing production reading new order national manufacturing survey consistent expectation moderate expansion factory output come month,0
76,2014-03-19,real personal consumption expenditures pce increased little net december january,real personal consumption expenditure pce increase little net december january,0
77,2014-03-19,however components nominal retail sales data used bureau economic analysis construct estimate pce rose faster rate february previous couple months light motor vehicle sales also moved up,however component nominal retail sale data use bureau economic analysis construct estimate pce rise faster rate february previous couple month light motor vehicle sale also move up,0
78,2014-03-19,recent information key factors influence household spending along expectation weather would return seasonal norms generally pointed toward additional gains pce coming months,recent information key factor influence household spending along expectation weather would return seasonal norm generally point toward additional gain pce come month,0
79,2014-03-19,households net worth probably continued expand equity prices home values increased further consumer sentiment thomson reutersuniversity michigan surveys consumers february early march remained average last fall however real disposable incomes edged up balance december january,household net worth probably continued expand equity price home value increase far consumer sentiment thomson reutersuniversity michigan survey consumer february early march remain average last fall however real disposable income edge up balance december january,0
80,2014-03-19,pace activity housing sector appeared soften,pace activity housing sector appear soften,0
81,2014-03-19,starts new single family homes multifamily units lower january february end last year,start new single family home multifamily unit low january february end last year,0
82,2014-03-19,permits single family homes typically less sensitive fluctuations weather better indicator underlying pace construction also moved months not shown sustained improvement since last spring mortgage rates began rise,permit single family home typically less sensitive fluctuation weather well indicator underlie pace construction also move month not show sustain improvement since last spring mortgage rate begin rise,0
83,2014-03-19,sales existing homes decreased january pending home sales little changed although new home sales expanded,sale exist home decrease january pending home sale little change although new home sale expand,0
84,2014-03-19,growth real private expenditures business equipment intellectual property products stepped fourth quarter faster rate third quarter,growth real private expenditure business equipment intellectual property product step fourth quarter faster rate third quarter,0
85,2014-03-19,january nominal shipments nondefense capital goods excluding aircraft decreased slightly,january nominal shipment nondefense capital good exclude aircraft decrease slightly,0
86,2014-03-19,however new orders capital goods increased remained level shipments january pointing increases shipments subsequent months,however new order capital good increase remain level shipment january point increase shipment subsequent month,0
87,2014-03-19,forward looking indicators surveys business conditions also generally consistent modest increases business equipment spending near term,forward look indicator survey business condition also generally consistent modest increase business equipment spending near term,0
88,2014-03-19,real business spending nonresidential structures essentially unchanged fourth quarter nominal expenditures structures flat january,real business spending nonresidential structure essentially unchanged fourth quarter nominal expenditure structure flat january,0
89,2014-03-19,real nonfarm inventory investment increased significantly slower pace fourth quarter preceding quarter recent data book value inventories along readings inventories national regional manufacturing surveys not point significant inventory imbalances industries however days supply light motor vehicles january february exceeded automakers targets,real nonfarm inventory investment increase significantly slow pace fourth quarter precede quarter recent data book value inventory along reading inventory national regional manufacturing survey not point significant inventory imbalance industry however day supply light motor vehicle january february exceed automaker target,0
90,2014-03-19,federal spending data january february pointed toward real federal government purchases roughly flat first quarter general downtrend purchases seemed likely offset reversal effects partial government shutdown fourth quarter,federal spending data january february point toward real federal government purchase roughly flat first quarter general downtrend purchase seem likely offset reversal effect partial government shutdown fourth quarter,0
91,2014-03-19,total real state local government purchases also appeared flat going first quarter,total real state local government purchase also appear flat go first quarter,0
92,2014-03-19,payrolls governments expanded somewhat balance january february nominal state local construction expenditures declined little january,payroll government expand somewhat balance january february nominal state local construction expenditure decline little january,0
93,2014-03-19,us international trade deficit widening december remained unchanged january,u international trade deficit widen december remain unchanged january,0
94,2014-03-19,exports increased january gains modest decreases sales cars petroleum products agricultural goods offset gains major categories,export increase january gain modest decrease sale car petroleum product agricultural good offset gain major category,0
95,2014-03-19,imports also rose january increase volume oil imports offset declines imports non oil goods services,import also rise january increase volume oil import offset decline import non oil good service,0
96,2014-03-19,totals consumer price inflation measured pce price index   percent  months ending january continuing run committee longer run objective  percent,total consumer price inflation measure pce price index percent month end january continue run committee longer run objective percent,0
97,2014-03-19, month period consumer energy prices rose faster total consumer prices consumer food prices edged up core pce prices exclude food energy prices increased bit  percent,month period consumer energy price rise faster total consumer price consumer food price edge up core pce price exclude food energy price increase bit percent,0
98,2014-03-19,february consumer price index cpi rose pace similar seen recent months food prices rose quickly energy prices declined increase core cpi remained slow,february consumer price index cpi rise pace similar see recent month food price rise quickly energy price decline increase core cpi remain slow,0
99,2014-03-19,near longer term inflation expectations michigan survey little changed february early march,near longer term inflation expectation michigan survey little change february early march,0
100,2014-03-19,measures labor compensation indicated increases nominal wages remained subdued,measure labor compensation indicate increase nominal wage remain subdue,0
101,2014-03-19,compensation per hour nonfarm business sector increased slightly year ending fourth quarter and gains labor productivity unit labor costs declined little,compensation per hour nonfarm business sector increase slightly year end fourth quarter and gain labor productivity unit labor cost decline little,0
102,2014-03-19,year long period employment cost index average hourly earnings employees rose little faster consumer price inflation,year long period employment cost index average hourly earnings employee rise little faster consumer price inflation,0
103,2014-03-19,foreign real gross domestic product gdp expanded moderate pace fourth quarter  weak economic growth japan mexico offsetting stronger gains many economies,foreign real gross domestic product gdp expand moderate pace fourth quarter weak economic growth japan mexico offset strong gain many economy,0
104,2014-03-19,recent indicators suggested total foreign real gdp expanding similar pace first quarter ,recent indicator suggest total foreign real gdp expand similar pace first quarter,0
105,2014-03-19,economic recovery euro area appeared continuing pace japanese economic growth looked picked up,economic recovery euro area appear continue pace japanese economic growth look picked up,0
106,2014-03-19,canada however severe winter weather appeared held economic activity early ,canada however severe winter weather appear held economic activity early,0
107,2014-03-19,among emerging market economies emes recent data suggested economic growth china slowing first quarter rate growth asian economies also declining robust fourth quarter pace,among emerge market economy emes recent data suggest economic growth china slow first quarter rate growth asian economy also decline robust fourth quarter pace,0
108,2014-03-19,mexican real gdp growth slowed sharply fourth quarter led contraction manufacturing sector recent indicators auto production suggested rebound pace economic activity current quarter,mexican real gdp growth slow sharply fourth quarter lead contraction manufacturing sector recent indicator auto production suggest rebound pace economic activity current quarter,0
109,2014-03-19,inflation increased slightly advanced economies remained well central banks targets,inflation increase slightly advanced economy remain well central bank target,0
110,2014-03-19,time inflation declined emerging asian economies,time inflation decline emerge asian economy,0
111,2014-03-19,monetary policy remained highly accommodative advanced foreign economies,monetary policy remain highly accommodative advanced foreign economy,0
112,2014-03-19,across emes monetary policy adjustments varied according economic financial developments central banks tightening policy others loosening it,across emes monetary policy adjustment varied accord economic financial development central bank tighten policy others loosening it,0
113,2014-03-19,staff review financial situation financial market conditions united states intermeeting period appeared influenced easing concerns developments emes relatively little affected generally weaker expected economic data market participants appeared attribute large part temporary effects unusually severe winter weather,staff review financial situation financial market condition united state intermeeting period appear influence ease concern development emes relatively little affected generally weaker expect economic data market participant appear attribute large part temporary effect unusually severe winter weather,0
114,2014-03-19,balance us financial conditions remained supportive growth economic activity employment expected path federal funds rate little changed longer term yields treasury securities edged down equity prices rose speculative grade corporate bond spreads narrowed foreign exchange value dollar depreciated slightly,balance u financial condition remain supportive growth economic activity employment expect path federal fund rate little change longer term yield treasury security edge down equity price rise speculative grade corporate bond spread narrow foreign exchange value dollar depreciate slightly,0
115,2014-03-19,fomc communications intermeeting period line market expectations,fomc communication intermeeting period line market expectation,0
116,2014-03-19,fomc decision statement january largely anticipated market participants,fomc decision statement january largely anticipate market participant,0
117,2014-03-19,monetary policy report chair yellen accompanying congressional testimony february viewed emphasizing continuity approach monetary policy solidifying expectations pace committee asset purchases would reduced  billion upcoming meeting absent material change economic outlook,monetary policy report chair yellen accompany congressional testimony february view emphasize continuity approach monetary policy solidify expectation pace committee asset purchase would reduce billion upcoming meeting absent material change economic outlook,0
118,2014-03-19,results desk survey primary dealers march indicated dealers expectations likely future path federal funds rate federal reserve asset purchases largely unchanged since january,result desk survey primary dealer march indicate dealer expectation likely future path federal fund rate federal reserve asset purchase largely unchanged since january,0
119,2014-03-19,survey results showed dealers expected committee modify forward rate guidance march meeting many anticipating shift toward qualitative guidance,survey result show dealer expect committee modify forward rate guidance march meeting many anticipate shift toward qualitative guidance,0
120,2014-03-19,yields short intermediate term treasury securities little changed balance intermeeting period effects waning flight quality demands early period roughly offset generally weaker expected economic data,yield short intermediate term treasury security little change balance intermeeting period effect wan flight quality demand early period roughly offset generally weaker expect economic data,0
121,2014-03-19,yields longer term treasury securities edged down,yield longer term treasury security edge down,0
122,2014-03-19,measures longer horizon inflation compensation based treasury inflation protected securities also declined somewhat,measure longer horizon inflation compensation base treasury inflation protect security also decline somewhat,0
123,2014-03-19,federal reserve continued fixed rate overnight reverse repurchase agreement on rrp exercise,federal reserve continued fix rate overnight reverse repurchase agreement on rrp exercise,0
124,2014-03-19,early intermeeting period market rates repurchase agreements close fixed rate offered exercise prompting high take rrp operations,early intermeeting period market rate repurchase agreement close fix rate offer exercise prompt high take rrp operation,0
