,Date,Original,Corpus,Class
221,2014-04-30,many participants saw recent behavior prices food energy shelter imports consistent stabilization inflation judged transitory factors reduced inflation declines administered prices medical services fading,many participant saw recent behavior price food energy shelter import consistent stabilization inflation judged transitory factor reduce inflation decline administer price medical service fading,0
222,2014-04-30,participants expected inflation return  percent within next years supported highly accommodative monetary policy stable inflation expectations continued gradual recovery economic activity,participant expect inflation return percent within next year support highly accommodative monetary policy stable inflation expectation continued gradual recovery economic activity,0
223,2014-04-30,however others expressed concern return  percent inflation could even gradual,however others express concern return percent inflation could even gradual,0
224,2014-04-30,discussion financial stability participants generally not see imbalances posed significant near term risks financial system broader economy nevertheless reviewed financial developments pointed potential future risks,discussion financial stability participant generally not see imbalance pose significant near term risk financial system broader economy nevertheless review financial development point potential future risk,0
225,2014-04-30,couple participants noted conditions leveraged loan market become stretched although equity cushions new deals remained levels seen prior financial crisis,couple participant note condition leveraged loan market become stretch although equity cushion new deal remain level see prior financial crisis,0
226,2014-04-30,two others saw declining credit spreads particularly speculative grade corporate bonds consistent increase investors appetite risk,two others saw decline credit spread particularly speculative grade corporate bond consistent increase investor appetite risk,0
227,2014-04-30,addition several participants noted low level expected volatility implied financial market prices might also signal increase risk appetite,addition several participant note low level expect volatility imply financial market price might also signal increase risk appetite,0
228,2014-04-30,stated would helpful continue explore appropriate regulatory supervisory monetary policy responses potential risks financial stability,state would helpful continue explore appropriate regulatory supervisory monetary policy response potential risk financial stability,0
229,2014-04-30,noted changes committee forward guidance march fomc meeting well understood investors,note change committee forward guidance march fomc meeting well understood investor,0
230,2014-04-30,however number participants emphasized importance communicating still clearly committee policy intentions time first increase federal funds rate moves closer,however number participant emphasize importance communicate still clearly committee policy intention time first increase federal fund rate move closer,0
231,2014-04-30,thought would helpful clarify reasoning underlying language fomc postmeeting statement indicating even employment inflation near mandate consistent levels economic conditions may time warrant keeping target federal funds rate levels committee views normal longer run,thought would helpful clarify reason underlie language fomc postmeeting statement indicate even employment inflation near mandate consistent level economic condition may time warrant keep target federal fund rate level committee view normal longer run,0
232,2014-04-30,addition participants judged additional clarity committee reaction function could particularly important event future economic conditions necessitate rapid rise target federal funds rate committee currently anticipates,addition participant judged additional clarity committee reaction function could particularly important event future economic condition necessitate rapid rise target federal fund rate committee currently anticipates,0
233,2014-04-30,number participants suggested would useful provide additional information regarding long committee would continue policy rolling maturing treasury securities auction reinvesting principal payments agency debt agency mortgage backed securities agency mortgage backed securities,number participant suggest would useful provide additional information regard long committee would continue policy roll mature treasury security auction reinvesting principal payment agency debt agency mortgage back security agency mortgage back security,0
234,2014-04-30,committee policy action members viewed information received intermeeting period indicating economic growth picked recently following sharp slowdown winter due part unusually severe weather conditions,committee policy action member view information receive intermeeting period indicate economic growth picked recently follow sharp slowdown winter due part unusually severe weather condition,0
235,2014-04-30,although labor market indicators mixed balance showed improvement,although labor market indicator mixed balance show improvement,0
236,2014-04-30,unemployment rate however remained elevated,unemployment rate however remain elevate,0
237,2014-04-30,household spending appeared rising rapidly business fixed investment edged recovery housing sector remained slow,household spending appear rise rapidly business fix investment edge recovery housing sector remain slow,0
238,2014-04-30,fiscal policy restraining economic growth extent restraint diminished,fiscal policy restrain economic growth extent restraint diminish,0
239,2014-04-30,committee expected that appropriate policy accommodation economic activity would expand moderate pace labor market conditions would continue improve gradually moving toward committee judges consistent dual mandate,committee expect that appropriate policy accommodation economic activity would expand moderate pace labor market condition would continue improve gradually move toward committee judge consistent dual mandate,0
240,2014-04-30,moreover members continued see risks outlook economy labor market nearly balanced,moreover member continued see risk outlook economy labor market nearly balance,0
241,2014-04-30,inflation running committee longer run objective seen posing possible risks economic performance members anticipated stable inflation expectations strengthening economic activity would time return inflation committee  percent target,inflation run committee longer run objective see pose possible risk economic performance member anticipate stable inflation expectation strengthen economic activity would time return inflation committee percent target,0
242,2014-04-30,however light concerns possible persistence low inflation members agreed inflation developments monitored carefully evidence inflation moving back toward committee longer run objective,however light concern possible persistence low inflation member agree inflation development monitor carefully evidence inflation move back toward committee longer run objective,0
243,2014-04-30,discussion monetary policy period ahead members noted little change economic outlook since march meeting decided would appropriate make measured reduction pace asset purchases meeting,discussion monetary policy period ahead member note little change economic outlook since march meeting decide would appropriate make measure reduction pace asset purchase meeting,0
244,2014-04-30,accordingly committee agreed that beginning may would add holdings agency mortgage backed securities pace  billion per month rather  billion per month would add holdings longer term treasury securities pace  billion per month rather  billion per month,accordingly committee agree that begin may would add holding agency mortgage back security pace billion per month rather billion per month would add holding longer term treasury security pace billion per month rather billion per month,0
245,2014-04-30,members judged that economy continued develop anticipated committee would likely reduce pace asset purchases measured steps future meetings,member judged that economy continued develop anticipate committee would likely reduce pace asset purchase measure step future meeting,0
246,2014-04-30,however members underscored pace asset purchases not preset course would remain contingent committee outlook labor market inflation well assessment likely efficacy costs purchases,however member underscored pace asset purchase not preset course would remain contingent committee outlook labor market inflation well assessment likely efficacy cost purchase,0
247,2014-04-30,committee agreed no changes target range federal funds rate forward guidance warranted meeting aside removing short paragraph added forward guidance updated march meeting noted change committee guidance not signal change committee policy intentions members deemed language no longer necessary,committee agree no change target range federal fund rate forward guidance warrant meeting aside remove short paragraph add forward guidance update march meeting note change committee guidance not signal change committee policy intention member deem language no longer necessary,0
248,2014-04-30,conclusion discussion committee voted authorize direct federal reserve bank new york instructed otherwise execute transactions soma accordance following domestic policy directive,conclusion discussion committee vote authorize direct federal reserve bank new york instruct otherwise execute transaction soma accordance follow domestic policy directive,0
249,2014-04-30,vote encompassed approval statement released,vote encompass approval statement release,0
250,2014-04-30,voting action janet yellen william dudley richard fisher narayana kocherlakota sandra pianalto charles plosser jerome powell jeremy stein daniel tarullo,voting action janet yellen william dudley richard fisher narayana kocherlakota sandra pianalto charles plosser jerome powell jeremy stein daniel tarullo,0
251,2014-04-30,voting action none,voting action none,0
252,2014-04-30,agreed next meeting committee would held tuesday wednesday june   ,agree next meeting committee would held tuesday wednesday june,0
253,2014-04-30,meeting adjourned april  ,meeting adjourn april,0
254,2014-04-30,notation vote notation vote completed april   committee unanimously approved minutes committee meeting held march   ,notation vote notation vote complete april committee unanimously approve minute committee meeting held march,0
255,2014-04-30,william english secretary,william english secretary,0
256,2014-04-30,attended wednesday session only,attend wednesday session only,0
257,2014-04-30,return text,return text,0
258,2014-04-30,attended discussion monetary policy normalization,attend discussion monetary policy normalization,0
259,2014-04-30,return text,return text,0
260,2014-04-30,attended tuesday session only,attend tuesday session only,0
261,2014-04-30,return text,return text,0
262,2014-04-30,attended tuesday session following discussion monetary policy normalization,attend tuesday session follow discussion monetary policy normalization,0
263,2014-04-30,return text,return text,0
264,2014-04-30,board governors federal reserve system,board governor federal reserve system,0
