,Date,Original,Corpus,Class
285,2014-09-17,committee currently judges sufficient underlying strength broader economy support ongoing improvement labor market conditions,committee currently judge sufficient underlie strength broader economy support ongoing improvement labor market condition,0
286,2014-09-17,light cumulative progress toward maximum employment improvement outlook labor market conditions since inception current asset purchase program committee decided make measured reduction pace asset purchases,light cumulative progress toward maximum employment improvement outlook labor market condition since inception current asset purchase program committee decide make measure reduction pace asset purchase,0
287,2014-09-17,beginning october committee add holdings agency mortgage backed securities pace  billion per month rather  billion per month add holdings longer term treasury securities pace  billion per month rather  billion per month,begin october committee add holding agency mortgage back security pace billion per month rather billion per month add holding longer term treasury security pace billion per month rather billion per month,0
288,2014-09-17,committee maintaining existing policy reinvesting principal payments holdings agency debt agency mortgage backed securities agency mortgage backed securities rolling maturing treasury securities auction,committee maintain exist policy reinvesting principal payment holding agency debt agency mortgage back security agency mortgage back security roll mature treasury security auction,0
289,2014-09-17,committee sizable still increasing holdings longer term securities maintain downward pressure longer term interest rates support mortgage markets help make broader financial conditions accommodative turn promote stronger economic recovery help ensure inflation time rate consistent committee dual mandate,committee sizable still increase holding longer term security maintain downward pressure longer term interest rate support mortgage market help make broader financial condition accommodative turn promote strong economic recovery help ensure inflation time rate consistent committee dual mandate,0
290,2014-09-17,committee closely monitor incoming information economic financial developments coming months continue purchases treasury agency mortgage backed securities employ policy tools appropriate outlook labor market improved substantially context price stability,committee closely monitor incoming information economic financial development come month continue purchase treasury agency mortgage back security employ policy tool appropriate outlook labor market improve substantially context price stability,0
291,2014-09-17,incoming information broadly supports committee expectation ongoing improvement labor market conditions inflation moving back toward longer run objective committee end current program asset purchases next meeting,incoming information broadly support committee expectation ongoing improvement labor market condition inflation move back toward longer run objective committee end current program asset purchase next meeting,0
292,2014-09-17,however asset purchases not preset course committee decisions pace remain contingent committee outlook labor market inflation well assessment likely efficacy costs purchases,however asset purchase not preset course committee decision pace remain contingent committee outlook labor market inflation well assessment likely efficacy cost purchase,0
293,2014-09-17,support continued progress toward maximum employment price stability committee today reaffirmed view highly accommodative stance monetary policy remains appropriate,support continued progress toward maximum employment price stability committee today reaffirm view highly accommodative stance monetary policy remains appropriate,0
294,2014-09-17,determining long maintain current   percent target range federal funds rate committee assess progress realized expected toward objectives maximum employment  percent inflation,determine long maintain current percent target range federal fund rate committee ass progress realize expect toward objective maximum employment percent inflation,0
295,2014-09-17,assessment take account wide range information including measures labor market conditions indicators inflation pressures inflation expectations readings financial developments,assessment take account wide range information include measure labor market condition indicator inflation pressure inflation expectation reading financial development,0
296,2014-09-17,committee continues anticipate based assessment factors likely appropriate maintain current target range federal funds rate considerable time asset purchase program ends especially projected inflation continues run committee  percent longer run goal provided longer term inflation expectations remain well anchored,committee continue anticipate base assessment factor likely appropriate maintain current target range federal fund rate considerable time asset purchase program end especially project inflation continue run committee percent longer run goal provide longer term inflation expectation remain well anchor,0
297,2014-09-17,committee decides begin remove policy accommodation take balanced approach consistent longer run goals maximum employment inflation  percent,committee decides begin remove policy accommodation take balance approach consistent longer run goal maximum employment inflation percent,0
298,2014-09-17,committee currently anticipates that even employment inflation near mandate consistent levels economic conditions may time warrant keeping target federal funds rate levels committee views normal longer run,committee currently anticipates that even employment inflation near mandate consistent level economic condition may time warrant keep target federal fund rate level committee view normal longer run,0
299,2014-09-17,voting action janet yellen william dudley lael brainard stanley fischer narayana kocherlakota loretta mester jerome powell daniel tarullo,voting action janet yellen william dudley lael brainard stanley fischer narayana kocherlakota loretta mester jerome powell daniel tarullo,0
300,2014-09-17,voting action richard fisher charles plosser,voting action richard fisher charles plosser,0
301,2014-09-17,president fisher dissented believed continued strengthening real economy improved outlook labor utilization general price stability continued signs financial market excess likely warrant earlier reduction monetary accommodation suggested committee stated forward guidance,president fisher dissent believe continued strengthen real economy improve outlook labor utilization general price stability continued sign financial market excess likely warrant earlier reduction monetary accommodation suggest committee state forward guidance,0
302,2014-09-17,mr plosser dissented objected statement guidance indicating likely appropriate maintain current target range federal funds rate considerable time asset purchase program ends,mr plosser dissent object statement guidance indicate likely appropriate maintain current target range federal fund rate considerable time asset purchase program end,0
303,2014-09-17,view reference calendar time replaced language indicates monetary policy respond incoming data,view reference calendar time replace language indicates monetary policy respond incoming data,0
304,2014-09-17,moreover judged statement not acknowledge substantial progress made toward committee economic goals thus risks unnecessary disruptive volatility financial markets perhaps economy committee reduces accommodation sooner quickly financial markets anticipate,moreover judged statement not acknowledge substantial progress make toward committee economic goal thus risk unnecessary disruptive volatility financial market perhaps economy committee reduces accommodation sooner quickly financial market anticipate,0
305,2014-09-17,agreed next meeting committee would held tuesday wednesday october   ,agree next meeting committee would held tuesday wednesday october,0
306,2014-09-17,meeting adjourned september  ,meeting adjourn september,0
307,2014-09-17,notation vote notation vote completed august   committee unanimously approved minutes committee meeting held july   ,notation vote notation vote complete august committee unanimously approve minute committee meeting held july,0
308,2014-09-17,william english secretary,william english secretary,0
309,2014-09-17,attended joint session federal open market committee board governors,attend joint session federal open market committee board governor,0
310,2014-09-17,return text,return text,0
311,2014-09-17,attended wednesday session only,attend wednesday session only,0
312,2014-09-17,return text,return text,0
313,2014-09-17,attended tuesday session only,attend tuesday session only,0
314,2014-09-17,return text,return text,0
315,2014-09-17,attended portion meeting following joint session federal open market committee board governors,attend portion meeting follow joint session federal open market committee board governor,0
316,2014-09-17,return text,return text,0
317,2014-09-17,recently released data health services consumption second quarter notably stronger bureau economic analysis estimated constructing recent pce estimates second quarter,recently release data health service consumption second quarter notably strong bureau economic analysis estimate construct recent pce estimate second quarter,0
318,2014-09-17,return text,return text,0
319,2014-09-17,board governors federal reserve system,board governor federal reserve system,0
