,Date,Original,Corpus,Class
208,2014-09-17,nonetheless cutbacks defense nondefense federal outlays well state governments budget restraint continued weigh jobs income parts country,nonetheless cutback defense nondefense federal outlay well state government budget restraint continued weigh job income part country,0
209,2014-09-17,fiscal policy overall anticipated neutral factor economic growth next several years,fiscal policy overall anticipate neutral factor economic growth next several year,0
210,2014-09-17,participants discussion prospects economic activity abroad commented number uncertainties risks attending outlook,participant discussion prospect economic activity abroad comment number uncertainty risk attend outlook,0
211,2014-09-17,intermeeting period foreign exchange value dollar appreciated particularly euro yen pound sterling,intermeeting period foreign exchange value dollar appreciate particularly euro yen pound sterling,0
212,2014-09-17,participants expressed concern persistent shortfall economic growth inflation euro area could lead appreciation dollar adverse effectss external sector,participant express concern persistent shortfall economic growth inflation euro area could lead appreciation dollar adverse effects external sector,0
213,2014-09-17,several participants added slower economic growth china japan unanticipated events middle east ukraine might pose similar risk,several participant add slow economic growth china japan unanticipated event middle east ukraine might pose similar risk,0
214,2014-09-17,time couple participants pointed appreciation dollar might also tend slow gradual increase inflation toward fomc  percent goal,time couple participant point appreciation dollar might also tend slow gradual increase inflation toward fomc percent goal,0
215,2014-09-17,labor market conditions continued improve intermeeting period,labor market condition continued improve intermeeting period,0
216,2014-09-17,although unemployment rate little changed participants variously cited positive readings indicators including decline longer term unemployment low level new claims unemployment insurance rise job openings survey reports increased hiring plans job availability,although unemployment rate little change participant variously cite positive reading indicator include decline longer term unemployment low level new claim unemployment insurance rise job opening survey report increase hire plan job availability,0
217,2014-09-17,recent estimate nonfarm payroll employment showed smaller monthly gain earlier year followed six months increases averaged ,recent estimate nonfarm payroll employment show small monthly gain earlier year follow six month increase average,0
218,2014-09-17,participants reluctant place much weight one monthly report noted first estimate august frequently revised recent years,participant reluctant place much weight one monthly report note first estimate august frequently revise recent year,0
219,2014-09-17,participants generally agreed accumulated progress labor market conditions since committee current asset purchase program began september  substantial expected progress would sustained,participant generally agree accumulate progress labor market condition since committee current asset purchase program begin september substantial expect progress would sustain,0
220,2014-09-17,nonetheless continued express differing views extent remaining slack labor markets,nonetheless continued express differ view extent remain slack labor market,0
221,2014-09-17,agreed underutilization labor resources remained significant participants noted variously level nonfarm payroll jobs recently returned pre recession level number individuals working part time economic reasons still elevated relative level unemployment labor force participation rate still assessments structural trend,agree underutilization labor resource remain significant participant note variously level nonfarm payroll job recently return pre recession level number individual work part time economic reason still elevate relative level unemployment labor force participation rate still assessment structural trend,0
222,2014-09-17,regard couple participants pointed stability participation rate balance past year suggested cyclical shortfall diminished,regard couple participant point stability participation rate balance past year suggest cyclical shortfall diminish,0
223,2014-09-17,agreed committee assessment labor market slack grounded review range labor market indicators although saw gap unemployment rate estimate longer run normal level reliable indicator slack,agree committee assessment labor market slack ground review range labor market indicator although saw gap unemployment rate estimate longer run normal level reliable indicator slack,0
224,2014-09-17,measures labor compensation showed no broad based increase wage inflation,measure labor compensation show no broad base increase wage inflation,0
225,2014-09-17,however businesses several districts continued report upward pressure wages specific industries occupations associated labor shortages difficult fill jobs couple participants noted general rise current planned wage increases regions,however business several district continued report upward pressure wage specific industry occupation associate labor shortage difficult fill job couple participant note general rise current plan wage increase region,0
226,2014-09-17,several participants commented relatively subdued rise nominal labor compensation still longer run trend rates productivity growth inflation signal slack remaining labor market,several participant comment relatively subdue rise nominal labor compensation still longer run trend rate productivity growth inflation signal slack remain labor market,0
227,2014-09-17,however couple others suggested caution reading subdued wage inflation indicator labor market underutilization,however couple others suggest caution reading subdue wage inflation indicator labor market underutilization,0
228,2014-09-17,pointed nominal wages not adjust downward unemployment high pent wage deflation could help explain modest increases wages far recovery wages could rise rapidly going forward unemployment rate continues decline,point nominal wage not adjust downward unemployment high pent wage deflation could help explain modest increase wage far recovery wage could rise rapidly go forward unemployment rate continue decline,0
229,2014-09-17,inflation running committee longer run objective readings consumer prices intermeeting period somewhat softer preceding four months part declining energy prices,inflation run committee longer run objective reading consumer price intermeeting period somewhat softer precede four month part decline energy price,0
230,2014-09-17,participants anticipated inflation would move gradually back toward objective medium term,participant anticipate inflation would move gradually back toward objective medium term,0
231,2014-09-17,however participants differed somewhat assessments quickly inflation would move up,however participant differ somewhat assessment quickly inflation would move up,0
232,2014-09-17,cited stability longer run inflation expectations level consistent committee objective important factor forecasts inflation would reach  percent coming years,cite stability longer run inflation expectation level consistent committee objective important factor forecast inflation would reach percent come year,0
233,2014-09-17,participants views responsiveness inflation level change resource utilization varied seeing labor markets sufficiently tight wages prices would soon begin move noticeably others indicating inflation unlikely approach  percent unemployment rate falls longer run normal level,participant view responsiveness inflation level change resource utilization varied see labor market sufficiently tight wage price would soon begin move noticeably others indicate inflation unlikely approach percent unemployment rate fall longer run normal level,0
234,2014-09-17,viewed risk inflation would run persistently  percent diminished somewhat since earlier year couple noted possibility longer term inflation expectations might slightly lower committee  percent objective domestic inflation might held persistent disinflation amongs trading partners appreciation dollar,view risk inflation would run persistently percent diminish somewhat since earlier year couple note possibility longer term inflation expectation might slightly low committee percent objective domestic inflation might held persistent disinflation amongs trading partner appreciation dollar,0
235,2014-09-17,discussion appropriate path monetary policy medium term meeting participants agreed timing first increase federal funds rate appropriate path policy rate thereafter would depend incoming economic data implications outlook,discussion appropriate path monetary policy medium term meeting participant agree timing first increase federal fund rate appropriate path policy rate thereafter would depend incoming economic data implication outlook,0
236,2014-09-17,said several participants thought current forward guidance regarding federal funds rate suggested longer period liftoff perhaps also gradual increase federal funds rate thereafter believed likely appropriate given economic financial conditions,say several participant thought current forward guidance regard federal fund rate suggest longer period liftoff perhaps also gradual increase federal fund rate thereafter believe likely appropriate give economic financial condition,0
237,2014-09-17,addition concern raised reference considerable time current forward guidance could misunderstood commitment rather data dependent,addition concern raise reference considerable time current forward guidance could misunderstood commitment rather data dependent,0
238,2014-09-17,however noted current formulation committee forward guidance clearly indicated committee policy decisions conditional ongoing assessment realized expected progress toward objectives maximum employment  percent inflation assessment reflected review broad array economic indicators,however note current formulation committee forward guidance clearly indicate committee policy decision conditional ongoing assessment realize expect progress toward objective maximum employment percent inflation assessment reflect review broad array economic indicator,0
239,2014-09-17,emphasized current forward guidance federal funds rate data dependent not indicate first increase target range federal funds rate would occur mechanically fixed calendar interval following completion current asset purchase program,emphasize current forward guidance federal fund rate data dependent not indicate first increase target range federal fund rate would occur mechanically fix calendar interval follow completion current asset purchase program,0
240,2014-09-17,employment inflation converged rapidly toward committee goals currently expected date liftoff could earlier subsequent increases federal funds rate target rapid participants currently anticipated,employment inflation converge rapidly toward committee goal currently expect date liftoff could earlier subsequent increase federal fund rate target rapid participant currently anticipate,0
241,2014-09-17,conversely employment inflation returned toward committee objectives slowly currently anticipated date liftoff federal funds rate could later future federal funds rate target increases could gradual,conversely employment inflation return toward committee objective slowly currently anticipate date liftoff federal fund rate could later future federal fund rate target increase could gradual,0
242,2014-09-17,addition participants saw current forward guidance appropriate light risk management considerations suggested would prudent err side patience awaiting evidence sustained progress toward committee goals,addition participant saw current forward guidance appropriate light risk management consideration suggest would prudent err side patience await evidence sustain progress toward committee goal,0
243,2014-09-17,view costs downside shocks economy would larger upside shocks because current circumstances would less problematic remove accommodation quickly becomes necessary add accommodation,view cost downside shock economy would large upside shock because current circumstance would less problematic remove accommodation quickly becomes necessary add accommodation,0
244,2014-09-17,number participants also noted changes forward guidance might misinterpreted signal fundamental shift stance policy could result unintended tightening financial conditions,number participant also note change forward guidance might misinterpret signal fundamental shift stance policy could result unintended tighten financial condition,0
245,2014-09-17,participants also discussed forward guidance language might evolve committee decides current formulation no longer appropriately conveys intentions future stance policy,participant also discuss forward guidance language might evolve committee decides current formulation no longer appropriately conveys intention future stance policy,0
246,2014-09-17,participants indicated preference clarifying dependence current forward guidance economic data committee assessment progress toward objectives maximum employment  percent inflation,participant indicate preference clarify dependence current forward guidance economic data committee assessment progress toward objective maximum employment percent inflation,0
247,2014-09-17,clarification along lines seen likely improve public understanding committee reaction function allowing committee retain flexibility respond appropriately changes economic outlook,clarification along line see likely improve public understand committee reaction function allow committee retain flexibility respond appropriately change economic outlook,0
248,2014-09-17,one participant favored using numerical threshold based inflation outlook form forward guidance,one participant favor use numerical threshold base inflation outlook form forward guidance,0
249,2014-09-17,participants however noted difficulties associated expressing forward guidance terms numerical thresholds set economic variables,participant however note difficulty associate express forward guidance term numerical threshold set economic variable,0
250,2014-09-17,another participant indicated preference reducing reliance explicit forward guidance statement conveying instead guidance regarding future stance monetary policy mechanisms including sep,another participant indicate preference reduce reliance explicit forward guidance statement convey instead guidance regard future stance monetary policy mechanism include sep,0
251,2014-09-17,noted providing explicit forward guidance regarding future path federal funds rate might become less important highly accommodative stance policy no longer appropriate process policy normalization well way,note provide explicit forward guidance regard future path federal fund rate might become less important highly accommodative stance policy no longer appropriate process policy normalization well way,0
252,2014-09-17,generally agreed changes forward guidance become appropriate likely present communication challenges caution needed avoid sending unintended signals committee policy outlook,generally agree change forward guidance become appropriate likely present communication challenge caution need avoid send unintended signal committee policy outlook,0
253,2014-09-17,committee policy action discussion monetary policy period ahead members judged information received since fomc met july indicated economic activity expanding moderate pace,committee policy action discussion monetary policy period ahead member judged information receive since fomc met july indicate economic activity expand moderate pace,0
254,2014-09-17,household spending appeared rising moderately business fixed investment advancing recovery housing sector remained slow,household spending appear rise moderately business fix investment advance recovery housing sector remain slow,0
255,2014-09-17,fiscal policy restraining economic growth although extent restraint diminishing would soon quite small,fiscal policy restrain economic growth although extent restraint diminish would soon quite small,0
256,2014-09-17,inflation running committee longer run objective longer term inflation expectations stable,inflation run committee longer run objective longer term inflation expectation stable,0
257,2014-09-17,committee expected that appropriate policy accommodation economic activity would expand moderate pace labor market indicators inflation moving toward levels committee judges consistent dual mandate,committee expect that appropriate policy accommodation economic activity would expand moderate pace labor market indicator inflation move toward level committee judge consistent dual mandate,0
258,2014-09-17,incoming information continuing broadly support committee expectation ongoing improvement labor market conditions inflation moving back toward committee  percent objective members agreed measured reduction pace asset purchases appropriate meeting,incoming information continue broadly support committee expectation ongoing improvement labor market condition inflation move back toward committee percent objective member agree measure reduction pace asset purchase appropriate meeting,0
259,2014-09-17,accordingly committee agreed that beginning october would add holdings agency mbs pace  billion per month rather  billion per month would add holdings longer term treasury securities pace  billion per month rather  billion per month,accordingly committee agree that begin october would add holding agency mb pace billion per month rather billion per month would add holding longer term treasury security pace billion per month rather billion per month,0
260,2014-09-17,committee judged that incoming information broadly supported expectations labor market indicator inflation would continue move toward mandate consistent levels would end current program asset purchases october meeting,committee judged that incoming information broadly support expectation labor market indicator inflation would continue move toward mandate consistent level would end current program asset purchase october meeting,0
261,2014-09-17,members discussed assessments progress toward committee objectives maximum employment  percent inflation considered possible enhancements statement would clearly communicate committee view progress,member discuss assessment progress toward committee objective maximum employment percent inflation consider possible enhancement statement would clearly communicate committee view progress,0
262,2014-09-17,regarding labor market many members indicated that although labor market conditions generally continued improve still significant slack labor markets,regard labor market many member indicate that although labor market condition generally continued improve still significant slack labor market,0
263,2014-09-17,members however expressed reservations continuing characterize extent underutilization labor resources significant,member however express reservation continue characterize extent underutilization labor resource significant,0
264,2014-09-17,end members agreed indicate labor market conditions improved somewhat further unemployment rate little changed range labor market indicators continued suggest remained significant underutilization labor resources,end member agree indicate labor market condition improve somewhat far unemployment rate little change range labor market indicator continued suggest remain significant underutilization labor resource,0
265,2014-09-17,noted however characterization labor market underutilization might changed progress labor market continued,note however characterization labor market underutilization might change progress labor market continued,0
266,2014-09-17,regarding inflation members agreed inflation moved closer committee  percent objective first half year but recently fallen back somewhat,regard inflation member agree inflation move closer committee percent objective first half year but recently fall back somewhat,0
267,2014-09-17,consequence updated language statement indicate inflation running committee longer run objective,consequence update language statement indicate inflation run committee longer run objective,0
268,2014-09-17,however stable longer term inflation expectations committee continued judge likelihood inflation running persistently  percent diminished somewhat since early year,however stable longer term inflation expectation committee continued judge likelihood inflation run persistently percent diminish somewhat since early year,0
269,2014-09-17,discussion members two voted maintain committee target range federal funds rate reiterate forward guidance federal funds rate,discussion member two vote maintain committee target range federal fund rate reiterate forward guidance federal fund rate,0
270,2014-09-17,guidance continued state committee decisions long maintain current target range federal funds rate would depend assessment actual expected progress toward objectives maximum employment  percent inflation,guidance continued state committee decision long maintain current target range federal fund rate would depend assessment actual expect progress toward objective maximum employment percent inflation,0
271,2014-09-17,committee anticipated likely would appropriate maintain current target range federal funds rate considerable time asset purchase program ends especially projected inflation continued run committee  percent longer run goal provided longer term inflation expectations remained well anchored,committee anticipate likely would appropriate maintain current target range federal fund rate considerable time asset purchase program end especially project inflation continued run committee percent longer run goal provide longer term inflation expectation remain well anchor,0
272,2014-09-17,forward guidance also reiterated committee expectation that even employment inflation near mandate consistent levels economic conditions may time warrant keeping target federal funds rate levels committee views normal longer run,forward guidance also reiterate committee expectation that even employment inflation near mandate consistent level economic condition may time warrant keep target federal fund rate level committee view normal longer run,0
273,2014-09-17,two members however dissented because view statement language not accurately reflect progress made date toward committee goals maximum employment inflation  percent believed ongoing progress likely warrant earlier increase federal funds rate suggested forward guidance committee postmeeting statement,two member however dissent because view statement language not accurately reflect progress make date toward committee goal maximum employment inflation percent believe ongoing progress likely warrant earlier increase federal fund rate suggest forward guidance committee postmeeting statement,0
274,2014-09-17,conclusion discussion committee voted authorize direct federal reserve bank new york instructed otherwise execute transactions soma accordance following domestic policy directive,conclusion discussion committee vote authorize direct federal reserve bank new york instruct otherwise execute transaction soma accordance follow domestic policy directive,0
275,2014-09-17,vote encompassed approval statement released,vote encompass approval statement release,0
276,2014-09-17,information received since federal open market committee met july suggests economic activity expanding moderate pace,information receive since federal open market committee met july suggests economic activity expand moderate pace,0
277,2014-09-17,balance labor market conditions improved somewhat further however unemployment rate little changed range labor market indicators suggests remains significant underutilization labor resources,balance labor market condition improve somewhat far however unemployment rate little change range labor market indicator suggests remains significant underutilization labor resource,0
278,2014-09-17,household spending appears rising moderately business fixed investment advancing recovery housing sector remains slow,household spending appear rise moderately business fix investment advance recovery housing sector remains slow,0
279,2014-09-17,fiscal policy restraining economic growth although extent restraint diminishing,fiscal policy restrain economic growth although extent restraint diminish,0
280,2014-09-17,inflation running committee longer run objective,inflation run committee longer run objective,0
281,2014-09-17,longer term inflation expectations remained stable,longer term inflation expectation remain stable,0
282,2014-09-17,consistent statutory mandate committee seeks foster maximum employment price stability,consistent statutory mandate committee seek foster maximum employment price stability,0
283,2014-09-17,committee expects that appropriate policy accommodation economic activity expand moderate pace labor market indicators inflation moving toward levels committee judges consistent dual mandate,committee expect that appropriate policy accommodation economic activity expand moderate pace labor market indicator inflation move toward level committee judge consistent dual mandate,0
284,2014-09-17,committee sees risks outlook economic activity labor market nearly balanced judges likelihood inflation running persistently  percent diminished somewhat since early year,committee see risk outlook economic activity labor market nearly balance judge likelihood inflation run persistently percent diminish somewhat since early year,0
