,Date,Original,Corpus,Class
125,2014-03-19,increases interest rate offered federal reserve rrp exercise along increases caps individual bids also may contributed higher levels activity daily operations,increase interest rate offer federal reserve rrp exercise along increase cap individual bid also may contribute high level activity daily operation,0
126,2014-03-19,later period market rates repurchase agreements moved higher apparently response rise treasury bill issuance rrp volumes moderated,later period market rate repurchase agreement move high apparently response rise treasury bill issuance rrp volume moderate,0
127,2014-03-19,reflecting larger size rrp exercises reduced pace asset purchases rate increase monetary base slowed january february,reflect large size rrp exercise reduce pace asset purchase rate increase monetary base slow january february,0
128,2014-03-19,conditions unsecured short term dollar funding markets remained stable intermeeting period,condition unsecured short term dollar funding market remain stable intermeeting period,0
129,2014-03-19,responses march  senior credit officer opinion survey dealer financing terms suggested little change past three months conditions securities financing counter derivatives markets credit terms applicable classes counterparties,response march senior credit officer opinion survey dealer financing term suggest little change past three month condition security financing counter derivative market credit term applicable class counterparties,0
130,2014-03-19,broad stock price indexes rose intermeeting period apparently boosted solid finish corporate earnings season,broad stock price index rise intermeeting period apparently boost solid finish corporate earnings season,0
131,2014-03-19,equity prices also supported broad increase investors willingness take riskier positions part likely reflecting easing concerns emes early period,equity price also support broad increase investor willingness take riskier position part likely reflect ease concern emes early period,0
132,2014-03-19,credit flows nonfinancial corporations remained robust,credit flow nonfinancial corporation remain robust,0
133,2014-03-19,following slowdown january nonfinancial corporate bond issuance rebounded february majority proceeds going investment grade firms,follow slowdown january nonfinancial corporate bond issuance rebound february majority proceeds go investment grade firm,0
134,2014-03-19,growth commercial industrial loans banks balance sheets increased period,growth commercial industrial loan bank balance sheet increase period,0
135,2014-03-19,institutional issuance leveraged loans continued brisk pace,institutional issuance leveraged loan continued brisk pace,0
136,2014-03-19,financing conditions commercial real estate cre sector continued improve gradually,financing condition commercial real estate cre sector continued improve gradually,0
137,2014-03-19,fourth quarter banks cre loans increased across major loan categories cre loans banks books advanced solid pace first two months year,fourth quarter bank cre loan increase across major loan category cre loan bank book advanced solid pace first two month year,0
138,2014-03-19,issuance commercial mortgage backed securities robust february slow start january,issuance commercial mortgage back security robust february slow start january,0
139,2014-03-19,conditions municipal bond market remained favorable intermeeting period spread municipal yields yields comparable maturity treasury securities little changed,condition municipal bond market remain favorable intermeeting period spread municipal yield yield comparable maturity treasury security little change,0
140,2014-03-19,although puerto rico general obligation go bonds downgraded investment grade speculative grade prices bonds held steady albeit depressed levels,although puerto rico general obligation go bond downgrade investment grade speculative grade price bond held steady albeit depressed level,0
141,2014-03-19,puerto rico successfully brought market go bond issue early march substantially easing near term liquidity pressures,puerto rico successfully brought market go bond issue early march substantially ease near term liquidity pressure,0
142,2014-03-19,house prices registered notable rise january,house price register notable rise january,0
143,2014-03-19,mortgage interest rates spreads treasury yields little changed intermeeting period,mortgage interest rate spread treasury yield little change intermeeting period,0
144,2014-03-19,mortgage applications home purchases refinancing applications remained low levels early march,mortgage application home purchase refinance application remain low level early march,0
145,2014-03-19,financing conditions residential mortgage markets stayed tight even incremental signs easing emerged,financing condition residential mortgage market stayed tight even incremental sign ease emerge,0
146,2014-03-19,conditions consumer credit markets still mixed,condition consumer credit market still mixed,0
147,2014-03-19,auto loans continued broadly available credit card limits borrowers subprime prime credit scores remained low levels fourth quarter,auto loan continued broadly available credit card limit borrower subprime prime credit score remain low level fourth quarter,0
148,2014-03-19,partly reflecting conditions credit card balances stayed flat january auto student loans continued expand briskly,partly reflect condition credit card balance stayed flat january auto student loan continued expand briskly,0
149,2014-03-19,issuance auto credit card asset backed securities robust january february,issuance auto credit card asset back security robust january february,0
150,2014-03-19,financial market sentiment abroad appeared improve period particularly respect stresses developed emes prior january fomc meeting,financial market sentiment abroad appear improve period particularly respect stress developed emes prior january fomc meeting,0
151,2014-03-19,although global equity price indexes fell abruptly march  amid deepening political crisis ukraine markets quickly retraced losses,although global equity price index fell abruptly march amid deepen political crisis ukraine market quickly retrace loss,0
152,2014-03-19,consistent general improvement financial market sentiment foreign currencies appreciated dollar flight safety flows reversed,consistent general improvement financial market sentiment foreign currency appreciate dollar flight safety flow reverse,0
153,2014-03-19,one notable exception chinese renminbi depreciated dollar,one notable exception chinese renminbi depreciate dollar,0
154,2014-03-19,performance foreign equity price indexes mixed net stock prices rose emes flat europe declined substantially japan,performance foreign equity price index mixed net stock price rise emes flat europe decline substantially japan,0
155,2014-03-19,longer term sovereign bond yields advanced economies fell modestly period,longer term sovereign bond yield advanced economy fell modestly period,0
156,2014-03-19,staff economic outlook economic forecast prepared staff march fomc meeting real gdp growth first half year somewhat lower projection january meeting,staff economic outlook economic forecast prepared staff march fomc meeting real gdp growth first half year somewhat low projection january meeting,0
157,2014-03-19,available readings consumer spending residential construction business investment pointed less spending growth first quarter staff previously expected,available reading consumer spending residential construction business investment point less spending growth first quarter staff previously expect,0
158,2014-03-19,staff assessment unusually severe winter weather could account some not all recent unanticipated weakness economic activity staff lowered projection near term output growth,staff assessment unusually severe winter weather could account some not all recent unanticipated weakness economic activity staff lower projection near term output growth,0
159,2014-03-19,largely combination recent downward surprises unemployment rate weaker expected real gdp growth staff lowered slightly assumed pace potential output growth recent years projection period,largely combination recent downward surprise unemployment rate weaker expect real gdp growth staff lower slightly assume pace potential output growth recent year projection period,0
160,2014-03-19,result staff medium term forecast real gdp growth also revised slightly,result staff medium term forecast real gdp growth also revise slightly,0
161,2014-03-19,nevertheless staff continued project real gdp would expand faster pace next years last year real gdp growth would exceed growth rate potential output,nevertheless staff continued project real gdp would expand faster pace next year last year real gdp growth would exceed growth rate potential output,0
162,2014-03-19,faster pace real gdp growth expected supported easing restraint changes fiscal policy increases consumer business confidence improvements credit availability financial conditions pickup rate foreign economic growth,faster pace real gdp growth expect support ease restraint change fiscal policy increase consumer business confidence improvement credit availability financial condition pickup rate foreign economic growth,0
163,2014-03-19,expansion economic activity anticipated lead slow reduction resource slack projection period unemployment rate expected decline gradually staff estimate longer run natural rate,expansion economic activity anticipate lead slow reduction resource slack projection period unemployment rate expect decline gradually staff estimate longer run natural rate,0
164,2014-03-19,staff forecast inflation basically unchanged projection prepared previous fomc meeting,staff forecast inflation basically unchanged projection prepared previous fomc meeting,0
165,2014-03-19,staff continued forecast inflation would stay committee longer run objective  percent next years,staff continued forecast inflation would stay committee longer run objective percent next year,0
166,2014-03-19,inflation projected rise gradually toward committee objective longer run inflation expectations assumed remain stable changes commodity import prices expected subdued slack labor product markets anticipated diminish slowly,inflation project rise gradually toward committee objective longer run inflation expectation assume remain stable change commodity import price expect subdue slack labor product market anticipate diminish slowly,0
167,2014-03-19,staff economic projections march meeting quite similar forecasts presented december meeting fomc last prepared summary economic projections sep,staff economic projection march meeting quite similar forecast present december meeting fomc last prepared summary economic projection sep,0
168,2014-03-19,staff march projections real gdp growth unemployment rate next years slightly lower december forecasts inflation projection essentially unchanged,staff march projection real gdp growth unemployment rate next year slightly low december forecast inflation projection essentially unchanged,0
169,2014-03-19,staff viewed extent uncertainty around march projections real gdp growth unemployment rate roughly line average past  years,staff view extent uncertainty around march projection real gdp growth unemployment rate roughly line average past year,0
170,2014-03-19,nonetheless risks forecast real gdp growth viewed tilted little downside especially economy not well positioned withstand adverse shocks target federal funds rate effective lower bound,nonetheless risk forecast real gdp growth view tilt little downside especially economy not well position withstand adverse shock target federal fund rate effective low bound,0
171,2014-03-19,time staff viewed risks around outlook unemployment rate inflation roughly balanced,time staff view risk around outlook unemployment rate inflation roughly balance,0
172,2014-03-19,participants views current conditions economic outlook conjunction fomc meeting meeting participants  members board governors presidents  federal reserve banks participated deliberations submitted assessments real output growth unemployment rate inflation target federal funds rate year   longer run participant judgment appropriate monetary policy,participant view current condition economic outlook conjunction fomc meeting meeting participant member board governor president federal reserve bank participate deliberation submit assessment real output growth unemployment rate inflation target federal fund rate year longer run participant judgment appropriate monetary policy,0
173,2014-03-19,longer run projections represent participant assessment rate variable would expected converge time appropriate monetary policy absence shocks economy,longer run projection represent participant assessment rate variable would expect converge time appropriate monetary policy absence shock economy,0
174,2014-03-19,economic projections policy assessments described sep attached addendum minutes,economic projection policy assessment described sep attach addendum minute,0
175,2014-03-19,discussion economic situation outlook participants generally noted data released since january meeting indicated somewhat slower expected growth economic activity winter months part reflecting adverse weather conditions,discussion economic situation outlook participant generally note data release since january meeting indicate somewhat slow expect growth economic activity winter month part reflect adverse weather condition,0
176,2014-03-19,labor market indicators mixed,labor market indicator mixed,0
177,2014-03-19,inflation continued run committee longer run objective longer term inflation expectations remained stable,inflation continued run committee longer run objective longer term inflation expectation remain stable,0
178,2014-03-19,several participants indicated recent economic news although leading mark somewhat estimates economic growth late  well assessments likely growth first quarter  not prompted significant revision projections moderate economic growth coming quarters,several participant indicate recent economic news although lead mark somewhat estimate economic growth late well assessment likely growth first quarter not prompt significant revision projection moderate economic growth come quarter,0
179,2014-03-19,participants noted unusually severe winter weather held economic activity early months year,participant note unusually severe winter weather held economic activity early month year,0
180,2014-03-19,business contacts various parts country reported number weather induced disruptions including reduced manufacturing activity due lost workdays interruptions supply chains inputs delivery final products lower expected retail sales,business contact various part country report number weather induced disruption include reduce manufacturing activity due lose workday interruption supply chain input delivery final product low expect retail sale,0
181,2014-03-19,participants expected economic activity pick weather related disruptions spending production dissipated,participant expect economic activity pick weather related disruption spending production dissipate,0
182,2014-03-19,participants however highlighted factors weather likely contributed slowdown first quarter including slower growth net exports following unusually large positive contribution growth fourth quarter ,participant however highlight factor weather likely contribute slowdown first quarter include slow growth net export follow unusually large positive contribution growth fourth quarter,0
183,2014-03-19,moreover noted pickup economic growth appeared indicated data available january meeting reversed subsequent data revisions,moreover note pickup economic growth appear indicate data available january meeting reverse subsequent data revision,0
184,2014-03-19,many participants outlook economic activity coming quarters changed little balance since time december meeting,many participant outlook economic activity come quarter change little balance since time december meeting,0
185,2014-03-19,housing activity remained slow intermeeting period,housing activity remain slow intermeeting period,0
186,2014-03-19,although unfavorable weather contributed recent disappointing performance housing participants suggested last year rise mortgage interest rates might produced larger expected reduction home sales,although unfavorable weather contribute recent disappoint performance housing participant suggest last year rise mortgage interest rate might produce large expect reduction home sale,0
187,2014-03-19,addition noted return house prices normal levels could damping pace housing recovery home affordability reduced prospective buyers,addition note return house price normal level could damp pace housing recovery home affordability reduce prospective buyer,0
188,2014-03-19,slackening demand institutional investors cited another factor behind decline home sales,slacken demand institutional investor cite another factor behind decline home sale,0
189,2014-03-19,nonetheless underlying fundamentals including population growth household formation viewed pointing continuing recovery housing market,nonetheless underlie fundamental include population growth household formation view point continue recovery housing market,0
190,2014-03-19,discussion labor market developments participants noted improvement balance labor market conditions,discussion labor market development participant note improvement balance labor market condition,0
191,2014-03-19,unemployment rate moved recent months broader measures unemployment underemployment,unemployment rate move recent month broader measure unemployment underemployment,0
192,2014-03-19,labor market indicators payrolls hiring quit rates not showing extent improvement also pointed ongoing gains labor markets,labor market indicator payroll hire quit rate not show extent improvement also point ongoing gain labor market,0
193,2014-03-19,going forward participants continued expect gradual decline unemployment rate medium term judgments differing somewhat across participants likely pace decline,go forward participant continued expect gradual decline unemployment rate medium term judgment differ somewhat across participant likely pace decline,0
194,2014-03-19,also noted uncertainty trend rate productivity growth making difficult ascertain rate real gdp growth would associated progress reducing unemployment rate,also note uncertainty trend rate productivity growth make difficult ascertain rate real gdp growth would associate progress reduce unemployment rate,0
195,2014-03-19,general agreement slack remains labor market participants expressed range views regarding amount slack well unemployment rate performs summary indicator labor market conditions,general agreement slack remains labor market participant express range view regard amount slack well unemployment rate performs summary indicator labor market condition,0
196,2014-03-19,several participants pointed number factors including low labor force participation rate still high rates longer duration unemployment workers employed part time economic reasons suggesting might considerably labor market slack indicated unemployment rate alone,several participant point number factor include low labor force participation rate still high rate longer duration unemployment worker employ part time economic reason suggest might considerably labor market slack indicate unemployment rate alone,0
197,2014-03-19,couple participants however saw reasons believe slack limited viewing decline participation rate primarily reflecting demographic trends little role cyclical factors observing broader measures unemployment registered declines past year comparable decline standard measure,couple participant however saw reason believe slack limited view decline participation rate primarily reflect demographic trend little role cyclical factor observe broader measure unemployment register decline past year comparable decline standard measure,0
198,2014-03-19,several participants cited low nominal wage growth pointing existence continued labor market slack,several participant cite low nominal wage growth point existence continued labor market slack,0
199,2014-03-19,participants also noted debate research literature elsewhere concerning whether long term unemployment differs materially short term unemployment implications wage price pressures,participant also note debate research literature elsewhere concern whether long term unemployment differs materially short term unemployment implication wage price pressure,0
200,2014-03-19,inflation continued run committee  percent longer run objective intermeeting period,inflation continued run committee percent longer run objective intermeeting period,0
201,2014-03-19,couple participants expressed concern inflation might not return  percent next years suggested protracted period inflation  percent raised questions whether committee providing appropriate degree monetary accommodation,couple participant express concern inflation might not return percent next year suggest protract period inflation percent raise question whether committee provide appropriate degree monetary accommodation,0
202,2014-03-19,one participants suggested persistently low inflation clear reflection sizable shortfall employment maximum level,one participant suggest persistently low inflation clear reflection sizable shortfall employment maximum level,0
203,2014-03-19,number participants noted pickup nominal wage growth would consistent labor market conditions moving closer normal would support return consumer price inflation committee  percent longer run goal,number participant note pickup nominal wage growth would consistent labor market condition move closer normal would support return consumer price inflation committee percent longer run goal,0
204,2014-03-19,however couple participants suggested factors economic slack played notable role holding inflation late including unusually slow growth prices medical services,however couple participant suggest factor economic slack played notable role hold inflation late include unusually slow growth price medical service,0
205,2014-03-19,participants expected inflation return  percent next years supported stable inflation expectations continued gradual recovery economic activity,participant expect inflation return percent next year support stable inflation expectation continued gradual recovery economic activity,0
206,2014-03-19,several participants pointed international developments bear watching,several participant point international development bear watch,0
207,2014-03-19,suggested slower growth china likely already put downward pressure world commodity prices couple participants observed larger expected slowdown economic growth china could adverse implications global economic growth,suggest slow growth china likely already put downward pressure world commodity price couple participant observe large expect slowdown economic growth china could adverse implication global economic growth,0
208,2014-03-19,addition noted events ukraine likely little direct effects economic outlook might negative implications global growth escalated led protracted period geopolitical tensions region,addition note event ukraine likely little direct effect economic outlook might negative implication global growth escalate lead protract period geopolitical tension region,0
209,2014-03-19,discussion recent financial developments participants saw financial conditions generally consistent committee policy intentions,discussion recent financial development participant saw financial condition generally consistent committee policy intention,0
210,2014-03-19,however several participants mentioned trends that continued could become concern perspective financial stability,however several participant mention trend that continued could become concern perspective financial stability,0
211,2014-03-19,couple participants pointed decline credit spreads relatively low levels historical standards one participants noted risk either sharp rise spreads could negative repercussions aggregate demand continuation decline spreads could undermine financial stability time,couple participant point decline credit spread relatively low level historical standard one participant note risk either sharp rise spread could negative repercussion aggregate demand continuation decline spread could undermine financial stability time,0
212,2014-03-19,one participant voiced concern high levels margin debt equity market valuations well notable shift commodity investments,one participant voiced concern high level margin debt equity market valuation well notable shift commodity investment,0
213,2014-03-19,another participant stressed growth consumer credit less creditworthy households,another participant stress growth consumer credit less creditworthy household,0
214,2014-03-19,discussion monetary policy going forward participants focused primarily possible changes committee forward guidance federal funds rate,discussion monetary policy go forward participant focus primarily possible change committee forward guidance federal fund rate,0
215,2014-03-19,almost participants agreed appropriate meeting update forward guidance part unemployment rate seen likely fall   percent threshold value long,almost participant agree appropriate meeting update forward guidance part unemployment rate see likely fall percent threshold value long,0
216,2014-03-19,participants preferred replacing numerical thresholds qualitative description factors would influence committee decision begin raising federal funds rate,participant prefer replace numerical threshold qualitative description factor would influence committee decision begin raise federal fund rate,0
