,Date,Original,Corpus,Class
130,2014-04-30,real gdp growth slowed markedly china largely reflecting lower investment growth exports,real gdp growth slow markedly china largely reflect low investment growth export,0
131,2014-04-30,weaker exports also restrained economic activity emerging asian economies,weaker export also restrain economic activity emerge asian economy,0
132,2014-04-30,mexico indicators activity suggested improvement lackluster fourth quarter,mexico indicator activity suggest improvement lackluster fourth quarter,0
133,2014-04-30,contrast economic growth remained near solid fourth quarter pace advanced foreign economies afes,contrast economic growth remain near solid fourth quarter pace advanced foreign economy afes,0
134,2014-04-30,euro area united kingdom canada average industrial production first two months year moderately fourth quarter japan industrial production rose robustly consumer demand boosted anticipation april increase consumption tax,euro area united kingdom canada average industrial production first two month year moderately fourth quarter japan industrial production rise robustly consumer demand boost anticipation april increase consumption tax,0
135,2014-04-30,inflation developments mixed,inflation development mixed,0
136,2014-04-30,inflation rebounded canada remained low euro area,inflation rebound canada remain low euro area,0
137,2014-04-30,china india inflation fell first quarter largely lower food prices,china india inflation fell first quarter largely low food price,0
138,2014-04-30,monetary policy remained highly accommodative intermeeting period afes also many emes although monetary policy brazil tightened contain inflation pressures,monetary policy remain highly accommodative intermeeting period afes also many emes although monetary policy brazil tighten contain inflation pressure,0
139,2014-04-30,staff review financial situation despite volatility certain asset prices financial conditions not change appreciably net intermeeting period,staff review financial situation despite volatility certain asset price financial condition not change appreciably net intermeeting period,0
140,2014-04-30,asset prices moved response economic data releases were balance little stronger expected federal reserve communications,asset price move response economic data release be balance little strong expect federal reserve communication,0
141,2014-04-30,anticipated path federal funds rate moved somewhat intermediate dated treasury yields corporate bond spreads narrowed increased slightly,anticipate path federal fund rate move somewhat intermediate date treasury yield corporate bond spread narrow increase slightly,0
142,2014-04-30,foreign exchange value dollar little changed,foreign exchange value dollar little change,0
143,2014-04-30,federal reserve communications garnered significant attention market participants period appeared modest net effect expectations monetary policy,federal reserve communication garner significant attention market participant period appear modest net effect expectation monetary policy,0
144,2014-04-30,communications following conclusion march fomc meeting interpreted somewhat less accommodative expected,communication follow conclusion march fomc meeting interpret somewhat less accommodative expect,0
145,2014-04-30,however subsequent communications including release minutes march fomc meeting appeared mostly reverse earlier change expectations,however subsequent communication include release minute march fomc meeting appear mostly reverse earlier change expectation,0
146,2014-04-30,yields short medium term nominal treasury securities rose balance intermeeting period,yield short medium term nominal treasury security rise balance intermeeting period,0
147,2014-04-30,contrast yields long end curve declined continuing downward trend evident much year,contrast yield long end curve decline continue downward trend evident much year,0
148,2014-04-30,market participants cited number factors contributing drop long term yields far year including portfolio reallocation large institutional investors trading strategies pursued investors safe flows,market participant cite number factor contribute drop long term yield far year include portfolio reallocation large institutional investor trading strategy pursue investor safe flow,0
149,2014-04-30,market participants reportedly also revised estimate average real federal funds rate longer term reflecting part changes assessments long run economic conditions,market participant reportedly also revise estimate average real federal fund rate longer term reflect part change assessment long run economic condition,0
150,2014-04-30,measures longer horizon inflation compensation based treasury inflation protected securities little changed,measure longer horizon inflation compensation base treasury inflation protect security little change,0
151,2014-04-30,conditions short term funding markets remained fairly stable intermeeting period,condition short term funding market remain fairly stable intermeeting period,0
152,2014-04-30,take federal reserve fixed rate rrp exercise continued sensitive spread market rates rate offered exercise higher take occurring days market rate repurchase agreements close rrp rate,take federal reserve fix rate rrp exercise continued sensitive spread market rate rate offer exercise high take occur day market rate repurchase agreement close rrp rate,0
153,2014-04-30,case since rrp exercise began money market funds increased usage quarter end take reached record level  billion end march,case since rrp exercise begin money market fund increase usage quarter end take reach record level billion end march,0
154,2014-04-30,part increase rrp usage end march relative end december likely reflected higher counterparty allotment limits raised  billion  billion first quarter,part increase rrp usage end march relative end december likely reflect high counterparty allotment limit raise billion billion first quarter,0
155,2014-04-30,allotment limit subsequently increased  billion per counterparty early april,allotment limit subsequently increase billion per counterparty early april,0
156,2014-04-30,seasonal paydown short term treasury debt following april tax date accompanied notable pickup participation rrp operations treasury repo rates generally remained close rrp rate  basis points,seasonal paydown short term treasury debt follow april tax date accompany notable pickup participation rrp operation treasury repo rate generally remain close rrp rate basis point,0
157,2014-04-30,increased bit net intermeeting period broader stock market indexes edged down,increase bit net intermeeting period broader stock market index edge down,0
158,2014-04-30,prices social media biotechnology stocks risen substantially faster broader market previous year fell sharply intermeeting period leaving gains shares line broader indexes past  months,price social medium biotechnology stock risen substantially faster broader market previous year fell sharply intermeeting period leave gain share line broader index past month,0
159,2014-04-30,initial public offerings reportedly put hold prices small capitalization stocks declined,initial public offering reportedly put hold price small capitalization stock decline,0
160,2014-04-30,contrast stocks generally stable dividends utility telecommunications companies advanced,contrast stock generally stable dividend utility telecommunication company advanced,0
161,2014-04-30,first quarter earnings reports large banking organizations mixed stock prices firms generally underperformed broad equity indexes,first quarter earnings report large banking organization mixed stock price firm generally underperformed broad equity index,0
162,2014-04-30,credit flows nonfinancial corporations remained robust balance notwithstanding subdued bond issuance april attributed typical constraints issuance period many firms reporting earnings,credit flow nonfinancial corporation remain robust balance notwithstanding subdue bond issuance april attribute typical constraint issuance period many firm reporting earnings,0
163,2014-04-30,growth commercial industrial loans banks balance sheets remained robust consistent increase loan demand large middle market firms reported april senior loan officer opinion survey bank lending practices sloos,growth commercial industrial loan bank balance sheet remain robust consistent increase loan demand large middle market firm report april senior loan officer opinion survey bank lending practice sloos,0
164,2014-04-30,institutional issuance leveraged loans continued brisk pace amid reports ongoing gradual easing credit terms deal structures,institutional issuance leveraged loan continued brisk pace amid report ongoing gradual ease credit term deal structure,0
165,2014-04-30,financing conditions commercial real estate cre sector improved further,financing condition commercial real estate cre sector improve far,0
166,2014-04-30,first quarter commercial mortgage loans held banks books continued grow solidly,first quarter commercial mortgage loan held bank book continued grow solidly,0
167,2014-04-30,according april sloos banks eased standards cre loans first quarter also reported increase loan demand especially construction land development loans,accord april sloos bank ease standard cre loan first quarter also report increase loan demand especially construction land development loan,0
168,2014-04-30,contrast issuance commercial mortgage backed securities  bit slower last year pace,contrast issuance commercial mortgage back security bit slow last year pace,0
169,2014-04-30,mortgage credit conditions generally remained tight intermeeting period though signs easing continued emerge amid gains house prices,mortgage credit condition generally remain tight intermeeting period though sign ease continued emerge amid gain house price,0
170,2014-04-30,particular april sloos indicated net easing banks credit standards home purchase loans prime customers first quarter,particular april sloos indicate net ease bank credit standard home purchase loan prime customer first quarter,0
171,2014-04-30,mortgage interest rates spreads treasury yields little changed intermeeting period applications refinancing purchase mortgages remained tepid,mortgage interest rate spread treasury yield little change intermeeting period application refinance purchase mortgage remain tepid,0
172,2014-04-30,conditions consumer credit markets continued mixed,condition consumer credit market continued mixed,0
173,2014-04-30,student auto loans expanded robust pace credit card debt outstanding stayed flat recent months,student auto loan expand robust pace credit card debt outstanding stayed flat recent month,0
174,2014-04-30,financing conditions consumer asset backed securities market remained favorable issuance continued solid,financing condition consumer asset back security market remain favorable issuance continued solid,0
175,2014-04-30,foreign equity indexes rose period despite global selloff technology related stocks  year sovereign bond yields canada germany united kingdom nearly unchanged net,foreign equity index rise period despite global selloff technology related stock year sovereign bond yield canada germany united kingdom nearly unchanged net,0
176,2014-04-30,yield spreads peripheral euro area debt german bonds similar maturity continued narrow,yield spread peripheral euro area debt german bond similar maturity continued narrow,0
177,2014-04-30,broad nominal exchange rate index dollar unchanged dollar appreciated euro yen renminbi depreciated currencies,broad nominal exchange rate index dollar unchanged dollar appreciate euro yen renminbi depreciate currency,0
178,2014-04-30,investor sentiment toward emes continued improve period despite incoming data somewhat weaker expected,investor sentiment toward emes continued improve period despite incoming data somewhat weaker expect,0
179,2014-04-30,increasing tensions ukraine russia well lowering russia sovereign debt rating standard  poor contributed rise russia  year sovereign bond yield sharp decline main equity index,increase tension ukraine russia well lower russia sovereign debt rating standard poor contribute rise russia year sovereign bond yield sharp decline main equity index,0
180,2014-04-30,outside region however building tensions left little imprint global financial markets,outside region however building tension left little imprint global financial market,0
181,2014-04-30,staff periodic report potential risks financial stability concluded vulnerability financial system adverse shocks remained moderate levels overall,staff periodic report potential risk financial stability conclude vulnerability financial system adverse shock remain moderate level overall,0
182,2014-04-30,relatively strong capital profiles large domestic banking firms low levels aggregate leverage nonfinancial sector moderate use short term wholesale funding across financial sector seen primary factors supporting overall financial stability,relatively strong capital profile large domestic banking firm low level aggregate leverage nonfinancial sector moderate use short term wholesale funding across financial sector see primary factor support overall financial stability,0
183,2014-04-30,however staff report also highlighted valuation pressures segments equity market continued strong demand corporate debt instruments associated pressures underwriting standards liquidity risks associated fixed income mutual funds,however staff report also highlight valuation pressure segment equity market continued strong demand corporate debt instrument associate pressure underwriting standard liquidity risk associate fix income mutual fund,0
184,2014-04-30,staff economic outlook economic forecast prepared staff april fomc meeting real gdp growth first half year somewhat slower projection march meeting,staff economic outlook economic forecast prepared staff april fomc meeting real gdp growth first half year somewhat slow projection march meeting,0
185,2014-04-30,available readings net exports and lesser extent residential investment pointed less spending growth first quarter staff previously expected,available reading net export and lesser extent residential investment point less spending growth first quarter staff previously expect,0
186,2014-04-30,however staff assessment unanticipated weakness economic activity first quarter would largely transitory implied little revision projection second quarter output growth,however staff assessment unanticipated weakness economic activity first quarter would largely transitory imply little revision projection second quarter output growth,0
187,2014-04-30,addition medium term forecast real gdp growth essentially unrevised,addition medium term forecast real gdp growth essentially unrevised,0
188,2014-04-30,staff continued project real gdp would expand faster pace next years last year would rise quickly growth rate potential output,staff continued project real gdp would expand faster pace next year last year would rise quickly growth rate potential output,0
189,2014-04-30,faster pace real gdp growth expected supported easing restraint changes fiscal policy increases consumer business confidence improvements credit availability financial conditions pickup rate foreign economic growth,faster pace real gdp growth expect support ease restraint change fiscal policy increase consumer business confidence improvement credit availability financial condition pickup rate foreign economic growth,0
190,2014-04-30,expansion economic activity anticipated slowly reduce resource slack projection period unemployment rate expected decline gradually staff estimate longer run natural rate,expansion economic activity anticipate slowly reduce resource slack projection period unemployment rate expect decline gradually staff estimate longer run natural rate,0
191,2014-04-30,staff forecast inflation basically unchanged projection prepared previous fomc meeting,staff forecast inflation basically unchanged projection prepared previous fomc meeting,0
192,2014-04-30,staff continued forecast inflation would remain committee longer run objective  percent next years,staff continued forecast inflation would remain committee longer run objective percent next year,0
193,2014-04-30,longer run inflation expectations assumed remain stable changes commodity import prices expected subdued slack labor product markets anticipated diminish slowly inflation projected rise gradually toward committee objective,longer run inflation expectation assume remain stable change commodity import price expect subdue slack labor product market anticipate diminish slowly inflation project rise gradually toward committee objective,0
194,2014-04-30,staff viewed extent uncertainty around april projections real gdp growth inflation unemployment rate roughly line average past  years,staff view extent uncertainty around april projection real gdp growth inflation unemployment rate roughly line average past year,0
195,2014-04-30,nonetheless risks forecast real gdp growth viewed tilted little downside especially economy not well positioned withstand adverse shocks target federal funds rate effective lower bound,nonetheless risk forecast real gdp growth view tilt little downside especially economy not well position withstand adverse shock target federal fund rate effective low bound,0
196,2014-04-30,time staff viewed risks around outlook unemployment rate inflation roughly balanced,time staff view risk around outlook unemployment rate inflation roughly balance,0
197,2014-04-30,participants views current conditions economic outlook discussion economic situation outlook meeting participants generally indicated assessment economic outlook not changed materially since march meeting,participant view current condition economic outlook discussion economic situation outlook meeting participant generally indicate assessment economic outlook not change materially since march meeting,0
198,2014-04-30,severe winter weather contributed sharp slowing activity first quarter recent indicators pointed rebound suggested economy returned trajectory moderate growth,severe winter weather contribute sharp slow activity first quarter recent indicator point rebound suggest economy return trajectory moderate growth,0
199,2014-04-30,however participants remarked early confirm bounceback economic activity would put economy path sustained trend economic growth,however participant remark early confirm bounceback economic activity would put economy path sustain trend economic growth,0
200,2014-04-30,general participants continued view risks outlook economy labor market nearly balanced,general participant continued view risk outlook economy labor market nearly balance,0
201,2014-04-30,however number participants pointed possible sources downside risk growth including persistent slowdown housing sector potential international developments slowing growth china increase geopolitical tensions regarding russia ukraine,however number participant point possible source downside risk growth include persistent slowdown housing sector potential international development slow growth china increase geopolitical tension regard russia ukraine,0
202,2014-04-30,participants noted business contacts many parts country generally optimistic economic prospects reports increased sales automobiles higher production aerospace industry increased usage industrial power addition couple firms global presence reported notable increase demand customers europe,participant note business contact many part country generally optimistic economic prospect report increase sale automobile high production aerospace industry increase usage industrial power addition couple firm global presence report notable increase demand customer europe,0
203,2014-04-30,contacts several districts pointed plans increasing capital expenditures stronger demand commercial industrial loans,contact several district point plan increase capital expenditure strong demand commercial industrial loan,0
204,2014-04-30,agricultural sector planting season way concerns effects drought production areas,agricultural sector plant season way concern effect drought production area,0
205,2014-04-30,participants commented continuing weakness housing activity,participant comment continue weakness housing activity,0
206,2014-04-30,saw range factors affecting housing market including higher home prices construction bottlenecks stemming scarcity labor harsh winter weather input cost pressures shortage supply available lots,saw range factor affect housing market include high home price construction bottleneck stem scarcity labor harsh winter weather input cost pressure shortage supply available lot,0
207,2014-04-30,views varied regarding outlook multifamily sector large increase multifamily units coming market potentially putting downward pressure prices rents demand type housing expected rise population ages,view varied regard outlook multifamily sector large increase multifamily unit come market potentially put downward pressure price rent demand type housing expect rise population age,0
208,2014-04-30,couple participants noted mortgage credit availability remained constrained lending standards tight compared historical norms especially purchase mortgages,couple participant note mortgage credit availability remain constrain lending standard tight compare historical norm especially purchase mortgage,0
209,2014-04-30,however reports districts indicated real estate housing related business activity strengthened recently consistent solid gains consumer spending registered march,however report district indicate real estate housing related business activity strengthen recently consistent solid gain consumer spending register march,0
210,2014-04-30,conditions labor market continued improve intermeeting period participants generally expected gradual improvement,condition labor market continued improve intermeeting period participant generally expect gradual improvement,0
211,2014-04-30,participants discussed range research analysis bearing amount available slack remaining labor market,participant discuss range research analysis bearing amount available slack remain labor market,0
212,2014-04-30,number argued several indicators labor underutilization including low labor force participation rate still elevated rates longer duration unemployment workers employed part time economic reasons suggested slack labor market captured unemployment rate alone,number argue several indicator labor underutilization include low labor force participation rate still elevate rate longer duration unemployment worker employ part time economic reason suggest slack labor market capture unemployment rate alone,0
213,2014-04-30,low nominal wage inflation also viewed consistent slack labor markets,low nominal wage inflation also view consistent slack labor market,0
214,2014-04-30,however participants reported labor markets tight districts contacts indicated sectors occupations experiencing shortages workers,however participant report labor market tight district contact indicate sector occupation experience shortage worker,0
215,2014-04-30,another participant observed labor underutilization measured index takes employment transition rates account consistent past periods official unemployment rate reached current level declined much relative official unemployment rate previous economic recoveries,another participant observe labor underutilization measure index take employment transition rate account consistent past period official unemployment rate reach current level decline much relative official unemployment rate previous economic recovery,0
216,2014-04-30,discussing effect labor market conditions inflation number participants expressed skepticism recent studies suggesting long term unemployment provides less downward pressure wage price inflation short term unemployment does,discuss effect labor market condition inflation number participant express skepticism recent study suggest long term unemployment provide less downward pressure wage price inflation short term unemployment do,0
217,2014-04-30,couple participants cited research findings short long term unemployment rates exert pressure wages effects long term unemployment increasing level short term unemployment declines,couple participant cite research finding short long term unemployment rate exert pressure wage effect long term unemployment increase level short term unemployment decline,0
218,2014-04-30,moreover participants pointed downward nominal wage rigidity recession wage increases likely remain relatively modest time recovery even labor market strengthens,moreover participant point downward nominal wage rigidity recession wage increase likely remain relatively modest time recovery even labor market strengthens,0
219,2014-04-30,also noted inflation expected remain well committee  percent objective unemployment rate still participants estimates longer run normal level committee not present face tradeoff employment inflation objectives expansion aggregate demand would result progress relative objectives,also note inflation expect remain well committee percent objective unemployment rate still participant estimate longer run normal level committee not present face tradeoff employment inflation objective expansion aggregate demand would result progress relative objective,0
220,2014-04-30,inflation continued run committee  percent longer run objective intermeeting period,inflation continued run committee percent longer run objective intermeeting period,0
