,Date,Original,Corpus,Class
289,2014-03-19,mr kocherlakota strongly endorsed sixth paragraph statement providing information committee intentions federal funds rate employment inflation near mandate consistent levels help stimulate economic activity reducing uncertainty,mr kocherlakota strongly endorse sixth paragraph statement provide information committee intention federal fund rate employment inflation near mandate consistent level help stimulate economic activity reduce uncertainty,0
290,2014-03-19,agreed next meeting committee would held tuesday wednesday april   ,agree next meeting committee would held tuesday wednesday april,0
291,2014-03-19,meeting adjourned march  ,meeting adjourn march,0
292,2014-03-19,notation vote notation vote completed february   committee unanimously approved minutes committee meeting held january   ,notation vote notation vote complete february committee unanimously approve minute committee meeting held january,0
293,2014-03-19,videoconference meeting march  committee met videoconference march   discuss issues associated forward guidance federal funds rate,videoconference meeting march committee met videoconference march discus issue associate forward guidance federal fund rate,0
294,2014-03-19,committee discussed possible changes forward guidance could provide additional information factors likely enter decisions regarding federal funds rate target unemployment rate approached   percent threshold threshold crossed,committee discuss possible change forward guidance could provide additional information factor likely enter decision regard federal fund rate target unemployment rate approach percent threshold threshold cross,0
295,2014-03-19,agenda not contemplate policy decisions none taken,agenda not contemplate policy decision none take,0
296,2014-03-19,many participants noted market expectations future course federal funds rate currently reasonably well aligned policymakers sizable change forward guidance could disturb alignment,many participant note market expectation future course federal fund rate currently reasonably well align policymakers sizable change forward guidance could disturb alignment,0
297,2014-03-19,nonetheless participants generally saw committee upcoming meeting opportune occasion reformulation guidance language one participants suggested reformulation could accompanied statement new language intended consistent current market expectations,nonetheless participant generally saw committee upcoming meeting opportune occasion reformulation guidance language one participant suggest reformulation could accompany statement new language intend consistent current market expectation,0
298,2014-03-19,participants stressed committee several vehicles including chair postmeeting press conference could clarify future policy intentions,participant stress committee several vehicle include chair postmeeting press conference could clarify future policy intention,0
299,2014-03-19,participants agreed existing forward guidance reference   percent threshold unemployment rate becoming outdated unemployment rate continued expected gradual decline,participant agree exist forward guidance reference percent threshold unemployment rate become outdated unemployment rate continued expect gradual decline,0
300,2014-03-19,participants felt quantitative thresholds useful communicating policy intentions employment far mandate consistent levels but economy moved appreciably closer maximum employment forward guidance emphasize committee focusing broader set economic indicators,participant felt quantitative threshold useful communicate policy intention employment far mandate consistent level but economy move appreciably closer maximum employment forward guidance emphasize committee focus broader set economic indicator,0
301,2014-03-19,thus participants felt quantitative thresholds triggers floors not part future statement language number participants noting uncertainty associated defining measuring unemployment rate level employment would consistent committee maximum employment objective similar concepts,thus participant felt quantitative threshold trigger floor not part future statement language number participant note uncertainty associate define measure unemployment rate level employment would consistent committee maximum employment objective similar concept,0
302,2014-03-19,participants generally favored qualitative language describing economic factors would influence committee decision regarding first increase federal funds rate target,participant generally favor qualitative language describe economic factor would influence committee decision regard first increase federal fund rate target,0
303,2014-03-19,participants put forward number suggestions qualitative language,participant put forward number suggestion qualitative language,0
304,2014-03-19,one participant favored linking length time federal funds rate would remain lower bound period complete recovery labor market projected occur another advocated qualitative forward guidance expressed terms committee projections real output growth arguing approach would avoid uncertainties associated estimates potential output maximum employment,one participant favor link length time federal fund rate would remain low bound period complete recovery labor market project occur another advocate qualitative forward guidance express term committee projection real output growth argue approach would avoid uncertainty associate estimate potential output maximum employment,0
305,2014-03-19,yet another participant argued would desirable statement describe committee reasons keeping federal funds rate lower bound standard policy rules prescribing rate increased noted one possible reason effective lower bound federal funds rate limits committee scope provide accommodation response adverse shocks,yet another participant argue would desirable statement describe committee reason keep federal fund rate low bound standard policy rule prescribe rate increase note one possible reason effective low bound federal fund rate limit committee scope provide accommodation response adverse shock,0
306,2014-03-19,contrast participants expressed preference quantitative guidance,contrast participant express preference quantitative guidance,0
307,2014-03-19,participants saw merit stating explicitly committee would provide accommodation extent necessary prevent inflation running persistently  percent longer run goal,participant saw merit state explicitly committee would provide accommodation extent necessary prevent inflation run persistently percent longer run goal,0
308,2014-03-19,one participants argued forward guidance would strengthen credibility committee inflation objective well encourage employment outcomes consistent committee objective maximum employment,one participant argue forward guidance would strengthen credibility committee inflation objective well encourage employment outcome consistent committee objective maximum employment,0
309,2014-03-19,another participant suggested committee state would adjust policy keep projected inflation near  percent medium term would balance deviations objectives near term,another participant suggest committee state would adjust policy keep project inflation near percent medium term would balance deviation objective near term,0
310,2014-03-19,still another participant expressed preference stating explicit quantitative criteria labor market variable variables,still another participant express preference state explicit quantitative criterion labor market variable variable,0
311,2014-03-19,participants favored providing information likely behavior federal funds rate first increase,participant favor provide information likely behavior federal fund rate first increase,0
312,2014-03-19,participants however viewed period policy firming likely far enough future committee not need provide information stage,participant however view period policy firm likely far enough future committee not need provide information stage,0
313,2014-03-19,committee participants also considered whether revised forward guidance include prominent mention financial developments potential risks financial stability,committee participant also consider whether revise forward guidance include prominent mention financial development potential risk financial stability,0
314,2014-03-19,participants felt committee monitoring financial conditions risks financial stability already well understood markets that reference financial developments might usefully included statement lengthy addition not seem necessary,participant felt committee monitoring financial condition risk financial stability already well understood market that reference financial development might usefully include statement lengthy addition not seem necessary,0
315,2014-03-19,one participant favored including reference statement financial conditions rather financial stability emphasizing that factors monetary policy induce change financial conditions committee may need take change financial conditions account making monetary policy decisions,one participant favor include reference statement financial condition rather financial stability emphasize that factor monetary policy induce change financial condition committee may need take change financial condition account make monetary policy decision,0
316,2014-03-19,william english secretary,william english secretary,0
317,2014-03-19,board governors federal reserve system,board governor federal reserve system,0
