,Date,Original,Corpus,Class
139,2015-01-28,committee voted amend authorization foreign currency operations procedural instructions respect foreign currency operations reaffirm foreign currency directive form shown below,committee vote amend authorization foreign currency operation procedural instruction respect foreign currency operation reaffirm foreign currency directive form show below,0
140,2015-01-28,approval documents included approval system warehousing agreements treasury,approval document include approval system warehouse agreement treasury,0
141,2015-01-28,change made authorization foreign currency operations increase duration limit foreign currency portfolio  months  months,change make authorization foreign currency operation increase duration limit foreign currency portfolio month month,0
142,2015-01-28,change made provide greater flexibility management foreign currency portfolio environment interest rates low many major economies,change make provide great flexibility management foreign currency portfolio environment interest rate low many major economy,0
143,2015-01-28,mr lacker dissented votes authorization foreign currency operations foreign currency directive indicate opposition foreign currency intervention federal reserve,mr lacker dissent vote authorization foreign currency operation foreign currency directive indicate opposition foreign currency intervention federal reserve,0
144,2015-01-28,view intervention would ineffective not also signal shift domestic monetary policy signal shift could potentially compromise federal reserve monetary policy independence,view intervention would ineffective not also signal shift domestic monetary policy signal shift could potentially compromise federal reserve monetary policy independence,0
145,2015-01-28,authorization foreign currency operations as amended effective january  ,authorization foreign currency operation a amend effective january,0
146,2015-01-28,federal open market committee the committee authorizes directs federal reserve bank selected committee execute open market transactions the selected bank system open market account extent necessary carry committee foreign currency directive express authorizations committee pursuant thereto conformity procedural instructions committee may issue time time,federal open market committee the committee authorizes directs federal reserve bank select committee execute open market transaction the select bank system open market account extent necessary carry committee foreign currency directive express authorization committee pursuant thereto conformity procedural instruction committee may issue time time,0
147,2015-01-28,purchase sell following foreign currencies form cable transfers spot forward transactions open market home abroad including transactionss treasury us exchange stabilization fund established section  gold reserve act  foreign monetary authorities bank international settlements international financial institutions,purchase sell follow foreign currency form cable transfer spot forward transaction open market home abroad include transactions treasury u exchange stabilization fund establish section gold reserve act foreign monetary authority bank international settlement international financial institution,0
148,2015-01-28,hold balances of outstanding forward contracts receive deliver foreign currencies listed paragraph above,hold balance of outstanding forward contract receive deliver foreign currency list paragraph above,0
149,2015-01-28,draw foreign currencies permit foreign banks draw dollars arrangements listed paragraph  below accordance procedural instructions respect foreign currency operations,draw foreign currency permit foreign bank draw dollar arrangement list paragraph below accordance procedural instruction respect foreign currency operation,0
150,2015-01-28,maintain overall open position foreign currencies not exceeding ,maintain overall open position foreign currency not exceed,0
151,2015-01-28, billion,billion,0
152,2015-01-28,purpose overall open position foreign currencies defined sum disregarding signs net positions individual currencies excluding changes dollar value due foreign exchange rate movements interest accruals,purpose overall open position foreign currency define sum disregard sign net position individual currency exclude change dollar value due foreign exchange rate movement interest accrual,0
153,2015-01-28,net position single foreign currency defined holdings balances currency plus outstanding contracts future receipt minus outstanding contracts future delivery currency ie sum elements due regard sign,net position single foreign currency define holding balance currency plus outstanding contract future receipt minus outstanding contract future delivery currency ie sum element due regard sign,0
154,2015-01-28,committee directs selected bank maintain system open market account subject requirements section ,committee directs select bank maintain system open market account subject requirement section,0
155,2015-01-28, regulation relations foreign banks bankers,regulation relation foreign bank banker,0
156,2015-01-28,standing dollar liquidity swap arrangements following foreign banks,stand dollar liquidity swap arrangement follow foreign bank,0
157,2015-01-28,standing foreign currency liquidity swap arrangements following foreign banks,stand foreign currency liquidity swap arrangement follow foreign bank,0
158,2015-01-28,dollar foreign currency liquidity swap arrangements no pre set size limits,dollar foreign currency liquidity swap arrangement no pre set size limit,0
159,2015-01-28,new swap arrangements shall referred review approval committee,new swap arrangement shall refer review approval committee,0
160,2015-01-28,swap arrangements subject annual review approval committee,swap arrangement subject annual review approval committee,0
161,2015-01-28,transactions foreign currencies undertaken paragraph ,transaction foreign currency undertaken paragraph,0
162,2015-01-28,shall unless otherwise expressly authorized committee prevailing market rates,shall unless otherwise expressly authorize committee prevail market rate,0
163,2015-01-28,purpose providing investment return system holdings foreign currencies purpose adjusting interest rates paid received connection swap drawings transactions foreign central banks may undertaken non market exchange rates,purpose provide investment return system holding foreign currency purpose adjust interest rate paid receive connection swap drawing transaction foreign central bank may undertaken non market exchange rate,0
164,2015-01-28,shall normal practice arrange foreign central banks coordination foreign currency transactions,shall normal practice arrange foreign central bank coordination foreign currency transaction,0
165,2015-01-28,making operating arrangements foreign central banks system holdings foreign currencies selected bank shall not commit maintain specific balance unless authorized committee,make operating arrangement foreign central bank system holding foreign currency select bank shall not commit maintain specific balance unless authorize committee,0
166,2015-01-28,agreements understandings concerning administration accounts maintained selected bank foreign banks designated board governors section ,agreement understanding concern administration account maintain select bank foreign bank designate board governor section,0
167,2015-01-28, regulation shall referred review approval committee,regulation shall refer review approval committee,0
168,2015-01-28,foreign currency holdings shall invested ensure adequate liquidity maintained meet anticipated needs currency portfolio shall generally average duration no  months calculated macaulay duration,foreign currency holding shall invest ensure adequate liquidity maintain meet anticipate need currency portfolio shall generally average duration no month calculate macaulay duration,0
169,2015-01-28,investments may include buying selling outright obligations of fully guaranteed principal interest by foreign government agency thereof buying securities agreements repurchase securities selling securities agreements resale securities holding various time deposit accounts foreign institutions,investment may include buying sell outright obligation of fully guaranteed principal interest by foreign government agency thereof buying security agreement repurchase security sell security agreement resale security hold various time deposit account foreign institution,0
170,2015-01-28,addition appropriate connection arrangements provide investment facilities foreign currency holdings us government securities may purchased foreign central banks agreements repurchase securities within  calendar days,addition appropriate connection arrangement provide investment facility foreign currency holding u government security may purchase foreign central bank agreement repurchase security within calendar day,0
171,2015-01-28,operations undertaken pursuant preceding paragraphs shall reported promptly foreign currency subcommittee the subcommittee committee,operation undertaken pursuant precede paragraph shall report promptly foreign currency subcommittee the subcommittee committee,0
172,2015-01-28,subcommittee consists chairman vice chairman committee vice chairman board governors member board chairman may designate or absence members board serving subcommittee board members designated chairman alternates absence vice chairman committee vice chairman alternate,subcommittee consists chairman vice chairman committee vice chairman board governor member board chairman may designate or absence member board serve subcommittee board member designate chairman alternate absence vice chairman committee vice chairman alternate,0
173,2015-01-28,meetings subcommittee shall called request member request manager system open market account manager purposes reviewing recent contemplated operations consulting manager matters relating manager responsibilities,meeting subcommittee shall call request member request manager system open market account manager purpose review recent contemplate operation consult manager matter relate manager responsibility,0
174,2015-01-28,request member subcommittee questions arising reviews consultations shall referred determination committee,request member subcommittee question arise review consultation shall refer determination committee,0
175,2015-01-28,chairman authorized,chairman authorize,0
176,2015-01-28,approval committee enter needed agreement understanding secretary treasury division responsibility foreign currency operations system treasury,approval committee enter need agreement understand secretary treasury division responsibility foreign currency operation system treasury,0
177,2015-01-28,keep secretary treasury fully advised concerning system foreign currency operations consult secretary policy matters relating foreign currency operations,keep secretary treasury fully advise concern system foreign currency operation consult secretary policy matter relate foreign currency operation,0
178,2015-01-28,time time transmit appropriate reports information national advisory council international monetary financial policies,time time transmit appropriate report information national advisory council international monetary financial policy,0
179,2015-01-28,federal reserve banks shall participate foreign currency operations system account accordance paragraph board governors statement procedure respect foreign relationships federal reserve banks dated january  ,federal reserve bank shall participate foreign currency operation system account accordance paragraph board governor statement procedure respect foreign relationship federal reserve bank date january,0
180,2015-01-28,committee authorizes selected bank undertake transactions type described paragraphs    foreign exchange investment transactions may otherwise authorized undertake time time purpose testing operational readiness,committee authorizes select bank undertake transaction type described paragraph foreign exchange investment transaction may otherwise authorize undertake time time purpose test operational readiness,0
181,2015-01-28,aggregate amount transactions shall not exceed ,aggregate amount transaction shall not exceed,0
182,2015-01-28, billion per calendar year,billion per calendar year,0
183,2015-01-28,transactions shall conducted prior notice committee,transaction shall conduct prior notice committee,0
184,2015-01-28,foreign currency directive as reaffirmed effective january  ,foreign currency directive a reaffirm effective january,0
185,2015-01-28,system operations foreign currencies shall generally directed countering disorderly market conditions provided market exchange ratess dollar reflect actions behavior consistent imf article iv section ,system operation foreign currency shall generally direct counter disorderly market condition provide market exchange rates dollar reflect action behavior consistent imf article iv section,0
186,2015-01-28,achieve end system shall,achieve end system shall,0
187,2015-01-28,undertake spot forward purchases sales foreign exchange,undertake spot forward purchase sale foreign exchange,0
188,2015-01-28,maintain reciprocal currency arrangements foreign central banks accordance authorization foreign currency operations,maintain reciprocal currency arrangement foreign central bank accordance authorization foreign currency operation,0
189,2015-01-28,maintain standing dollar liquidity swap arrangements foreign banks accordance authorization foreign currency operations,maintain stand dollar liquidity swap arrangement foreign bank accordance authorization foreign currency operation,0
190,2015-01-28,maintain standing foreign currency liquidity swap arrangements foreign banks accordance authorization foreign currency operations,maintain stand foreign currency liquidity swap arrangement foreign bank accordance authorization foreign currency operation,0
191,2015-01-28,cooperate respects central banks countries international monetary institutions,cooperate respect central bank country international monetary institution,0
192,2015-01-28,transactions may also undertaken,transaction may also undertaken,0
193,2015-01-28,adjust system balances light probable future needs currencies,adjust system balance light probable future need currency,0
194,2015-01-28,provide means meeting system treasury commitments particular currencies facilitate operations exchange stabilization fund,provide mean meeting system treasury commitment particular currency facilitate operation exchange stabilization fund,0
195,2015-01-28,purposes may expressly authorized committee,purpose may expressly authorize committee,0
196,2015-01-28,system foreign currency operations shall conducted,system foreign currency operation shall conduct,0
197,2015-01-28,close continuous consultation cooperation united states treasury,close continuous consultation cooperation united state treasury,0
198,2015-01-28,cooperation appropriate foreign monetary authorities,cooperation appropriate foreign monetary authority,0
199,2015-01-28,manner consistent obligations united states international monetary fund regarding exchange arrangements imf article iv,manner consistent obligation united state international monetary fund regard exchange arrangement imf article iv,0
200,2015-01-28,procedural instructions respect foreign currency operations as amended effective january  ,procedural instruction respect foreign currency operation a amend effective january,0
201,2015-01-28,conducting operations pursuant authorization direction federal open market committee the committee set forth authorization foreign currency operations foreign currency directive federal reserve bank selected committee execute open market transactions the selected bank manager system open market account manager shall guided following procedural understandings respect consultations clearances committee foreign currency subcommittee the subcommittee chairman committee unless otherwise directed committee,conduct operation pursuant authorization direction federal open market committee the committee set forth authorization foreign currency operation foreign currency directive federal reserve bank select committee execute open market transaction the select bank manager system open market account manager shall guide follow procedural understanding respect consultation clearance committee foreign currency subcommittee the subcommittee chairman committee unless otherwise direct committee,0
202,2015-01-28,operations undertaken pursuant clearances shall reported promptly committee,operation undertaken pursuant clearance shall report promptly committee,0
203,2015-01-28,reciprocal currency arrangements authorized paragraphs ,reciprocal currency arrangement authorize paragraph,0
204,2015-01-28,authorization foreign currency operations,authorization foreign currency operation,0
205,2015-01-28,drawings must approved subcommittee or chairman chairman believes consultation subcommittee not feasible time available swap drawing proposed foreign bank not exceed larger  million ii  percent size swap arrangement,drawing must approve subcommittee or chairman chairman believe consultation subcommittee not feasible time available swap draw propose foreign bank not exceed large million ii percent size swap arrangement,0
206,2015-01-28,drawings must approved committee or subcommittee subcommittee believes consultation full committee not feasible time available chairman chairman believes consultation subcommittee not feasible time available swap drawing proposed foreign bank exceeds larger  million ii  percent size swap arrangement,drawing must approve committee or subcommittee subcommittee believe consultation full committee not feasible time available chairman chairman believe consultation subcommittee not feasible time available swap draw propose foreign bank exceeds large million ii percent size swap arrangement,0
207,2015-01-28,manager shall also consult subcommittee chairman proposed swap drawings system,manager shall also consult subcommittee chairman propose swap drawing system,0
208,2015-01-28,changes terms existing swap arrangements shall referred review approval chairman,change term exist swap arrangement shall refer review approval chairman,0
209,2015-01-28,chairman shall keep committee informed changes terms terms shall consistent principles discussed guidance provided committee,chairman shall keep committee inform change term term shall consistent principle discuss guidance provide committee,0
210,2015-01-28,dollar foreign currency liquidity swap arrangements authorized paragraphs ,dollar foreign currency liquidity swap arrangement authorize paragraph,0
211,2015-01-28,authorization foreign currency operations,authorization foreign currency operation,0
212,2015-01-28,drawings must approved chairman consultation subcommittee,drawing must approve chairman consultation subcommittee,0
213,2015-01-28,chairman subcommittee consult committee prior initial drawing dollar foreign currency liquidity swap lines possible circumstances prevailing authority approve subsequent drawings either dollar foreign currency liquidity swap lines may delegated manager chairman,chairman subcommittee consult committee prior initial draw dollar foreign currency liquidity swap line possible circumstance prevail authority approve subsequent drawing either dollar foreign currency liquidity swap line may delegate manager chairman,0
214,2015-01-28,changes terms existing swap arrangements shall referred review approval chairman,change term exist swap arrangement shall refer review approval chairman,0
215,2015-01-28,chairman shall keep committee informed changes terms terms shall consistent principles discussed guidance provided committee,chairman shall keep committee inform change term term shall consistent principle discuss guidance provide committee,0
216,2015-01-28,operation must approved by,operation must approve by,0
217,2015-01-28,subcommittee or chairman chairman believes consultation subcommittee not feasible time available it,subcommittee or chairman chairman believe consultation subcommittee not feasible time available it,0
218,2015-01-28,would result change system overall open position foreign currencies exceeding  million day  million since recent regular meeting committee,would result change system overall open position foreign currency exceed million day million since recent regular meeting committee,0
219,2015-01-28,ii,ii,0
220,2015-01-28,would result change day system net position single foreign currency exceeding  million  million operation associated repayment swap drawings,would result change day system net position single foreign currency exceed million million operation associate repayment swap drawing,0
221,2015-01-28,iii,iii,0
222,2015-01-28,might generate substantial volume trading particular currency system even though change system net position currency as defined paragraph ,might generate substantial volume trading particular currency system even though change system net position currency a define paragraph,0
223,2015-01-28,authorization foreign currency operations might less limits specified ,authorization foreign currency operation might less limit specify,0
224,2015-01-28,a,a,0
225,2015-01-28,ii,ii,0
226,2015-01-28,committee or subcommittee subcommittee believes consultation full committee not feasible time available chairman chairman believes consultation subcommittee not feasible time available would result change system overall open position foreign currencies exceeding ,committee or subcommittee subcommittee believe consultation full committee not feasible time available chairman chairman believe consultation subcommittee not feasible time available would result change system overall open position foreign currency exceed,0
227,2015-01-28, billion since recent regular meeting committee,billion since recent regular meeting committee,0
228,2015-01-28,committee authorizes selected bank undertake transactions type described paragraphs    authorization foreign currency operations foreign exchange investment transactions may otherwise authorized undertake time time purpose testing operational readiness,committee authorizes select bank undertake transaction type described paragraph authorization foreign currency operation foreign exchange investment transaction may otherwise authorize undertake time time purpose test operational readiness,0
229,2015-01-28,aggregate amount transactions shall not exceed ,aggregate amount transaction shall not exceed,0
230,2015-01-28, billion per calendar year,billion per calendar year,0
231,2015-01-28,transactions shall conducted prior notice committee,transaction shall conduct prior notice committee,0
232,2015-01-28,unanimous vote committee amended program security fomc information changes federal reserve banks classify access committee information,unanimous vote committee amend program security fomc information change federal reserve bank classify access committee information,0
233,2015-01-28,annual reconsideration statement longer run goals monetary policy strategy participants generally agreed minor update required meeting,annual reconsideration statement longer run goal monetary policy strategy participant generally agree minor update require meeting,0
234,2015-01-28,several participants observed statement helped increase public understanding committee goals policy framework,several participant observe statement help increase public understand committee goal policy framework,0
235,2015-01-28,noted however committee continue discuss possible enhancements statement coming year,note however committee continue discus possible enhancement statement come year,0
236,2015-01-28,following discussion committee voted reaffirm statement updated reference participants estimates longer run normal unemployment rate,follow discussion committee vote reaffirm statement update reference participant estimate longer run normal unemployment rate,0
237,2015-01-28,mr tarullo abstained not believe statement reflects sufficient consensus principles underlying committee policy actions significantly advance public understanding monetary policy strategy,mr tarullo abstain not believe statement reflect sufficient consensus principle underlie committee policy action significantly advance public understand monetary policy strategy,0
238,2015-01-28,statement longer run goals monetary policy strategy as amended effective january  ,statement longer run goal monetary policy strategy a amend effective january,0
239,2015-01-28,developments financial markets federal reserve balance sheet joint session committee board governors federal reserve system manager system open market account soma reported developments domestic foreign financial markets,development financial market federal reserve balance sheet joint session committee board governor federal reserve system manager system open market account soma report development domestic foreign financial market,0
240,2015-01-28,deputy manager followed review system open market operations conducted period since committee met december   ,deputy manager follow review system open market operation conduct period since committee met december,0
241,2015-01-28,deputy manager also discussed outcomes recent tests term overnight reverse repurchase agreements term rrps rrps respectively,deputy manager also discuss outcome recent test term overnight reverse repurchase agreement term rrps rrps respectively,0
242,2015-01-28,tests suggested combination term rrp rrp operations effective supporting money market rates leading year end,test suggest combination term rrp rrp operation effective support money market rate lead year end,0
