,Date,Original,Corpus,Class
0,2015-01-28,federal reserve central bank united states provides nation safe flexible stable monetary financial system,federal reserve central bank united state provide nation safe flexible stable monetary financial system,0
1,2015-01-28,federal open market committee,federal open market committee,0
2,2015-01-28,monetary policy principles practice,monetary policy principle practice,0
3,2015-01-28,policy implementation,policy implementation,0
4,2015-01-28,reports,report,0
5,2015-01-28,review monetary policy strategy tools communications,review monetary policy strategy tool communication,0
6,2015-01-28,institution supervision,institution supervision,0
7,2015-01-28,reports,report,0
8,2015-01-28,reporting forms,reporting form,0
9,2015-01-28,supervision  regulation letters,supervision regulation letter,0
10,2015-01-28,banking applications  legal developments,banking application legal development,0
11,2015-01-28,regulatory resources,regulatory resource,0
12,2015-01-28,banking  data structure,banking data structure,0
13,2015-01-28,regulations  statutes,regulation statute,0
14,2015-01-28,payment policies,payment policy,0
15,2015-01-28,reserve bank payment services  data,reserve bank payment service data,0
16,2015-01-28,financial market utilities  infrastructures,financial market utility infrastructure,0
17,2015-01-28,research committees forums,research committee forum,0
18,2015-01-28,working papers notes,work paper note,0
19,2015-01-28,models tools,model tool,0
20,2015-01-28,bank assets liabilities,bank asset liability,0
21,2015-01-28,bank structure data,bank structure data,0
22,2015-01-28,business finance,business finance,0
23,2015-01-28,dealer financing terms,dealer financing term,0
24,2015-01-28,exchange rates international data,exchange rate international data,0
25,2015-01-28,financial accounts,financial account,0
26,2015-01-28,household finance,household finance,0
27,2015-01-28,industrial activity,industrial activity,0
28,2015-01-28,interest rates,interest rate,0
29,2015-01-28,micro data reference manual mdrm,micro data reference manual mdrm,0
30,2015-01-28,money stock reserve balances,money stock reserve balance,0
31,2015-01-28,regulations,regulation,0
32,2015-01-28,supervision  enforcement,supervision enforcement,0
33,2015-01-28,community development,community development,0
34,2015-01-28,research  analysis,research analysis,0
35,2015-01-28,consumer resources,consumer resource,0
36,2015-01-28,january   ,january,0
37,2015-01-28,meeting federal open market committee held offices board governors federal reserve system washington dc tuesday january   continued wednesday january   m,meeting federal open market committee held office board governor federal reserve system washington dc tuesday january continued wednesday january m,0
38,2015-01-28,present,present,0
39,2015-01-28,janet yellen chair william dudley vice chairman lael brainard charles evans stanley fischer jeffrey lacker dennis lockhart jerome powell daniel tarullo john williams,janet yellen chair william dudley vice chairman lael brainard charles evans stanley fischer jeffrey lacker dennis lockhart jerome powell daniel tarullo john williams,0
40,2015-01-28,james bullard esther george loretta mester eric rosengren alternate members federal open market committee,james bullard esther george loretta mester eric rosengren alternate member federal open market committee,0
41,2015-01-28,richard fisher narayana kocherlakota charles plosser presidents federal reserve banks dallas minneapolis philadelphia respectively,richard fisher narayana kocherlakota charles plosser president federal reserve bank dallas minneapolis philadelphia respectively,0
42,2015-01-28,thomas laubach secretary economist,thomas laubach secretary economist,0
43,2015-01-28,matthew luecke deputy secretary,matthew luecke deputy secretary,0
44,2015-01-28,michelle smith assistant secretary,michelle smith assistant secretary,0
45,2015-01-28,scott alvarez general counsel,scott alvarez general counsel,0
46,2015-01-28,thomas baxter deputy general counsel,thomas baxter deputy general counsel,0
47,2015-01-28,steven kamin economist,steven kamin economist,0
48,2015-01-28,david wilcox economist,david wilcox economist,0
49,2015-01-28,david altig thomas connors michael leahy jonathan mccarthy william nelson glenn rudebusch daniel sullivan william wascher associate economists,david altig thomas connors michael leahy jonathan mccarthy william nelson glenn rudebusch daniel sullivan william wascher associate economist,0
50,2015-01-28,simon potter manager system open market account,simon potter manager system open market account,0
51,2015-01-28,lorie logan deputy manager system open market account,lorie logan deputy manager system open market account,0
52,2015-01-28,robert dev,robert dev,0
53,2015-01-28,frierson secretary board office secretary board governors,frierson secretary board office secretary board governor,0
54,2015-01-28,michael gibson director division banking supervision regulation board governors,michael gibson director division banking supervision regulation board governor,0
55,2015-01-28,nellie liang director office financial stability policy research board governors,nellie liang director office financial stability policy research board governor,0
56,2015-01-28,james clouse deputy director division monetary affairs board governors,james clouse deputy director division monetary affair board governor,0
57,2015-01-28,william english senior special adviser board office board members board governors,william english senior special adviser board office board member board governor,0
58,2015-01-28,andrew figura david reifschneider stacey tevlin special advisers board office board members board governors,andrew figura david reifschneider stacey tevlin special adviser board office board member board governor,0
59,2015-01-28,trevor reeve special adviser chair office board members board governors,trevor reeve special adviser chair office board member board governor,0
60,2015-01-28,david lebow senior associate director division research statistics board governors,david lebow senior associate director division research statistic board governor,0
61,2015-01-28,michael kiley senior adviser division research statistics senior associate director office financial stability policy research board governors,michael kiley senior adviser division research statistic senior associate director office financial stability policy research board governor,0
62,2015-01-28,jeremy rudd senior adviser division research statistics board governors joyce zickler senior adviser division monetary affairs board governors,jeremy rudd senior adviser division research statistic board governor joyce zickler senior adviser division monetary affair board governor,0
63,2015-01-28,fabio natalucci gretchen weinbach associate directors division monetary affairs board governors,fabio natalucci gretchen weinbach associate director division monetary affair board governor,0
64,2015-01-28,joseph gruber deputy associate director division international finance board governors david lpez salido deputy associate director division monetary affairs board governors,joseph gruber deputy associate director division international finance board governor david lpez salido deputy associate director division monetary affair board governor,0
65,2015-01-28,jennifer gallagher special assistant board office board members board governors,jennifer gallagher special assistant board office board member board governor,0
66,2015-01-28,edward nelson assistant director division monetary affairs board governors shane sherlund assistant director division research statistics board governors,edward nelson assistant director division monetary affair board governor shane sherlund assistant director division research statistic board governor,0
67,2015-01-28,burcu duygan bump robert tetlow advisers division monetary affairs board governors eric engstrom adviser division research statistics board governors,burcu duygan bump robert tetlow adviser division monetary affair board governor eric engstrom adviser division research statistic board governor,0
68,2015-01-28,penelope beattie assistant secretary office secretary board governors,penelope beattie assistant secretary office secretary board governor,0
69,2015-01-28,dana burnett christopher gust section chiefs division monetary affairs board governors,dana burnett christopher gust section chief division monetary affair board governor,0
70,2015-01-28,katie ross manager office secretary board governors,katie ross manager office secretary board governor,0
71,2015-01-28,david small project manager division monetary affairs board governors,david small project manager division monetary affair board governor,0
72,2015-01-28,carlos arteta senior economist division international finance board governors kimberly bayard senior economist division research statistics board governors elmar mertens senior economist division monetary affairs board governors,carlos arteta senior economist division international finance board governor kimberly bayard senior economist division research statistic board governor elmar mertens senior economist division monetary affair board governor,0
73,2015-01-28,bernd schlusche emre yoldas economists division monetary affairs board governors,bernd schlusche emre yoldas economist division monetary affair board governor,0
74,2015-01-28,peter garavuso information management analyst division monetary affairs board governors,peter garavuso information management analyst division monetary affair board governor,0
75,2015-01-28,blake prichard first vice president federal reserve bank philadelphia,blake prichard first vice president federal reserve bank philadelphia,0
76,2015-01-28,jeff fuhrer alberto musalem executive vice presidents federal reserve banks boston new york respectively,jeff fuhrer alberto musalem executive vice president federal reserve bank boston new york respectively,0
77,2015-01-28,troy davig michael dotsey joshua frost evan koenig samuel schulhofer wohl christopher waller senior vice presidents federal reserve banks kansas city philadelphia new york dallas minneapolis st louis respectively,troy davig michael dotsey joshua frost evan koenig samuel schulhofer wohl christopher waller senior vice president federal reserve bank kansa city philadelphia new york dallas minneapolis st louis respectively,0
78,2015-01-28,todd clark douglas tillett vice presidents federal reserve banks cleveland chicago respectively,todd clark douglas tillett vice president federal reserve bank cleveland chicago respectively,0
79,2015-01-28,robert hetzel senior economist federal reserve bank richmond,robert hetzel senior economist federal reserve bank richmond,0
80,2015-01-28,annual organizational matters agenda meeting reported advices election following members alternate members federal open market committee the committee term beginning january   received individuals executed oaths office,annual organizational matter agenda meeting report advice election follow member alternate member federal open market committee the committee term begin january receive individual execute oath office,0
81,2015-01-28,elected members alternate members follows,elect member alternate member follow,0
82,2015-01-28,william dudley president federal reserve bank new york christine cumming first vice president federal reserve bank new york alternate,william dudley president federal reserve bank new york christine cumming first vice president federal reserve bank new york alternate,0
83,2015-01-28,jeffrey lacker president federal reserve bank richmond eric rosengren president federal reserve bank boston alternate,jeffrey lacker president federal reserve bank richmond eric rosengren president federal reserve bank boston alternate,0
84,2015-01-28,charles evans president federal reserve bank chicago loretta mester president federal reserve bank cleveland alternate,charles evans president federal reserve bank chicago loretta mester president federal reserve bank cleveland alternate,0
85,2015-01-28,dennis lockhart president federal reserve bank atlanta james bullard president federal reserve bank st louis alternate,dennis lockhart president federal reserve bank atlanta james bullard president federal reserve bank st louis alternate,0
86,2015-01-28,john williams president federal reserve bank san francisco esther george president federal reserve bank kansas city alternate,john williams president federal reserve bank san francisco esther george president federal reserve bank kansa city alternate,0
87,2015-01-28,unanimous vote following officers committee selected serve selection successors first regularly scheduled meeting committee ,unanimous vote follow officer committee select serve selection successor first regularly schedule meeting committee,0
88,2015-01-28,unanimous vote federal reserve bank new york selected execute transactions system open market account soma,unanimous vote federal reserve bank new york select execute transaction system open market account soma,0
89,2015-01-28,unanimous vote committee selected simon potter lorie logan serve pleasure committee manager deputy manager soma respectively understanding selection subject satisfactory federal reserve bank new york,unanimous vote committee select simon potter lorie logan serve pleasure committee manager deputy manager soma respectively understand selection subject satisfactory federal reserve bank new york,0
90,2015-01-28,unanimous vote authorization domestic open market operations approved two sets amendments,unanimous vote authorization domestic open market operation approve two set amendment,0
91,2015-01-28,first set amendments aimed simplifying language defining common terms eliminating duplication language standardizing references committee,first set amendment aim simplify language define common term eliminate duplication language standardize reference committee,0
92,2015-01-28, second set amendments clarified modified existing authority particular introducing defined term selected bank part prudent planning simplify transfer authority federal reserve bank new york another federal reserve bank selected committee event significant contingency removing authorization use agents agency mortgage backed securities mbs transactions defining types collateral accepted securities lending operations described paragraph  updating language relating chair authority act exceptional circumstances,second set amendment clarify modify exist authority particular introduce define term select bank part prudent planning simplify transfer authority federal reserve bank new york another federal reserve bank select committee event significant contingency remove authorization use agent agency mortgage back security mb transaction define type collateral accepted security lending operation described paragraph update language relate chair authority act exceptional circumstance,0
93,2015-01-28, guidelines conduct system open market operations federal agency issues remained suspended,guideline conduct system open market operation federal agency issue remain suspend,0
94,2015-01-28,authorization domestic open market operations as amended effective january  ,authorization domestic open market operation a amend effective january,0
95,2015-01-28,federal open market committee the committee authorizes directs federal reserve bank selected committee execute open market transactions the selected bank extent necessary carry recent domestic policy directive adopted committee,federal open market committee the committee authorizes directs federal reserve bank select committee execute open market transaction the select bank extent necessary carry recent domestic policy directive adopt committee,0
96,2015-01-28,buy sell open market securities direct obligations of fully guaranteed principal interest by united states securities direct obligations of fully guaranteed principal interest by agency united states eligible purchase sale section federal reserve act eligible securities system open market account soma,buy sell open market security direct obligation of fully guaranteed principal interest by united state security direct obligation of fully guaranteed principal interest by agency united state eligible purchase sale section federal reserve act eligible security system open market account soma,0
97,2015-01-28,outright operation securities dealers foreign international accounts maintained selected bank day deferred delivery basis including transactions commonly referred dollar rolls coupon swaps market prices,outright operation security dealer foreign international account maintain select bank day defer delivery basis include transaction commonly refer dollar roll coupon swap market price,0
98,2015-01-28,ii,ii,0
99,2015-01-28,temporary operation day deferred delivery basis purchase eligible securities subject agreement resell repo transactions sell eligible securities subject agreement repurchase reverse repo transactions term  business days less rates that unless otherwise authorized committee determined competitive bidding applying reasonable limitations volume agreements individual counterparties,temporary operation day defer delivery basis purchase eligible security subject agreement resell repo transaction sell eligible security subject agreement repurchase reverse repo transaction term business day less rate that unless otherwise authorize committee determine competitive bidding apply reasonable limitation volume agreement individual counterparties,0
100,2015-01-28,allow eligible securities soma mature without replacement,allow eligible security soma mature without replacement,0
101,2015-01-28,exchange market prices connection treasury auction maturing eligible securities soma treasury case eligible securities direct obligations united states fully guaranteed principal interest united states,exchange market price connection treasury auction mature eligible security soma treasury case eligible security direct obligation united state fully guaranteed principal interest united state,0
102,2015-01-28,exchange market prices maturing eligible securities soma agency united states case eligible securities direct obligations agency fully guaranteed principal interest agency,exchange market price mature eligible security soma agency united state case eligible security direct obligation agency fully guaranteed principal interest agency,0
103,2015-01-28,committee authorizes selected bank undertake transactions type described paragraph  time time purpose testing operational readiness subject following limitations,committee authorizes select bank undertake transaction type described paragraph time time purpose test operational readiness subject follow limitation,0
104,2015-01-28,transactions authorized paragraph  shall conducted prior notice committee,transaction authorize paragraph shall conduct prior notice committee,0
105,2015-01-28,aggregate par value transactions authorized paragraph  type described paragraph ,aggregate par value transaction authorize paragraph type described paragraph,0
106,2015-01-28,a,a,0
107,2015-01-28,shall not exceed  billion per calendar year,shall not exceed billion per calendar year,0
108,2015-01-28,outstanding amount transactions described paragraph ,outstanding amount transaction described paragraph,0
109,2015-01-28,a,a,0
110,2015-01-28,ii shall not exceed  billion given time,ii shall not exceed billion give time,0
111,2015-01-28,order ensure effective conduct open market operations committee authorizes selected bank operate program lend eligible securities held soma dealers overnight basis except selected bank may lend eligible securities longer overnight term accommodate weekend holiday similar trading conventions,order ensure effective conduct open market operation committee authorizes select bank operate program lend eligible security held soma dealer overnight basis except select bank may lend eligible security longer overnight term accommodate weekend holiday similar trading convention,0
112,2015-01-28,securities lending must be,security lending must be,0
113,2015-01-28,rates determined competitive bidding,rate determine competitive bidding,0
114,2015-01-28,ii,ii,0
115,2015-01-28,minimum lending fee consistent objectives program,minimum lending fee consistent objective program,0
116,2015-01-28,iii,iii,0
117,2015-01-28,subject reasonable limitations total amount specific issue eligible securities may auctioned,subject reasonable limitation total amount specific issue eligible security may auction,0
118,2015-01-28,iv,iv,0
119,2015-01-28,subject reasonable limitations amount eligible securities borrower may borrow,subject reasonable limitation amount eligible security borrower may borrow,0
120,2015-01-28,selected bank may,select bank may,0
121,2015-01-28,reject bids that determined sole discretion could facilitate bidder ability control single issue,reject bid that determine sole discretion could facilitate bidder ability control single issue,0
122,2015-01-28,ii,ii,0
123,2015-01-28,accept treasury securities cash collateral loan securities authorized paragraph ,accept treasury security cash collateral loan security authorize paragraph,0
124,2015-01-28,iii,iii,0
125,2015-01-28,accept agency securities collateral loan agency securities authorized paragraph ,accept agency security collateral loan agency security authorize paragraph,0
126,2015-01-28,order ensure effective conduct open market operations assisting provision short term investments authorized services foreign central bank international accounts maintained federal reserve bank the foreign accounts accounts maintained federal reserve bank fiscal agent united states pursuant section  federal reserve act together foreign accounts customer accounts committee authorizes following undertaken terms comparable available open market,order ensure effective conduct open market operation assist provision short term investment authorize service foreign central bank international account maintain federal reserve bank the foreign account account maintain federal reserve bank fiscal agent united state pursuant section federal reserve act together foreign account customer account committee authorizes follow undertaken term comparable available open market,0
127,2015-01-28,selected bank soma undertake reverse repo transactions eligible securities held soma customer accounts term  business days less,select bank soma undertake reverse repo transaction eligible security held soma customer account term business day less,0
128,2015-01-28,federal reserve bank maintains customer accounts customer account appropriate subject necessary authorization approvals to,federal reserve bank maintains customer account customer account appropriate subject necessary authorization approval to,0
129,2015-01-28,undertake repo transactions eligible securities dealers corresponding reverse repo transaction eligible securities customer accounts,undertake repo transaction eligible security dealer correspond reverse repo transaction eligible security customer account,0
130,2015-01-28,ii,ii,0
131,2015-01-28,undertake intraday reverse repo transactions eligible securities foreign accounts,undertake intraday reverse repo transaction eligible security foreign account,0
132,2015-01-28,transactions undertaken customer accounts provisions paragraph  may provide service fee appropriate,transaction undertaken customer account provision paragraph may provide service fee appropriate,0
133,2015-01-28,transactions undertaken customer accounts also subject authorization approval entities including board governors federal reserve system and involving accounts maintained federal reserve bank fiscal agent united states united states department treasury,transaction undertaken customer account also subject authorization approval entity include board governor federal reserve system and involve account maintain federal reserve bank fiscal agent united state united state department treasury,0
134,2015-01-28,committee authorizes chairman committee fostering committee objectives period meetings committee instruct selected bank act behalf committee to,committee authorizes chairman committee foster committee objective period meeting committee instruct select bank act behalf committee to,0
135,2015-01-28,adjust somewhat exceptional circumstances stance monetary policy take actions may result material changes composition size assets soma,adjust somewhat exceptional circumstance stance monetary policy take action may result material change composition size asset soma,0
136,2015-01-28,undertake transactions respect eligible securities order appropriately address temporary disruptions operational highly unusual natures dollar funding markets,undertake transaction respect eligible security order appropriately address temporary disruption operational highly unusual nature dollar funding market,0
137,2015-01-28,adjustment described subparagraph paragraph  shall made context committee discussion decision stance policy recent meeting committee long run objectives foster maximum employment price stability shall based economic financial monetary developments since recent meeting committee,adjustment described subparagraph paragraph shall make context committee discussion decision stance policy recent meeting committee long run objective foster maximum employment price stability shall base economic financial monetary development since recent meeting committee,0
138,2015-01-28,chairman whenever feasible consult committee making instruction paragraph ,chairman whenever feasible consult committee make instruction paragraph,0
