,Date,Original,Corpus,Class
243,2015-01-28,presentation also outlined staff recommendations testing term deposit facility operations,presentation also outline staff recommendation test term deposit facility operation,0
244,2015-01-28,unanimous vote committee ratified open market desk domestic transactions intermeeting period,unanimous vote committee ratify open market desk domestic transaction intermeeting period,0
245,2015-01-28,no intervention operations foreign currencies system account intermeeting period,no intervention operation foreign currency system account intermeeting period,0
246,2015-01-28,liftoff tools possible liftoff options staff briefing provided background possible options use supplementary tools addition interest excess reserves ioer committee could choose use early stages policy normalization,liftoff tool possible liftoff option staff briefing provide background possible option use supplementary tool addition interest excess reserve ioer committee could choose use early stage policy normalization,0
247,2015-01-28,purpose options help ensure sufficient control federal funds rate short term interest rates period mitigating potential risks associated particular policy tools,purpose option help ensure sufficient control federal fund rate short term interest rate period mitigate potential risk associate particular policy tool,0
248,2015-01-28,presentation discussed possibility establishing temporary basis aggregate cap rrp operations substantially cap committee chosen purposes testing operations,presentation discuss possibility establish temporary basis aggregate cap rrp operation substantially cap committee chosen purpose test operation,0
249,2015-01-28,addition presentation discussed possible use term rrp operations either commencement policy firming way reinforce control short term interest rates manage size rrp program,addition presentation discuss possible use term rrp operation either commencement policy firm way reinforce control short term interest rate manage size rrp program,0
250,2015-01-28,possible options presented briefing included adjusting values ioer rrp rates associated given target range federal funds rate use term deposits,possible option present briefing include adjust value ioer rrp rate associate give target range federal fund rate use term deposit,0
251,2015-01-28,discussion issues participants generally agreed important commencement policy firming proceed successfully,discussion issue participant generally agree important commencement policy firm proceed successfully,0
252,2015-01-28,consequently prepared take steps necessary ensure federal funds rate traded within target range established federal open market committee fomc,consequently prepared take step necessary ensure federal fund rate trade within target range establish federal open market committee fomc,0
253,2015-01-28,however participants noted day day volatility federal funds rate potentially including temporary movements outside target range would not surprising historical experience suggested temporary movements few any implications overall financial conditions aggregate economy,however participant note day day volatility federal fund rate potentially include temporary movement outside target range would not surprising historical experience suggest temporary movement few any implication overall financial condition aggregate economy,0
254,2015-01-28,regard appropriate setting cap rrp operations beginning normalization staff reported testing date suggested rrp operations generally successful establishing floor level federal funds effective rate short term interest rates long market participants judge aggregate cap quite unlikely bind,regard appropriate set cap rrp operation begin normalization staff report test date suggest rrp operation generally successful establish floor level federal fund effective rate short term interest rate long market participant judge aggregate cap quite unlikely bind,0
255,2015-01-28,backdrop meeting participants indicated sizable rrp cap would appropriate support policy implementation time liftoff couple participants suggested aggregate cap might suspended time,backdrop meeting participant indicate sizable rrp cap would appropriate support policy implementation time liftoff couple participant suggest aggregate cap might suspend time,0
256,2015-01-28,couple participants expressed continued concerns potential risks financial stability associated large rrp facility possible effect facility patterns financial intermediation,couple participant express continued concern potential risk financial stability associate large rrp facility possible effect facility pattern financial intermediation,0
257,2015-01-28,moreover participants concerned decision allow temporary increase maximum size rrp facility could viewed market participants signal large rrp facility would maintained longer period participants deemed appropriate,moreover participant concerned decision allow temporary increase maximum size rrp facility could view market participant signal large rrp facility would maintain longer period participant deem appropriate,0
258,2015-01-28,acknowledging concerns many participants believed temporarily elevated cap rrp operations time committee saw conditions appropriate begin normalization would likely pose limited risks another participant judged rrp program was case unlikely materially increase risks financial stability,acknowledge concern many participant believe temporarily elevate cap rrp operation time committee saw condition appropriate begin normalization would likely pose limited risk another participant judged rrp program be case unlikely materially increase risk financial stability,0
259,2015-01-28,participants noted relatively high cap could established reduced fairly soon initial policy firming determined not needed reduction could help underscore committee intent use facility extent necessary,participant note relatively high cap could establish reduce fairly soon initial policy firm determine not need reduction could help underscore committee intent use facility extent necessary,0
260,2015-01-28,number participants emphasized committee develop plans ensure facility temporary phased no longer needed help control federal funds rate,number participant emphasize committee develop plan ensure facility temporary phase no longer need help control federal fund rate,0
261,2015-01-28,regard possible use term rrp operations additional supplementary tool participants noted recent testing showed term rrp operations ahead year end associated significant decline level take rrp operations,regard possible use term rrp operation additional supplementary tool participant note recent test show term rrp operation ahead year end associate significant decline level take rrp operation,0
262,2015-01-28,staff presentation suggested risks financial stability associated term rrps could somewhat lower associated rrp operations term rrp operations would conducted selected dates federal reserve would set quantity auctioned rate term rrps would determined auction process,staff presentation suggest risk financial stability associate term rrps could somewhat low associate rrp operation term rrp operation would conduct select date federal reserve would set quantity auction rate term rrps would determine auction process,0
263,2015-01-28,however participants expressed view term rrps unlikely lower risks financial stability significantly,however participant express view term rrps unlikely low risk financial stability significantly,0
264,2015-01-28,addition participants noted use term rrp operations could complicate communications,addition participant note use term rrp operation could complicate communication,0
265,2015-01-28,others observed committee not design operations reduce year end quarter end volatility induced financial firms reporting practices,others observe committee not design operation reduce year end quarter end volatility induced financial firm reporting practice,0
266,2015-01-28,nonetheless many participants agreed use term rrp operations period policy tightening could useful situations,nonetheless many participant agree use term rrp operation period policy tighten could useful situation,0
267,2015-01-28,regard potential use tools several participants noted ioer rrp rates set top bottom respectively target range federal funds rate,regard potential use tool several participant note ioer rrp rate set top bottom respectively target range federal fund rate,0
268,2015-01-28,deviate structure would complicate communications policy framework therefore avoided possible,deviate structure would complicate communication policy framework therefore avoid possible,0
269,2015-01-28,however participants judged adjustments relationship ioer rate rrp rate target range federal funds rate might circumstances helpful improving control federal funds rate,however participant judged adjustment relationship ioer rate rrp rate target range federal fund rate might circumstance helpful improve control federal fund rate,0
270,2015-01-28,participants noted use term deposits tightening phase could also appropriate circumstances,participant note use term deposit tighten phase could also appropriate circumstance,0
271,2015-01-28,staff presentation also discussed technical issue related calculation payment interest reserves,staff presentation also discuss technical issue related calculation payment interest reserve,0
272,2015-01-28,current arrangements increase ioer rate implemented middle reserve maintenance period not fully reflected interest payments depository institutions beginning new maintenance period,current arrangement increase ioer rate implement middle reserve maintenance period not fully reflect interest payment depository institution begin new maintenance period,0
273,2015-01-28,participants generally suggested would useful staff investigate changes method used determine interest payments reserves could tighten link ioer rate place day level reserve balances held depository institutions day,participant generally suggest would useful staff investigate change method use determine interest payment reserve could tighten link ioer rate place day level reserve balance held depository institution day,0
274,2015-01-28,conclusion discussion participants generally agreed would useful discuss coming meetings specific calibrations policy tools could used early stages policy normalization,conclusion discussion participant generally agree would useful discus come meeting specific calibration policy tool could use early stage policy normalization,0
275,2015-01-28,addition many noted would useful communicate additional information public issues provide greater clarity committee approach policy implementation time,addition many note would useful communicate additional information public issue provide great clarity committee approach policy implementation time,0
276,2015-01-28,staff briefing outlined two proposals committee could consider testing term rrp operations,staff briefing outline two proposal committee could consider test term rrp operation,0
277,2015-01-28,first proposals desk would conduct series preannounced term rrp operations would span end first quarter,first proposal desk would conduct series preannounced term rrp operation would span end first quarter,0
278,2015-01-28,second proposal desk would conduct small term rrp operations february early march addition quarter end option presented first proposal,second proposal desk would conduct small term rrp operation february early march addition quarter end option present first proposal,0
279,2015-01-28,discussion term rrp testing participants noted testing could provide information substitutability term rrp operations including outside year end quarter end periods,discussion term rrp test participant note test could provide information substitutability term rrp operation include outside year end quarter end period,0
280,2015-01-28,number participants emphasized that even committee conducted additional tests not yet decided whether use term rrp operations part policy normalization,number participant emphasize that even committee conduct additional test not yet decide whether use term rrp operation part policy normalization,0
281,2015-01-28,following discussion testing term rrp operations committee approved following resolution term rrp testing end first quarter ,follow discussion test term rrp operation committee approve follow resolution term rrp test end first quarter,0
282,2015-01-28,committee also approved following resolution testing term rrp operations february march,committee also approve follow resolution test term rrp operation february march,0
283,2015-01-28,mr lacker dissented votes resolutions felt testing date already provided sufficient information tool authorizing testing could encourage incorrect impression committee already decided would engaging term rrp operations period policy normalization,mr lacker dissent vote resolution felt test date already provide sufficient information tool authorize test could encourage incorrect impression committee already decide would engage term rrp operation period policy normalization,0
284,2015-01-28,board meeting concluded end discussion liftoff tools possible liftoff options,board meeting conclude end discussion liftoff tool possible liftoff option,0
285,2015-01-28,staff review economic situation information reviewed january   meeting indicated economic activity expanded solid pace second half  labor market conditions improved recent months,staff review economic situation information review january meeting indicate economic activity expand solid pace second half labor market condition improve recent month,0
286,2015-01-28,consumer price inflation moved fomc longer run objective  percent held continuing large decreases energy prices,consumer price inflation move fomc longer run objective percent held continue large decrease energy price,0
287,2015-01-28,longer term market based measures inflation compensation declined substantially recent months survey measures longer run inflation expectations remained stable,longer term market base measure inflation compensation decline substantially recent month survey measure longer run inflation expectation remain stable,0
288,2015-01-28,total nonfarm payroll employment expanded december gains october november revised up putting increase fourth quarter third quarter,total nonfarm payroll employment expand december gain october november revise up put increase fourth quarter third quarter,0
289,2015-01-28,unemployment rate declined ,unemployment rate decline,0
290,2015-01-28, percent december labor force participation rate decreased employment population rate unchanged,percent december labor force participation rate decrease employment population rate unchanged,0
291,2015-01-28,share workers employed part time economic reasons declined,share worker employ part time economic reason decline,0
292,2015-01-28,rate private sector job openings moved november rates hiring quits edged remained well year earlier readings,rate private sector job opening move november rate hire quits edge remain well year earlier reading,0
293,2015-01-28,industrial production rose robust pace fourth quarter strong increase manufacturing output modest gain mining output,industrial production rise robust pace fourth quarter strong increase manufacturing output modest gain mining output,0
294,2015-01-28,automakers assembly schedules first quarter broader indicators manufacturing production readings new orders national regional manufacturing surveys generally pointed moderate gains factory output early year,automaker assembly schedule first quarter broader indicator manufacturing production reading new order national regional manufacturing survey generally point moderate gain factory output early year,0
295,2015-01-28,contrast indicators mining activity counts drilling rigs operation weakened presumably reflecting recent sharp declines energy prices,contrast indicator mining activity count drilling rig operation weaken presumably reflect recent sharp decline energy price,0
296,2015-01-28,real personal consumption expenditures pce appeared risen robust pace second half ,real personal consumption expenditure pce appear risen robust pace second half,0
297,2015-01-28,data spending third quarter revised up components nominal retail sales used construct estimates pce rose briskly fourth quarter,data spending third quarter revise up component nominal retail sale use construct estimate pce rise briskly fourth quarter,0
298,2015-01-28,light motor vehicle sales fourth quarter maintained robust third quarter pace,light motor vehicle sale fourth quarter maintain robust third quarter pace,0
299,2015-01-28,important factors influencing household spending remained supportive solid gains real pce early year,important factor influence household spending remain supportive solid gain real pce early year,0
300,2015-01-28,real disposable personal income increased november since then continued declines energy prices likely raised purchasing power households incomes,real disposable personal income increase november since then continued decline energy price likely raise purchasing power household income,0
301,2015-01-28,households net worth likely increased home values equity prices advanced consumer sentiment measured thomson reutersuniversity michigan surveys consumers moved early january highest level decade,household net worth likely increase home value equity price advanced consumer sentiment measure thomson reutersuniversity michigan survey consumer move early january high level decade,0
302,2015-01-28,pace housing market activity improved somewhat remained slow,pace housing market activity improve somewhat remain slow,0
303,2015-01-28,starts new single family homes increased december highest level since  permits new construction also moved higher,start new single family home increase december high level since permit new construction also move high,0
304,2015-01-28,starts multifamily units unchanged december within range past year,start multifamily unit unchanged december within range past year,0
305,2015-01-28,sales new homes increased net november december sales existing homes declined average two months,sale new home increase net november december sale exist home decline average two month,0
306,2015-01-28,real private expenditures business equipment intellectual property appeared decelerate fourth quarter,real private expenditure business equipment intellectual property appear decelerate fourth quarter,0
307,2015-01-28,nominal orders shipments nondefense capital goods excluding aircraft declined november december,nominal order shipment nondefense capital good exclude aircraft decline november december,0
308,2015-01-28,moreover level new orders capital goods little shipments pointed modest near term gains business equipment spending despite relatively positive readings business conditions national regional surveys,moreover level new order capital good little shipment point modest near term gain business equipment spending despite relatively positive reading business condition national regional survey,0
309,2015-01-28,firms nominal spending nonresidential structures edged november remained higher third quarter,firm nominal spending nonresidential structure edge november remain high third quarter,0
310,2015-01-28,real federal government purchases appeared likely decreased sharply fourth quarter reversing much surprisingly strong increase third quarter,real federal government purchase appear likely decrease sharply fourth quarter reverse much surprisingly strong increase third quarter,0
311,2015-01-28,real state local government purchases rising modestly fourth quarter nominal construction expenditures october november little changed net payrolls governments increased somewhat,real state local government purchase rise modestly fourth quarter nominal construction expenditure october november little change net payroll government increase somewhat,0
312,2015-01-28,us international trade deficit narrowed substantially november imports declining exports,u international trade deficit narrow substantially november import decline export,0
313,2015-01-28,decrease value imports stemmed large part reduction value petroleum imports reflecting lower prices volumes,decrease value import stem large part reduction value petroleum import reflect low price volume,0
314,2015-01-28,however many categories goods imports also weaker,however many category good import also weaker,0
315,2015-01-28,export declines concentrated capital goods particularly aircraft,export decline concentrate capital good particularly aircraft,0
316,2015-01-28,despite narrowing nominal trade deficit november real net exports appeared track decline fourth quarter adding considerably real gross domestic product gdp growth third quarter,despite narrow nominal trade deficit november real net export appear track decline fourth quarter add considerably real gross domestic product gdp growth third quarter,0
317,2015-01-28,totals consumer prices measured pce price index increased   percent  months ending november core prices measured pce prices excluding food energy rose   percent consumer energy prices declined consumer food prices increased faster overall prices,total consumer price measure pce price index increase percent month end november core price measure pce price exclude food energy rise percent consumer energy price decline consumer food price increase faster overall price,0
318,2015-01-28, months ending december total inflation measured consumer price index cpi  percent core cpi inflation   percent,month end december total inflation measure consumer price index cpi percent core cpi inflation percent,0
319,2015-01-28, months ending december total cpi decreased annual rate   percent reflecting recent declines consumer energy prices core cpi increased  percent pace,month end december total cpi decrease annual rate percent reflect recent decline consumer energy price core cpi increase percent pace,0
320,2015-01-28,measures expected long run inflation variety surveys including michigan survey desk survey primary dealers remained stable,measure expect long run inflation variety survey include michigan survey desk survey primary dealer remain stable,0
321,2015-01-28,contrast market based measures inflation compensation   years ahead declined further,contrast market base measure inflation compensation year ahead decline far,0
322,2015-01-28, months ending december nominal average hourly earnings employees increased slightly faster core consumer price inflation,month end december nominal average hourly earnings employee increase slightly faster core consumer price inflation,0
323,2015-01-28,foreign real gdp growth appeared increase slightly fourth quarter,foreign real gdp growth appear increase slightly fourth quarter,0
324,2015-01-28,euro area retail sales car registrations industrial production november third quarter averages japan strengthening consumption exports suggested recovery output two quarters contraction,euro area retail sale car registration industrial production november third quarter average japan strengthen consumption export suggest recovery output two quarter contraction,0
325,2015-01-28,however growth slowed china partly reflecting moderation residential investment declining construction activity also contributed slowing gdp growth korea united kingdom,however growth slow china partly reflect moderation residential investment decline construction activity also contribute slow gdp growth korea united kingdom,0
326,2015-01-28,inflation advanced foreign economies declined sharply end last year amid rapidly falling energy prices,inflation advanced foreign economy decline sharply end last year amid rapidly fall energy price,0
327,2015-01-28,contrast inflation emerging market economies fell modestly several economies government administered energy prices experiencing upward price pressures currency depreciations,contrast inflation emerge market economy fell modestly several economy government administer energy price experience upward price pressure currency depreciation,0
328,2015-01-28,staff review financial situation intermeeting period amid trading volatile times longer term sovereign yields united states advanced economies declined,staff review financial situation intermeeting period amid trading volatile time longer term sovereign yield united state advanced economy decline,0
329,2015-01-28,moves attributed part deterioration market sentiment associated downward pressure inflation increased concern global economic outlook announced anticipated foreign central bank policies,move attribute part deterioration market sentiment associate downward pressure inflation increase concern global economic outlook announce anticipate foreign central bank policy,0
330,2015-01-28,moreover continued sharp declines oil pricess economic data releases viewed investors bit weaker anticipated balance reportedly weighed sentiment,moreover continued sharp decline oil price economic data release view investor bit weaker anticipate balance reportedly weigh sentiment,0
331,2015-01-28,federal reserve communications intermeeting period apparently seen line expectations balance,federal reserve communication intermeeting period apparently see line expectation balance,0
332,2015-01-28,however reflecting part deterioration market sentiment expected path federal funds rate implied market quotes shifted down,however reflect part deterioration market sentiment expect path federal fund rate imply market quote shift down,0
