,Date,Original,Corpus,Class
0,2016-04-27,federal reserve central bank united states provides nation safe flexible stable monetary financial system,federal reserve central bank united state provide nation safe flexible stable monetary financial system,0
1,2016-04-27,federal open market committee,federal open market committee,0
2,2016-04-27,monetary policy principles practice,monetary policy principle practice,0
3,2016-04-27,policy implementation,policy implementation,0
4,2016-04-27,reports,report,0
5,2016-04-27,review monetary policy strategy tools communications,review monetary policy strategy tool communication,0
6,2016-04-27,institution supervision,institution supervision,0
7,2016-04-27,reports,report,0
8,2016-04-27,reporting forms,reporting form,0
9,2016-04-27,supervision  regulation letters,supervision regulation letter,0
10,2016-04-27,banking applications  legal developments,banking application legal development,0
11,2016-04-27,regulatory resources,regulatory resource,0
12,2016-04-27,banking  data structure,banking data structure,0
13,2016-04-27,regulations  statutes,regulation statute,0
14,2016-04-27,payment policies,payment policy,0
15,2016-04-27,reserve bank payment services  data,reserve bank payment service data,0
16,2016-04-27,financial market utilities  infrastructures,financial market utility infrastructure,0
17,2016-04-27,research committees forums,research committee forum,0
18,2016-04-27,working papers notes,work paper note,0
19,2016-04-27,models tools,model tool,0
20,2016-04-27,bank assets liabilities,bank asset liability,0
21,2016-04-27,bank structure data,bank structure data,0
22,2016-04-27,business finance,business finance,0
23,2016-04-27,dealer financing terms,dealer financing term,0
24,2016-04-27,exchange rates international data,exchange rate international data,0
25,2016-04-27,financial accounts,financial account,0
26,2016-04-27,household finance,household finance,0
27,2016-04-27,industrial activity,industrial activity,0
28,2016-04-27,interest rates,interest rate,0
29,2016-04-27,micro data reference manual mdrm,micro data reference manual mdrm,0
30,2016-04-27,money stock reserve balances,money stock reserve balance,0
31,2016-04-27,regulations,regulation,0
32,2016-04-27,supervision  enforcement,supervision enforcement,0
33,2016-04-27,community development,community development,0
34,2016-04-27,research  analysis,research analysis,0
35,2016-04-27,consumer resources,consumer resource,0
36,2016-04-27,april   ,april,0
37,2016-04-27,joint meeting federal open market committee board governors held offices board governors federal reserve system washington dc tuesday april   continued wednesday april   m,joint meeting federal open market committee board governor held office board governor federal reserve system washington dc tuesday april continued wednesday april m,0
38,2016-04-27,present janet yellen chair william dudley vice chairman lael brainard james bullard stanley fischer esther george loretta mester jerome powell eric rosengren daniel tarullo,present janet yellen chair william dudley vice chairman lael brainard james bullard stanley fischer esther george loretta mester jerome powell eric rosengren daniel tarullo,0
39,2016-04-27,charles evans patrick harker robert kaplan neel kashkari michael strine alternate members federal open market committee,charles evans patrick harker robert kaplan neel kashkari michael strine alternate member federal open market committee,0
40,2016-04-27,jeffrey lacker dennis lockhart john williams presidents federal reserve banks richmond atlanta san francisco respectively,jeffrey lacker dennis lockhart john williams president federal reserve bank richmond atlanta san francisco respectively,0
41,2016-04-27,brian madigan secretary matthew luecke deputy secretary david skidmore assistant secretary michelle smith assistant secretary scott alvarez general counsel thomas baxter deputy general counsel steven kamin economist thomas laubach economist david wilcox economist,brian madigan secretary matthew luecke deputy secretary david skidmore assistant secretary michelle smith assistant secretary scott alvarez general counsel thomas baxter deputy general counsel steven kamin economist thomas laubach economist david wilcox economist,0
42,2016-04-27,thomas connors troy davig michael leahy david lebow stephen meyer geoffrey tootell william wascher associate economists,thomas connors troy davig michael leahy david lebow stephen meyer geoffrey tootell william wascher associate economist,0
43,2016-04-27,simon potter manager system open market account,simon potter manager system open market account,0
44,2016-04-27,lorie logan deputy manager system open market account,lorie logan deputy manager system open market account,0
45,2016-04-27,robert dev,robert dev,0
46,2016-04-27,frierson secretary board office secretary board governors,frierson secretary board office secretary board governor,0
47,2016-04-27,michael gibson director division banking supervision regulation board governors,michael gibson director division banking supervision regulation board governor,0
48,2016-04-27,nellie liang director office financial stability policy research board governors,nellie liang director office financial stability policy research board governor,0
49,2016-04-27,james clouse deputy director division monetary affairs board governors,james clouse deputy director division monetary affair board governor,0
50,2016-04-27,william english senior special adviser board office board members board governors,william english senior special adviser board office board member board governor,0
51,2016-04-27,andrew figura ann mckeehan david reifschneider stacey tevlin special advisers board office board members board governors,andrew figura ann mckeehan david reifschneider stacey tevlin special adviser board office board member board governor,0
52,2016-04-27,trevor reeve special adviser chair office board members board governors,trevor reeve special adviser chair office board member board governor,0
53,2016-04-27,linda robertson assistant board office board members board governors,linda robertson assistant board office board member board governor,0
54,2016-04-27,eric engen senior associate director division research statistics board governors fabio natalucci senior associate director division monetary affairs board governors,eric engen senior associate director division research statistic board governor fabio natalucci senior associate director division monetary affair board governor,0
55,2016-04-27,antulio bomfim egon zakrajek joyce zickler senior advisers division monetary affairs board governors jeremy rudd senior adviser division research statistics board governors,antulio bomfim egon zakrajek joyce zickler senior adviser division monetary affair board governor jeremy rudd senior adviser division research statistic board governor,0
56,2016-04-27,mark carey associate director division international finance board governors joshua gallin associate director division research statistics board governors,mark carey associate director division international finance board governor joshua gallin associate director division research statistic board governor,0
57,2016-04-27,shaghil ahmed deputy associate director division international finance board governors,shaghil ahmed deputy associate director division international finance board governor,0
58,2016-04-27,rochelle edge deputy associate director office financial stability policy research board governors,rochelle edge deputy associate director office financial stability policy research board governor,0
59,2016-04-27,glenn follette john roberts assistant directors division research statistics board governors christopher gust assistant director division monetary affairs board governors,glenn follette john robert assistant director division research statistic board governor christopher gust assistant director division monetary affair board governor,0
60,2016-04-27,burcu duygan bump adviser division monetary affairs board governors,burcu duygan bump adviser division monetary affair board governor,0
61,2016-04-27,penelope beattie assistant secretary office secretary board governors,penelope beattie assistant secretary office secretary board governor,0
62,2016-04-27,dana burnett section chief division monetary affairs board governors,dana burnett section chief division monetary affair board governor,0
63,2016-04-27,bora durdu section chief office financial stability policy research board governors,bora durdu section chief office financial stability policy research board governor,0
64,2016-04-27,jae sim principal economist division research statistics board governors,jae sim principal economist division research statistic board governor,0
65,2016-04-27,andrea ajello senior economist division monetary affairs board governors,andrea ajello senior economist division monetary affair board governor,0
66,2016-04-27,kelly dubbert first vice president federal reserve bank kansas city,kelly dubbert first vice president federal reserve bank kansa city,0
67,2016-04-27,david altig kartik athreya jeff fuhrer glenn rudebusch executive vice presidents federal reserve banks atlanta richmond boston san francisco respectively,david altig kartik athreya jeff fuhrer glenn rudebusch executive vice president federal reserve bank atlanta richmond boston san francisco respectively,0
68,2016-04-27,tobias adrian michael dotsey samuel schulhofer wohl senior vice presidents federal reserve banks new york philadelphia minneapolis respectively,tobias adrian michael dotsey samuel schulhofer wohl senior vice president federal reserve bank new york philadelphia minneapolis respectively,0
69,2016-04-27,joseph haubrich anna paulson david wheelock vice presidents federal reserve banks cleveland chicago st louis respectively,joseph haubrich anna paulson david wheelock vice president federal reserve bank cleveland chicago st louis respectively,0
70,2016-04-27,richard crump marco del negro assistant vice presidents federal reserve bank new york,richard crump marco del negro assistant vice president federal reserve bank new york,0
71,2016-04-27,jim dolmas senior research economist federal reserve bank dallas,jim dolmas senior research economist federal reserve bank dallas,0
72,2016-04-27,nina boyarchenko financial economist federal reserve bank new york,nina boyarchenko financial economist federal reserve bank new york,0
73,2016-04-27,relationship monetary policy financial stability staff presented several briefings special topic relationship monetary policy financial stability,relationship monetary policy financial stability staff present several briefing special topic relationship monetary policy financial stability,0
74,2016-04-27,presentations began overview possible linkages among monetary policy macroprudential tools financial stability drawing academic research experience tools various countries,presentation begin overview possible linkage among monetary policy macroprudential tool financial stability draw academic research experience tool various country,0
75,2016-04-27,staff reviewed empirical literature linkages stance monetary policy financial stability,staff review empirical literature linkage stance monetary policy financial stability,0
76,2016-04-27,lastly staff presented illustrative simulation results specific macroeconomic model explore whether monetary policy react financial imbalances well extent monetary macroprudential policies coordinated best achieve macroeconomic goals financial stability goals,lastly staff present illustrative simulation result specific macroeconomic model explore whether monetary policy react financial imbalance well extent monetary macroprudential policy coordinate best achieve macroeconomic goal financial stability goal,0
77,2016-04-27,comments briefings discussion relationship monetary policy financial stability fomc participants noted stringent regulatory supervisory policies implemented since financial crisis including enhanced capital liquidity requirements types financial institutions significantly increased resilience financial system shocks,comment briefing discussion relationship monetary policy financial stability fomc participant note stringent regulatory supervisory policy implement since financial crisis include enhance capital liquidity requirement type financial institution significantly increase resilience financial system shock,0
78,2016-04-27,participants emphasized importance macroprudential tools promoting financial stability generally expressed view tools primary means address financial stability risks,participant emphasize importance macroprudential tool promote financial stability generally express view tool primary mean address financial stability risk,0
79,2016-04-27,however noted relatively macroprudential tools available financial regulators united states that part tools untested,however note relatively macroprudential tool available financial regulator united state that part tool untested,0
80,2016-04-27,moreover number institutional factors including dispersion responsibilities across regulatory agencies differences mandates among agencies resulting coordination challenges may make difficult deploy macroprudential tools expeditiously united states may lessen effectiveness,moreover number institutional factor include dispersion responsibility across regulatory agency difference mandate among agency result coordination challenge may make difficult deploy macroprudential tool expeditiously united state may lessen effectiveness,0
81,2016-04-27,participants noted considerations would less significant tools likely adjusted infrequently,participant note consideration would less significant tool likely adjust infrequently,0
82,2016-04-27,participants judged benefits using monetary policy address threats financial stability would typically outweighed costs associated deviations committee employment price stability objectives induced actions also noted benefits highly uncertain,participant judged benefit use monetary policy address threat financial stability would typically outweigh cost associate deviation committee employment price stability objective induced action also note benefit highly uncertain,0
83,2016-04-27,nonetheless participants generally agreed committee not completely rule possibility using monetary policy address financial stability risks particularly circumstances risks significantly threatened achievement dual mandate macroprudential tools likely ineffective mitigating risks,nonetheless participant generally agree committee not completely rule possibility use monetary policy address financial stability risk particularly circumstance risk significantly threaten achievement dual mandate macroprudential tool likely ineffective mitigate risk,0
84,2016-04-27,finally participants stressed need research analysis advance understanding relationship monetary policy financial stability help identify situations might desirable incorporate financial stability considerations design monetary policy,finally participant stress need research analysis advance understand relationship monetary policy financial stability help identify situation might desirable incorporate financial stability consideration design monetary policy,0
85,2016-04-27,developments financial markets open market operations manager system open market account soma reported developments domestic foreign financial markets including changes market participants expectations courses monetary policy,development financial market open market operation manager system open market account soma report development domestic foreign financial market include change market participant expectation course monetary policy,0
86,2016-04-27,deputy manager provided briefing money market developments system open market operations conducted open market desk period since committee met march   ,deputy manager provide briefing money market development system open market operation conduct open market desk period since committee met march,0
87,2016-04-27,except march quarter end daily effective federal funds rate remained close center committee   percent target range intermeeting period,except march quarter end daily effective federal fund rate remain close center committee percent target range intermeeting period,0
88,2016-04-27,manager briefed committee routine review staff process managing foreign currency reserves resulting proposal enhanced analytical framework management reserves,manager briefed committee routine review staff process manage foreign currency reserve result proposal enhance analytical framework management reserve,0
89,2016-04-27,committee voted unanimously renew reciprocal currency arrangements bank canada bank mexico arrangements associated federal reserve participation north american framework agreement ,committee vote unanimously renew reciprocal currency arrangement bank canada bank mexico arrangement associate federal reserve participation north american framework agreement,0
90,2016-04-27,addition committee voted unanimously renew dollar foreign currency liquidity swap arrangements bank canada bank england bank japan european central bank swiss national bank,addition committee vote unanimously renew dollar foreign currency liquidity swap arrangement bank canada bank england bank japan european central bank swiss national bank,0
91,2016-04-27,votes renew federal reserve participation standing arrangements taken annually april fomc meeting,vote renew federal reserve participation stand arrangement take annually april fomc meeting,0
92,2016-04-27,unanimous vote committee ratified desk domestic transactions intermeeting period,unanimous vote committee ratify desk domestic transaction intermeeting period,0
93,2016-04-27,no intervention operations foreign currencies system account intermeeting period,no intervention operation foreign currency system account intermeeting period,0
94,2016-04-27,staff review economic situation information reviewed april   fomc meeting indicated labor market conditions improved first quarter even though growth real gross domestic product gdp appeared slowed,staff review economic situation information review april fomc meeting indicate labor market condition improve first quarter even though growth real gross domestic product gdp appear slow,0
95,2016-04-27,consumer price inflation continued run committee longer run objective  percent restrained part earlier decreases energy prices declining prices non energy imports,consumer price inflation continued run committee longer run objective percent restrain part earlier decrease energy price decline price non energy import,0
96,2016-04-27,survey based measures longer run inflation expectations little changed balance recent months market based measures inflation compensation still low,survey base measure longer run inflation expectation little change balance recent month market base measure inflation compensation still low,0
97,2016-04-27,total nonfarm payroll employment expanded solid pace march labor market conditions generally continued strengthen,total nonfarm payroll employment expand solid pace march labor market condition generally continued strengthen,0
98,2016-04-27,although unemployment rate edged ,although unemployment rate edge,0
99,2016-04-27, percent labor force participation rate employment population ratio continued increase,percent labor force participation rate employment population ratio continued increase,0
100,2016-04-27,share workers employed part time economic reasons rose slightly flat balance recent months,share worker employ part time economic reason rise slightly flat balance recent month,0
101,2016-04-27,rates private sector hires quits moved february rate job openings declined little still elevated level,rate private sector hire quits move february rate job opening decline little still elevate level,0
102,2016-04-27,late march early april four week moving average initial claims unemployment insurance benefits essentially unchanged net low level,late march early april four week move average initial claim unemployment insurance benefit essentially unchanged net low level,0
103,2016-04-27,labor productivity growth appeared remained slow four quarters ending first quarter year,labor productivity growth appear remain slow four quarter end first quarter year,0
104,2016-04-27,measures labor compensation continued rise modest pace average hourly earnings employees increased   percent  months ending march,measure labor compensation continued rise modest pace average hourly earnings employee increase percent month end march,0
105,2016-04-27,total industrial production declined february march,total industrial production decline february march,0
106,2016-04-27,manufacturing output decreased partly reflecting effects export demand earlier appreciation foreign exchange value dollar,manufacturing output decrease partly reflect effect export demand earlier appreciation foreign exchange value dollar,0
107,2016-04-27,meanwhile mining output continued contract result declines drilling activity associated low crude oil prices,meanwhile mining output continued contract result decline drilling activity associate low crude oil price,0
108,2016-04-27,moreover unseasonably warm weather february march held output utilities,moreover unseasonably warm weather february march held output utility,0
109,2016-04-27,automakers assembly schedules broader indicators manufacturing production readings new orders national regional manufacturing surveys mostly pointed modest gains factory output next months,automaker assembly schedule broader indicator manufacturing production reading new order national regional manufacturing survey mostly point modest gain factory output next month,0
110,2016-04-27,information extraction drilling activity crude oil natural gas early april consistent declines mining output,information extraction drilling activity crude oil natural gas early april consistent decline mining output,0
111,2016-04-27,growth real personal consumption expenditures pce appeared slowed first quarter,growth real personal consumption expenditure pce appear slow first quarter,0
112,2016-04-27,real pce rose moderately february flat january,real pce rise moderately february flat january,0
113,2016-04-27,components nominal retail sales data used bureau economic analysis construct estimate pce moved sideways march rate sales new light motor vehicles decreased markedly,component nominal retail sale data use bureau economic analysis construct estimate pce move sideways march rate sale new light motor vehicle decrease markedly,0
114,2016-04-27,nevertheless recent readings key factors influence consumer spending consistent pickup real pce growth coming months,nevertheless recent reading key factor influence consumer spending consistent pickup real pce growth come month,0
115,2016-04-27,gains real disposable income continued solid february,gain real disposable income continued solid february,0
116,2016-04-27,households net worth boosted rise equity prices intermeeting period strong increases home values february,household net worth boost rise equity price intermeeting period strong increase home value february,0
117,2016-04-27,also consumer sentiment measured university michigan surveys consumers remained upbeat early april,also consumer sentiment measure university michigan survey consumer remain upbeat early april,0
118,2016-04-27,recent information housing activity broadly consistent continued slow recovery sector,recent information housing activity broadly consistent continued slow recovery sector,0
119,2016-04-27,starts building permits new single family homes declined march measures higher first quarter whole fourth quarter ,start building permit new single family home decline march measure high first quarter whole fourth quarter,0
120,2016-04-27,however starts multifamily units continued decrease march,however start multifamily unit continued decrease march,0
121,2016-04-27,sales existing homes rose march decreasing february new home sales moved lower months nonetheless sales new existing homes first quarter whole fourth quarter,sale exist home rise march decrease february new home sale move low month nonetheless sale new exist home first quarter whole fourth quarter,0
122,2016-04-27,real private expenditures business equipment intellectual property appeared decline first quarter,real private expenditure business equipment intellectual property appear decline first quarter,0
123,2016-04-27,nominal shipments nondefense capital goods excluding aircraft decreased net february march,nominal shipment nondefense capital good exclude aircraft decrease net february march,0
124,2016-04-27,forward looking indicators equipment spending new orders nondefense capital goods along recent readings national regional surveys business conditions continued soft,forward look indicator equipment spending new order nondefense capital good along recent reading national regional survey business condition continued soft,0
125,2016-04-27,firms nominal spending nonresidential structures excluding drilling mining decreased february,firm nominal spending nonresidential structure exclude drilling mining decrease february,0
126,2016-04-27,indicators spending structures drilling mining sector number oil gas rigs operation continued fall early april,indicator spending structure drilling mining sector number oil gas rig operation continued fall early april,0
127,2016-04-27,available data suggested inventory investment moved first quarter,available data suggest inventory investment move first quarter,0
128,2016-04-27,total real government purchases seemed risen modestly first quarter,total real government purchase seem risen modestly first quarter,0
129,2016-04-27,federal government spending defense appeared declined,federal government spending defense appear decline,0
