,Date,Original,Corpus,Class
301,2016-04-27,two participants noted several standard policy benchmarks number interest rate rules measures equilibrium real interest rate continued imply values federal funds rate well current target range,two participant note several standard policy benchmark number interest rate rule measure equilibrium real interest rate continued imply value federal fund rate well current target range,0
302,2016-04-27,large persistent deviations federal funds rate benchmarks view posed risk removal policy accommodation proceeding slowly committee might future find necessary raise federal funds rate quickly combat inflation pressures potentially unduly disrupting economic financial activity,large persistent deviation federal fund rate benchmark view pose risk removal policy accommodation proceed slowly committee might future find necessary raise federal fund rate quickly combat inflation pressure potentially unduly disrupt economic financial activity,0
303,2016-04-27,overly accommodative policy could also induce imprudent risk taking financial markets posing additional risks achieving committee goals future,overly accommodative policy could also induce imprudent risk take financial market pose additional risk achieve committee goal future,0
304,2016-04-27,participants agreed ongoing assessments data incoming information well implications outlook would determine timing pace future adjustments stance monetary policy,participant agree ongoing assessment data incoming information well implication outlook would determine timing pace future adjustment stance monetary policy,0
305,2016-04-27,participants judged incoming data consistent economic growth picking second quarter labor market conditions continuing strengthen inflation making progress toward committee  percent objective likely would appropriate committee increase target range federal funds rate june,participant judged incoming data consistent economic growth pick second quarter labor market condition continue strengthen inflation make progress toward committee percent objective likely would appropriate committee increase target range federal fund rate june,0
306,2016-04-27,participants expressed range views likelihood incoming information would make appropriate adjust stance policy time next meeting,participant express range view likelihood incoming information would make appropriate adjust stance policy time next meeting,0
307,2016-04-27,several participants concerned incoming information might not provide sufficiently clear signals determine mid june whether increase target range federal funds rate would warranted,several participant concerned incoming information might not provide sufficiently clear signal determine mid june whether increase target range federal fund rate would warrant,0
308,2016-04-27,participants expressed confidence incoming data would prove broadly consistent economic conditions would make increase target range june appropriate,participant express confidence incoming data would prove broadly consistent economic condition would make increase target range june appropriate,0
309,2016-04-27,participants concerned market participants may not properly assessed likelihood increase target range june meeting emphasized importance communicating clearly intermeeting period committee intends respond economic financial developments,participant concerned market participant may not properly assess likelihood increase target range june meeting emphasize importance communicate clearly intermeeting period committee intend respond economic financial development,0
310,2016-04-27,committee policy action discussion monetary policy period ahead members judged information received since fomc met march indicated labor market conditions improved even growth economic activity appeared slow,committee policy action discussion monetary policy period ahead member judged information receive since fomc met march indicate labor market condition improve even growth economic activity appear slow,0
311,2016-04-27,noted growth household spending moderated although households real income risen solid rate consumer sentiment remained high,note growth household spending moderate although household real income risen solid rate consumer sentiment remain high,0
312,2016-04-27,also agreed since beginning year housing sector improved further business fixed investment net exports soft,also agree since begin year housing sector improve far business fix investment net export soft,0
313,2016-04-27,members saw range recent indicators including strong job gains pointing additional strengthening labor market,member saw range recent indicator include strong job gain point additional strengthen labor market,0
314,2016-04-27,members noted inflation continued run committee  percent longer run objective partly reflecting earlier declines energy prices falling prices non energy imports,member note inflation continued run committee percent longer run objective partly reflect earlier decline energy price fall price non energy import,0
315,2016-04-27,market based measures inflation compensation remained low,market base measure inflation compensation remain low,0
316,2016-04-27,survey based measures longer term inflation expectations little changed balance recent months,survey base measure longer term inflation expectation little change balance recent month,0
317,2016-04-27,respect economic outlook implications monetary policy members continued expect that gradual adjustments stance monetary policy economic activity would expand moderate pace labor market indicators would continue strengthen,respect economic outlook implication monetary policy member continued expect that gradual adjustment stance monetary policy economic activity would expand moderate pace labor market indicator would continue strengthen,0
318,2016-04-27,although recent spending production data disappointing members generally judged weakness temporary though members noted risk might persist potentially undermining improvement labor market,although recent spending production data disappoint member generally judged weakness temporary though member note risk might persist potentially undermine improvement labor market,0
319,2016-04-27,members also continued expect inflation remain low near term part earlier declines energy prices rise  percent medium term transitory effects declines energy import prices dissipated labor market strengthened further,member also continued expect inflation remain low near term part earlier decline energy price rise percent medium term transitory effect decline energy import price dissipate labor market strengthen far,0
320,2016-04-27,postmeeting statement rather stating global economic financial developments continued pose risks committee decided indicate would continue closely monitor inflation indicators global economic financial developments,postmeeting statement rather state global economic financial development continued pose risk committee decide indicate would continue closely monitor inflation indicator global economic financial development,0
321,2016-04-27,change language intended convey committee sense risks associated global developments diminished somewhat since march fomc meeting without characterizing overall balance risks,change language intend convey committee sense risk associate global development diminish somewhat since march fomc meeting without characterize overall balance risk,0
322,2016-04-27,backdrop discussion current conditions economic outlook risks uncertainties surrounding outlook committee decided maintain target range federal funds rate   percent meeting,backdrop discussion current condition economic outlook risk uncertainty surround outlook committee decide maintain target range federal fund rate percent meeting,0
323,2016-04-27,members generally agreed that light recent weak readings spending production inflation committee objective would prudent wait additional information bearing medium term outlook deciding whether raise target range federal funds rate,member generally agree that light recent weak reading spending production inflation committee objective would prudent wait additional information bearing medium term outlook decide whether raise target range federal fund rate,0
324,2016-04-27,one member however preferred raise target range federal funds rate meeting noting downside risks outlook diminished outlook outcomes consistent committee objectives,one member however prefer raise target range federal fund rate meeting note downside risk outlook diminish outlook outcome consistent committee objective,0
325,2016-04-27,members agreed that determining timing size future adjustments target range federal funds rate committee would assess realized expected economic conditions relative objectives maximum employment  percent inflation,member agree that determine timing size future adjustment target range federal fund rate committee would ass realize expect economic condition relative objective maximum employment percent inflation,0
326,2016-04-27,assessment would take account wide range information including measures labor market conditions indicators inflation pressures inflation expectations readings financial international developments,assessment would take account wide range information include measure labor market condition indicator inflation pressure inflation expectation reading financial international development,0
327,2016-04-27,light current shortfall inflation  percent committee agreed would carefully monitor actual expected progress toward inflation goal,light current shortfall inflation percent committee agree would carefully monitor actual expect progress toward inflation goal,0
328,2016-04-27,committee expected economic conditions would evolve manner would warrant gradual increases federal funds rate federal funds rate likely remain time levels expected prevail longer run,committee expect economic condition would evolve manner would warrant gradual increase federal fund rate federal fund rate likely remain time level expect prevail longer run,0
329,2016-04-27,regarding possibility adjustments stance policy next meeting members generally judged appropriate leave policy options open maintain flexibility make decision based incoming data developments shaped outlook labor market inflation well evolving assessments balance risks around outlook,regard possibility adjustment stance policy next meeting member generally judged appropriate leave policy option open maintain flexibility make decision base incoming data development shape outlook labor market inflation well evolve assessment balance risk around outlook,0
330,2016-04-27,noted communications could help public understand committee might respond incoming data developments upcoming intermeeting period,note communication could help public understand committee might respond incoming data development upcoming intermeeting period,0
331,2016-04-27,members expressed concern likelihood implied market pricing committee would increase target range federal funds rate june meeting might unduly low,member express concern likelihood imply market pricing committee would increase target range federal fund rate june meeting might unduly low,0
332,2016-04-27,committee also decided maintain existing policy reinvesting principal payments holdings agency debt agency mortgage backed securities agency mortgage backed securities rolling maturing treasury securities auction anticipated normalization level federal funds rate well way,committee also decide maintain exist policy reinvesting principal payment holding agency debt agency mortgage back security agency mortgage back security roll mature treasury security auction anticipate normalization level federal fund rate well way,0
333,2016-04-27,policy keeping committee holdings longer term securities sizable levels help maintain accommodative financial conditions,policy keep committee holding longer term security sizable level help maintain accommodative financial condition,0
334,2016-04-27,conclusion discussion committee voted authorize direct federal reserve bank new york instructed otherwise execute transactions soma accordance following domestic policy directive released,conclusion discussion committee vote authorize direct federal reserve bank new york instruct otherwise execute transaction soma accordance follow domestic policy directive release,0
335,2016-04-27,effective april   federal open market committee directs desk undertake open market operations necessary maintain federal funds rate target range   percent including overnight reverse repurchase operations and reverse repurchase operations maturities one day necessary accommodate weekend holiday similar trading conventions offering rate ,effective april federal open market committee directs desk undertake open market operation necessary maintain federal fund rate target range percent include overnight reverse repurchase operation and reverse repurchase operation maturity one day necessary accommodate weekend holiday similar trading convention offering rate,0
336,2016-04-27, percent amounts limited value treasury securities held outright system open market account available operations per counterparty limit  billion per day,percent amount limited value treasury security held outright system open market account available operation per counterparty limit billion per day,0
337,2016-04-27,committee directs desk continue rolling maturing treasury securities auction continue reinvesting principal payments agency debt agency mortgage backed securities agency mortgage backed securities,committee directs desk continue roll mature treasury security auction continue reinvesting principal payment agency debt agency mortgage back security agency mortgage back security,0
338,2016-04-27,committee also directs desk engage dollar roll coupon swap transactions necessary facilitate settlement federal reserve agency mortgage backed securities transactions,committee also directs desk engage dollar roll coupon swap transaction necessary facilitate settlement federal reserve agency mortgage back security transaction,0
339,2016-04-27,vote also encompassed approval statement released,vote also encompass approval statement release,0
340,2016-04-27,information received since federal open market committee met march indicates labor market conditions improved even growth economic activity appears slowed,information receive since federal open market committee met march indicates labor market condition improve even growth economic activity appear slow,0
341,2016-04-27,growth household spending moderated although households real income risen solid rate consumer sentiment remains high,growth household spending moderate although household real income risen solid rate consumer sentiment remains high,0
342,2016-04-27,since beginning year housing sector improved business fixed investment net exports soft,since begin year housing sector improve business fix investment net export soft,0
343,2016-04-27,range recent indicators including strong job gains points additional strengthening labor market,range recent indicator include strong job gain point additional strengthen labor market,0
344,2016-04-27,inflation continued run committee  percent longer run objective partly reflecting earlier declines energy prices falling prices non energy imports,inflation continued run committee percent longer run objective partly reflect earlier decline energy price fall price non energy import,0
345,2016-04-27,market based measures inflation compensation remain low survey based measures longer term inflation expectations little changed balance recent months,market base measure inflation compensation remain low survey base measure longer term inflation expectation little change balance recent month,0
346,2016-04-27,consistent statutory mandate committee seeks foster maximum employment price stability,consistent statutory mandate committee seek foster maximum employment price stability,0
347,2016-04-27,committee currently expects that gradual adjustments stance monetary policy economic activity expand moderate pace labor market indicators continue strengthen,committee currently expect that gradual adjustment stance monetary policy economic activity expand moderate pace labor market indicator continue strengthen,0
348,2016-04-27,inflation expected remain low near term part earlier declines energy prices rise  percent medium term transitory effects declines energy import prices dissipate labor market strengthens further,inflation expect remain low near term part earlier decline energy price rise percent medium term transitory effect decline energy import price dissipate labor market strengthens far,0
349,2016-04-27,committee continues closely monitor inflation indicators global economic financial developments,committee continue closely monitor inflation indicator global economic financial development,0
350,2016-04-27,backdrop committee decided maintain target range federal funds rate   percent,backdrop committee decide maintain target range federal fund rate percent,0
351,2016-04-27,stance monetary policy remains accommodative thereby supporting improvement labor market conditions return  percent inflation,stance monetary policy remains accommodative thereby support improvement labor market condition return percent inflation,0
352,2016-04-27,determining timing size future adjustments target range federal funds rate committee assess realized expected economic conditions relative objectives maximum employment  percent inflation,determine timing size future adjustment target range federal fund rate committee ass realize expect economic condition relative objective maximum employment percent inflation,0
353,2016-04-27,assessment take account wide range information including measures labor market conditions indicators inflation pressures inflation expectations readings financial international developments,assessment take account wide range information include measure labor market condition indicator inflation pressure inflation expectation reading financial international development,0
354,2016-04-27,light current shortfall inflation  percent committee carefully monitor actual expected progress toward inflation goal,light current shortfall inflation percent committee carefully monitor actual expect progress toward inflation goal,0
355,2016-04-27,committee expects economic conditions evolve manner warrant gradual increases federal funds rate federal funds rate likely remain time levels expected prevail longer run,committee expect economic condition evolve manner warrant gradual increase federal fund rate federal fund rate likely remain time level expect prevail longer run,0
356,2016-04-27,however actual path federal funds rate depend economic outlook informed incoming data,however actual path federal fund rate depend economic outlook inform incoming data,0
357,2016-04-27,committee maintaining existing policy reinvesting principal payments holdings agency debt agency mortgage backed securities agency mortgage backed securities rolling maturing treasury securities auction anticipates normalization level federal funds rate well way,committee maintain exist policy reinvesting principal payment holding agency debt agency mortgage back security agency mortgage back security roll mature treasury security auction anticipates normalization level federal fund rate well way,0
358,2016-04-27,policy keeping committee holdings longer term securities sizable levels help maintain accommodative financial conditions,policy keep committee holding longer term security sizable level help maintain accommodative financial condition,0
359,2016-04-27,voting action janet yellen william dudley lael brainard james bullard stanley fischer loretta mester jerome powell eric rosengren daniel tarullo,voting action janet yellen william dudley lael brainard james bullard stanley fischer loretta mester jerome powell eric rosengren daniel tarullo,0
360,2016-04-27,voting action esther george,voting action esther george,0
361,2016-04-27,ms george dissented believed  basis point increase target range federal funds rate appropriate meeting,m george dissent believe basis point increase target range federal fund rate appropriate meeting,0
362,2016-04-27,potential downside risks economic outlook diminished since march fomc meeting modal outlook economic growth employment inflation outcomes consistent committee statutory objectives,potential downside risk economic outlook diminish since march fomc meeting modal outlook economic growth employment inflation outcome consistent committee statutory objective,0
363,2016-04-27,believed monetary policy respond developments gradually removing accommodation noted several frameworks assessing appropriate stance monetary policy prescriptions various policy rules estimates equilibrium interest rates also suggested reduction monetary policy accommodation would appropriate,believe monetary policy respond development gradually remove accommodation note several framework assess appropriate stance monetary policy prescription various policy rule estimate equilibrium interest rate also suggest reduction monetary policy accommodation would appropriate,0
364,2016-04-27,consistent committee decision leave target range federal funds rate unchanged board governors took no action change interest rates reserves discount rates,consistent committee decision leave target range federal fund rate unchanged board governor take no action change interest rate reserve discount rate,0
365,2016-04-27,agreed next meeting committee would held tuesday wednesday june   ,agree next meeting committee would held tuesday wednesday june,0
366,2016-04-27,meeting adjourned april  ,meeting adjourn april,0
367,2016-04-27,notation vote notation vote completed april   committee unanimously approved minutes committee meeting held march   ,notation vote notation vote complete april committee unanimously approve minute committee meeting held march,0
368,2016-04-27,brian madigan secretary,brian madigan secretary,0
369,2016-04-27,federal open market committee referenced fomc committee minutes,federal open market committee reference fomc committee minute,0
370,2016-04-27,return text,return text,0
371,2016-04-27,attended discussion relationship monetary policy financial stability,attend discussion relationship monetary policy financial stability,0
372,2016-04-27,return text,return text,0
373,2016-04-27,attended tuesday session only,attend tuesday session only,0
374,2016-04-27,return text,return text,0
375,2016-04-27,board governors federal reserve system,board governor federal reserve system,0
