,Date,Original,Corpus,Class
130,2016-04-27,however payrolls state local governments increased first quarter nominal construction spending governments rose net first two months quarter,however payroll state local government increase first quarter nominal construction spending government rise net first two month quarter,0
131,2016-04-27,us international trade deficit widened february imports rose exports however preliminary data trade goods suggested deficit narrowed substantially march imports falling back sharply even exports declined,u international trade deficit widen february import rise export however preliminary data trade good suggest deficit narrow substantially march import fall back sharply even export decline,0
132,2016-04-27,large increases exports imports consumer goods february reversed march,large increase export import consumer good february reverse march,0
133,2016-04-27,also imports capital goods dropped sharply march increasing february,also import capital good drop sharply march increase february,0
134,2016-04-27,all recent data indicated net exports probably continued moderate drag real gdp growth first quarter,all recent data indicate net export probably continued moderate drag real gdp growth first quarter,0
135,2016-04-27,totals consumer prices measured pce price index increased  percent  months ending february partly restrained declines consumer energy prices,total consumer price measure pce price index increase percent month end february partly restrain decline consumer energy price,0
136,2016-04-27,core pce price inflation excludes changes food energy prices   percent  month period held part falling prices non energy imports pass declines energy prices prices goods services,core pce price inflation excludes change food energy price percent month period held part fall price non energy import pas decline energy price price good service,0
137,2016-04-27, months ending march total consumer prices measured consumer price index cpi rose  percent core cpi inflation   percent,month end march total consumer price measure consumer price index cpi rise percent core cpi inflation percent,0
138,2016-04-27,light cpi data total core pce price inflation  month basis appeared slow bit march,light cpi data total core pce price inflation month basis appear slow bit march,0
139,2016-04-27,survey measures longer run inflation expectations including michigan survey along desk survey primary dealers survey market participants generally little changed balance recent months although reading michigan survey early april low end historical range,survey measure longer run inflation expectation include michigan survey along desk survey primary dealer survey market participant generally little change balance recent month although reading michigan survey early april low end historical range,0
140,2016-04-27,recent indicators suggested foreign real gdp growth picked first quarter lackluster performance last year,recent indicator suggest foreign real gdp growth picked first quarter lackluster performance last year,0
141,2016-04-27,economic growth canada appeared rebounded weak fourth quarter,economic growth canada appear rebound weak fourth quarter,0
142,2016-04-27,recent data industrial production retail sales pointed pickup economic growth euro area,recent data industrial production retail sale point pickup economic growth euro area,0
143,2016-04-27,although weak economic performance persisted japan south america weakness appeared abated somewhat,although weak economic performance persist japan south america weakness appear abate somewhat,0
144,2016-04-27,contrast economic growth china moderated first quarter although economic indicators march upbeat earlier months year,contrast economic growth china moderate first quarter although economic indicator march upbeat earlier month year,0
145,2016-04-27,advanced foreign economies afes headline inflation remained low held earlier declines energy prices,advanced foreign economy afes headline inflation remain low held earlier decline energy price,0
146,2016-04-27,inflation generally running target rates economies monetary policies remained accommodative,inflation generally run target rate economy monetary policy remain accommodative,0
147,2016-04-27,contrast overall inflation emerging market economies emes rose first quarter largely reflecting increases inflation much latin america along increase inflation china driven higher food prices,contrast overall inflation emerge market economy emes rise first quarter largely reflect increase inflation much latin america along increase inflation china driven high food price,0
148,2016-04-27,staff review financial situation financial market conditions improved further balance intermeeting period investors appearing respond federal reserve communications viewed accommodative anticipated somewhat better expected incoming data foreign economic activity,staff review financial situation financial market condition improve far balance intermeeting period investor appear respond federal reserve communication view accommodative anticipate somewhat well expect incoming data foreign economic activity,0
149,2016-04-27,risk sentiment also appeared improve further net accompanied decline financial market volatility higher oil prices,risk sentiment also appear improve far net accompany decline financial market volatility high oil price,0
150,2016-04-27,domestic economic data releases period had balance limited effect asset prices,domestic economic data release period have balance limited effect asset price,0
151,2016-04-27,federal reserve communications following march fomc meeting interpreted market participants accommodative expected,federal reserve communication follow march fomc meeting interpret market participant accommodative expect,0
152,2016-04-27,particular investors attentive larger expected downward revisions projections federal funds rate fomc summary economic projections well references march fomc statement chair prepared remarks press conference riskss economic outlook stemming global economic financial developments,particular investor attentive large expect downward revision projection federal fund rate fomc summary economic projection well reference march fomc statement chair prepared remark press conference risk economic outlook stem global economic financial development,0
153,2016-04-27,meanwhile domestic data releases mixed elicited modest market reactions,meanwhile domestic data release mixed elicit modest market reaction,0
154,2016-04-27,net financial market quotes implied federal funds rate path expected investors flattened notably estimated probability rate hike june fomc meeting declined significantly,net financial market quote imply federal fund rate path expect investor flatten notably estimate probability rate hike june fomc meeting decline significantly,0
155,2016-04-27,survey market participants median investor modal path federal funds rate also moved substantially survey primary dealers median dealer modal path little changed,survey market participant median investor modal path federal fund rate also move substantially survey primary dealer median dealer modal path little change,0
156,2016-04-27,consistent flatter path federal funds rate implied market quotes yields nominal treasury securities maturities  years declined slightly period since march fomc meeting,consistent flatter path federal fund rate imply market quote yield nominal treasury security maturity year decline slightly period since march fomc meeting,0
157,2016-04-27,measures inflation compensation based treasury inflation protected securities increased somewhat remained low levels,measure inflation compensation base treasury inflation protect security increase somewhat remain low level,0
158,2016-04-27,credit conditions municipal bond markets continued stable even situation facing puerto rico creditors deteriorated further,credit condition municipal bond market continued stable even situation face puerto rico creditor deteriorate far,0
159,2016-04-27,intermeeting period broads equity price indexes moved up net likely investors views monetary policy would accommodative previously expected along improvement risk sentiment,intermeeting period broad equity price index move up net likely investor view monetary policy would accommodative previously expect along improvement risk sentiment,0
160,2016-04-27,stock prices increased broadly across industries including energy sector,stock price increase broadly across industry include energy sector,0
161,2016-04-27,one month ahead implied volatility index vix moved ended period historical median,one month ahead imply volatility index vix move end period historical median,0
162,2016-04-27,spreads  year corporate bond yields yields comparable maturity treasury securities triple rated speculative grade issuers declined balance remained levels near high end ranges since  outlook corporate earnings deteriorated somewhat period,spread year corporate bond yield yield comparable maturity treasury security triple rat speculative grade issuer decline balance remain level near high end range since outlook corporate earnings deteriorate somewhat period,0
163,2016-04-27,light available earnings reports companies index along equity analysts forecasts companies not yet issued reports corporate earnings first quarter appeared decreased markedly relative previous quarter,light available earnings report company index along equity analyst forecast company not yet issue report corporate earnings first quarter appear decrease markedly relative previous quarter,0
164,2016-04-27,financing conditionss nonfinancial businesses remained generally accommodative investment grade issuers speculative grade firms improved somewhat showing strains earlier year,financing conditions nonfinancial business remain generally accommodative investment grade issuer speculative grade firm improve somewhat show strain earlier year,0
165,2016-04-27,corporate bond issuance speculative grade firms rebounded march sluggish pace january february,corporate bond issuance speculative grade firm rebound march sluggish pace january february,0
166,2016-04-27,growth commercial industrial ci loans banks books remained strong continued driven lending investment grade borrowers large banks,growth commercial industrial ci loan bank book remain strong continued driven lending investment grade borrower large bank,0
167,2016-04-27,nonetheless according recent senior loan officer opinion survey bank lending practices sloos balance banks tightened lending standardsloans large middle market firms first quarter demand loans weakened,nonetheless accord recent senior loan officer opinion survey bank lending practice sloos balance bank tighten lending standardsloans large middle market firm first quarter demand loan weaken,0
168,2016-04-27,sloos indicated banks expected increase year delinquencies charge offs existing loans firms energy sector banks also noted deterioration credit quality loans non energy businesses locateds regions dependent energy sector,sloos indicate bank expect increase year delinquency charge offs exist loan firm energy sector bank also note deterioration credit quality loan non energy business locateds region dependent energy sector,0
169,2016-04-27,significant number sloos respondents reported tightening lending standards major categories commercial real estate cre loans first quarter,significant number sloos respondent report tighten lending standard major category commercial real estate cre loan first quarter,0
170,2016-04-27,however demand cre loans reportedly strengthened cre loans banks books continued grow robust pace first quarter,however demand cre loan reportedly strengthen cre loan bank book continued grow robust pace first quarter,0
171,2016-04-27,response wider volatile spreads commercial mortgage backed securities cmbs since summer  cmbs issuance subdued first quarter consistent reports banks sloos,response wider volatile spread commercial mortgage back security cmb since summer cmb issuance subdue first quarter consistent report bank sloos,0
172,2016-04-27,intermeeting period cmbs spreads narrowed markedly remained elevated,intermeeting period cmb spread narrow markedly remain elevate,0
173,2016-04-27,growth residential real estate rre loans banks books continued low first quarter credit conditions stayed tight mortgage borrowers low credit scores hard document income relatively high debt income ratios,growth residential real estate rre loan bank book continued low first quarter credit condition stayed tight mortgage borrower low credit score hard document income relatively high debt income ratio,0
174,2016-04-27,significant number sloos respondents reportedly eased lending standards residential mortgages eligible purchase government sponsored enterprises significant number also experienced stronger demand overall rre loans first quarter,significant number sloos respondent reportedly ease lending standard residential mortgage eligible purchase government sponsor enterprise significant number also experienced strong demand overall rre loan first quarter,0
175,2016-04-27,intermeeting period rates  year fixed rate mortgages well qualified borrowers edged line yields mortgage backed securities comparable duration treasury securities near time lows end period,intermeeting period rate year fix rate mortgage well qualify borrower edge line yield mortgage back security comparable duration treasury security near time low end period,0
176,2016-04-27,financing conditions consumer credit markets little changed remained largely accommodative first quarter student auto loans continuing broadly available,financing condition consumer credit market little change remain largely accommodative first quarter student auto loan continue broadly available,0
177,2016-04-27,credit card lending conditions still relatively tight particularly borrowers subprime credit scores,credit card lending condition still relatively tight particularly borrower subprime credit score,0
178,2016-04-27,responses sloos indicated first quarter credit card lending standards little changed modest number banks eased standards auto consumer loans,response sloos indicate first quarter credit card lending standard little change modest number bank ease standard auto consumer loan,0
179,2016-04-27,period demand auto loans reportedly strengthened many banks,period demand auto loan reportedly strengthen many bank,0
180,2016-04-27,consumer loan balances continued increase robust pace february data bank lending activities suggested growth march,consumer loan balance continued increase robust pace february data bank lending activity suggest growth march,0
181,2016-04-27,issuance asset backed securities continued strong first quarter,issuance asset back security continued strong first quarter,0
182,2016-04-27,spreads securities remained levels bit higher usual,spread security remain level bit high usual,0
183,2016-04-27,since march fomc meeting foreign financial market conditions eased net overall risk sentiment appeared improved,since march fomc meeting foreign financial market condition ease net overall risk sentiment appear improve,0
184,2016-04-27,number factors likely contributed improvement including expectations accommodative monetary policy united states,number factor likely contribute improvement include expectation accommodative monetary policy united state,0
185,2016-04-27,sentiment also likely boosted release generally favorable foreign economic data,sentiment also likely boost release generally favorable foreign economic data,0
186,2016-04-27,backdrop stock prices rose countries equity indexes emes outperforming afes,backdrop stock price rise country equity index emes outperform afes,0
187,2016-04-27,changes longer term yields afes mixed ten year sovereign yields decreased slightly germany japan increased canada united kingdom,change longer term yield afes mixed ten year sovereign yield decrease slightly germany japan increase canada united kingdom,0
188,2016-04-27,foreign exchange value dollar depreciated currencies part higher oil prices supported currencies oil exporters,foreign exchange value dollar depreciate currency part high oil price support currency oil exporter,0
189,2016-04-27,latest report potential risks stabilitys financial system staff continued judge vulnerabilities moderate overall,late report potential risk stability financial system staff continued judge vulnerability moderate overall,0
190,2016-04-27,particular leverage maturity transformation financial sector subdued relative historical levels growth aggregate private nonfinancial sector credit modest,particular leverage maturity transformation financial sector subdue relative historical level growth aggregate private nonfinancial sector credit modest,0
191,2016-04-27,indicators suggested financial system fairly resilient absence significant increase funding stresses margin calls earlier year prices risky assets fell volatility rose sharply,indicator suggest financial system fairly resilient absence significant increase funding stress margin call earlier year price risky asset fell volatility rise sharply,0
192,2016-04-27,since then prices risky assets rebounded notably valuation pressures rose somewhat,since then price risky asset rebound notably valuation pressure rise somewhat,0
193,2016-04-27,term premiums remained low cre valuations elevated,term premium remain low cre valuation elevate,0
194,2016-04-27,addition corporate debt positions high although issuance low rated debt slowed,addition corporate debt position high although issuance low rat debt slow,0
195,2016-04-27,staff economic outlooks economic forecast prepared staff april fomc meeting real gdp growth first quarter year estimated much slower forecast prepared march meeting although projected real gdp growth second quarter revised little,staff economic outlook economic forecast prepared staff april fomc meeting real gdp growth first quarter year estimate much slow forecast prepared march meeting although project real gdp growth second quarter revise little,0
196,2016-04-27,beyond near term real gdp expected increase slightly faster previous forecast largely reflecting somewhat higher projected trajectory equity prices lower assumed paths longer term interest rates foreign exchange value dollar,beyond near term real gdp expect increase slightly faster previous forecast largely reflect somewhat high project trajectory equity price low assume path longer term interest rate foreign exchange value dollar,0
197,2016-04-27,staff continued project real gdp would expand modestly faster pace potential output   supported primarily increases consumer spending,staff continued project real gdp would expand modestly faster pace potential output support primarily increase consumer spending,0
198,2016-04-27,unemployment rate expected gradually decline run somewhat staff estimate longer run natural rate period,unemployment rate expect gradually decline run somewhat staff estimate longer run natural rate period,0
199,2016-04-27,staff forecast inflation little changed previous projection,staff forecast inflation little change previous projection,0
200,2016-04-27,staff continued project inflation would increase next several years energy prices prices non energy imports expected begin steadily rising year inflation still projected slightly committee longer run objective  percent ,staff continued project inflation would increase next several year energy price price non energy import expect begin steadily rise year inflation still project slightly committee longer run objective percent,0
201,2016-04-27,staff viewed uncertainty around april projections real gdp growth unemployment rate inflation similar average past  years,staff view uncertainty around april projection real gdp growth unemployment rate inflation similar average past year,0
202,2016-04-27,risks forecast real gdp seen tilted downside reflecting staff assessment neither monetary fiscal policy well positioned help economy withstand substantial adverse shocks,risk forecast real gdp see tilt downside reflect staff assessment neither monetary fiscal policy well position help economy withstand substantial adverse shock,0
203,2016-04-27,addition recent improvements global financial economic conditions downside risks forecast developments abroad though smaller remained,addition recent improvement global financial economic condition downside risk forecast development abroad though small remain,0
204,2016-04-27,consistent downside risk aggregate demand staff viewed risks outlook unemployment rate skewed upside,consistent downside risk aggregate demand staff view risk outlook unemployment rate skewed upside,0
205,2016-04-27,risks projection inflation still judged weighted downside reflecting possibility longer term inflation expectations may edged down,risk projection inflation still judged weight downside reflect possibility longer term inflation expectation may edge down,0
206,2016-04-27,participants views current conditions economic outlook discussion economic situation outlook meeting participants agreed information received intermeeting period indicated labor market conditions improved even growth economic activity appeared slowed,participant view current condition economic outlook discussion economic situation outlook meeting participant agree information receive intermeeting period indicate labor market condition improve even growth economic activity appear slow,0
207,2016-04-27,growth household spending moderated although households real income risen solid rate consumer sentiment remained high,growth household spending moderate although household real income risen solid rate consumer sentiment remain high,0
208,2016-04-27,since beginning year housing sector improved further business fixed investment net exports soft,since begin year housing sector improve far business fix investment net export soft,0
209,2016-04-27,range indicators including strong job gains pointed additional strengthening labor market,range indicator include strong job gain point additional strengthen labor market,0
210,2016-04-27,inflation continued run committee  percent longer run objective partly reflecting earlier declines energy prices falling prices non energy imports,inflation continued run committee percent longer run objective partly reflect earlier decline energy price fall price non energy import,0
211,2016-04-27,market based measures inflation compensation remained low survey based measures longer run inflation expectations little changed balance recent months,market base measure inflation compensation remain low survey base measure longer run inflation expectation little change balance recent month,0
212,2016-04-27,domestic global financial conditions eased intermeeting period incoming news foreign economic outlook generally positive investor sentiment improved,domestic global financial condition ease intermeeting period incoming news foreign economic outlook generally positive investor sentiment improve,0
213,2016-04-27,although incoming data suggested aggregate spending first quarter weaker expected participants continued anticipate economic activity would expand moderate pace medium term labor market indicators would continue strengthen,although incoming data suggest aggregate spending first quarter weaker expect participant continued anticipate economic activity would expand moderate pace medium term labor market indicator would continue strengthen,0
214,2016-04-27,inflation expected remain low near term part earlier declines energy prices rise  percent medium term transitory effects declines energy import prices dissipated labor market strengthened further,inflation expect remain low near term part earlier decline energy price rise percent medium term transitory effect decline energy import price dissipate labor market strengthen far,0
215,2016-04-27,participants generally saw risks stemming global economic financial developments diminished intermeeting period continuing warrant close monitoring,participant generally saw risk stem global economic financial development diminish intermeeting period continue warrant close monitoring,0
216,2016-04-27,participants indicated assessments medium term economic outlook not changed materially since march discussed number factors suggesting apparent softness spending first quarter unlikely persist,participant indicate assessment medium term economic outlook not change materially since march discuss number factor suggest apparent softness spending first quarter unlikely persist,0
217,2016-04-27,pointed steady improvement labor market indicator underlying pace economic activity likely not deteriorated much suggested recent data spending production,point steady improvement labor market indicator underlie pace economic activity likely not deteriorate much suggest recent data spending production,0
218,2016-04-27,notably solid job gains real income growth along high level household wealth relatively upbeat consumer sentiment expected support pickup consumer spending slowdown first quarter,notably solid job gain real income growth along high level household wealth relatively upbeat consumer sentiment expect support pickup consumer spending slowdown first quarter,0
219,2016-04-27,addition easing financial conditions recent months anticipated provide support consumer spending business investment going forward,addition ease financial condition recent month anticipate provide support consumer spending business investment go forward,0
