,Date,Original,Corpus,Class
0,2020-09-16,federal reserve central bank united states provides nation safe flexible stable monetary financial system,federal reserve central bank united state provide nation safe flexible stable monetary financial system,0
1,2020-09-16,federal open market committee,federal open market committee,0
2,2020-09-16,monetary policy principles practice,monetary policy principle practice,0
3,2020-09-16,policy implementation,policy implementation,0
4,2020-09-16,reports,report,0
5,2020-09-16,review monetary policy strategy tools communications,review monetary policy strategy tool communication,0
6,2020-09-16,institution supervision,institution supervision,0
7,2020-09-16,reports,report,0
8,2020-09-16,reporting forms,reporting form,0
9,2020-09-16,supervision  regulation letters,supervision regulation letter,0
10,2020-09-16,banking applications  legal developments,banking application legal development,0
11,2020-09-16,regulatory resources,regulatory resource,0
12,2020-09-16,banking  data structure,banking data structure,0
13,2020-09-16,regulations  statutes,regulation statute,0
14,2020-09-16,payment policies,payment policy,0
15,2020-09-16,reserve bank payment services  data,reserve bank payment service data,0
16,2020-09-16,financial market utilities  infrastructures,financial market utility infrastructure,0
17,2020-09-16,research committees forums,research committee forum,0
18,2020-09-16,working papers notes,work paper note,0
19,2020-09-16,models tools,model tool,0
20,2020-09-16,bank assets liabilities,bank asset liability,0
21,2020-09-16,bank structure data,bank structure data,0
22,2020-09-16,business finance,business finance,0
23,2020-09-16,dealer financing terms,dealer financing term,0
24,2020-09-16,exchange rates international data,exchange rate international data,0
25,2020-09-16,financial accounts,financial account,0
26,2020-09-16,household finance,household finance,0
27,2020-09-16,industrial activity,industrial activity,0
28,2020-09-16,interest rates,interest rate,0
29,2020-09-16,micro data reference manual mdrm,micro data reference manual mdrm,0
30,2020-09-16,money stock reserve balances,money stock reserve balance,0
31,2020-09-16,regulations,regulation,0
32,2020-09-16,supervision  enforcement,supervision enforcement,0
33,2020-09-16,community development,community development,0
34,2020-09-16,research  analysis,research analysis,0
35,2020-09-16,consumer resources,consumer resource,0
36,2020-09-16,september  ,september,0
37,2020-09-16,joint meeting federal open market committee board governors held videoconference tuesday september   continued wednesday september   m,joint meeting federal open market committee board governor held videoconference tuesday september continued wednesday september m,0
38,2020-09-16,present jerome powell chair john williams vice chair michelle bowman lael brainard richard clarida patrick harker robert kaplan neel kashkari loretta mester randal quarles,present jerome powell chair john williams vice chair michelle bowman lael brainard richard clarida patrick harker robert kaplan neel kashkari loretta mester randal quarles,0
39,2020-09-16,thomas barkin raphael bostic mary daly charles evans michael strine alternate members federal open market committee,thomas barkin raphael bostic mary daly charles evans michael strine alternate member federal open market committee,0
40,2020-09-16,james bullard esther george eric rosengren presidents federal reserve banks st louis kansas city boston respectively,james bullard esther george eric rosengren president federal reserve bank st louis kansa city boston respectively,0
41,2020-09-16,james clouse secretary matthew luecke deputy secretary michelle smith assistant secretary mark van der weide general counsel michael held deputy general counsel stacey tevlin economist beth anne wilson economist,james clouse secretary matthew luecke deputy secretary michelle smith assistant secretary mark van der weide general counsel michael held deputy general counsel stacey tevlin economist beth anne wilson economist,0
42,2020-09-16,shaghil ahmed michael dotsey marc giannoni trevor reeve ellis tallman william wascher markj wright associate economists,shaghil ahmed michael dotsey marc giannoni trevor reeve elli tallman william wascher markj wright associate economist,0
43,2020-09-16,lorie logan manager system open market account,lorie logan manager system open market account,0
44,2020-09-16,ann misback secretary office secretary board governors,ann misback secretary office secretary board governor,0
45,2020-09-16,matthew eichner director division reserve bank operations payment systems board governors michael gibson director division supervision regulation board governors andreas lehnert director division financial stability board governors,matthew eichner director division reserve bank operation payment system board governor michael gibson director division supervision regulation board governor andreas lehnert director division financial stability board governor,0
46,2020-09-16,sally davies brian doyle deputy directors division international finance board governors rochelle edge deputy director division monetary affairs board governors michael kiley deputy director division financial stability board governors,sally davy brian doyle deputy director division international finance board governor rochelle edge deputy director division monetary affair board governor michael kiley deputy director division financial stability board governor,0
47,2020-09-16,jon faust senior special adviser chair division board members board governors,jon faust senior special adviser chair division board member board governor,0
48,2020-09-16,joshua gallin special adviser chair division board members board governors,joshua gallin special adviser chair division board member board governor,0
49,2020-09-16,william bassett antulio bomfim wendy dunn ellen meade chiara scotti ivan vidangos special advisers board division board members board governors,william bassett antulio bomfim wendy dunn ellen meade chiara scotti ivan vidangos special adviser board division board member board governor,0
50,2020-09-16,linda robertson assistant board division board members board governors,linda robertson assistant board division board member board governor,0
51,2020-09-16,david bowman senior associate director division monetary affairs board governors eric engen diana hancock john stevens senior associate directors division research statistics board governors,david bowman senior associate director division monetary affair board governor eric engen diana hancock john stevens senior associate director division research statistic board governor,0
52,2020-09-16,jeremy rudd senior adviser division research statistics board governors,jeremy rudd senior adviser division research statistic board governor,0
53,2020-09-16,glenn follette associate director division research statistics board governors david lpez salido associate director division monetary affairs board governors,glenn follette associate director division research statistic board governor david lpez salido associate director division monetary affair board governor,0
54,2020-09-16,christopher gust deputy associate director division monetary affairs board governors john roberts deputy associate director division research statistics board governors jeffrey walker deputy associate director division reserve bank operations payment systems board governors,christopher gust deputy associate director division monetary affair board governor john robert deputy associate director division research statistic board governor jeffrey walker deputy associate director division reserve bank operation payment system board governor,0
55,2020-09-16,brian bonis laura lipscomb assistant directors division monetary affairs board governors,brian bonis laura lipscomb assistant director division monetary affair board governor,0
56,2020-09-16,penelope beattie section chief office secretary board governors dana burnett felicia ionescu section chiefs division monetary affairs board governors,penelope beattie section chief office secretary board governor dana burnett felicia ionescu section chief division monetary affair board governor,0
57,2020-09-16,mark carlson senior economic project manager division monetary affairs board governors,mark carlson senior economic project manager division monetary affair board governor,0
58,2020-09-16,david small project manager division monetary affairs board governors,david small project manager division monetary affair board governor,0
59,2020-09-16,michele cavallo jonathan goldberg kurt lewis principal economists division monetary affairs board governors,michele cavallo jonathan goldberg kurt lewis principal economist division monetary affair board governor,0
60,2020-09-16,randall williams senior information manager division monetary affairs board governors,randall williams senior information manager division monetary affair board governor,0
61,2020-09-16,meredith black first vice president federal reserve bank dallas,meredith black first vice president federal reserve bank dallas,0
62,2020-09-16,david altig kartik athreya joseph gruber sylvain leduc anna paulson daleep singh christopher waller executive vice presidents federal reserve banks atlanta richmond kansas city san francisco chicago new york st louis respectively,david altig kartik athreya joseph gruber sylvain leduc anna paulson daleep singh christopher waller executive vice president federal reserve bank atlanta richmond kansa city san francisco chicago new york st louis respectively,0
63,2020-09-16,argia sbordone patricia zobel vice presidents federal reserve bank new york,argia sbordone patricia zobel vice president federal reserve bank new york,0
64,2020-09-16,jenny tang senior economic policy advisor federal reserve bank boston,jenny tang senior economic policy advisor federal reserve bank boston,0
65,2020-09-16,opening remarks chair vice chair williams governor clarida opened meeting remarks memory thomas laubach,opening remark chair vice chair williams governor clarida open meeting remark memory thomas laubach,0
66,2020-09-16,chair powell,chair powell,0
67,2020-09-16,thomas unquestionably one great economic minds generation research central biggest discussions policy actions past several years,thomas unquestionably one great economic mind generation research central big discussion policy action past several year,0
68,2020-09-16,rare underappreciated gift translating arcane academic theory real world practice,rare underappreciated gift translate arcane academic theory real world practice,0
69,2020-09-16,ability made real difference conduct communication monetary policy,ability make real difference conduct communication monetary policy,0
70,2020-09-16,work balance sheet leading steering committee monetary policy review thomas laubach intellectual fingerprints committee decisions define era federal reserve,work balance sheet lead steer committee monetary policy review thomas laubach intellectual fingerprint committee decision define era federal reserve,0
71,2020-09-16,thomas also exceptional colleague leader friend,thomas also exceptional colleague leader friend,0
72,2020-09-16,no one surprised know condolences pour in admiration kindness equanimity match not exceed esteem intellect,no one surprised know condolence pour in admiration kindness equanimity match not exceed esteem intellect,0
73,2020-09-16,thomas model leadership fiercely believed every member team critical collective success made certain knew it,thomas model leadership fiercely believe every member team critical collective success make certain knew it,0
74,2020-09-16,even battled health problems working treatment help fight economic fallout global pandemic concern lay others,even battle health problem work treatment help fight economic fallout global pandemic concern lay others,0
75,2020-09-16,amid deluge emergency work fight historic downturn upending daily life thomas urged people take care families first,amid deluge emergency work fight historic downturn upend daily life thomas urge people take care family first,0
76,2020-09-16,testament mutual respect amity thomas team proposed tealbook dedication memory,testament mutual respect amity thomas team propose tealbook dedication memory,0
77,2020-09-16,friends colleagues collaborators grieve loss,friend colleague collaborator grieve loss,0
78,2020-09-16,absence leaves space cannot truly filled,absence leaf space can not truly fill,0
79,2020-09-16,miss thomas laubach intellect insight,miss thomas laubach intellect insight,0
80,2020-09-16,importantly miss thomas laubach,importantly miss thomas laubach,0
81,2020-09-16,vice chair williams,vice chair williams,0
82,2020-09-16,thomas started working together  years ago,thomas start work together year ago,0
83,2020-09-16,arrived board kansas city fed returned stint council economic advisers,arrive board kansa city fed return stint council economic adviser,0
84,2020-09-16,truly serendipitous,truly serendipitous,0
85,2020-09-16,immediately recognized shared interest figuring estimate thing called natural rate interest,immediately recognize share interest figure estimate thing call natural rate interest,0
86,2020-09-16,importantly thomas expert kalman filtering,importantly thomas expert kalman filter,0
87,2020-09-16,races project,race project,0
88,2020-09-16,ironically given subsequent events question time whether productivity boom driven higher,ironically give subsequent event question time whether productivity boom driven high,0
89,2020-09-16,fact go back december  memo first memo board original estimates   percent real not nominal,fact go back december memo first memo board original estimate percent real not nominal,0
90,2020-09-16,  percent nominal,percent nominal,0
91,2020-09-16,days,day,0
92,2020-09-16,jumping ahead  years following appointment director monetary affairs thomas would frequently earnestly ask could effective role adviser fomc,jumping ahead year follow appointment director monetary affair thomas would frequently earnestly ask could effective role adviser fomc,0
93,2020-09-16,iremind committee times compared herd cats,iremind committee time compare herd cat,0
94,2020-09-16,always looking ways raise game hopefully ours help committee grapple issues decisions us,always look way raise game hopefully ours help committee grapple issue decision u,0
95,2020-09-16,sometimes effort led briefings labyrinth charts figures thomas heroically tried make sense summary economic projections sep projections implicit policy rule must embedded looked hard enough,sometimes effort lead briefing labyrinth chart figure thomas heroically try make sense summary economic projection sep projection implicit policy rule must embed look hard enough,0
96,2020-09-16,goes without saying everything makes sense factor,go without say everything make sense factor,0
97,2020-09-16,role trusted adviser never display important framework review chair powell commented,role trust adviser never display important framework review chair powell comment,0
98,2020-09-16,thomas focused making sure committee prepared best information analysis,thomas focus make sure committee prepared best information analysis,0
99,2020-09-16,consistently moved us towards goal line even engaged complex range issues dealt effects pandemic,consistently move u towards goal line even engage complex range issue dealt effect pandemic,0
100,2020-09-16,scrupulously played role honest broker throughout,scrupulously played role honest broker throughout,0
101,2020-09-16,indeed perfected formula herding cats,indeed perfect formula herd cat,0
102,2020-09-16,one part keen intellect dollop understated humor big helping patience perseverance,one part keen intellect dollop understated humor big help patience perseverance,0
103,2020-09-16,governor clarida,governor clarida,0
104,2020-09-16,thomas laubach remarkable human happened world class economist,thomas laubach remarkable human happen world class economist,0
105,2020-09-16,passing last week represents course incalculable loss family also devastating blow felt every one us federal reserve system indeed major central banks around world frequently visited,passing last week represent course incalculable loss family also devastate blow felt every one u federal reserve system indeed major central bank around world frequently visit,0
106,2020-09-16,arrived board knew thomas primarily research,arrive board knew thomas primarily research,0
107,2020-09-16,book inflation targeting ben bernanke rick mishkin adam posen classic reference subject work president williams,book inflation target ben bernanke rick mishkin adam posen classic reference subject work president williams,0
108,2020-09-16,would say thomas talent picking co authors,would say thomas talent pick co author,0
109,2020-09-16,thomas first met phd student working book visiting new york fed,thomas first met phd student work book visit new york fed,0
110,2020-09-16,remember well first meeting  years ago struck thomas enthusiasm brought economics graduate student,remember well first meeting year ago struck thomas enthusiasm brought economics graduate student,0
111,2020-09-16,thomas course never lost spark joy practice monetary policy fortunate not,thomas course never lose spark joy practice monetary policy fortunate not,0
112,2020-09-16,iandsure chair powell him chair yellentrusted implicitly,iandsure chair powell him chair yellentrusted implicitly,0
113,2020-09-16,speaking myself always sought insight advice privately office counsel big policy decisionsve consider two years vice chair,speak myself always sought insight advice privately office counsel big policy decisionsve consider two year vice chair,0
114,2020-09-16,thomas made everyone worked better inspired put forth best energy effort achieve larger goals,thomas make everyone work well inspire put forth best energy effort achieve large goal,0
115,2020-09-16,certainly case framework review ill second vice chair williams chair powell said,certainly case framework review ill second vice chair williams chair powell say,0
116,2020-09-16,thomas brought peerless leadership energy commitment entire framework review,thomas brought peerless leadership energy commitment entire framework review,0
117,2020-09-16,simply would not achieved evolution framework strategy without thomas insight inspiration good judgment brought project ambitious process designed worked us implement,simply would not achieve evolution framework strategy without thomas insight inspiration good judgment brought project ambitious process design work u implement,0
118,2020-09-16,understand thomas last days able watch chair speech jackson hole rolling new framework proud part wall street journal called landmark changes monetary policy,understand thomas last day able watch chair speech jackson hole roll new framework proud part wall street journal call landmark change monetary policy,0
119,2020-09-16,isure speak us conclude saying proud privilege working thomas laubach  years fed,isure speak u conclude say proud privilege work thomas laubach year fed,0
120,2020-09-16,deeply missed spirit inspiration us endure,deeply miss spirit inspiration u endure,0
121,2020-09-16,developments financial markets open market operations system open market account soma manager first discussed developments financial markets,development financial market open market operation system open market account soma manager first discuss development financial market,0
122,2020-09-16,net financial conditions eased intermeeting period,net financial condition ease intermeeting period,0
123,2020-09-16,equity prices rose broad dollar continued depreciate crisis driven peak march,equity price rise broad dollar continued depreciate crisis driven peak march,0
124,2020-09-16,yields treasury inflation protected securities fell longer dated nominal treasury yields increased modestly,yield treasury inflation protect security fell longer date nominal treasury yield increase modestly,0
125,2020-09-16,market participants attributed developments stronger economic outlook better news covid  trajectory better feared corporate earnings reports accommodative policy,market participant attribute development strong economic outlook well news covid trajectory well fear corporate earnings report accommodative policy,0
126,2020-09-16,backdrop respondents open market desk survey primary dealers survey market participants perceived downside riskss gross domestic product gdp growth year declined notably since july survey forecasts overall growth  revised significantly,backdrop respondent open market desk survey primary dealer survey market participant perceive downside risk gross domestic product gdp growth year decline notably since july survey forecast overall growth revise significantly,0
127,2020-09-16,economic outlook brightened market participants continued see significant risks ahead,economic outlook brighten market participant continued see significant risk ahead,0
128,2020-09-16,noted concerns elevated asset valuations certain sectors,note concern elevate asset valuation certain sector,0
129,2020-09-16,many also cited geopolitical events heightening uncertainty,many also cite geopolitical event heighten uncertainty,0
130,2020-09-16,addition forecasters assuming additional pandemic related fiscal package would approved year noted that absent new package growth could decelerate faster expected pace fourth quarter,addition forecaster assume additional pandemic related fiscal package would approve year note that absent new package growth could decelerate faster expect pace fourth quarter,0
131,2020-09-16,light risks well ongoing pandemic market participants continued suggest supportive policy environment backstops market functioning remained important stabilizers,light risk well ongoing pandemic market participant continued suggest supportive policy environment backstop market function remain important stabilizer,0
132,2020-09-16,release revised statement longer run goals monetary policy strategy consensus statement elicited relatively modest immediate reaction across markets,release revise statement longer run goal monetary policy strategy consensus statement elicit relatively modest immediate reaction across market,0
133,2020-09-16,however market participants generally viewed completion review important milestone many indicated growing expectations committee adopt flexible average inflation targeting regime influenced asset prices recent months,however market participant generally view completion review important milestone many indicate grow expectation committee adopt flexible average inflation target regime influence asset price recent month,0
134,2020-09-16,particular expectations viewed contributing recent rise far forward measures inflation compensation though market participants noted measures still somewhat low historical standards,particular expectation view contribute recent rise far forward measure inflation compensation though market participant note measure still somewhat low historical standard,0
135,2020-09-16,market participants continued anticipate committee would update forward guidance federal funds rate,market participant continued anticipate committee would update forward guidance federal fund rate,0
136,2020-09-16,respondents desk surveys continued indicate expected fomc adopt outcome based forward guidance linked inflation noted employment measures could part forward guidance well,respondent desk survey continued indicate expect fomc adopt outcome base forward guidance link inflation note employment measure could part forward guidance well,0
137,2020-09-16,survey respondents expectations economic conditions would prevail fomc first lifted target range shifted notably since previous survey many respondents projecting somewhat higher inflation lower unemployment july,survey respondent expectation economic condition would prevail fomc first lift target range shift notably since previous survey many respondent project somewhat high inflation low unemployment july,0
138,2020-09-16,expectations asset purchases year remained tightly centered around current pace however many survey respondents revised amount asset purchases expected  ,expectation asset purchase year remain tightly center around current pace however many survey respondent revise amount asset purchase expect,0
139,2020-09-16,manager turned next discussion funding market conditions open market operations period,manager turn next discussion funding market condition open market operation period,0
140,2020-09-16,conditions short term dollar funding markets remained stable period,condition short term dollar funding market remain stable period,0
141,2020-09-16,overnight secured unsecured rates continued trade narrow ranges near interest excess reserves rate,overnight secure unsecured rate continued trade narrow range near interest excess reserve rate,0
142,2020-09-16,forward measures funding rates implied conditions expected remain stable coming months,forward measure funding rate imply condition expect remain stable come month,0
143,2020-09-16,markets treasury securities agency mortgage backed securities mbs continued function smoothly bid ask spreads range indicators remaining near pre pandemic levels,market treasury security agency mortgage back security mb continued function smoothly bid ask spread range indicator remain near pre pandemic level,0
144,2020-09-16,indicators functioning market agency commercial mortgage backed securities cmbs also remained stable,indicator function market agency commercial mortgage back security cmb also remain stable,0
145,2020-09-16,light improved conditions staff proposed desk no longer required increase agency cmbs holdings reinvest principal payments agency cmbs,light improve condition staff propose desk no longer require increase agency cmb holding reinvest principal payment agency cmb,0
