,Date,Original,Corpus,Class
342,2020-09-16,accordingly participants agreed would appropriate incorporate key elements revised consensus statement fomc statement released following meeting,accordingly participant agree would appropriate incorporate key element revise consensus statement fomc statement release follow meeting,0
343,2020-09-16,particular participants reiterated commitment achieve maximum employment inflation rate  percent longer run,particular participant reiterate commitment achieve maximum employment inflation rate percent longer run,0
344,2020-09-16,inflation running persistently longer run goal participants judged would appropriate aim achieve inflation moderately  percent time inflation would average  percent time longer term inflation expectations would remain well anchored  percent,inflation run persistently longer run goal participant judged would appropriate aim achieve inflation moderately percent time inflation would average percent time longer term inflation expectation would remain well anchor percent,0
345,2020-09-16,backdrop participants discussed range issues associated providing greater clarity likely path federal funds rate years ahead,backdrop participant discuss range issue associate provide great clarity likely path federal fund rate year ahead,0
346,2020-09-16,participants supported providing explicit outcome based forward guidance federal funds rate included establishing criteria lifting federal funds rate elb terms paths employment inflation both,participant support provide explicit outcome base forward guidance federal fund rate include establish criterion lift federal fund rate elb term path employment inflation both,0
347,2020-09-16,among participants favored providing explicit forward guidance meeting couple supported formulation forward guidance included language indicating would likely appropriate maintain current target range labor market conditions judged consistent committee assessments maximum employment inflation risen  percent track moderately exceed  percent time,among participant favor provide explicit forward guidance meeting couple support formulation forward guidance include language indicate would likely appropriate maintain current target range labor market condition judged consistent committee assessment maximum employment inflation risen percent track moderately exceed percent time,0
348,2020-09-16,participants noted communicating target range federal funds rate would remain elb criteria achieved would provide appropriately clear strong policy guidance,participant note communicate target range federal fund rate would remain elb criterion achieve would provide appropriately clear strong policy guidance,0
349,2020-09-16,meeting viewed especially important way affirming committee commitment achieving economic outcomes articulated consensus statement,meeting view especially important way affirm committee commitment achieve economic outcome articulate consensus statement,0
350,2020-09-16,participants generally noted outcome based forward guidance federal funds rate type not unconditional commitment particular path,participant generally note outcome base forward guidance federal fund rate type not unconditional commitment particular path,0
351,2020-09-16,indeed outcome based guidance type would allow public infer changes committee assessment long target range federal funds rate would remain current setting,indeed outcome base guidance type would allow public infer change committee assessment long target range federal fund rate would remain current set,0
352,2020-09-16,information pointing weaker outlook economy inflation would tend lead public expectations longer period current setting target range information suggesting stronger outlook economy inflation would tend lead expectations shorter period current setting,information point weaker outlook economy inflation would tend lead public expectation longer period current set target range information suggest strong outlook economy inflation would tend lead expectation shorter period current set,0
353,2020-09-16,addition circumstances could arise committee judged would appropriate change guidance particularly risks emerged could impede attainment economic objectives,addition circumstance could arise committee judged would appropriate change guidance particularly risk emerge could impede attainment economic objective,0
354,2020-09-16,couple participants preferred even stronger less qualified outcome based forward guidance judged would clearly convey committee commitment objectives strategic approach articulated revised consensus statement,couple participant prefer even strong less qualify outcome base forward guidance judged would clearly convey committee commitment objective strategic approach articulate revise consensus statement,0
355,2020-09-16,particular participants preferred forward guidance target range federal funds rate remained elb inflation moved  percent time,particular participant prefer forward guidance target range federal fund rate remain elb inflation move percent time,0
356,2020-09-16,especially light lengthy period inflation run committee longer run  percent objective participants judged critical demonstrate committee commitment achieve outcomes inflation averages  percent time,especially light lengthy period inflation run committee longer run percent objective participant judged critical demonstrate committee commitment achieve outcome inflation average percent time,0
357,2020-09-16,several participants noted agreed appropriate incorporate key elements consensus statement postmeeting statement preferred retain forward guidance similar provided recent fomc statements,several participant note agree appropriate incorporate key element consensus statement postmeeting statement prefer retain forward guidance similar provide recent fomc statement,0
358,2020-09-16,participants judged would likely appropriate maintain accommodative stance policy time order foster outcomes consistent committee revised consensus statement,participant judged would likely appropriate maintain accommodative stance policy time order foster outcome consistent committee revise consensus statement,0
359,2020-09-16,however longer term interest rates already low not appear need enhanced forward guidance juncture much scope forward guidance put additional downward pressure yields,however longer term interest rate already low not appear need enhance forward guidance juncture much scope forward guidance put additional downward pressure yield,0
360,2020-09-16,moreover participants concerned forward guidance involved target range federal funds rate remaining elb employment inflation criteria achieved could limit committee flexibility years,moreover participant concerned forward guidance involve target range federal fund rate remain elb employment inflation criterion achieve could limit committee flexibility year,0
361,2020-09-16,furthermore influencing expectations path short term interest rates guidance could contribute buildup financial imbalances would make difficult committee achieve objectives future,furthermore influence expectation path short term interest rate guidance could contribute buildup financial imbalance would make difficult committee achieve objective future,0
362,2020-09-16,regarding asset purchases participants judged would appropriate coming months federal reserve increase holdings treasury securities agency mbs least current pace,regard asset purchase participant judged would appropriate come month federal reserve increase holding treasury security agency mb least current pace,0
363,2020-09-16,actions would continue help sustain smooth market functioning would continue help foster accommodative financial conditions thereby supporting flow credit households businesses,action would continue help sustain smooth market function would continue help foster accommodative financial condition thereby support flow credit household business,0
364,2020-09-16,participants also noted future meetings would appropriate assess communicate committee asset purchase program could best support achievement committee maximum employment price stability goals,participant also note future meeting would appropriate ass communicate committee asset purchase program could best support achievement committee maximum employment price stability goal,0
365,2020-09-16,participants widely echoed remarks opening meeting memory thomas laubach,participant widely echoed remark opening meeting memory thomas laubach,0
366,2020-09-16,participants universally recognized great leadership intellectual contributions work committee well warm generous spirit,participant universally recognize great leadership intellectual contribution work committee well warm generous spirit,0
367,2020-09-16,committee policy action discussion monetary policy meeting members agreed covid  pandemic causing tremendous human economic hardship across united states around world,committee policy action discussion monetary policy meeting member agree covid pandemic cause tremendous human economic hardship across united state around world,0
368,2020-09-16,noted economic activity employment picked recent months remained well levels beginning year weaker demand significantly lower oil prices holding consumer price inflation,note economic activity employment picked recent month remain well level begin year weaker demand significantly low oil price hold consumer price inflation,0
369,2020-09-16,overall financial conditions improved recent months part reflecting policy measures support economy flow credits households businesses,overall financial condition improve recent month part reflect policy measure support economy flow credit household business,0
370,2020-09-16,members agreed federal reserve committed using full range tools supports economy challenging time thereby promoting maximum employment price stability goals,member agree federal reserve commit use full range tool support economy challenge time thereby promote maximum employment price stability goal,0
371,2020-09-16,members also stated path economy would depend significantly course virus,member also state path economy would depend significantly course virus,0
372,2020-09-16,addition members agreed ongoing public health crisis would continue weigh economic activity employment inflation near term posing considerable risks economic outlook medium term,addition member agree ongoing public health crisis would continue weigh economic activity employment inflation near term pose considerable risk economic outlook medium term,0
373,2020-09-16,members agreed incorporate postmeeting statement key elements committee revised statement longer run goals monetary policy strategy,member agree incorporate postmeeting statement key element committee revise statement longer run goal monetary policy strategy,0
374,2020-09-16,members judged action would underscore committee strong commitment goals strategy articulated new consensus statement pursuit committee statutory objectives,member judged action would underscore committee strong commitment goal strategy articulate new consensus statement pursuit committee statutory objective,0
375,2020-09-16,accordingly members agreed fomc statement note committee seeks achieve maximum employment inflation rate  percent longer run that inflation running persistently longer run goal committee aim achieve inflation moderately  percent time inflation averages  percent time longer term inflation expectations remain well anchored  percent,accordingly member agree fomc statement note committee seek achieve maximum employment inflation rate percent longer run that inflation run persistently longer run goal committee aim achieve inflation moderately percent time inflation average percent time longer term inflation expectation remain well anchor percent,0
376,2020-09-16,members generally expected would appropriate maintain accommodative stance monetary policy outcomes achieved,member generally expect would appropriate maintain accommodative stance monetary policy outcome achieve,0
377,2020-09-16,members agreed maintain target range federal funds rate   percent,member agree maintain target range federal fund rate percent,0
378,2020-09-16,almost members viewed meeting appropriate time modify forward guidance provide greater clarity regarding likely future path federal funds rate,almost member view meeting appropriate time modify forward guidance provide great clarity regard likely future path federal fund rate,0
379,2020-09-16,end almost members agreed specification outcome based forward guidance indicated committee expects appropriate maintain current setting target range federal funds rate labor market conditions reached levels consistent committee assessments maximum employment inflation risen  percent track run moderately excess  percent time,end almost member agree specification outcome base forward guidance indicate committee expect appropriate maintain current set target range federal fund rate labor market condition reach level consistent committee assessment maximum employment inflation risen percent track run moderately excess percent time,0
380,2020-09-16,two members dissented policy decision,two member dissent policy decision,0
381,2020-09-16,one dissenting members preferred committee retain greater policy rate flexibility retaining language forward guidance provided july postmeeting statement language noted would appropriate maintain current target range committee confident economy weathered recent events track achieve maximum employment price stability goals,one dissent member prefer committee retain great policy rate flexibility retain language forward guidance provide july postmeeting statement language note would appropriate maintain current target range committee confident economy weather recent event track achieve maximum employment price stability goal,0
382,2020-09-16,dissenting member preferred stronger formulation forward guidanceone committee would indicate expected maintain current target range core inflation reached  percent sustained basis,dissent member prefer strong formulation forward guidanceone committee would indicate expect maintain current target range core inflation reach percent sustain basis,0
383,2020-09-16,discussion monetary policy period ahead members generally agreed committee policy guidance expressed assessment path federal funds rate likely consistent achievement committee goals not unconditional commitment,discussion monetary policy period ahead member generally agree committee policy guidance express assessment path federal fund rate likely consistent achievement committee goal not unconditional commitment,0
384,2020-09-16,stated appropriate rate path would depend evolution economic outlook,state appropriate rate path would depend evolution economic outlook,0
385,2020-09-16,accordingly agreed committee would prepared adjust stance policy appropriate event risks emerged could impede attainment committee goals,accordingly agree committee would prepared adjust stance policy appropriate event risk emerge could impede attainment committee goal,0
386,2020-09-16,members also agreed that assessing appropriate stance monetary policy would take account wide range information including readings public health labor market conditions inflation pressures inflation expectations financial international developments,member also agree that assess appropriate stance monetary policy would take account wide range information include reading public health labor market condition inflation pressure inflation expectation financial international development,0
387,2020-09-16,members noted committee asset purchases helped foster significant improvements market functioning recent months,member note committee asset purchase help foster significant improvement market function recent month,0
388,2020-09-16,addition purchases securities contributing accommodative financial conditions way supported economic recovery,addition purchase security contribute accommodative financial condition way support economic recovery,0
389,2020-09-16,consistent observations members agreed would appropriate acknowledge postmeeting statement role asset purchases supporting accommodative financial conditions,consistent observation member agree would appropriate acknowledge postmeeting statement role asset purchase support accommodative financial condition,0
390,2020-09-16,committee statement thus indicated coming months would appropriate federal reserve increase holdings treasury securities agency mbs least current pace sustain smooth market functioning help foster accommodative financial conditions thereby supporting flow credit households businesses,committee statement thus indicate come month would appropriate federal reserve increase holding treasury security agency mb least current pace sustain smooth market function help foster accommodative financial condition thereby support flow credit household business,0
391,2020-09-16,members considered staff proposal eliminate requirement directive increase holdings agency cmbs soma portfolio,member consider staff proposal eliminate requirement directive increase holding agency cmb soma portfolio,0
392,2020-09-16,light substantial improvement market functioning agency cmbs market committee judged would appropriate desk purchase agency cmbs needed sustain smooth market functioning rather seek steadily increase agency cmbs holdings cease reinvestments agency cmbs principal payments,light substantial improvement market function agency cmb market committee judged would appropriate desk purchase agency cmb need sustain smooth market function rather seek steadily increase agency cmb holding cease reinvestments agency cmb principal payment,0
393,2020-09-16,members also concluded that light ongoing low take desk repo operations not necessary include sentence operations fomc statement,member also conclude that light ongoing low take desk repo operation not necessary include sentence operation fomc statement,0
394,2020-09-16,however directive adopted committee continued direct desk conduct overnight term repo operations support effective policy implementation smooth functioning short terms dollar funding markets,however directive adopt committee continued direct desk conduct overnight term repo operation support effective policy implementation smooth function short term dollar funding market,0
395,2020-09-16,conclusion discussion committee voted authorize direct federal reserve bank new york instructed otherwise execute transactions soma accordance following domestic policy directive release,conclusion discussion committee vote authorize direct federal reserve bank new york instruct otherwise execute transaction soma accordance follow domestic policy directive release,0
396,2020-09-16,effective september   federal open market committee directs desk to,effective september federal open market committee directs desk to,0
397,2020-09-16,vote also encompassed approval statement release,vote also encompass approval statement release,0
398,2020-09-16,the federal reserve committed using full range tools supports economy challenging time thereby promoting maximum employment price stability goals,the federal reserve commit use full range tool support economy challenge time thereby promote maximum employment price stability goal,0
399,2020-09-16,covid  pandemic causing tremendous human economic hardship across united states around world,covid pandemic cause tremendous human economic hardship across united state around world,0
400,2020-09-16,economic activity employment picked recent months remain well levels beginning year,economic activity employment picked recent month remain well level begin year,0
401,2020-09-16,weaker demand significantly lower oil prices holding consumer price inflation,weaker demand significantly low oil price hold consumer price inflation,0
402,2020-09-16,overall financial conditions improved recent months part reflecting policy measures support economy flow credits households businesses,overall financial condition improve recent month part reflect policy measure support economy flow credit household business,0
403,2020-09-16,path economy depend significantly course virus,path economy depend significantly course virus,0
404,2020-09-16,ongoing public health crisis continue weigh economic activity employment inflation near term poses considerable risks economic outlook medium term,ongoing public health crisis continue weigh economic activity employment inflation near term pose considerable risk economic outlook medium term,0
405,2020-09-16,committee seeks achieve maximum employment inflation rate  percent longer run,committee seek achieve maximum employment inflation rate percent longer run,0
406,2020-09-16,inflation running persistently longer run goal committee aim achieve inflation moderately  percent time inflation averages  percent time longer term inflation expectations remain well anchored  percent,inflation run persistently longer run goal committee aim achieve inflation moderately percent time inflation average percent time longer term inflation expectation remain well anchor percent,0
407,2020-09-16,committee expects maintain accommodative stance monetary policy outcomes achieved,committee expect maintain accommodative stance monetary policy outcome achieve,0
408,2020-09-16,committee decided keep target range federal funds rate   percent expects appropriate maintain target range labor market conditions reached levels consistent committee assessments maximum employment inflation risen  percent track moderately exceed  percent time,committee decide keep target range federal fund rate percent expect appropriate maintain target range labor market condition reach level consistent committee assessment maximum employment inflation risen percent track moderately exceed percent time,0
409,2020-09-16,addition coming months federal reserve increase holdings treasury securities agency mortgage backed securities least current pace sustain smooth market functioning help foster accommodative financial conditions thereby supporting flow credit households businesses,addition come month federal reserve increase holding treasury security agency mortgage back security least current pace sustain smooth market function help foster accommodative financial condition thereby support flow credit household business,0
410,2020-09-16,assessing appropriate stance monetary policy committee continue monitor implications incoming information economic outlook,assess appropriate stance monetary policy committee continue monitor implication incoming information economic outlook,0
411,2020-09-16,committee would prepared adjust stance monetary policy appropriate risks emerge could impede attainment committee goals,committee would prepared adjust stance monetary policy appropriate risk emerge could impede attainment committee goal,0
412,2020-09-16,committee assessments take account wide range information including readings public health labor market conditions inflation pressures inflation expectations financial international developments,committee assessment take account wide range information include reading public health labor market condition inflation pressure inflation expectation financial international development,0
413,2020-09-16,voting action jerome powell john williams michelle bowman lael brainard richard clarida patrick harker loretta mester randal quarles,voting action jerome powell john williams michelle bowman lael brainard richard clarida patrick harker loretta mester randal quarles,0
414,2020-09-16,voting action robert kaplan neel kashkari,voting action robert kaplan neel kashkari,0
415,2020-09-16,president kaplan dissented expects appropriate maintain current target range committee confident economy weathered recent events track achieve maximum employment price stability goals articulated new policy strategy statement prefers committee retain greater policy rate flexibility beyond point,president kaplan dissent expect appropriate maintain current target range committee confident economy weather recent event track achieve maximum employment price stability goal articulate new policy strategy statement prefers committee retain great policy rate flexibility beyond point,0
416,2020-09-16,president kashkari dissented prefers committee indicate expects maintain current target range core inflation reached  percent sustained basis,president kashkari dissent prefers committee indicate expect maintain current target range core inflation reach percent sustain basis,0
417,2020-09-16,consistent committee decision leave target range federal funds rate unchanged board governors voted unanimously leave interest rates required excess reserve balances ,consistent committee decision leave target range federal fund rate unchanged board governor vote unanimously leave interest rate require excess reserve balance,0
418,2020-09-16, percent,percent,0
419,2020-09-16,board governors also voted unanimously approve establishment primary credit rate existing level ,board governor also vote unanimously approve establishment primary credit rate exist level,0
420,2020-09-16, percent effective september  ,percent effective september,0
421,2020-09-16,agreed next meeting committee would held wednesdaythursday november  ,agree next meeting committee would held wednesdaythursday november,0
422,2020-09-16,meeting adjourned september  ,meeting adjourn september,0
423,2020-09-16,notation votes notation vote completed august   committee unanimously approved minutes committee meeting held july  ,notation vote notation vote complete august committee unanimously approve minute committee meeting held july,0
