,Date,Original,Corpus,Class
146,2020-09-16,time being desk would continue conduct regular agency cmbs operations maintain backstop capacity,time be desk would continue conduct regular agency cmb operation maintain backstop capacity,0
147,2020-09-16,unanimous vote committee ratified desk domestic transactions intermeeting period,unanimous vote committee ratify desk domestic transaction intermeeting period,0
148,2020-09-16,no intervention operations foreign currencies system account intermeeting period,no intervention operation foreign currency system account intermeeting period,0
149,2020-09-16,staff review economic situation covid  pandemic measures undertaken contain spread continued affect economic activity united states abroad,staff review economic situation covid pandemic measure undertaken contain spread continued affect economic activity united state abroad,0
150,2020-09-16,information available time september  meeting suggesteds real gdp rebounding rapid rate third quarter,information available time september meeting suggesteds real gdp rebound rapid rate third quarter,0
151,2020-09-16,labor market conditions continued improve markedly july august employment still level beginning year,labor market condition continued improve markedly july august employment still level begin year,0
152,2020-09-16,consumer price inflationas measured month percentage change price index personal consumption expenditures pce julyremained well rates prevailed early year,consumer price inflationas measure month percentage change price index personal consumption expenditure pce julyremained well rate prevail early year,0
153,2020-09-16,total nonfarm payroll employment expanded strongly july august although payrolls retraced half jobs lost onset pandemic,total nonfarm payroll employment expand strongly july august although payroll retrace half job lose onset pandemic,0
154,2020-09-16,unemployment rate moved ,unemployment rate move,0
155,2020-09-16, percent august,percent august,0
156,2020-09-16,unemployment rates african americans asians hispanics declined past two months remained well national average,unemployment rate african american asian hispanic decline past two month remain well national average,0
157,2020-09-16,labor force participation rate rose net employment population ratio increased july august,labor force participation rate rise net employment population ratio increase july august,0
158,2020-09-16,initial claims unemployment insurance benefits continued move down net early september pace declines slowed,initial claim unemployment insurance benefit continued move down net early september pace decline slow,0
159,2020-09-16,addition weekly estimates private sector payrolls constructed board staff using data provided payroll processor adp suggested employment gains likely still solid mid august early september,addition weekly estimate private sector payroll construct board staff use data provide payroll processor adp suggest employment gain likely still solid mid august early september,0
160,2020-09-16,total pce price inflation ,total pce price inflation,0
161,2020-09-16, percent  months ending july reflecting weak aggregate demand considerable drop consumer energy prices early year,percent month end july reflect weak aggregate demand considerable drop consumer energy price early year,0
162,2020-09-16,core pce price inflation excludes changes consumer food energy prices ,core pce price inflation excludes change consumer food energy price,0
163,2020-09-16, percent  month period,percent month period,0
164,2020-09-16,comparison trimmed mean measure month pce price inflation constructed federal reserve bank dallas ,comparison trim mean measure month pce price inflation construct federal reserve bank dallas,0
165,2020-09-16, percent july,percent july,0
166,2020-09-16,consumer price index cpi increased ,consumer price index cpi increase,0
167,2020-09-16, percent  months ending august core cpi inflation ,percent month end august core cpi inflation,0
168,2020-09-16, percent period,percent period,0
169,2020-09-16,monthly basis recent inflation readings bolstered increases durable goods prices largely reflecting strong demand consumer goods household purchases shifted away many consumer services,monthly basis recent inflation reading bolster increase durable good price largely reflect strong demand consumer good household purchase shift away many consumer service,0
170,2020-09-16,latest readings survey based measures longer run inflation expectations moved bit remained within ranges recent years,late reading survey base measure longer run inflation expectation move bit remain within range recent year,0
171,2020-09-16,university michigan surveys consumers measure next   years edged july august three year ahead measure federal reserve bank new york survey consumer expectations also crept past two months,university michigan survey consumer measure next year edge july august three year ahead measure federal reserve bank new york survey consumer expectation also crept past two month,0
172,2020-09-16,real pce expanded strongly july continued bolstered supportive fiscal monetary policy actions,real pce expand strongly july continued bolster supportive fiscal monetary policy action,0
173,2020-09-16,august components retail sales used estimate pce along sales light motor vehicles increased further,august component retail sale use estimate pce along sale light motor vehicle increase far,0
174,2020-09-16,however recent high frequency indicators spending consumer servicessuch restaurant dining hotel accommodations air travelwere still subdued,however recent high frequency indicator spending consumer servicessuch restaurant din hotel accommodation air travelwere still subdue,0
175,2020-09-16,real disposable personal income roughly flat july primarily reflecting gains wage salary income largely offset waning government transfer payments peak spring,real disposable personal income roughly flat july primarily reflect gain wage salary income largely offset wan government transfer payment peak spring,0
176,2020-09-16,nevertheless personal saving rate remained quite elevated,nevertheless personal save rate remain quite elevate,0
177,2020-09-16,consumer sentiment measure michigan survey edged august conference board survey measure moved down measures continued levels beginning year,consumer sentiment measure michigan survey edge august conference board survey measure move down measure continued level begin year,0
178,2020-09-16,housing sector activity continued expand likely supported effects low interest rates,housing sector activity continued expand likely support effect low interest rate,0
179,2020-09-16,starts building permit issuance single family homes along starts multifamily units increased july,start building permit issuance single family home along start multifamily unit increase july,0
180,2020-09-16,sales new existing homes also rose substantially further,sale new exist home also rise substantially far,0
181,2020-09-16,measures construction sales generally near pre pandemic levels,measure construction sale generally near pre pandemic level,0
182,2020-09-16,indicators business fixed investment suggested sector beginning recover balance,indicator business fix investment suggest sector begin recover balance,0
183,2020-09-16,nominal new orders shipments nondefense capital goods excluding aircraft increased july third consecutive monthly increase indicators business equipment spending,nominal new order shipment nondefense capital good exclude aircraft increase july third consecutive monthly increase indicator business equipment spending,0
184,2020-09-16,many measures business sentiment also improved somewhat july august,many measure business sentiment also improve somewhat july august,0
185,2020-09-16,addition number crude oil natural gas rigs operation early septemberan indicator business spending structures drilling mining sectorhad flattened recently following declines since spring,addition number crude oil natural gas rig operation early septemberan indicator business spending structure drilling mining sectorhad flatten recently follow decline since spring,0
186,2020-09-16,contrast nominal business spending nonresidential structures outside drilling mining sector declined june july,contrast nominal business spending nonresidential structure outside drilling mining sector decline june july,0
187,2020-09-16,industrial production expanded july august although less rapid pace preceding two months,industrial production expand july august although less rapid pace precede two month,0
188,2020-09-16,increase factory output broad based gains manufacturing industries slowed gradually since june,increase factory output broad base gain manufacturing industry slow gradually since june,0
189,2020-09-16,production mining sectorwhich includes crude oil natural gas drilling extractionincreased july fell august tropical storm marco hurricane laura caused sharp temporary decreases extraction drilling,production mining sectorwhich include crude oil natural gas drilling extractionincreased july fell august tropical storm marco hurricane laura cause sharp temporary decrease extraction drilling,0
190,2020-09-16,total real government purchases appeared increasing modestly balance third quarter,total real government purchase appear increase modestly balance third quarter,0
191,2020-09-16,federal defense spending continued rise august federal employment boosted markedly temporary census related hiring,federal defense spending continued rise august federal employment boost markedly temporary census related hire,0
192,2020-09-16,state local government payrolls expanded july august although nominal state local construction expenditures decreased june july,state local government payroll expand july august although nominal state local construction expenditure decrease june july,0
193,2020-09-16,declining sharply earlier year exports imports goods services increased strongly june july,decline sharply earlier year export import good service increase strongly june july,0
194,2020-09-16,net two months nominals international trade deficit widened imports rose exports,net two month nominal international trade deficit widen import rise export,0
195,2020-09-16,exports imports goods rose june july major product categories exports imports services rose modestly following previous historic declines,export import good rise june july major product category export import service rise modestly follow previous historic decline,0
196,2020-09-16,foreign economic activity plunged second quarter result covid  pandemic associated restrictive measures contain it,foreign economic activity plunge second quarter result covid pandemic associate restrictive measure contain it,0
197,2020-09-16,measures rolled back recent months economic indicators pointed large partial rebound foreign economies third quarter,measure roll back recent month economic indicator point large partial rebound foreign economy third quarter,0
198,2020-09-16,recent indicators household business spending strong several economies including canada euro area brazil reflecting part boost substantial government support programs,recent indicator household business spending strong several economy include canada euro area brazil reflect part boost substantial government support program,0
199,2020-09-16,china economic indicators showed continued moderate expansion sharp rebound second quarter though gains consumption continued lag production exports,china economic indicator show continued moderate expansion sharp rebound second quarter though gain consumption continued lag production export,0
200,2020-09-16,similarly mexico strong rebound manufacturing production contrasted weak services activity,similarly mexico strong rebound manufacturing production contrast weak service activity,0
201,2020-09-16,despite widespread rebound foreign activity indicators resurgence covid  cases parts europe asia added uncertainty outlook economies,despite widespread rebound foreign activity indicator resurgence covid case part europe asia add uncertainty outlook economy,0
202,2020-09-16,recent readings headline core inflation abroad remained quite low particularly advanced foreign economies afes amid subdued demand pressures lower energy prices earlier year,recent reading headline core inflation abroad remain quite low particularly advanced foreign economy afes amid subdue demand pressure low energy price earlier year,0
203,2020-09-16,staff review financial situation financial market sentiment improved intermeeting period boosted declines number new covid  cases united states stronger anticipated corporate earnings reports domestic economic data releases,staff review financial situation financial market sentiment improve intermeeting period boost decline number new covid case united state strong anticipate corporate earnings report domestic economic data release,0
204,2020-09-16,broad stock price indexes rose net despite notable declines late intermeeting period,broad stock price index rise net despite notable decline late intermeeting period,0
205,2020-09-16,inflation compensation increased further reaching pre pandemic levels,inflation compensation increase far reach pre pandemic level,0
206,2020-09-16,changes asset prices generally modest consistent improved sentiment treasury yield curve steepened little spreads speculative grade corporate bonds narrowed moderately exchange value dollar depreciated modestly,change asset price generally modest consistent improve sentiment treasury yield curve steepen little spread speculative grade corporate bond narrow moderately exchange value dollar depreciate modestly,0
207,2020-09-16,meanwhile financing conditions businesses access capital markets households high credit scores remained broadly accommodative although conditions remained tight borrowers,meanwhile financing condition business access capital market household high credit score remain broadly accommodative although condition remain tight borrower,0
208,2020-09-16,yields  year nominal treasury securities little changed since july fomc meeting   year yields rose moderately,yield year nominal treasury security little change since july fomc meeting year yield rise moderately,0
209,2020-09-16,market commentary attributed increases longer term yields improved investor sentiment,market commentary attribute increase longer term yield improve investor sentiment,0
210,2020-09-16,improved sentiment partly reflected decline new covid  cases united states stronger expected economic data al though market reactions economic data releases limited,improve sentiment partly reflect decline new covid case united state strong expect economic data al though market reaction economic data release limited,0
211,2020-09-16,near dated implied volatility  year treasury securities little changed intermeeting period remained near bottom historical range,near date imply volatility year treasury security little change intermeeting period remain near bottom historical range,0
212,2020-09-16,measures inflation compensation based tips maturing next years continued increase likely reflecting general improvement investor sentiment accompanying improvement economic outlook improvements tips market liquidity higher expected july cpi data release,measure inflation compensation base tip mature next year continued increase likely reflect general improvement investor sentiment accompany improvement economic outlook improvement tip market liquidity high expect july cpi data release,0
213,2020-09-16, year   year measures inflation compensation close pre pandemic levels still lower end historical ranges,year year measure inflation compensation close pre pandemic level still low end historical range,0
214,2020-09-16,expected path federal funds rate next years implied straight read overnight index swap quotes little changed net since july fomc meeting remained close effective lower bound elb first half ,expect path federal fund rate next year imply straight read overnight index swap quote little change net since july fomc meeting remain close effective low bound elb first half,0
215,2020-09-16,communications monetary policy intermeeting period generally little effect treasury yields expected path federal funds rate,communication monetary policy intermeeting period generally little effect treasury yield expect path federal fund rate,0
216,2020-09-16,however market participants suggested building expectations committee would move form flexible average inflation targeting revised consensus statement factor boosting tips inflation compensation recent months,however market participant suggest building expectation committee would move form flexible average inflation target revise consensus statement factor boost tip inflation compensation recent month,0
217,2020-09-16,broad stock price indexes rose net intermeeting period consistent generally better expected news economy second quarter corporate earnings,broad stock price index rise net intermeeting period consistent generally well expect news economy second quarter corporate earnings,0
218,2020-09-16,one month option implied volatilitythe vixwas roughly unchanged net although measures longer term downside risks equity markets option implied cost insuring  percent decline index three months increased somewhat,one month option imply volatilitythe vixwas roughly unchanged net although measure longer term downside risk equity market option imply cost insure percent decline index three month increase somewhat,0
219,2020-09-16,spreads investment speculative grade corporate bond yields comparable maturity treasury yields narrowed somewhat remained near historical medians,spread investment speculative grade corporate bond yield comparable maturity treasury yield narrow somewhat remain near historical median,0
220,2020-09-16,conditions short term funding markets stable intermeeting period,condition short term funding market stable intermeeting period,0
221,2020-09-16,spreads commercial paper cp negotiable certificates deposit across different tenors changed little net remained around levels observed pandemic,spread commercial paper cp negotiable certificate deposit across different tenor change little net remain around level observe pandemic,0
222,2020-09-16,total gross cp issuance also remained within pre pandemic normal ranges although outstanding volumes nonfinancial cp declined moderately since july fomc meeting,total gross cp issuance also remain within pre pandemic normal range although outstanding volume nonfinancial cp decline moderately since july fomc meeting,0
223,2020-09-16,assets management prime government money market funds mmfs declined modestly net,asset management prime government money market fund mmfs decline modestly net,0
224,2020-09-16,partly reversing changes observed april july institutional government mmfs net decreased holdings treasury securities increased holdings repurchase agreements repos august,partly reverse change observe april july institutional government mmfs net decrease holding treasury security increase holding repurchase agreement repos august,0
225,2020-09-16,reversal driven part tighter spread treasury bill yields repo rates,reversal driven part tighter spread treasury bill yield repo rate,0
226,2020-09-16,amid normalizing market conditions little activity money market mutual fund liquidity facility commercial paper funding facility,amid normalize market condition little activity money market mutual fund liquidity facility commercial paper funding facility,0
227,2020-09-16,effective federal funds rate secured overnight financing rate averaged  basis points intermeeting period,effective federal fund rate secure overnight financing rate average basis point intermeeting period,0
228,2020-09-16,amount federal reserve repo outstanding remained zero intermeeting period due attractive rates private market,amount federal reserve repo outstanding remain zero intermeeting period due attractive rate private market,0
229,2020-09-16,meanwhile federal reserve increased holdings treasury securities agency mbs pace previous intermeeting period,meanwhile federal reserve increase holding treasury security agency mb pace previous intermeeting period,0
230,2020-09-16,foreign asset price movements generally muted market participants likely weighing concerns rising infection rates countries prospect covid  vaccine,foreign asset price movement generally mute market participant likely weigh concern rise infection rate country prospect covid vaccine,0
231,2020-09-16,emerging market economies emes asian equity markets significantly outperformed latin american counterparts chinese equities showing particular strength,emerge market economy emes asian equity market significantly outperform latin american counterpart chinese equity show particular strength,0
232,2020-09-16,afes equity indexes rose modestly long term sovereign yields edged higher,afes equity index rise modestly long term sovereign yield edge high,0
233,2020-09-16,line modest improvement risk sentiment staff broad dollar index declined moderately net dollar depreciating eme currencies,line modest improvement risk sentiment staff broad dollar index decline moderately net dollar depreciate eme currency,0
234,2020-09-16,chinese renminbi boosted better expected chinese economic data notable contributor decline staff trade weighted dollar index along mexican peso,chinese renminbi boost well expect chinese economic data notable contributor decline staff trade weight dollar index along mexican peso,0
235,2020-09-16,among afe currencies euro appreciated reached highest level dollar since ,among afe currency euro appreciate reach high level dollar since,0
236,2020-09-16,pound little changed earlier appreciation dollar unwound amid resurgence brexit related uncertainty,pound little change earlier appreciation dollar unwound amid resurgence brexit related uncertainty,0
237,2020-09-16,financing conditions capital markets remained accommodative intermeeting period,financing condition capital market remain accommodative intermeeting period,0
238,2020-09-16,amid historically low corporate bond yields gross issuance investment speculative grade corporate bonds strong july august,amid historically low corporate bond yield gross issuance investment speculative grade corporate bond strong july august,0
239,2020-09-16,much recent issuance intended refinance existing debt,much recent issuance intend refinance exist debt,0
240,2020-09-16,gross institutional leveraged loan issuance picked slightly july remained levels observed period last year,gross institutional leveraged loan issuance picked slightly july remain level observe period last year,0
241,2020-09-16,amid notable equity market gains august gross equity issuance robust seasoned offerings strengthened double typical pace,amid notable equity market gain august gross equity issuance robust season offering strengthen double typical pace,0
242,2020-09-16,commercial industrial loans outstanding declined july august slower pace june declines large part reflecting continued credit line repayment,commercial industrial loan outstanding decline july august slow pace june decline large part reflect continued credit line repayment,0
243,2020-09-16,credit quality nonfinancial corporations showed tentative signs stabilization intermeeting period,credit quality nonfinancial corporation show tentative sign stabilization intermeeting period,0
244,2020-09-16,dollar volume nonfinancial corporate bond downgrades continued exceed upgrades albeit modestly representing sizable reduction net downgrades since spring,dollar volume nonfinancial corporate bond downgrade continued exceed upgrade albeit modestly represent sizable reduction net downgrade since spring,0
245,2020-09-16,pace nonfinancial corporate bond defaults july also notably lower april may still elevated relative pre pandemic levels,pace nonfinancial corporate bond default july also notably low april may still elevate relative pre pandemic level,0
246,2020-09-16,default volumes fell august reaching level  monthly average,default volume fell august reach level monthly average,0
247,2020-09-16,market indicators future default expectations also improved somewhat,market indicator future default expectation also improve somewhat,0
248,2020-09-16,financing conditions small businesses remained tight although indicators pointed slight improvement,financing condition small business remain tight although indicator point slight improvement,0
249,2020-09-16,thirty day delinquency rates fell modestly may july remained comparable early  levels,thirty day delinquency rate fell modestly may july remain comparable early level,0
250,2020-09-16,credit needs small businesses remained high significant shares respondents census bureau small business pulse survey reporting scarce cash availability anticipating need financial assistance next six months,credit need small business remain high significant share respondent census bureau small business pulse survey reporting scarce cash availability anticipate need financial assistance next six month,0
251,2020-09-16,municipal market financing conditions remained accommodative since july fomc meeting,municipal market financing condition remain accommodative since july fomc meeting,0
252,2020-09-16,however credit quality municipal debt deteriorated somewhat driven relatively large volume credit rating downgrades revenue bonds,however credit quality municipal debt deteriorate somewhat driven relatively large volume credit rating downgrade revenue bond,0
253,2020-09-16,financing conditions commercial real estate cre intermediated capital markets recovered intermeeting period,financing condition commercial real estate cre intermediate capital market recover intermeeting period,0
