,Date,Original,Corpus,Class
115,2021-06-16,inflation compensation measured five year breakeven rates treasury inflation protected securities peaked mid may highest level decade increase driven almost entirely higher inflation compensation short horizons,inflation compensation measure five year breakeven rate treasury inflation protect security peaked mid may high level decade increase driven almost entirely high inflation compensation short horizon,0
116,2021-06-16,indeed one year forward inflation compensation horizons beyond year relatively stable,indeed one year forward inflation compensation horizon beyond year relatively stable,0
117,2021-06-16,measures expectations federal reserve policy little changed period,measure expectation federal reserve policy little change period,0
118,2021-06-16,median respondent desk surveys primary dealers market participants continued expect pace federal reserve asset purchases begin decline first quarter  although respondents also saw reasonable chance decline could occur one quarter earlier later,median respondent desk survey primary dealer market participant continued expect pace federal reserve asset purchase begin decline first quarter although respondent also saw reasonable chance decline could occur one quarter earlier later,0
119,2021-06-16,median respondent expected purchases end fourth quarter ,median respondent expect purchase end fourth quarter,0
120,2021-06-16,desk survey measures expected path target federal funds rate also fairly steady median respondent continued expect first target rate increase occur third quarter ,desk survey measure expect path target federal fund rate also fairly steady median respondent continued expect first target rate increase occur third quarter,0
121,2021-06-16,nearly desk survey respondents anticipated summary economic projections would show median committee participant projecting either no increase target range one  percentage point increase end ,nearly desk survey respondent anticipate summary economic projection would show median committee participant project either no increase target range one percentage point increase end,0
122,2021-06-16,manager noted downward pressure money market rates continued period,manager note downward pressure money market rate continued period,0
123,2021-06-16,banks continued limit growth balance sheets allowing wholesale liabilities mature encouraging customers shift nonoperational deposits money market funds,bank continued limit growth balance sheet allow wholesale liability mature encourage customer shift nonoperational deposit money market fund,0
124,2021-06-16,moreover supply treasury bills primary investment government money market mutual funds fell further,moreover supply treasury bill primary investment government money market mutual fund fell far,0
125,2021-06-16,backdrop secured overnight financing rate sofr printed  basis point day intermeeting period effective federal funds rate effr decreased  basis point  basis points,backdrop secure overnight financing rate sofr print basis point day intermeeting period effective federal fund rate effr decrease basis point basis point,0
126,2021-06-16,amid heightened demand reduced supply short term investments rrp continued maintain floor overnight rates,amid heighten demand reduce supply short term investment rrp continued maintain floor overnight rate,0
127,2021-06-16,growth rrp nonreserve liabilities helped expand base federal reserve liabilities supporting asset purchases damping increase reserves easing pressure bank balance sheets,growth rrp nonreserve liability help expand base federal reserve liability support asset purchase damp increase reserve ease pressure bank balance sheet,0
128,2021-06-16,next intermeeting period manager anticipated increases reserves reductions bill supply could put additional downward pressure overnight rates,next intermeeting period manager anticipate increase reserve reduction bill supply could put additional downward pressure overnight rate,0
129,2021-06-16,modest technical adjustment administered rates could warranted maintain effr well within target range support smooth functioning short term funding markets,modest technical adjustment administer rate could warrant maintain effr well within target range support smooth function short term funding market,0
130,2021-06-16,adjustment would expected raise federal funds rate lift overnight rates modestly,adjustment would expect raise federal fund rate lift overnight rate modestly,0
131,2021-06-16,respondents desk surveys expected administered rate adjustment summer,respondent desk survey expect administer rate adjustment summer,0
132,2021-06-16,manager noted balances rrp facility would likely continue grow coming months,manager note balance rrp facility would likely continue grow come month,0
133,2021-06-16,staff would continue monitor developments manager noted that point could become appropriate consider raising counterparty limits rrp,staff would continue monitor development manager note that point could become appropriate consider raise counterparty limit rrp,0
134,2021-06-16,manager provided update progress toward winding number emergency facilities established section  federal reserve act,manager provide update progress toward wind number emergency facility establish section federal reserve act,0
135,2021-06-16,market participants took note federal reserve board announcement winding secondary market corporate credit facility smccf holdings elicited little price response,market participant take note federal reserve board announcement wind secondary market corporate credit facility smccf holding elicit little price response,0
136,2021-06-16,commencement exchange traded funds sales proceeded smoothly,commencement exchange trade fund sale proceed smoothly,0
137,2021-06-16,smccf assets expected sold end year,smccf asset expect sell end year,0
138,2021-06-16,finally manager noted proposal request chair approval extension temporarys dollar liquidity swap arrangements december  ,finally manager note proposal request chair approval extension temporary dollar liquidity swap arrangement december,0
139,2021-06-16,extension would benefits economy helping forestall potential pressures offshore dollar funding markets could spills financial conditions much global economy remains uncertain recovery path pandemic,extension would benefit economy help forestall potential pressure offshore dollar funding market could spill financial condition much global economy remains uncertain recovery path pandemic,0
140,2021-06-16,committee decide make fima repo facility standing extension would also provide sufficient time temporary swap line central banks not currently enrolled fima repo facility become fully operational,committee decide make fima repo facility stand extension would also provide sufficient time temporary swap line central bank not currently enrol fima repo facility become fully operational,0
141,2021-06-16,secretary note chair subsequently provided approval desk following procedures authorization foreign currency operations extend expiration temporarys dollar liquidity swap lines december  ,secretary note chair subsequently provide approval desk follow procedure authorization foreign currency operation extend expiration temporary dollar liquidity swap line december,0
142,2021-06-16,unanimous vote committee ratified desk domestic transactions intermeeting period,unanimous vote committee ratify desk domestic transaction intermeeting period,0
143,2021-06-16,no intervention operations foreign currencies system account intermeeting period,no intervention operation foreign currency system account intermeeting period,0
144,2021-06-16,staff review economic situation information available time june  meeting suggesteds real gross domestic product gdp expanding second quarter pace faster first quarter year,staff review economic situation information available time june meeting suggesteds real gross domestic product gdp expand second quarter pace faster first quarter year,0
145,2021-06-16,moreover labor market conditions improved april may,moreover labor market condition improve april may,0
146,2021-06-16,consumer price inflation aprilas measured  month percentage change pce price indexhad picked notably largely reflecting transitory factors,consumer price inflation aprilas measure month percentage change pce price indexhad picked notably largely reflect transitory factor,0
147,2021-06-16,total nonfarm payroll employment increased solidly april may though slower monthly pace february march,total nonfarm payroll employment increase solidly april may though slow monthly pace february march,0
148,2021-06-16,may total payroll employment retraced twothirds job losses seen onset pandemic although employment leisure hospitality sector education sector including public private education bounced back less,may total payroll employment retrace twothirds job loss see onset pandemic although employment leisure hospitality sector education sector include public private education bounce back less,0
149,2021-06-16,april may unemployment rate edged stood ,april may unemployment rate edge stood,0
150,2021-06-16, percent may,percent may,0
151,2021-06-16,unemployment rates african americans asians hispanics also moved down although rates african americans hispanics remained well national average,unemployment rate african american asian hispanic also move down although rate african american hispanic remain well national average,0
152,2021-06-16,labor force participation rate employment population ratio moved slightly measures recovered partially lows pandemic,labor force participation rate employment population ratio move slightly measure recover partially low pandemic,0
153,2021-06-16,initial claims regular state unemployment insurance benefits moved since midapril lowest level since beginning pandemic though remained high relative pre pandemic level,initial claim regular state unemployment insurance benefit move since midapril low level since begin pandemic though remain high relative pre pandemic level,0
154,2021-06-16,weekly estimates private sector payrolls constructed federal reserve board staff using data provided payroll processor adp available may suggested pace private employment gains stepped late month,weekly estimate private sector payroll construct federal reserve board staff use data provide payroll processor adp available may suggest pace private employment gain step late month,0
155,2021-06-16,pace increases several measures labor compensation moved recent months,pace increase several measure labor compensation move recent month,0
156,2021-06-16,average hourly earnings employees jumped sizable monthly rate april may even though large job gains leisure hospitality sectorwhere wages tend lower sectorslikely held increases average hourly earnings months,average hourly earnings employee jumped sizable monthly rate april may even though large job gain leisure hospitality sectorwhere wage tend low sectorslikely held increase average hourly earnings month,0
157,2021-06-16,staff measure month change median wage derived adp data stepped significantly april relative march,staff measure month change median wage derive adp data step significantly april relative march,0
158,2021-06-16,employment cost index total hourly compensation private sector increased annual rate  percent three months ending march notably faster pace previous three months,employment cost index total hourly compensation private sector increase annual rate percent three month end march notably faster pace previous three month,0
159,2021-06-16,recent  month change measures inflation using either pce prices consumer price index cpi boosted significantly base effects drop prices spring  rolling calculation,recent month change measure inflation use either pce price consumer price index cpi boost significantly base effect drop price spring roll calculation,0
160,2021-06-16,addition surge demand economy reopened further combined production bottlenecks supply constraints contributed large recent monthly price increases,addition surge demand economy reopen far combine production bottleneck supply constraint contribute large recent monthly price increase,0
161,2021-06-16,total pce price inflation ,total pce price inflation,0
162,2021-06-16, percent  months ending april,percent month end april,0
163,2021-06-16,core pce price inflation excludes changes consumer energy prices many consumer food prices ,core pce price inflation excludes change consumer energy price many consumer food price,0
164,2021-06-16, percent  months ending april,percent month end april,0
165,2021-06-16,contrast trimmed mean measure  month pce inflation constructed federal reserve bank dallas ,contrast trim mean measure month pce inflation construct federal reserve bank dallas,0
166,2021-06-16, percent april,percent april,0
167,2021-06-16,may  month change cpi  percent core cpi inflation ,may month change cpi percent core cpi inflation,0
168,2021-06-16, percent period,percent period,0
169,2021-06-16,second quarter staff common inflation expectations index combines information many indicators inflation expectations inflation compensation returned level prevailed  time inflation modest,second quarter staff common inflation expectation index combine information many indicator inflation expectation inflation compensation return level prevail time inflation modest,0
170,2021-06-16,real pce increased substantially march little changed high level april,real pce increase substantially march little change high level april,0
171,2021-06-16,components nominal retail sales data used estimate pce edged may sales data previous two months revised markedly pointing stronger real pce growth initially estimated,component nominal retail sale data use estimate pce edge may sale data previous two month revise markedly point strong real pce growth initially estimate,0
172,2021-06-16,combined reduced social distancing widespread vaccinations key factors influence consumer spendingincluding increasing job gains upward trend real disposable income high levels household net worth low interest ratespointed strong real pce growth rest year,combine reduce social distance widespread vaccination key factor influence consumer spendingincluding increase job gain upward trend real disposable income high level household net worth low interest ratespointed strong real pce growth rest year,0
173,2021-06-16,housing demand continued robust construction single family homes home sales remaining well pre pandemic levels house prices rising appreciably further,housing demand continued robust construction single family home home sale remain well pre pandemic level house price rise appreciably far,0
174,2021-06-16,incoming data sector indicated residential investment spending temporarily held back second quarter materials shortages limited stocks homes sale,incoming data sector indicate residential investment spending temporarily held back second quarter material shortage limited stock home sale,0
175,2021-06-16,available indicators suggested equipment intangibles investmentparticularly high tech categorieswas increasing solidly second quarter,available indicator suggest equipment intangible investmentparticularly high tech categorieswas increase solidly second quarter,0
176,2021-06-16,rising orders nondefense capital goods excluding aircraft running well increases shipments goods april pointed additional gains business equipment spending coming months,rise order nondefense capital good exclude aircraft run well increase shipment good april point additional gain business equipment spending come month,0
177,2021-06-16,moreover business investment drilling mining sector appeared increasing further crude oil natural gas rigs operationan indicator drilling investmentcontinued rise early june oil prices moving higher,moreover business investment drilling mining sector appear increase far crude oil natural gas rig operationan indicator drilling investmentcontinued rise early june oil price move high,0
178,2021-06-16,however nominal nonresidential construction spending declined april investment nonresidential structures outside drilling mining sector looked remain weak current quarter likely reflecting continued hesitation businesses commit building projects lengthy times completion uncertain future returns,however nominal nonresidential construction spending decline april investment nonresidential structure outside drilling mining sector look remain weak current quarter likely reflect continued hesitation business commit building project lengthy time completion uncertain future return,0
179,2021-06-16,manufacturing output expanded solidly balance april may,manufacturing output expand solidly balance april may,0
180,2021-06-16,output motor vehicle parts sector rose net although semiconductor shortages still weighing vehicle production,output motor vehicle part sector rise net although semiconductor shortage still weigh vehicle production,0
181,2021-06-16,factory output outside motor vehicle sector increased solidly production mining sector includes crude oil natural gas extraction also increased april may,factory output outside motor vehicle sector increase solidly production mining sector include crude oil natural gas extraction also increase april may,0
182,2021-06-16,total real government purchases looked flat balance second quarter,total real government purchase look flat balance second quarter,0
183,2021-06-16,data may indicated real federal defense spending rising slightly nondefense spending expected drop following first quarter surge pandemic related expenditures,data may indicate real federal defense spending rise slightly nondefense spending expect drop follow first quarter surge pandemic related expenditure,0
184,2021-06-16,state local government purchases looked increasing significantly payrolls governments expanded solidly april may,state local government purchase look increase significantly payroll government expand solidly april may,0
185,2021-06-16,nominal state local construction spending however edged april,nominal state local construction spending however edge april,0
186,2021-06-16,strong economic recovery leading improved outlook state local tax revenues additional federal support governments included american rescue plan state local purchases appeared likely increase notably rest year,strong economic recovery lead improve outlook state local tax revenue additional federal support government include american rescue plan state local purchase appear likely increase notably rest year,0
187,2021-06-16,nominals international trade deficit widened record size march reversed widening april,nominal international trade deficit widen record size march reverse widen april,0
188,2021-06-16,real goods exports march surpassed january  levels first time continued grow april particular strength exports capital goods,real good export march surpass january level first time continued grow april particular strength export capital good,0
189,2021-06-16,real goods imports surged record high levels march stepped back modestly april,real good import surge record high level march step back modestly april,0
190,2021-06-16,bottlenecks global semiconductor industry weighed exports imports automotive products year continued april,bottleneck global semiconductor industry weigh export import automotive product year continued april,0
191,2021-06-16,exports imports services remained depressed relative pre pandemic levels international travel increased slightly february,export import service remain depressed relative pre pandemic level international travel increase slightly february,0
192,2021-06-16,recent data pointed pickup foreign economic activity second quarter,recent data point pickup foreign economic activity second quarter,0
193,2021-06-16,demand improved social distancing restrictions lifted united kingdom euro area following rollout vaccines,demand improve social distance restriction lift united kingdom euro area follow rollout vaccine,0
194,2021-06-16,economic reopening way purchasing managers indexes pmis manufacturing services sectors strong europe april may,economic reopen way purchasing manager index pmis manufacturing service sector strong europe april may,0
195,2021-06-16,emerging market economies emes manufacturing pmis exports generally robust,emerge market economy emes manufacturing pmis export generally robust,0
196,2021-06-16,however many emes continued struggle contain virus amid slow pace vaccinations particularly south america parts asia,however many emes continued struggle contain virus amid slow pace vaccination particularly south america part asia,0
197,2021-06-16,consumer price inflation continued rise many foreign economies primarily driven rebounding energy prices fading effects steep price declines seen early last year,consumer price inflation continued rise many foreign economy primarily driven rebound energy price fading effect steep price decline see early last year,0
198,2021-06-16,price increases concentrated relatively items suggesting underlying inflationary pressures remained subdued amid considerable economic slack,price increase concentrate relatively item suggest underlie inflationary pressure remain subdue amid considerable economic slack,0
199,2021-06-16,staff review financial situation overall financial conditions eased intermeeting period market participants appeared remain confident economic recovery broadly track inflation medium term would stay contained monetary policy would remain accommodative,staff review financial situation overall financial condition ease intermeeting period market participant appear remain confident economic recovery broadly track inflation medium term would stay contain monetary policy would remain accommodative,0
200,2021-06-16,domestic equity prices edged up corporate bond spreads narrowed little,domestic equity price edge up corporate bond spread narrow little,0
201,2021-06-16,yields nominal treasury securities declined modestly since previous fomc meeting,yield nominal treasury security decline modestly since previous fomc meeting,0
202,2021-06-16,measures inflation compensation shorter horizons moved somewhat net measures longer term inflation compensation little changed,measure inflation compensation shorter horizon move somewhat net measure longer term inflation compensation little change,0
203,2021-06-16,straight read overnight index swap ois quotes suggested expected path federal funds rate moved lower intermeeting period expected policy rate would remain  basis points first quarter ,straight read overnight index swap ois quote suggest expect path federal fund rate move low intermeeting period expect policy rate would remain basis point first quarter,0
204,2021-06-16,short term funding markets functioned smoothly amid record participation rrp facility,short term funding market function smoothly amid record participation rrp facility,0
205,2021-06-16,financing conditions businesses households remained accommodative particularly large firms households high credit ratings,financing condition business household remain accommodative particularly large firm household high credit rating,0
206,2021-06-16,treasury yield curve flattened bit net  year yields unchanged      year yields declined somewhat,treasury yield curve flatten bit net year yield unchanged year yield decline somewhat,0
207,2021-06-16,inflation compensation declined bit shorter horizons held steady longer horizons,inflation compensation decline bit shorter horizon held steady longer horizon,0
208,2021-06-16,market expectations federal funds rate path medium term implied ois quotes unadjusted term premiums declined moderately,market expectation federal fund rate path medium term imply ois quote unadjusted term premium decline moderately,0
209,2021-06-16,broad stock price indexes increased slightly intermeeting period stocks cyclically sensitive sectors generally outperforming,broad stock price index increase slightly intermeeting period stock cyclically sensitive sector generally outperform,0
210,2021-06-16,one month option implied volatilitythe vixreached lowest level since february  remained bit middle historical distribution,one month option imply volatilitythe vixreached low level since february remain bit middle historical distribution,0
211,2021-06-16,spreads yields corporate bonds comparable maturity treasury securities narrowed little credit ratings,spread yield corporate bond comparable maturity treasury security narrow little credit rating,0
212,2021-06-16,meanwhile yields municipal bonds reached historical lows spreads roughly unchanged high credit rated bonds moderately narrower lower credit rated bonds,meanwhile yield municipal bond reach historical low spread roughly unchanged high credit rat bond moderately narrower low credit rat bond,0
213,2021-06-16,short term funding markets continued function smoothly intermeeting period,short term funding market continued function smoothly intermeeting period,0
214,2021-06-16,shortterm overnight rates remained near historical lows overnight rates dipping slightly,shortterm overnight rate remain near historical low overnight rate dip slightly,0
215,2021-06-16,effr nearly constant throughout period  basis points sofr remained  basis point,effr nearly constant throughout period basis point sofr remain basis point,0
216,2021-06-16,rates low net treasury bill supply contracting government money market funds time attracting notable inflows limited investment options nonnegative rates,rate low net treasury bill supply contract government money market fund time attract notable inflow limited investment option nonnegative rate,0
217,2021-06-16,result rrp take funds surged pushing total rrp participation record levels late may june,result rrp take fund surge push total rrp participation record level late may june,0
