,Date,Original,Corpus,Class
0,2021-06-16,federal reserve central bank united states provides nation safe flexible stable monetary financial system,federal reserve central bank united state provide nation safe flexible stable monetary financial system,0
1,2021-06-16,federal open market committee,federal open market committee,0
2,2021-06-16,monetary policy principles practice,monetary policy principle practice,0
3,2021-06-16,policy implementation,policy implementation,0
4,2021-06-16,reports,report,0
5,2021-06-16,review monetary policy strategy tools communications,review monetary policy strategy tool communication,0
6,2021-06-16,institution supervision,institution supervision,0
7,2021-06-16,reports,report,0
8,2021-06-16,reporting forms,reporting form,0
9,2021-06-16,supervision  regulation letters,supervision regulation letter,0
10,2021-06-16,banking applications  legal developments,banking application legal development,0
11,2021-06-16,regulatory resources,regulatory resource,0
12,2021-06-16,banking  data structure,banking data structure,0
13,2021-06-16,regulations  statutes,regulation statute,0
14,2021-06-16,payment policies,payment policy,0
15,2021-06-16,reserve bank payment services  data,reserve bank payment service data,0
16,2021-06-16,financial market utilities  infrastructures,financial market utility infrastructure,0
17,2021-06-16,research committees forums,research committee forum,0
18,2021-06-16,working papers notes,work paper note,0
19,2021-06-16,models tools,model tool,0
20,2021-06-16,bank assets liabilities,bank asset liability,0
21,2021-06-16,bank structure data,bank structure data,0
22,2021-06-16,business finance,business finance,0
23,2021-06-16,dealer financing terms,dealer financing term,0
24,2021-06-16,exchange rates international data,exchange rate international data,0
25,2021-06-16,financial accounts,financial account,0
26,2021-06-16,household finance,household finance,0
27,2021-06-16,industrial activity,industrial activity,0
28,2021-06-16,interest rates,interest rate,0
29,2021-06-16,micro data reference manual mdrm,micro data reference manual mdrm,0
30,2021-06-16,money stock reserve balances,money stock reserve balance,0
31,2021-06-16,regulations,regulation,0
32,2021-06-16,supervision  enforcement,supervision enforcement,0
33,2021-06-16,community development,community development,0
34,2021-06-16,research  analysis,research analysis,0
35,2021-06-16,consumer resources,consumer resource,0
36,2021-06-16,joint meeting federal open market committee board governors held videoconference tuesday june   continued wednesday june   m,joint meeting federal open market committee board governor held videoconference tuesday june continued wednesday june m,0
37,2021-06-16,present jerome powell chair john williams vice chair thomas barkin raphael bostic michelle bowman lael brainard richard clarida mary daly charles evans randal quarles christopher waller,present jerome powell chair john williams vice chair thomas barkin raphael bostic michelle bowman lael brainard richard clarida mary daly charles evans randal quarles christopher waller,0
38,2021-06-16,james bullard esther george naureen hassan loretta mester eric rosengren alternate members federal open market committee,james bullard esther george naureen hassan loretta mester eric rosengren alternate member federal open market committee,0
39,2021-06-16,patrick harker robert kaplan neel kashkari presidents federal reserve banks philadelphia dallas minneapolis respectively,patrick harker robert kaplan neel kashkari president federal reserve bank philadelphia dallas minneapolis respectively,0
40,2021-06-16,james clouse secretary matthew luecke deputy secretary michelle smith assistant secretary mark van der weide general counsel michael held deputy general counsel trevor reeve economist stacey tevlin economist beth anne wilson economist,james clouse secretary matthew luecke deputy secretary michelle smith assistant secretary mark van der weide general counsel michael held deputy general counsel trevor reeve economist stacey tevlin economist beth anne wilson economist,0
41,2021-06-16,shaghil ahmed kartik athreya rochelle edge eric engen william wascher associate economists,shaghil ahmed kartik athreya rochelle edge eric engen william wascher associate economist,0
42,2021-06-16,lorie logan manager system open market account,lorie logan manager system open market account,0
43,2021-06-16,patricia zobel deputy manager system open market account,patricia zobel deputy manager system open market account,0
44,2021-06-16,ann misback secretary office secretary board governors,ann misback secretary office secretary board governor,0
45,2021-06-16,michael gibson director division supervision regulation board governors andreas lehnert director division financial stability board governors,michael gibson director division supervision regulation board governor andreas lehnert director division financial stability board governor,0
46,2021-06-16,daniel covitz deputy director division research statistics board governors sally davies deputy director division international finance board governors,daniel covitz deputy director division research statistic board governor sally davy deputy director division international finance board governor,0
47,2021-06-16,jon faust senior special adviser chair division board members board governors,jon faust senior special adviser chair division board member board governor,0
48,2021-06-16,joshua gallin special adviser chair division board members board governors,joshua gallin special adviser chair division board member board governor,0
49,2021-06-16,william bassett antulio bomfim wendy dunn burcu duygan bump jane ihrig kurt lewis chiara scotti nitish sinha special advisers board division board members board governors,william bassett antulio bomfim wendy dunn burcu duygan bump jane ihrig kurt lewis chiara scotti nitish sinha special adviser board division board member board governor,0
50,2021-06-16,carol bertaut senior associate director division international finance board governors marnie gillis deboer david lpez salido senior associate directors division monetary affairs board governors elizabeth klee senior associate director division financial stability board governors david lebow senior associate director division research statistics board governors,carol bertaut senior associate director division international finance board governor marnie gillis deboer david lpez salido senior associate director division monetary affair board governor elizabeth klee senior associate director division financial stability board governor david lebow senior associate director division research statistic board governor,0
51,2021-06-16,brett berger senior adviser division international finance board governors ellen meade edward nelson senior advisers division monetary affairs board governors jeremy rudd senior adviser division research statistics board governors,brett berger senior adviser division international finance board governor ellen meade edward nelson senior adviser division monetary affair board governor jeremy rudd senior adviser division research statistic board governor,0
52,2021-06-16,andrew figura associate director division research statistics board governors christopher gust associate director division monetary affairs board governors,andrew figura associate director division research statistic board governor christopher gust associate director division monetary affair board governor,0
53,2021-06-16,stephanie curcuru andrea raffo deputy associate directors division international finance board governors laura lipscomb deputy associate director division monetary affairs board governors steve spurry deputy associate director division supervision regulation board governors jeffrey walker deputy associate director division reserve bank operations payment systems board governors,stephanie curcuru andrea raffo deputy associate director division international finance board governor laura lipscomb deputy associate director division monetary affair board governor steve spurry deputy associate director division supervision regulation board governor jeffrey walker deputy associate director division reserve bank operation payment system board governor,0
54,2021-06-16,jennifer gallagher special assistant board division board members board governors,jennifer gallagher special assistant board division board member board governor,0
55,2021-06-16,brian bonis etienne gagnon dan li assistant directors division monetary affairs board governors,brian bonis etienne gagnon dan li assistant director division monetary affair board governor,0
56,2021-06-16,charles fleischman adviser division research statistics board governors,charles fleischman adviser division research statistic board governor,0
57,2021-06-16,penelope beattie section chief office secretary board governors,penelope beattie section chief office secretary board governor,0
58,2021-06-16,alyssa arute manager division reserve bank operations payment systems board governors,alyssa arute manager division reserve bank operation payment system board governor,0
59,2021-06-16,sriya anbil group manager division monetary affairs board governors,sriya anbil group manager division monetary affair board governor,0
60,2021-06-16,mark carlson senior economic project manager division monetary affairs board governors,mark carlson senior economic project manager division monetary affair board governor,0
61,2021-06-16,david small project manager division monetary affairs board governors,david small project manager division monetary affair board governor,0
62,2021-06-16,david byrne principal economist division research statistics board governors michele cavallo bernd schlusche mary tian francisco vazquez grande principal economists division monetary affairs board governors alberto queralto principal economist division international finance board governors,david byrne principal economist division research statistic board governor michele cavallo bernd schlusche mary tian francisco vazquez grande principal economist division monetary affair board governor alberto queralto principal economist division international finance board governor,0
63,2021-06-16,randall williams lead information manager division monetary affairs board governors,randall williams lead information manager division monetary affair board governor,0
64,2021-06-16,courtney demartini lead financial institution policy analyst division monetary affairs board governors,courtney demartini lead financial institution policy analyst division monetary affair board governor,0
65,2021-06-16,anthony diercks senior economist division monetary affairs board governors,anthony diercks senior economist division monetary affair board governor,0
66,2021-06-16,joseph gruber ellis tallman executive vice presidents federal reserve banks kansas city cleveland respectively,joseph gruber elli tallman executive vice president federal reserve bank kansa city cleveland respectively,0
67,2021-06-16,anne baum carlos garriga susan mclaughlin anna nordstrom giovanni olivei paolo pesenti julie ann remache robert valletta markj wright senior vice presidents federal reserve banks new york st louis new york new york boston new york new york san francisco minneapolis respectively,anne baum carlos garriga susan mclaughlin anna nordstrom giovanni olivei paolo pesenti julie ann remache robert valletta markj wright senior vice president federal reserve bank new york st louis new york new york boston new york new york san francisco minneapolis respectively,0
68,2021-06-16,roc armenter jennifer crystal jonas fisher matthew nemeth vice presidents federal reserve banks philadelphia new york chicago new york respectively,roc armenter jennifer crystal jonas fisher matthew nemeth vice president federal reserve bank philadelphia new york chicago new york respectively,0
69,2021-06-16,jason miu assistant vice president federal reserve bank new york,jason miu assistant vice president federal reserve bank new york,0
70,2021-06-16,karel mertens senior economic policy advisor federal reserve bank dallas,karel mertens senior economic policy advisor federal reserve bank dallas,0
71,2021-06-16,kristopher gerardi financial economist senior advisor federal reserve bank atlanta,kristopher gerardi financial economist senior advisor federal reserve bank atlanta,0
72,2021-06-16,haitham jendoubi policy markets analysis manager federal reserve bank new york,haitham jendoubi policy market analysis manager federal reserve bank new york,0
73,2021-06-16,discussion repurchase agreement arrangements participants resumed discussion april  fomc meeting considerations related establishment domestic standing repurchase agreement repo facility srf standing foreign international monetary authorities fima repo facility,discussion repurchase agreement arrangement participant resume discussion april fomc meeting consideration related establishment domestic stand repurchase agreement repo facility srf stand foreign international monetary authority fima repo facility,0
74,2021-06-16,building discussion previous meetings staff presented considerations facilities might designed,building discussion previous meeting staff present consideration facility might design,0
75,2021-06-16,design considerations guided participants general desire facilities play backstop role fostering effective implementation monetary policy supporting smooth functioning markets,design consideration guide participant general desire facility play backstop role foster effective implementation monetary policy support smooth function market,0
76,2021-06-16,april participants highlighted importance designing facilities way would leave ample room private market activity minimizing potential stigma promote equitable access appropriately broad set counterparties governed fomc,april participant highlight importance design facility way would leave ample room private market activity minimize potential stigma promote equitable access appropriately broad set counterparties govern fomc,0
77,2021-06-16,principles goals mind staff presented potential terms facility,principle goal mind staff present potential term facility,0
78,2021-06-16,staff presentation potential design domestic srf included establishing minimum bid rate  basis pointsthe top target range federal funds rate,staff presentation potential design domestic srf include establish minimum bid rate basis pointsthe top target range federal fund rate,0
79,2021-06-16,staff briefing suggested counterparties facility would include primary dealers would extended time include banks expressed interest participation,staff briefing suggest counterparties facility would include primary dealer would extend time include bank express interest participation,0
80,2021-06-16,staff presentation noted facility could limiteds treasury securities could accept securities currently accepted open market operations omos include treasury securities agency securities agency mortgage backed securities mbs,staff presentation note facility could limited treasury security could accept security currently accepted open market operation omos include treasury security agency security agency mortgage back security mb,0
81,2021-06-16,briefing noted that one hand restricting eligible collateral domestic srfs treasury securities could mitigate concerns srf could encourage counterparties take greater liquidity risk,briefing note that one hand restrict eligible collateral domestic srfs treasury security could mitigate concern srf could encourage counterparties take great liquidity risk,0
82,2021-06-16,hand accepting agency securities agency mbs srf would consistent structure current repo operations could help address greater range potential repo market pressures spilling federal funds market,hand accept agency security agency mb srf would consistent structure current repo operation could help address great range potential repo market pressure spill federal fund market,0
83,2021-06-16,proposed design standing fima repo facility similar structure existing temporary fima repo facility,propose design stand fima repo facility similar structure exist temporary fima repo facility,0
84,2021-06-16,draft terms range eligible counterparties fima repo facility would continue include foreign official institutions largely comprising central banks subject individual approval,draft term range eligible counterparties fima repo facility would continue include foreign official institution largely comprise central bank subject individual approval,0
85,2021-06-16,eligible collateral would continue limiteds treasury securities,eligible collateral would continue limited treasury security,0
86,2021-06-16,draft terms envisioned rate fima repo facility would set equal top target range federal funds rate rate equal minimum bid rate draft terms domestic srf,draft term envision rate fima repo facility would set equal top target range federal fund rate rate equal minimum bid rate draft term domestic srf,0
87,2021-06-16,discussion considerations related design domestic srf substantial majority restated view conveyed april  meeting potential benefits facility outweighed potential costs,discussion consideration related design domestic srf substantial majority restate view conveyed april meeting potential benefit facility outweigh potential cost,0
88,2021-06-16,participants broadly supported terms presented staff facility,participant broadly support term present staff facility,0
89,2021-06-16,several participants noted importance setting minimum bid rate high enough facility positioned backstop pointed importance not setting rate high usage facility could stigmatized facility would not sufficiently contain pressures could spill federal funds market,several participant note importance set minimum bid rate high enough facility position backstop point importance not set rate high usage facility could stigmatize facility would not sufficiently contain pressure could spill federal fund market,0
90,2021-06-16,several participants noted setting srf rate top target range federal funds rate would consistent addressing pressures could spill federal funds market,several participant note set srf rate top target range federal fund rate would consistent address pressure could spill federal fund market,0
91,2021-06-16,others remarked setting srf rate level primary credit rate borrowing discount window would promote equitable access federal reserve liquidity across banks counterparties omos,others remark set srf rate level primary credit rate borrowing discount window would promote equitable access federal reserve liquidity across bank counterparties omos,0
92,2021-06-16,several participants commented may also appropriate adjust srf rate time based accumulated experience economic financial developments,several participant comment may also appropriate adjust srf rate time base accumulate experience economic financial development,0
93,2021-06-16,several participants suggested that order ensure srf continues effective may appropriate study costs benefits additional adjustments time moving cleared settlement structure,several participant suggest that order ensure srf continue effective may appropriate study cost benefit additional adjustment time move clear settlement structure,0
94,2021-06-16,participants noted benefits allowing banks counterparties domestic srf including directly addressing liquidity pressures participants federal funds market promoting equitable access liquidity across domestic counterparties,participant note benefit allow bank counterparties domestic srf include directly address liquidity pressure participant federal fund market promote equitable access liquidity across domestic counterparties,0
95,2021-06-16,many participants judged would appropriate accept set securities currently accepted omos,many participant judged would appropriate accept set security currently accepted omos,0
96,2021-06-16,participants indicated accepting securities domestic srf operations increase effectiveness facility limiting upward pressures repo markets could spill federal funds market,participant indicate accept security domestic srf operation increase effectiveness facility limit upward pressure repo market could spill federal fund market,0
97,2021-06-16,participants noted limiting acceptable securities srf operationss treasury securities could benefits including consistency regulatory distinctions treasury securities types securities potentially limiting federal reserve footprint financial markets maintaining consistency structure proposed fima repo facility overnight reverse repo on rrp facility,participant note limit acceptable security srf operations treasury security could benefit include consistency regulatory distinction treasury security type security potentially limit federal reserve footprint financial market maintain consistency structure propose fima repo facility overnight reverse repo on rrp facility,0
98,2021-06-16,several participants cautioned establishing backstop srf would not diminish importance providing sufficiently ample supply reserves ongoing basis need improve structural resiliencys treasury market,several participant caution establish backstop srf would not diminish importance provide sufficiently ample supply reserve ongoing basis need improve structural resiliency treasury market,0
99,2021-06-16,couple participants reiterated concerns converting current ongoing daily repo operations standing facility suggested ways calibrate terms facility mitigate concerns including setting relatively high minimum bid rate limiting securities eligible srf operationss treasury securities,couple participant reiterate concern convert current ongoing daily repo operation stand facility suggest way calibrate term facility mitigate concern include set relatively high minimum bid rate limit security eligible srf operations treasury security,0
100,2021-06-16,discussion considerations related design standing fima repo facility substantial majority supported broad structure discussed staff presentation,discussion consideration related design stand fima repo facility substantial majority support broad structure discuss staff presentation,0
101,2021-06-16,many participants generally saw benefits keeping rate level potential domestic srf light similar nature transactions high quality collateral,many participant generally saw benefit keep rate level potential domestic srf light similar nature transaction high quality collateral,0
102,2021-06-16,number participants remarked rate fima repo facility could set higher level domestic srf could set level comparable federal reserve dollar liquidity swap lines,number participant remark rate fima repo facility could set high level domestic srf could set level comparable federal reserve dollar liquidity swap line,0
103,2021-06-16,couple participants commented potential reputational risks establishing standing fima repo facility including associated providing liquidity standing basis wider set central banks finance ministries existing swap lines,couple participant comment potential reputational risk establish stand fima repo facility include associate provide liquidity stand basis wider set central bank finance ministry exist swap line,0
104,2021-06-16,participants reiterated importance maintaining well defined criteria participation facility suggested fomc receive regular reports operations counterparties approved standing fima repo facility,participant reiterate importance maintain well define criterion participation facility suggest fomc receive regular report operation counterparties approve stand fima repo facility,0
105,2021-06-16,participants agreed would continue discussion design parameters domestic srf standing fima repo facility,participant agree would continue discussion design parameter domestic srf stand fima repo facility,0
106,2021-06-16,chair asked staff work specific proposal reflected views expressed participants meeting,chair ask staff work specific proposal reflect view express participant meeting,0
107,2021-06-16,developments financial markets open market operations manager turned first discussion financial market developments intermeeting period,development financial market open market operation manager turn first discussion financial market development intermeeting period,0
108,2021-06-16,net us financial conditions eased further led decline treasury yields,net u financial condition ease far lead decline treasury yield,0
109,2021-06-16,lower term premiums appeared significant component declines reflected lower implied volatility longer term interest rates,low term premium appear significant component decline reflect low imply volatility longer term interest rate,0
110,2021-06-16,equities rose slightly broad dollar weakened credit spreads little changed historically tight levels,equity rise slightly broad dollar weaken credit spread little change historically tight level,0
111,2021-06-16,period market participants focused data showing lower employment growth higher inflation readings expected,period market participant focus data show low employment growth high inflation reading expect,0
112,2021-06-16,median  core personal consumption expenditures pce inflation forecast open market desk survey primary dealers jumped nearly  percentage point previous survey,median core personal consumption expenditure pce inflation forecast open market desk survey primary dealer jumped nearly percentage point previous survey,0
113,2021-06-16,however median forecasts   rose less ,however median forecast rise less,0
114,2021-06-16, percent suggesting expectations inflationary pressures subside,percent suggest expectation inflationary pressure subside,0
