,Date,Original,Corpus,Class
316,2021-06-16,participants noted overall financial conditions remained highly accommodative part reflecting stance monetary policy continued deliver appropriate support economy,participant note overall financial condition remain highly accommodative part reflect stance monetary policy continued deliver appropriate support economy,0
317,2021-06-16,several participants highlighted however low interest rates contributing elevated house prices valuation pressures housing markets might pose financial stability risks,several participant highlight however low interest rate contribute elevate house price valuation pressure housing market might pose financial stability risk,0
318,2021-06-16,discussing uncertainty risks associated economic outlook participants commented process reopening economy unprecedented likely uneven across sectors,discuss uncertainty risk associate economic outlook participant comment process reopen economy unprecedented likely uneven across sector,0
319,2021-06-16,participants judged supply chain disruptions labor shortages complicated task assessing progress toward committee goals speed factors would dissipate uncertain,participant judged supply chain disruption labor shortage complicate task assess progress toward committee goal speed factor would dissipate uncertain,0
320,2021-06-16,accordingly participants judged uncertainty around economic projections elevated,accordingly participant judged uncertainty around economic projection elevate,0
321,2021-06-16,although generally saw risks outlook economic activity broadly balanced substantial majority participants judged risks inflation projections tilted upside concerns supply disruptions labor shortages might linger longer might larger persistent effects prices wages currently assumed,although generally saw risk outlook economic activity broadly balance substantial majority participant judged risk inflation projection tilt upside concern supply disruption labor shortage might linger longer might large persistent effect price wage currently assume,0
322,2021-06-16,several participants expressed concern longer term inflation expectations might rise inappropriate levels elevated inflation readings persisted,several participant express concern longer term inflation expectation might rise inappropriate level elevate inflation reading persist,0
323,2021-06-16,several participants cautioned downside risks inflation remained temporary price pressures might unwind faster currently anticipated forces held inflation inflation expectations previous economic expansion not gone away might reinforce effect unwinding temporary price pressures,several participant caution downside risk inflation remain temporary price pressure might unwind faster currently anticipate force held inflation inflation expectation previous economic expansion not go away might reinforce effect unwind temporary price pressure,0
324,2021-06-16,consideration stance monetary policy participants reaffirmed federal reserve commitment using full range tools supports economy challenging time thereby promoting committee statutory goals maximum employment price stability,consideration stance monetary policy participant reaffirm federal reserve commitment use full range tool support economy challenge time thereby promote committee statutory goal maximum employment price stability,0
325,2021-06-16,participants generally agreed economic recovery incomplete risks economic outlook remained,participant generally agree economic recovery incomplete risk economic outlook remain,0
326,2021-06-16,although inflation risen anticipated increase seen largely reflecting temporary factors participants expected inflation decline toward committee  percent longer run objective,although inflation risen anticipate increase see largely reflect temporary factor participant expect inflation decline toward committee percent longer run objective,0
327,2021-06-16,participants judged current stance monetary policy policy guidance remained appropriate promote maximum employment well achieve inflation averages  percent time longer term inflation expectations well anchored  percent,participant judged current stance monetary policy policy guidance remain appropriate promote maximum employment well achieve inflation average percent time longer term inflation expectation well anchor percent,0
328,2021-06-16,participants also reiterated existing outcome based guidance implied paths federal funds rate balance sheet would depend actual progress toward reaching committee maximum employment inflation goals,participant also reiterate exist outcome base guidance imply path federal fund rate balance sheet would depend actual progress toward reach committee maximum employment inflation goal,0
329,2021-06-16,light incoming data implications economic outlooks participants mentioned expected economic conditions set committee forward guidance federal funds rate met somewhat earlier projected march,light incoming data implication economic outlook participant mention expect economic condition set committee forward guidance federal fund rate met somewhat earlier project march,0
330,2021-06-16,several participants emphasized however uncertainty around economic outlook elevated early draw firm conclusions paths labor market inflation,several participant emphasize however uncertainty around economic outlook elevate early draw firm conclusion path labor market inflation,0
331,2021-06-16,view heightened uncertainty regarding evolution economy also implied significant uncertainty appropriate path federal funds rate,view heighten uncertainty regard evolution economy also imply significant uncertainty appropriate path federal fund rate,0
332,2021-06-16,participants noted communications appropriate path policy would focus market participants current environment commented would important emphasize committee reaction function commitment monetary policy framework not changed,participant note communication appropriate path policy would focus market participant current environment comment would important emphasize committee reaction function commitment monetary policy framework not change,0
333,2021-06-16,participants discussed federal reserve asset purchases progress toward committee goals since last december committee adopted guidance asset purchases,participant discuss federal reserve asset purchase progress toward committee goal since last december committee adopt guidance asset purchase,0
334,2021-06-16,committee standard substantial progress generally seen not yet met though participants expected progress continue,committee standard substantial progress generally see not yet met though participant expect progress continue,0
335,2021-06-16,various participants mentioned expected conditions beginning reduce pace asset purchases met somewhat earlier anticipated previous meetings light incoming data,various participant mention expect condition begin reduce pace asset purchase met somewhat earlier anticipate previous meeting light incoming data,0
336,2021-06-16,participants saw incoming data providing less clear signal underlying economic momentum judged committee would information coming months make better assessment path labor market inflation,participant saw incoming data provide less clear signal underlie economic momentum judged committee would information come month make well assessment path labor market inflation,0
337,2021-06-16,result several participants emphasized committee patient assessing progress toward goals announcing changes plans asset purchases,result several participant emphasize committee patient assess progress toward goal announce change plan asset purchase,0
338,2021-06-16,participants generally judged that matter prudent planning important well positioned reduce pace asset purchases appropriate response unexpected economic developments including faster anticipated progress toward committee goals emergence risks could impede attainment committee goals,participant generally judged that matter prudent planning important well position reduce pace asset purchase appropriate response unexpected economic development include faster anticipate progress toward committee goal emergence risk could impede attainment committee goal,0
339,2021-06-16,various participants offered views committee agency mbs purchases,various participant offer view committee agency mb purchase,0
340,2021-06-16,several participants saw benefits reducing pace purchases quickly earlier treasury purchases light valuation pressures housing markets,several participant saw benefit reduce pace purchase quickly earlier treasury purchase light valuation pressure housing market,0
341,2021-06-16,several participants however commented reducing pace treasury mbs purchases commensurately preferable approach would well aligned committee previous communications purchases treasury securities mbs provide accommodation influence broader financial conditions,several participant however comment reduce pace treasury mb purchase commensurately preferable approach would well align committee previous communication purchase treasury security mb provide accommodation influence broader financial condition,0
342,2021-06-16,coming meetings participants agreed continue assessing economy progress toward committee goals begin discuss plans adjusting path composition asset purchases,come meeting participant agree continue assess economy progress toward committee goal begin discus plan adjust path composition asset purchase,0
343,2021-06-16,addition participants reiterated intention provide notice well advance announcement reduce pace purchases,addition participant reiterate intention provide notice well advance announcement reduce pace purchase,0
344,2021-06-16,regard implementation monetary policy participants observed downward pressure money market rates intermeeting period viewed possibility downward pressure rates near term likely,regard implementation monetary policy participant observe downward pressure money market rate intermeeting period view possibility downward pressure rate near term likely,0
345,2021-06-16,consequently noted adjustment federal reserve administered rates would help keep federal funds rate well within target range support smooth market functioning short term funding markets,consequently note adjustment federal reserve administer rate would help keep federal fund rate well within target range support smooth market function short term funding market,0
346,2021-06-16,participants agreed technical adjustment no bearing appropriate path federal funds rate stance monetary policy,participant agree technical adjustment no bearing appropriate path federal fund rate stance monetary policy,0
347,2021-06-16,committee policy action discussion monetary policy meeting members agreed progress vaccinations reduced spread covid  united states,committee policy action discussion monetary policy meeting member agree progress vaccination reduce spread covid united state,0
348,2021-06-16,noted amid progress strong policy support indicators economic activity employment strengthened,note amid progress strong policy support indicator economic activity employment strengthen,0
349,2021-06-16,although sectors adversely affected pandemic remained weak shown improvement,although sector adversely affected pandemic remain weak show improvement,0
350,2021-06-16,inflation risen largely reflecting transitory factors,inflation risen largely reflect transitory factor,0
351,2021-06-16,overall financial conditions remained accommodative part reflecting policy measures support economy flow credits households businesses,overall financial condition remain accommodative part reflect policy measure support economy flow credit household business,0
352,2021-06-16,members also agreed path economy would depend significantly course virus,member also agree path economy would depend significantly course virus,0
353,2021-06-16,progress vaccinations would likely continue reduce effects public health crisis economy risks economic outlook remained,progress vaccination would likely continue reduce effect public health crisis economy risk economic outlook remain,0
354,2021-06-16,members agreed federal reserve committed using full range tools supports economy challenging time thereby promoting maximum employment price stability goals,member agree federal reserve commit use full range tool support economy challenge time thereby promote maximum employment price stability goal,0
355,2021-06-16,members reaffirmed that accordance committee goals achieve maximum employment inflation rate  percent longer run inflation run persistently longer run goal would aim achieve inflation moderately  percent time inflation averages  percent time longer term inflation expectations remain well anchored  percent,member reaffirm that accordance committee goal achieve maximum employment inflation rate percent longer run inflation run persistently longer run goal would aim achieve inflation moderately percent time inflation average percent time longer term inflation expectation remain well anchor percent,0
356,2021-06-16,members expected maintain accommodative stance monetary policy outcomes achieved,member expect maintain accommodative stance monetary policy outcome achieve,0
357,2021-06-16,members agreed keep target range federal funds rate   percent expected would appropriate maintain target range labor market conditions reached levels consistent committee assessments maximum employment inflation risen  percent track moderately exceed  percent time,member agree keep target range federal fund rate percent expect would appropriate maintain target range labor market condition reach level consistent committee assessment maximum employment inflation risen percent track moderately exceed percent time,0
358,2021-06-16,addition members agreed would appropriate federal reserve continue increase holdings treasury securities least  billion per month agency mbs least  billion per month substantial progress made toward committee maximum employment price stability goals,addition member agree would appropriate federal reserve continue increase holding treasury security least billion per month agency mb least billion per month substantial progress make toward committee maximum employment price stability goal,0
359,2021-06-16,judged asset purchases would help foster smooth market functioning accommodative financial conditions thereby supporting flow credit households businesses,judged asset purchase would help foster smooth market function accommodative financial condition thereby support flow credit household business,0
360,2021-06-16,members agreed that assessing appropriate stance monetary policy would continue monitor implications incoming information economic outlook would prepared adjust stance monetary policy appropriate event risks emerged could impede attainment committee goals,member agree that assess appropriate stance monetary policy would continue monitor implication incoming information economic outlook would prepared adjust stance monetary policy appropriate event risk emerge could impede attainment committee goal,0
361,2021-06-16,members also concurred that assessing appropriate stance monetary policy would take account wide range information including readings public health labor market conditions inflation pressures inflation expectations financial international developments,member also concur that assess appropriate stance monetary policy would take account wide range information include reading public health labor market condition inflation pressure inflation expectation financial international development,0
362,2021-06-16,members judged economic outlook continued improve negative effects pandemic economy likely occurred,member judged economic outlook continued improve negative effect pandemic economy likely occur,0
363,2021-06-16,result agreed remove references fomc statement noted virus causing tremendous human economic hardship the ongoing public health crisis continues weigh economy,result agree remove reference fomc statement note virus cause tremendous human economic hardship the ongoing public health crisis continue weigh economy,0
364,2021-06-16,instead agreed say progress vaccinations reduced spread covid  would likely continue reduce negative economic effects public health crisis,instead agree say progress vaccination reduce spread covid would likely continue reduce negative economic effect public health crisis,0
365,2021-06-16,conclusion discussion committee voted authorize direct federal reserve bank new york instructed otherwise execute transactions soma accordance following domestic policy directive release,conclusion discussion committee vote authorize direct federal reserve bank new york instruct otherwise execute transaction soma accordance follow domestic policy directive release,0
366,2021-06-16,effective june   federal open market committee directs desk to,effective june federal open market committee directs desk to,0
367,2021-06-16,vote also encompassed approval statement release,vote also encompass approval statement release,0
368,2021-06-16,the federal reserve committed using full range tools supports economy challenging time thereby promoting maximum employment price stability goals,the federal reserve commit use full range tool support economy challenge time thereby promote maximum employment price stability goal,0
369,2021-06-16,progress vaccinations reduced spread covid  united states,progress vaccination reduce spread covid united state,0
370,2021-06-16,amid progress strong policy support indicators economic activity employment strengthened,amid progress strong policy support indicator economic activity employment strengthen,0
371,2021-06-16,sectors adversely affected pandemic remain weak shown improvement,sector adversely affected pandemic remain weak show improvement,0
372,2021-06-16,inflation risen largely reflecting transitory factors,inflation risen largely reflect transitory factor,0
373,2021-06-16,overall financial conditions remain accommodative part reflecting policy measures support economy flow credits households businesses,overall financial condition remain accommodative part reflect policy measure support economy flow credit household business,0
374,2021-06-16,path economy depend significantly course virus,path economy depend significantly course virus,0
375,2021-06-16,progress vaccinations likely continue reduce effects public health crisis economy risks economic outlook remain,progress vaccination likely continue reduce effect public health crisis economy risk economic outlook remain,0
376,2021-06-16,committee seeks achieve maximum employment inflation rate  percent longer run,committee seek achieve maximum employment inflation rate percent longer run,0
377,2021-06-16,inflation run persistently longer run goal committee aim achieve inflation moderately  percent time inflation averages  percent time longerterm inflation expectations remain well anchored  percent,inflation run persistently longer run goal committee aim achieve inflation moderately percent time inflation average percent time longerterm inflation expectation remain well anchor percent,0
378,2021-06-16,committee expects maintain accommodative stance monetary policy outcomes achieved,committee expect maintain accommodative stance monetary policy outcome achieve,0
379,2021-06-16,committee decided keep target range federal funds rate   percent expects appropriate maintain target range labor market conditions reached levels consistent committee assessments maximum employment inflation risen  percent track moderately exceed  percent time,committee decide keep target range federal fund rate percent expect appropriate maintain target range labor market condition reach level consistent committee assessment maximum employment inflation risen percent track moderately exceed percent time,0
380,2021-06-16,addition federal reserve continue increase holdings treasury securities least  billion per month agency mortgagebacked securities least  billion per month substantial progress made toward committee maximum employment price stability goals,addition federal reserve continue increase holding treasury security least billion per month agency mortgagebacked security least billion per month substantial progress make toward committee maximum employment price stability goal,0
381,2021-06-16,asset purchases help foster smooth market functioning accommodative financial conditions thereby supporting flow credit households businesses,asset purchase help foster smooth market function accommodative financial condition thereby support flow credit household business,0
382,2021-06-16,assessing appropriate stance monetary policy committee continue monitor implications incoming information economic outlook,assess appropriate stance monetary policy committee continue monitor implication incoming information economic outlook,0
383,2021-06-16,committee would prepared adjust stance monetary policy appropriate risks emerge could impede attainment committee goals,committee would prepared adjust stance monetary policy appropriate risk emerge could impede attainment committee goal,0
384,2021-06-16,committee assessments take account wide range information including readings public health labor market conditions inflation pressures inflation expectations financial international developments,committee assessment take account wide range information include reading public health labor market condition inflation pressure inflation expectation financial international development,0
385,2021-06-16,voting action jerome powell john williams thomas barkin raphael bostic michelle bowman lael brainard richard clarida mary daly charles evans randal quarles christopher waller,voting action jerome powell john williams thomas barkin raphael bostic michelle bowman lael brainard richard clarida mary daly charles evans randal quarles christopher waller,0
386,2021-06-16,voting action none,voting action none,0
387,2021-06-16,consistent committee decision leave target range federal funds rate unchanged board governors voted unanimously raise interest rates required excess reserve balances ,consistent committee decision leave target range federal fund rate unchanged board governor vote unanimously raise interest rate require excess reserve balance,0
388,2021-06-16, percent,percent,0
389,2021-06-16,setting interest rate paid required excess reserve balances  basis points bottom target range federal funds rate intended foster trading federal funds market rates well within federal open market committee target range support smooth functioning short term funding markets,set interest rate paid require excess reserve balance basis point bottom target range federal fund rate intend foster trading federal fund market rate well within federal open market committee target range support smooth function short term funding market,0
390,2021-06-16,board governors also voted unanimously approve establishment primary credit rate existing level ,board governor also vote unanimously approve establishment primary credit rate exist level,0
391,2021-06-16, percent effective june  ,percent effective june,0
392,2021-06-16,agreed next meeting committee would held tuesdaywednesday july  ,agree next meeting committee would held tuesdaywednesday july,0
393,2021-06-16,meeting adjourned june  ,meeting adjourn june,0
394,2021-06-16,notation vote notation vote completed may   committee unanimously approved minutes committee meeting held april  ,notation vote notation vote complete may committee unanimously approve minute committee meeting held april,0
395,2021-06-16, james clouse secretary,james clouse secretary,0
396,2021-06-16,federal open market committee referenced fomc committee minutes,federal open market committee reference fomc committee minute,0
397,2021-06-16,return text,return text,0
398,2021-06-16,attended discussion developments financial markets open market operations,attend discussion development financial market open market operation,0
399,2021-06-16,return text,return text,0
400,2021-06-16,attended discussion economic developments outlook,attend discussion economic development outlook,0
401,2021-06-16,return text,return text,0
402,2021-06-16,board governors federal reserve system,board governor federal reserve system,0
